ticker,event_date,window_start,window_end,symbol,symbols,publishedDate,publishedDateET,date_et,title,text,site,url,image
WMT,2023-08-17,2023-08-03,2023-08-31,WMT,,2023-08-04 15:35:57,2023-08-04T15:35:57-04:00,2023-08-04,3 of the Safest Dividend Kings,"Income investors should focus on stocks that pay solid yields but also those that have sustainable payouts and strong business models. The Dividend Kings are an excellent place to look for stocks with sustainable dividends, as they have raised their dividends each year for more than 50 consecutive years.",investorplace.com,https://investorplace.com/2023/08/3-of-the-safest-dividend-kings/,https://images.financialmodelingprep.com/news/3-of-the-safest-dividend-kings-20230804.jpg
WMT,2023-08-17,2023-08-03,2023-08-31,WMT,,2023-08-04 14:50:00,2023-08-04T14:50:00-04:00,2023-08-04,"These retailers are enjoying foot-traffic wins, research says","Target Corp., Walmart Inc. and Costco Wholesale Corp. are set to report earnings over the coming weeks, providing insight into the consumer spending landscape.",marketwatch.com,https://www.marketwatch.com/story/these-retailers-are-enjoying-foot-traffic-wins-research-says-158188ec,https://images.financialmodelingprep.com/news/these-retailers-are-enjoying-foottraffic-wins-research-says-20230804.jpg
WMT,2023-08-17,2023-08-03,2023-08-31,WMT,,2023-08-07 11:54:14,2023-08-07T11:54:14-04:00,2023-08-07,Walmart Stock: Not Filling My Basket Here,"Walmart Inc. shares have recovered and are trading near all-time highs after a setback in 2022 due to pandemic-related trends and inflation concerns. The company has posted solid financial performance, with margin expansion and increased earnings per share. Walmart has set ambitious targets for sales growth and operating margins, but earnings multiples remain high, raising caution for investors.",seekingalpha.com,https://seekingalpha.com/article/4624930-walmart-stock-not-filling-my-basket-here,https://images.financialmodelingprep.com/news/walmart-stock-not-filling-my-basket-here-20230807.jpg
WMT,2023-08-17,2023-08-03,2023-08-31,WMT,,2023-08-08 11:26:17,2023-08-08T11:26:17-04:00,2023-08-08,There's Still Hope for Target,"Target Corp. ( TGT , Financial) is an incredible business and one of the top big-box retailers in the United States. However, when I first wrote about the company back in January of 2017, it was in a much different position.",gurufocus.com,https://www.gurufocus.com/news/2059318/theres-still-hope-for-target,https://images.financialmodelingprep.com/news/theres-still-hope-for-target-20230808.jpg
WMT,2023-08-17,2023-08-03,2023-08-31,WMT,,2023-08-09 07:24:00,2023-08-09T07:24:00-04:00,2023-08-09,Walmart price target raised to $175 by BMO,"BMO Capital Markets raised its Walmart Inc. WMT, +0.10% price target to $175 from $170 Wednesday ahead of the retail giant's second-quarter results on Aug. 17. BMO is expecting upside from Walmart, according to analyst Kelly Bania.",marketwatch.com,https://www.marketwatch.com/story/walmart-price-target-raised-to-175-by-bmo-4040cc87,https://images.financialmodelingprep.com/news/walmart-price-target-raised-to-175-by-bmo-20230809.jpg
WMT,2023-08-17,2023-08-03,2023-08-31,WMT,,2023-08-09 07:23:00,2023-08-09T07:23:00-04:00,2023-08-09,Walmart price target gets boosted by $5 to $175 at Wells Fargo,"Wells Fargo & Co. analysts on Wednesday hiked their price target for Walmart Inc. WMT, +0.10% to $175 from $170 a share on expectations that the retail giant will beat Wall Street estimates when it reports second-quarter results next week. “WMT seemed somewhat cautious on the macro in our recent meetings, but the company-specific tone was notably positive,” said analyst Edward Kelly.",marketwatch.com,https://www.marketwatch.com/story/walmart-price-target-gets-boosted-by-5-to-175-at-wells-fargo-d792150f,https://images.financialmodelingprep.com/news/walmart-price-target-gets-boosted-by-5-to-175-at-20230809.jpg
WMT,2023-08-17,2023-08-03,2023-08-31,WMT,,2023-08-10 15:19:35,2023-08-10T15:19:35-04:00,2023-08-10,Financial Market Outlook: August 2023,"The global economic environment is in the midst of a structural shift as most regional economic cycles are within their troughs. This leads to adjustments in the outlook for factors such as inflation, risk premiums and general asset valuations.",gurufocus.com,https://www.gurufocus.com/news/2062606/financial-market-outlook-august-2023,https://images.financialmodelingprep.com/news/financial-market-outlook-august-2023-20230810.jpg
WMT,2023-08-17,2023-08-03,2023-08-31,WMT,,2023-08-10 13:45:45,2023-08-10T13:45:45-04:00,2023-08-10,Will Walmart (WMT) Beat Estimates Again in Its Next Earnings Report?,Walmart (WMT) has an impressive earnings surprise history and currently possesses the right combination of the two key ingredients for a likely beat in its next quarterly report.,zacks.com,https://www.zacks.com/stock/news/2135262/will-walmart-wmt-beat-estimates-again-in-its-next-earnings-report,https://images.financialmodelingprep.com/news/will-walmart-wmt-beat-estimates-again-in-its-next-20230810.jpg
WMT,2023-08-17,2023-08-03,2023-08-31,WMT,,2023-08-10 11:30:22,2023-08-10T11:30:22-04:00,2023-08-10,Walmart (WMT) Expected to Beat Earnings Estimates: Can the Stock Move Higher?,Walmart (WMT) possesses the right combination of the two key ingredients for a likely earnings beat in its upcoming report. Get prepared with the key expectations.,zacks.com,https://www.zacks.com/stock/news/2135108/walmart-wmt-expected-to-beat-earnings-estimates-can-the-stock-move-higher,https://images.financialmodelingprep.com/news/walmart-wmt-expected-to-beat-earnings-estimates-can-the-20230810.jpg
WMT,2023-08-17,2023-08-03,2023-08-31,WMT,,2023-08-10 10:00:52,2023-08-10T10:00:52-04:00,2023-08-10,5 Dividend Growth Stocks for Safe and Stable Returns,"Caterpillar (CAT), Walmart (WMT), KB Home (KBH), Progress Software (PRGS) and Dr. Reddy's (RDY) could be solid choices for your portfolio.",zacks.com,https://www.zacks.com/stock/news/2134858/5-dividend-growth-stocks-for-safe-and-stable-returns,https://images.financialmodelingprep.com/news/5-dividend-growth-stocks-for-safe-and-stable-returns-20230810.jpg
WMT,2023-08-17,2023-08-03,2023-08-31,WMT,,2023-08-10 09:15:17,2023-08-10T09:15:17-04:00,2023-08-10,Top 5 Stocks Set to Beat on Earnings Next Week,"We have narrowed our search to five stocks that are set to declare earnings results next week. These are: LEGN, TJX, WMT, ONON, BILL.",zacks.com,https://www.zacks.com/stock/news/2134930/top-5-stocks-set-to-beat-on-earnings-next-week,https://images.financialmodelingprep.com/news/top-5-stocks-set-to-beat-on-earnings-next-20230810.jpg
WMT,2023-08-17,2023-08-03,2023-08-31,WMT,,2023-08-10 08:30:00,2023-08-10T08:30:00-04:00,2023-08-10,"Walmart To Host Second Quarter Earnings Conference Call Aug. 17, 2023","BENTONVILLE, Ark.--(BUSINESS WIRE)--Walmart Inc. (NYSE: WMT) today announced it will hold a live conference call with the Investment Community at 7 a.m. CDT Thursday, Aug. 17, 2023, to discuss the company's second quarter earnings results for fiscal year 2024. Doug McMillon, president and chief executive officer, and John David Rainey, executive vice president and chief financial officer, will host the call to discuss the results and answer questions. The event will be webcast live and is acces.",businesswire.com,https://www.businesswire.com/news/home/20230810981835/en/Walmart-To-Host-Second-Quarter-Earnings-Conference-Call-Aug.-17-2023/,https://images.financialmodelingprep.com/news/walmart-to-host-second-quarter-earnings-conference-call-aug-20230810.jpg
WMT,2023-08-17,2023-08-03,2023-08-31,WMT,,2023-08-11 19:03:11,2023-08-11T19:03:11-04:00,2023-08-11,Retail Earnings Looming: What to Expect,"Walmart WMT and Target TGT shares lost roughly a quarter of their value in response to the disappointing April-quarter results on May 17th and 18th, 2022.",zacks.com,https://www.zacks.com/commentary/2135930/retail-earnings-looming-what-to-expect,https://images.financialmodelingprep.com/news/retail-earnings-looming-what-to-expect-20230811.jpg
WMT,2023-08-17,2023-08-03,2023-08-31,WMT,,2023-08-11 18:05:58,2023-08-11T18:05:58-04:00,2023-08-11,"Stock Market Action Plan: Walmart, Target, Home Depot Lead Crucial Week For Retail","The stock market remains under pressure heading into an important week for retail earnings. Walmart, Target and Home Depot all report.",investors.com,https://www.investors.com/research/investing-action-plan/stock-market-action-plan-walmart-target-home-depot-lead-crucial-week-for-retail/,https://images.financialmodelingprep.com/news/stock-market-action-plan-walmart-target-home-depot-lead-20230811.jpg
WMT,2023-08-17,2023-08-03,2023-08-31,WMT,,2023-08-11 14:35:00,2023-08-11T14:35:00-04:00,2023-08-11,"Walmart's stock stock rises toward its 4th record close this month, a week ahead of earnings","Shares of Walmart Inc. WMT, +0.80% rose 0.7% in afternoon trading Friday, to put them on track for a record close. The discount retail giant's stock was headed for the fourth record close in the nine trading sessions so far in August.",marketwatch.com,https://www.marketwatch.com/story/walmarts-stock-stock-rises-toward-its-4th-record-close-this-month-a-week-ahead-of-earnings-d3e60d98,https://images.financialmodelingprep.com/news/walmarts-stock-stock-rises-toward-its-4th-record-close-20230811.jpg
WMT,2023-08-17,2023-08-03,2023-08-31,WMT,,2023-08-11 10:51:13,2023-08-11T10:51:13-04:00,2023-08-11,"Walmart Stock Holds Near All-Time High Ahead Of Earnings; High-Flying On Holding, Cava Group Set To Report",Walmart stock headlines a busy week of earnings in the retail sector. On Holding and Cava Group are also on the earnings calendar.,investors.com,https://www.investors.com/research/earnings-preview/walmart-stock-holds-near-all-time-high-ahead-of-earnings-high-flying-on-holding-cava-group-set-to-report/,https://images.financialmodelingprep.com/news/walmart-stock-holds-near-alltime-high-ahead-of-earnings-20230811.jpg
WMT,2023-08-17,2023-08-03,2023-08-31,WMT,,2023-08-11 09:52:29,2023-08-11T09:52:29-04:00,2023-08-11,Walmart Stock Climbs After Pre-Earnings Bull Note,Credit Suisse this morning raised its price target on Walmart Inc (NYSE:WMT) to $180 from $170.,schaeffersresearch.com,https://www.schaeffersresearch.com/content/news/2023/08/11/walmart-stock-climbs-after-pre-earnings-bull-note,https://images.financialmodelingprep.com/news/walmart-stock-climbs-after-preearnings-bull-note-20230811.jpg
WMT,2023-08-17,2023-08-03,2023-08-31,WMT,,2023-08-11 09:38:31,2023-08-11T09:38:31-04:00,2023-08-11,This Analyst Says to Buy Walmart (WMT) Stock Ahead of Earnings,Walmart (NYSE: WMT ) stock is worth picking up ahead of the retail giant's earnings report if one analyst is to be believed. Credit Suisse analyst Karen Short is behind this news and it comes with a new earnings per share estimate.,investorplace.com,https://investorplace.com/2023/08/this-analyst-says-to-buy-walmart-wmt-stock-ahead-of-earnings/,https://images.financialmodelingprep.com/news/this-analyst-says-to-buy-walmart-wmt-stock-ahead-20230811.jpg
WMT,2023-08-17,2023-08-03,2023-08-31,WMT,,2023-08-12 13:49:35,2023-08-12T13:49:35-04:00,2023-08-12,5 Best Stocks to Buy in a Bear Market,"In the ever-fluctuating stock market landscape, navigating bear markets can be a nerve-wracking experience for even the most seasoned investors. When stock prices plunge and economic clouds gather, it's natural to question whether investing during such turbulent times is wise.",marketbeat.com,https://www.marketbeat.com/originals/5-best-stocks-to-buy-in-a-bear-market/?utm_source=snapi,https://images.financialmodelingprep.com/news/5-best-stocks-to-buy-in-a-bear-market-20230812.jpg
WMT,2023-08-17,2023-08-03,2023-08-31,WMT,,2023-08-13 13:00:55,2023-08-13T13:00:55-04:00,2023-08-13,3 Income-Generating Stocks for a Worry-Free Retirement,"During this ongoing uncertainty, finding income-generating stocks for retirement has become a complex puzzle. Investors seek reliable avenues to ensure a worry-free retirement as the golden year approach.",investorplace.com,https://investorplace.com/2023/08/3-income-generating-stocks-for-a-worry-free-retirement/,https://images.financialmodelingprep.com/news/3-incomegenerating-stocks-for-a-worryfree-retirement-20230813.jpg
WMT,2023-08-17,2023-08-03,2023-08-31,WMT,,2023-08-13 11:00:33,2023-08-13T11:00:33-04:00,2023-08-13,"Are Walmart's 5,200 Stores Enough?","Walmart has over 10,000 locations worldwide. Over 5,200 are in the US.",247wallst.com,https://247wallst.com/retail/2023/08/13/are-walmarts-5200-stores-enough/,https://images.financialmodelingprep.com/news/are-walmarts-5200-stores-enough-20230813.jpg
WMT,2023-08-17,2023-08-03,2023-08-31,WMT,,2023-08-13 10:01:00,2023-08-13T10:01:00-04:00,2023-08-13,"Recession worries are fading. When Walmart and Target report, we'll see how shoppers feel about that","The Federal Reserve no longer thinks a recession is going to happen, but it still expects an economic “slowdown.” Mastercard Inc. MA, -0.54% last month said consumer spending was “resilient,” while Visa Inc. V, -0.05% said it was “stable.",marketwatch.com,https://www.marketwatch.com/story/recession-worries-are-fading-when-walmart-and-target-report-well-see-how-shoppers-feel-about-that-f64978c2,https://images.financialmodelingprep.com/news/recession-worries-are-fading-when-walmart-and-target-report-20230813.jpg
WMT,2023-08-17,2023-08-03,2023-08-31,WMT,,2023-08-13 09:15:37,2023-08-13T09:15:37-04:00,2023-08-13,"Amazon To Cut Back On Private Labels, While Walmart And Other Retailers Thrive",Customers opt for pricing over brand names but Amazon's scaling back its private label operations even as other retailers such as Walmart and Costco continue to derive value.,investopedia.com,https://www.investopedia.com/amazon-cuts-back-on-private-labels-7642551,https://images.financialmodelingprep.com/news/amazon-to-cut-back-on-private-labels-while-walmart-20230813.jpg
WMT,2023-08-17,2023-08-03,2023-08-31,WMT,,2023-08-13 07:05:52,2023-08-13T07:05:52-04:00,2023-08-13,"Home Depot, Target and Walmart earnings; retail sales, oil inventories in week ahead","Retailers Home Depot, Target and Walmart will headline the companies slated to report quarterly results this week. Mortgage applications data will also be released.",foxbusiness.com,https://www.foxbusiness.com/markets/home-depot-target-walmart-earnings-retail-sales-oil-inventories-week-ahead,https://images.financialmodelingprep.com/news/home-depot-target-and-walmart-earnings-retail-sales-oil-20230813.jpg
WMT,2023-08-17,2023-08-03,2023-08-31,WMT,,2023-08-14 16:54:04,2023-08-14T16:54:04-04:00,2023-08-14,Time to Buy Stock in These Retail Giants as Earnings Approach?,"In a week led by quarterly results from large retailers, Home Depot (HD) and Walmart (WMT) will be two companies to watch.",zacks.com,https://www.zacks.com/stock/news/2136347/time-to-buy-stock-in-these-retail-giants-as-earnings-approach,https://images.financialmodelingprep.com/news/time-to-buy-stock-in-these-retail-giants-as-20230814.jpg
WMT,2023-08-17,2023-08-03,2023-08-31,WMT,,2023-08-14 12:24:05,2023-08-14T12:24:05-04:00,2023-08-14,Factors to Note Before Walmart's (WMT) Q2 Earnings Results,Walmart's (WMT) fiscal second-quarter performance is likely to reflect gains from constant expansion efforts and splendid e-commerce business.,zacks.com,https://www.zacks.com/stock/news/2136296/factors-to-note-before-walmart-s-wmt-q2-earnings-results,https://images.financialmodelingprep.com/news/factors-to-note-before-walmarts-wmt-q2-earnings-results-20230814.jpg
WMT,2023-08-17,2023-08-03,2023-08-31,WMT,,2023-08-14 11:39:06,2023-08-14T11:39:06-04:00,2023-08-14,Dog Days of the Market: Taking It Slow This Morning,Pre-market futures were in the green but have slid into the red roughly an hour before today's opening bell.,zacks.com,https://www.zacks.com/stock/news/2136217/dog-days-of-the-market-taking-it-slow-this-morning,https://images.financialmodelingprep.com/news/dog-days-of-the-market-taking-it-slow-this-20230814.jpg
WMT,2023-08-17,2023-08-03,2023-08-31,WMT,,2023-08-14 10:09:19,2023-08-14T10:09:19-04:00,2023-08-14,Why Walmart (WMT) Might Surprise This Earnings Season,Walmart (WMT) is seeing favorable earnings estimate revision activity and has a positive Zacks Earnings ESP heading into earnings season.,zacks.com,https://www.zacks.com/stock/news/2136161/why-walmart-wmt-might-surprise-this-earnings-season,https://images.financialmodelingprep.com/news/why-walmart-wmt-might-surprise-this-earnings-season-20230814.jpg
WMT,2023-08-17,2023-08-03,2023-08-31,WMT,,2023-08-14 09:01:21,2023-08-14T09:01:21-04:00,2023-08-14,"Home Depot, Target And Walmart Report Earnings In A Retail Heavy Week","Those losses come despite a better than expected earning cycle thus far, though this week will bear watching for signs retail spending.",forbes.com,https://www.forbes.com/sites/jjkinahan/2023/08/14/home-depot-target-and-walmart-report-earnings-in-a-retail-heavy-week/,https://images.financialmodelingprep.com/news/home-depot-target-and-walmart-report-earnings-in-a-20230814.jpg
WMT,2023-08-17,2023-08-03,2023-08-31,WMT,,2023-08-14 08:09:17,2023-08-14T08:09:17-04:00,2023-08-14,Smart Investors Are Watching These 3 Dow Stocks Right Now,"The Dow is closing in on record highs. Earnings from Home Depot, Cisco Systems, and Walmart could provide more upward momentum.",fool.com,https://www.fool.com/investing/2023/08/14/smart-investors-are-watching-these-3-dow-stocks-ri/,https://images.financialmodelingprep.com/news/smart-investors-are-watching-these-3-dow-stocks-right-20230814.jpg
WMT,2023-08-17,2023-08-03,2023-08-31,WMT,,2023-08-15 21:48:28,2023-08-15T21:48:28-04:00,2023-08-15,Surprise! 3 (Non-Tech) Stocks That May Get a Big AI Boost.,"While technology firms have been flying on the promise of artificial intelligence, investors may want to consider “analog” AI stocks; that is, the best stocks to buy that don't natively align with a core tech product or service. Of course, this concept begs the question, why the heck would you want to do something like that?",investorplace.com,https://investorplace.com/2023/08/surprise-3-non-tech-stocks-that-may-get-a-big-ai-boost/,https://images.financialmodelingprep.com/news/surprise-3-nontech-stocks-that-may-get-a-big-20230815.jpg
WMT,2023-08-17,2023-08-03,2023-08-31,WMT,,2023-08-15 14:41:39,2023-08-15T14:41:39-04:00,2023-08-15,"Walmart Inc. (WMT) Hit a 52 Week High, Can the Run Continue?","Walmart (WMT) is at a 52-week high, but can investors hope for more gains in the future? We take a look at the company's fundamentals for clues.",zacks.com,https://www.zacks.com/stock/news/2136520/walmart-inc-wmt-hit-a-52-week-high-can-the-run-continue,https://images.financialmodelingprep.com/news/walmart-inc-wmt-hit-a-52-week-high-can-20230815.jpg
WMT,2023-08-17,2023-08-03,2023-08-31,WMT,,2023-08-15 14:41:15,2023-08-15T14:41:15-04:00,2023-08-15,Brokers Suggest Investing in Walmart (WMT): Read This Before Placing a Bet,"When deciding whether to buy, sell, or hold a stock, investors often rely on analyst recommendations. Media reports about rating changes by these brokerage-firm-employed (or sell-side) analysts often influence a stock's price, but are they really important?",zacks.com,https://www.zacks.com/stock/news/2136522/brokers-suggest-investing-in-walmart-wmt-read-this-before-placing-a-bet,https://images.financialmodelingprep.com/news/brokers-suggest-investing-in-walmart-wmt-read-this-before-20230815.jpg
WMT,2023-08-17,2023-08-03,2023-08-31,WMT,,2023-08-15 14:41:12,2023-08-15T14:41:12-04:00,2023-08-15,"Walmart Stock: Dow Jones Giant, Target Face Widely Divergent Earnings Expectations",Walmart stock is hitting new highs ahead of earnings Thursday. Target and TJX report Wednesday after retail spending beat forecasts for July.,investors.com,https://www.investors.com/news/walmart-stock-dow-jones-giant-target-face-widely-divergent-earnings-expectations/,https://images.financialmodelingprep.com/news/walmart-stock-dow-jones-giant-target-face-widely-divergent-20230815.jpg
WMT,2023-08-17,2023-08-03,2023-08-31,WMT,,2023-08-15 11:13:41,2023-08-15T11:13:41-04:00,2023-08-15,"Earnings Previews: Tapestry, Walmart","After U.S. markets closed on Monday, Canoo reported no revenue, as expected, and a narrower-than-expected adjusted loss per share of $0.14.",247wallst.com,https://247wallst.com/investing/2023/08/15/earnings-previews-tapestry-walmart/,https://images.financialmodelingprep.com/news/earnings-previews-tapestry-walmart-20230815.jpg
WMT,2023-08-17,2023-08-03,2023-08-31,WMT,,2023-08-15 10:39:00,2023-08-15T10:39:00-04:00,2023-08-15,"Vroom, Vroom! Walmart+ Members to Receive Accelerated Savings on Fuel","BENTONVILLE, Ark.--(BUSINESS WIRE)--Walmart+ is helping steer members toward some serious savings on fuel, just in time for the busy travel holiday weekend. The retailer is joining forces with Exxon Mobil to double the discount Walmart+ members currently receive at Exxon and Mobil stations nationwide, from 10 cents to 20 cents off every gallon of gas. The 2x discount will begin August 15 at about 12,000 participating stations and will continue to pump savings into members' wallets through Septe.",businesswire.com,https://www.businesswire.com/news/home/20230815961572/en/Vroom-Vroom%21-Walmart-Members-to-Receive-Accelerated-Savings-on-Fuel/,https://images.financialmodelingprep.com/news/vroom-vroom-walmart-members-to-receive-accelerated-savings-on-20230815.jpg
WMT,2023-08-17,2023-08-03,2023-08-31,WMT,,2023-08-15 08:05:00,2023-08-15T08:05:00-04:00,2023-08-15,Insider Buys: 3 REITs With $1+ Million Investments,REITs are currently undervalued. And insiders are buying millions worth of shares. I highlight three REITs with significant insider purchases.,seekingalpha.com,https://seekingalpha.com/article/4628194-insider-buys-3-reits-with-1-plus-million-investments,https://images.financialmodelingprep.com/news/insider-buys-3-reits-with-1-million-investments-20230815.jpg
WMT,2023-08-17,2023-08-03,2023-08-31,WMT,,2023-08-15 05:31:00,2023-08-15T05:31:00-04:00,2023-08-15,1 Spectacular Stock to Buy at a Massive Discount and 1 to Pass On,"Dollar General's business has struggled as consumers pull back. Meanwhile, Walmart has benefited as a haven for cost-conscious shoppers.",fool.com,https://www.fool.com/investing/2023/08/15/1-spectacular-stock-to-buy-at-massive-discount-and/,https://images.financialmodelingprep.com/news/1-spectacular-stock-to-buy-at-a-massive-discount-20230815.jpg
WMT,2023-08-17,2023-08-03,2023-08-31,WMT,,2023-08-16 20:00:20,2023-08-16T20:00:20-04:00,2023-08-16,Q2 Earnings Confirm Improving Growth Trends,We see the above-average Q2 EPS beats percentage as reflective of a favorable turn in underlying earnings trends.,zacks.com,https://www.zacks.com/commentary/2137237/q2-earnings-confirm-improving-growth-trends,https://images.financialmodelingprep.com/news/q2-earnings-confirm-improving-growth-trends-20230816.jpg
WMT,2023-08-17,2023-08-03,2023-08-31,WMT,,2023-08-16 20:00:08,2023-08-16T20:00:08-04:00,2023-08-16,Q2 Earnings Confirm Improving Growth Trends,We see the above-average Q2 EPS beats percentage as reflective of a favorable turn in underlying earnings trends.,zacks.com,https://www.zacks.com/commentary/2137232/q2-earnings-confirm-improving-growth-trends,https://images.financialmodelingprep.com/news/q2-earnings-confirm-improving-growth-trends-20230816.jpg
WMT,2023-08-17,2023-08-03,2023-08-31,WMT,,2023-08-16 19:15:12,2023-08-16T19:15:12-04:00,2023-08-16,Markets Tack Down Again; CSCO Beats in Q4 (as Usual),"Markets are clearly reversing the exuberance they had been expressing for much of this summer, down again for the regular trading session this Hump Day. The Dow lost another -155 points, -0.45%, while the Nasdaq was down -154 points, -1.14%.",zacks.com,https://www.zacks.com/stock/news/2137223/markets-tack-down-again-csco-beats-in-q4-as-usual,https://images.financialmodelingprep.com/news/markets-tack-down-again-csco-beats-in-q4-as-20230816.jpg
WMT,2023-08-17,2023-08-03,2023-08-31,WMT,,2023-08-16 19:10:00,2023-08-16T19:10:00-04:00,2023-08-16,"Walmart says Judith McKenna, CEO of Walmart International, to retire after nearly 30 years","Walmart Inc. WMT on Wednesday said that Judith McKenna, president and chief executive of Walmart International, has decided to retire after 27 years at the big-box retailer. Starting on Sept.",marketwatch.com,https://www.marketwatch.com/story/walmart-says-judith-mckenna-ceo-of-walmart-international-to-retire-after-nearly-30-years-964ea73d,https://images.financialmodelingprep.com/news/walmart-says-judith-mckenna-ceo-of-walmart-international-to-20230816.jpeg
WMT,2023-08-17,2023-08-03,2023-08-31,WMT,,2023-08-16 14:44:22,2023-08-16T14:44:22-04:00,2023-08-16,ETF Areas & Stocks to Win on Upbeat July Retail Sales,"Retail sales in the United States gained 0.7% sequentially in July of 2023, marking a fourth successive rise.",zacks.com,https://www.zacks.com/stock/news/2137167/etf-areas-stocks-to-win-on-upbeat-july-retail-sales,https://images.financialmodelingprep.com/news/etf-areas-stocks-to-win-on-upbeat-july-retail-20230816.jpg
WMT,2023-08-17,2023-08-03,2023-08-31,WMT,,2023-08-16 14:14:00,2023-08-16T14:14:00-04:00,2023-08-16,"Target, TJX and other big retailers have reported earnings. Now we'll hear from the biggest.",Results from Home Depot Inc. HD on Tuesday and Target Corp. TGT on Wednesday were a mixed bag. Those from TJX Cos.,marketwatch.com,https://www.marketwatch.com/story/target-tjx-and-other-big-retailers-have-reported-earnings-now-well-hear-from-the-biggest-4e5a3135,https://images.financialmodelingprep.com/news/target-tjx-and-other-big-retailers-have-reported-earnings-20230816.jpg
