ticker,event_date,window_start,window_end,symbol,symbols,publishedDate,publishedDateET,date_et,title,text,site,url,image
WMT,2023-08-17,2023-08-03,2023-08-31,WMT,,2023-08-18 10:51:04,2023-08-18T10:51:04-04:00,2023-08-18,What Walmart's Upgraded Sales Outlook Says About the Market As a Whole,"Walmart upgraded its outlook because its sales are increasing, thanks to particular strength in non-discretionary categories. Other retailers aren't seeing the same boost, likely because they have a greater mix of discretionary items in stores.",fool.com,https://www.fool.com/investing/2023/08/18/what-walmarts-upgraded-sales-outlook-says-about-th/,https://images.financialmodelingprep.com/news/what-walmarts-upgraded-sales-outlook-says-about-the-market-20230818.jpg
WMT,2023-08-17,2023-08-03,2023-08-31,WMT,,2023-08-18 09:53:51,2023-08-18T09:53:51-04:00,2023-08-18,Walmart and Target CEOs say retail crime continues to threaten profits and employee safety,"The leaders of two of America's largest retail chains, Walmart Inc (NYSE:WMT) and Target Corporation (NYSE:TGT), say more needs to be done to prevent retail crime as it continues to impact their profits and threaten the safety of their staff and customers. This week, Walmart CEO Doug McMillon told investors that he wants to see action at a local level.",proactiveinvestors.com,https://www.proactiveinvestors.com/companies/news/1023974?SNAPI,https://images.financialmodelingprep.com/news/walmart-and-target-ceos-say-retail-crime-continues-to-20230818.jpg
WMT,2023-08-17,2023-08-03,2023-08-31,WMT,,2023-08-18 05:29:00,2023-08-18T05:29:00-04:00,2023-08-18,"If I Could Only Buy 3 Stocks in 2023, I'd Pick These","Cintas provides uniforms, restroom supplies, and safety products and boasts a strong track record of producing consistent free cash flow. Dover is a diversified manufacturer of consumable supplies and aftermarket parts that has upped its dividend for 68 consecutive years.",fool.com,https://www.fool.com/investing/2023/08/18/if-i-could-only-buy-3-stocks-in-2023-id-pick-these/,https://images.financialmodelingprep.com/news/if-i-could-only-buy-3-stocks-in-2023-id-20230818.jpg
WMT,2023-08-17,2023-08-03,2023-08-31,WMT,,2023-08-19 11:01:00,2023-08-19T11:01:00-04:00,2023-08-19,Why Investors Should Love Walmart More Than Target,"Walmart's revenue is derived from a higher percentage of sales of nondiscretionary items than Target's. Target recently reported a decline in sales, yet Walmart announced robust growth.",fool.com,https://www.fool.com/investing/2023/08/19/why-investors-should-love-walmart-more-than-target/,https://images.financialmodelingprep.com/news/why-investors-should-love-walmart-more-than-target-20230819.jpg
WMT,2023-08-17,2023-08-03,2023-08-31,WMT,,2023-08-19 09:00:00,2023-08-19T09:00:00-04:00,2023-08-19,10 Dividend Growth Stocks For August 2023,"The article presents the ten highest-quality Dividend Radar stocks for further research and possible investment. To rank stocks, I do a quality assessment and sort stocks by quality scores, breaking ties with additional metrics. Different stocks are recommended for different investment styles, including income investors, value investors, and growth-oriented investors.",seekingalpha.com,https://seekingalpha.com/article/4629774-10-dividend-growth-stocks-for-august-2023,https://images.financialmodelingprep.com/news/10-dividend-growth-stocks-for-august-2023-20230819.jpg
WMT,2023-08-17,2023-08-03,2023-08-31,WMT,,2023-08-21 12:20:31,2023-08-21T12:20:31-04:00,2023-08-21,Walmart Was A More Essential Retailer Than Target In Q2,Walmart is coming off a strong second quarter. Target is not.,forbes.com,https://www.forbes.com/sites/georgeanderson/2023/08/21/walmart-was-a-more-essential-retailer-than-target-in-q2/,https://images.financialmodelingprep.com/news/walmart-was-a-more-essential-retailer-than-target-in-q2-20230821.jpg
WMT,2023-08-17,2023-08-03,2023-08-31,WMT,,2023-08-21 11:40:09,2023-08-21T11:40:09-04:00,2023-08-21,"Weight loss drugs boost sales at retail pharmacies, but they may not help profits much",Analysts said blockbuster weight loss drugs like Wegovy are minimally profitable for retailers like Walmart – and may even come with slight margin headwinds.,cnbc.com,https://www.cnbc.com/2023/08/21/weight-loss-drugs-boost-retail-pharmacy-sales.html,https://images.financialmodelingprep.com/news/weight-loss-drugs-boost-sales-at-retail-pharmacies-but-20230821.jpeg
WMT,2023-08-17,2023-08-03,2023-08-31,WMT,,2023-08-21 10:31:29,2023-08-21T10:31:29-04:00,2023-08-21,Walmart Inc. (WMT) is Attracting Investor Attention: Here is What You Should Know,"Recently, Zacks.com users have been paying close attention to Walmart (WMT). This makes it worthwhile to examine what the stock has in store.",zacks.com,https://www.zacks.com/stock/news/2138577/walmart-inc-wmt-is-attracting-investor-attention-here-is-what-you-should-know,https://images.financialmodelingprep.com/news/walmart-inc-wmt-is-attracting-investor-attention-here-is-20230821.jpg
WMT,2023-08-17,2023-08-03,2023-08-31,WMT,,2023-08-21 09:00:00,2023-08-21T09:00:00-04:00,2023-08-21,REPEAT -- Blender Bites Launches into Walmart USA,"VANCOUVER, British Columbia, Aug. 21, 2023 (GLOBE NEWSWIRE) -- Blender Bites Ltd. (the “Company”, “Blender Bites” or “Blender”), (CSE: BITE, FWB: JL4, WKN: A3DMEJ), a multi award-winning Canadian company involved in the development and marketing of a line of premium, frozen functional beverages, is thrilled to announce its US subsidiary, Blender Bites US Ltd.",globenewswire.com,https://www.globenewswire.com/news-release/2023/08/21/2728701/0/en/REPEAT-Blender-Bites-Launches-into-Walmart-USA.html,https://images.financialmodelingprep.com/news/repeat-blender-bites-launches-into-walmart-usa-20230821.jpg
WMT,2023-08-17,2023-08-03,2023-08-31,WMT,,2023-08-21 08:50:44,2023-08-21T08:50:44-04:00,2023-08-21,Nobody's Talking About Walmart's Most Exciting Q2 Success Story,"Walmart grows its top line by selling more goods, but profit margins on retail sales are historically low. Digital ads paid for by third-party brands appearing at Walmart.com are highly profitable.",fool.com,https://www.fool.com/investing/2023/08/21/walmart-q2-retail-media-digital-advertising-growth/,https://images.financialmodelingprep.com/news/nobodys-talking-about-walmarts-most-exciting-q2-success-story-20230821.jpg
WMT,2023-08-17,2023-08-03,2023-08-31,WMT,,2023-08-22 17:24:00,2023-08-22T17:24:00-04:00,2023-08-22,"Walmart to start paying states, local governments in opioids settlement","Walmart Inc. WMT, -0.32% said in a filing late Tuesday that it will pay about $2.8 billion of its roughly $3.3 billion opioids settlement around November, in the retail giant's fiscal 2024 third quarter. The settlement, which sought to resolve all lawsuits over Walmart pharmacies' role around the opioid crisis, was announced last year, with Walmart reaching agreements with all 50 states in December.",marketwatch.com,https://www.marketwatch.com/story/walmart-to-start-paying-states-local-governments-in-opioids-settlement-3757fee0,https://images.financialmodelingprep.com/news/walmart-to-start-paying-states-local-governments-in-opioids-20230822.jpg
WMT,2023-08-17,2023-08-03,2023-08-31,WMT,,2023-08-22 13:13:04,2023-08-22T13:13:04-04:00,2023-08-22,Walmart probing suppliers accused of using inmate labor at Cambodia women's prison,"International trade of goods made by convicts is illegal in the US and in Cambodia, which has received preferential US trade terms on billions of dollars of products over recent years.",nypost.com,https://nypost.com/2023/08/22/walmart-probing-suppliers-accused-of-using-inmate-labor-at-cambodia-womens-prison/,https://images.financialmodelingprep.com/news/walmart-probing-suppliers-accused-of-using-inmate-labor-at-20230822.jpg
WMT,2023-08-17,2023-08-03,2023-08-31,WMT,,2023-08-22 10:30:00,2023-08-22T10:30:00-04:00,2023-08-22,Spin Master Delivers The Magic with Four Toys Named to Walmart's 2023 Top Toys List,"TORONTO , Aug. 22, 2023 /PRNewswire/ - Spin Master Corp. (TSX: TOY) (www.spinmaster.com), a leading children's entertainment company, is delivering the magic this holiday season with four toys being named to Walmart's highly-anticipated 2023 Top Toys List. The list includes Spin Master's Bitzee™, an interactive digital pet that you can really touch; the Gabby's Dollhouse® Gabby Cat Friend Ship™ playset, expanding the ecosystem of toys inspired by the imaginative world from DreamWorks Animation's hit series; the hilarious Monkey See, Monkey Poo™ kids boardgame and the Skye 12"" premium plush that celebrates the heroine of the upcoming PAW Patrol: The Mighty Movie™ feature film.",prnewswire.com,https://www.prnewswire.com/news-releases/spin-master-delivers-the-magic-with-four-toys-named-to-walmarts-2023-top-toys-list-301906950.html,https://images.financialmodelingprep.com/news/spin-master-delivers-the-magic-with-four-toys-named-20230822.jpg
WMT,2023-08-17,2023-08-03,2023-08-31,WMT,,2023-08-22 09:46:28,2023-08-22T09:46:28-04:00,2023-08-22,5 Blue-Chip Stocks for a Stable Portfolio Amid Volatility,"We have narrowed our search to five blue-chip such stocks with strong growth potential for the rest of 2023. These are: WMT, JPM, JNJ, CAT, MCD.",zacks.com,https://www.zacks.com/stock/news/2139022/5-blue-chip-stocks-for-a-stable-portfolio-amid-volatility,https://images.financialmodelingprep.com/news/5-bluechip-stocks-for-a-stable-portfolio-amid-volatility-20230822.jpg
WMT,2023-08-17,2023-08-03,2023-08-31,WMT,,2023-08-22 09:10:48,2023-08-22T09:10:48-04:00,2023-08-22,Embrace the Lynch Philosophy: Hold Your Winners and Prosper,"""Selling your winners and holding your losers is like cutting the flowers and watering the weeds"" is probably one of Peter Lynch's most famous quotes. And for good reason.",gurufocus.com,https://www.gurufocus.com/news/2069820/embrace-the-lynch-philosophy-hold-your-winners-and-prosper,https://images.financialmodelingprep.com/news/embrace-the-lynch-philosophy-hold-your-winners-and-prosper-20230822.jpg
WMT,2023-08-17,2023-08-03,2023-08-31,WMT,,2023-08-22 09:01:04,2023-08-22T09:01:04-04:00,2023-08-22,Best ETFs of Last Week,Wall Street delivered downbeat performances last week due to rising rates.,zacks.com,https://www.zacks.com/stock/news/2138968/best-etfs-of-last-week,https://images.financialmodelingprep.com/news/best-etfs-of-last-week-20230822.jpg
WMT,2023-08-17,2023-08-03,2023-08-31,WMT,,2023-08-22 08:00:00,2023-08-22T08:00:00-04:00,2023-08-22,Calling All Kids! Walmart's 2023 Top Toys List is Here and Going Big On Savings this Holiday Season,"BENTONVILLE, Ark.--(BUSINESS WIRE)--It's the most wonderful list of the year! Ready the gift wrap because Walmart is unveiling its highly anticipated Top Toys List, bringing customers this season's coolest toys – all at Walmart's joyfully low prices. Walmart's 2023 Top Toys List celebrates this year's 55 most-wanted toys for kids (and kids at heart!) of all ages, making it affordable, easy and fun to shop and spread cheer all season long. “The holiday season is just around the corner, and Walma.",businesswire.com,https://www.businesswire.com/news/home/20230822862590/en/Calling-All-Kids%21-Walmart%E2%80%99s-2023-Top-Toys-List-is-Here-and-Going-Big-On-Savings-this-Holiday-Season/,https://images.financialmodelingprep.com/news/calling-all-kids-walmarts-2023-top-toys-list-is-20230822.jpg
WMT,2023-08-17,2023-08-03,2023-08-31,WMT,,2023-08-22 06:30:00,2023-08-22T06:30:00-04:00,2023-08-22,Is Walmart an Excellent Dividend Stock?,Walmart's quarterly financial update revealed that consumers are increasingly looking for everyday low prices.,fool.com,https://www.fool.com/investing/2023/08/22/is-walmart-an-excellent-dividend-stock/,https://images.financialmodelingprep.com/news/is-walmart-an-excellent-dividend-stock-20230822.jpg
WMT,2023-08-17,2023-08-03,2023-08-31,WMT,,2023-08-23 18:47:17,2023-08-23T18:47:17-04:00,2023-08-23,Earnings Remain Stable: No 'Cliff' in Sight,"The evolving earnings outlook remains inconsistent with the long-feared 'earnings cliff' narrative, with estimates for several key sectors increasing.",zacks.com,https://www.zacks.com/commentary/2139916/earnings-remain-stable-no-cliff-in-sight,https://images.financialmodelingprep.com/news/earnings-remain-stable-no-cliff-in-sight-20230823.jpg
WMT,2023-08-17,2023-08-03,2023-08-31,WMT,,2023-08-23 18:47:16,2023-08-23T18:47:16-04:00,2023-08-23,Earnings Remain Stable: No 'Cliff' in Sight,"The evolving earnings outlook remains inconsistent with the long-feared 'earnings cliff' narrative, with estimates for several key sectors increasing.",zacks.com,https://www.zacks.com/commentary/2139911/earnings-remain-stable-no-cliff-in-sight,https://images.financialmodelingprep.com/news/earnings-remain-stable-no-cliff-in-sight-20230823.jpg
WMT,2023-08-17,2023-08-03,2023-08-31,WMT,,2023-08-23 10:00:00,2023-08-23T10:00:00-04:00,2023-08-23,Are Walmart's Profits Poised to Surge With Online Growth and Consumer Staples?,Walmart's emphasis on consumer staples resonates with customers who seek value. The retailer's strategic integration of physical stores with digital platforms continues.,fool.com,https://www.fool.com/investing/2023/08/23/are-walmarts-profits-poised-to-surge-with-online/,https://images.financialmodelingprep.com/news/are-walmarts-profits-poised-to-surge-with-online-growth-20230823.jpg
WMT,2023-08-17,2023-08-03,2023-08-31,WMT,,2023-08-23 09:46:11,2023-08-23T09:46:11-04:00,2023-08-23,Walmart's (WMT) Growth Tale Highlighted by Omnichannel Prowess,Walmart (WMT) benefits from its efforts to enhance store and e-commerce performance. These upsides have been boosting comp sales for a while now.,zacks.com,https://www.zacks.com/stock/news/2139540/walmart-s-wmt-growth-tale-highlighted-by-omnichannel-prowess,https://images.financialmodelingprep.com/news/walmarts-wmt-growth-tale-highlighted-by-omnichannel-prowess-20230823.jpg
WMT,2023-08-17,2023-08-03,2023-08-31,WMT,,2023-08-23 08:30:00,2023-08-23T08:30:00-04:00,2023-08-23,Walmart leadership to participate in upcoming investor events,"BENTONVILLE, Ark.--(BUSINESS WIRE)--Walmart Inc. (NYSE: WMT) announced today that company leadership will participate in upcoming investor events, with several including live webcasts on Walmart's investor relations website at stock.walmart.com. September 6: Global Staples Conference – hosted by Barclays. Walmart Investor Relations will participate in meetings. September 11: Growth Frontiers Conference – hosted by Piper Sandler. Walmart Investor Relations and Jennifer Acerra, vice president, U.",businesswire.com,https://www.businesswire.com/news/home/20230823581140/en/Walmart-leadership-to-participate-in-upcoming-investor-events/,https://images.financialmodelingprep.com/news/walmart-leadership-to-participate-in-upcoming-investor-events-20230823.jpg
WMT,2023-08-17,2023-08-03,2023-08-31,WMT,,2023-08-23 00:37:15,2023-08-23T00:37:15-04:00,2023-08-23,Deep-Value Opportunity To Invest In High-Yielding Non-Cyclical Stocks,"Non-cyclical stocks offer steady growth and reliability, attracting investors during economic downturns. Rising interest rates and inflation pose a risk to stocks, making bonds with ""durable"" interest rates an attractive option. Consumer staples stocks have underperformed in 2023 but may see a turnaround due to potential inflation risks and rising oil prices.",seekingalpha.com,https://seekingalpha.com/article/4630415-deep-value-opportunity-to-invest-in-high-yielding-non-cyclical-stocks,https://images.financialmodelingprep.com/news/deepvalue-opportunity-to-invest-in-highyielding-noncyclical-stocks-20230823.jpg
WMT,2023-08-17,2023-08-03,2023-08-31,WMT,,2023-08-24 19:32:00,2023-08-24T19:32:00-04:00,2023-08-24,"Retailers are raising the alarm about theft. For this chain, it's been ‘within our plans'","Lots of big retailers this summer are talking about theft, and how it's hurting profit. But when an analyst asked department-store chain Nordstrom Inc. JWN, -4.38% about the subject on Thursday, following a massive late-afternoon robbery at one of its stores this month in California, executives said levels of theft haven't been beyond what they expected.",marketwatch.com,https://www.marketwatch.com/story/retailers-are-raising-the-alarm-about-theft-for-this-chain-its-been-within-our-plans-b59c9bea,https://images.financialmodelingprep.com/news/retailers-are-raising-the-alarm-about-theft-for-this-chain-20230824.jpg
WMT,2023-08-17,2023-08-03,2023-08-31,WMT,,2023-08-24 16:17:49,2023-08-24T16:17:49-04:00,2023-08-24,Got $600? Here are 3 No-Brainer Stocks You Absolutely Must Buy,The stock market recovered nicely from last year's debacle. The Nasdaq Composite Index in particular went from a 34% loss in 2022 to a 29% gain so far this year.,investorplace.com,https://investorplace.com/2023/08/got-600-here-are-3-no-brainer-stocks-you-absolutely-must-buy/,https://images.financialmodelingprep.com/news/got-600-here-are-3-nobrainer-stocks-you-absolutely-20230824.png
WMT,2023-08-17,2023-08-03,2023-08-31,WMT,,2023-08-24 14:30:35,2023-08-24T14:30:35-04:00,2023-08-24,Walmart + Google = Drone Delivery In Dallas,"Walmart has been testing drone delivery for two years now while its biggest competitor, Amazon, seems grounded.",forbes.com,https://www.forbes.com/sites/johnkoetsier/2023/08/24/walmart--google--drone-delivery-in-dallas/,https://images.financialmodelingprep.com/news/walmart-google-drone-delivery-in-dallas-20230824.jpg
WMT,2023-08-17,2023-08-03,2023-08-31,WMT,,2023-08-24 14:24:33,2023-08-24T14:24:33-04:00,2023-08-24,Bridgewater's Approach: Stocks for an Upcoming Recession,"In the ever-changing landscape of financial markets, the search for stability and resilience remains a paramount concern, especially in the face of potential economic downturns. Ray Dalio (Trades, Portfolio), the visionary founder of Bridgewater Associates, is well-known for his strategic prowess in navigating market fluctuations.",gurufocus.com,https://www.gurufocus.com/news/2071703/bridgewaters-approach-stocks-for-an-upcoming-recession,https://images.financialmodelingprep.com/news/bridgewaters-approach-stocks-for-an-upcoming-recession-20230824.jpg
WMT,2023-08-17,2023-08-03,2023-08-31,WMT,,2023-08-24 13:41:01,2023-08-24T13:41:01-04:00,2023-08-24,Walmart expands drone delivery to 60K more US households,Walmart and Alphabet-owned Wing announced a partnership that will allow the retailer to offer drone delivery to tens of thousands of additional households.,foxbusiness.com,https://www.foxbusiness.com/lifestyle/walmart-expands-drone-delivery-60k-more-us-households,https://images.financialmodelingprep.com/news/walmart-expands-drone-delivery-to-60k-more-us-households-20230824.jpg
WMT,2023-08-17,2023-08-03,2023-08-31,WMT,,2023-08-24 12:56:08,2023-08-24T12:56:08-04:00,2023-08-24,How To Profit from these 3 Membership Club Stocks Strength,"One thing is clear from the Q2 retail earnings and guidance. There are winners and losers in the space, and the membership clubs are an area of strength.",marketbeat.com,https://www.marketbeat.com/originals/how-to-profit-from-these-3-membership-club-stocks-strength/?utm_source=snapi,https://images.financialmodelingprep.com/news/how-to-profit-from-these-3-membership-club-stocks-strength-20230824.jpg
WMT,2023-08-17,2023-08-03,2023-08-31,WMT,,2023-08-24 12:19:44,2023-08-24T12:19:44-04:00,2023-08-24,These Are the ONLY 3 Blue-Chip Stocks to Consider in August 2023,"The stock market is sliding lower in August, and volatility has returned to equities. So what's an investor to do?",investorplace.com,https://investorplace.com/2023/08/these-are-the-only-3-blue-chip-stocks-to-consider-in-august-2023/,https://images.financialmodelingprep.com/news/these-are-the-only-3-bluechip-stocks-to-consider-in-20230824.jpg
WMT,2023-08-17,2023-08-03,2023-08-31,WMT,,2023-08-24 10:32:04,2023-08-24T10:32:04-04:00,2023-08-24,3 Stocks Plant-Based Meat Lovers Should Keep an Eye on,"More people are now getting concerned about lifestyle changes and prefer healthy diets, making the long-term prospects of Beyond Meat (BYND), Ingredion (INGR) and Walmart (WMT) bright.",zacks.com,https://www.zacks.com/stock/news/2140240/3-stocks-plant-based-meat-lovers-should-keep-an-eye-on,https://images.financialmodelingprep.com/news/3-stocks-plantbased-meat-lovers-should-keep-an-eye-20230824.jpg
WMT,2023-08-17,2023-08-03,2023-08-31,WMT,,2023-08-24 10:13:39,2023-08-24T10:13:39-04:00,2023-08-24,U.S. Credit Rating Concerns? Here Are 3 Stocks to Protect Your Portfolio,"Fear is back in the air. On August 8, 2023, Moody's rating agency downgraded central U.S. banks due to weaker profits and increased funding risks.",investorplace.com,https://investorplace.com/2023/08/u-s-credit-rating-concerns-here-are-3-stocks-to-protect-your-portfolio/,https://images.financialmodelingprep.com/news/us-credit-rating-concerns-here-are-3-stocks-to-20230824.png
WMT,2023-08-17,2023-08-03,2023-08-31,WMT,,2023-08-24 09:53:00,2023-08-24T09:53:00-04:00,2023-08-24,3 Dividend Stocks to Buy and Hold Until You Retire,"UnitedHealth Group, Apple, and Walmart pay modest but sustainable dividends. These companies have all been increasing their payouts in recent years.",fool.com,https://www.fool.com/investing/2023/08/24/3-dividend-stocks-to-buy-and-hold-until-you-retire/,https://images.financialmodelingprep.com/news/3-dividend-stocks-to-buy-and-hold-until-you-retire-20230824.jpg
WMT,2023-08-17,2023-08-03,2023-08-31,WMT,,2023-08-24 08:00:08,2023-08-24T08:00:08-04:00,2023-08-24,Walmart is adding Wing drone deliveries to limited Superstores this year,"Wing is expanding drone deliveries to a pair of Texas-area Walmart Superstores later this year. The Alphabet-owned drone firm says the two offerings will cover a combined 60,000 homes in the greater Dallas-Fort Worth metroplex.",techcrunch.com,https://techcrunch.com/2023/08/24/walmart-is-adding-wing-drone-deliveries-to-limited-superstores-this-year/,https://images.financialmodelingprep.com/news/walmart-is-adding-wing-drone-deliveries-to-limited-superstores-20230824.jpeg
WMT,2023-08-17,2023-08-03,2023-08-31,WMT,,2023-08-24 07:20:05,2023-08-24T07:20:05-04:00,2023-08-24,4 Off-Price Retailers that are Worth the Price,"The signals are mixed in retail land, but some clear winners exist. While Foot Locker NYSE: FL and Target NYSE: TGT suffer from poor positioning, inventory woes, and competition, names like Walmart NYSE: WMT have emerged as clear winners.",marketbeat.com,https://www.marketbeat.com/originals/4-off-price-retailers-that-are-worth-the-price/?utm_source=snapi,https://images.financialmodelingprep.com/news/4-offprice-retailers-that-are-worth-the-price-20230824.jpg
WMT,2023-08-17,2023-08-03,2023-08-31,WMT,,2023-08-24 06:41:00,2023-08-24T06:41:00-04:00,2023-08-24,Better Stock Buy: Walmart vs. Target vs.,Persistent inflation is forcing consumers to adapt how they spend money and what they spend it on. Slowing sales growth suggests Costco's membership-based approach isn't as beneficial for consumers as it was just a couple of years ago.,fool.com,https://www.fool.com/investing/2023/08/24/better-stock-buy-walmart-vs-target-vs-costco/,https://images.financialmodelingprep.com/news/better-stock-buy-walmart-vs-target-vs-20230824.jpg
WMT,2023-08-17,2023-08-03,2023-08-31,WMT,,2023-08-25 16:31:00,2023-08-25T16:31:00-04:00,2023-08-25,Theft is hitting different retailers differently — this one suggests good customer service can be part of the solution,"Theft has been the theme for the retail industry's earnings season this month, and with it the industry metric known as “shrink.” But sports-centric retailer Hibbett Inc. said Friday that the hit to margins from theft wasn't that much.",marketwatch.com,https://www.marketwatch.com/story/theft-is-hitting-different-retailers-differently-this-one-suggests-good-customer-service-can-be-part-of-the-solution-6d13e4ee,https://images.financialmodelingprep.com/news/theft-is-hitting-different-retailers-differently-this-one-suggests-20230825.jpg
WMT,2023-08-17,2023-08-03,2023-08-31,WMT,,2023-08-25 08:31:15,2023-08-25T08:31:15-04:00,2023-08-25,Alphabet and Walmart team up for drone deliveries in Texas,"Google owner Alphabet has started to use drones to make deliveries for Walmart in the Dallas-Fort Worth area. Walmart says the partnership, which is with Alphabet's drone business Wing, will allow it to deliver to an additional 60,000 homes.",proactiveinvestors.co.uk,https://www.proactiveinvestors.co.uk/companies/news/1024617?SNAPI,https://images.financialmodelingprep.com/news/alphabet-and-walmart-team-up-for-drone-deliveries-in-20230825.jpg
WMT,2023-08-17,2023-08-03,2023-08-31,WMT,,2023-08-25 06:00:01,2023-08-25T06:00:01-04:00,2023-08-25,These Are the ONLY 3 Retail Stocks to Consider in August 2023,Retail stocks are not what they used to be with the rise of cheaper and much more streamlined shopping experiences that are provided by companies such as Amazon (NASDAQ: AMZN ) and Walmart (NYSE: WMT ). Other companies in the retail marketplace have struggled with customer retention and retail location foot traffic.,investorplace.com,https://investorplace.com/2023/08/these-are-the-only-3-retail-stocks-to-consider-in-august-2023/,https://images.financialmodelingprep.com/news/these-are-the-only-3-retail-stocks-to-consider-20230825.png
WMT,2023-08-17,2023-08-03,2023-08-31,WMT,,2023-08-26 15:32:27,2023-08-26T15:32:27-04:00,2023-08-26,7 Retail Stocks Ready to Get a Back-to-School Boost,"At first glance, the very concept of retail stocks to buy might seem the equivalent of burning your cash in the dumpster. With the Federal Reserve still concerned about the impact of stubbornly high inflation, the underlying narrative doesn't seem supportive of consumer sentiment.",investorplace.com,https://investorplace.com/2023/08/7-retail-stocks-ready-to-get-a-back-to-school-boost/,https://images.financialmodelingprep.com/news/7-retail-stocks-ready-to-get-a-backtoschool-boost-20230826.jpg
