ticker,event_date,window_start,window_end,symbol,symbols,publishedDate,publishedDateET,date_et,title,text,site,url,image
WMT,2023-08-17,2023-08-03,2023-08-31,WMT,,2023-08-26 08:00:00,2023-08-26T08:00:00-04:00,2023-08-26,What Walmart Is Doing Right,And Aldi makes an interesting grocery move.,fool.com,https://www.fool.com/investing/2023/08/26/what-walmart-is-doing-right/,https://images.financialmodelingprep.com/news/what-walmart-is-doing-right-20230826.jpg
WMT,2023-08-17,2023-08-03,2023-08-31,WMT,,2023-08-27 06:24:00,2023-08-27T06:24:00-04:00,2023-08-27,These 3 Stocks Are Safe Bets in the Event of a Market Crash,"Visa is the world's largest payment processor, and its business has strong network effects. Marsh & McLennan advises companies on managing risks and has a history of growing earnings during recessionary periods.",fool.com,https://www.fool.com/investing/2023/08/27/these-3-stocks-are-safe-bets-in-the-event-of-a-mar/,https://images.financialmodelingprep.com/news/these-3-stocks-are-safe-bets-in-the-event-20230827.jpg
WMT,2023-08-17,2023-08-03,2023-08-31,WMT,,2023-08-28 12:47:54,2023-08-28T12:47:54-04:00,2023-08-28,String of Q2 Earnings Beat Fails to Lift Retail ETFs,"Total earnings from 96.3% of the sector's total market capitalization reported so far are up 23.9% on 5.5% higher revenues, with 78.6% beating EPS estimates and 57.1% beating revenue estimates.",zacks.com,https://www.zacks.com/stock/news/2141401/string-of-q2-earnings-beat-fails-to-lift-retail-etfs,https://images.financialmodelingprep.com/news/string-of-q2-earnings-beat-fails-to-lift-retail-etfs-20230828.jpg
WMT,2023-08-17,2023-08-03,2023-08-31,WMT,,2023-08-28 12:15:48,2023-08-28T12:15:48-04:00,2023-08-28,Better Stock Buy: Walmart vs. Lowe's,Both companies pay a growing dividend. Walmart stock will appeal to investors seeking stability and predictable growth.,fool.com,https://www.fool.com/investing/2023/08/28/better-buy-walmart-vs-lowes-stock/,https://images.financialmodelingprep.com/news/better-stock-buy-walmart-vs-lowes-20230828.jpg
WMT,2023-08-17,2023-08-03,2023-08-31,WMT,,2023-08-28 12:04:18,2023-08-28T12:04:18-04:00,2023-08-28,Walmart Partners With People Of Crypto To Celebrate Hip Hop And Black Culture In The Metaverse,"To celebrate Black culture and Hip Hop's 50th, Walmart is partnering with People of Crypto Lab to launch gamified experience Cultureverse in the Spatial metaverse.",forbes.com,https://www.forbes.com/sites/stephaniehirschmiller/2023/08/28/walmart-partners-with-people-of-crypto-to-celebrate-hip-hop-and-black-culture-in-the-metaverse/,https://images.financialmodelingprep.com/news/walmart-partners-with-people-of-crypto-to-celebrate-hip-hop-20230828.jpg
WMT,2023-08-17,2023-08-03,2023-08-31,WMT,,2023-08-28 10:41:30,2023-08-28T10:41:30-04:00,2023-08-28,Walmart: How High Is Too High?,"The stock is hovering around an all-time high level of $161.20. Strong momentum in the Comps sales and e-commerce business, incremental operating margins, and strong operating cash flow provide an investment case for upside potential. Robust growth in e-commerce is driven by strength in pickup and delivery.",seekingalpha.com,https://seekingalpha.com/article/4631506-walmart-how-high-is-too-high,https://images.financialmodelingprep.com/news/walmart-how-high-is-too-high-20230828.jpg
WMT,2023-08-17,2023-08-03,2023-08-31,WMT,,2023-08-28 10:32:48,2023-08-28T10:32:48-04:00,2023-08-28,These 2 Retail and Wholesale Stocks Could Beat Earnings: Why They Should Be on Your Radar,Finding stocks expected to beat quarterly earnings estimates becomes an easier task with our Zacks Earnings ESP.,zacks.com,https://www.zacks.com/stock/news/2141238/these-2-retail-and-wholesale-stocks-could-beat-earnings-why-they-should-be-on-your-radar,https://images.financialmodelingprep.com/news/these-2-retail-and-wholesale-stocks-could-beat-earnings-20230828.jpg
WMT,2023-08-17,2023-08-03,2023-08-31,WMT,,2023-08-28 09:46:27,2023-08-28T09:46:27-04:00,2023-08-28,5 Dividend Growth Stocks to Buy in a Weak Market,"Caterpillar (CAT), Applied Materials (AMAT), Toll Brothers (TOL), Walmart (WMT) and Dr. Reddy's (RDY) could be solid choices for investors amid market weakness.",zacks.com,https://www.zacks.com/stock/news/2141200/5-dividend-growth-stocks-to-buy-in-a-weak-market,https://images.financialmodelingprep.com/news/5-dividend-growth-stocks-to-buy-in-a-weak-20230828.jpg
WMT,2023-08-17,2023-08-03,2023-08-31,WMT,,2023-08-28 07:16:13,2023-08-28T07:16:13-04:00,2023-08-28,Dollar Wars: 2 Dollar Store Empires Getting More Affordable,"During uncertain macroeconomic times, consumers trying to stretch their budgets will migrate towards finding promotions and discounts at retailers. Consumers shop in dollar stores to get the best deals.",marketbeat.com,https://www.marketbeat.com/originals/dollar-wars-2-dollar-store-empires-getting-more-affordable/?utm_source=snapi,https://images.financialmodelingprep.com/news/dollar-wars-2-dollar-store-empires-getting-more-affordable-20230828.jpg
WMT,2023-08-17,2023-08-03,2023-08-31,WMT,,2023-08-28 06:05:45,2023-08-28T06:05:45-04:00,2023-08-28,August MDA Breakout Stocks Week 35 - 2023: High-Frequency Gainers To Give You An Edge,"Two new sample Breakout Stocks for Week 35 curated by the MDA model for a 10% short-term upside along with a Dow pick. The Momentum Gauges, S&P 500 Gauges, and Weekly Gauges all continue negative after the longest positive signal since March 2021 on the weekly gauges. Last week three of the four picks gained over the 10% mark, closing up an average of +9.17% for the week with strong Segment 6 momentum.",seekingalpha.com,https://seekingalpha.com/article/4631464-august-mda-breakout-stocks-week-35-2023,https://images.financialmodelingprep.com/news/august-mda-breakout-stocks-week-35-2023-highfrequency-gainers-20230828.jpg
WMT,2023-08-17,2023-08-03,2023-08-31,WMT,,2023-08-29 14:50:11,2023-08-29T14:50:11-04:00,2023-08-29,"Walmart asks pharmacists to take pay cuts, work fewer hours to reduce costs","Walmart is asking some of its 16K pharmacists to voluntarily take pay cuts and reduce their working hours in a bid to cut costs, a person familiar with the matter says.",nypost.com,https://nypost.com/2023/08/29/walmart-asks-pharmacists-to-take-pay-cuts-work-fewer-hours/,https://images.financialmodelingprep.com/news/walmart-asks-pharmacists-to-take-pay-cuts-work-fewer-20230829.jpg
WMT,2023-08-17,2023-08-03,2023-08-31,WMT,,2023-08-29 13:56:55,2023-08-29T13:56:55-04:00,2023-08-29,"Exclusive: Walmart cuts pharmacist pay, hours while workload piles up","Walmart is asking some of its 16,000 pharmacists across the U.S. to voluntarily take pay cuts and reduce their working hours in a bid to reduce costs, a person familiar with the matter told Reuters.",reuters.com,https://www.reuters.com/business/healthcare-pharmaceuticals/walmart-cuts-pharmacist-pay-hours-while-workload-piles-up-2023-08-29/,https://images.financialmodelingprep.com/news/exclusive-walmart-cuts-pharmacist-pay-hours-while-workload-piles-20230829.jpg
WMT,2023-08-17,2023-08-03,2023-08-31,WMT,,2023-08-29 13:37:07,2023-08-29T13:37:07-04:00,2023-08-29,Market Crash Coming? 3 Consumer Staples Stocks to Buy for a Soft Landing,The debate rages on. Some notable investors are betting on a market crash in coming months prompted by a year-long recession talks.,investorplace.com,https://investorplace.com/2023/08/market-crash-coming-3-consumer-staples-stocks-to-buy-for-a-soft-landing/,https://images.financialmodelingprep.com/news/market-crash-coming-3-consumer-staples-stocks-to-buy-20230829.jpg
WMT,2023-08-17,2023-08-03,2023-08-31,WMT,,2023-08-29 10:00:00,2023-08-29T10:00:00-04:00,2023-08-29,3 Reasons to Buy This Dow Dividend Giant,Walmart recently boosted its sales and earnings outlook. The stock could deliver strong returns for patient investors.,fool.com,https://www.fool.com/investing/2023/08/29/3-reasons-to-buy-this-dow-dividend-giant/,https://images.financialmodelingprep.com/news/3-reasons-to-buy-this-dow-dividend-giant-20230829.jpg
WMT,2023-08-17,2023-08-03,2023-08-31,WMT,,2023-08-29 08:30:11,2023-08-29T08:30:11-04:00,2023-08-29,3 Winning Retail Stocks Income Investors Can Rely On,"The Retail Sector (XRT) has always been a challenging one to invest in, but income investors can find attractive returns that build wealth. The takeaway from recent data is that consumer spending remains strong, albeit aided by inflation.",marketbeat.com,https://www.marketbeat.com/originals/3-winning-retail-stocks-income-investors-can-rely-on/?utm_source=snapi,https://images.financialmodelingprep.com/news/3-winning-retail-stocks-income-investors-can-rely-on-20230829.jpg
WMT,2023-08-17,2023-08-03,2023-08-31,WMT,,2023-08-29 07:11:00,2023-08-29T07:11:00-04:00,2023-08-29,Wall Street Says This EV Stock Is Set to Soar -- Here's Why They Couldn't Be More Wrong,Wall Street is still overwhelmingly bullish on Canoo. Its average price target implies a near-400% gain from its current levels.,fool.com,https://www.fool.com/investing/2023/08/29/wall-street-says-this-ev-stock-is-set-to-soar-here/,https://images.financialmodelingprep.com/news/wall-street-says-this-ev-stock-is-set-to-20230829.jpg
WMT,2023-08-17,2023-08-03,2023-08-31,WMT,,2023-08-30 12:05:47,2023-08-30T12:05:47-04:00,2023-08-30,Walmart's corporate employees are getting a generative AI assistant while Amazon and Apple are restricting AI in the workplace,"Walmart is giving its corporate employees an AI ""assistant"" tool to speed up productivity.  The retailer is embracing AI while other companies limit employees' use of AI in the workplace.",businessinsider.com,https://www.businessinsider.com/walmart-is-giving-50000-corporate-employees-a-generative-ai-assistant-2023-8,https://images.financialmodelingprep.com/news/walmarts-corporate-employees-are-getting-a-generative-ai-assistant-20230830.jpg
WMT,2023-08-17,2023-08-03,2023-08-31,WMT,,2023-08-30 12:02:05,2023-08-30T12:02:05-04:00,2023-08-30,"Walmart ramps up efforts to grow third-party marketplace with Las Vegas event, new perks",Walmart is chasing more e-commerce sales and has said it will grow profits faster than revenue over the next five years.,cnbc.com,https://www.cnbc.com/2023/08/30/walmart-tries-to-grow-third-party-marketplace-with-las-vegas-event.html,https://images.financialmodelingprep.com/news/walmart-ramps-up-efforts-to-grow-thirdparty-marketplace-with-20230830.jpg
WMT,2023-08-17,2023-08-03,2023-08-31,WMT,,2023-08-30 05:15:00,2023-08-30T05:15:00-04:00,2023-08-30,3 Top Stocks to Buy During a Bear Market (And It's Not Even Close),Not all food companies are built the same. Hormel Foods enjoys a combination of persistent pricing power and opportunities to keep its relative costs curbed.,fool.com,https://www.fool.com/investing/2023/08/30/3-top-stocks-to-buy-during-bear-market-not-close/,https://images.financialmodelingprep.com/news/3-top-stocks-to-buy-during-a-bear-market-and-20230830.jpg
WMT,2023-08-17,2023-08-03,2023-08-31,WMT,,2023-08-31 12:46:36,2023-08-31T12:46:36-04:00,2023-08-31,3 Takeaways from the August Inflation Report,"The market advanced following the August PCE price index report, but investors and traders should not discount the news. The PCE index remains cool relative to the peaks of the inflation scare, but there are signs that the cooling is over.",marketbeat.com,https://www.marketbeat.com/originals/3-takeaways-from-the-august-inflation-report/?utm_source=snapi,https://images.financialmodelingprep.com/news/3-takeaways-from-the-august-inflation-report-20230831.jpg
WMT,2023-08-17,2023-08-03,2023-08-31,WMT,,2023-08-31 10:31:28,2023-08-31T10:31:28-04:00,2023-08-31,Is Walmart (WMT) a Buy as Wall Street Analysts Look Optimistic?,"Investors often turn to recommendations made by Wall Street analysts before making a Buy, Sell, or Hold decision about a stock. While media reports about rating changes by these brokerage-firm employed (or sell-side) analysts often affect a stock's price, do they really matter?",zacks.com,https://www.zacks.com/stock/news/2142924/is-walmart-wmt-a-buy-as-wall-street-analysts-look-optimistic,https://images.financialmodelingprep.com/news/is-walmart-wmt-a-buy-as-wall-street-analysts-look-20230831.jpg
