ticker,event_date,window_start,window_end,symbol,symbols,publishedDate,publishedDateET,date_et,title,text,site,url,image
WMT,2023-08-17,2023-08-03,2023-08-31,WMT,,2023-08-16 13:14:23,2023-08-16T13:14:23-04:00,2023-08-16,Walmart Likely to Beat Q2 Earnings Estimates: ETFs in Focus,Walmart has been hitting record highs ahead of its earnings release. It has a strong chance of beating estimates this quarter.,zacks.com,https://www.zacks.com/stock/news/2137128/walmart-likely-to-beat-q2-earnings-estimates-etfs-in-focus,https://images.financialmodelingprep.com/news/walmart-likely-to-beat-q2-earnings-estimates-etfs-in-20230816.jpg
WMT,2023-08-17,2023-08-03,2023-08-31,WMT,,2023-08-16 12:00:12,2023-08-16T12:00:12-04:00,2023-08-16,Can Walmart's Stock Trade Lower Post Q2?,"Walmart (NYSE: WMT), the world's largest retailer (by revenue), operating discount stores, supercenters, neighborhood markets, and Sam's Club warehouses, is scheduled",forbes.com,https://www.forbes.com/sites/greatspeculations/2023/08/16/can-walmarts-stock-trade-lower-post-q2/,https://images.financialmodelingprep.com/news/can-walmarts-stock-trade-lower-post-q2-20230816.jpg
WMT,2023-08-17,2023-08-03,2023-08-31,WMT,,2023-08-16 11:44:20,2023-08-16T11:44:20-04:00,2023-08-16,Coty Gears Up for Q4 Earnings: What's in the Offing?,Coty's (COTY) fourth-quarter fiscal 2023 earnings are likely to reflect gains from saving efforts and pricing actions amid the inflationary environment.,zacks.com,https://www.zacks.com/stock/news/2137052/coty-gears-up-for-q4-earnings-what-s-in-the-offing,https://images.financialmodelingprep.com/news/coty-gears-up-for-q4-earnings-whats-in-the-20230816.jpg
WMT,2023-08-17,2023-08-03,2023-08-31,WMT,,2023-08-16 10:58:56,2023-08-16T10:58:56-04:00,2023-08-16,Walmart 2Q revenue beat expected to be driven by strong growth in grocery and health,"Walmart Inc (NYSE:WMT) is expected to post “very good” second quarter fiscal 2024 financial results before the market opens on Thursday, August 17, which will push consensus forecasts higher and in turn drive momentum in the stock, according to analysts at UBS. “Its model is not only at the right place at the right time, in our view, but it's also executing at a very high level,” the analysts wrote in a note to clients.",proactiveinvestors.com,https://www.proactiveinvestors.com/companies/news/1023707?SNAPI,https://images.financialmodelingprep.com/news/walmart-2q-revenue-beat-expected-to-be-driven-by-20230816.jpg
WMT,2023-08-17,2023-08-03,2023-08-31,WMT,,2023-08-16 10:22:32,2023-08-16T10:22:32-04:00,2023-08-16,3 Consumer Stocks To Watch In August 2023,Consumer stocks to watch in the stock market today.,stockmarket.com,https://stockmarket.com/featured/3-consumer-stocks-to-watch-in-august-2023-2023-08-16,https://images.financialmodelingprep.com/news/3-consumer-stocks-to-watch-in-august-2023-20230816.jpg
WMT,2023-08-17,2023-08-03,2023-08-31,WMT,,2023-08-16 09:30:37,2023-08-16T09:30:37-04:00,2023-08-16,Walmart Beats Out Target,Target Corp. (NYSE: TGT) was once considered a worthy rival to Walmart Inc. It was the second largest big-box retailer behind Sam Walton's company.,247wallst.com,https://247wallst.com/retail/2023/08/16/walmart-beats-out-target/,https://images.financialmodelingprep.com/news/walmart-beats-out-target-20230816.jpg
WMT,2023-08-17,2023-08-03,2023-08-31,WMT,,2023-08-16 09:25:17,2023-08-16T09:25:17-04:00,2023-08-16,7 Stocks to Buy as Back to School Spending Increases,"Summer's ending and school is right around the corner. From elementary entrants to grad students, learners of all ages and types are ready to hit the books and call an end to summer break.",investorplace.com,https://investorplace.com/2023/08/7-stocks-to-buy-as-back-to-school-spending-increases/,https://images.financialmodelingprep.com/news/7-stocks-to-buy-as-back-to-school-spending-20230816.jpg
WMT,2023-08-17,2023-08-03,2023-08-31,WMT,,2023-08-16 07:36:06,2023-08-16T07:36:06-04:00,2023-08-16,These 3 Stocks Get High Grades for 2023 Back-to-School Shopping,"The National Retail Federation (NRF) estimates that Americans will spend a record $41.5 billion on back-to-school shopping this year, 5% more than last year. Back-to-college shopping is forecast to surge 27% to $94 billion.",marketbeat.com,https://www.marketbeat.com/originals/these-3-stocks-get-high-grades-for-2023-back-to-school-shopping/?utm_source=snapi,https://images.financialmodelingprep.com/news/these-3-stocks-get-high-grades-for-2023-backtoschool-20230816.jpg
WMT,2023-08-17,2023-08-03,2023-08-31,WMT,,2023-08-17 19:13:00,2023-08-17T19:13:00-04:00,2023-08-17,Walmart expects to make a lot more money on selling ads for its products. Here's what it's up against.,"Walmart Inc. sells billions of dollars' worth of products in stores and online every quarter, and Thursday's results showed no exception. But in the years ahead, the retailer is hoping to make a lot more money from advertisements promoting those products, via a segment at the company responsible for putting ads in front of shoppers browsing for purchases online and in its physical locations.",marketwatch.com,https://www.marketwatch.com/story/walmart-expects-to-make-a-lot-more-money-on-selling-ads-for-its-products-heres-what-its-up-against-23f86859,https://images.financialmodelingprep.com/news/walmart-expects-to-make-a-lot-more-money-on-20230817.jpg
WMT,2023-08-17,2023-08-03,2023-08-31,WMT,,2023-08-17 17:47:03,2023-08-17T17:47:03-04:00,2023-08-17,"Retail Earnings Review: Walmart, Target, Home Depot and More",We saw a very interesting trend emerge from the totality of these earnings,zacks.com,https://www.zacks.com/commentary/2137789/retail-earnings-review-walmart-target-home-depot-and-more,https://images.financialmodelingprep.com/news/retail-earnings-review-walmart-target-home-depot-and-more-20230817.jpg
WMT,2023-08-17,2023-08-03,2023-08-31,WMT,,2023-08-17 15:51:07,2023-08-17T15:51:07-04:00,2023-08-17,Three ways Walmart and Target are diverging as consumers watch their wallets,"The two big-box retailers' fiscal second-quarter results had sharp differences, even as economic factors shape consumer spending.",cnbc.com,https://www.cnbc.com/2023/08/17/walmart-and-target-earnings-key-trends-for-retailers.html,https://images.financialmodelingprep.com/news/three-ways-walmart-and-target-are-diverging-as-consumers-20230817.jpg
WMT,2023-08-17,2023-08-03,2023-08-31,WMT,,2023-08-17 14:41:15,2023-08-17T14:41:15-04:00,2023-08-17,"Walmart Delivered A Winning $161 Billion Quarter, And Out-Played Target","Walmart used some of its old-school strategies, combined with new technology, to boost sales and profits, with a second quarter that easily beat expectations.",forbes.com,https://www.forbes.com/sites/joanverdon/2023/08/17/walmart-delivered-a-winning-161-billion-quarter-and-out-played-target/,https://images.financialmodelingprep.com/news/walmart-delivered-a-winning-161-billion-quarter-and-outplayed-20230817.jpg
WMT,2023-08-17,2023-08-03,2023-08-31,WMT,,2023-08-17 14:16:00,2023-08-17T14:16:00-04:00,2023-08-17,"Walmart's ‘shrink' challenges differ from those of other retail giants, CEO says","Like many retailers, Walmart Inc. is dealing with inventory “shrink,” although CEO Doug McMillon says the company's specific challenges are different from those faced by other big retailers.",marketwatch.com,https://www.marketwatch.com/story/walmarts-shrink-challenges-differ-from-those-of-other-retail-giants-ceo-says-1705c830,https://images.financialmodelingprep.com/news/walmarts-shrink-challenges-differ-from-those-of-other-retail-20230817.jpg
WMT,2023-08-17,2023-08-03,2023-08-31,WMT,,2023-08-17 12:44:09,2023-08-17T12:44:09-04:00,2023-08-17,Walmart Inc. (WMT) Q2 2024 Earnings Call Transcript,"Walmart Inc. (NYSE:WMT ) Q2 2024 Earnings Conference Call August 17, 2023 8:00 AM ET Company Participants Steph Wissink - Senior Vice President, Investor Relations Doug McMillon - CEO John David Rainey - CFO John Furner - CEO, Walmart U.S. Judith McKenna - CEO, Walmart International Kathryn McLay - CEO, Sam's Club Conference Call Participants Robbie Ohmes - Bank of America Katharine McShane - Goldman Sachs Oliver Chen - TD Cowen Rupesh Parikh - Oppenheimer Paul Lejuez - Citi Simeon Gutman - Morgan Stanley Kelly Bania - BMO Capital Markets Edward Yruma - Piper Sandler Seth Sigman - Barclays Corey Tarlowe - Jefferies Krisztina Katai - Deutsche Bank Michael Lasser - UBS Operator Greetings. Welcome to Walmart's Fiscal Year 2024 Second Quarter Earnings Call.",seekingalpha.com,https://seekingalpha.com/article/4629315-walmart-inc-wmt-q2-2024-earnings-call-transcript,https://images.financialmodelingprep.com/news/walmart-inc-wmt-q2-2024-earnings-call-transcript-20230817.jpg
WMT,2023-08-17,2023-08-03,2023-08-31,WMT,,2023-08-17 12:31:47,2023-08-17T12:31:47-04:00,2023-08-17,"Walmart (WMT) Q2 Earnings & Sales Top Estimates, View Raised",Walmart's (WMT) second-quarter fiscal 2024 results reflect sales growth across all segments. The company gains from strong comp sales growth globally and a robust omnichannel model.,zacks.com,https://www.zacks.com/stock/news/2137597/walmart-wmt-q2-earnings-sales-top-estimates-view-raised,https://images.financialmodelingprep.com/news/walmart-wmt-q2-earnings-sales-top-estimates-view-raised-20230817.jpg
WMT,2023-08-17,2023-08-03,2023-08-31,WMT,,2023-08-17 12:30:00,2023-08-17T12:30:00-04:00,2023-08-17,"Generative AI will ‘unlock value' for Walmart shareholders, says CEO",Generative AI technology can be trained to harness vast quantities of data and generate carefully tailored content.,marketwatch.com,https://www.marketwatch.com/story/generative-ai-will-unlock-value-for-walmart-shareholders-says-ceo-b40ac994,https://images.financialmodelingprep.com/news/generative-ai-will-unlock-value-for-walmart-shareholders-says-20230817.jpg
WMT,2023-08-17,2023-08-03,2023-08-31,WMT,,2023-08-17 12:17:55,2023-08-17T12:17:55-04:00,2023-08-17,Walmart stock pinned-back as fear of malaise distracts investors from otherwise upbeat earnings,"Walmart Inc (NYSE:WMT) stock traded nearly 2% lower in Thursday's exchanges in New York despite fairly upbeat earnings from the supermarket retailer, with a broader macroeconomic malaise cited for the tepid reaction on Wall Street. The Bentonville, Arkansas-based firm earlier today raised its guidance for the second quarter in a row after reporting revenue and earnings above expectations.",proactiveinvestors.com,https://www.proactiveinvestors.com/companies/news/1023875?SNAPI,https://images.financialmodelingprep.com/news/walmart-stock-pinnedback-as-fear-of-malaise-distracts-investors-20230817.jpg
WMT,2023-08-17,2023-08-03,2023-08-31,WMT,,2023-08-17 11:46:05,2023-08-17T11:46:05-04:00,2023-08-17,"Jobless Claims Down, Philly Fed Up; Walmart Beats & Raises","With new Jobless Claims down to 239K and the Philly Fed positive for the first time in a year, Walmart impressed in Q2 this morning.",zacks.com,https://www.zacks.com/stock/news/2137559/jobless-claims-down-philly-fed-up-walmart-beats-raises,https://images.financialmodelingprep.com/news/jobless-claims-down-philly-fed-up-walmart-beats-raises-20230817.jpg
WMT,2023-08-17,2023-08-03,2023-08-31,WMT,,2023-08-17 11:46:04,2023-08-17T11:46:04-04:00,2023-08-17,Weekly Jobless Claims Lag Expectations,Weekly Jobless Claims Lag Expectations.,zacks.com,https://www.zacks.com/stock/news/2137579/weekly-jobless-claims-lag-expectations,https://images.financialmodelingprep.com/news/weekly-jobless-claims-lag-expectations-20230817.jpg
WMT,2023-08-17,2023-08-03,2023-08-31,WMT,,2023-08-17 11:02:32,2023-08-17T11:02:32-04:00,2023-08-17,Walmart (WMT) Q2 Earnings: Taking a Look at Key Metrics Versus Estimates,"While the top- and bottom-line numbers for Walmart (WMT) give a sense of how the business performed in the quarter ended July 2023, it could be worth looking at how some of its key metrics compare to Wall Street estimates and year-ago values.",zacks.com,https://www.zacks.com/stock/news/2137484/walmart-wmt-q2-earnings-taking-a-look-at-key-metrics-versus-estimates,https://images.financialmodelingprep.com/news/walmart-wmt-q2-earnings-taking-a-look-at-key-20230817.jpg
WMT,2023-08-17,2023-08-03,2023-08-31,WMT,,2023-08-17 10:57:00,2023-08-17T10:57:00-04:00,2023-08-17,"Walmart customers' household budgets still under pressure, CEO says","Walmart Inc. customers are buying more grocery staples and “in-home meal options” as household budgets remain under pressure, according to CEO Doug McMillon.",marketwatch.com,https://www.marketwatch.com/story/walmart-customers-household-budgets-still-under-pressure-ceo-says-46da0a60,https://images.financialmodelingprep.com/news/walmart-customers-household-budgets-still-under-pressure-ceo-says-20230817.jpg
WMT,2023-08-17,2023-08-03,2023-08-31,WMT,,2023-08-17 10:27:58,2023-08-17T10:27:58-04:00,2023-08-17,3 Best Defensive Stocks to Protect Your Portfolio in August 2023,"As economic tides turn, households tighten up their wallets and cut spending wherever possible. This means keeping a close eye on all “nice to have” expenses like entertainment, new tech, and even vehicle upgrades.",investorplace.com,https://investorplace.com/2023/08/3-best-defensive-stocks-to-protect-your-portfolio-in-august-2023/,https://images.financialmodelingprep.com/news/3-best-defensive-stocks-to-protect-your-portfolio-in-20230817.png
WMT,2023-08-17,2023-08-03,2023-08-31,WMT,,2023-08-17 10:26:18,2023-08-17T10:26:18-04:00,2023-08-17,Walmart reports solid eCommerce sales for Q2: ‘it's gaining share from Amazon',Walmart Inc (NYSE: WMT) had a strong second quarter as it continued to gain share in groceries resulting in strong food sales. Walmart's guidance for the future Shares of the retail behemoth opened slightly up today on guidance that was roughly in line with expectations as well.,invezz.com,https://invezz.com/news/2023/08/17/walmart-q2-earnings-forrester-retail-analyst-view/?utm_source=snapi,https://images.financialmodelingprep.com/news/walmart-reports-solid-ecommerce-sales-for-q2-its-gaining-20230817.jpg
WMT,2023-08-17,2023-08-03,2023-08-31,WMT,,2023-08-17 10:22:44,2023-08-17T10:22:44-04:00,2023-08-17,Walmart profits soar as Target takes major hit over ‘woke' merchandise,"Walmart's second-quarter earnings release showed that e-commerce and international sales increased by 24% and 11%, respectively -- a stark difference from rival Target, which had a dismal quarter attributed to backlash over its Pride line.",nypost.com,https://nypost.com/2023/08/17/walmart-profits-soar-as-target-takes-hit-over-woke-items/,https://images.financialmodelingprep.com/news/walmart-profits-soar-as-target-takes-major-hit-over-20230817.jpg
WMT,2023-08-17,2023-08-03,2023-08-31,WMT,,2023-08-17 10:15:54,2023-08-17T10:15:54-04:00,2023-08-17,"Walmart raises outlook as food, online sales boom","Walmart shoppers are doing just that, shopping across the board, which allowed the world's biggest retailer to raise its full-year outlook for profits and sales.",foxbusiness.com,https://www.foxbusiness.com/markets/walmart-raises-outlook-food-online-sales,https://images.financialmodelingprep.com/news/walmart-raises-outlook-as-food-online-sales-boom-20230817.jpg
WMT,2023-08-17,2023-08-03,2023-08-31,WMT,,2023-08-17 10:08:21,2023-08-17T10:08:21-04:00,2023-08-17,Walmart Stock Options Pop After Beat-and-Raise,Walmart Inc   (NYSE:WMT)  raised its full-year outlook following second-quarter earnings and revenue wins.,schaeffersresearch.com,https://www.schaeffersresearch.com/content/news/2023/08/17/walmart-stock-options-pop-after-beat-and-raise,https://images.financialmodelingprep.com/news/walmart-stock-options-pop-after-beatandraise-20230817.jpg
WMT,2023-08-17,2023-08-03,2023-08-31,WMT,,2023-08-17 09:46:49,2023-08-17T09:46:49-04:00,2023-08-17,Walmart Shares Rally To Near All-Time High As Retailer Cashes In On Tight Budgets,Walmart apparently benefitted from anti-Pride backlash that dragged on rival Target's sales.,forbes.com,https://www.forbes.com/sites/dereksaul/2023/08/17/walmart-shares-rally-to-near-all-time-high-as-retailer-cashes-in-on-tight-budgets/,https://images.financialmodelingprep.com/news/walmart-shares-rally-to-near-alltime-high-as-retailer-20230817.jpg
WMT,2023-08-17,2023-08-03,2023-08-31,WMT,,2023-08-17 09:31:22,2023-08-17T09:31:22-04:00,2023-08-17,Walmart (WMT) Q2 Earnings and Revenues Beat Estimates,"Walmart (WMT) came out with quarterly earnings of $1.84 per share, beating the Zacks Consensus Estimate of $1.69 per share. This compares to earnings of $1.77 per share a year ago.",zacks.com,https://www.zacks.com/stock/news/2137365/walmart-wmt-q2-earnings-and-revenues-beat-estimates,https://images.financialmodelingprep.com/news/walmart-wmt-q2-earnings-and-revenues-beat-estimates-20230817.jpg
WMT,2023-08-17,2023-08-03,2023-08-31,WMT,,2023-08-17 09:09:54,2023-08-17T09:09:54-04:00,2023-08-17,The 2 Dow Stocks Investors Are Watching Thursday,The Dow has been less volatile than other stock market indexes lately. Cisco Systems saw its stock rise after reporting good results in its latest quarter.,fool.com,https://www.fool.com/investing/2023/08/17/the-2-dow-stocks-investors-are-watching-thursday/,https://images.financialmodelingprep.com/news/the-2-dow-stocks-investors-are-watching-thursday-20230817.jpg
WMT,2023-08-17,2023-08-03,2023-08-31,WMT,,2023-08-17 09:02:06,2023-08-17T09:02:06-04:00,2023-08-17,Walmart Wins the Retail Wars: Target is Losing Ground,"Walmart's NYSE: WMT Q2 results confirm trends Target NYSE: TGT, Home Depot NYSE: HD, and TJX Companies NYSE: TJX suggested. Consumers are shifting away from big-ticket items and large projects in favor of smaller, non-discretionary items.",marketbeat.com,https://www.marketbeat.com/originals/walmart-wins-the-retail-wars-target-is-losing-ground/?utm_source=snapi,https://images.financialmodelingprep.com/news/walmart-wins-the-retail-wars-target-is-losing-ground-20230817.jpg
WMT,2023-08-17,2023-08-03,2023-08-31,WMT,,2023-08-17 09:00:00,2023-08-17T09:00:00-04:00,2023-08-17,This Underrated Retail Stock Could Outperform Walmart and Costco,"Traffic at Target stores was up in the first half of the year, more than at Costco and Walmart. Target may be a riskier buy than its two larger peers, but the stock trades at a deep discount.",fool.com,https://www.fool.com/investing/2023/08/17/this-underrated-retail-stock-could-outperform/,https://images.financialmodelingprep.com/news/this-underrated-retail-stock-could-outperform-walmart-and-costco-20230817.jpg
WMT,2023-08-17,2023-08-03,2023-08-31,WMT,,2023-08-17 08:48:55,2023-08-17T08:48:55-04:00,2023-08-17,"Premarket: Walmart, Dole, Cisco Systems, Wolfspeed, Synopsys and more","Walmart Inc (NYSE:WMT) saw back-n-forth dealing in premarket – at first popping up to trade near US$161, before falling back as opening bell approached. At US$157.98 the stock was down 0.8% with under an hour to the start of regular market hours.",proactiveinvestors.com,https://www.proactiveinvestors.com/companies/news/1023822?SNAPI,https://images.financialmodelingprep.com/news/premarket-walmart-dole-cisco-systems-wolfspeed-synopsys-and-more-20230817.jpg
WMT,2023-08-17,2023-08-03,2023-08-31,WMT,,2023-08-17 08:06:00,2023-08-17T08:06:00-04:00,2023-08-17,"Walmart Posts Another Strong Quarter, the Stock Shrugs. Here's Why.","The retailer raised guidance as earnings beat Wall Street expectations, driven by groceries.",barrons.com,https://www.barrons.com/articles/walmart-earnings-stock-price-retail-e6e1086c,https://images.financialmodelingprep.com/news/walmart-posts-another-strong-quarter-the-stock-shrugs-heres-20230817.jpg
WMT,2023-08-17,2023-08-03,2023-08-31,WMT,,2023-08-17 08:01:56,2023-08-17T08:01:56-04:00,2023-08-17,Walmart ups guidance as sales and profit tops forecast,"Walmart Inc (NYSE:WMT) raised its guidance for the second quarter in a row after reporting revenue and earnings above expectations. The Bentonville, Arkansas-based firm said the increase reflected ""Q2 upside, confidence in continued business momentum and ongoing customer response to its value proposition.",proactiveinvestors.com,https://www.proactiveinvestors.com/companies/news/1023812?SNAPI,https://images.financialmodelingprep.com/news/walmart-ups-guidance-as-sales-and-profit-tops-forecast-20230817.jpg
WMT,2023-08-17,2023-08-03,2023-08-31,WMT,,2023-08-17 07:31:38,2023-08-17T07:31:38-04:00,2023-08-17,Walmart's sales are surging,Target and Home Depot are slumping. But more shoppers are heading to Walmart for groceries and essentials.,cnn.com,https://www.cnn.com/2023/08/17/investing/walmart-q2-earnings/index.html,https://images.financialmodelingprep.com/news/walmarts-sales-are-surging-20230817.jpg
WMT,2023-08-17,2023-08-03,2023-08-31,WMT,,2023-08-17 07:14:00,2023-08-17T07:14:00-04:00,2023-08-17,Walmart's stock pops premarket after earnings top consensus estimates,"Walmart Inc.'s stock WMT, +0.05% rose 2% in premarket trade Thursday, after the retail giant posted better-than-expected second-quarter earnings. Bentonville, Arkansas-based Walmart had net income of $7.891 billion, or $2.92 a share, for the quarter, up from $5.149 billion, or $1.88 a share, in the year-earlier period.",marketwatch.com,https://www.marketwatch.com/story/walmarts-stock-pops-premarket-after-earnings-top-consensus-estimates-14b084c6,https://images.financialmodelingprep.com/news/walmarts-stock-pops-premarket-after-earnings-top-consensus-estimates-20230817.jpg
WMT,2023-08-17,2023-08-03,2023-08-31,WMT,,2023-08-17 07:02:00,2023-08-17T07:02:00-04:00,2023-08-17,Walmart revenue growth of 5.7%; operating income growing faster at 6.7%; eCommerce up 24% globally; GAAP EPS of $2.92; Adjusted EPS of $1.84; Guides Q3 and raises FY24 outlook,"BENTONVILLE, Ark.--(BUSINESS WIRE)--Walmart Inc. (NYSE: WMT): Second-quarter highlights: Consolidated revenue of $161.6 billion, up 5.7%, or 5.4% in constant currency Consolidated gross margin rate up 50bps on lapping elevated markdowns and supply chain costs, partially offset by ongoing mix pressure in grocery and health & wellness Consolidated operating expenses as a percentage of net sales grew 33bps Consolidated operating income up $0.5 billion, or 6.7%, adjusted operating income up 8.1.",businesswire.com,https://www.businesswire.com/news/home/20230816938547/en/Walmart-revenue-growth-of-5.7-operating-income-growing-faster-at-6.7-eCommerce-up-24-globally-GAAP-EPS-of-2.92-Adjusted-EPS-of-1.84-Guides-Q3-and-raises-FY24-outlook/,https://images.financialmodelingprep.com/news/walmart-revenue-growth-of-57-operating-income-growing-faster-20230817.jpg
WMT,2023-08-17,2023-08-03,2023-08-31,WMT,,2023-08-17 04:50:00,2023-08-17T04:50:00-04:00,2023-08-17,U.S. stock futures inch higher following latest sell-off with Walmart earnings in view,U.S. stock futures nudged higher early Thursday after falling to a six-week trough amid rising bond yields.,marketwatch.com,https://www.marketwatch.com/story/u-s-stock-futures-inch-higher-following-latest-sell-off-with-walmart-earnings-in-view-3cb43c44,https://images.financialmodelingprep.com/news/us-stock-futures-inch-higher-following-latest-selloff-with-20230817.jpg
WMT,2023-08-17,2023-08-03,2023-08-31,WMT,,2023-08-17 00:01:01,2023-08-17T00:01:01-04:00,2023-08-17,Walmart will report earnings before the bell — here's what to expect,Walmart has capitalized on its low-priced reputation as consumers look for value.,cnbc.com,https://www.cnbc.com/2023/08/17/walmart-wmt-earnings-q2-2024.html,https://images.financialmodelingprep.com/news/walmart-will-report-earnings-before-the-bell-heres-what-20230817.jpeg
WMT,2023-08-17,2023-08-03,2023-08-31,WMT,,2023-08-18 18:40:00,2023-08-18T18:40:00-04:00,2023-08-18,Blender Bites Launches into Walmart USA,"VANCOUVER, British Columbia, Aug. 18, 2023 (GLOBE NEWSWIRE) -- Blender Bites Ltd. (the “Company”, “Blender Bites” or “Blender”), (CSE: BITE, FWB: JL4, WKN: A3DMEJ), a multi award-winning Canadian company involved in the development and marketing of a line of premium, frozen functional beverages, is thrilled to announce its US subsidiary, Blender Bites US Ltd.",globenewswire.com,https://www.globenewswire.com/news-release/2023/08/18/2728278/0/en/Blender-Bites-Launches-into-Walmart-USA.html,https://images.financialmodelingprep.com/news/blender-bites-launches-into-walmart-usa-20230818.jpg
WMT,2023-08-17,2023-08-03,2023-08-31,WMT,,2023-08-18 11:49:12,2023-08-18T11:49:12-04:00,2023-08-18,ETFs to Bet on as Walmart Beats Q2 Earnings Estimates,"Walmart (WMT) reported robust second-quarter fiscal 2024 results, wherein it surpassed both earnings and revenue estimates and raised its outlook for the full year.",zacks.com,https://www.zacks.com/stock/news/2138077/etfs-to-bet-on-as-walmart-beats-q2-earnings-estimates,https://images.financialmodelingprep.com/news/etfs-to-bet-on-as-walmart-beats-q2-earnings-20230818.jpg
WMT,2023-08-17,2023-08-03,2023-08-31,WMT,,2023-08-18 11:44:53,2023-08-18T11:44:53-04:00,2023-08-18,Walmart strong 2Q results reflect market share gain among cost-conscious shoppers,Walmart Inc (NYSE:WMT) has impressed analysts with its strong second quarter financial results that outperformed Street expectations. UBS analysts wrote in a note to clients that the retailer's 2Q outperformance showed that its offering of convenience and value is resonating with cost-conscious customers and its productivity initiatives and success in its alternative businesses offer more room to run.,proactiveinvestors.com,https://www.proactiveinvestors.com/companies/news/1023988?SNAPI,https://images.financialmodelingprep.com/news/walmart-strong-2q-results-reflect-market-share-gain-among-costconscious-20230818.jpg
