ticker,event_date,window_start,window_end,symbol,symbols,publishedDate,publishedDateET,date_et,title,text,site,url,image
JNJ,2021-01-26,2021-01-12,2021-02-09,JNJ,,2021-01-22 10:17:27,2021-01-22T10:17:27-05:00,2021-01-22,J&J Snack Foods's Earnings: A Preview,"J&J Snack Foods (NASDAQ:JJSF) announces its next round of earnings this Monday, January 25. Here is Benzinga's everything-that-matters guide for this Monday's Q1 earnings announcement.",benzinga.com,https://www.benzinga.com/news/earnings/21/01/19274371/j-j-snack-foodss-earnings-a-preview,https://images.financialmodelingprep.com/news/jj-snack-foodss-earnings-a-preview-20210122.jpg
JNJ,2021-01-26,2021-01-12,2021-02-09,JNJ,,2021-01-22 11:17:06,2021-01-22T11:17:06-05:00,2021-01-22,"Q4 Earnings Come to Regional Banks: ALLY, HBAN & More",Most of the Big Banks have already posted for Q4; this morning we see a large share of Regional Banks reporting quarterly earnings.,zacks.com,https://www.zacks.com/stock/news/1250524/q4-earnings-come-to-regional-banks-ally-hban-more,https://images.financialmodelingprep.com/news/q4-earnings-come-to-regional-banks-ally-hban-more-20210122.jpg
JNJ,2021-01-26,2021-01-12,2021-02-09,JNJ,,2021-01-22 12:02:06,2021-01-22T12:02:06-05:00,2021-01-22,Regional Banks Post Mixed Earnings Results,Regional Banks Post Mixed Earnings Results.,zacks.com,https://www.zacks.com/stock/news/1250555/regional-banks-post-mixed-earnings-results,https://images.financialmodelingprep.com/news/regional-banks-post-mixed-earnings-results-20210122.jpg
JNJ,2021-01-26,2021-01-12,2021-02-09,JNJ,,2021-01-22 13:54:37,2021-01-22T13:54:37-05:00,2021-01-22,Sana Biotechnology Seeks $150 Million U.S. IPO,Sana Biotechnology Seeks $150 Million U.S. IPO,seekingalpha.com,https://seekingalpha.com/article/4400435-sana-biotechnology-seeks-150-million-u-s-ipo,https://images.financialmodelingprep.com/news/sana-biotechnology-seeks-150-million-us-ipo-20210122.jpg
JNJ,2021-01-26,2021-01-12,2021-02-09,JNJ,,2021-01-22 15:48:05,2021-01-22T15:48:05-05:00,2021-01-22,Q4 and 2021 Earnings Estimates Keep Going Up,Q4 and 2021 Earnings Estimates Keep Going Up,zacks.com,https://www.zacks.com/commentary/1250712/q4-and-2021-earnings-estimates-keep-going-up,https://images.financialmodelingprep.com/news/q4-and-2021-earnings-estimates-keep-going-up-20210122.jpg
JNJ,2021-01-26,2021-01-12,2021-02-09,JNJ,,2021-01-22 16:08:00,2021-01-22T16:08:00-05:00,2021-01-22,"Top Coronavirus Vaccine Makers Will Earn Up to $23 Billion in Revenue This Year, Says New Analysis",Moderna and Pfizer/BioNTech should rake in similar levels of revenue for their vaccines.,fool.com,https://www.fool.com/investing/2021/01/22/top-coronavirus-vaccine-makers-will-earn-up-to-23/,https://images.financialmodelingprep.com/news/top-coronavirus-vaccine-makers-will-earn-up-to-23-20210122.jpg
JNJ,2021-01-26,2021-01-12,2021-02-09,JNJ,,2021-01-23 18:13:00,2021-01-23T18:13:00-05:00,2021-01-23,The New York Post: Fauci says Johnson & Johnson COVID-19 vaccine may get approval in two weeks,"The first single-dose COVID-19 vaccine could get emergency approval in just two weeks, Dr. Anthony Fauci said late Friday.",marketwatch.com,https://www.marketwatch.com/story/fauci-says-johnson-johnson-covid-19-vaccine-may-get-approval-in-two-weeks-11611443596,https://images.financialmodelingprep.com/news/the-new-york-post-fauci-says-johnson-johnson-covid19-20210123.jpg
JNJ,2021-01-26,2021-01-12,2021-02-09,JNJ,,2021-01-24 05:04:50,2021-01-24T05:04:50-05:00,2021-01-24,Week 4 MDA Breakout Stocks - January 2021: Short-Term Picks To Give You An Edge,Two new breakout stocks for Week 4 of 2021 with better than 10% short-term upside potential. This past week 3 out of 4 stocks gained over 10% in a short trading week but gave back most of their gains closing for an avg loss of -4.1%. 2021 MDA portfolio returns are on record pace up +36.3% in the first three weeks with 10 out of 12 picks gaining more than 10% in less than a week.,seekingalpha.com,https://seekingalpha.com/article/4400583-week-4-mda-breakout-stocks-january-2021-short-term-picks-to-give-you-edge,https://images.financialmodelingprep.com/news/week-4-mda-breakout-stocks-january-2021-shortterm-picks-20210124.jpg
JNJ,2021-01-26,2021-01-12,2021-02-09,JNJ,,2021-01-24 07:10:00,2021-01-24T07:10:00-05:00,2021-01-24,Where to Invest $1 Million Right Now,"With a nest egg this sizable, you'll need to find more than one place to put your money so it keeps growing.",fool.com,https://www.fool.com/investing/2021/01/24/where-to-invest-1-million-right-now/,https://images.financialmodelingprep.com/news/where-to-invest-1-million-right-now-20210124.jpg
JNJ,2021-01-26,2021-01-12,2021-02-09,JNJ,,2021-01-24 09:15:00,2021-01-24T09:15:00-05:00,2021-01-24,3 Bargain Stocks You Can Buy Right Now,These dividend stocks all look like great long-term buys.,fool.com,https://www.fool.com/investing/2021/01/24/3-bargain-stocks-you-can-buy-right-now/,https://images.financialmodelingprep.com/news/3-bargain-stocks-you-can-buy-right-now-20210124.jpg
JNJ,2021-01-26,2021-01-12,2021-02-09,JNJ,,2021-01-24 16:39:12,2021-01-24T16:39:12-05:00,2021-01-24,Week In Review: Suzhou's Adagene To Stage $125 Million IPO On NASDAQ,Week In Review: Suzhou's Adagene To Stage $125 Million IPO On NASDAQ,seekingalpha.com,https://seekingalpha.com/article/4400664-week-in-review-suzhous-adagene-to-stage-125-million-ipo-on-nasdaq,https://images.financialmodelingprep.com/news/week-in-review-suzhous-adagene-to-stage-125-million-20210124.jpg
JNJ,2021-01-26,2021-01-12,2021-02-09,JNJ,,2021-01-25 07:00:00,2021-01-25T07:00:00-05:00,2021-01-25,Should You Buy Johnson & Johnson Stock At $160?,"Despite a 45% rise since the March 23 lows of last year, at the current price of around $161 per share we believe that pharmaceuticals bellwether, Johnson & Johnson, looks attractive and it can see more upside from the current levels. JNJ stock has rallied from $111 to $161, underperforming.",forbes.com,https://www.forbes.com/sites/greatspeculations/2021/01/25/should-you-buy-johnson--johnson-stock-at-160/,https://images.financialmodelingprep.com/news/should-you-buy-johnson-johnson-stock-at-160-20210125.jpg
JNJ,2021-01-26,2021-01-12,2021-02-09,JNJ,,2021-01-25 10:43:35,2021-01-25T10:43:35-05:00,2021-01-25,5 Biden-Friendly Warren Buffett Stocks to Load Up On,"With President Joe Biden now in the White House, these five Warren Buffett stocks have the advantage of attractive, stable returns. The post 5 Biden-Friendly Warren Buffett Stocks to Load Up On appeared first on InvestorPlace.",investorplace.com,https://investorplace.com/2021/01/5-biden-friendly-warren-buffett-stocks-to-load-up-on-ko-gm-jnj-tmus-mco/,https://images.financialmodelingprep.com/news/5-bidenfriendly-warren-buffett-stocks-to-load-up-on-20210125.jpeg
JNJ,2021-01-26,2021-01-12,2021-02-09,JNJ,,2021-01-25 11:13:11,2021-01-25T11:13:11-05:00,2021-01-25,"Don't Buy, Hold, And Hope For The Best","Don't Buy, Hold, And Hope For The Best",seekingalpha.com,https://seekingalpha.com/article/4400788-dont-buy-hold-and-hope-for-best,https://images.financialmodelingprep.com/news/dont-buy-hold-and-hope-for-the-best-20210125.jpg
JNJ,2021-01-26,2021-01-12,2021-02-09,JNJ,,2021-01-25 12:37:38,2021-01-25T12:37:38-05:00,2021-01-25,J&J may share findings from Phase 3 vaccine trial this week,"Shares of Johnson & Johnson were up 0.9% in trading on Monday, as the company nears the anticipated disclosure of interim results from a late-stage clinical trial evaluating its single-dose COVID-19 vaccine candidate. J&J said in mid-December it expects to share findings from the Phase 3 trial by the end of January, which would it the third company testing coronavirus vaccines in the U.S. to announce results from a closely watched Phase 3 trial.",marketwatch.com,https://www.marketwatch.com/story/jj-may-share-findings-from-phase-3-vaccine-trial-this-week-2021-01-25,https://images.financialmodelingprep.com/news/jj-may-share-findings-from-phase-3-vaccine-trial-20210125.jpeg
JNJ,2021-01-26,2021-01-12,2021-02-09,JNJ,,2021-01-25 15:17:00,2021-01-25T15:17:00-05:00,2021-01-25,The Market Is Looking to Johnson & Johnson for Hope After a Grim Morning,"After Moderna and Merck's news, the path for a swift vaccine rollout looks a bit rockier than it did last week.",barrons.com,https://www.barrons.com/articles/it-was-a-grim-morning-in-the-covid-19-fight-the-market-is-looking-to-johnson-johnson-for-hope-51611605861,https://images.financialmodelingprep.com/news/the-market-is-looking-to-johnson-johnson-for-hope-20210125.jpg
JNJ,2021-01-26,2021-01-12,2021-02-09,JNJ,,2021-01-25 16:19:02,2021-01-25T16:19:02-05:00,2021-01-25,J&J Snack Foods: Q1 Earnings Insights,"Shares of J&J Snack Foods (NASDAQ:JJSF) were flat in after-market trading after the company reported Q1 results. Quarterly Results Earnings per share fell 90.32% over the past year to $0.09, which missed the estimate of $0.20.",benzinga.com,https://www.benzinga.com/news/earnings/21/01/19308870/j-j-snack-foods-q1-earnings-insights,https://images.financialmodelingprep.com/news/jj-snack-foods-q1-earnings-insights-20210125.jpg
JNJ,2021-01-26,2021-01-12,2021-02-09,JNJ,,2021-01-25 16:36:51,2021-01-25T16:36:51-05:00,2021-01-25,"Covid Vaccines: Here's What J&J Has To Do To Undercut Pfizer, Moderna",Johnson & Johnson is expected soon to release test results for its coronavirus vaccine in a move that could rock vaccine stocks Pfizer and Moderna. Pfizer and Moderna have authorized drugs.,investors.com,https://www.investors.com/news/technology/vaccine-stocks-will-johnson-johnson-coronavirus-vaccine-undercut-pfizer-moderna/,https://images.financialmodelingprep.com/news/covid-vaccines-heres-what-jj-has-to-do-to-20210125.jpg
JNJ,2021-01-26,2021-01-12,2021-02-09,JNJ,,2021-01-25 17:21:16,2021-01-25T17:21:16-05:00,2021-01-25,"4 Top Stock Trades for Tuesday: GME, CLX, JNJ, MCD","GameStop, Clorox, Johnson & Johnson and McDonald's were our top stock trades for Tuesday. Now, let's look at the charts after a busy day.",investorplace.com,https://investorplace.com/2021/01/4-top-stock-trades-for-tuesday-gme-clx-jnj-mcd/,https://images.financialmodelingprep.com/news/4-top-stock-trades-for-tuesday-gme-clx-jnj-20210125.jpg
JNJ,2021-01-26,2021-01-12,2021-02-09,JNJ,,2021-01-25 17:24:00,2021-01-25T17:24:00-05:00,2021-01-25,J&J Snack stock drops 14% as earnings miss Street expectations,"J&J Snack Foods Corp. JJSF shares dropped after the snack food company's quarterly earnings fell short of Wall Street estimates. J&J Snack shares fell 14% after hours, following a 2.5% rise to close the session at $156.89.",marketwatch.com,https://www.marketwatch.com/story/j-j-snack-stock-drops-14-as-earnings-miss-street-expectations-11611613452,https://images.financialmodelingprep.com/news/jj-snack-stock-drops-14-as-earnings-miss-street-20210125.jpg
JNJ,2021-01-26,2021-01-12,2021-02-09,JNJ,,2021-01-25 18:03:08,2021-01-25T18:03:08-05:00,2021-01-25,J&J Snack Foods (JJSF) Lags Q1 Earnings Estimates,"J&J Snack Foods (JJSF) delivered earnings and revenue surprises of -35.71% and 7.21%, respectively, for the quarter ended December 2020. Do the numbers hold clues to what lies ahead for the stock?",zacks.com,https://www.zacks.com/stock/news/1251647/jj-snack-foods-jjsf-lags-q1-earnings-estimates,https://images.financialmodelingprep.com/news/jj-snack-foods-jjsf-lags-q1-earnings-estimates-20210125.jpg
JNJ,2021-01-26,2021-01-12,2021-02-09,JNJ,,2021-01-26 05:30:00,2021-01-26T05:30:00-05:00,2021-01-26,Johnson & Johnson's Vaccine Updates: When Will The Shot Be Available For Use?,"Johnson & Johnson's Covid-19 vaccine is one of the most closely watched shots against the novel coronavirus, given that it is backed by one of the world's largest pharma companies and is expected to require only a single dose. Here's a quick rundown of the expected timeline for the vaccine's.",forbes.com,https://www.forbes.com/sites/greatspeculations/2021/01/26/johnson--johnsons-vaccine-updates-when-will-the-shot-be-available-for-use/,https://images.financialmodelingprep.com/news/johnson-johnsons-vaccine-updates-when-will-the-shot-be-available-20210126.jpg
JNJ,2021-01-26,2021-01-12,2021-02-09,JNJ,,2021-01-26 06:09:00,2021-01-26T06:09:00-05:00,2021-01-26,Should You Buy Johnson & Johnson Stock Before Its Big Coronavirus Vaccine News?,The clock is definitely ticking.,fool.com,https://www.fool.com/investing/2021/01/26/should-you-buy-johnson-johnson-stock-before-its-bi/,https://images.financialmodelingprep.com/news/should-you-buy-johnson-johnson-stock-before-its-big-20210126.jpg
JNJ,2021-01-26,2021-01-12,2021-02-09,JNJ,,2021-01-26 06:30:01,2021-01-26T06:30:01-05:00,2021-01-26,"J&J beats fourth-quarter earnings expectations, will release Covid vaccine data 'soon'","The drug and and consumer products company reported adjusted earnings of $1.86 per share, higher than the $1.82 expected in a survey of analysts by Refinitiv.",cnbc.com,https://www.cnbc.com/2021/01/26/johnson-johnson-jnj-earnings-q4-2020.html,https://images.financialmodelingprep.com/news/jj-beats-fourthquarter-earnings-expectations-will-release-covid-vaccine-20210126.jpeg
JNJ,2021-01-26,2021-01-12,2021-02-09,JNJ,,2021-01-26 06:41:00,2021-01-26T06:41:00-05:00,2021-01-26,"Johnson & Johnson quarterly sales rise 8.3%, sees vaccine data ""soon""","Johnson & Johnson on Tuesday posted an 8.3% rise in quarterly sales and said it would share details from its keenly watched coronavirus vaccine trial soon, as the healthcare conglomerate races to develop a potential single-dose vaccine for COVID-19.",reuters.com,https://www.reuters.com/article/us-johnson-johnson-results/johnson-johnson-quarterly-sales-rise-8-3-sees-vaccine-data-soon-idUSKBN29V197,https://images.financialmodelingprep.com/news/johnson-johnson-quarterly-sales-rise-83-sees-vaccine-data-20210126.jpg
JNJ,2021-01-26,2021-01-12,2021-02-09,JNJ,,2021-01-26 06:42:00,2021-01-26T06:42:00-05:00,2021-01-26,Johnson & Johnson Reports 2020 Fourth-Quarter And Full Year Results,"NEW BRUNSWICK, N.J., Jan. 26, 2021 /PRNewswire/ -- Johnson & Johnson (NYSE: JNJ) today announced results for fourth-quarter and full year 2020. ""Our notable full year performance reflects the continued confidence from patients, physicians, customers and consumers in our life-enhancing...",prnewswire.com,https://www.prnewswire.com/news-releases/johnson--johnson-reports-2020-fourth-quarter-and-full-year-results-301214853.html,https://images.financialmodelingprep.com/news/johnson-johnson-reports-2020-fourthquarter-and-full-year-results-20210126.jpg
JNJ,2021-01-26,2021-01-12,2021-02-09,JNJ,,2021-01-26 07:31:19,2021-01-26T07:31:19-05:00,2021-01-26,"J&J beats earnings estimates in Q4, driven by a 16% jump in sales of Remicade","Shares of Johnson & Johnson were up 0.5% in premarket trading on Tuesday after the company had higher-than-expected sales in the fourth quarter, despite the ongoing impact of the COVID-19 pandemic on companies that sell medical products. J&J had earnings of $1.7 billion, or 65 cents per share, in the fourth of quarter of 2020, compared with $4.0 billion, or $1.50 per share, in the same quarter a year ago.",marketwatch.com,https://www.marketwatch.com/story/jj-beats-earnings-estimates-in-q4-driven-by-a-16-jump-in-sales-of-remicade-2021-01-26,https://images.financialmodelingprep.com/news/jj-beats-earnings-estimates-in-q4-driven-by-a-20210126.jpg
JNJ,2021-01-26,2021-01-12,2021-02-09,JNJ,,2021-01-26 08:33:09,2021-01-26T08:33:09-05:00,2021-01-26,Johnson & Johnson's sales jump to £16.35 billion in fiscal Q4,Johnson & Johnson (NYSE: JNJ) reported its financial results for the fiscal fourth quarter on Tuesday that topped Wall Street estimates despite the impact of the ongoing Coronavirus pandemic. J&J topped analysts' forecasts in the prior quarter (Q3) as well.,invezz.com,https://invezz.com/news/2021/01/26/johnsons-johnsons-sales-jump-to-16-35-billion-in-fiscal-q4/,https://images.financialmodelingprep.com/news/johnson-johnsons-sales-jump-to-1635-billion-in-fiscal-20210126.jpg
JNJ,2021-01-26,2021-01-12,2021-02-09,JNJ,,2021-01-26 09:02:10,2021-01-26T09:02:10-05:00,2021-01-26,Johnson & Johnson (JNJ) Tops Q4 Earnings and Revenue Estimates,"Johnson & Johnson (JNJ) delivered earnings and revenue surprises of 2.76% and 3.97%, respectively, for the quarter ended December 2020. Do the numbers hold clues to what lies ahead for the stock?",zacks.com,https://www.zacks.com/stock/news/1251790/johnson-johnson-jnj-tops-q4-earnings-and-revenue-estimates,https://images.financialmodelingprep.com/news/johnson-johnson-jnj-tops-q4-earnings-and-revenue-estimates-20210126.jpg
JNJ,2021-01-26,2021-01-12,2021-02-09,JNJ,,2021-01-26 09:27:49,2021-01-26T09:27:49-05:00,2021-01-26,"J&J Pops On Quarterly Beat, Will 'Soon' Release Covid Vaccine Test Results","Johnson & Johnson beat fourth-quarter estimates and said it would ""soon"" release pivotal test results for its coronavirus vaccine — leading JNJ stock to pop Tuesday. The post J&J Pops On Quarterly Beat, Will 'Soon' Release Covid Vaccine Test Results appeared first on Investor's Business Daily.",investors.com,https://www.investors.com/news/technology/jnj-stock-johnson-johnson-earnings-q4-2020/,https://images.financialmodelingprep.com/news/jj-pops-on-quarterly-beat-will-soon-release-covid-20210126.jpg
JNJ,2021-01-26,2021-01-12,2021-02-09,JNJ,,2021-01-26 09:31:41,2021-01-26T09:31:41-05:00,2021-01-26,"Sunny Outlook, Incoming Vaccine Data Lifts JNJ to Fresh Highs","Johnson & Johnson (NYSE:JNJ) stock is getting a boost this morning, last seen up 1.8% at an all-time high of $169, after the major company posted better-than-expected fiscal fourth quarter earnings, though profits dropped 56.7% due to litigation expenses.",schaeffersresearch.com,https://www.schaeffersresearch.com/content/news/2021/01/26/sunny-outlook-incoming-vaccine-data-lifts-jnj-to-fresh-highs,https://images.financialmodelingprep.com/news/sunny-outlook-incoming-vaccine-data-lifts-jnj-to-fresh-20210126.jpg
JNJ,2021-01-26,2021-01-12,2021-02-09,JNJ,,2021-01-26 09:59:40,2021-01-26T09:59:40-05:00,2021-01-26,J&J Covid-19 vaccine data due 'soon' as drug maker boosts outlook,The world's biggest maker of health care products topped profit and sales expectations.,foxbusiness.com,https://www.foxbusiness.com/markets/jj-covid-19-vaccine-data-due-soon-after-boosting-outlook,https://images.financialmodelingprep.com/news/jj-covid19-vaccine-data-due-soon-as-drug-maker-boosts-20210126.jpg
JNJ,2021-01-26,2021-01-12,2021-02-09,JNJ,,2021-01-26 11:15:47,2021-01-26T11:15:47-05:00,2021-01-26,Johnson & Johnson (JNJ) Surges to All-Time High,Johnson & Johnson (JNJ) stock has rallied to an all-time high in reaction to a strong quarter and next week's vaccine data release.,investopedia.com,https://www.investopedia.com/johnson-and-johnson-jnj-surges-to-all-time-high-5097426,https://images.financialmodelingprep.com/news/johnson-johnson-jnj-surges-to-alltime-high-20210126.jpg
JNJ,2021-01-26,2021-01-12,2021-02-09,JNJ,,2021-01-26 11:17:12,2021-01-26T11:17:12-05:00,2021-01-26,Housing Charges Economy: +9.5% Case Shiller & DHI's Earnings Beat,"Record-low interest rates, along with Americans moving away from the big cities, helped lead the housing formation run.",zacks.com,https://www.zacks.com/stock/news/1251894/housing-charges-economy-%2B95-case-shiller-dhis-earnings-beat,https://images.financialmodelingprep.com/news/housing-charges-economy-95-case-shiller-dhis-earnings-beat-20210126.jpg
JNJ,2021-01-26,2021-01-12,2021-02-09,JNJ,,2021-01-26 11:17:28,2021-01-26T11:17:28-05:00,2021-01-26,"J&J (JNJ) Q4 Earnings & Sales Beat, 2021 Guidance Upbeat",J&J (JNJ) beats fourth-quarter 2020 estimates for both earnings and sales. It issues its adjusted earnings and sales outlook for 2021.,zacks.com,https://www.zacks.com/stock/news/1251881/jj-jnj-q4-earnings-sales-beat-2021-guidance-upbeat,https://images.financialmodelingprep.com/news/jj-jnj-q4-earnings-sales-beat-2021-guidance-upbeat-20210126.jpeg
JNJ,2021-01-26,2021-01-12,2021-02-09,JNJ,,2021-01-26 11:23:16,2021-01-26T11:23:16-05:00,2021-01-26,Johnson & Johnson Shares Pop on Stronger-Than-Expected 4th-Quarter Results,Johnson & Johnson (NYSE:JNJ) released its fourth-quarter fiscal 2020 results before the opening bell on Jan. 26. The world's biggest maker of consumer health care products posted an earnings and revenue beat and provided a strong outlook for the full-year 2021.,gurufocus.com,https://www.gurufocus.com/news/1340903/johnson--johnson-shares-pop-on-strongerthanexpected-4thquarter-results,https://images.financialmodelingprep.com/news/johnson-johnson-shares-pop-on-strongerthanexpected-4thquarter-results-20210126.jpg
JNJ,2021-01-26,2021-01-12,2021-02-09,JNJ,,2021-01-26 11:30:00,2021-01-26T11:30:00-05:00,2021-01-26,Here's Why Investors Cheered Johnson & Johnson's Q4 Results,The healthcare giant beat Wall Street expectations in Q4 and gave encouraging guidance for 2021.,fool.com,https://www.fool.com/investing/2021/01/26/heres-why-investors-cheered-johnson-johnsons-q4-re/,https://images.financialmodelingprep.com/news/heres-why-investors-cheered-johnson-johnsons-q4-results-20210126.jpg
JNJ,2021-01-26,2021-01-12,2021-02-09,JNJ,,2021-01-26 11:39:37,2021-01-26T11:39:37-05:00,2021-01-26,Johnson & Johnson's CEO says crucial coronavirus vaccine data will come by early next week,"The world is days away from getting crucial results on one of the most important coronavirus vaccines in development. Johnson & Johnson CEO Alex Gorsky said Tuesday the healthcare giant will have results from a 45,000-person study testing its single-dose COVID-19 vaccine by early next week.",businessinsider.com,https://www.businessinsider.com/jj-single-dose-coronavirus-vaccine-data-to-come-within-days-2021-1,https://images.financialmodelingprep.com/news/johnson-johnsons-ceo-says-crucial-coronavirus-vaccine-data-will-20210126.jpg
JNJ,2021-01-26,2021-01-12,2021-02-09,JNJ,,2021-01-26 12:02:23,2021-01-26T12:02:23-05:00,2021-01-26,Home Prices Rose in November,Home Prices Rose in November,zacks.com,https://www.zacks.com/stock/news/1251901/home-prices-rose-in-november,https://images.financialmodelingprep.com/news/home-prices-rose-in-november-20210126.jpg
JNJ,2021-01-26,2021-01-12,2021-02-09,JNJ,,2021-01-26 12:39:05,2021-01-26T12:39:05-05:00,2021-01-26,J&J CEO: Expect Phase 3 results for its COVID-19 vaccine candidate early next week,"Johnson & Johnson expects to share details from the Phase 3 clinical trial for its COVID-19 vaccine candidate ""early next week,"" according to remarks made by CEO Alex Gorsky on Tuesday during an earnings call. J&J's stock was up 3.0% in trading on Tuesday afternoon.",marketwatch.com,https://www.marketwatch.com/story/jj-ceo-expect-phase-3-results-for-its-covid-19-vaccine-candidate-early-next-week-2021-01-26,https://images.financialmodelingprep.com/news/jj-ceo-expect-phase-3-results-for-its-covid19-20210126.jpg
JNJ,2021-01-26,2021-01-12,2021-02-09,JNJ,,2021-01-26 14:02:20,2021-01-26T14:02:20-05:00,2021-01-26,Johnson & Johnson (JNJ) CEO Alex Gorsky on Q4 2020 Results - Earnings Call Transcript,Johnson & Johnson (JNJ) CEO Alex Gorsky on Q4 2020 Results - Earnings Call Transcript,seekingalpha.com,https://seekingalpha.com/article/4401077-johnson-johnson-jnj-ceo-alex-gorsky-on-q4-2020-results-earnings-call-transcript,https://images.financialmodelingprep.com/news/johnson-johnson-jnj-ceo-alex-gorsky-on-q4-2020-results-20210126.jpg
JNJ,2021-01-26,2021-01-12,2021-02-09,JNJ,,2021-01-26 14:37:23,2021-01-26T14:37:23-05:00,2021-01-26,"Johnson & Johnson Sales Rise 8.3 Pct Amid Consumer Health, Pharmaceutical Growth","Johnson & Johnson reported on Tuesday (Jan. 26) as part of its financial results that reported sales grew by 8.3 percent from Q4 2019 to Q4 2020, as consumer health and pharmaceutical sales rose while medical devices worldwide operational sales fell amid the pandemic. The company reported that consumer health worldwide operational sales grew 3.1 […]",pymnts.com,https://www.pymnts.com/earnings/2021/johnson-johnson-sales-rise-8-3-pct-amid-consumer-health-pharmaceutical-growth/,https://images.financialmodelingprep.com/news/johnson-johnson-sales-rise-83-pct-amid-consumer-health-20210126.jpg
JNJ,2021-01-26,2021-01-12,2021-02-09,JNJ,,2021-01-26 14:40:31,2021-01-26T14:40:31-05:00,2021-01-26,Johnson & Johnson Rises on 4th-Quarter Earnings Beat,"Shares of Johnson & Johnson (NYSE:JNJ), a major drug manufacturer, climbed approximately 3% on Tuesday on the back of reporting fourth-quarter earnings results that topped analyst estimates.",gurufocus.com,https://www.gurufocus.com/news/1341335/johnson--johnson-rises-on-4thquarter-earnings-beat,https://images.financialmodelingprep.com/news/johnson-johnson-rises-on-4thquarter-earnings-beat-20210126.jpg
JNJ,2021-01-26,2021-01-12,2021-02-09,JNJ,,2021-01-26 21:10:00,2021-01-26T21:10:00-05:00,2021-01-26,"Johnson & Johnson Rises on Q4 Beats, Coronavirus Vaccine Hopes",The company promises that news about its vaccine is coming soon.,fool.com,https://www.fool.com/investing/2021/01/26/johnson-johnson-rises-on-q4-beats-coronavirus-vacc/,https://images.financialmodelingprep.com/news/johnson-johnson-rises-on-q4-beats-coronavirus-vaccine-hopes-20210126.jpg
JNJ,2021-01-26,2021-01-12,2021-02-09,JNJ,,2021-01-27 08:51:18,2021-01-27T08:51:18-05:00,2021-01-27,J&J vaccine data is imminent,"Hello, Walgreens is officially getting a new leader — Starbucks COO Roz Brewer has been named the retail pharmacy's next CEO. That'll make her the only Black woman leading a Fortune 500 company.",businessinsider.com,https://www.businessinsider.com/business-insiders-biggest-healthcare-stories-for-january-27-2021-1,https://images.financialmodelingprep.com/news/jj-vaccine-data-is-imminent-20210127.jpg
