ticker,event_date,window_start,window_end,symbol,symbols,publishedDate,publishedDateET,date_et,title,text,site,url,image
JNJ,2021-01-26,2021-01-12,2021-02-09,JNJ,,2021-02-01 22:57:26,2021-02-01T22:57:26-05:00,2021-02-01,Johnson & Johnson Vaccine's 66% Efficacy Figure Is Better Than It Looks,"Johnson & Johnson announced that its single-shot Covid-19 vaccine was 66% effective in preventing moderate and severe cases of Covid-19 in its global phase 3 trials. Efficacy varied by region, with the shot proving 72% effective in the U.S., 66% effective in Latin America, and around 57% effective.",forbes.com,https://www.forbes.com/sites/greatspeculations/2021/02/01/johnson--johnson-vaccines-66-efficacy-figure-is-better-than-it-looks/,https://images.financialmodelingprep.com/news/johnson-johnson-vaccines-66-efficacy-figure-is-better-than-20210201.jpg
JNJ,2021-01-26,2021-01-12,2021-02-09,JNJ,,2021-02-02 05:52:00,2021-02-02T05:52:00-05:00,2021-02-02,Is Moderna Stock a Buy or Sell After Johnson & Johnson's Vaccine News?,It's complicated.,fool.com,https://www.fool.com/investing/2021/02/02/is-moderna-stock-a-buy-or-sell-after-johnson-johns/,https://images.financialmodelingprep.com/news/is-moderna-stock-a-buy-or-sell-after-johnson-20210202.jpg
JNJ,2021-01-26,2021-01-12,2021-02-09,JNJ,,2021-02-02 08:00:00,2021-02-02T08:00:00-05:00,2021-02-02,Johnson & Johnson Vision Receives FDA Approval For Next Generation Monofocal Intraocular Lens - TECNIS Eyhance™ And TECNIS Eyhance™ Toric II IOLs - For The Treatment Of Cataract Patients,"SANTA ANA, Calif., Feb. 2, 2021 /PRNewswire/ -- Johnson & Johnson Vision**, a global leader in eye health and part of the Johnson & Johnson Medical Devices Companies***, today announced that the U.S. Food and Drug Administration (FDA) approved the TECNIS Eyhance™ and TECNIS Eyhance™ Toric...",prnewswire.com,https://www.prnewswire.com/news-releases/johnson--johnson-vision-receives-fda-approval-for-next-generation-monofocal-intraocular-lens---tecnis-eyhance-and-tecnis-eyhance-toric-ii-iols---for-the-treatment-of-cataract-patients-301219587.html,https://images.financialmodelingprep.com/news/johnson-johnson-vision-receives-fda-approval-for-next-generation-20210202.jpg
JNJ,2021-01-26,2021-01-12,2021-02-09,JNJ,,2021-02-02 09:45:00,2021-02-02T09:45:00-05:00,2021-02-02,This One Stock Market Chart Will Make You a Smarter Investor,"Amid the craze, return to the basics.",fool.com,https://www.fool.com/investing/2021/02/02/this-one-stock-market-chart-will-make-you-a-smarte/,https://images.financialmodelingprep.com/news/this-one-stock-market-chart-will-make-you-a-20210202.jpg
JNJ,2021-01-26,2021-01-12,2021-02-09,JNJ,,2021-02-02 10:09:53,2021-02-02T10:09:53-05:00,2021-02-02,8 Dividend Stocks With a Decade of Dividend Increases,"Dividend stocks aren't just about current yield, but payout growth over time. These 8 stocks have done a fantastic job hiking distributions.",investorplace.com,https://investorplace.com/2021/02/8-dividend-stocks-decade-dividend-increases/,https://images.financialmodelingprep.com/news/8-dividend-stocks-with-a-decade-of-dividend-increases-20210202.jpg
JNJ,2021-01-26,2021-01-12,2021-02-09,JNJ,,2021-02-02 13:53:38,2021-02-02T13:53:38-05:00,2021-02-02,Bolt Biotherapeutics Aims For $150 Million U.S. IPO,Bolt Biotherapeutics has filed proposed terms for a $150 million IPO. The firm is developing antibody conjugate treatments for various cancers.,seekingalpha.com,https://seekingalpha.com/article/4402758-bolt-biotherapeutics-aims-for-150-million-u-s-ipo,https://images.financialmodelingprep.com/news/bolt-biotherapeutics-aims-for-150-million-us-ipo-20210202.jpg
JNJ,2021-01-26,2021-01-12,2021-02-09,JNJ,,2021-02-02 14:49:00,2021-02-02T14:49:00-05:00,2021-02-02,Pfizer Increased Vaccine Sales Estimate After AstraZeneca and J&J Stumbles,Pfizer CEO Albert Bourla says he has grown more confident about the outlook for the vaccine.,barrons.com,https://www.barrons.com/articles/pfizer-increased-vaccine-sales-estimate-after-astrazeneca-and-j-j-stumbles-51612295394,https://images.financialmodelingprep.com/news/pfizer-increased-vaccine-sales-estimate-after-astrazeneca-and-jj-20210202.jpg
JNJ,2021-01-26,2021-01-12,2021-02-09,JNJ,,2021-02-03 06:45:00,2021-02-03T06:45:00-05:00,2021-02-03,3 Stocks I Can't Wait to Buy When the Stock Market Crashes Again,"If stocks drop 50% tomorrow, do you have your shopping list ready?",fool.com,https://www.fool.com/investing/2021/02/03/3-stocks-i-cant-wait-to-buy-when-the-stock-market/,https://images.financialmodelingprep.com/news/3-stocks-i-cant-wait-to-buy-when-the-20210203.jpg
JNJ,2021-01-26,2021-01-12,2021-02-09,JNJ,,2021-02-04 17:35:00,2021-02-04T17:35:00-05:00,2021-02-04,Johnson & Johnson Announces Submission of Application to the U.S. FDA for Emergency Use Authorization of its Investigational Single-Shot Janssen COVID-19 Vaccine Candidate,"NEW BRUNSWICK, N.J., Feb. 4, 2021 /PRNewswire/ -- Johnson & Johnson (NYSE: JNJ) (the Company) today announced that Janssen Biotech, Inc., has submitted an application to the U.S. Food and Drug Administration (FDA) requesting Emergency Use Authorization (EUA) for its investigational...",prnewswire.com,https://www.prnewswire.com/news-releases/johnson--johnson-announces-submission-of-application-to-the-us-fda-for-emergency-use-authorization-of-its-investigational-single-shot-janssen-covid-19-vaccine-candidate-301222768.html,https://images.financialmodelingprep.com/news/johnson-johnson-announces-submission-of-application-to-the-us-20210204.jpg
JNJ,2021-01-26,2021-01-12,2021-02-09,JNJ,,2021-02-04 17:52:36,2021-02-04T17:52:36-05:00,2021-02-04,Johnson & Johnson requests emergency authorization from FDA for Covid vaccine,"If J&J's application is approved, it would be the third authorized for emergency use in the U.S. behind vaccines developed by Pfizer-BioNTech and Moderna.",cnbc.com,https://www.cnbc.com/2021/02/04/covid-vaccine-jj-requests-fda-emergency-use-authorization.html,https://images.financialmodelingprep.com/news/johnson-johnson-requests-emergency-authorization-from-fda-for-covid-vaccine-20210204.jpeg
JNJ,2021-01-26,2021-01-12,2021-02-09,JNJ,,2021-02-04 17:57:42,2021-02-04T17:57:42-05:00,2021-02-04,J&J submits application for its COVID-19 shot to the FDA,"Shares of Johnson & Johnson gained 1.2% in after-hours trading on Thursday after the company announced that it had submitted an application for an emergency use authorization to the Food and Drug Administration for its COVID-19 vaccine candidate. The experimental single-dose COVID vaccine was 72% effective at preventing symptomatic disease in the U.S. arm of the Phase 3 clinical trial, according to findings released Jan. 29.",marketwatch.com,https://www.marketwatch.com/story/jj-submits-application-for-its-covid-19-shot-to-the-fda-2021-02-04,https://images.financialmodelingprep.com/news/jj-submits-application-for-its-covid19-shot-to-the-20210204.jpeg
JNJ,2021-01-26,2021-01-12,2021-02-09,JNJ,,2021-02-04 18:14:49,2021-02-04T18:14:49-05:00,2021-02-04,Johnson & Johnson Files For Covid Vaccine Emergency Use Authorization,A third Covid vaccine could soon be available in the United States.,forbes.com,https://www.forbes.com/sites/nicholasreimann/2021/02/04/johnson--johnson-files-for-covid-vaccine-emergency-use-authorization/,https://images.financialmodelingprep.com/news/johnson-johnson-files-for-covid-vaccine-emergency-use-authorization-20210204.jpg
JNJ,2021-01-26,2021-01-12,2021-02-09,JNJ,,2021-02-04 19:04:00,2021-02-04T19:04:00-05:00,2021-02-04,Johnson & Johnson Seeks Emergency Authorization for Covid Vaccine,Johnson & Johnson said it expects to supply 100 million doses to the U.S. in the first half of the year.,barrons.com,https://www.barrons.com/articles/johnson-johnson-seeks-emergency-authorization-for-covid-vaccine-the-stock-moved-higher-51612483452,https://images.financialmodelingprep.com/news/johnson-johnson-seeks-emergency-authorization-for-covid-vaccine-20210204.jpg
JNJ,2021-01-26,2021-01-12,2021-02-09,JNJ,,2021-02-04 22:53:21,2021-02-04T22:53:21-05:00,2021-02-04,Johnson & Johnson Seeks US Emergency Approval For Single Dose COVID-19 Vaccine,Johnson & Johnson (NYSE: JNJ) said Wednesday that its subsidiary Janssen Biotech Inc is requesting approval from the United States Food and Drug Administration for its single-dose COVID-19 vaccine candidate. What Happened: The multinational pharma company said in a statement that it is asking for an emergency use authorization from the FDA based on the results of the vaccine's Phase 3 clinical trial.,benzinga.com,https://www.benzinga.com/general/biotech/21/02/19504227/johnson-johnson-seeks-us-emergency-approval-for-single-dose-covid-19-vaccine,https://images.financialmodelingprep.com/news/johnson-johnson-seeks-us-emergency-approval-for-single-dose-20210204.jpg
JNJ,2021-01-26,2021-01-12,2021-02-09,JNJ,,2021-02-05 05:59:00,2021-02-05T05:59:00-05:00,2021-02-05,Global Stocks Cheered by JNJ Vaccine News as Investors Wait for U.S. Payrolls Data,U.S. stock futures are inching up and European equities are climbing after a record session on Wall Street. Payrolls data are in the spotlight as is Covid-19 vaccine news.,barrons.com,https://www.barrons.com/articles/global-stocks-cheered-by-jnj-vaccine-news-as-investors-wait-for-u-s-payrolls-data-51612522775,https://images.financialmodelingprep.com/news/global-stocks-cheered-by-jnj-vaccine-news-as-investors-20210205.jpg
JNJ,2021-01-26,2021-01-12,2021-02-09,JNJ,,2021-02-05 06:25:00,2021-02-05T06:25:00-05:00,2021-02-05,Is Johnson & Johnson a Great Dividend Stock?,The company has been increasing its payouts for decades.,fool.com,https://www.fool.com/investing/2021/02/05/is-johnson-johnson-a-great-dividend-stock/,https://images.financialmodelingprep.com/news/is-johnson-johnson-a-great-dividend-stock-20210205.jpg
JNJ,2021-01-26,2021-01-12,2021-02-09,JNJ,,2021-02-05 07:31:31,2021-02-05T07:31:31-05:00,2021-02-05,FDA schedules advisory committee for J&J's COVID-19 vaccine candidate for Feb. 26,A Food and Drug Administration advisory committee is now scheduled to meet Feb. 26 for an all-day meeting to discuss Johnson & Johnson's COVID-19 vaccine candidate. This is the next step in the regulatory process after J&J said Thursday it has submitted an application for its experimental vaccine to the FDA.,marketwatch.com,https://www.marketwatch.com/story/fda-schedules-advisory-committee-for-jjs-covid-19-vaccine-candidate-for-feb-26-2021-02-05,https://images.financialmodelingprep.com/news/fda-schedules-advisory-committee-for-jjs-covid19-vaccine-candidate-20210205.jpg
JNJ,2021-01-26,2021-01-12,2021-02-09,JNJ,,2021-02-05 10:30:00,2021-02-05T10:30:00-05:00,2021-02-05,Johnson & Johnson Stock Belongs In Every Portfolio,Johnson & Johnson Stock Belongs In Every Portfolio,seekingalpha.com,https://seekingalpha.com/article/4403797-johnson-johnson-stock-belongs-in-every-portfolio,https://images.financialmodelingprep.com/news/johnson-johnson-stock-belongs-in-every-portfolio-20210205.jpg
JNJ,2021-01-26,2021-01-12,2021-02-09,JNJ,,2021-02-05 11:43:50,2021-02-05T11:43:50-05:00,2021-02-05,"J&J, Novavax Ask FDA To Authorize Covid Vaccines — Shares Surge Higher","Johnson & Johnson and Novavax asked the Food and Drug Administration to authorize their coronavirus vaccines late Thursday — and both vaccine stocks jumped Friday. The post J&J, Novavax Ask FDA To Authorize Covid Vaccines — Shares Surge Higher appeared first on Investor's Business Daily.",investors.com,https://www.investors.com/news/technology/vaccine-stock-johnson-johnson-asks-fda-covid-vaccine-nod-branch/,https://images.financialmodelingprep.com/news/jj-novavax-ask-fda-to-authorize-covid-vaccines-shares-surge-20210205.jpg
JNJ,2021-01-26,2021-01-12,2021-02-09,JNJ,,2021-02-05 12:07:07,2021-02-05T12:07:07-05:00,2021-02-05,J&J (JNJ) Seeks Emergency Approval for Coronavirus Vaccine,Johnson & Johnson (JNJ) submits regulatory application to the FDA seeking emergency use approval for its single-shot coronavirus vaccine.,zacks.com,https://www.zacks.com/stock/news/1258382/jj-jnj-seeks-emergency-approval-for-coronavirus-vaccine,https://images.financialmodelingprep.com/news/jj-jnj-seeks-emergency-approval-for-coronavirus-vaccine-20210205.jpg
JNJ,2021-01-26,2021-01-12,2021-02-09,JNJ,,2021-02-05 13:38:16,2021-02-05T13:38:16-05:00,2021-02-05,Pharma ETFs in Focus Post Q4 Earnings,Healthcare Q4 results seem robust given that it is the fourth-best sector from a revenue growth look and the sixth-strongest in terms of earnings growth.,zacks.com,https://www.zacks.com/stock/news/1258521/pharma-etfs-in-focus-post-q4-earnings,https://images.financialmodelingprep.com/news/pharma-etfs-in-focus-post-q4-earnings-20210205.jpg
JNJ,2021-01-26,2021-01-12,2021-02-09,JNJ,,2021-02-05 15:00:00,2021-02-05T15:00:00-05:00,2021-02-05,When Will Johnson & Johnson's Coronavirus Vaccine Be Available?,"The clinical trial data was solid enough, but it'll be a few weeks before it could be authorized.",fool.com,https://www.fool.com/investing/2021/02/05/when-will-johnson-johnsons-coronavirus-vaccine-be/,https://images.financialmodelingprep.com/news/when-will-johnson-johnsons-coronavirus-vaccine-be-available-20210205.jpg
JNJ,2021-01-26,2021-01-12,2021-02-09,JNJ,,2021-02-06 05:59:00,2021-02-06T05:59:00-05:00,2021-02-06,2 Green Flags in Johnson & Johnson's Latest Earnings Report,Strong pharmaceutical sales and an impressive growth forecast gave investors reasons to smile.,fool.com,https://www.fool.com/investing/2021/02/06/2-green-flags-in-johnson-johnsons-latest-earnings/,https://images.financialmodelingprep.com/news/2-green-flags-in-johnson-johnsons-latest-earnings-report-20210206.jpg
JNJ,2021-01-26,2021-01-12,2021-02-09,JNJ,,2021-02-06 06:32:00,2021-02-06T06:32:00-05:00,2021-02-06,Johnson & Johnson's Vaccine Is Less Effective Than Rivals. Here's Why It Could Still Win Big,There's good news for those organizing vaccine logistics and the people sticking out an arm.,fool.com,https://www.fool.com/investing/2021/02/06/johnson-johnsons-vaccine-is-less-effective-than-ri/,https://images.financialmodelingprep.com/news/johnson-johnsons-vaccine-is-less-effective-than-rivals-heres-20210206.jpg
JNJ,2021-01-26,2021-01-12,2021-02-09,JNJ,,2021-02-06 13:03:19,2021-02-06T13:03:19-05:00,2021-02-06,Week 6 MDA Breakout Stocks - February 2021: Short-Term Picks To Give You An Edge,Week 6 MDA Breakout Stocks - February 2021: Short-Term Picks To Give You An Edge,seekingalpha.com,https://seekingalpha.com/article/4404108-week-6-mda-breakout-stocks-february-2021-short-term-picks-to-give-you-edge,https://images.financialmodelingprep.com/news/week-6-mda-breakout-stocks-february-2021-shortterm-picks-20210206.jpg
JNJ,2021-01-26,2021-01-12,2021-02-09,JNJ,,2021-02-07 07:07:00,2021-02-07T07:07:00-05:00,2021-02-07,3 Stocks to Bankroll Your Retirement,How does a 4.6% dividend yield sound?,fool.com,https://www.fool.com/investing/2021/02/07/3-stocks-to-bankroll-your-retirement/,https://images.financialmodelingprep.com/news/3-stocks-to-bankroll-your-retirement-20210207.jpg
JNJ,2021-01-26,2021-01-12,2021-02-09,JNJ,,2021-02-07 08:58:00,2021-02-07T08:58:00-05:00,2021-02-07,1 Big Problem in Johnson & Johnson's Latest Earnings Call,The coronavirus pandemic continues to pressure one of the company's big operating segments.,fool.com,https://www.fool.com/investing/2021/02/07/1-big-problem-in-johnson-johnsons-latest-earnings/,https://images.financialmodelingprep.com/news/1-big-problem-in-johnson-johnsons-latest-earnings-call-20210207.jpg
JNJ,2021-01-26,2021-01-12,2021-02-09,JNJ,,2021-02-07 14:54:52,2021-02-07T14:54:52-05:00,2021-02-07,Johnson & Johnson submits one-shot coronavirus vaccine for US approval,"Johnson & Johnson  Inc (NYSE:JNJ) said last night it has filed for emergency use authorisation of its one-dose Coronavirus (COVID-19) vaccine with US regulator, the Food & Drug Administration (FDA). The application follows the publication of trial data last month that showed the drug was 66% effective in preventing infections, though the figure was higher at 72% among US participants.",proactiveinvestors.co.uk,https://www.proactiveinvestors.co.uk//companies/news/940519/johnson--johnson-submits-one-shot-coronavirus-vaccine-for-us-approval-940519.html?SNAPI,https://images.financialmodelingprep.com/news/johnson-johnson-submits-oneshot-coronavirus-vaccine-for-us-approval-20210207.jpg
JNJ,2021-01-26,2021-01-12,2021-02-09,JNJ,,2021-02-08 10:19:00,2021-02-08T10:19:00-05:00,2021-02-08,Why Johnson & Johnson's Vaccine Data Is Actually Great News,"A few numbers from phase 3 trials stuck out for the wrong reasons. But looking closer, there's plenty to celebrate.",fool.com,https://www.fool.com/investing/2021/02/08/why-johnson-johnsons-vaccine-data-is-actually-grea/,https://images.financialmodelingprep.com/news/why-johnson-johnsons-vaccine-data-is-actually-great-news-20210208.jpg
JNJ,2021-01-26,2021-01-12,2021-02-09,JNJ,,2021-02-08 18:57:21,2021-02-08T18:57:21-05:00,2021-02-08,"New All-Time Highs for Dow, Nasdaq, S&P and Russell",We're not seeing any real earth-shattering developments that might be spurring the markets near-term; we see a lot of positive sentiment pivoting of the $1.9 trillion stimulus package.,zacks.com,https://www.zacks.com/stock/news/1259477/new-all-time-highs-for-dow-nasdaq-sp-and-russell,https://images.financialmodelingprep.com/news/new-alltime-highs-for-dow-nasdaq-sp-and-russell-20210208.jpg
JNJ,2021-01-26,2021-01-12,2021-02-09,JNJ,,2021-02-09 05:43:11,2021-02-09T05:43:11-05:00,2021-02-09,"Janssen's Erleada Plus, Zytiga Plus Prednisone Combo Treatment Shows Clinical Benefit In Late-Stage Prostate Cancer Study","Johnson & Johnson's (NYSE: JNJ) unit Janssen Pharmaceutical has announced results from Phase 3 ACIS study, evaluating the efficacy and safety of Erleada (apalutamide) and Zytiga (abiraterone) plus prednisone (treatment arm) compared to placebo and Zytiga plus prednisone (control arm) in prostate cancer patients with chemotherapy-naïve disease who received androgen deprivation therapy. JNJ will present the results at the American Society of Clinical Oncology's Genitourinary Cancers Symposium.",benzinga.com,https://www.benzinga.com/general/biotech/21/02/19556352/janssens-erleada-plus-zytiga-plus-prednisone-combo-treatment-shows-clinical-benefit-in-late-stage,https://images.financialmodelingprep.com/news/janssens-erleada-plus-zytiga-plus-prednisone-combo-treatment-shows-20210209.jpg
JNJ,2021-01-26,2021-01-12,2021-02-09,JNJ,,2021-02-09 06:09:00,2021-02-09T06:09:00-05:00,2021-02-09,How Will Johnson & Johnson's COVID Vaccine Affect Its Stock?,The answer is different for the long term than for the short term.,fool.com,https://www.fool.com/investing/2021/02/09/how-will-johnson-johnsons-covid-vaccine-affect-its/,https://images.financialmodelingprep.com/news/how-will-johnson-johnsons-covid-vaccine-affect-its-stock-20210209.jpg
JNJ,2021-01-26,2021-01-12,2021-02-09,JNJ,,2021-02-09 06:11:00,2021-02-09T06:11:00-05:00,2021-02-09,Here's Why Investors Should Remember These 2 Healthcare Lessons in 2021,"If you're thinking about investing in healthcare stocks this year, remember these two things.",fool.com,https://www.fool.com/investing/2021/02/09/heres-why-investors-should-remember-these-2-health/,https://images.financialmodelingprep.com/news/heres-why-investors-should-remember-these-2-healthcare-lessons-20210209.jpg
JNJ,2021-01-26,2021-01-12,2021-02-09,JNJ,,2021-02-09 13:27:58,2021-02-09T13:27:58-05:00,2021-02-09,7 Safe Stocks for Reddit's WSB Bull Gang,"The short-squeeze is putting negative selling pressure on a wide range of stocks, so investors need to carefully select the safest plays. The post 7 Safe Stocks for Reddit's WSB Bull Gang appeared first on InvestorPlace.",investorplace.com,https://investorplace.com/2021/02/7-safe-stocks-for-reddits-wsb-bull-gang/,https://images.financialmodelingprep.com/news/7-safe-stocks-for-reddits-wsb-bull-gang-20210209.jpg
JNJ,2021-01-26,2021-01-12,2021-02-09,JNJ,,2021-02-09 14:55:29,2021-02-09T14:55:29-05:00,2021-02-09,J&J CEO says people may need annual Covid vaccine shots for the next several years,,cnbc.com,https://www.cnbc.com/2021/02/09/covid-vaccine-jj-ceo-says-people-may-get-annual-shots-for-the-next-several-years.html,https://images.financialmodelingprep.com/news/jj-ceo-says-people-may-need-annual-covid-vaccine-20210209.jpg
JNJ,2021-01-26,2021-01-12,2021-02-09,JNJ,,2021-02-09 18:47:00,2021-02-09T18:47:00-05:00,2021-02-09,"Key Words: Expect to get COVID-19 shots for years to come, Johnson & Johnson CEO says","In an interview with CNBC, CEO Alex Gorsky said mutations of the coronavirus will necessitate changes to vaccines, much like annual flu shots.",marketwatch.com,https://www.marketwatch.com/story/expect-to-get-covid-19-shots-for-years-to-come-johnson-johnson-ceo-says-11612914428,https://images.financialmodelingprep.com/news/key-words-expect-to-get-covid19-shots-for-years-20210209.jpg
