ticker,event_date,window_start,window_end,symbol,symbols,publishedDate,publishedDateET,date_et,title,text,site,url,image
JNJ,2021-01-26,2021-01-12,2021-02-09,JNJ,,2021-01-27 12:28:17,2021-01-27T12:28:17-05:00,2021-01-27,"Breaking Up With Johnson & Johnson: It's Not You, It's Me","I believe Johnson & Johnson is overvalued, and offer a demonstration. I also believe that it is overvalued enough to warrant selling part of the position.",seekingalpha.com,https://seekingalpha.com/article/4401314-breaking-up-johnson-johnson-not-you-me,https://images.financialmodelingprep.com/news/breaking-up-with-johnson-johnson-its-not-you-its-20210127.jpg
JNJ,2021-01-26,2021-01-12,2021-02-09,JNJ,,2021-01-27 12:47:23,2021-01-27T12:47:23-05:00,2021-01-27,Johnson & Johnson (JNJ) is a Top Dividend Stock Right Now: Should You Buy?,"Dividends are one of the best benefits to being a shareholder, but finding a great dividend stock is no easy task. Does Johnson & Johnson (JNJ) have what it takes?",zacks.com,https://www.zacks.com/stock/news/1252643/johnson-johnson-jnj-is-a-top-dividend-stock-right-now-should-you-buy,https://images.financialmodelingprep.com/news/johnson-johnson-jnj-is-a-top-dividend-stock-right-20210127.jpg
JNJ,2021-01-26,2021-01-12,2021-02-09,JNJ,,2021-01-27 13:32:08,2021-01-27T13:32:08-05:00,2021-01-27,JNJ Touches New Highs Post Solid Q4 Earnings: ETFs in Focus,The solid results coupled with upbeat vaccine data optimism pushed JNJ shares to all-time high.,zacks.com,https://www.zacks.com/stock/news/1252728/jnj-touches-new-highs-post-solid-q4-earnings-etfs-in-focus,https://images.financialmodelingprep.com/news/jnj-touches-new-highs-post-solid-q4-earnings-etfs-20210127.jpg
JNJ,2021-01-26,2021-01-12,2021-02-09,JNJ,,2021-01-28 01:31:03,2021-01-28T01:31:03-05:00,2021-01-28,A Positive and Reassuring Earnings Picture,A Positive and Reassuring Earnings Picture,zacks.com,https://www.zacks.com/commentary/1252808/a-positive-and-reassuring-earnings-picture,https://images.financialmodelingprep.com/news/a-positive-and-reassuring-earnings-picture-20210128.jpg
JNJ,2021-01-26,2021-01-12,2021-02-09,JNJ,,2021-01-28 07:48:00,2021-01-28T07:48:00-05:00,2021-01-28,3 Great Stocks for Low-Risk Investors,You can count on steady growth in revenue and profit with these companies.,fool.com,https://www.fool.com/investing/2021/01/28/3-great-stocks-for-low-risk-investors/,https://images.financialmodelingprep.com/news/3-great-stocks-for-lowrisk-investors-20210128.jpg
JNJ,2021-01-26,2021-01-12,2021-02-09,JNJ,,2021-01-28 11:30:00,2021-01-28T11:30:00-05:00,2021-01-28,"If You're Retired, Consider Buying These 2 Stocks",These stocks allow you to focus on your retirement activities without worrying your investments will sour.,fool.com,https://www.fool.com/investing/2021/01/28/if-youre-retired-consider-buying-these-2-stocks/,https://images.financialmodelingprep.com/news/if-youre-retired-consider-buying-these-2-stocks-20210128.jpg
JNJ,2021-01-26,2021-01-12,2021-02-09,JNJ,,2021-01-28 12:02:36,2021-01-28T12:02:36-05:00,2021-01-28,5 Big Pharma/Biotech Stocks Set to Trump Q4 Earnings Estimates,Let us take a look at some drug/biotech stocks including Sanofi (SNY) and Merck (MRK) that are poised to beat fourth-quarter earnings estimates.,zacks.com,https://www.zacks.com/stock/news/1253404/5-big-pharma-biotech-stocks-set-to-trump-q4-earnings-estimates,https://images.financialmodelingprep.com/news/5-big-pharmabiotech-stocks-set-to-trump-q4-earnings-20210128.jpg
JNJ,2021-01-26,2021-01-12,2021-02-09,JNJ,,2021-01-28 12:42:00,2021-01-28T12:42:00-05:00,2021-01-28,This Company May Be the Next to Cross the Coronavirus Vaccine Finish Line,Stay tuned for phase 3 results in the coming days.,fool.com,https://www.fool.com/investing/2021/01/28/this-company-may-be-the-next-to-cross-the-coronavi/,https://images.financialmodelingprep.com/news/this-company-may-be-the-next-to-cross-the-20210128.jpg
JNJ,2021-01-26,2021-01-12,2021-02-09,JNJ,,2021-01-29 05:11:00,2021-01-29T05:11:00-05:00,2021-01-29,Johnson & Johnson To Start With 2 Million Doses COVID-19 Vaccine Supply,"Johnson & Johnson will start COVID-19 vaccine supply with 2 million doses on receiving an emergency use authorization in the U.S., according to Government Accountability Office (GAO) report.",benzinga.com,https://www.benzinga.com/general/biotech/21/01/19388031/johnson-johnson-to-start-with-2-million-doses-covid-19-vaccine-supply,https://images.financialmodelingprep.com/news/johnson-johnson-to-start-with-2-million-doses-covid19-20210129.jpg
JNJ,2021-01-26,2021-01-12,2021-02-09,JNJ,,2021-01-29 06:02:00,2021-01-29T06:02:00-05:00,2021-01-29,New to the Stock Market? 3 Investments You Can't Go Wrong With,These investments are perfect for beginners.,fool.com,https://www.fool.com/investing/2021/01/29/new-to-the-stock-market-3-investments-you-cant-go/,https://images.financialmodelingprep.com/news/new-to-the-stock-market-3-investments-you-cant-20210129.jpg
JNJ,2021-01-26,2021-01-12,2021-02-09,JNJ,,2021-01-29 07:23:00,2021-01-29T07:23:00-05:00,2021-01-29,Better Coronavirus Stock: Johnson & Johnson vs. Pfizer,"Pfizer already is putting its COVID-19 vaccine into people's arms, while Johnson & Johnson's is waiting to be approved.",fool.com,https://www.fool.com/investing/2021/01/29/better-coronavirus-stock-johnson-johnson-vs-pfizer/,https://images.financialmodelingprep.com/news/better-coronavirus-stock-johnson-johnson-vs-pfizer-20210129.jpg
JNJ,2021-01-26,2021-01-12,2021-02-09,JNJ,,2021-01-29 08:00:00,2021-01-29T08:00:00-05:00,2021-01-29,Johnson & Johnson Announces Single-Shot Janssen COVID-19 Vaccine Candidate Met Primary Endpoints in Interim Analysis of its Phase 3 ENSEMBLE Trial,"NEW BRUNSWICK, N.J., Jan. 29, 2021 /PRNewswire/ -- Johnson & Johnson (NYSE: JNJ) (the Company) today announced topline efficacy and safety data from the Phase 3 ENSEMBLE clinical trial, demonstrating that the investigational single-dose COVID-19 vaccine in development at its Janssen...",prnewswire.com,https://www.prnewswire.com/news-releases/johnson--johnson-announces-single-shot-janssen-covid-19-vaccine-candidate-met-primary-endpoints-in-interim-analysis-of-its-phase-3-ensemble-trial-301218035.html,https://images.financialmodelingprep.com/news/johnson-johnson-announces-singleshot-janssen-covid19-vaccine-candidate-met-20210129.jpg
JNJ,2021-01-26,2021-01-12,2021-02-09,JNJ,,2021-01-29 08:00:07,2021-01-29T08:00:07-05:00,2021-01-29,"J&J says its one-shot Covid vaccine is 72% effective in the U.S., but less potent in other regions","The Covid vaccine was well tolerated, with no significant safety concerns related to the vaccine reported, J&J said. There were also no reports of anaphylaxis.",cnbc.com,https://www.cnbc.com/2021/01/29/covid-vaccine-jjs-one-shot-drug-is-72percent-in-the-us-but-less-effective-elsewhere.html,https://images.financialmodelingprep.com/news/jj-says-its-oneshot-covid-vaccine-is-72-effective-20210129.jpeg
JNJ,2021-01-26,2021-01-12,2021-02-09,JNJ,,2021-01-29 08:01:18,2021-01-29T08:01:18-05:00,2021-01-29,"J&J's single-dose coronavirus vaccine is 66% effective against COVID-19, raising worries that some variants may lower protection","The US effort to halt the coronavirus got some good news on Friday as another vaccine succeeded in the final stages of clinical research. The single-dose vaccine, developed by healthcare giant Johnson & Johnson with US government funding, proved to be 66% effective at preventing people from catching COVID-19, J&J said in a statement. That's significantly lower than the protection offered by shots from Pfizer and from Moderna, though both of those shots require two doses.",businessinsider.com,https://www.businessinsider.com/jj-one-dose-covid-vaccine-late-stage-trial-results-2021-1,https://images.financialmodelingprep.com/news/jjs-singledose-coronavirus-vaccine-is-66-effective-against-covid19-20210129.jpg
JNJ,2021-01-26,2021-01-12,2021-02-09,JNJ,,2021-01-29 08:13:33,2021-01-29T08:13:33-05:00,2021-01-29,Johnson & Johnson says COVID vaccine was 66% effective in Phase 3 trial,"Johnson & Johnson said Friday a Phase 3 trial of its one-dose COVID-19 vaccine proved to be 66% effective overall in preventing moderate-to-severe disease 28 days after vaccination, raising hopes it may receive emergency use authorization in the U.S. in the coming weeks. The vaccine candidate was 72% effective in the U.S. trial, the company said in a statement.",marketwatch.com,https://www.marketwatch.com/story/johnson-johnson-says-covid-vaccine-was-66-effective-in-phase-3-trial-2021-01-29,https://images.financialmodelingprep.com/news/johnson-johnson-says-covid-vaccine-was-66-effective-in-20210129.jpg
JNJ,2021-01-26,2021-01-12,2021-02-09,JNJ,,2021-01-29 08:38:43,2021-01-29T08:38:43-05:00,2021-01-29,"Johnson & Johnson's Single-Dose Covid-19 Vaccine Is 66% Effective In Global Trial, But Has Lower Efficacy Against South African Variant",In the U.S. the vaccine had an effectiveness of 72% but that number dropped to just 57% in South Africa where a more infectious variant of the virus is spreading.,forbes.com,https://www.forbes.com/sites/siladityaray/2021/01/29/johnson--johnsons-single-dose-covid-19-vaccine-is-66-effective-in-global-trial-but-has-lower-efficacy-against-south-african-variant/,https://images.financialmodelingprep.com/news/johnson-johnsons-singledose-covid19-vaccine-is-66-effective-in-20210129.jpg
JNJ,2021-01-26,2021-01-12,2021-02-09,JNJ,,2021-01-29 08:59:00,2021-01-29T08:59:00-05:00,2021-01-29,"JNJ Drops, GameStop Keeps Flying as Vaccine News Hits the Dow",Futures on the Dow Jones Industrial Average and other major stock indexes are falling in response to the latest vaccine-trial data.,barrons.com,https://www.barrons.com/articles/stocks-moving-premarket-friday-jnj-gamestop-amc-novavax-51611928781,https://images.financialmodelingprep.com/news/jnj-drops-gamestop-keeps-flying-as-vaccine-news-hits-20210129.jpg
JNJ,2021-01-26,2021-01-12,2021-02-09,JNJ,,2021-01-29 09:04:52,2021-01-29T09:04:52-05:00,2021-01-29,"Johnson & Johnson's COVID-19 vaccine is 85% effective against severe cases, and 66% effective overall per trial data","Another COVID-19 vaccine is almost ready to begin being distributed – a single-shot inoculation made by Johnson & Johnson's Janssen pharmaceutical subsidiary. The company just released an efficacy report based on data from its Phase 3 trial, which found that the new vaccine is 66% effective overall in preventing moderate to severe incarnations of COVID-19 […]",techcrunch.com,https://techcrunch.com/2021/01/29/johnson-johnsons-covid-19-vaccine-is-85-effective-against-severe-cases-and-66-effective-overall-per-trial-data/,https://images.financialmodelingprep.com/news/johnson-johnsons-covid19-vaccine-is-85-effective-against-severe-20210129.jpg
JNJ,2021-01-26,2021-01-12,2021-02-09,JNJ,,2021-01-29 09:29:00,2021-01-29T09:29:00-05:00,2021-01-29,Johnson & Johnson Single-Dose Vaccine Found Effective Against Severe Covid-19 Infections,Here's what you need to know about the impact of Covid-19 to navigate the markets today.,barrons.com,https://www.barrons.com/articles/news-updates-51611930488,https://images.financialmodelingprep.com/news/johnson-johnson-singledose-vaccine-found-effective-against-severe-covid19-20210129.jpg
JNJ,2021-01-26,2021-01-12,2021-02-09,JNJ,,2021-01-29 09:37:00,2021-01-29T09:37:00-05:00,2021-01-29,Wall St. opens lower after J&J vaccine data,Wall Street's main indexes opened lower on Friday after COVID-19 vaccine data from Johnson & Johnson hurt sentiment and added to worries over a growing standoff between hedge funds and retail investors.,reuters.com,https://www.reuters.com/article/us-usa-stocks/wall-st-opens-lower-after-jj-vaccine-data-idUSKBN29Y1MV,https://images.financialmodelingprep.com/news/wall-st-opens-lower-after-jj-vaccine-data-20210129.jpg
JNJ,2021-01-26,2021-01-12,2021-02-09,JNJ,,2021-01-29 09:45:44,2021-01-29T09:45:44-05:00,2021-01-29,Speculative Trading Heightens Uncertainty; JNJ Reports Vaccine 66% Effective Globally,"This morning, the stock market continues to fret about certain highly speculative trades; JNJ reports vaccine is 66% effective globally",forbes.com,https://www.forbes.com/sites/jjkinahan/2021/01/29/speculative-trading-heightens-uncertainty-jnj-reports-vaccine-66-effective-globally/,https://images.financialmodelingprep.com/news/speculative-trading-heightens-uncertainty-jnj-reports-vaccine-66-effective-globally-20210129.jpg
JNJ,2021-01-26,2021-01-12,2021-02-09,JNJ,,2021-01-29 10:10:38,2021-01-29T10:10:38-05:00,2021-01-29,Moderna (MRNA) at High as Johnson & Johnson (JNJ) Vaccine Disappoints,Inferior effectiveness of the Johnson & Johnson vaccine is unlikely to instill public confidence.,investopedia.com,https://www.investopedia.com/moderna-mrna-at-high-as-johnson-and-johnson-jnj-vaccine-disappoints-5100992,https://images.financialmodelingprep.com/news/moderna-mrna-at-high-as-johnson-johnson-jnj-vaccine-20210129.jpg
JNJ,2021-01-26,2021-01-12,2021-02-09,JNJ,,2021-01-29 10:33:32,2021-01-29T10:33:32-05:00,2021-01-29,Johnson & Johnson's COVID-19 Vaccine Data: What You Need to Know,"Johnson & Johnson (NYSE: JNJ) released much-awaited top-line results Friday from a large scale, late-stage study of its coronavirus vaccine candidate. The data hasn't gone down well with investors, with the shares of the health care company ticking lower in the session.",benzinga.com,https://www.benzinga.com/general/biotech/21/01/19393568/johnson-johnsons-covid-19-vaccine-data-what-you-need-to-know,https://images.financialmodelingprep.com/news/johnson-johnsons-covid19-vaccine-data-what-you-need-to-20210129.jpg
JNJ,2021-01-26,2021-01-12,2021-02-09,JNJ,,2021-01-29 10:56:00,2021-01-29T10:56:00-05:00,2021-01-29,Blue-Chip Pharma Stock Dips on Vaccine Update,"The shares of Johnson & Johnson (NYSE:JNJ) are down 3.4% at $163.22 at last check, after releasing new coronavirus vaccine data.",schaeffersresearch.com,https://www.schaeffersresearch.com/content/news/2021/01/29/blue-chip-pharma-stock-dips-on-vaccine-update,https://images.financialmodelingprep.com/news/bluechip-pharma-stock-dips-on-vaccine-update-20210129.jpg
JNJ,2021-01-26,2021-01-12,2021-02-09,JNJ,,2021-01-29 11:00:00,2021-01-29T11:00:00-05:00,2021-01-29,"Coronavirus Update: Vaccine hopes boosted by data from Novavax and J&J, but fears over new variants remain","The global case tally for the coronavirus-borne illness COVID-19 was headed toward 102 million on Friday, as health experts were digesting the latest vaccine updates from Novavax Inc. and Johnson & Johnson amid hopes they will soon win emergency authorization and bolster supplies.",marketwatch.com,https://www.marketwatch.com/story/vaccine-hopes-boosted-by-data-from-novavax-and-j-j-but-fears-over-new-variants-remain-11611936022,https://images.financialmodelingprep.com/news/coronavirus-update-vaccine-hopes-boosted-by-data-from-novavax-20210129.jpg
JNJ,2021-01-26,2021-01-12,2021-02-09,JNJ,,2021-01-29 11:17:08,2021-01-29T11:17:08-05:00,2021-01-29,Personal Income Increased in December,Personal Income Increased in December,zacks.com,https://www.zacks.com/stock/news/1254275/personal-income-increased-in-december,https://images.financialmodelingprep.com/news/personal-income-increased-in-december-20210129.jpg
JNJ,2021-01-26,2021-01-12,2021-02-09,JNJ,,2021-01-29 11:17:16,2021-01-29T11:17:16-05:00,2021-01-29,"Economic Prints, Q4 Reports Up for Lilly, CAT; J&J Posts Phase-3 Data","With the GameStop (GME) short-squeeze saga continuing, market indexes work to regain their equilibrium.",zacks.com,https://www.zacks.com/stock/news/1254261/economic-prints-q4-reports-up-for-lilly-cat-jj-posts-phase-3-data,https://images.financialmodelingprep.com/news/economic-prints-q4-reports-up-for-lilly-cat-jj-20210129.jpg
JNJ,2021-01-26,2021-01-12,2021-02-09,JNJ,,2021-01-29 12:49:39,2021-01-29T12:49:39-05:00,2021-01-29,What makes Johnson & Johnson's COVID-19 vaccine different? We break it down,"Johnson & Johnson has released data from its global Phase 3 clinical trial today. Many COVID-19 vaccines have name brands attached them, but one of them has drawn a lot of attention lately.",fastcompany.com,https://www.fastcompany.com/90599466/what-makes-johnson-johnsons-covid-19-vaccine-different-we-break-it-down,https://images.financialmodelingprep.com/news/what-makes-johnson-johnsons-covid19-vaccine-different-we-break-20210129.jpg
JNJ,2021-01-26,2021-01-12,2021-02-09,JNJ,,2021-01-29 12:56:05,2021-01-29T12:56:05-05:00,2021-01-29,Top Stocks To Buy Today As Johnson & Johnson Vaccine Underwhelms Markets,"It's been a volatile trading week, with “Reddit investors” upending institutional investors and hedge funds by influencing a stock market rally for underperforming stocks.",forbes.com,https://www.forbes.com/sites/qai/2021/01/29/top-stocks-to-buy-today-as-johnson--johnson-vaccine-underwhelms-markets/,https://images.financialmodelingprep.com/news/top-stocks-to-buy-today-as-johnson-johnson-vaccine-20210129.jpg
JNJ,2021-01-26,2021-01-12,2021-02-09,JNJ,,2021-01-29 13:08:40,2021-01-29T13:08:40-05:00,2021-01-29,Top Stocks To Short Today Amid Reddit Mania And Disappointing Johnson & Johnson Data,"As the war between retail investors and Wall Street continues, stocks are on pace for their worst weekly declines in nearly three months.",forbes.com,https://www.forbes.com/sites/qai/2021/01/29/top-stocks-to-short-today-amid-reddit-mania-and-disappointing-johnson--johnson-data/,https://images.financialmodelingprep.com/news/top-stocks-to-short-today-amid-reddit-mania-and-20210129.jpg
JNJ,2021-01-26,2021-01-12,2021-02-09,JNJ,,2021-01-29 14:01:40,2021-01-29T14:01:40-05:00,2021-01-29,Stock ETFs Fall on Johnson & Johnson Vaccine News,"After a respite on Thursday, stocks and index ETFs tumbled once again on Friday after a trial result from Johnson & Johnson's coronavirus vaccine disappointed some investors. Fears about a retail trading battle between smaller and larger investing players continued.",etftrends.com,https://www.etftrends.com/stock-etfs-fall-johnson-johnson-vaccine-news/,https://images.financialmodelingprep.com/news/stock-etfs-fall-on-johnson-johnson-vaccine-news-20210129.jpg
JNJ,2021-01-26,2021-01-12,2021-02-09,JNJ,,2021-01-29 14:01:49,2021-01-29T14:01:49-05:00,2021-01-29,How does Johnson & Johnson's COVID-19 vaccine stack up against shots from Pfizer and Moderna?,"An experimental coronavirus vaccine from Johnson & Johnson is 66% effective at preventing moderate to severe COVID-19, according to new trial data the company released on Friday.  At first glance, the vaccine doesn't appear to be as stellar as authorized vaccines from Pfizer and Moderna, but it does have a few perks.",businessinsider.com,https://www.businessinsider.com/coronavirus-vaccines-compared-pfizer-moderna-johnson-and-johnson-2021-1,https://images.financialmodelingprep.com/news/how-does-johnson-johnsons-covid19-vaccine-stack-up-against-20210129.jpg
JNJ,2021-01-26,2021-01-12,2021-02-09,JNJ,,2021-01-29 15:50:38,2021-01-29T15:50:38-05:00,2021-01-29,"U.S. Stock ETFs Slide on J&J's Weak Vaccine, GameStop Volatility",U.S. markets and stock exchange traded funds retreated Friday after Johnson & Johnson's inefficient Covid-19 vaccine dinged sentiment. The ongoing fight between institutional investors and retail traders added to fears of a bubble.,etftrends.com,https://www.etftrends.com/equity-etf-channel/u-s-stock-etfs-slide-on-jjs-weak-vaccine-gamestop-volatility/,https://images.financialmodelingprep.com/news/us-stock-etfs-slide-on-jjs-weak-vaccine-gamestop-20210129.jpg
JNJ,2021-01-26,2021-01-12,2021-02-09,JNJ,,2021-01-29 19:00:00,2021-01-29T19:00:00-05:00,2021-01-29,Why Johnson & Johnson Fell Today Despite Excellent Coronavirus Vaccine News,The company's vaccine has a lower efficacy rate than others.,fool.com,https://www.fool.com/investing/2021/01/29/why-johnson-johnson-fell-today-despite-excellent-c/,https://images.financialmodelingprep.com/news/why-johnson-johnson-fell-today-despite-excellent-coronavirus-vaccine-20210129.jpg
JNJ,2021-01-26,2021-01-12,2021-02-09,JNJ,,2021-01-29 19:09:48,2021-01-29T19:09:48-05:00,2021-01-29,Dr. Gottlieb says J&J Covid vaccine trial yields very good result and vaccine will aid U.S. pandemic response,"Former FDA chief Dr. Scott Gottlieb said Johnson & Johnson's single-dose Covid vaccine will be a ""great addition"" to the U.S. pandemic response.",cnbc.com,https://www.cnbc.com/2021/01/29/dr-scott-gottlieb-jj-covid-vaccine-trial-yields-very-good-result.html,https://images.financialmodelingprep.com/news/dr-gottlieb-says-jj-covid-vaccine-trial-yields-very-20210129.jpeg
JNJ,2021-01-26,2021-01-12,2021-02-09,JNJ,,2021-01-29 20:24:06,2021-01-29T20:24:06-05:00,2021-01-29,"There will be enough Covid vaccines for the ‘entire U.S. adult population by June,' Johnson & Johnson board member says",Johnson & Johnson board member Dr. Mark McClellan said that there could be enough vaccinations for the entire U.S. adult population by June.,cnbc.com,https://www.cnbc.com/2021/01/29/there-will-be-enough-covid-vaccines-for-the-entire-us-adult-population-by-june-doctor-says.html,https://images.financialmodelingprep.com/news/there-will-be-enough-covid-vaccines-for-the-entire-20210129.jpeg
JNJ,2021-01-26,2021-01-12,2021-02-09,JNJ,,2021-01-30 06:55:00,2021-01-30T06:55:00-05:00,2021-01-30,Biden's Latest Move Just Handed the Vaccine Market to These 2 Companies,They can't vaccinate the whole world against COVID-19 -- but they may vaccinate all of the U.S.,fool.com,https://www.fool.com/investing/2021/01/30/bidens-latest-move-just-handed-the-vaccine-market/,https://images.financialmodelingprep.com/news/bidens-latest-move-just-handed-the-vaccine-market-to-20210130.jpg
JNJ,2021-01-26,2021-01-12,2021-02-09,JNJ,,2021-01-30 11:09:50,2021-01-30T11:09:50-05:00,2021-01-30,Moderna vaccine creator calls Johnson & Johnson's competing shot a 'darn good' tool to fight the pandemic,"A leading coronavirus vaccine scientist who helped develop Moderna's highly effective vaccine says Johnson & Johnson's new trial results, which tout 72% efficacy for the one-shot vaccine in the US, look ""darn good."" ""Don't let the perfect get in the way of the good enough,"" Kizzmekia Corbett, scientific lead for coronavirus vaccines in the Viral Pathogenesis Laboratory at the National Institutes of Health, wrote on Twitter Friday.",businessinsider.com,https://www.businessinsider.com/moderna-scientist-kizzy-johnson-and-johnson-covid-shot-darn-good-2021-1,https://images.financialmodelingprep.com/news/moderna-vaccine-creator-calls-johnson-johnsons-competing-shot-a-20210130.jpg
JNJ,2021-01-26,2021-01-12,2021-02-09,JNJ,,2021-01-31 06:10:00,2021-01-31T06:10:00-05:00,2021-01-31,"Which Is the Best COVID Vaccine Stock: Pfizer, BioNTech, Moderna, Johnson & Johnson, or Novavax?",Hint: It's complicated.,fool.com,https://www.fool.com/investing/2021/01/31/can-johnson-johnson-beat-pfizer-and-moderna-in-the/,https://images.financialmodelingprep.com/news/which-is-the-best-covid-vaccine-stock-pfizer-biontech-20210131.jpg
JNJ,2021-01-26,2021-01-12,2021-02-09,JNJ,,2021-01-31 08:44:29,2021-01-31T08:44:29-05:00,2021-01-31,Top Wall Street analysts like these stocks coming out of earnings season,"TipRanks analyst ranking service pinpoints Wall Street's best-performing stocks, like Facebook and Apple",cnbc.com,https://www.cnbc.com/2021/01/31/top-analysts-like-these-stocks-coming-out-of-earnings-season.html,https://images.financialmodelingprep.com/news/top-wall-street-analysts-like-these-stocks-coming-out-20210131.jpg
JNJ,2021-01-26,2021-01-12,2021-02-09,JNJ,,2021-02-01 04:16:53,2021-02-01T04:16:53-05:00,2021-02-01,Week 5 MDA Breakout Stocks - February 2021: Short-Term Picks To Give You An Edge,Two new breakout stocks for Week 5 of 2021 with better than 10% short-term upside potential. This past week all 4 stocks gained over 10% with NBSE and QDEL gaining over 20% before pulling back on Friday to close with average +3.77% gains this week.,seekingalpha.com,https://seekingalpha.com/article/4402369-week-5-mda-breakout-stocks-february-2021-short-term-picks-to-give-you-edge,https://images.financialmodelingprep.com/news/week-5-mda-breakout-stocks-february-2021-shortterm-picks-20210201.jpg
JNJ,2021-01-26,2021-01-12,2021-02-09,JNJ,,2021-02-01 08:00:00,2021-02-01T08:00:00-05:00,2021-02-01,Retirement Strategy: A Surprise Update To The Pandemic Retirement Income Portfolio,Retirement Strategy: A Surprise Update To The Pandemic Retirement Income Portfolio,seekingalpha.com,https://seekingalpha.com/article/4402139-retirement-strategy-surprise-update-to-pandemic-retirement-income-portfolio,https://images.financialmodelingprep.com/news/retirement-strategy-a-surprise-update-to-the-pandemic-retirement-20210201.jpg
JNJ,2021-01-26,2021-01-12,2021-02-09,JNJ,,2021-02-01 11:22:04,2021-02-01T11:22:04-05:00,2021-02-01,J&J's (JNJ) Coronavirus Vaccine Shows 66% Efficacy in Phase III,J&J's (JNJ) phase III ENSEMBLE study on its single-dose COVID-19 vaccine candidate meets all primary and key secondary endpoints.,zacks.com,https://www.zacks.com/stock/news/1255269/jjs-jnj-coronavirus-vaccine-shows-66-efficacy-in-phase-iii,https://images.financialmodelingprep.com/news/jjs-jnj-coronavirus-vaccine-shows-66-efficacy-in-phase-20210201.jpg
JNJ,2021-01-26,2021-01-12,2021-02-09,JNJ,,2021-02-01 11:40:03,2021-02-01T11:40:03-05:00,2021-02-01,7 Blue Chip Stocks to Help Prepare For Your Retirement,These blue chip stocks have tremendous brand equity and will allow investors to rake in healthy returns while preparing for their retirement. The post 7 Blue Chip Stocks to Help Prepare For Your Retirement appeared first on InvestorPlace.,investorplace.com,https://investorplace.com/2021/02/7-blue-chip-stocks-help-prepare-your-retirement/,https://images.financialmodelingprep.com/news/7-blue-chip-stocks-to-help-prepare-for-your-20210201.jpg
