ticker,event_date,window_start,window_end,symbol,symbols,publishedDate,publishedDateET,date_et,title,text,site,url,image
JNJ,2021-01-26,2021-01-12,2021-02-09,JNJ,,2021-01-12 06:30:00,2021-01-12T06:30:00-05:00,2021-01-12,"Retirement Strategy: Johnson & Johnson, Another Buy-And-Hold-Forever Dividend Superstar","In this new series, I am hoping folks realize that the stocks I'm suggesting could provide an income for life, so you don't go broke before you kick the bucket. Obviously these should be a portion of a portfolio of dividend growth stocks for DGI'ers.",seekingalpha.com,https://seekingalpha.com/article/4398475-retirement-strategy-johnson-johnson-another-buy-and-hold-forever-dividend-superstar,https://images.financialmodelingprep.com/news/retirement-strategy-johnson-johnson-another-buyandholdforever-dividend-superstar-20210112.jpg
JNJ,2021-01-26,2021-01-12,2021-02-09,JNJ,,2021-01-12 07:10:00,2021-01-12T07:10:00-05:00,2021-01-12,3 Recession-Proof Healthcare Stocks to Buy for 2021,"With solid valuations and good dividends, these businesses will get you through the next rainy day -- or year.",fool.com,https://www.fool.com/investing/2021/01/12/3-recession-proof-healthcare-stocks-to-buy-for-202/,https://images.financialmodelingprep.com/news/3-recessionproof-healthcare-stocks-to-buy-for-2021-20210112.jpg
JNJ,2021-01-26,2021-01-12,2021-02-09,JNJ,,2021-01-12 08:49:00,2021-01-12T08:49:00-05:00,2021-01-12,Johnson & Johnson's Covid-19 Vaccine Could Alter The Course Of The Pandemic. Investors Will Soon Know If It Works.,Company CEO Alex Gorsky said at a conference that the company is in the “final stages” of analyzing the single-dose vaccine's efficacy.,barrons.com,https://www.barrons.com/articles/johnson-johnsons-covid-19-vaccine-could-alter-the-course-of-the-pandemic-investors-will-soon-know-if-it-works-51610459381,https://images.financialmodelingprep.com/news/johnson-johnsons-covid19-vaccine-could-alter-the-course-of-20210112.jpg
JNJ,2021-01-26,2021-01-12,2021-02-09,JNJ,,2021-01-12 18:48:17,2021-01-12T18:48:17-05:00,2021-01-12,Johnson & Johnson (JNJ) Stock Sinks As Market Gains: What You Should Know,"Johnson & Johnson (JNJ) closed at $158.13 in the latest trading session, marking a -0.78% move from the prior day.",zacks.com,https://www.zacks.com/stock/news/1245461/johnson-johnson-jnj-stock-sinks-as-market-gains-what-you-should-know,https://images.financialmodelingprep.com/news/johnson-johnson-jnj-stock-sinks-as-market-gains-what-20210112.jpg
JNJ,2021-01-26,2021-01-12,2021-02-09,JNJ,,2021-01-13 05:41:47,2021-01-13T05:41:47-05:00,2021-01-13,Johnson & Johnson vaccine production is behind schedule: report,"Federal officials have been told that Johnson & Johnson's vaccine production has fallen as much as two months behind the original production schedule and won't catch up until the end of April, The New York Times reported, citing people familiar with the situations. The report quoted the lead manufacturing adviser for Operation Warp Speed that the company might be able to catch up with initial production goals by March.",marketwatch.com,https://www.marketwatch.com/story/johnson-johnson-vaccine-production-is-behind-schedule-report-2021-01-13,https://images.financialmodelingprep.com/news/johnson-johnson-vaccine-production-is-behind-schedule-report-20210113.jpg
JNJ,2021-01-26,2021-01-12,2021-02-09,JNJ,,2021-01-13 05:57:00,2021-01-13T05:57:00-05:00,2021-01-13,J&J may not meet U.S. COVID-19 vaccine supply target by spring: NYT,"Johnson & Johnson is facing unexpected delays in the manufacturing of its coronavirus vaccine and may not be able to supply the doses it promised the federal government by spring, the New York Times reported on Wednesday.",reuters.com,https://www.reuters.com/article/us-health-coronavirus-vaccines-johnson-j/jj-may-not-meet-u-s-covid-19-vaccine-supply-target-by-spring-nyt-idUSKBN29I18I,https://images.financialmodelingprep.com/news/jj-may-not-meet-us-covid19-vaccine-supply-target-20210113.jpg
JNJ,2021-01-26,2021-01-12,2021-02-09,JNJ,,2021-01-13 06:03:00,2021-01-13T06:03:00-05:00,2021-01-13,3 Dividend Aristocrats to Buy Right Now,These stocks are as solid as they come.,fool.com,https://www.fool.com/investing/2021/01/13/3-dividend-aristocrats-to-buy-right-now/,https://images.financialmodelingprep.com/news/3-dividend-aristocrats-to-buy-right-now-20210113.jpg
JNJ,2021-01-26,2021-01-12,2021-02-09,JNJ,,2021-01-13 06:05:00,2021-01-13T06:05:00-05:00,2021-01-13,My Best Coronavirus Stock for 2021,Its risk-reward proposition is compelling.,fool.com,https://www.fool.com/investing/2021/01/13/my-best-coronavirus-stock-for-2021/,https://images.financialmodelingprep.com/news/my-best-coronavirus-stock-for-2021-20210113.jpg
JNJ,2021-01-26,2021-01-12,2021-02-09,JNJ,,2021-01-13 11:31:52,2021-01-13T11:31:52-05:00,2021-01-13,J&J Stock Topples On Report Its Covid Vaccine Is 2 Months Behind Schedule,Johnson & Johnson said it's premature to discuss the details of its coronavirus vaccine supply after JNJ stock slipped Wednesday on a report it's two months behind schedule. The post J&J Stock Topples On Report Its Covid Vaccine Is 2 Months Behind Schedule appeared first on Investor's Business Daily.,investors.com,https://www.investors.com/news/technology/jnj-stock-dips-report-coronavirus-vaccine-2-months-behind-schedule/,https://images.financialmodelingprep.com/news/jj-stock-topples-on-report-its-covid-vaccine-is-20210113.jpg
JNJ,2021-01-26,2021-01-12,2021-02-09,JNJ,,2021-01-13 14:51:59,2021-01-13T14:51:59-05:00,2021-01-13,7 Pharmaceutical Stocks With Exciting Plans for 2021,"Pharmaceutical stocks have many benefits, particularly when their products are in demand. And in 2021, that seems likely to be the case.",investorplace.com,https://investorplace.com/2021/01/7-pharmaceutical-stocks-with-exciting-plans-for-2021/,https://images.financialmodelingprep.com/news/7-pharmaceutical-stocks-with-exciting-plans-for-2021-20210113.jpg
JNJ,2021-01-26,2021-01-12,2021-02-09,JNJ,,2021-01-13 17:00:01,2021-01-13T17:00:01-05:00,2021-01-13,J&J's one-shot Covid vaccine is safe and generates promising immune response in early trial,"The new clinical trial data shows a single shot of the vaccine ""gives sustainable antibodies,"" Dr. Paul Stoffels, J&J chief scientific officer, told CNBC.",cnbc.com,https://www.cnbc.com/2021/01/13/covid-vaccine-johnson-johnson-one-shot-safe-generates-immune-response.html,https://images.financialmodelingprep.com/news/jjs-oneshot-covid-vaccine-is-safe-and-generates-promising-20210113.jpeg
JNJ,2021-01-26,2021-01-12,2021-02-09,JNJ,,2021-01-14 07:58:39,2021-01-14T07:58:39-05:00,2021-01-14,J&J's COVID-19 vaccine candidate shows it generates antibodies in early-stage trial,"Shares of Johnson & Johnson gained 1.7% in premarket trading on Thursday, the day after a study published in the New England Journal of Medicine showed that its COVID-19 vaccine candidate generated neutralizing antibody titers in 100% of roughly 800 adult participants younger than 55 years old by day 57. (Some of the data from the Phase 1/2 clinical trial was published in preprint form in September.",marketwatch.com,https://www.marketwatch.com/story/jjs-covid-19-vaccine-candidate-shows-it-generates-antibodies-in-early-stage-trial-2021-01-14,https://images.financialmodelingprep.com/news/jjs-covid19-vaccine-candidate-shows-it-generates-antibodies-in-20210114.jpg
JNJ,2021-01-26,2021-01-12,2021-02-09,JNJ,,2021-01-14 08:58:40,2021-01-14T08:58:40-05:00,2021-01-14,Johnson & Johnson COVID-19 vaccine generates immune response in trial,"Johnson & Johnson's coronavirus vaccine generated a lasting immune response to the deadly bug in an early-stage clinical trial, the pharmaceutical giant said.",nypost.com,https://nypost.com/2021/01/14/johnson-johnson-covid-vaccine-generates-immune-response-in-trial/,https://images.financialmodelingprep.com/news/johnson-johnson-covid19-vaccine-generates-immune-response-in-trial-20210114.jpg
JNJ,2021-01-26,2021-01-12,2021-02-09,JNJ,,2021-01-14 10:39:28,2021-01-14T10:39:28-05:00,2021-01-14,A Dividend Investor's Guide To 2021: The Cure To Uncertain Times,"Year 2020 was wild, and left many important threats for 2021. I will summarize the key threats I see, and offer my approach to the markets.",seekingalpha.com,https://seekingalpha.com/article/4398925-dividend-investors-guide-to-2021-cure-to-uncertain-times,https://images.financialmodelingprep.com/news/a-dividend-investors-guide-to-2021-the-cure-to-uncertain-20210114.jpg
JNJ,2021-01-26,2021-01-12,2021-02-09,JNJ,,2021-01-14 14:08:00,2021-01-14T14:08:00-05:00,2021-01-14,"Invitae Nabs Bristol Myers Squibb, J&J, Novartis, and Roche for Acute Myeloid Leukemia Project",Those are some solid endorsements.,fool.com,https://www.fool.com/investing/2021/01/14/invitae-nabs-bristol-myers-squibb-jj-novartis-and/,https://images.financialmodelingprep.com/news/invitae-nabs-bristol-myers-squibb-jj-novartis-and-roche-20210114.jpg
JNJ,2021-01-26,2021-01-12,2021-02-09,JNJ,,2021-01-14 18:48:20,2021-01-14T18:48:20-05:00,2021-01-14,Johnson & Johnson (JNJ) Gains As Market Dips: What You Should Know,"Johnson & Johnson (JNJ) closed the most recent trading day at $160.65, moving +1.75% from the previous trading session.",zacks.com,https://www.zacks.com/stock/news/1246971/johnson-johnson-jnj-gains-as-market-dips-what-you-should-know,https://images.financialmodelingprep.com/news/johnson-johnson-jnj-gains-as-market-dips-what-you-20210114.jpg
JNJ,2021-01-26,2021-01-12,2021-02-09,JNJ,,2021-01-15 06:07:00,2021-01-15T06:07:00-05:00,2021-01-15,3 Great Stocks You Can Buy and Hold Forever,Holding on to stocks for the long haul is a good way to build wealth -- as long as you've picked strong and growing enterprises. Here are three to consider.,fool.com,https://www.fool.com/investing/2021/01/15/3-great-stocks-you-can-buy-and-hold-forever/,https://images.financialmodelingprep.com/news/3-great-stocks-you-can-buy-and-hold-forever-20210115.jpg
JNJ,2021-01-26,2021-01-12,2021-02-09,JNJ,,2021-01-16 06:09:00,2021-01-16T06:09:00-05:00,2021-01-16,3 Fantastic Coronavirus Vaccine Stocks to Buy Right Now,Each has more to offer than just a COVID-19 vaccine.,fool.com,https://www.fool.com/investing/2021/01/16/3-fantastic-coronavirus-vaccine-stocks-to-buy-righ/,https://images.financialmodelingprep.com/news/3-fantastic-coronavirus-vaccine-stocks-to-buy-right-now-20210116.jpg
JNJ,2021-01-26,2021-01-12,2021-02-09,JNJ,,2021-01-17 05:43:41,2021-01-17T05:43:41-05:00,2021-01-17,Week 3 MDA Breakout Stocks - January 2021: Short-Term Picks To Give You An Edge,Week 3 MDA Breakout Stocks - January 2021: Short-Term Picks To Give You An Edge,seekingalpha.com,https://seekingalpha.com/article/4399342-week-3-mda-breakout-stocks-january-2021-short-term-picks-to-give-you-edge,https://images.financialmodelingprep.com/news/week-3-mda-breakout-stocks-january-2021-shortterm-picks-to-20210117.jpg
JNJ,2021-01-26,2021-01-12,2021-02-09,JNJ,,2021-01-17 11:31:00,2021-01-17T11:31:00-05:00,2021-01-17,Here Are the Most Compelling Buys of the COVID Vaccine Stocks,Experts give their opinion of a conservative pick and a riskier one.,fool.com,https://www.fool.com/investing/2021/01/17/here-are-the-most-compelling-buys-of-covid-vaccine/,https://images.financialmodelingprep.com/news/here-are-the-most-compelling-buys-of-the-covid-20210117.jpg
JNJ,2021-01-26,2021-01-12,2021-02-09,JNJ,,2021-01-18 06:45:00,2021-01-18T06:45:00-05:00,2021-01-18,Should You Buy Johnson & Johnson For Its COVID Vaccine?,The possibility of a one-dose vaccine may give it an edge over rivals.,fool.com,https://www.fool.com/investing/2021/01/18/should-you-buy-johnson-johnson-for-its-covid-vacci/,https://images.financialmodelingprep.com/news/should-you-buy-johnson-johnson-for-its-covid-vaccine-20210118.jpg
JNJ,2021-01-26,2021-01-12,2021-02-09,JNJ,,2021-01-18 12:02:10,2021-01-18T12:02:10-05:00,2021-01-18,J&J's (JNJ) Darzalex Faspro Gets FDA Nod for Amyloidosis,"J&J (JNJ) gets accelerated approval for a new indication of Darzalex Faspro in combination with bortezomib, cyclophosphamide and dexamethasone for treating amyloidosis patients.",zacks.com,https://www.zacks.com/stock/news/1248175/jjs-jnj-darzalex-faspro-gets-fda-nod-for-amyloidosis,https://images.financialmodelingprep.com/news/jjs-jnj-darzalex-faspro-gets-fda-nod-for-amyloidosis-20210118.jpg
JNJ,2021-01-26,2021-01-12,2021-02-09,JNJ,,2021-01-19 07:01:00,2021-01-19T07:01:00-05:00,2021-01-19,2 Top Dividend Kings to Buy and Hold Forever,You can just sit back and watch the cash roll in with these two top stocks.,fool.com,https://www.fool.com/investing/2021/01/19/2-top-dividend-kings-to-buy-and-hold-forever/,https://images.financialmodelingprep.com/news/2-top-dividend-kings-to-buy-and-hold-forever-20210119.jpg
JNJ,2021-01-26,2021-01-12,2021-02-09,JNJ,,2021-01-19 09:00:00,2021-01-19T09:00:00-05:00,2021-01-19,"Johnson & Johnson's Covid-19 Vaccine Updates: Efficacy Figures, Production Delays","Johnson & Johnson is developing one of the most closely watched Covid-19 vaccines, considering that it is a single-dose shot that should be relatively easy to distribute. Here's a quick rundown on the recent developments for the vaccine.",forbes.com,https://www.forbes.com/sites/greatspeculations/2021/01/19/johnson--johnsons-covid-19-vaccine-updates-efficacy-figures-production-delays/,https://images.financialmodelingprep.com/news/johnson-johnsons-covid19-vaccine-updates-efficacy-figures-production-delays-20210119.jpg
JNJ,2021-01-26,2021-01-12,2021-02-09,JNJ,,2021-01-19 09:05:12,2021-01-19T09:05:12-05:00,2021-01-19,Invest Like A Billionaire With High Yield: THW,Invest Like A Billionaire With High Yield: THW,seekingalpha.com,https://seekingalpha.com/article/4399114-invest-like-billionaire-high-yield-thw,https://images.financialmodelingprep.com/news/invest-like-a-billionaire-with-high-yield-thw-20210119.jpg
JNJ,2021-01-26,2021-01-12,2021-02-09,JNJ,,2021-01-19 09:07:23,2021-01-19T09:07:23-05:00,2021-01-19,"Allison Transmission, Korn Ferry, & Johnson & Johnson: Poised To Outperform",Starting 2021 by looking at the Long Ideas that performed poorly in 2020 that I remain bullish on.,forbes.com,https://www.forbes.com/sites/greatspeculations/2021/01/19/allison-transmission-korn-ferry--johnson--johnson-poised-to-outperform/,https://images.financialmodelingprep.com/news/allison-transmission-korn-ferry-johnson-johnson-poised-to-outperform-20210119.jpg
JNJ,2021-01-26,2021-01-12,2021-02-09,JNJ,,2021-01-19 13:17:36,2021-01-19T13:17:36-05:00,2021-01-19,Healthcare Stocks Appear Set to Move Higher,Nearby levels of support and recent closes beyond key resistance are creating lucrative risk/reward setups in the healthcare sector.,investopedia.com,https://www.investopedia.com/healthcare-stocks-appear-set-to-move-higher-5095993,https://images.financialmodelingprep.com/news/healthcare-stocks-appear-set-to-move-higher-20210119.jpg
JNJ,2021-01-26,2021-01-12,2021-02-09,JNJ,,2021-01-19 15:48:27,2021-01-19T15:48:27-05:00,2021-01-19,The 7 Best Stocks To Buy In The Dow Jones Today,The Dow Jones Industrial Index is one of the cornerstone indexes of the U.S. markets. But it's more consumer-driven now.,investorplace.com,https://investorplace.com/2021/01/the-7-best-stocks-to-buy-in-the-dow-jones-today/,https://images.financialmodelingprep.com/news/the-7-best-stocks-to-buy-in-the-dow-20210119.jpg
JNJ,2021-01-26,2021-01-12,2021-02-09,JNJ,,2021-01-20 03:41:50,2021-01-20T03:41:50-05:00,2021-01-20,Dividend Income Summary: Bert's December 2020 Summary - New Record,"In December, we received $4,699.20 in dividend income. That is a 23.4% increase compared to last year. We received $3,500 from our retirement accounts this month alone. In total, our dividend income increased nearly $10 from dividend increases.",seekingalpha.com,https://seekingalpha.com/article/4399836-dividend-income-summary-berts-december-2020-summary-new-record,https://images.financialmodelingprep.com/news/dividend-income-summary-berts-december-2020-summary-new-record-20210120.jpg
JNJ,2021-01-26,2021-01-12,2021-02-09,JNJ,,2021-01-20 09:27:52,2021-01-20T09:27:52-05:00,2021-01-20,"In This Overheated Market, It's Not If But When. Here's How To Prepare","In This Overheated Market, It's Not If But When. Here's How To Prepare",seekingalpha.com,https://seekingalpha.com/article/4399873-in-this-overheated-market-not-when-how-to-prepare,https://images.financialmodelingprep.com/news/in-this-overheated-market-its-not-if-but-when-20210120.jpg
JNJ,2021-01-26,2021-01-12,2021-02-09,JNJ,,2021-01-20 11:03:11,2021-01-20T11:03:11-05:00,2021-01-20,9 Beginner Stocks for First-Time Investors,"If you have a long-term outlook for your portfolio, these beginner stocks to buy should make you very happy down the line. The post 9 Beginner Stocks for First-Time Investors appeared first on InvestorPlace.",investorplace.com,https://investorplace.com/2021/01/9-beginner-stocks-for-first-time-investors-to-buy/,https://images.financialmodelingprep.com/news/9-beginner-stocks-for-firsttime-investors-20210120.jpg
JNJ,2021-01-26,2021-01-12,2021-02-09,JNJ,,2021-01-20 11:52:55,2021-01-20T11:52:55-05:00,2021-01-20,Covid-19 Vaccine Roundup: 5 Pharma Stocks Making the Biggest Headlines Today,Covid-19 pharma stocks like NVAX stock and BNTX stock are making headlines as Joe Biden promises to vaccinate 100 million Americans. The post Covid-19 Vaccine Roundup: 5 Pharma Stocks Making the Biggest Headlines Today appeared first on InvestorPlace.,investorplace.com,https://investorplace.com/2021/01/covid-19-vaccine-5-pharma-stocks-headlines-today-nvax-stock-bntx-stock/,https://images.financialmodelingprep.com/news/covid19-vaccine-roundup-5-pharma-stocks-making-the-biggest-20210120.jpg
JNJ,2021-01-26,2021-01-12,2021-02-09,JNJ,,2021-01-20 18:48:20,2021-01-20T18:48:20-05:00,2021-01-20,Johnson & Johnson (JNJ) Stock Sinks As Market Gains: What You Should Know,"In the latest trading session, Johnson & Johnson (JNJ) closed at $162.38, marking a -0.25% move from the previous day.",zacks.com,https://www.zacks.com/stock/news/1249437/johnson-johnson-jnj-stock-sinks-as-market-gains-what-you-should-know,https://images.financialmodelingprep.com/news/johnson-johnson-jnj-stock-sinks-as-market-gains-what-20210120.jpg
JNJ,2021-01-26,2021-01-12,2021-02-09,JNJ,,2021-01-21 00:33:00,2021-01-21T00:33:00-05:00,2021-01-21,These 3 Stocks Just Hit All-Time Highs -- And They Still Look Unstoppable,Don't let an expensive share price stop you from buying the best.,fool.com,https://www.fool.com/investing/2021/01/21/these-3-stocks-just-hit-all-time-highs-and-they-st/,https://images.financialmodelingprep.com/news/these-3-stocks-just-hit-alltime-highs-and-they-20210121.jpg
JNJ,2021-01-26,2021-01-12,2021-02-09,JNJ,,2021-01-21 04:30:00,2021-01-21T04:30:00-05:00,2021-01-21,Medical Device Aristocrats For A High Class Dividend Portfolio,"Healthcare aristocrats benefit from significant medical device contributions. By and large these healthcare aristocrats share favorable quant metrics on Seeking Alpha, albeit with significant variations among the five.",seekingalpha.com,https://seekingalpha.com/article/4400093-medical-device-aristocrats-for-high-class-dividend-portfolio,https://images.financialmodelingprep.com/news/medical-device-aristocrats-for-a-high-class-dividend-portfolio-20210121.jpg
JNJ,2021-01-26,2021-01-12,2021-02-09,JNJ,,2021-01-21 06:09:00,2021-01-21T06:09:00-05:00,2021-01-21,3 COVID Stocks to Buy if You're Not a Big Risk-Taker,These stocks won't keep you up at night.,fool.com,https://www.fool.com/investing/2021/01/21/3-covid-stocks-to-buy-if-youre-not-a-big-risk-take/,https://images.financialmodelingprep.com/news/3-covid-stocks-to-buy-if-youre-not-a-20210121.jpg
JNJ,2021-01-26,2021-01-12,2021-02-09,JNJ,,2021-01-21 07:07:00,2021-01-21T07:07:00-05:00,2021-01-21,Is Johnson & Johnson a Buy?,This innovative drugmaker is expecting multiple growth catalysts in 2021.,fool.com,https://www.fool.com/investing/2021/01/21/is-johnson-johnson-a-buy/,https://images.financialmodelingprep.com/news/is-johnson-johnson-a-buy-20210121.jpeg
JNJ,2021-01-26,2021-01-12,2021-02-09,JNJ,,2021-01-21 10:22:30,2021-01-21T10:22:30-05:00,2021-01-21,Are Biotech Stocks a Good Idea Right Now?,Take a look at a few trending biotech stocks and decide if this is something you want to invest in.,thedogofwallstreet.com,https://thedogofwallstreet.com/axsm/are-biotech-stocks-a-good-idea-right-now,https://images.financialmodelingprep.com/news/are-biotech-stocks-a-good-idea-right-now-20210121.jpg
JNJ,2021-01-26,2021-01-12,2021-02-09,JNJ,,2021-01-21 11:31:00,2021-01-21T11:31:00-05:00,2021-01-21,"Allison Transmission, Korn Ferry And Johnson & Johnson: 3 Long Ideas Poised To Outperform","Starting 2021 by looking at the Long Ideas that performed poorly in 2020. Despite their underperformance, we remain bullish on these stocks, and they all remain open long ideas.",seekingalpha.com,https://seekingalpha.com/article/4400184-allison-transmission-korn-ferry-and-johnson-johnson-3-long-ideas-poised-to-outperform,https://images.financialmodelingprep.com/news/allison-transmission-korn-ferry-and-johnson-johnson-3-long-20210121.jpg
JNJ,2021-01-26,2021-01-12,2021-02-09,JNJ,,2021-01-21 21:01:56,2021-01-21T21:01:56-05:00,2021-01-21,"Johnson & Johnson plans to have 100 million vaccines for Americans by spring, board member says","A J&J board member said “if the clinical trial works out,” the company could significantly increase the nation's Covid vaccine supply availability.",cnbc.com,https://www.cnbc.com/2021/01/21/jj-plans-to-have-100-million-vaccines-for-americans-by-spring-board-member-says.html,https://images.financialmodelingprep.com/news/johnson-johnson-plans-to-have-100-million-vaccines-for-20210121.jpeg
JNJ,2021-01-26,2021-01-12,2021-02-09,JNJ,,2021-01-22 04:51:08,2021-01-22T04:51:08-05:00,2021-01-22,2020 Portfolio Activity Summary And 2021 Target,"2020, for our investments, was a good year. We kept the cash from the Emera sale for emergency funds during the first lockdown when we weren't working.",seekingalpha.com,https://seekingalpha.com/article/4400341-2020-portfolio-activity-summary-and-2021-target,https://images.financialmodelingprep.com/news/2020-portfolio-activity-summary-and-2021-target-20210122.jpg
JNJ,2021-01-26,2021-01-12,2021-02-09,JNJ,,2021-01-22 06:16:00,2021-01-22T06:16:00-05:00,2021-01-22,3 Cheap Dividend Aristocrats to Buy Right Now,The lowest yield on this list is 2.5% and well above what the average S&P 500 stock pays today.,fool.com,https://www.fool.com/investing/2021/01/22/3-cheap-dividend-aristocrats-to-buy-right-now/,https://images.financialmodelingprep.com/news/3-cheap-dividend-aristocrats-to-buy-right-now-20210122.jpg
JNJ,2021-01-26,2021-01-12,2021-02-09,JNJ,,2021-01-22 06:43:45,2021-01-22T06:43:45-05:00,2021-01-22,"Johnson & Johnson Could Have 100 Million COVID-19 Vaccines By April, Board Member McClellan Says",Bloomberg reports that Johnson & Johnson (NYSE: JNJ) is on track to analyze data from its late-stage single-dose COVID-19 vaccine trial. Dr. Anthony Fauci said in his remarks at the White House that JNJ has enough data to begin analysis in a week or two.,benzinga.com,https://www.benzinga.com/general/biotech/21/01/19270827/johnson-johnson-could-have-100-million-covid-19-vaccines-by-april-board-member-mcclellan-says,https://images.financialmodelingprep.com/news/johnson-johnson-could-have-100-million-covid19-vaccines-by-20210122.jpg
JNJ,2021-01-26,2021-01-12,2021-02-09,JNJ,,2021-01-22 08:24:33,2021-01-22T08:24:33-05:00,2021-01-22,One-shot COVID-19 vaccine may give Johnson & Johnson an edge,"Less may be more when it comes to rolling out a coronavirus vaccine. Johnson & Johnson's one-dose vaccine could have an edge over Pfizer and Moderna's shots– even though it's still several weeks away from approval in the US, Wall Street analysts told The Post.",nypost.com,https://nypost.com/2021/01/22/one-shot-covid-vaccine-could-give-johnson-johnson-an-edge/,https://images.financialmodelingprep.com/news/oneshot-covid19-vaccine-may-give-johnson-johnson-an-edge-20210122.jpg
JNJ,2021-01-26,2021-01-12,2021-02-09,JNJ,,2021-01-22 09:07:28,2021-01-22T09:07:28-05:00,2021-01-22,Johnson & Johnson eyes 100M COVID-19 vaccines for US by April,"Johnson & Johnson hopes to have enough COVID-19 vaccines for 100 million Americans by April as the feds ramp up nationwide inoculation efforts, a company official says.",nypost.com,https://nypost.com/2021/01/22/johnson-johnson-eyes-100-million-covid-vaccines-by-april/,https://images.financialmodelingprep.com/news/johnson-johnson-eyes-100m-covid19-vaccines-for-us-by-20210122.jpg
JNJ,2021-01-26,2021-01-12,2021-02-09,JNJ,,2021-01-22 09:26:00,2021-01-22T09:26:00-05:00,2021-01-22,Johnson & Johnson Aims for 100 Million Vaccine Doses by Spring. The Stock Market Is Counting on It.,"More data on the Johnson & Johnson vaccine, expected in the coming days, will have ripple effects across the market.",barrons.com,https://www.barrons.com/articles/johnson-johnson-aims-for-100-million-vaccine-doses-by-spring-the-stock-market-is-counting-on-it-51611325577,https://images.financialmodelingprep.com/news/johnson-johnson-aims-for-100-million-vaccine-doses-by-spring-20210122.jpg
JNJ,2021-01-26,2021-01-12,2021-02-09,JNJ,,2021-01-22 09:47:27,2021-01-22T09:47:27-05:00,2021-01-22,J&J (JNJ) to Get the Ball Rolling for Pharma Q4 Earnings,J&J's (JNJ) Pharma segment is expected to have performed above market while continued procedure stabilization is expected to have benefited the Medical Devices segment in the fourth quarter.,zacks.com,https://www.zacks.com/stock/news/1250356/jj-jnj-to-get-the-ball-rolling-for-pharma-q4-earnings,https://images.financialmodelingprep.com/news/jj-jnj-to-get-the-ball-rolling-for-pharma-20210122.jpeg
