ticker,event_date,window_start,window_end,symbol,symbols,publishedDate,publishedDateET,date_et,title,text,site,url,image
AMD,2022-05-03,2022-04-26,2022-05-17,AMD,,2022-05-17 12:29:29,2022-05-17T12:29:29-04:00,2022-05-17,Why Is Advanced Micro Devices (AMD) Stock Up Today?,Advanced Micro Devices (AMD) stock is heading higher on Tuesday following an upgrade from Piper Sandler analyst Harsh Kumar. The post Why Is Advanced Micro Devices (AMD) Stock Up Today?,investorplace.com,https://investorplace.com/2022/05/why-is-advanced-micro-devices-amd-stock-up-today/,https://images.financialmodelingprep.com/news/why-is-advanced-micro-devices-amd-stock-up-today-20220517.jpg
AMD,2022-05-03,2022-04-26,2022-05-17,AMD,,2022-05-17 12:41:37,2022-05-17T12:41:37-04:00,2022-05-17,Be Bullish on Advanced Micro Devices After Across-the-Board Earnings Beats,An optimistic second-quarter sales forecast should help to assuage AMD stock holders' supply-chain issue fears. The post Be Bullish on Advanced Micro Devices After Across-the-Board Earnings Beats appeared first on InvestorPlace.,investorplace.com,https://investorplace.com/2022/05/be-bullish-on-amd-stock-after-across-the-board-earnings-beats/,https://images.financialmodelingprep.com/news/be-bullish-on-advanced-micro-devices-after-acrosstheboard-earnings-20220517.jpg
AMD,2022-05-03,2022-04-26,2022-05-17,AMD,,2022-05-17 13:37:35,2022-05-17T13:37:35-04:00,2022-05-17,My Top 3 Stocks For The Overdue Countertrend Rally,"The S&P 500 has dropped by 20% from its all-time high, and it's probably time for a strong countertrend rally. We've seen three waves since the year began, and the fourth wave could take stocks significantly higher, for now.",seekingalpha.com,https://seekingalpha.com/article/4512558-my-top-three-stocks-for-the-overdue-countertrend-rally,https://images.financialmodelingprep.com/news/my-top-3-stocks-for-the-overdue-countertrend-rally-20220517.jpg
AMD,2022-05-03,2022-04-26,2022-05-17,AMD,,2022-05-17 13:52:04,2022-05-17T13:52:04-04:00,2022-05-17,Why Advanced Micro Devices Stock Advanced 8% Today,"Two weeks ago, an analyst goofed on valuing AMD. Today it's issuing a very public mea culpa -- and investors are noticing.",fool.com,https://www.fool.com/investing/2022/05/17/why-advanced-micro-devices-stock-advanced-8-today/,https://images.financialmodelingprep.com/news/why-advanced-micro-devices-stock-advanced-8-today-20220517.jpg
AMD,2022-05-03,2022-04-26,2022-05-17,AMD,,2022-05-17 14:01:06,2022-05-17T14:01:06-04:00,2022-05-17,Investors Are Jumping on the Bandwagon With These 2 Nasdaq Stocks,"The major indexes were rising on Tuesday, and these stocks got some key recommendations.",fool.com,https://www.fool.com/investing/2022/05/17/investors-are-jumping-on-the-bandwagon-with-these/,https://images.financialmodelingprep.com/news/investors-are-jumping-on-the-bandwagon-with-these-2-20220517.jpg
AMD,2022-05-03,2022-04-26,2022-05-17,AMD,,2022-05-17 15:26:38,2022-05-17T15:26:38-04:00,2022-05-17,Advanced Micro Devices Stock Offers More Than 36.50% Upside for Buyers,"An ""overweight"" recommendation from Piper Jaffrey undercuts everything else that makes AMD stock a very strong buy today The post Advanced Micro Devices Stock Offers More Than 36.50% Upside for Buyers appeared first on InvestorPlace. More From InvestorPlace Stock Prodigy Who Found NIO at $2… Says Buy THIS It doesn't matter if you have $500 in savings or $5 million.",investorplace.com,https://investorplace.com/2022/05/advanced-micro-devices-stock-offers-more-than-36-50-upside-for-buyers/,https://images.financialmodelingprep.com/news/advanced-micro-devices-stock-offers-more-than-3650-upside-20220517.jpg
AMD,2022-05-03,2022-04-26,2022-05-17,AMD,,2022-05-17 18:10:09,2022-05-17T18:10:09-04:00,2022-05-17,Piper Sandler: AMD shares could jump 40%,Shares of Advanced Micro Devices Inc (NASDAQ: AMD) closed nearly 9.0% up on Tuesday after Piper Sandler turned bullish on the multinational semiconductor company. Harsh Kumar sees upside to $140 in AMD shares Analyst Harsh Kumar upgraded AMD to “overweight” this morning with a price target of $140 that represents a 40% upside from here.,invezz.com,https://invezz.com/news/2022/05/17/piper-sandler-amd-shares-could-jump-40/,https://images.financialmodelingprep.com/news/piper-sandler-amd-shares-could-jump-40-20220517.jpg
