ticker,event_date,window_start,window_end,symbol,symbols,publishedDate,publishedDateET,date_et,title,text,site,url,image
AMD,2022-05-03,2022-04-26,2022-05-17,AMD,,2022-04-26 16:27:01,2022-04-26T16:27:01-04:00,2022-04-26,"Nasdaq Falls 4% As Tesla, AMD Take A Big Slide",U.S. indices fell sharply Tuesday as stocks continue to drop amid concerns over the potential economic impacts of Fed rate hikes and the Russia-Ukraine conflict. Traders and investors are also weighing recent earnings reports.,benzinga.com,https://www.benzinga.com/after-hours-center/22/04/26825681/tesla-amd-lead-the-nasdaq-4-lower,https://images.financialmodelingprep.com/news/nasdaq-falls-4-as-tesla-amd-take-a-big-20220426.jpg
AMD,2022-05-03,2022-04-26,2022-05-17,AMD,,2022-04-26 18:50:09,2022-04-26T18:50:09-04:00,2022-04-26,Why AMD Stock Dropped Today,Investors are troubled by the prospect of a global recession and a looming chip supply glut.,fool.com,https://www.fool.com/investing/2022/04/26/why-amd-stock-dropped-today/,https://images.financialmodelingprep.com/news/why-amd-stock-dropped-today-20220426.jpg
AMD,2022-05-03,2022-04-26,2022-05-17,AMD,,2022-04-26 20:45:41,2022-04-26T20:45:41-04:00,2022-04-26,Top Semiconductor Stocks To Watch Right Now,Which semiconductor stocks do you have on your May watchlist?,stockmarket.com,https://stockmarket.com/featured/top-semiconductor-stocks-to-watch-right-now-2022-04-26,https://images.financialmodelingprep.com/news/top-semiconductor-stocks-to-watch-right-now-20220426.jpg
AMD,2022-05-03,2022-04-26,2022-05-17,AMD,,2022-04-27 06:40:23,2022-04-27T06:40:23-04:00,2022-04-27,The Pullback in Advanced Micro Devices Stock Is a Near-Term Overreaction,"A rebound may take time to arrive, but if you've been waiting for a great entry point for AMD stock, now's the time to act. The post The Pullback in Advanced Micro Devices Stock Is a Near-Term Overreaction appeared first on InvestorPlace.",investorplace.com,https://investorplace.com/2022/04/the-pullback-in-amd-stock-is-a-near-term-overreaction/,https://images.financialmodelingprep.com/news/the-pullback-in-advanced-micro-devices-stock-is-a-20220427.jpg
AMD,2022-05-03,2022-04-26,2022-05-17,AMD,,2022-04-27 11:56:27,2022-04-27T11:56:27-04:00,2022-04-27,The Aggressive Investor Is Buying AMD Stock Ahead of Earnings,"Just days until Advanced Micro Devices reports earnings, Raymond James analyst Chris Caso upgraded AMD stock to Strong Buy. It's a buy.",investorplace.com,https://investorplace.com/2022/04/the-aggressive-investor-is-buying-amd-stock-ahead-of-earnings/,https://images.financialmodelingprep.com/news/the-aggressive-investor-is-buying-amd-stock-ahead-of-20220427.jpg
AMD,2022-05-03,2022-04-26,2022-05-17,AMD,,2022-04-28 13:36:05,2022-04-28T13:36:05-04:00,2022-04-28,Why AMD Shares Are Rising,"Shares of semiconductor stocks, including Advanced Micro Devices, Inc. (NASDAQ: AMD), are trading higher in sympathy with QUALCOMM, Inc. (NASDAQ: QCOM), which reported better-than-expected second-quarter EPS and sales results. Qualcomm reported fiscal second-quarter revenue of $11.16 billion, which.",benzinga.com,https://www.benzinga.com/markets/cryptocurrency/22/04/26876280/why-amd-shares-are-rising,https://images.financialmodelingprep.com/news/why-amd-shares-are-rising-20220428.jpg
AMD,2022-05-03,2022-04-26,2022-05-17,AMD,,2022-04-28 17:18:04,2022-04-28T17:18:04-04:00,2022-04-28,Have Microchip Stocks Declined Into an Attractive Buying Level?,"When COVID-19 stormed the world by surprise, semiconductor-enabled technologies were a bright spot in an otherwise dark world. They allowed us to work, study, and stay connected remotely while the outside world quickly shut down.",zacks.com,https://www.zacks.com/commentary/1910722/have-microchip-stocks-declined-into-an-attractive-buying-level,https://images.financialmodelingprep.com/news/have-microchip-stocks-declined-into-an-attractive-buying-level-20220428.jpg
AMD,2022-05-03,2022-04-26,2022-05-17,AMD,,2022-04-28 18:39:00,2022-04-28T18:39:00-04:00,2022-04-28,"AMD, Skyworks, and Micron Bounced Back Today",These large-cap semiconductor stocks rose dramatically on good news from a fourth sector-leading peer.,fool.com,https://www.fool.com/investing/2022/04/28/amd-skyworks-and-micron-bounced-back-today/,https://images.financialmodelingprep.com/news/amd-skyworks-and-micron-bounced-back-today-20220428.jpg
AMD,2022-05-03,2022-04-26,2022-05-17,AMD,,2022-04-29 04:24:00,2022-04-29T04:24:00-04:00,2022-04-29,"AMD, NVIDIA, and Qualcomm Fall After Intel Flags Problems Ahead","Computer sales are slowing as the pandemic ends and the economic outlook is uncertain, raising concerns for chip makers.",barrons.com,https://www.barrons.com/articles/amd-nvidia-and-qualcomm-intel-chip-problems-51651220603,https://images.financialmodelingprep.com/news/amd-nvidia-and-qualcomm-fall-after-intel-flags-problems-20220429.jpg
AMD,2022-05-03,2022-04-26,2022-05-17,AMD,,2022-04-29 08:19:00,2022-04-29T08:19:00-04:00,2022-04-29,"AMD, Nvidia, and Qualcomm Stocks Fall After Intel Flags Problems Ahead","PC sales are slowing as the Covid-19 pandemic phase looks to be ending and the economic outlook is uncertain, raising concerns for chip makers.",barrons.com,https://www.barrons.com/articles/amd-nvidia-qualcomm-intel-stock-price-chip-problems-51651220603,https://images.financialmodelingprep.com/news/amd-nvidia-and-qualcomm-stocks-fall-after-intel-flags-20220429.jpg
AMD,2022-05-03,2022-04-26,2022-05-17,AMD,,2022-04-29 08:48:43,2022-04-29T08:48:43-04:00,2022-04-29,7 Large-Cap Growth Stocks to Go Gaga For,Institutional investors are frantically repricing stocks. That is creating an opportunity for these large-cap growth stocks.,investorplace.com,https://investorplace.com/2022/04/7-large-cap-growth-stocks-to-go-gaga-for/,https://images.financialmodelingprep.com/news/7-largecap-growth-stocks-to-go-gaga-for-20220429.jpg
AMD,2022-05-03,2022-04-26,2022-05-17,AMD,,2022-04-29 09:54:17,2022-04-29T09:54:17-04:00,2022-04-29,AMD: Be Greedy When Others Are Fearful,Advanced Micro Devices is a technologically strong semiconductor company with an attractive growth track record. New product launches and the Xilinx acquisition should make 2022 a strong year.,seekingalpha.com,https://seekingalpha.com/article/4505035-amd-be-greedy-when-others-are-fearful,https://images.financialmodelingprep.com/news/amd-be-greedy-when-others-are-fearful-20220429.jpg
AMD,2022-05-03,2022-04-26,2022-05-17,AMD,,2022-04-29 13:33:20,2022-04-29T13:33:20-04:00,2022-04-29,Advanced Micro Devices (AMD) to Post Q1 Earnings: What to Expect?,Advanced Micro Devices' (AMD) first-quarter 2022 performance is likely to have benefited from momentum in the adoption of semi-custom and EPYC server processors.,zacks.com,https://www.zacks.com/stock/news/1912172/advanced-micro-devices-amd-to-post-q1-earnings-what-to-expect,https://images.financialmodelingprep.com/news/advanced-micro-devices-amd-to-post-q1-earnings-what-20220429.jpg
AMD,2022-05-03,2022-04-26,2022-05-17,AMD,,2022-04-29 17:53:31,2022-04-29T17:53:31-04:00,2022-04-29,3 Semiconductor Stocks Providing Better Value Than Intel,"On Thursday, Intel Corp. ( INTC , Financial) delivered earnings and revenue beats for its first quarter of fiscal 2022, which ended on April 2. Adjusted earnings were 87 cents per share versus the 81 cents expected by analysts, while revenue came in at $18.31 billion versus estimates for $18.31 billion.",gurufocus.com,https://www.gurufocus.com/news/1699712/3-semiconductor-stocks-providing-better-value-than-intel,https://images.financialmodelingprep.com/news/3-semiconductor-stocks-providing-better-value-than-intel-20220429.jpg
AMD,2022-05-03,2022-04-26,2022-05-17,AMD,,2022-04-29 18:28:00,2022-04-29T18:28:00-04:00,2022-04-29,Earnings Outlook: AMD's earnings outlook expected to give a clearer picture of where the chip sector is headed,"Advanced Micro Devices Inc. has served as a bellwether in chip-sector earnings of late, usually playing the foil to Intel Corp.'s report, so analysts will keep a sharp eye on how the company expects 2022 to play out when AMD reports earnings Tuesday.",marketwatch.com,https://www.marketwatch.com/story/amds-earnings-outlook-expected-to-give-a-clearer-picture-of-where-the-chip-sector-is-headed-11651271321,https://images.financialmodelingprep.com/news/earnings-outlook-amds-earnings-outlook-expected-to-give-a-20220429.jpg
AMD,2022-05-03,2022-04-26,2022-05-17,AMD,,2022-04-30 08:13:00,2022-04-30T08:13:00-04:00,2022-04-30,"The Semiconductor Shortage Is Far From Over, According to Industry Executives",Manufacturers are still behind the eight ball when trying to fulfill customer demand.,fool.com,https://www.fool.com/investing/2022/04/30/the-semiconductor-shortage-is-far-from-over/,https://images.financialmodelingprep.com/news/the-semiconductor-shortage-is-far-from-over-according-to-20220430.jpg
AMD,2022-05-03,2022-04-26,2022-05-17,AMD,,2022-05-01 07:01:13,2022-05-01T07:01:13-04:00,2022-05-01,3 Semiconductor Stocks to Buy for May 2022,"Despite fears of a semiconductor cycle correction, the industry is poised to growth strongly, thanks to solid uptake of memory chips and 5G migration. The post 3 Semiconductor Stocks to Buy for May 2022 appeared first on InvestorPlace.",investorplace.com,https://investorplace.com/2022/05/https-investorplace-com-p2223938previewtrue/,https://images.financialmodelingprep.com/news/3-semiconductor-stocks-to-buy-for-may-2022-20220501.jpg
AMD,2022-05-03,2022-04-26,2022-05-17,AMD,,2022-05-02 09:13:29,2022-05-02T09:13:29-04:00,2022-05-02,"Earnings Previews: Airbnb, AMD, Livent",The normally quiet weekend was livened up this past Saturday with Berkshire Hathaway's annual shareholders' meeting and quarterly report.,247wallst.com,https://247wallst.com/investing/2022/05/02/earnings-previews-airbnb-amd-livent/,https://images.financialmodelingprep.com/news/earnings-previews-airbnb-amd-livent-20220502.jpg
AMD,2022-05-03,2022-04-26,2022-05-17,AMD,,2022-05-02 12:02:07,2022-05-02T12:02:07-04:00,2022-05-02,AMD's Q1 Earnings: Semi-Custom & EPYC Demand to Aid Growth,AMD's Q1 performance is expected to have benefited from strength in EPYC processors and momentum in semi-custom products' sales.,zacks.com,https://www.zacks.com/stock/news/1913500/amd-s-q1-earnings-semi-custom-epyc-demand-to-aid-growth,https://images.financialmodelingprep.com/news/amds-q1-earnings-semicustom-epyc-demand-to-aid-growth-20220502.jpg
AMD,2022-05-03,2022-04-26,2022-05-17,AMD,,2022-05-02 15:48:03,2022-05-02T15:48:03-04:00,2022-05-02,Advanced Micro Devices (AMD) Q1 Preview: Can Shares Return to Former Glory?,"AMD shares, down nearly 40% in 2022, look to find a new uptrend with strong year-over-year forecasted growth rates.",zacks.com,https://www.zacks.com/commentary/1913653/advanced-micro-devices-amd-q1-preview-can-shares-return-to-former-glory,https://images.financialmodelingprep.com/news/advanced-micro-devices-amd-q1-preview-can-shares-return-20220502.jpg
AMD,2022-05-03,2022-04-26,2022-05-17,AMD,,2022-05-03 08:46:59,2022-05-03T08:46:59-04:00,2022-05-03,Essentra Packaging teams up with AMD to develop cost-effect smart packaging,"Essentra Packaging, part of FTSE 250 group Essentra PLC (LSE:ESNT), has made public a collaboration with Advanced Material Development (AMD), developing new smart packaging technology for the pharmaceutical sector. The pair will work on a new generation of time temperature indicators (TTIs), which are smart labels that show if a product has been subjected to excessive temperatures and for how long.",proactiveinvestors.co.uk,https://www.proactiveinvestors.co.uk/companies/news/981180?SNAPI,https://images.financialmodelingprep.com/news/essentra-packaging-teams-up-with-amd-to-develop-costeffect-20220503.jpg
AMD,2022-05-03,2022-04-26,2022-05-17,AMD,,2022-05-03 09:15:00,2022-05-03T09:15:00-04:00,2022-05-03,AMD: Already Baked In,AMD is now priced for serious weakness in the chip business while the data continues to support strong growth. The company remains supply constrained with Intel still forecasting chip challenges until 2024.,seekingalpha.com,https://seekingalpha.com/article/4506031-amd-already-baked-in,https://images.financialmodelingprep.com/news/amd-already-baked-in-20220503.jpg
AMD,2022-05-03,2022-04-26,2022-05-17,AMD,,2022-05-03 12:02:55,2022-05-03T12:02:55-04:00,2022-05-03,Fed's Crucial FOMC Meeting in Focus,Fed's Crucial FOMC Meeting in Focus.,zacks.com,https://www.zacks.com/stock/news/1914373/fed-s-crucial-fomc-meeting-in-focus,https://images.financialmodelingprep.com/news/feds-crucial-fomc-meeting-in-focus-20220503.jpg
AMD,2022-05-03,2022-04-26,2022-05-17,AMD,,2022-05-03 12:34:04,2022-05-03T12:34:04-04:00,2022-05-03,How to Trade Advanced Micro Devices Stock After the Print,"AMD stock has been pummeled, with its recent lows coming in at a near-50% decline from the highs. But there is an opportunity with this one.",investorplace.com,https://investorplace.com/2022/05/how-to-trade-advanced-micro-devices-stock-after-the-print/,https://images.financialmodelingprep.com/news/how-to-trade-advanced-micro-devices-stock-after-the-20220503.jpg
AMD,2022-05-03,2022-04-26,2022-05-17,AMD,,2022-05-03 13:00:05,2022-05-03T13:00:05-04:00,2022-05-03,3 High Beta Stocks that Could Rocket When the Market Rallies,High Beta stocks are worthwhile due to their increased ability to provide greater returns. These three look to be in strong position now.,investorplace.com,https://investorplace.com/2022/05/3-high-beta-stocks-that-could-rocket-when-the-market-rallies/,https://images.financialmodelingprep.com/news/3-high-beta-stocks-that-could-rocket-when-the-20220503.jpg
AMD,2022-05-03,2022-04-26,2022-05-17,AMD,,2022-05-03 15:57:04,2022-05-03T15:57:04-04:00,2022-05-03,How To Trade Advanced Micro Devices Stock Heading Into Q4 Earnings,"Advanced Micro Devices, Inc (NASDAQ: AMD) is set to print its first-quarter financial results after the market closes on Thursday. When the semiconductor company printed its fourth-quarter results on Feb. 1, the stock soared 12% higher over the six trading days that followed before topping out at.",benzinga.com,https://www.benzinga.com/trading-ideas/technicals/22/05/26974345/how-to-trade-advanced-micro-devices-amd-stock-heading-into-q4-earnings,https://images.financialmodelingprep.com/news/how-to-trade-advanced-micro-devices-stock-heading-into-20220503.jpg
AMD,2022-05-03,2022-04-26,2022-05-17,AMD,,2022-05-03 16:10:00,2022-05-03T16:10:00-04:00,2022-05-03,AMD Reports First Quarter 2022 Financial Results,― Record quarterly revenue of $5.9 billion grew 71% year-over-year;  Gross margin grew 2 percentage points and  non-GAAP gross margin grew 7 percentage points year-over-year ―,globenewswire.com,https://www.globenewswire.com/news-release/2022/05/03/2435070/0/en/AMD-Reports-First-Quarter-2022-Financial-Results.html,https://images.financialmodelingprep.com/news/amd-reports-first-quarter-2022-financial-results-20220503.jpg
AMD,2022-05-03,2022-04-26,2022-05-17,AMD,,2022-05-03 16:19:00,2022-05-03T16:19:00-04:00,2022-05-03,AMD forecasts current-quarter revenue above estimates,"Advanced Micro Devices Inc forecast second-quarter revenue above market expectations on Tuesday, betting on steady demand for its chips used in data centers and gaming consoles.",reuters.com,https://www.reuters.com/technology/amd-forecasts-current-quarter-revenue-above-estimates-2022-05-03/,https://images.financialmodelingprep.com/news/amd-forecasts-currentquarter-revenue-above-estimates-20220503.jpg
AMD,2022-05-03,2022-04-26,2022-05-17,AMD,,2022-05-03 16:21:10,2022-05-03T16:21:10-04:00,2022-05-03,"AMD sales jump 71%, shrugging off concerns about PC slowdown","AMD reported first-quarter earnings after the bell on Tuesday, beating analyst estimates for earnings and revenue.",cnbc.com,https://www.cnbc.com/2022/05/03/amd-earnings-q1-2022.html,https://images.financialmodelingprep.com/news/amd-sales-jump-71-shrugging-off-concerns-about-pc-20220503.jpg
AMD,2022-05-03,2022-04-26,2022-05-17,AMD,,2022-05-03 18:49:36,2022-05-03T18:49:36-04:00,2022-05-03,Advanced Micro Devices (AMD) Q1 Earnings and Revenues Beat Estimates,"Advanced Micro (AMD) delivered earnings and revenue surprises of 24.18% and 17.73%, respectively, for the quarter ended March 2022. Do the numbers hold clues to what lies ahead for the stock?",zacks.com,https://www.zacks.com/stock/news/1914827/advanced-micro-devices-amd-q1-earnings-and-revenues-beat-estimates,https://images.financialmodelingprep.com/news/advanced-micro-devices-amd-q1-earnings-and-revenues-beat-20220503.png
AMD,2022-05-03,2022-04-26,2022-05-17,AMD,,2022-05-03 20:23:00,2022-05-03T20:23:00-04:00,2022-05-03,MarketWatch First Take: AMD will finally give investors its data-center data as business soars,Advanced Micro Devices Inc.'s data-center business will finally get its own spotlight.,marketwatch.com,https://www.marketwatch.com/story/amd-will-finally-give-investors-its-data-center-data-as-business-soars-11651623801,https://images.financialmodelingprep.com/news/marketwatch-first-take-amd-will-finally-give-investors-its-20220503.jpg
AMD,2022-05-03,2022-04-26,2022-05-17,AMD,,2022-05-03 21:30:24,2022-05-03T21:30:24-04:00,2022-05-03,AMD reports a ‘pretty good' Q1: Pro says stock is reasonably valued,Shares of Advanced Micro Devices Inc (NASDAQ: AMD) are up more than 5.0% in extended trading after the semiconductor company reported market-beating results for its fiscal Q1. The company also raised its future guidance on acquisition of Xilinx and strong data centre revenue.,invezz.com,https://invezz.com/news/2022/05/04/amd-reports-a-pretty-good-q1-pro-says-stock-is-reasonably-valued/,https://images.financialmodelingprep.com/news/amd-reports-a-pretty-good-q1-pro-says-stock-20220503.jpg
AMD,2022-05-03,2022-04-26,2022-05-17,AMD,,2022-05-03 21:40:24,2022-05-03T21:40:24-04:00,2022-05-03,"Advanced Micro Devices, Inc.'s (AMD) CEO Dr. Lisa Su on Q1 2022 Results - Earnings Call Transcript","Advanced Micro Devices, Inc. (NASDAQ:AMD ) Q1 2022 Earnings Conference Call May 3, 2022 5:00 PM ET Company Participants Laura Graves - Corporate Vice President, Investor Relations Dr. Lisa Su - Chair and CEO Devinder Kumar - Executive Vice President, Chief Financial Officer and Treasurer Victor Peng - President, AMD's Adaptive and Embedded Computing Group Conference Call Participants Matt Ramsay - Cowen Toshiya Hari - Goldman Sachs Vivek Arya - Bank of America Stacy Rasgon - Bernstein Research Aaron Rakers - Wells Fargo Harlan Sur - JPMorgan Mark Lipacis - Jefferies Ross Seymore - Deutsche Bank Timothy Arcuri - UBS Brett Simpson - Arete Research Operator Hello. And welcome to the AMD First Quarter 2022 Earnings Conference Call.",seekingalpha.com,https://seekingalpha.com/article/4506537-advanced-micro-devices-inc-s-amd-ceo-dr-lisa-su-on-q1-2022-results-earnings-call-transcript,https://images.financialmodelingprep.com/news/advanced-micro-devices-incs-amd-ceo-dr-lisa-su-20220503.jpg
AMD,2022-05-03,2022-04-26,2022-05-17,AMD,,2022-05-04 08:05:00,2022-05-04T08:05:00-04:00,2022-05-04,3 Growth Stocks You Can Buy and Hold for the Next Decade,These three companies should thrive over the next 10 years.,fool.com,https://www.fool.com/investing/2022/05/04/3-breakout-growth-stocks-you-can-buy-and-hold-for/,https://images.financialmodelingprep.com/news/3-growth-stocks-you-can-buy-and-hold-for-20220504.jpg
AMD,2022-05-03,2022-04-26,2022-05-17,AMD,,2022-05-04 09:26:04,2022-05-04T09:26:04-04:00,2022-05-04,AMD Crushes Earnings -- Is It a Buy Now?,"AMD recently completed its acquisition of Xilinx to diversify into data centers, but can AMD navigate 2022's supply chain and inflationary challenges?",fool.com,https://www.fool.com/investing/2022/05/04/amd-crushes-earnings-is-amd-stock-a-buy-now/,https://images.financialmodelingprep.com/news/amd-crushes-earnings-is-it-a-buy-now-20220504.jpg
AMD,2022-05-03,2022-04-26,2022-05-17,AMD,,2022-05-04 09:28:04,2022-05-04T09:28:04-04:00,2022-05-04,Why AMD Shares Are Rising,"Advanced Micro Devices, Inc. (NASDAQ: AMD) shares are trading higher by 6.32% to $96.89 during Wednesday's pre-market session after the company reported better-than-expected first-quarter adjusted EPS and sales results and raised FY22 sales guidance. AMD reported quarterly earnings of $1.13.",benzinga.com,https://www.benzinga.com/markets/cryptocurrency/22/05/26989965/why-amd-shares-are-rising,https://images.financialmodelingprep.com/news/why-amd-shares-are-rising-20220504.jpg
AMD,2022-05-03,2022-04-26,2022-05-17,AMD,,2022-05-04 09:51:00,2022-05-04T09:51:00-04:00,2022-05-04,Why Advanced Micro Devices Stock Fell 21.8% in April,"AMD fell hard in April, but looks to be on the upswing in May.",fool.com,https://www.fool.com/investing/2022/05/04/why-advanced-micro-devices-fell-218-in-april/,https://images.financialmodelingprep.com/news/why-advanced-micro-devices-stock-fell-218-in-april-20220504.jpg
AMD,2022-05-03,2022-04-26,2022-05-17,AMD,,2022-05-04 09:55:56,2022-05-04T09:55:56-04:00,2022-05-04,"Stock Market Today: Dow Jones, S&P 500 Ticked Higher Ahead Of Fed Decision; AMD Stock Up On Solid Earnings",Markets open higher as investors eagerly await the Federal Reserve's latest monetary policy decision,stockmarket.com,https://stockmarket.com/featured/stock-market-today-dow-jones-s-amd-stock-up-on-solid-earnings-2022-05-04,https://images.financialmodelingprep.com/news/stock-market-today-dow-jones-sp-500-ticked-higher-20220504.jpeg
AMD,2022-05-03,2022-04-26,2022-05-17,AMD,,2022-05-04 10:05:27,2022-05-04T10:05:27-04:00,2022-05-04,The S&P 500 Can Repeat the March Performance This Month,SPY stock is down but not out. The news tide can turn swiftly and the buyers will step right back into it starting with buyback programs.,investorplace.com,https://investorplace.com/2022/05/spy-stock-can-repeat-its-march-performance-this-month/,https://images.financialmodelingprep.com/news/the-sp-500-can-repeat-the-march-performance-this-20220504.jpg
AMD,2022-05-03,2022-04-26,2022-05-17,AMD,,2022-05-04 12:00:00,2022-05-04T12:00:00-04:00,2022-05-04,Good Stocks To Buy Right Now? 3 Consumer Tech Stocks In Focus,Could these consumer tech names be good buys amid the Fed's latest interest rate update?,stockmarket.com,https://stockmarket.com/featured/good-stocks-to-buy-right-now-3-consumer-tech-stocks-in-focus-2022-05-04,https://images.financialmodelingprep.com/news/good-stocks-to-buy-right-now-3-consumer-tech-20220504.jpg
AMD,2022-05-03,2022-04-26,2022-05-17,AMD,,2022-05-04 13:09:00,2022-05-04T13:09:00-04:00,2022-05-04,"The Ratings Game: AMD ‘is just a different company now,' and Wall Street is cheering","Advanced Micro Devices Inc. shares rose Wednesday, as analysts described the chip maker's earnings report as “a potential watershed moment” that proved AMD is a data-center powerhouse following its acquisition of Xilinx Inc.",marketwatch.com,https://www.marketwatch.com/story/amd-is-just-a-different-company-now-and-wall-street-is-cheering-11651684142,https://images.financialmodelingprep.com/news/the-ratings-game-amd-is-just-a-different-company-20220504.jpg
AMD,2022-05-03,2022-04-26,2022-05-17,AMD,,2022-05-04 14:17:09,2022-05-04T14:17:09-04:00,2022-05-04,"AMD Beats on Q1 Earnings & Revenues, Provides Solid '22 View","Advanced Micro Devices' (AMD) first-quarter 2022 results benefit from strong Ryzen, Radeon, and EPYC processor sales.",zacks.com,https://www.zacks.com/stock/news/1915847/amd-beats-on-q1-earnings-revenues-provides-solid-22-view,https://images.financialmodelingprep.com/news/amd-beats-on-q1-earnings-revenues-provides-solid-22-20220504.jpg
AMD,2022-05-03,2022-04-26,2022-05-17,AMD,,2022-05-04 16:20:00,2022-05-04T16:20:00-04:00,2022-05-04,Is AMD Stock a Buy Now?,Advanced Micro Devices' second-quarter results blew away internal and external expectations.,fool.com,https://www.fool.com/investing/2022/05/04/is-amd-stock-a-buy-now/,https://images.financialmodelingprep.com/news/is-amd-stock-a-buy-now-20220504.jpg
AMD,2022-05-03,2022-04-26,2022-05-17,AMD,,2022-05-04 17:25:00,2022-05-04T17:25:00-04:00,2022-05-04,Deep Dive: These 10 stock in the S&P 500 soared at least 8% after the Fed made its big move — but only 3 have gains for 2022,Wednesday turned into a big day for stocks — the S&P 500 index had its largest one-day percentage gain in nearly two years — after the Federal Reserve raised the federal funds rate by half a percentage point and announced plans to begin reducing its bond portfolio next month.,marketwatch.com,https://www.marketwatch.com/story/these-10-stock-in-the-s-p-500-soared-at-least-8-after-the-fed-made-its-big-move-but-only-3-have-gains-for-2022-11651699501,https://images.financialmodelingprep.com/news/deep-dive-these-10-stock-in-the-sp-500-20220504.jpg
AMD,2022-05-03,2022-04-26,2022-05-17,AMD,,2022-05-04 23:58:07,2022-05-04T23:58:07-04:00,2022-05-04,AMD: There's A Reason We Weren't Done,AMD is a company that we've recommended circling back to before and the company's earnings help confirm that. The company has some of the strongest products in its history with substantial YoY revenue growth and margin growth supporting strong financials.,seekingalpha.com,https://seekingalpha.com/article/4507105-amd-reason-werent-done,https://images.financialmodelingprep.com/news/amd-theres-a-reason-we-werent-done-20220504.jpg
