ticker,event_date,window_start,window_end,symbol,symbols,publishedDate,publishedDateET,date_et,title,text,site,url,image
AMD,2022-05-03,2022-04-26,2022-05-17,AMD,,2022-05-05 09:00:00,2022-05-05T09:00:00-04:00,2022-05-05,New AMD Ryzen 5000 C-Series Processors Bring Leadership Performance and All-Day Battery Life to Chrome OS,"Built on powerful “Zen 3” architecture, AMD Ryzen 5000 C-Series expands AMD reach into premium Chromebook market with new Acer and HP designs Built on powerful “Zen 3” architecture, AMD Ryzen 5000 C-Series expands AMD reach into premium Chromebook market with new Acer and HP designs",globenewswire.com,https://www.globenewswire.com/news-release/2022/05/05/2436898/0/en/New-AMD-Ryzen-5000-C-Series-Processors-Bring-Leadership-Performance-and-All-Day-Battery-Life-to-Chrome-OS.html,https://images.financialmodelingprep.com/news/new-amd-ryzen-5000-cseries-processors-bring-leadership-performance-20220505.jpg
AMD,2022-05-03,2022-04-26,2022-05-17,AMD,,2022-05-05 10:09:08,2022-05-05T10:09:08-04:00,2022-05-05,AMD: Simply Unstoppable,AMD's Data Center business is booming. Revenues and gross margins continued to soar in the last quarter.,seekingalpha.com,https://seekingalpha.com/article/4507240-amd-simply-unstoppable,https://images.financialmodelingprep.com/news/amd-simply-unstoppable-20220505.jpg
AMD,2022-05-03,2022-04-26,2022-05-17,AMD,,2022-05-05 12:15:09,2022-05-05T12:15:09-04:00,2022-05-05,Why AMD Shares Are Falling,"Shares of several companies in the broader tech sector, including Advanced Micro Devices, Inc. (NASDAQ: AMD), are trading lower amid overall weakness as traders continue to digest Wednesday's Fed rate hike announcement. An increase in yields has pressured tech and growth stocks.",benzinga.com,https://www.benzinga.com/trading-ideas/movers/22/05/27026730/why-amd-shares-are-falling,https://images.financialmodelingprep.com/news/why-amd-shares-are-falling-20220505.jpg
AMD,2022-05-03,2022-04-26,2022-05-17,AMD,,2022-05-05 13:14:19,2022-05-05T13:14:19-04:00,2022-05-05,The Smart Way to Buy Advanced Micro Devices After Earnings,Advanced Micro Devices dazzled investors with rosy earnings numbers and upbeat guidance. Here's how to trade AMD stock now.,investorplace.com,https://investorplace.com/2022/05/the-smart-way-to-buy-amd-stock-after-earnings/,https://images.financialmodelingprep.com/news/the-smart-way-to-buy-advanced-micro-devices-after-20220505.jpg
AMD,2022-05-03,2022-04-26,2022-05-17,AMD,,2022-05-05 13:21:52,2022-05-05T13:21:52-04:00,2022-05-05,AMD Stock Is a Buy on Any Pullback,AMD stock continues to be a cash machine as the earnings beat continues. Time to be a buyer whenever the chips are down.,investorplace.com,https://investorplace.com/2022/05/amd-stock-is-a-buy-on-any-pullback/,https://images.financialmodelingprep.com/news/amd-stock-is-a-buy-on-any-pullback-20220505.jpeg
AMD,2022-05-03,2022-04-26,2022-05-17,AMD,,2022-05-05 13:40:56,2022-05-05T13:40:56-04:00,2022-05-05,"Why AMD, Qualcomm, and Skyworks Solutions Stocks Just Crashed",Top semiconductor stocks are getting hit hard today.,fool.com,https://www.fool.com/investing/2022/05/05/why-amd-qualcomm-and-skyworks-solutions-stocks-jus/,https://images.financialmodelingprep.com/news/why-amd-qualcomm-and-skyworks-solutions-stocks-just-crashed-20220505.jpg
AMD,2022-05-03,2022-04-26,2022-05-17,AMD,,2022-05-05 14:08:09,2022-05-05T14:08:09-04:00,2022-05-05,Largest US Pension Fund Sold FAANG Stocks In Q1: Which Chip Stock Did It Buy Instead?,"The largest pension fund in the U.S. reduced its FAANG holdings in the first quarter amid the tech rout at the start of the year, the 13-F filed with the SEC late Wednesday revealed. FAANG Loses Favor: The California Public Employees' Retirement System, aka CalPERS, sold shares in all.",benzinga.com,https://www.benzinga.com/news/22/05/27013270/largest-u-s-pension-fund-sold-faang-stocks-in-q1-bought-this-chip-stock-instead,https://images.financialmodelingprep.com/news/largest-us-pension-fund-sold-faang-stocks-in-q1-20220505.jpg
AMD,2022-05-03,2022-04-26,2022-05-17,AMD,,2022-05-05 19:34:38,2022-05-05T19:34:38-04:00,2022-05-05,"Negative Sentiment Kills Market Indices, Dow -1063 Points","Yesterday's positive boost was completely wiped out, and the losses added to the overall bearishness we've seen over the past month.",zacks.com,https://www.zacks.com/stock/news/1917235/negative-sentiment-kills-market-indices-dow-1063-points,https://images.financialmodelingprep.com/news/negative-sentiment-kills-market-indices-dow-1063-points-20220505.jpg
AMD,2022-05-03,2022-04-26,2022-05-17,AMD,,2022-05-06 07:10:00,2022-05-06T07:10:00-04:00,2022-05-06,Tech Sell-Off: 1 Semiconductor Growth Stock to Buy Now and Hold Forever,"The demand for advanced computer chips is soaring, and AMD is moving one step ahead of the industry.",fool.com,https://www.fool.com/investing/2022/05/06/tech-sell-off-semiconductor-growth-stock-buy-hold/,https://images.financialmodelingprep.com/news/tech-selloff-1-semiconductor-growth-stock-to-buy-now-20220506.jpg
AMD,2022-05-03,2022-04-26,2022-05-17,AMD,,2022-05-06 07:50:00,2022-05-06T07:50:00-04:00,2022-05-06,AMD Is a Top Tech Stock Buy After Q1 2022,"After the sell-off, AMD looks like a long-term steal as it steadily grows in the massive data center market.",fool.com,https://www.fool.com/investing/2022/05/06/amd-is-a-top-tech-stock-buy-after-q1-2022/,https://images.financialmodelingprep.com/news/amd-is-a-top-tech-stock-buy-after-q1-20220506.jpg
AMD,2022-05-03,2022-04-26,2022-05-17,AMD,,2022-05-06 07:51:43,2022-05-06T07:51:43-04:00,2022-05-06,AMD: Consolidating Its Way To The Top,"AMD reported robust results this week that suggest it is nowhere near a slowing cycle. In fact, its continued consolidation of complementary industry peers like Xilinx and Pensando will unlock additional TAM and drive greater synergies ahead.",seekingalpha.com,https://seekingalpha.com/article/4507815-amd-q1-earnings-consolidating-its-way-to-the-top,https://images.financialmodelingprep.com/news/amd-consolidating-its-way-to-the-top-20220506.jpg
AMD,2022-05-03,2022-04-26,2022-05-17,AMD,,2022-05-06 09:23:47,2022-05-06T09:23:47-04:00,2022-05-06,AMD Stock Still Belongs on Investor's Growth and Value Shopping Lists,AMD stock continues to wow investors with exceptional financial and operational metrics. Investors should keep it on their stocks to buy list.,investorplace.com,https://investorplace.com/2022/05/amd-stock-still-belongs-on-investors-growth-and-value-shopping-lists/,https://images.financialmodelingprep.com/news/amd-stock-still-belongs-on-investors-growth-and-value-20220506.jpg
AMD,2022-05-03,2022-04-26,2022-05-17,AMD,,2022-05-06 09:59:49,2022-05-06T09:59:49-04:00,2022-05-06,AMD (NASDAQ: AMD) Shines Green In A Sea Of Red,"Despite their shares being down almost 50% from last year's all time high, Advanced Micro Devices (NASDAQ: AMD) was a welcome sight for sore eyes this week.",marketbeat.com,https://www.marketbeat.com/originals/amd-nasdaq-amd-shines-green-in-a-sea-of-red/?SNAPI,https://images.financialmodelingprep.com/news/amd-nasdaq-amd-shines-green-in-a-sea-of-red-20220506.jpg
AMD,2022-05-03,2022-04-26,2022-05-17,AMD,,2022-05-06 18:48:09,2022-05-06T18:48:09-04:00,2022-05-06,AMD vs. Nvidia: Which Chip Giant Should Investors Buy?,"It's not easy to play favoritism between these two chip giants. While both companies are thrilling and innovative investments, one must come out on top.",zacks.com,https://www.zacks.com/commentary/1918095/amd-vs-nvidia-which-chip-giant-should-investors-buy,https://images.financialmodelingprep.com/news/amd-vs-nvidia-which-chip-giant-should-investors-buy-20220506.jpg
AMD,2022-05-03,2022-04-26,2022-05-17,AMD,,2022-05-07 07:42:00,2022-05-07T07:42:00-04:00,2022-05-07,Better Buy: AMD vs. Intel,"How do these companies compare, and which stock can better serve investors right now?",fool.com,https://www.fool.com/investing/2022/05/07/better-buy-amd-vs-intel/,https://images.financialmodelingprep.com/news/better-buy-amd-vs-intel-20220507.jpg
AMD,2022-05-03,2022-04-26,2022-05-17,AMD,,2022-05-07 11:30:00,2022-05-07T11:30:00-04:00,2022-05-07,Why you should do DCA (Dollar-cost Averaging) on AMD,Dollar-Cost Averaging (DCA) is a method investors use to profit from asset purchases without being affected by volatili,thedogofwallstreet.com,https://thedogofwallstreet.com/amd/why-you-should-do-dca-dollar-cost-averaging-on-amd?SNAPI,https://images.financialmodelingprep.com/news/why-you-should-do-dca-dollarcost-averaging-on-amd-20220507.webp
AMD,2022-05-03,2022-04-26,2022-05-17,AMD,,2022-05-07 19:41:36,2022-05-07T19:41:36-04:00,2022-05-07,Why AMD Stock Surged This Week,The semiconductor star is riding high on the heels of its blockbuster first-quarter earnings report.,fool.com,https://www.fool.com/investing/2022/05/07/why-amd-stock-surged-this-week/,https://images.financialmodelingprep.com/news/why-amd-stock-surged-this-week-20220507.jpeg
AMD,2022-05-03,2022-04-26,2022-05-17,AMD,,2022-05-08 07:00:00,2022-05-08T07:00:00-04:00,2022-05-08,"Giant Pension Bought AMD, Tilray, Uber, and Petrobras Stock","New Jersey's state pension materially increased investments in chip maker AMD, marijuana producer Tilray, ride-hailing firm Uber, and energy giant Petrobras.",barrons.com,https://www.barrons.com/articles/amd-stock-tilray-uber-petrobras-51651858042,https://images.financialmodelingprep.com/news/giant-pension-bought-amd-tilray-uber-and-petrobras-stock-20220508.jpg
AMD,2022-05-03,2022-04-26,2022-05-17,AMD,,2022-05-09 06:00:48,2022-05-09T06:00:48-04:00,2022-05-09,3 Companies Jumping on the Web 3.0 Train,"Web 3.0 is an evolution of the internet, powered by decentralized networks such as blockchain. Here are three companies that will benefit.",investorplace.com,https://investorplace.com/2022/05/3-companies-jumping-on-the-web-3-0-train-nvda-amd-u/,https://images.financialmodelingprep.com/news/3-companies-jumping-on-the-web-30-train-20220509.jpg
AMD,2022-05-03,2022-04-26,2022-05-17,AMD,,2022-05-09 09:55:14,2022-05-09T09:55:14-04:00,2022-05-09,Advanced Micro Devices Stock Has a Positive Upside After its Latest Earnings Release,AMD stock has a positive upside after its latest earnings release. AMD stock stands to rise higher if Advanced Micro Devices can keep raising revenue despite a forecast market slump in the PC business.,investorplace.com,https://investorplace.com/2022/05/amd-stock-could-still-rise-despite-a-coming-slump-in-demand-for-chips-in-the-pc-market/,https://images.financialmodelingprep.com/news/advanced-micro-devices-stock-has-a-positive-upside-after-20220509.jpg
AMD,2022-05-03,2022-04-26,2022-05-17,AMD,,2022-05-09 10:32:24,2022-05-09T10:32:24-04:00,2022-05-09,"Investors Heavily Search Advanced Micro Devices, Inc. (AMD): Here is What You Need to Know","Recently, Zacks.com users have been paying close attention to Advanced Micro (AMD). This makes it worthwhile to examine what the stock has in store.",zacks.com,https://www.zacks.com/stock/news/1918482/investors-heavily-search-advanced-micro-devices-inc-amd-here-is-what-you-need-to-know,https://images.financialmodelingprep.com/news/investors-heavily-search-advanced-micro-devices-inc-amd-here-20220509.jpg
AMD,2022-05-03,2022-04-26,2022-05-17,AMD,,2022-05-09 11:30:04,2022-05-09T11:30:04-04:00,2022-05-09,Why AMD Shares Are Diving Today,"Shares of several companies in the broader tech sector, including Advanced Micro Devices, Inc. (NASDAQ: AMD), are trading lower amid market weakness as traders continue to digest Wednesday's Fed rate hike announcement. A gain in treasury yields has weighed on technology and growth stocks.",benzinga.com,https://www.benzinga.com/trading-ideas/movers/22/05/27078962/why-amd-shares-are-diving-today,https://images.financialmodelingprep.com/news/why-amd-shares-are-diving-today-20220509.jpg
AMD,2022-05-03,2022-04-26,2022-05-17,AMD,,2022-05-09 19:33:34,2022-05-09T19:33:34-04:00,2022-05-09,3 Tech Stocks Investors Shouldn't Lose Sleep Over,"The pullback seems healthy. Additionally, these companies have established themselves in crucial aspects of the world.",zacks.com,https://www.zacks.com/commentary/1921428/3-tech-stocks-investors-shouldn-t-lose-sleep-over,https://images.financialmodelingprep.com/news/3-tech-stocks-investors-shouldnt-lose-sleep-over-20220509.jpg
AMD,2022-05-03,2022-04-26,2022-05-17,AMD,,2022-05-10 01:59:41,2022-05-10T01:59:41-04:00,2022-05-10,AMD: Growth Priced As Value,AMD's true economic or owners' earnings have been consistently better than its accounting earnings. Its valuation is even more attractive than on the surface.,seekingalpha.com,https://seekingalpha.com/article/4509414-amd-growth-priced-as-value,https://images.financialmodelingprep.com/news/amd-growth-priced-as-value-20220510.jpg
AMD,2022-05-03,2022-04-26,2022-05-17,AMD,,2022-05-10 09:55:36,2022-05-10T09:55:36-04:00,2022-05-10,65 Billion Reasons to Buy AMD Stock,This massive market could supercharge AMD's long-term growth.,fool.com,https://www.fool.com/investing/2022/05/10/65-billion-reasons-to-buy-amd-stock/,https://images.financialmodelingprep.com/news/65-billion-reasons-to-buy-amd-stock-20220510.jpg
AMD,2022-05-03,2022-04-26,2022-05-17,AMD,,2022-05-10 10:00:00,2022-05-10T10:00:00-04:00,2022-05-10,Market Sell-Off: 4 Stocks With Attractive Growth and Valuations,These four companies are all profitable and growing at impressive rates.,fool.com,https://www.fool.com/investing/2022/05/10/market-sell-off-4-stocks-with-attractive-growth-an/,https://images.financialmodelingprep.com/news/market-selloff-4-stocks-with-attractive-growth-and-valuations-20220510.jpg
AMD,2022-05-03,2022-04-26,2022-05-17,AMD,,2022-05-10 10:08:50,2022-05-10T10:08:50-04:00,2022-05-10,Outlook Therapeutics says its COO to talk wet AMD drug Lytenava at World Retina Conference this week,"Outlook Therapeutics (NASDAQ:OTLK) Inc has said its chief operations officer Terry Dagnon will discuss the company's wet age-related macular degeneration (AMD) drug Lytenava as part of a panel at the 2022 World Retina Conference later this month.  The conference is taking place from May 12-15, 2022, in Fort Lauderdale, Florida.",proactiveinvestors.com,https://www.proactiveinvestors.com/companies/news/981885?SNAPI,https://images.financialmodelingprep.com/news/outlook-therapeutics-says-its-coo-to-talk-wet-amd-20220510.jpg
AMD,2022-05-03,2022-04-26,2022-05-17,AMD,,2022-05-11 07:10:00,2022-05-11T07:10:00-04:00,2022-05-11,3 Beaten-Down Growth Stocks Worth Buying on the Dip,These companies are posting growth where it counts and trade at fair valuations.,fool.com,https://www.fool.com/investing/2022/05/11/3-beaten-down-growth-stocks-worth-buying/,https://images.financialmodelingprep.com/news/3-beatendown-growth-stocks-worth-buying-on-the-dip-20220511.jpg
AMD,2022-05-03,2022-04-26,2022-05-17,AMD,,2022-05-11 09:01:00,2022-05-11T09:01:00-04:00,2022-05-11,AMD Enables 4G/5G Radio Access Network Solutions to Support Meta Connectivity Evenstar Program,"— Efficient, adaptable radio units to expand global mobile network infrastructure and accelerate Open RAN adoption for metaverse-ready networks—",globenewswire.com,https://www.globenewswire.com/news-release/2022/05/11/2440928/0/en/AMD-Enables-4G-5G-Radio-Access-Network-Solutions-to-Support-Meta-Connectivity-Evenstar-Program.html,https://images.financialmodelingprep.com/news/amd-enables-4g5g-radio-access-network-solutions-to-support-20220511.jpg
AMD,2022-05-03,2022-04-26,2022-05-17,AMD,,2022-05-11 09:13:00,2022-05-11T09:13:00-04:00,2022-05-11,Facebook parent Meta partners with AMD for mobile infrastructure program,"Facebook parent, Meta Platforms Inc, and chip maker AMD on Wednesday said they were partnering for a mobile internet infrastructure program that would bring base station costs down to make broadband more accessible around the world.",reuters.com,https://www.reuters.com/technology/facebook-parent-meta-partners-with-amd-mobile-infrastructure-program-2022-05-11/,https://images.financialmodelingprep.com/news/facebook-parent-meta-partners-with-amd-for-mobile-infrastructure-20220511.jpg
AMD,2022-05-03,2022-04-26,2022-05-17,AMD,,2022-05-11 10:56:19,2022-05-11T10:56:19-04:00,2022-05-11,3 Diamond-in-the-Rough Stocks to Buy,"Investors should be extremely picky during bear markets. However, using options, here are three of the best stocks to buy right now.",investorplace.com,https://investorplace.com/2022/05/3-diamond-in-the-rough-stocks-to-buy/,https://images.financialmodelingprep.com/news/3-diamondintherough-stocks-to-buy-20220511.jpg
AMD,2022-05-03,2022-04-26,2022-05-17,AMD,,2022-05-11 18:07:23,2022-05-11T18:07:23-04:00,2022-05-11,AMD: No Plateau In Sight,"AMD shows no signs of business plateauing, yet the stock has plunged this year. The chip company just guided to mid-30% organic revenue growth for the year.",seekingalpha.com,https://seekingalpha.com/article/4510318-amd-stock-buy-no-plateau-in-sight,https://images.financialmodelingprep.com/news/amd-no-plateau-in-sight-20220511.jpg
AMD,2022-05-03,2022-04-26,2022-05-17,AMD,,2022-05-11 21:31:40,2022-05-11T21:31:40-04:00,2022-05-11,"Retail investors are continuing to buy the dip in tech despite recent turmoil, says TD Ameritrade","Retail investors have continued to buy the dip in the recent market turmoil, liking tech despite the sector rout, according to TD Ameritrade's AJ Kahling.",cnbc.com,https://www.cnbc.com/2022/05/12/retail-investors-continue-to-buy-dip-despite-turmoil-td-ameritrade.html,https://images.financialmodelingprep.com/news/retail-investors-are-continuing-to-buy-the-dip-in-20220511.jpeg
AMD,2022-05-03,2022-04-26,2022-05-17,AMD,,2022-05-12 07:08:28,2022-05-12T07:08:28-04:00,2022-05-12,How to Invest in Web 3.0? 3 Stocks That Will Be the Long-Term Winner,"Are you unsure how to invest in Web 3.0? Look at companies like NVDA, AMD and COIN, which will form the foundation of this sea change.",investorplace.com,https://investorplace.com/2022/05/how-to-invest-in-web-3-long-term-winners-amd-coin-nvda/,https://images.financialmodelingprep.com/news/how-to-invest-in-web-30-3-stocks-that-20220512.jpg
AMD,2022-05-03,2022-04-26,2022-05-17,AMD,,2022-05-12 10:36:58,2022-05-12T10:36:58-04:00,2022-05-12,Why Advanced Micro Devices Is Shockingly Cheap Right Now,AMD continues to defy expectations.,fool.com,https://www.fool.com/investing/2022/05/12/why-advanced-micro-devices-stock-cheap-rigght-now/,https://images.financialmodelingprep.com/news/why-advanced-micro-devices-is-shockingly-cheap-right-now-20220512.jpg
AMD,2022-05-03,2022-04-26,2022-05-17,AMD,,2022-05-13 08:20:00,2022-05-13T08:20:00-04:00,2022-05-13,3 Growth Stocks for the Next 10 Years and Beyond,These companies are on track to win big from lucrative markets.,fool.com,https://www.fool.com/investing/2022/05/13/3-growth-stocks-for-the-next-10-years-and-beyond/,https://images.financialmodelingprep.com/news/3-growth-stocks-for-the-next-10-years-and-20220513.jpg
AMD,2022-05-03,2022-04-26,2022-05-17,AMD,,2022-05-13 10:26:16,2022-05-13T10:26:16-04:00,2022-05-13,Outlook Therapeutics ends fiscal 2Q with $58.4M in cash as it ramps up pre-commercial activities for wet AMD treatment Lytenava,"Outlook Therapeutics (NASDAQ:OTLK) Inc ended its fiscal second quarter with $58.4 million in cash – enough to launch its lead drug ONS-5010 without raising significant additional capital, it said. ONS-5010, which will be sold under the brand name Lytenava, is an investigational ophthalmic formulation of bevacizumab under development to be administered as an intravitreal injection for the treatment of wet age-related macular degeneration (AMD) and other retinal diseases.",proactiveinvestors.com,https://www.proactiveinvestors.com/companies/news/982231?SNAPI,https://images.financialmodelingprep.com/news/outlook-therapeutics-ends-fiscal-2q-with-584m-in-cash-20220513.jpg
AMD,2022-05-03,2022-04-26,2022-05-17,AMD,,2022-05-13 13:39:38,2022-05-13T13:39:38-04:00,2022-05-13,"Is AMD Stock A Buy, Sell, Or Hold Now? Grab The Shares From The Panic Sellers","AMD stock outperformed the SPY ETF since our previous article was published. We believe that it has already started to form a potential bottoming process. Bearish investors also seemed to have written off AMD's growth estimates. Its PEG ratio has fallen to 0.68x, well below the semi-industry median.",seekingalpha.com,https://seekingalpha.com/article/4511305-is-amd-stock-buy-sell-hold-now,https://images.financialmodelingprep.com/news/is-amd-stock-a-buy-sell-or-hold-now-20220513.jpg
AMD,2022-05-03,2022-04-26,2022-05-17,AMD,,2022-05-15 06:00:54,2022-05-15T06:00:54-04:00,2022-05-15,The 7 Best Long-Term Stocks to Buy Now,"Although the market is looking shaky amid global recession fears, the circumstances may bode well for long-term stocks to buy now. The post The 7 Best Long-Term Stocks to Buy Now appeared first on InvestorPlace.",investorplace.com,https://investorplace.com/2022/05/best-7-long-term-stocks-to-buy-now/,https://images.financialmodelingprep.com/news/the-7-best-longterm-stocks-to-buy-now-20220515.jpg
AMD,2022-05-03,2022-04-26,2022-05-17,AMD,,2022-05-15 08:00:00,2022-05-15T08:00:00-04:00,2022-05-15,"Largest U.S. Pension Bought AMC, AMD, and Block Stock. It Sold Netflix.","Calpers materially raised stakes in theater chain AMC, chip maker AMD, and Square parent Block in the first quarter. The pension slashed a third of its Netflix stake.",barrons.com,https://www.barrons.com/articles/amc-stock-amd-block-netflix-51652216679,https://images.financialmodelingprep.com/news/largest-us-pension-bought-amc-amd-and-block-stock-20220515.jpg
AMD,2022-05-03,2022-04-26,2022-05-17,AMD,,2022-05-16 08:45:00,2022-05-16T08:45:00-04:00,2022-05-16,Stocks on Sale: Is AMD a Buy?,"Shares of AMD are down 40% this year, but its fundamentals still look strong.",fool.com,https://www.fool.com/investing/2022/05/16/stocks-on-sale-is-amd-a-buy/,https://images.financialmodelingprep.com/news/stocks-on-sale-is-amd-a-buy-20220516.jpg
AMD,2022-05-03,2022-04-26,2022-05-17,AMD,,2022-05-17 08:54:00,2022-05-17T08:54:00-04:00,2022-05-17,"AMD's Stock Pullback and PC Share Gains Makes It a Buy, Analyst Says",Piper Sandler analyst Harsh Kumar had downgraded the semiconductor company's shares in January.,barrons.com,https://www.barrons.com/articles/amd-stock-down-slowing-pc-market-51652791925,https://images.financialmodelingprep.com/news/amds-stock-pullback-and-pc-share-gains-makes-it-20220517.jpg
AMD,2022-05-03,2022-04-26,2022-05-17,AMD,,2022-05-17 09:01:00,2022-05-17T09:01:00-04:00,2022-05-17,AMD Robotics Starter Kit Kick-Starts the Intelligent Factory of the Future,"SANTA CLARA, Calif., May 17, 2022 (GLOBE NEWSWIRE) -- Today AMD (NASDAQ: AMD) announced the Kria™ KR260 Robotics Starter Kit, the latest addition to the Kria portfolio of adaptive system-on-modules (SOMs) and developer kits. A scalable and out-of-the-box development platform for robotics, the Kria KR260 offers a seamless path to production deployment with the existing Kria K26 adaptive SOMs. With native ROS 2 support, the standard framework for robotics application development, and pre-built interfaces for robotics and industrial solutions, the new SOM starter kit enables rapid development of hardware-accelerated applications for robotics, machine vision and industrial communication and control.",globenewswire.com,https://www.globenewswire.com/news-release/2022/05/17/2445131/0/en/AMD-Robotics-Starter-Kit-Kick-Starts-the-Intelligent-Factory-of-the-Future.html,https://images.financialmodelingprep.com/news/amd-robotics-starter-kit-kickstarts-the-intelligent-factory-of-20220517.jpg
AMD,2022-05-03,2022-04-26,2022-05-17,AMD,,2022-05-17 09:49:20,2022-05-17T09:49:20-04:00,2022-05-17,7 Growth Stocks That Analysts Love Right Now,"These growth stocks are receiving buy ratings and significantly higher price targets from analysts, making them ideal names to consider. The post 7 Growth Stocks That Analysts Love Right Now appeared first on InvestorPlace.",investorplace.com,https://investorplace.com/2022/05/7-growth-stocks-that-analysts-love-right-now/,https://images.financialmodelingprep.com/news/7-growth-stocks-that-analysts-love-right-now-20220517.jpg
AMD,2022-05-03,2022-04-26,2022-05-17,AMD,,2022-05-17 10:55:06,2022-05-17T10:55:06-04:00,2022-05-17,7 Cheap Semiconductor Stocks to Buy Now,Advanced Micro Devices leads this list of cheap semiconductor stocks with high earnings growth and strong cash flow generation. The post 7 Cheap Semiconductor Stocks to Buy Now appeared first on InvestorPlace.,investorplace.com,https://investorplace.com/2022/05/7-cheap-semiconductor-stocks-to-buy-now-2/,https://images.financialmodelingprep.com/news/7-cheap-semiconductor-stocks-to-buy-now-20220517.jpg
AMD,2022-05-03,2022-04-26,2022-05-17,AMD,,2022-05-17 11:29:03,2022-05-17T11:29:03-04:00,2022-05-17,Advanced Micro Devices Stock Is in Neutral Territory,"Advanced Micro Devices ( AMD , Financial) is one of the most widely-traded stocks on the market, with an average three-month daily trading volume of more than 108 million shares. Thus, Advanced Micro Devices provides plenty of sharp action to investors.",gurufocus.com,https://www.gurufocus.com/news/1714823/advanced-micro-devices-stock-is-in-neutral-territory,https://images.financialmodelingprep.com/news/advanced-micro-devices-stock-is-in-neutral-territory-20220517.jpg
AMD,2022-05-03,2022-04-26,2022-05-17,AMD,,2022-05-17 11:44:00,2022-05-17T11:44:00-04:00,2022-05-17,The Ratings Game: AMD stock shoots higher after upgrade: ‘Buy good companies when they are down',"Shares of Advanced Micro Devices Inc. were headed higher in Tuesday morning trading after an analyst flipped to a bullish stance on the chip company, citing some long-held investment maxims.",marketwatch.com,https://www.marketwatch.com/story/amd-stock-shoots-higher-after-upgrade-buy-good-companies-when-they-are-down-11652802298,https://images.financialmodelingprep.com/news/the-ratings-game-amd-stock-shoots-higher-after-upgrade-20220517.jpg
