ticker,event_date,window_start,window_end,symbol,symbols,publishedDate,publishedDateET,date_et,title,text,site,url,image
PLTR,2022-11-07,2022-10-31,2022-11-21,PLTR,,2022-11-01 11:37:58,2022-11-01T11:37:58-04:00,2022-11-01,Palantir: A Bargain Heading Into Q3 Earnings,"Palantir is helping organizations all over the world make sense of their data. Although it used to predominantly serve governments, Palantir has been growing rapidly with its commercial customers.",seekingalpha.com,https://seekingalpha.com/article/4551443-palantir-a-bargain-heading-into-q3-earnings,https://images.financialmodelingprep.com/news/palantir-a-bargain-heading-into-q3-earnings-20221101.jpg
PLTR,2022-11-07,2022-10-31,2022-11-21,PLTR,,2022-11-05 07:35:00,2022-11-05T07:35:00-04:00,2022-11-05,These 3 Meme Stocks Have Legitimate Long-Term Upside,The masses have identified some winning stocks.,fool.com,https://www.fool.com/investing/2022/11/05/these-meme-stocks-have-legitimate-long-term-upside/,https://images.financialmodelingprep.com/news/these-3-meme-stocks-have-legitimate-longterm-upside-20221105.jpg
PLTR,2022-11-07,2022-10-31,2022-11-21,PLTR,,2022-11-05 07:45:00,2022-11-05T07:45:00-04:00,2022-11-05,2 Artificial Intelligence Stocks You Can Buy and Hold for the Next Decade,The AI industry offers appropriate stocks suitable for most risk profiles.,fool.com,https://www.fool.com/investing/2022/11/05/artificial-intelligence-stocks-you-buy-and-hold/,https://images.financialmodelingprep.com/news/2-artificial-intelligence-stocks-you-can-buy-and-hold-20221105.jpg
PLTR,2022-11-07,2022-10-31,2022-11-21,PLTR,,2022-11-05 10:00:00,2022-11-05T10:00:00-04:00,2022-11-05,Palantir: No Destruction Here - Gladly Eating Our Bearish Words,"Palantir continues to prove the bears wrong with a constant stream of government contracts, providing a lifeline during a time of economic uncertainties. By now, we have massively moderated our expectations of GAAP profitability and accepted its adjusted numbers, given its leading offerings and wide moat.",seekingalpha.com,https://seekingalpha.com/article/4552452-palantir-no-destruction-eating-bearish-words,https://images.financialmodelingprep.com/news/palantir-no-destruction-here-gladly-eating-our-bearish-words-20221105.jpg
PLTR,2022-11-07,2022-10-31,2022-11-21,PLTR,,2022-11-07 07:11:00,2022-11-07T07:11:00-05:00,2022-11-07,Palantir revenue tops expectations amid surge in U.S. commercial business,"On the heels of a tough week for software stocks, Palantir Technologies Inc. came in just above expectations with its latest quarterly revenue performance while raising its outlook on an earnings metric.",marketwatch.com,https://www.marketwatch.com/story/palantir-revenue-tops-expectations-amid-surge-in-u-s-commercial-business-11667823095,https://images.financialmodelingprep.com/news/palantir-revenue-tops-expectations-amid-surge-in-us-commercial-20221107.jpg
PLTR,2022-11-07,2022-10-31,2022-11-21,PLTR,,2022-11-07 07:18:25,2022-11-07T07:18:25-05:00,2022-11-07,Palantir sees upbeat fourth-quarter revenue on U.S. govt business strength,Palantir Technologies Inc on Monday posted a 22% rise in its quarterly revenue and forecast a better-than-expected fourth-quarter revenue due to renewal and expansion of U.S. government contracts and a growing commercial business.,reuters.com,https://www.reuters.com/technology/palantir-sees-upbeat-fourth-quarter-revenue-us-govt-business-strength-2022-11-07/,https://images.financialmodelingprep.com/news/palantir-sees-upbeat-fourthquarter-revenue-on-us-govt-business-20221107.jpg
PLTR,2022-11-07,2022-10-31,2022-11-21,PLTR,,2022-11-07 09:34:02,2022-11-07T09:34:02-05:00,2022-11-07,Palantir Falls Into The Hands Of Value Investors,Shares of Palantir hit a floor that may turn into a bottom following Q3 results that show high-double-digit increases in customer counts and growth business.,marketbeat.com,https://www.marketbeat.com/originals/palantir-falls-into-the-hands-of-value-investors/?SNAPI,https://images.financialmodelingprep.com/news/palantir-falls-into-the-hands-of-value-investors-20221107.jpg
PLTR,2022-11-07,2022-10-31,2022-11-21,PLTR,,2022-11-07 09:48:50,2022-11-07T09:48:50-05:00,2022-11-07,Palantir Technologies Inc. (PLTR) Q3 Earnings Lag Estimates,"Palantir Technologies Inc. (PLTR) delivered earnings and revenue surprises of -50% and 0.70%, respectively, for the quarter ended September 2022. Do the numbers hold clues to what lies ahead for the stock?",zacks.com,https://www.zacks.com/stock/news/2014609/palantir-technologies-inc-pltr-q3-earnings-lag-estimates,https://images.financialmodelingprep.com/news/palantir-technologies-inc-pltr-q3-earnings-lag-estimates-20221107.jpg
PLTR,2022-11-07,2022-10-31,2022-11-21,PLTR,,2022-11-07 10:08:58,2022-11-07T10:08:58-05:00,2022-11-07,PLTR Stock Alert: What to Know as Palantir Reports Q3 Earnings,Palantir (NYSE: PLTR ) stock is on the move Monday after reporting results from its third-quarter earnings report of 2022. The earnings report doesn't start off well with the data company reporting adjusted earnings per share of 1 cent.,investorplace.com,https://investorplace.com/2022/11/pltr-stock-alert-what-to-know-as-palantir-reports-q3-earnings/,https://images.financialmodelingprep.com/news/pltr-stock-alert-what-to-know-as-palantir-reports-20221107.png
PLTR,2022-11-07,2022-10-31,2022-11-21,PLTR,,2022-11-07 10:30:00,2022-11-07T10:30:00-05:00,2022-11-07,4 Growth Stocks Under $10 to Buy,4 beaten-down growth stocks that might be worth your while.,fool.com,https://www.fool.com/investing/2022/11/07/4-growth-stocks-under-10-to-buy/,https://images.financialmodelingprep.com/news/4-growth-stocks-under-10-to-buy-20221107.jpg
PLTR,2022-11-07,2022-10-31,2022-11-21,PLTR,,2022-11-07 11:01:51,2022-11-07T11:01:51-05:00,2022-11-07,Palantir stock falls after slight earnings miss,Shares of Palantir fell Monday after the company released third-quarter earnings that slightly missed analyst estimates for earnings but beat on revenue.,cnbc.com,https://www.cnbc.com/2022/11/07/palantir-pltr-earnings-q3-2022.html,https://images.financialmodelingprep.com/news/palantir-stock-falls-after-slight-earnings-miss-20221107.jpeg
PLTR,2022-11-07,2022-10-31,2022-11-21,PLTR,,2022-11-07 11:25:06,2022-11-07T11:25:06-05:00,2022-11-07,Palantir Technologies Inc. (PLTR) Q3 2022 Earnings Call Transcript,"Palantir Technologies Inc. (NYSE:PLTR ) Q3 2022 Results Conference Call November 7, 2022 8:00 AM ET Company Participants Alexander Karp - Chief Executive Officer Shyam Sankar - Chief Operating Officer David Glazer - Chief Financial Officer Ryan Taylor - Chief Business Affairs & Legal Officer Conference Call Participants Brent Thill - Jefferies Mariana Perez Mora - Bank of America Gabriela Borges - Goldman Sachs Operator Good morning. Welcome to Palantier's Third Quarter 2022 Earnings Call.",seekingalpha.com,https://seekingalpha.com/article/4554291-palantir-technologies-inc-pltr-q3-2022-earnings-call-transcript,https://images.financialmodelingprep.com/news/palantir-technologies-inc-pltr-q3-2022-earnings-call-transcript-20221107.jpg
PLTR,2022-11-07,2022-10-31,2022-11-21,PLTR,,2022-11-07 14:05:23,2022-11-07T14:05:23-05:00,2022-11-07,Why Palantir Stock Plummeted 11% Monday Morning,"The market is (usually) forward-looking -- but unfortunately for Palantir, that's not how things are working out today.",fool.com,https://www.fool.com/investing/2022/11/07/why-palantir-stock-plummeted-11-monday-morning/,https://images.financialmodelingprep.com/news/why-palantir-stock-plummeted-11-monday-morning-20221107.jpg
PLTR,2022-11-07,2022-10-31,2022-11-21,PLTR,,2022-11-07 14:50:34,2022-11-07T14:50:34-05:00,2022-11-07,Peter Thiel's Palantir has struggled to win contracts since Trump left White House,"On Monday, Palantir shares tumbled 11.8% to $6.99 in afternoon trading after the company posted a loss of 6 cents a share, with adjusted earnings missed Wall Street's expectations.",nypost.com,https://nypost.com/2022/11/07/peter-thiels-palantir-has-struggled-since-trump-left-white-house/,https://images.financialmodelingprep.com/news/peter-thiels-palantir-has-struggled-to-win-contracts-since-20221107.jpg
PLTR,2022-11-07,2022-10-31,2022-11-21,PLTR,,2022-11-07 15:23:08,2022-11-07T15:23:08-05:00,2022-11-07,"Palantir Q3 Earnings: The Good, The Bad, But Thankfully No Ugly","Palantir is helping organisations all over the world make sense of their data. Although it used to predominantly serve governments, Palantir has been growing rapidly with its commercial customers.",seekingalpha.com,https://seekingalpha.com/article/4554376-palantir-q3-earnings-the-good-the-bad-but-thankfully-no-ugly,https://images.financialmodelingprep.com/news/palantir-q3-earnings-the-good-the-bad-but-thankfully-20221107.jpg
PLTR,2022-11-07,2022-10-31,2022-11-21,PLTR,,2022-11-08 06:41:49,2022-11-08T06:41:49-05:00,2022-11-08,Palantir Technologies falls after earnings disappoint and European nations 'less willing' to engage,"Palantir Technologies Inc (NYSE:PLTR) stock tumbled after third-quarter earnings from Peter Thiel's company disappointed Wall Street and the company said countries in Europe were less willing to use its controversial data processing software. Revenue from Denver, Colorado-based group was better than analysts expected however, up 22% to US$478mln and it guided to US$503-505mln for the fourth quarter, in line with estimates.",proactiveinvestors.co.uk,https://www.proactiveinvestors.co.uk/companies/news/997652?SNAPI,https://images.financialmodelingprep.com/news/palantir-technologies-falls-after-earnings-disappoint-and-european-nations-20221108.jpg
PLTR,2022-11-07,2022-10-31,2022-11-21,PLTR,,2022-11-09 02:21:58,2022-11-09T02:21:58-05:00,2022-11-09,Palantir's Q3: Why I Finally Bought Back In,Palantir Technologies released Q3 numbers and future guidance that initially disappointed Mr. Market. I actually thought the results and outlook - while not perfect - were pretty good.,seekingalpha.com,https://seekingalpha.com/article/4555215-palantir-stock-q3-earnings-bought-dip,https://images.financialmodelingprep.com/news/palantirs-q3-why-i-finally-bought-back-in-20221109.jpg
PLTR,2022-11-07,2022-10-31,2022-11-21,PLTR,,2022-11-09 05:10:00,2022-11-09T05:10:00-05:00,2022-11-09,2 Top Bargain Stocks Ready for a Bull Run,The market is unfairly discounting these two bargain stocks with long-term growth potential.,fool.com,https://www.fool.com/investing/2022/11/09/2-top-bargain-stocks-ready-for-a-bull-run/,https://images.financialmodelingprep.com/news/2-top-bargain-stocks-ready-for-a-bull-run-20221109.jpg
PLTR,2022-11-07,2022-10-31,2022-11-21,PLTR,,2022-11-10 05:40:00,2022-11-10T05:40:00-05:00,2022-11-10,"2 Reasons to Buy Palantir Stock, and 1 Reason to Sell","Palantir is an intriguing stock, but investors need to watch one key metric.",fool.com,https://www.fool.com/investing/2022/11/10/2-reasons-to-buy-palantir-stock-1-reason-to-sell/,https://images.financialmodelingprep.com/news/2-reasons-to-buy-palantir-stock-and-1-reason-20221110.jpg
PLTR,2022-11-07,2022-10-31,2022-11-21,PLTR,,2022-11-10 09:48:31,2022-11-10T09:48:31-05:00,2022-11-10,Palantir: Don't Panic,"Palantir recently dropped close to its all-time low again. Despite some bright spots, the recent earnings announcement failed to please investors.",seekingalpha.com,https://seekingalpha.com/article/4555865-palantir-dont-panic,https://images.financialmodelingprep.com/news/palantir-dont-panic-20221110.jpg
PLTR,2022-11-07,2022-10-31,2022-11-21,PLTR,,2022-11-10 10:11:00,2022-11-10T10:11:00-05:00,2022-11-10,Here's Why Palantir's Stock Crashed After Earnings,The company's revenue is slowing as businesses curtail capital investments.,fool.com,https://www.fool.com/investing/2022/11/10/heres-why-palantirs-stock-crashed-after-earnings/,https://images.financialmodelingprep.com/news/heres-why-palantirs-stock-crashed-after-earnings-20221110.jpg
PLTR,2022-11-07,2022-10-31,2022-11-21,PLTR,,2022-11-10 10:16:03,2022-11-10T10:16:03-05:00,2022-11-10,Palantir Stock: Is It Finally Fairly Valued?,I'm sharing with you the updated results of my improved Sum-Of-The-Parts valuation model of Palantir Technologies Inc. stock that I developed 5 articles ago. Sales growth justifies the current valuation of Palantir stock. But that is the only excuse for the bulls.,seekingalpha.com,https://seekingalpha.com/article/4555875-palantir-stock-is-it-finally-fairly-valued,https://images.financialmodelingprep.com/news/palantir-stock-is-it-finally-fairly-valued-20221110.jpg
PLTR,2022-11-07,2022-10-31,2022-11-21,PLTR,,2022-11-10 16:51:22,2022-11-10T16:51:22-05:00,2022-11-10,Why Palantir Stock Soared Today,The latest Labor Department inflation data could signal a more sustained recovery of bullish momentum for Palantir.,fool.com,https://www.fool.com/investing/2022/11/10/why-palantir-stock-soared-today/,https://images.financialmodelingprep.com/news/why-palantir-stock-soared-today-20221110.jpg
PLTR,2022-11-07,2022-10-31,2022-11-21,PLTR,,2022-11-11 06:32:00,2022-11-11T06:32:00-05:00,2022-11-11,1 Green Flag and 1 Red Flag for Palantir,"Palantir's revenue growth is shrinking, but its customer count continues to rise.",fool.com,https://www.fool.com/investing/2022/11/11/1-green-flag-and-1-red-flag-for-palantir/,https://images.financialmodelingprep.com/news/1-green-flag-and-1-red-flag-for-palantir-20221111.jpg
PLTR,2022-11-07,2022-10-31,2022-11-21,PLTR,,2022-11-13 08:45:00,2022-11-13T08:45:00-05:00,2022-11-13,Artificial Intelligence Stocks: The Top 9 AI Investment Opportunities,How can you invest in artificial intelligence? How can investors use AI to become a better investor?,forbes.com,https://www.forbes.com/sites/qai/2022/11/13/artificial-intelligence-stocks-roundup-of-ai-investment-opportunities/,https://images.financialmodelingprep.com/news/artificial-intelligence-stocks-the-top-9-ai-investment-opportunities-20221113.jpg
PLTR,2022-11-07,2022-10-31,2022-11-21,PLTR,,2022-11-13 11:14:00,2022-11-13T11:14:00-05:00,2022-11-13,"Palantir: A Software Company Playing 4D Chess, While Critics And Competition Are Still Learning To Play Checkers","Palantir's business model is built on proving quantifiable returns and value back to the customer with its software, and they are willing to lose money upfront to prove its worth. Palantir understands the importance of delivering proven quantifiable value and returns to its customers that can be realized throughout their entire organization.",seekingalpha.com,https://seekingalpha.com/article/4557221-palantir-vs-competition-sell-off-unwarranted,https://images.financialmodelingprep.com/news/palantir-a-software-company-playing-4d-chess-while-critics-20221113.jpg
PLTR,2022-11-07,2022-10-31,2022-11-21,PLTR,,2022-11-14 05:36:33,2022-11-14T05:36:33-05:00,2022-11-14,Palantir: The Good Is Hidden In The Numbers,"The poor results in Q3 were a logical consequence of stagnating outstanding deal value over the trailing twelve months. However, customer growth and outstanding deal value have reaccelerated and should be visible in the financials in Q1 2023.",seekingalpha.com,https://seekingalpha.com/article/4557384-palantir-good-hidden-in-numbers,https://images.financialmodelingprep.com/news/palantir-the-good-is-hidden-in-the-numbers-20221114.jpg
PLTR,2022-11-07,2022-10-31,2022-11-21,PLTR,,2022-11-14 16:15:12,2022-11-14T16:15:12-05:00,2022-11-14,Why Palantir Stock Is Under Pressure Today,One of the company's SPAC investments has run into trouble.,fool.com,https://www.fool.com/investing/2022/11/14/why-palantir-stock-is-under-pressure-today/,https://images.financialmodelingprep.com/news/why-palantir-stock-is-under-pressure-today-20221114.jpg
PLTR,2022-11-07,2022-10-31,2022-11-21,PLTR,,2022-11-15 09:00:37,2022-11-15T09:00:37-05:00,2022-11-15,Palantir Buyers Reversed Its Post-Earnings Selloff Astutely,"The market reversed the initial post-earnings selloff in PLTR, drawing bearish investors looking for the breakdown setup astutely. We maintain our thesis that PLTR continues to consolidate robustly along its long-term support predicated against its May lows.",seekingalpha.com,https://seekingalpha.com/article/4557868-palantir-stock-buyers-reversed-post-q3-earnings-selloff-astutely,https://images.financialmodelingprep.com/news/palantir-buyers-reversed-its-postearnings-selloff-astutely-20221115.jpg
PLTR,2022-11-07,2022-10-31,2022-11-21,PLTR,,2022-11-15 12:00:00,2022-11-15T12:00:00-05:00,2022-11-15,Palantir: Geopolitical Trade Of The Decade,"As the world is in disarray, Palantir has all the tools and exposure needed to meet the new challenges that arise from the changing geopolitical landscape. The expected rise in military spending across the globe is likely going to help Palantir scale its governmental software solutions business in the foreseeable future.",seekingalpha.com,https://seekingalpha.com/article/4557896-palantir-geopolitical-trade-decade,https://images.financialmodelingprep.com/news/palantir-geopolitical-trade-of-the-decade-20221115.jpg
PLTR,2022-11-07,2022-10-31,2022-11-21,PLTR,,2022-11-15 13:09:38,2022-11-15T13:09:38-05:00,2022-11-15,"Why Shopify, Snowflake, and Palantir Stocks All Rallied Early Tuesday",The latest read on inflation and warming U.S./China relations had bargain-hunting investors loading up on beaten-down tech stocks.,fool.com,https://www.fool.com/investing/2022/11/15/why-shopify-snowflake-and-palantir-stocks-all-rall/,https://images.financialmodelingprep.com/news/why-shopify-snowflake-and-palantir-stocks-all-rallied-early-20221115.jpg
PLTR,2022-11-07,2022-10-31,2022-11-21,PLTR,,2022-11-16 05:21:00,2022-11-16T05:21:00-05:00,2022-11-16,The Smartest Stocks to Buy With $20 Right Now,You don't need a mountain of cash to begin building wealth on Wall Street.,fool.com,https://www.fool.com/investing/2022/11/16/the-smartest-stocks-to-buy-with-20-right-now/,https://images.financialmodelingprep.com/news/the-smartest-stocks-to-buy-with-20-right-now-20221116.jpg
PLTR,2022-11-07,2022-10-31,2022-11-21,PLTR,,2022-11-16 12:48:08,2022-11-16T12:48:08-05:00,2022-11-16,SPXC vs. PLTR: Which Stock Is the Better Value Option?,SPXC vs. PLTR: Which Stock Is the Better Value Option?,zacks.com,https://www.zacks.com/stock/news/2019016/spxc-vs-pltr-which-stock-is-the-better-value-option,https://images.financialmodelingprep.com/news/spxc-vs-pltr-which-stock-is-the-better-value-20221116.jpg
PLTR,2022-11-07,2022-10-31,2022-11-21,PLTR,,2022-11-17 07:40:00,2022-11-17T07:40:00-05:00,2022-11-17,Better Cloud Stock: Palantir vs. Twilio,Which of these beaten-down growth stocks is a better turnaround play?,fool.com,https://www.fool.com/investing/2022/11/17/better-cloud-stock-palantir-vs-twilio/,https://images.financialmodelingprep.com/news/better-cloud-stock-palantir-vs-twilio-20221117.jpg
PLTR,2022-11-07,2022-10-31,2022-11-21,PLTR,,2022-11-17 10:24:32,2022-11-17T10:24:32-05:00,2022-11-17,Palantir: Why I Doubled Down On My Position,"After falling 70% from its 52-week high, the stock's risk-reward profile remains compelling. The target of $4 billion in revenue by 2025 would require new customer growth; expansion in the Commercial segment remains key to sustaining sales momentum in the near term.",seekingalpha.com,https://seekingalpha.com/article/4558699-palantir-why-i-doubled-down-on-my-position,https://images.financialmodelingprep.com/news/palantir-why-i-doubled-down-on-my-position-20221117.jpg
PLTR,2022-11-07,2022-10-31,2022-11-21,PLTR,,2022-11-17 13:41:36,2022-11-17T13:41:36-05:00,2022-11-17,"Why Palo Alto Networks, Palantir, and MongoDB Stocks All Traded Lower Thursday",Comments by a top Federal Reserve official have all but erased investor hopes that the central bank will pause its interest rate hikes.,fool.com,https://www.fool.com/investing/2022/11/17/why-palo-alto-networks-palantir-and-mongodb-stocks/,https://images.financialmodelingprep.com/news/why-palo-alto-networks-palantir-and-mongodb-stocks-all-20221117.jpg
PLTR,2022-11-07,2022-10-31,2022-11-21,PLTR,,2022-11-21 13:33:34,2022-11-21T13:33:34-05:00,2022-11-21,Palantir Is To Data What AWS Is To Servers,"Amazon's AWS revolutionized the world of computing, and companies realized that maintaining their own data centers and computer farms wasn't worth it. Palantir Technologies is offering the same thing with data, the ability to generate synergies from its side while providing value to customers.",seekingalpha.com,https://seekingalpha.com/article/4559581-palantir-is-to-data-what-aws-is-to-servers,https://images.financialmodelingprep.com/news/palantir-is-to-data-what-aws-is-to-servers-20221121.jpg
PLTR,2022-11-07,2022-10-31,2022-11-21,PLTR,,2022-11-21 14:07:18,2022-11-21T14:07:18-05:00,2022-11-21,Palantir: Don't Get Fooled Again,Palantir Technologies Inc. produced yet another quarter of $100+ million in (net) losses. Palantir achieved only Adjusted EBITDA profitability.,seekingalpha.com,https://seekingalpha.com/article/4559594-palantir-dont-get-fooled-again,https://images.financialmodelingprep.com/news/palantir-dont-get-fooled-again-20221121.jpg
