ticker,event_date,window_start,window_end,symbol,symbols,publishedDate,publishedDateET,date_et,title,text,site,url,image
AMZN,2021-02-02,2021-01-26,2021-02-16,AMZN,,2021-01-26 04:00:00,2021-01-26T04:00:00-05:00,2021-01-26,"Amazon Expands Boston Tech Hub With Plans to Create 3,000 New Jobs","BOSTON--(BUSINESS WIRE)--Amazon (NASDAQ: AMZN) today announced plans to expand its Boston Tech Hub and create more than 3,000 new corporate and technology jobs over the next several years. The new roles will support teams across the company, including Alexa, Amazon Web Services (AWS), Amazon Robotics, and Amazon Pharmacy. Over the last decade, Amazon has invested more than $6.2 billion in Massachusetts and created more than 20,000 jobs across customer fulfillment, retail, corporate and technology functions. “We’re proud to be creating more than 3,000 new jobs over the next several years at our Boston Tech Hub,” said Rohit Prasad, Vice President & Head Scientist for Alexa at Amazon. “Much of the technology that makes Alexa smarter every day is invented in Boston. Our teams here play a key role in driving Amazon’s innovations – from Alexa to AWS to Amazon Pharmacy – and help us keep delighting customers around the world. We look forward to continuing to be a strong community partner, helping to grow and diversify the local economy, and create new opportunities for Boston and its residents.” The 3,000 jobs that Amazon plans to create in its Boston Tech Hub will include technology roles in software development, Artificial Intelligence and machine learning, along with non-tech corporate roles in product management, HR, finance, and more. Amazon already employs more than 3,700 people in its Boston Tech Hub. “Our administration welcomes Amazon's continued efforts to invest in our communities,” said Governor Charlie Baker. “This expansion is significant and will create thousands more jobs for our highly skilled workforce in different regions of the Commonwealth.”​ “By further expanding its Boston Tech Hub, Amazon is continuing to create new economic opportunities in our City,” said Boston Mayor Martin J. Walsh. “This expansion will grow our technology workforce and support a strong pipeline of diverse talent and a range of new jobs and opportunities for Boston residents."" To accommodate its growing teams in Boston, Amazon leased a new 17-story office tower located at One Boston Wharf Road in the 33-acre Boston Seaport project. Owned and developed by Boston-based development company WS Development, the 630,000 square foot location will include working space, innovation labs, and mixed-use common areas for Amazon employees. Set for completion in 2024, One Boston Wharf Road will also feature a community dog park, ground-floor retail space and a new performing arts center for Bostonians to enjoy with two live performance venues consisting of a 500-seat theater and a 100-seat black box theater, which together will add significant state-of-the-art capacity for the performing arts in Boston. “We are proud to continue our partnership with Amazon in Boston’s Seaport, a neighborhood that has grown to serve forward-thinking employers, residents, and retailers and that is now a global hub of innovation and talent,” said Jeremy Sclar, Chairman and CEO of WS Development. This is Amazon’s second full-building lease in Boston’s Seaport after securing a 430,000-square foot building at 111 Harbor Way. Now under construction by WS Development, this office will be completed later this year and will host 2,000 Amazon employees. Using our Scale for Good in Massachusetts Amazon continues to support the communities in which it operates in Boston and Massachusetts. Amazon Future Engineer, our comprehensive childhood-to-career program designed to inspire, educate, and prepare children and young adults from underrepresented and underserved communities to pursue computer science, supports more than 20 schools in the Boston area, and more than 60 across the state of Massachusetts. The program provides local schools with high quality computer science education curriculum and teacher professional development. Amazon has also provided grants of more than $1.5 million to St. Mary’s Center to support women, children and families in need facing homelessness. Since 2010, Amazon has created more than 20,000 jobs in Massachusetts and invested more than $6.2 billion across the Commonwealth, including infrastructure (from fulfillment centers to retail locations to our Boston Tech Hub) and compensation. These investments have contributed an additional $5.3 billion to the Massachusetts economy and have helped create an additional 13,400 jobs on top of those that the company directly employs – from jobs in construction and logistics to healthcare and professional services. Additionally, more than 34,500 independent authors and small and medium businesses in Massachusetts are currently growing their businesses with Amazon. About Amazon Amazon is guided by four principles: customer obsession rather than competitor focus, passion for invention, commitment to operational excellence, and long-term thinking. Customer reviews, 1-Click shopping, personalized recommendations, Prime, Fulfillment by Amazon, AWS, Kindle Direct Publishing, Kindle, Fire tablets, Fire TV, Amazon Echo, and Alexa are some of the products and services pioneered by Amazon. For more information, visit amazon.com/about and follow @AmazonNews.",businesswire.com,https://www.businesswire.com/news/home/20210126005379/en/Amazon-Expands-Boston-Tech-Hub-With-Plans-to-Create-3000-New-Jobs,https://images.financialmodelingprep.com/news/amazon-expands-boston-tech-hub-with-plans-to-create-3000-20210126.jpg
AMZN,2021-02-02,2021-01-26,2021-02-16,AMZN,,2021-01-26 04:00:00,2021-01-26T04:00:00-05:00,2021-01-26,"Amazon Expands Boston Tech Hub With Plans to Create 3,000 New Jobs","BOSTON--(BUSINESS WIRE)--Amazon today announced plans to expands its Boston Tech Hub and create more than 3,000 new corporate and technology jobs over the next several years.",businesswire.com,https://www.businesswire.com/news/home/20210126005379/en/Amazon-Expands-Boston-Tech-Hub-With-Plans-to-Create-3000-New-Jobs/,https://images.financialmodelingprep.com/news/amazon-expands-boston-tech-hub-with-plans-to-create-20210126.jpg
AMZN,2021-02-02,2021-01-26,2021-02-16,AMZN,,2021-01-26 05:44:56,2021-01-26T05:44:56-05:00,2021-01-26,"Amazon is adding 3,000 jobs in Boston, including in AI, finance, and HR, as it continues its pandemic hiring spree","Amazon, already the second-largest employer in America, is expanding its workforce by hiring 3,000 corporate and tech employees in Boston, it announced Tuesday. The jobs would include technology, AI, and software development roles, Amazon said. They would also include jobs in HR and finance, as well as in support teams across its web services, robotics, pharmacy, and Alexa divisions, it said.",businessinsider.com,https://www.businessinsider.com/amazon-jobs-hiring-boston-hr-finance-ai-vacancies-jeff-bezos-2021-1,https://images.financialmodelingprep.com/news/amazon-is-adding-3000-jobs-in-boston-including-in-20210126.jpg
AMZN,2021-02-02,2021-01-26,2021-02-16,AMZN,,2021-01-26 07:35:00,2021-01-26T07:35:00-05:00,2021-01-26,3 Stocks to Hold for the Next 20 Years,These are companies that have proven they make decisions for the long term.,fool.com,https://www.fool.com/investing/2021/01/26/3-stocks-to-hold-for-the-next-20-years/,https://images.financialmodelingprep.com/news/3-stocks-to-hold-for-the-next-20-years-20210126.jpg
AMZN,2021-02-02,2021-01-26,2021-02-16,AMZN,,2021-01-26 08:01:12,2021-01-26T08:01:12-05:00,2021-01-26,"Start-up tackling decarbonization of trucking sector gets funding from Amazon climate fund, Grantham","Amazon's $2 billion Climate Pledge Fund just announced its latest investment: Infinium, which is a start-up making electrofuels to cut emissions in the transportation sector.",cnbc.com,https://www.cnbc.com/2021/01/26/start-up-tackling-decarbonization-of-trucking-sector-gets-funding-from-amazon-climate-fund-grantham.html,https://images.financialmodelingprep.com/news/startup-tackling-decarbonization-of-trucking-sector-gets-funding-from-20210126.jpg
AMZN,2021-02-02,2021-01-26,2021-02-16,AMZN,,2021-01-26 08:27:00,2021-01-26T08:27:00-05:00,2021-01-26,"The Tell: Hot stocks for 2021? The Amazon.com of Latin America and a popular cannabis maker, says this fund manager","Tom Plumb, portfolio manager of the Plumb Balanced Fund, talks about the next companies that will lead the digital disruption that got a jump start by the COVID-19 pandemic.",marketwatch.com,https://www.marketwatch.com/story/hot-stocks-for-2021-the-amazon-com-of-latin-america-and-a-popular-cannabis-maker-says-this-fund-manager-11611667651,https://images.financialmodelingprep.com/news/the-tell-hot-stocks-for-2021-the-amazoncom-of-20210126.jpg
AMZN,2021-02-02,2021-01-26,2021-02-16,AMZN,,2021-01-26 08:30:00,2021-01-26T08:30:00-05:00,2021-01-26,My Best E-Commerce Stock for 2021,Amazon is still the best all-around e-commerce investment for most investors.,fool.com,https://www.fool.com/investing/2021/01/26/my-best-e-commerce-stock-for-2021/,https://images.financialmodelingprep.com/news/my-best-ecommerce-stock-for-2021-20210126.jpg
AMZN,2021-02-02,2021-01-26,2021-02-16,AMZN,,2021-01-26 08:40:00,2021-01-26T08:40:00-05:00,2021-01-26,Better Buy: MercadoLibre vs. Amazon,Online shopping doesn't require a coronavirus mask.,fool.com,https://www.fool.com/investing/2021/01/26/better-buy-mercadolibre-vs-amazon/,https://images.financialmodelingprep.com/news/better-buy-mercadolibre-vs-amazon-20210126.jpg
AMZN,2021-02-02,2021-01-26,2021-02-16,AMZN,,2021-01-26 08:59:49,2021-01-26T08:59:49-05:00,2021-01-26,"Amazon plans to create 3,000 jobs in Boston with new office expansion","The new roles will be added over the next several years and are expected to support Amazon's AWS, Alexa, robotics and pharmacy teams.",cnbc.com,https://www.cnbc.com/2021/01/26/amazon-to-create-3000-jobs-in-boston-with-new-office-expansion.html,https://images.financialmodelingprep.com/news/amazon-plans-to-create-3000-jobs-in-boston-with-20210126.jpg
AMZN,2021-02-02,2021-01-26,2021-02-16,AMZN,,2021-01-26 09:37:48,2021-01-26T09:37:48-05:00,2021-01-26,Tech companies could see blowout fourth quarters for ad revenue,"""The setup couldn't be any better for the digital ad names,"" Bernstein analysts said.",cnbc.com,https://www.cnbc.com/2021/01/26/tech-companies-could-see-blowout-fourth-quarters-for-ad-revenue-.html,https://images.financialmodelingprep.com/news/tech-companies-could-see-blowout-fourth-quarters-for-ad-20210126.jpeg
AMZN,2021-02-02,2021-01-26,2021-02-16,AMZN,,2021-01-26 10:09:37,2021-01-26T10:09:37-05:00,2021-01-26,Elon Musk blasts Jeff Bezos' Amazon for attempts to 'hamstring' SpaceX's Starlink satellite internet,Elon Musk's SpaceX and Jeff Bezos' Amazon are sparring in front of the FCC over the satellite internet projects Starlink and Project Kuiper.,cnbc.com,https://www.cnbc.com/2021/01/26/elon-musk-blasts-jeff-bezos-amazon-competitor-to-spacexs-starlink-.html,https://images.financialmodelingprep.com/news/elon-musk-blasts-jeff-bezos-amazon-for-attempts-to-20210126.jpeg
AMZN,2021-02-02,2021-01-26,2021-02-16,AMZN,,2021-01-26 10:28:53,2021-01-26T10:28:53-05:00,2021-01-26,Is Unionization Coming to Amazon and Google?,Technology companies have avoided (and discouraged) unionization since the days of Fairchild Semiconductor.,247wallst.com,https://247wallst.com/technology-3/2021/01/26/is-unionization-coming-to-amazon-and-google/,https://images.financialmodelingprep.com/news/is-unionization-coming-to-amazon-and-google-20210126.jpg
AMZN,2021-02-02,2021-01-26,2021-02-16,AMZN,,2021-01-26 10:30:00,2021-01-26T10:30:00-05:00,2021-01-26,Amazon Prime Membership Is Growing at a Record Pace,And more of those new members are planning to stick around through 2021.,fool.com,https://www.fool.com/investing/2021/01/26/amazon-prime-membership-is-growing-at-a-record-pac/,https://images.financialmodelingprep.com/news/amazon-prime-membership-is-growing-at-a-record-pace-20210126.jpeg
AMZN,2021-02-02,2021-01-26,2021-02-16,AMZN,,2021-01-26 11:00:58,2021-01-26T11:00:58-05:00,2021-01-26,Mizuho Sees More Upside in Software Stocks,Enterprise software companies had a stellar run in the market in 2020 as this industry was at the center of the thriving virtual world. Global X Cloud Computing ETF (NASDAQ:CLOU) gained a staggering 70% in the last year as investors flocked to software names that were facilitating the work-from-home economy.,gurufocus.com,https://www.gurufocus.com/news/1340702/mizuho-sees-more-upside-in-software-stocks,https://images.financialmodelingprep.com/news/mizuho-sees-more-upside-in-software-stocks-20210126.jpg
AMZN,2021-02-02,2021-01-26,2021-02-16,AMZN,,2021-01-26 11:17:32,2021-01-26T11:17:32-05:00,2021-01-26,What Lies Ahead for FAANG ETFs in Q4 Earnings,The smooth trend is likely to continue with most of the companies likely to beat earnings estimates when they report this week and the next.,zacks.com,https://www.zacks.com/stock/news/1251877/what-lies-ahead-for-faang-etfs-in-q4-earnings,https://images.financialmodelingprep.com/news/what-lies-ahead-for-faang-etfs-in-q4-earnings-20210126.jpg
AMZN,2021-02-02,2021-01-26,2021-02-16,AMZN,,2021-01-26 11:45:52,2021-01-26T11:45:52-05:00,2021-01-26,7 Bold Predictions for Tech Stocks in 2021,"What's next for the constantly changing technology sector? With a new year comes new, exciting predictions for tech stocks.",investorplace.com,https://investorplace.com/2021/01/7-bold-predictions-for-tech-stocks/,https://images.financialmodelingprep.com/news/7-bold-predictions-for-tech-stocks-in-2021-20210126.jpg
AMZN,2021-02-02,2021-01-26,2021-02-16,AMZN,,2021-01-26 12:34:00,2021-01-26T12:34:00-05:00,2021-01-26,"AWS, Google service issues reported in Northeast U.S.",Alphabet Inc.'s GOOGGOOGL Google services and Amazon.com Inc.'s AMZN Amazon Web Services saw a spike in reported outages mostly confined to the Northeast U.S. Tuesday morning. At around 11:15 a.m.,marketwatch.com,https://www.marketwatch.com/story/aws-google-service-issues-reported-in-northeast-u-s-11611682443,https://images.financialmodelingprep.com/news/aws-google-service-issues-reported-in-northeast-us-20210126.jpg
AMZN,2021-02-02,2021-01-26,2021-02-16,AMZN,,2021-01-26 12:56:02,2021-01-26T12:56:02-05:00,2021-01-26,Amazon invests in startup producing ‘net-zero carbon fuels' for transportation,"Amazon announced on Tuesday that it was investing in Infinium, a Sacramento, Calif.",geekwire.com,https://www.geekwire.com/2021/amazon-invests-startup-producing-net-zero-carbon-fuels-transportation/,https://images.financialmodelingprep.com/news/amazon-invests-in-startup-producing-netzero-carbon-fuels-for-20210126.jpeg
AMZN,2021-02-02,2021-01-26,2021-02-16,AMZN,,2021-01-26 14:09:26,2021-01-26T14:09:26-05:00,2021-01-26,"The Current Market, Warren Buffett, Cinderella and Known Unknowns","Over the past few weeks and months, I've read a lot about the market's current state. The most common observation is that we are currently in the middle of a bubble reminiscent of the late 1999s.",gurufocus.com,https://www.gurufocus.com/news/1340941/the-current-market-warren-buffett-cinderella-and-known-unknowns,https://images.financialmodelingprep.com/news/the-current-market-warren-buffett-cinderella-and-known-unknowns-20210126.jpg
AMZN,2021-02-02,2021-01-26,2021-02-16,AMZN,,2021-01-26 14:44:17,2021-01-26T14:44:17-05:00,2021-01-26,It's Not Too Late To Start Investing in Amazon Stock,Amazon stock gained more than 73% in 2020 and there are all indications that it could challenge (and exceed) all-time highs again this year. The post It's Not Too Late To Start Investing in Amazon Stock appeared first on InvestorPlace.,investorplace.com,https://investorplace.com/2021/01/its-not-too-late-to-start-investing-in-amazon-stock/,https://images.financialmodelingprep.com/news/its-not-too-late-to-start-investing-in-amazon-20210126.jpg
AMZN,2021-02-02,2021-01-26,2021-02-16,AMZN,,2021-01-26 15:42:31,2021-01-26T15:42:31-05:00,2021-01-26,Could IZEA Stock Be the Best Stock to Buy for 2021?,"Thanks to its new game-changing platform in the booming influencer marketing world, IZEA stock is one of the best stocks to buy for 2021. The post Could IZEA Stock Be the Best Stock to Buy for 2021?",investorplace.com,https://investorplace.com/hypergrowthinvesting/2021/01/could-izea-stock-be-the-best-stock-to-buy-for-2021/,https://images.financialmodelingprep.com/news/could-izea-stock-be-the-best-stock-to-buy-20210126.jpg
AMZN,2021-02-02,2021-01-26,2021-02-16,AMZN,,2021-01-26 15:54:43,2021-01-26T15:54:43-05:00,2021-01-26,University of Washington researchers say Amazon's algorithms spread vaccine misinformation,Researchers at the University of Washington find evidence that Amazon's algorithms are promoting vaccine misinformation.,venturebeat.com,https://venturebeat.com/2021/01/26/university-of-washington-researchers-say-amazons-algorithms-spread-vaccine-misinformation/,https://images.financialmodelingprep.com/news/university-of-washington-researchers-say-amazons-algorithms-spread-vaccine-20210126.jpg
AMZN,2021-02-02,2021-01-26,2021-02-16,AMZN,,2021-01-26 18:16:00,2021-01-26T18:16:00-05:00,2021-01-26,Elon Musk Escalates Feud With Amazon Over Satellite Internet Projects,The Tesla co-founder feels that Jeff Bezos' company is trying to put up a roadblock to his efforts in space.,fool.com,https://www.fool.com/investing/2021/01/26/elon-musk-escalates-feud-with-amazon-over-satellit/,https://images.financialmodelingprep.com/news/elon-musk-escalates-feud-with-amazon-over-satellite-internet-20210126.jpg
AMZN,2021-02-02,2021-01-26,2021-02-16,AMZN,,2021-01-27 03:33:00,2021-01-27T03:33:00-05:00,2021-01-27,Amazon stops alcohol sales in Northern Ireland due to Brexit rules: ITV,"Amazon has halted sales of wines, beers and spirits in Northern Ireland and is preparing to de-list more products due to new Brexit customs rules, broadcaster ITV reported on Tuesday.",reuters.com,https://www.reuters.com/article/us-britain-eu-amazon-ireland/amazon-stops-alcohol-sales-in-northern-ireland-due-to-brexit-rules-itv-idUSKBN29W0S1,https://images.financialmodelingprep.com/news/amazon-stops-alcohol-sales-in-northern-ireland-due-to-brexit-20210127.jpg
AMZN,2021-02-02,2021-01-26,2021-02-16,AMZN,,2021-01-27 06:46:03,2021-01-27T06:46:03-05:00,2021-01-27,Buy Amazon Stock for Big Breakout Q4 Earnings Potential?,Amazon stock is down around 6% from its early September 2020 highs. This means Wall Street will be glued to the e-commerce titan's upcoming Q4 earnings release on February 2.,zacks.com,https://www.zacks.com/stock/news/1252217/buy-amazon-stock-for-big-breakout-q4-earnings-potential,https://images.financialmodelingprep.com/news/buy-amazon-stock-for-big-breakout-q4-earnings-potential-20210127.jpg
AMZN,2021-02-02,2021-01-26,2021-02-16,AMZN,,2021-01-27 09:39:55,2021-01-27T09:39:55-05:00,2021-01-27,Lowes Stock Is a Buy as Ellison Shows That He Knows Home Improvement,"Lowe's has been gaining share against Home Depot, especially online, as both home improvement stocks glided through the pandemic. The post Lowes Stock Is a Buy as Ellison Shows That He Knows Home Improvement appeared first on InvestorPlace.",investorplace.com,https://investorplace.com/2021/01/low-stock-ellison-knows-home-improvement/,https://images.financialmodelingprep.com/news/lowes-stock-is-a-buy-as-ellison-shows-that-20210127.jpg
AMZN,2021-02-02,2021-01-26,2021-02-16,AMZN,,2021-01-27 12:19:33,2021-01-27T12:19:33-05:00,2021-01-27,Amazon Stock Gets a Target Price Upgrade Ahead of Holiday Quarter Earnings,"Don't worry about Amazon in the post-pandemic world says Bank of America analyst who bumps Amazon stock price target to $4,000. The post Amazon Stock Gets a Target Price Upgrade Ahead of Holiday Quarter Earnings appeared first on InvestorPlace.",investorplace.com,https://investorplace.com/2021/01/amazon-stock-gets-a-target-price-upgrade-ahead-of-holiday-quarter-earnings/,https://images.financialmodelingprep.com/news/amazon-stock-gets-a-target-price-upgrade-ahead-of-20210127.jpg
AMZN,2021-02-02,2021-01-26,2021-02-16,AMZN,,2021-01-27 12:57:35,2021-01-27T12:57:35-05:00,2021-01-27,Why Amazon Is Waking Up Ahead of Earnings,"With investors cheering Netflix and Microsoft earnings, it's hard not to be bullish on Amazon into its report next week. Here's how to profit with Amazon stock options.",investorplace.com,https://investorplace.com/2021/01/amazon-stock-waking-up-ahead-of-earnings/,https://images.financialmodelingprep.com/news/why-amazon-is-waking-up-ahead-of-earnings-20210127.jpg
AMZN,2021-02-02,2021-01-26,2021-02-16,AMZN,,2021-01-27 14:34:07,2021-01-27T14:34:07-05:00,2021-01-27,Lessons from the Best Performing S&P 500 Stocks,The best long-term performing stocks might not be the ones you think. There's a lot to learn from seeing a list of the 30-year winners.,zacks.com,https://www.zacks.com/stock/news/1252776/lessons-from-the-best-performing-sp-500-stocks,https://images.financialmodelingprep.com/news/lessons-from-the-best-performing-sp-500-stocks-20210127.jpg
AMZN,2021-02-02,2021-01-26,2021-02-16,AMZN,,2021-01-27 15:51:00,2021-01-27T15:51:00-05:00,2021-01-27,The Ratings Game: Starbucks exec & Amazon director Rosalind Brewer brings digital prowess to Walgreens CEO role,Walgreens stock was up nearly 5% in Wednesday trading after the news,marketwatch.com,https://www.marketwatch.com/story/starbucks-exec-amazon-director-rosalind-brewer-brings-digital-prowess-to-walgreens-ceo-role-11611780678,https://images.financialmodelingprep.com/news/the-ratings-game-starbucks-exec-amazon-director-rosalind-brewer-brings-20210127.jpg
AMZN,2021-02-02,2021-01-26,2021-02-16,AMZN,,2021-01-27 15:55:37,2021-01-27T15:55:37-05:00,2021-01-27,Amazon Stock Can Afford To Have Some Failures,"Misfires like the Whole Foods acquisition won't slow down Amazon stock, which remains a global e-commerce juggernaut and cloud juggernaut. The post Amazon Stock Can Afford To Have Some Failures appeared first on InvestorPlace.",investorplace.com,https://investorplace.com/2021/01/amazon-stock-can-afford-to-have-some-failures/,https://images.financialmodelingprep.com/news/amazon-stock-can-afford-to-have-some-failures-20210127.jpg
AMZN,2021-02-02,2021-01-26,2021-02-16,AMZN,,2021-01-27 19:46:23,2021-01-27T19:46:23-05:00,2021-01-27,Dick's: Time For A Pause,Dick's: Time For A Pause,seekingalpha.com,https://seekingalpha.com/article/4401470-dicks-time-for-pause,https://images.financialmodelingprep.com/news/dicks-time-for-a-pause-20210127.jpg
AMZN,2021-02-02,2021-01-26,2021-02-16,AMZN,,2021-01-27 20:35:03,2021-01-27T20:35:03-05:00,2021-01-27,3 Cheap Stocks Under $20 to Buy as Market Falls from Records,"Today, we dive into three stocks that might be worth buying from within a niche, but attractive part of the market for many: cheap stocks trading for under $20 a share.",zacks.com,https://www.zacks.com/stock/news/1252898/3-cheap-stocks-under-%2420-to-buy-as-market-falls-from-records,https://images.financialmodelingprep.com/news/3-cheap-stocks-under-20-to-buy-as-market-20210127.jpg
AMZN,2021-02-02,2021-01-26,2021-02-16,AMZN,,2021-01-28 05:56:29,2021-01-28T05:56:29-05:00,2021-01-28,"Expect Amazon Stock To Move Up, Fueled By Its Powerful Free Cash Flow","Expect Amazon stock to move up with its powerful free cash flow. AMZN stock is still worth at least 15% more at $3,796 based on its FCF yield.",investorplace.com,https://investorplace.com/2021/01/amazon-stock-is-worth-3796-or-15-more-based-on-fcf-yield/,https://images.financialmodelingprep.com/news/expect-amazon-stock-to-move-up-fueled-by-its-20210128.jpg
AMZN,2021-02-02,2021-01-26,2021-02-16,AMZN,,2021-01-28 07:07:00,2021-01-28T07:07:00-05:00,2021-01-28,Here's Why Amazon Will Never Be a Dow Jones Industrials Stock,One of the world's most important businesses is being ignored by one of the most important indexes.,fool.com,https://www.fool.com/investing/2021/01/28/heres-why-amazon-will-never-be-a-dow-jones-industr/,https://images.financialmodelingprep.com/news/heres-why-amazon-will-never-be-a-dow-jones-20210128.jpg
AMZN,2021-02-02,2021-01-26,2021-02-16,AMZN,,2021-01-28 07:42:00,2021-01-28T07:42:00-05:00,2021-01-28,Should Stitch Fix Worry About Amazon's Personal Styling Service?,Stitch Fix will have to buckle up as the competition heats up.,fool.com,https://www.fool.com/investing/2021/01/28/should-stitch-fix-worry-amazon-personal-styling-s/,https://images.financialmodelingprep.com/news/should-stitch-fix-worry-about-amazons-personal-styling-service-20210128.jpg
AMZN,2021-02-02,2021-01-26,2021-02-16,AMZN,,2021-01-28 08:03:00,2021-01-28T08:03:00-05:00,2021-01-28,Walmart plans big push to challenge Amazon on advertising,"Walmart Inc plans to expand its advertising business, adding space for ads at its U.S. stores and sharing its vast trove of shopper data with brands, the world's largest retailer said on Thursday, looking to challenge rival Amazon.com Inc as a media powerhouse.",reuters.com,https://www.reuters.com/article/us-walmart-advertising/walmart-plans-big-push-to-challenge-amazon-on-advertising-idUSKBN29X1QA,https://images.financialmodelingprep.com/news/walmart-plans-big-push-to-challenge-amazon-on-advertising-20210128.jpg
AMZN,2021-02-02,2021-01-26,2021-02-16,AMZN,,2021-01-28 08:15:00,2021-01-28T08:15:00-05:00,2021-01-28,Better Buy: Amazon vs. Best Buy,Both companies have done well as consumers gravitate toward low-contact and online shopping.,fool.com,https://www.fool.com/investing/2021/01/28/better-buy-amazon-vs-best-buy/,https://images.financialmodelingprep.com/news/better-buy-amazon-vs-best-buy-20210128.jpg
