ticker,event_date,window_start,window_end,symbol,symbols,publishedDate,publishedDateET,date_et,title,text,site,url,image
AMZN,2021-02-02,2021-01-26,2021-02-16,AMZN,,2021-02-03 12:13:00,2021-02-03T12:13:00-05:00,2021-02-03,Mark Hulbert: The key lesson for Amazon investors as Andy Jassy takes over from Jeff Bezos,Academic research says promoting a company insider to CEO rather than recruiting a superstar CEO is the smarter move.,marketwatch.com,https://www.marketwatch.com/story/the-key-lesson-for-amazon-investors-as-andy-jassy-takes-over-from-jeff-bezos-11612372431,https://images.financialmodelingprep.com/news/mark-hulbert-the-key-lesson-for-amazon-investors-as-andy-20210203.jpg
AMZN,2021-02-02,2021-01-26,2021-02-16,AMZN,,2021-02-03 13:03:25,2021-02-03T13:03:25-05:00,2021-02-03,"Bezos Will Be Missed, But Jassy Could Shift Amazon Into Hypergrowth","Bezos is the man. But under Jassy's leadership, Amazon could unlock its full potential as a cloud computing giant, making AMZN stock a buy.",investorplace.com,https://investorplace.com/hypergrowthinvesting/2021/02/bezos-will-be-missed-but-jassy-could-shift-amazon-into-hypergrowth/,https://images.financialmodelingprep.com/news/bezos-will-be-missed-but-jassy-could-shift-amazon-into-20210203.jpg
AMZN,2021-02-02,2021-01-26,2021-02-16,AMZN,,2021-02-03 14:35:00,2021-02-03T14:35:00-05:00,2021-02-03,5 things to know about new Amazon CEO Andy Jassy,Jeff Bezos is stepping down as Amazon's CEO and will be replaced by AWS head Andy Jassy,marketwatch.com,https://www.marketwatch.com/story/5-things-to-know-about-new-amazon-ceo-andy-jassy-11612380924,https://images.financialmodelingprep.com/news/5-things-to-know-about-new-amazon-ceo-andy-20210203.jpg
AMZN,2021-02-02,2021-01-26,2021-02-16,AMZN,,2021-02-03 14:49:20,2021-02-03T14:49:20-05:00,2021-02-03,Jeff Bezos Steps Away As The Amazon Effect Intensifies,"Jeff Bezos is stepping away. After over two and a half decades at the helm of Amazon, Bezos will be handing off CEO responsibilities at the behemoth he built to the head of Amazon Web Services, Andy Jassy, and transitioning into the role of executive chairman starting in Q3 of 2021.",pymnts.com,https://www.pymnts.com/amazon/2021/jeff-bezos-steps-away-as-the-amazon-effect-intensifies/,https://images.financialmodelingprep.com/news/jeff-bezos-steps-away-as-the-amazon-effect-intensifies-20210203.jpg
AMZN,2021-02-02,2021-01-26,2021-02-16,AMZN,,2021-02-03 14:56:41,2021-02-03T14:56:41-05:00,2021-02-03,"Who Is Andy Jassy, The Soon-To-Be CEO Of Amazon?","When Amazon.com, Inc. (NASDAQ: AMZN) released its fourth-quarter earnings on Tuesday, it had another big announcement: Jeff Bezos would be stepping down as CEO, moving to the role of executive chair in the third quarter of 2021. His replacement is Andy Jassy, current CEO of Amazon Web Services (AWS), an on-demand cloud computing subsidiary of Amazon.",benzinga.com,https://www.benzinga.com/news/21/02/19469822/who-is-andy-jassy-the-soon-to-be-ceo-of-amazon,https://images.financialmodelingprep.com/news/who-is-andy-jassy-the-soontobe-ceo-of-amazon-20210203.jpg
AMZN,2021-02-02,2021-01-26,2021-02-16,AMZN,,2021-02-03 14:59:10,2021-02-03T14:59:10-05:00,2021-02-03,"Amazon will surge 21% as deliveries stay elevated in a post-pandemic world, Canaccord says","The coronavirus drove a massive influx of consumer spending to Amazon. That boost could very well outlive the pandemic and help shares charge higher still, analysts at Canaccord Genuity said Tuesday. The team led by Michael Graham lifted their price target for Amazon stock to $4,100 from $3,800, reflecting expectations for a 21% climb from Tuesday's closing level. The move comes after the e-commerce giant reported fourth-quarter figures that beat estimates for profit and revenue. Quarterly sales grew 44% and passed $100 billion for the first time ever.",businessinsider.com,https://www.businessinsider.com/amazon-stock-price-target-lifted-ecommerce-spending-economic-aws-amzn-2021-2,https://images.financialmodelingprep.com/news/amazon-will-surge-21-as-deliveries-stay-elevated-in-20210203.jpg
AMZN,2021-02-02,2021-01-26,2021-02-16,AMZN,,2021-02-03 15:25:00,2021-02-03T15:25:00-05:00,2021-02-03,"With Bezos out as Amazon CEO, is this the end of his ominous question-mark emails?","For staff at Amazon.com Inc, the departure of CEO Jeff Bezos may spell the end of one of the company's unusual and, for some managers, frightening practices: the ""question-mark"" email.",reuters.com,https://www.reuters.com/article/us-amazon-com-bezos/with-bezos-out-as-amazon-ceo-is-this-the-end-of-his-ominous-question-mark-emails-idUSKBN2A32Z8,https://images.financialmodelingprep.com/news/with-bezos-out-as-amazon-ceo-is-this-the-end-20210203.jpg
AMZN,2021-02-02,2021-01-26,2021-02-16,AMZN,,2021-02-03 15:47:56,2021-02-03T15:47:56-05:00,2021-02-03,'Jassy's the captain now': Here's what 4 Wall Street banks had to say about Amazon's 4th-quarter earnings,"Amazon's fourth-quarter earnings impressed on Tuesday, matching high analyst expectations. The company managed a 44% year-over-year revenue jump in the quarter, breaking the $100 billion net sales mark for the first time just days after Apple managed a similar feat.",businessinsider.com,https://www.businessinsider.com/amazon-q4-earnings-reaction-ecommerce-aws-bezos-jassy-2021-2,https://images.financialmodelingprep.com/news/jassys-the-captain-now-heres-what-4-wall-street-20210203.jpg
AMZN,2021-02-02,2021-01-26,2021-02-16,AMZN,,2021-02-03 15:56:19,2021-02-03T15:56:19-05:00,2021-02-03,Stock Market Movers & Shakers: 5 Big Names in Business Ready to Move Stocks,Stock market movers this week include Robinhood CEO Vlad Tenev and outgoing Amazon CEO Jeff Bezos. Here's how they are influencing Wall Street now.,investorplace.com,https://investorplace.com/2021/02/stock-market-movers-big-names-business-tsla-amzn-blue-origin-bitcoin-bmbl-ipo/,https://images.financialmodelingprep.com/news/stock-market-movers-shakers-5-big-names-in-business-20210203.jpg
AMZN,2021-02-02,2021-01-26,2021-02-16,AMZN,,2021-02-03 16:20:55,2021-02-03T16:20:55-05:00,2021-02-03,PreMarket Prep Stock Of The Day: Amazon,"Every earnings season takes on a character of its own. For example, in the second quarter of 2020, many of the companies that posted staggering losses as a result of the pandemic were given a pass, with investors buying the dip.",benzinga.com,https://www.benzinga.com/news/earnings/21/02/19475331/premarket-prep-stock-of-the-day-amazon,https://images.financialmodelingprep.com/news/premarket-prep-stock-of-the-day-amazon-20210203.jpg
AMZN,2021-02-02,2021-01-26,2021-02-16,AMZN,,2021-02-03 17:18:54,2021-02-03T17:18:54-05:00,2021-02-03,"4 Top Stock Trades for Thursday: AMZN, SPOT, BMY, ABBV","Amazon, Spotify, Bristol-Myers Squibb and AbbVie were our top stock trades for Thursday. Let's look at the charts of these earnings movers.",investorplace.com,https://investorplace.com/2021/02/4-top-stock-trades-for-thursday-amzn-spot-bmy-abbv/,https://images.financialmodelingprep.com/news/4-top-stock-trades-for-thursday-amzn-spot-bmy-20210203.jpg
AMZN,2021-02-02,2021-01-26,2021-02-16,AMZN,,2021-02-03 18:34:05,2021-02-03T18:34:05-05:00,2021-02-03,Here's What The Street Thinks Of Amazon's New Boss,"Jeff Bezos' era of running Amazon.com, Inc. (NASDAQ: AMZN) as CEO comes to an end later this year. His replacement is Andy Jassy, a veteran of Amazon since 1997 and is credited with founding Amazon Web Services (AWS).",benzinga.com,https://www.benzinga.com/news/21/02/19472952/heres-what-the-street-thinks-of-amazons-new-boss,https://images.financialmodelingprep.com/news/heres-what-the-street-thinks-of-amazons-new-boss-20210203.jpg
AMZN,2021-02-02,2021-01-26,2021-02-16,AMZN,,2021-02-03 20:08:50,2021-02-03T20:08:50-05:00,2021-02-03,Amazon is using AI-equipped cameras in delivery vans and some drivers are concerned about privacy,Amazon has deployed the cameras from Netradyne in Amazon-branded cargo vans used by a handful of companies that are part of its delivery service partner program.,cnbc.com,https://www.cnbc.com/2021/02/03/amazon-using-ai-equipped-cameras-in-delivery-vans.html,https://images.financialmodelingprep.com/news/amazon-is-using-aiequipped-cameras-in-delivery-vans-and-some-20210203.jpeg
AMZN,2021-02-02,2021-01-26,2021-02-16,AMZN,,2021-02-04 00:10:48,2021-02-04T00:10:48-05:00,2021-02-04,SPYG: Market-Mania Signals Potential Peak For Big Tech,SPYG: Market-Mania Signals Potential Peak For Big Tech,seekingalpha.com,https://seekingalpha.com/article/4403240-spyg-market-mania-signals-potential-peak-for-big-tech,https://images.financialmodelingprep.com/news/spyg-marketmania-signals-potential-peak-for-big-tech-20210204.jpg
AMZN,2021-02-02,2021-01-26,2021-02-16,AMZN,,2021-02-04 01:31:02,2021-02-04T01:31:02-05:00,2021-02-04,Tech Sector Shows Its Enormous Earnings Power,Tech Sector Shows Its Enormous Earnings Power,zacks.com,https://www.zacks.com/commentary/1257129/tech-sector-shows-its-enormous-earnings-power,https://images.financialmodelingprep.com/news/tech-sector-shows-its-enormous-earnings-power-20210204.jpg
AMZN,2021-02-02,2021-01-26,2021-02-16,AMZN,,2021-02-04 01:31:03,2021-02-04T01:31:03-05:00,2021-02-04,Tech Sector Shows Its Enormous Earnings Power,Tech Sector Shows Its Enormous Earnings Power,zacks.com,https://www.zacks.com/commentary/1257118/tech-sector-shows-its-enormous-earnings-power,https://images.financialmodelingprep.com/news/tech-sector-shows-its-enormous-earnings-power-20210204.jpg
AMZN,2021-02-02,2021-01-26,2021-02-16,AMZN,,2021-02-04 07:10:52,2021-02-04T07:10:52-05:00,2021-02-04,5 FAANG Stocks With Big Moves Ahead to Keep in Mind,"FAANG stocks represent about 15% of the S&P, making them the safest investments around. But even then, you have to time your entry and exit.",investorplace.com,https://investorplace.com/2021/02/5-faang-stocks-with-big-moves-ahead-to-keep-in-mind-fb-amzn-nflx-aapl-goog-googl/,https://images.financialmodelingprep.com/news/5-faang-stocks-with-big-moves-ahead-to-keep-in-20210204.jpg
AMZN,2021-02-02,2021-01-26,2021-02-16,AMZN,,2021-02-04 08:12:00,2021-02-04T08:12:00-05:00,2021-02-04,Sustainable Investing: What new Amazon CEO Andy Jassy needs to do to become a leader in sustainability like Apple,"Few ESG funds own Amazon stock because of its poor record on labor, workplace issues and corporate competition.",marketwatch.com,https://www.marketwatch.com/story/what-new-amazon-ceo-andy-jassy-needs-to-do-to-become-a-leader-in-sustainability-like-apple-11612444339,https://images.financialmodelingprep.com/news/sustainable-investing-what-new-amazon-ceo-andy-jassy-needs-to-20210204.jpg
AMZN,2021-02-02,2021-01-26,2021-02-16,AMZN,,2021-02-04 10:00:00,2021-02-04T10:00:00-05:00,2021-02-04,"Amazon: Blowout Earnings, Jeff Bezos Stepping Down, And A Path To $7,000 In 2025","Mr. Jassy has been with Amazon since 1997, was the CEO of AWS and is a great choice to succeed Mr. Bezos as CEO of Amazon. Amazon continues to impress as they consistently blowout earnings and increase shareholder value.",seekingalpha.com,https://seekingalpha.com/article/4403060-amazon-blowout-earnings-jeff-bezos-stepping-down-and-path-to-7000-in-2025,https://images.financialmodelingprep.com/news/amazon-blowout-earnings-jeff-bezos-stepping-down-and-a-path-20210204.jpg
AMZN,2021-02-02,2021-01-26,2021-02-16,AMZN,,2021-02-04 10:06:27,2021-02-04T10:06:27-05:00,2021-02-04,8 Biometric Stocks to Consider as We Eye a Return to Normal,"Biometric stocks were already relevant before the pandemic, but they will be even more so as we eventually return to normal. The post 8 Biometric Stocks to Consider as We Eye a Return to Normal appeared first on InvestorPlace.",investorplace.com,https://investorplace.com/2021/02/8-biometric-stocks-investing-in-future/,https://images.financialmodelingprep.com/news/8-biometric-stocks-to-consider-as-we-eye-a-return-20210204.jpeg
AMZN,2021-02-02,2021-01-26,2021-02-16,AMZN,,2021-02-04 11:29:03,2021-02-04T11:29:03-05:00,2021-02-04,8 Stocks to Buy When Your Refund Check Arrives,"It's tax season and while it's not the most enjoyable period for some, you can put your tax refund check to work with these stocks to buy. The post 8 Stocks to Buy When Your Refund Check Arrives appeared first on InvestorPlace.",investorplace.com,https://investorplace.com/2021/02/8-stocks-to-buy-with-tax-refund/,https://images.financialmodelingprep.com/news/8-stocks-to-buy-when-your-refund-check-arrives-20210204.jpg
AMZN,2021-02-02,2021-01-26,2021-02-16,AMZN,,2021-02-04 12:06:18,2021-02-04T12:06:18-05:00,2021-02-04,6 Hot ETFs That Could be Investors' Darling in February,A few ETFs have garnered solid investors' interest to start a New Year and will continue to be their darlings in the month of love.,zacks.com,https://www.zacks.com/stock/news/1257612/6-hot-etfs-that-could-be-investors-darling-in-february,https://images.financialmodelingprep.com/news/6-hot-etfs-that-could-be-investors-darling-in-20210204.jpg
AMZN,2021-02-02,2021-01-26,2021-02-16,AMZN,,2021-02-04 12:07:10,2021-02-04T12:07:10-05:00,2021-02-04,"The Best Stocks to Buy in the Market Today, According to Jeff Bezos","The world's biggest companies -- and the market's best stocks to buy -- all have one thing in common: They're relentlessly innovative.  The post The Best Stocks to Buy in the Market Today, According to Jeff Bezos appeared first on InvestorPlace.",investorplace.com,https://investorplace.com/hypergrowthinvesting/2021/02/the-best-stocks-to-buy-in-the-market-today-according-to-jeff-bezos/,https://images.financialmodelingprep.com/news/the-best-stocks-to-buy-in-the-market-today-20210204.jpg
AMZN,2021-02-02,2021-01-26,2021-02-16,AMZN,,2021-02-04 13:00:59,2021-02-04T13:00:59-05:00,2021-02-04,"Odds Are This Fund Topped Yours — Without FAANG Stocks like Amazon, Apple and Netflix","Odds are, Virtus KAR Mid-Cap Growth Fund's 65% gain topped your mutual funds. It owned no giant tech stocks like Amazon, Apple and Netflix.",investors.com,https://www.investors.com/etfs-and-funds/mutual-funds/best-mutual-funds-fund-soared-2020-without-amazon-apple-netflix/,https://images.financialmodelingprep.com/news/odds-are-this-fund-topped-yours-without-faang-stocks-like-20210204.jpg
AMZN,2021-02-02,2021-01-26,2021-02-16,AMZN,,2021-02-04 13:04:54,2021-02-04T13:04:54-05:00,2021-02-04,Amazon Stock Proves It's Still the E-Commerce King After Blowout Q4,"Amazon stock felt the impact of two huge news items, as an all-time record quarter and the departure of Jeff Bezos as CEO compete for headlines. The post Amazon Stock Proves It's Still the E-Commerce King After Blowout Q4 appeared first on InvestorPlace.",investorplace.com,https://investorplace.com/2021/02/amazon-stock-proves-its-still-the-e-commerce-king-after-blowout-q4/,https://images.financialmodelingprep.com/news/amazon-stock-proves-its-still-the-ecommerce-king-after-20210204.jpg
AMZN,2021-02-02,2021-01-26,2021-02-16,AMZN,,2021-02-04 15:07:04,2021-02-04T15:07:04-05:00,2021-02-04,Is It Time For The Markets To Sober Up?,"Market fundamentals and valuations have seemingly been thrown out the window, but I don???t think this market euphoria can last much longer",zacks.com,https://www.zacks.com/stock/news/1257785/is-it-time-for-the-markets-to-sober-up,https://images.financialmodelingprep.com/news/is-it-time-for-the-markets-to-sober-up-20210204.jpg
AMZN,2021-02-02,2021-01-26,2021-02-16,AMZN,,2021-02-04 15:52:07,2021-02-04T15:52:07-05:00,2021-02-04,Is It Time For The Equity Market To Sober Up?,"The democratization of the financial markets, ultra-low interest rate, and high future growth environment have created a new market that freshman and senior traders are both learning.",zacks.com,https://www.zacks.com/stock/news/1257790/is-it-time-for-the-equity-market-to-sober-up,https://images.financialmodelingprep.com/news/is-it-time-for-the-equity-market-to-sober-20210204.jpg
AMZN,2021-02-02,2021-01-26,2021-02-16,AMZN,,2021-02-04 18:30:34,2021-02-04T18:30:34-05:00,2021-02-04,Big Tech's road to underperformance and why its dominance is waning,"Big Tech stocks such as Apple and Microsoft rallied on Thursday, but Bryn Mawr Trust's Jeff Mills has a warning.",cnbc.com,https://www.cnbc.com/2021/02/04/big-tech-stocks-whats-next-for-apple-microsoft-alphabet-shares.html,https://images.financialmodelingprep.com/news/big-techs-road-to-underperformance-and-why-its-dominance-20210204.jpeg
AMZN,2021-02-02,2021-01-26,2021-02-16,AMZN,,2021-02-04 20:03:09,2021-02-04T20:03:09-05:00,2021-02-04,Here's the biggest challenge facing Amazon's Andy Jassy — at least in the words of one partner,Andy Jassy will have big shoes to fill when he takes over from Amazon CEO Jeff Bezos later this year.,geekwire.com,https://www.geekwire.com/2021/heres-biggest-challenge-facing-amazons-andy-jassy-least-words-one-partner/,https://images.financialmodelingprep.com/news/heres-the-biggest-challenge-facing-amazons-andy-jassy-at-least-20210204.jpg
AMZN,2021-02-02,2021-01-26,2021-02-16,AMZN,,2021-02-05 06:06:00,2021-02-05T06:06:00-05:00,2021-02-05,"Got $5,000? 5 of the Best Buffett Stocks to Buy Now",Riding the Oracle of Omaha's coattails has historically been a smart move.,fool.com,https://www.fool.com/investing/2021/02/05/got-5000-5-of-the-best-buffett-stocks-to-buy-now/,https://images.financialmodelingprep.com/news/got-5000-5-of-the-best-buffett-stocks-to-20210205.jpg
AMZN,2021-02-02,2021-01-26,2021-02-16,AMZN,,2021-02-05 07:50:56,2021-02-05T07:50:56-05:00,2021-02-05,"Should Amazon Try To Acquire Alibaba, Jumia Or eBay In 2021?","Every week, Benzinga conducts a survey to collect sentiment on what traders are most excited about, interested in or thinking about as they manage and build their personal portfolios. This week we posed the following question to over 500 traders and investors as to whether Amazon.com, Inc. (NASDAQ:AMZN) should buy another e-commerce company:",benzinga.com,https://www.benzinga.com/trading-ideas/long-ideas/21/02/19490794/should-amazon-try-to-acquire-alibaba-jumia-or-ebay-in-2021,https://images.financialmodelingprep.com/news/should-amazon-try-to-acquire-alibaba-jumia-or-ebay-20210205.jpg
AMZN,2021-02-02,2021-01-26,2021-02-16,AMZN,,2021-02-05 08:45:00,2021-02-05T08:45:00-05:00,2021-02-05,Jeff Bezos Is Stepping Back: Where Amazon Stock Goes From Here,"He leaves the company in great shape, but his departure will test the strength of the culture he created.",fool.com,https://www.fool.com/investing/2021/02/05/bezos-is-leaving-where-amazon-stock-goes-from-here/,https://images.financialmodelingprep.com/news/jeff-bezos-is-stepping-back-where-amazon-stock-goes-20210205.jpg
AMZN,2021-02-02,2021-01-26,2021-02-16,AMZN,,2021-02-05 09:55:51,2021-02-05T09:55:51-05:00,2021-02-05,"Amazon's Third-Party Marketplace Is Its Cash Cow, Not AWS","What Amazon doesn't talk about, most especially its Marketplace results, is more important than the data it reveals in its SEC reporting.",forbes.com,https://www.forbes.com/sites/pamdanziger/2021/02/05/amazons-third-party-marketplace-is-its-cash-cow-not-aws/,https://images.financialmodelingprep.com/news/amazons-thirdparty-marketplace-is-its-cash-cow-not-aws-20210205.jpg
AMZN,2021-02-02,2021-01-26,2021-02-16,AMZN,,2021-02-05 10:00:12,2021-02-05T10:00:12-05:00,2021-02-05,Dispute between Elastic and AWS highlights ongoing battle over open source business model,"Editor's note: This is a guest post written by Daniel Li, partner at Madrona Venture Group, which first appeared in his weekly newsletter The DL.",geekwire.com,https://www.geekwire.com/2021/dispute-elastic-aws-highlights-ongoing-battle-open-source-business-model/,https://images.financialmodelingprep.com/news/dispute-between-elastic-and-aws-highlights-ongoing-battle-over-open-20210205.jpg
AMZN,2021-02-02,2021-01-26,2021-02-16,AMZN,,2021-02-05 10:30:00,2021-02-05T10:30:00-05:00,2021-02-05,Better Buy: Amazon vs. Dollar Tree,"Is it better to go with the established company, or one that has seen recently improving results?",fool.com,https://www.fool.com/investing/2021/02/05/better-buy-amazon-vs-dollar-tree/,https://images.financialmodelingprep.com/news/better-buy-amazon-vs-dollar-tree-20210205.jpg
AMZN,2021-02-02,2021-01-26,2021-02-16,AMZN,,2021-02-05 10:53:00,2021-02-05T10:53:00-05:00,2021-02-05,U.S. labor board denies Amazon's request to halt Alabama union election,"The U.S. National Labor Relations Board on Friday denied Amazon.com Inc's motion to halt the union election at the company's Bessemer, Alabama warehouse and its request to review the decision to hold the election by mail.",reuters.com,https://www.reuters.com/article/us-amazon-com-labor/u-s-labor-board-denies-amazons-request-to-halt-alabama-union-election-idUSKBN2A51ZX,https://images.financialmodelingprep.com/news/us-labor-board-denies-amazons-request-to-halt-alabama-20210205.jpg
AMZN,2021-02-02,2021-01-26,2021-02-16,AMZN,,2021-02-05 11:00:27,2021-02-05T11:00:27-05:00,2021-02-05,Whole Paycheck: Walmart And Amazon Have A Food Fight,"New research from PYMNTS into seven key retail categories where Amazon and Walmart compete shows the online giant is closing in on its rival's lead in auto parts, one of the last segments where Walmart still enjoys a lead — other than food, where it still dominates. According to the report, the auto parts market […]",pymnts.com,https://www.pymnts.com/news/retail/2021/whole-paycheck-walmart-and-amazon-have-a-food-fight/,https://images.financialmodelingprep.com/news/whole-paycheck-walmart-and-amazon-have-a-food-fight-20210205.jpg
AMZN,2021-02-02,2021-01-26,2021-02-16,AMZN,,2021-02-05 11:10:07,2021-02-05T11:10:07-05:00,2021-02-05,"Amazon loses effort to halt Alabama union drive, voting begins next week","The NLRB's rejection of Amazon's appeal allows workers at an Alabama warehouse to begin casting their ballots by mail, as planned, beginning on Feb. 8.",cnbc.com,https://www.cnbc.com/2021/02/05/amazon-loses-effort-to-halt-alabama-union-drive-voting-begins-next-week.html,https://images.financialmodelingprep.com/news/amazon-loses-effort-to-halt-alabama-union-drive-voting-begins-20210205.jpg
AMZN,2021-02-02,2021-01-26,2021-02-16,AMZN,,2021-02-05 11:27:04,2021-02-05T11:27:04-05:00,2021-02-05,Amazon Stock Will Be Fine Without Jeff Bezos,"Amazon CEO Jeff Bezos is stepping aside, but it appears to making the transition at the right time. The future is bright for Amazon stock.",investorplace.com,https://investorplace.com/2021/02/amazon-stock-will-be-fine-without-jeff-bezos/,https://images.financialmodelingprep.com/news/amazon-stock-will-be-fine-without-jeff-bezos-20210205.jpg
AMZN,2021-02-02,2021-01-26,2021-02-16,AMZN,,2021-02-05 12:14:01,2021-02-05T12:14:01-05:00,2021-02-05,Amazon reportedly hopes to to double its delivery fleet this year by investing in smaller trucking companies that would exclusively serve the e-commerce giant (AMZN),"Amazon is planning to launch an ""Amazon Freight Partners"" program to help train delivery upstarts that would, in turn, join Amazon's fleet of exclusive delivery partners, per a new report from The Information. The e-commerce giant continues to grapple with high freight volumes, and it has struggled to partner with enough delivery partners to meet that demand.",businessinsider.com,https://www.businessinsider.com/amazon-double-delivery-fleet-exclusive-incubator-freight-2021-2,https://images.financialmodelingprep.com/news/amazon-reportedly-hopes-to-to-double-its-delivery-fleet-20210205.jpg
AMZN,2021-02-02,2021-01-26,2021-02-16,AMZN,,2021-02-05 12:24:24,2021-02-05T12:24:24-05:00,2021-02-05,"As Bezos Steps Back, Will Amazon Be A 'Kinder, Gentler' Behemoth?",Is the world ready for a more magnanimous Amazon.com now that Chief Executive Jeff Bezos is handing over the reins of the e-commerce behemoth? At least one analyst seems to think so.,investors.com,https://www.investors.com/stock-lists/tech-leaders/amazon-stock-bezos-ceo-jassy-services-business-amzn/,https://images.financialmodelingprep.com/news/as-bezos-steps-back-will-amazon-be-a-kinder-20210205.jpg
AMZN,2021-02-02,2021-01-26,2021-02-16,AMZN,,2021-02-05 13:38:18,2021-02-05T13:38:18-05:00,2021-02-05,Amazon Loses Appeal To Delay Warehouse Worker Union Vote,Amazon asked the National Labor Relations Board to mandate an in-person vote instead of voting by mail.,forbes.com,https://www.forbes.com/sites/rachelsandler/2021/02/05/amazon-loses-appeal-to-delay-warehouse-worker-union-vote/,https://images.financialmodelingprep.com/news/amazon-loses-appeal-to-delay-warehouse-worker-union-vote-20210205.jpg
