ticker,event_date,window_start,window_end,symbol,symbols,publishedDate,publishedDateET,date_et,title,text,site,url,image
AMZN,2021-02-02,2021-01-26,2021-02-16,AMZN,,2021-02-09 06:09:00,2021-02-09T06:09:00-05:00,2021-02-09,"Amazon spent $44 billion striving for 1-day shipping in 2020, and its logistics empire is nowhere near done","Amazon raced to meet skyrocketing demand with new logistics facilities in 2020, building late into Q4, a time when construction usually slows before the holiday shopping season. It maxed out intentionally underused capacity meant for the holidays early in the year, and so upped its logistics square footage by roughly 50%, adding an estimated 130 million square feet.  It was a good thing it did, CFO Brian Olsavsky said on Amazon's Q4 earnings call last week, since the company beat expectations with a 44% year over year uptick in sales in the fourth quarter.",businessinsider.com,https://www.businessinsider.com/amazon-logistics-buildout-one-day-prime-shipping-2021-2,https://images.financialmodelingprep.com/news/amazon-spent-44-billion-striving-for-1day-shipping-in-20210209.jpg
AMZN,2021-02-02,2021-01-26,2021-02-16,AMZN,,2021-02-09 08:15:00,2021-02-09T08:15:00-05:00,2021-02-09,UPS' No. 1 Opportunity and Challenge in 2021 (Hint: It's Not Amazon),The company's recent results contain mixed evidence of a turnaround in margin.,fool.com,https://www.fool.com/investing/2021/02/09/ups-no-1-opportunity-and-challenge-in-2021-hint-it/,https://images.financialmodelingprep.com/news/ups-no-1-opportunity-and-challenge-in-2021-hint-its-20210209.jpg
AMZN,2021-02-02,2021-01-26,2021-02-16,AMZN,,2021-02-09 08:55:25,2021-02-09T08:55:25-05:00,2021-02-09,3 Reasons Why Amazon Is Still a Top Stock,"The online retailer rocked the fourth quarter, and it still has a lot more up its sleeve.",fool.com,https://www.fool.com/investing/2021/02/09/3-reasons-why-amazon-is-still-a-top-stock/,https://images.financialmodelingprep.com/news/3-reasons-why-amazon-is-still-a-top-stock-20210209.jpeg
AMZN,2021-02-02,2021-01-26,2021-02-16,AMZN,,2021-02-09 09:06:16,2021-02-09T09:06:16-05:00,2021-02-09,3 Stocks Set to Grow In Tune With Demand for Music Streaming,"Music streaming seems poised to witness further growth due to the convenience it provides, making it wise to watch out for names like Apple (AAPL), Amazon (AMZN) and Alphabet (GOOGL)",zacks.com,https://www.zacks.com/stock/news/1259708/3-stocks-set-to-grow-in-tune-with-demand-for-music-streaming,https://images.financialmodelingprep.com/news/3-stocks-set-to-grow-in-tune-with-demand-20210209.jpg
AMZN,2021-02-02,2021-01-26,2021-02-16,AMZN,,2021-02-09 09:15:00,2021-02-09T09:15:00-05:00,2021-02-09,Can The Boom In SaaS Stocks Last Through 2021,Can The Boom In SaaS Stocks Last Through 2021,seekingalpha.com,https://seekingalpha.com/article/4404430-can-boom-in-saas-stocks-last-through-2021,https://images.financialmodelingprep.com/news/can-the-boom-in-saas-stocks-last-through-2021-20210209.jpg
AMZN,2021-02-02,2021-01-26,2021-02-16,AMZN,,2021-02-09 12:30:00,2021-02-09T12:30:00-05:00,2021-02-09,Where Will Amazon Be in a Year?,An end to the pandemic could be challenging for Amazon's business.,fool.com,https://www.fool.com/investing/2021/02/09/where-will-amazon-be-in-a-year/,https://images.financialmodelingprep.com/news/where-will-amazon-be-in-a-year-20210209.jpg
AMZN,2021-02-02,2021-01-26,2021-02-16,AMZN,,2021-02-09 13:42:42,2021-02-09T13:42:42-05:00,2021-02-09,Tensions high at Amazon warehouse as milestone union vote gets underway,"On their way to and from the sprawling warehouse facility in Bessemer, Alabama, Amazon workers see union representatives holding signs encouraging them to vote ""yes"" for a union. But inside the facility, workers have frequently been pulled into meetings informing them of Amazon's stance that a union is an unnecessary expense. Even when they sit on the toilet, they see anti-union signage on the bathroom stall.",cnn.com,https://www.cnn.com/2021/02/09/tech/amazon-warehouse-union-election/index.html,https://images.financialmodelingprep.com/news/tensions-high-at-amazon-warehouse-as-milestone-union-vote-20210209.jpg
AMZN,2021-02-02,2021-01-26,2021-02-16,AMZN,,2021-02-09 14:35:41,2021-02-09T14:35:41-05:00,2021-02-09,ContextLogic Has Nothing to Do With Retail,One look at ContextLogic's board of directors tells me that the company is a lot of things but it's not a great retail business. Here's why.,investorplace.com,https://investorplace.com/2021/02/wish-stock-contextlogic-has-nothing-to-do-with-retail/,https://images.financialmodelingprep.com/news/contextlogic-has-nothing-to-do-with-retail-20210209.jpg
AMZN,2021-02-02,2021-01-26,2021-02-16,AMZN,,2021-02-10 00:02:36,2021-02-10T00:02:36-05:00,2021-02-10,Tesla Rival Rivian Prepares To Go Public This Year At $50B Valuation: Report,"Amazon.com, Inc (NASDAQ: AMZN)-backed Rivian Automotive Inc may go public as early as September, Bloomberg reported Tuesday. What Happened: The Michigan-based automaker — also backed by Ford Motor Company (NYSE: F) — could achieve a valuation of nearly $50 billion or more, people familiar with the matter told Bloomberg.",benzinga.com,https://www.benzinga.com/news/21/02/19578827/tesla-rival-rivian-prepares-to-go-public-this-year-at-50b-valuation-report,https://images.financialmodelingprep.com/news/tesla-rival-rivian-prepares-to-go-public-this-year-20210210.jpg
AMZN,2021-02-02,2021-01-26,2021-02-16,AMZN,,2021-02-10 07:46:32,2021-02-10T07:46:32-05:00,2021-02-10,Amazon Short Interest Rises to 6-Month High,"Amazon.com Inc. (NASDAQ: AMZN) recently posted strong fourth-quarter results, with earnings per share more than doubling year over year and revenue at its cloud computing segment up 28%.",247wallst.com,https://247wallst.com/retail/2021/02/10/amazon-short-interest-rises-to-6-month-high/,https://images.financialmodelingprep.com/news/amazon-short-interest-rises-to-6month-high-20210210.jpg
AMZN,2021-02-02,2021-01-26,2021-02-16,AMZN,,2021-02-10 08:50:00,2021-02-10T08:50:00-05:00,2021-02-10,Amazon and Dutch Blitz File Joint Lawsuit against Counterfeiters,"SEATTLE--(BUSINESS WIRE)--Today, Amazon’s (NASDAQ: AMZN) Counterfeit Crimes Unit filed four federal lawsuits on behalf of Dutch Blitz Acquisition Corporation (Dutch Blitz), a family-owned card game maker. The lawsuits seek recovery of the profits the owners of Dutch Blitz have lost from counterfeit versions of its card game, which was born in the Pennsylvania Dutch country. Amazon and Dutch Blitz filed four lawsuits collectively against four individuals and two entities (the “defendants”) for counterfeiting Dutch Blitz’s card game product. The defendants attempted to offer the infringing product in Amazon’s store, violating Amazon’s policies, infringing on Dutch Blitz’s trademarks, and breaking the law. The suits were filed in the United States District Court for the Western District of Washington and allege that the six defendants used Dutch Blitz’s registered trademarks, without authorization, to deceive customers about the authenticity and origin of the products and the affiliation with Dutch Blitz. Amazon strictly prohibits counterfeit products in its stores, and in 2019 alone, invested more than $500 million to protect customers and brands from fraud and abuse, including counterfeit. Amazon’s proactive investments in preventing counterfeit include robust seller vetting, advanced machine-learning based technologies, and industry-leading brand protection tools like Project Zero, Brand Registry, and Transparency. As a result of Amazon’s efforts, 99.9% of all products viewed by customers on Amazon have not received a valid counterfeit complaint. In June 2020, Amazon launched its Counterfeit Crimes Unit, a global team dedicated to pursuing bad actors and holding them accountable to the fullest extent of the law, including working with law enforcement. Amazon has filed a series of lawsuits against counterfeiters, including a suit against individuals using social media to promote and facilitate the sale of counterfeits, as well as joint lawsuits with Italian luxury brand Valentino, cosmetics brand KF Beauty, family travel accessory brand JL Childress, and YETI. Dutch Blitz is a Pennsylvania-based, family-owned-and-operated business started in the 1960s by Werner Ernst George Muller. Today, Mary and Mike Fisher continue to run Dutch Blitz as a family-owned and family-operated business in Pennsylvania and it is one of more than a million small and medium-sized businesses worldwide that sell their products in Amazon’s store. “We strictly prohibit the sale of counterfeits and have done more than any other retailer to stop the trafficking of counterfeit goods online. We continue to launch new and enhanced verification processes and advanced machine learning based systems to protect customers and prevent bad actors from entering our store. We have invented tools to empower brands to partner with us and better protect their intellectual property, and we have launched the Counterfeit Crimes Unit, staffed with former federal prosecutors and other experts, to hold bad actors accountable to the fullest extent of the law. We are proud that we are able to help protect the intellectual property of small and medium size businesses such as Dutch Blitz through our Counterfeit Crimes Unit,"" said Dharmesh Mehta, VP of Customer Trust and Partner Support. “We are tireless in our efforts to ensure only authentic products are sold in our store, and we urge brands, policymakers, and regulators to remain vigilant and continue to partner with us in our shared mission to stop these bad actors.” “We are seeing real results from Amazon’s work to eliminate counterfeit products from being sold in their store,” said Mary Fisher, President of Dutch Blitz. “It has been incredible to work with their team on these efforts, which have had a meaningful and measurable impact on our brand. We will continue to partner with Amazon to deliver on the commitment we’ve made to our customers who enjoy our game every day.” The court filings are available here: Case: 2:21-cv-00162, United States District Court for the Western District of Washington Amazon has an extensive history protecting brands and taking action to hold bad actors accountable: Amazon Project Zero launches in 7 new countries Amazon Transparency protects more than 10,000 brands Amazon Establishes Counterfeit Crimes Unit to Bring Counterfeiters to Justice Amazon Launches IP Accelerator in Europe to Help Small Businesses Protect Their Brands and Tackle Counterfeit IPR Center, Amazon Launch ‘Operation Fulfilled Action’ to Stop Counterfeiters Amazon Files Lawsuit Against Counterfeiters Using Social Media to Promote Sales Amazon Supports Resolution of 3M Case Against Fraudsters Amazon Supports Investigation, Prosecution of New York Defendants Charged in Fraud Scheme Amazon and KF Beauty File Joint Lawsuit Against Counterfeiters Amazon and Valentino File Joint Lawsuit Against New York-Based Counterfeiter Amazon and YETI File Joint Lawsuit against Counterfeiters About Amazon Amazon is guided by four principles: customer obsession rather than competitor focus, passion for invention, commitment to operational excellence, and long-term thinking. Customer reviews, 1-Click shopping, personalized recommendations, Prime, Fulfillment by Amazon, AWS, Kindle Direct Publishing, Kindle, Fire tablets, Fire TV, Amazon Echo, and Alexa are some of the products and services pioneered by Amazon. For more information, visit amazon.com/about and follow @AmazonNews.",businesswire.com,https://www.businesswire.com/news/home/20210210005579/en/Amazon-and-Dutch-Blitz-File-Joint-Lawsuit-against-Counterfeiters,https://images.financialmodelingprep.com/news/amazon-and-dutch-blitz-file-joint-lawsuit-against-counterfeiters-20210210.jpg
AMZN,2021-02-02,2021-01-26,2021-02-16,AMZN,,2021-02-10 08:50:00,2021-02-10T08:50:00-05:00,2021-02-10,Amazon and Dutch Blitz File Joint Lawsuit against Counterfeiters,"SEATTLE--(BUSINESS WIRE)--Today, Amazon's (NASDAQ: AMZN) Counterfeit Crimes Unit filed four federal lawsuits on behalf of Dutch Blitz Acquisition Corporation (Dutch Blitz), a family-owned card game maker. The lawsuits seek recovery of the profits the owners of Dutch Blitz have lost from counterfeit versions of its card game, which was born in the Pennsylvania Dutch country. Amazon and Dutch Blitz filed four lawsuits collectively against four individuals and two entities (the “defendants”) for c",businesswire.com,https://www.businesswire.com/news/home/20210210005579/en/Amazon-and-Dutch-Blitz-File-Joint-Lawsuit-against-Counterfeiters/,https://images.financialmodelingprep.com/news/amazon-and-dutch-blitz-file-joint-lawsuit-against-counterfeiters-20210210.jpg
AMZN,2021-02-02,2021-01-26,2021-02-16,AMZN,,2021-02-10 09:05:00,2021-02-10T09:05:00-05:00,2021-02-10,The 5 Toughest Tasks for Amazon's New CEO,Andy Jassy will start with a full plate when he takes over later this year.,fool.com,https://www.fool.com/investing/2021/02/10/the-5-toughest-tasks-for-amazons-new-ceo/,https://images.financialmodelingprep.com/news/the-5-toughest-tasks-for-amazons-new-ceo-20210210.jpg
AMZN,2021-02-02,2021-01-26,2021-02-16,AMZN,,2021-02-10 11:05:00,2021-02-10T11:05:00-05:00,2021-02-10,EU privacy agency urges more safeguards to curb U.S. tech giants,"EU privacy watchdog EDPS on Wednesday backed the bloc's push to curb the power of Apple, Amazon, Alphabet unit Google and Facebook via new tough rules and suggested more safeguards to boost users' privacy rights.",reuters.com,https://www.reuters.com/article/us-eu-tech-privacy/eu-privacy-agency-urges-more-safeguards-to-curb-u-s-tech-giants-idUSKBN2AA25D,https://images.financialmodelingprep.com/news/eu-privacy-agency-urges-more-safeguards-to-curb-us-20210210.jpg
AMZN,2021-02-02,2021-01-26,2021-02-16,AMZN,,2021-02-10 19:00:00,2021-02-10T19:00:00-05:00,2021-02-10,AWS Teams with the National Hockey League to be the Official Cloud Infrastructure Provider of the NHL,"SEATTLE--(BUSINESS WIRE)--Today, Amazon Web Services, Inc. (AWS), an Amazon.com, Inc. company (NASDAQ: AMZN), announced that it has entered into an agreement with the National Hockey League (NHL) to become the Official Cloud, Artificial Intelligence, and Machine Learning Infrastructure Provider of the NHL. By tapping into the breadth and depth of AWS services, the NHL will be able to automate video processing and content delivery in the cloud and leverage its Puck and Player Tracking (PPT) System, which runs on AWS cloud infrastructure, to better capture the details of game play for its fans, teams, and media partners. The NHL will also build an enterprise video platform on AWS to aggregate video, data, and related applications into one central repository that will enable easier search and retrieval of archival video footage, give broadcasters instant access to NHL content for syndication and licensing, and facilitate the creation and delivery of new in-game analyses, predictions, and video highlights to enhance mobile, online, and broadcast experiences. The NHL will work with the Amazon Machine Learning Solutions Lab to apply AWS’s deep portfolio of machine learning services to game video and official NHL data – including data from the NHL’s new Puck and Player Tracking (PPT) System and from the NHL’s Hockey Information & Tracking System (HITS) real-time stats – to develop and share advanced game analytics and metrics that take fans deeper into the game. In addition, the NHL intends to use AWS Elemental Media Services to develop and manage a cloud-based HD and 4K video content delivery system that will provide a complete view of the game to NHL officials, coaches, players, and fans. Powered by AWS, the system will encode, process, store, and transmit game footage from a series of new camera angles to provide continuous video feeds that capture plays and events outside the field of view of traditional broadcast cameras. In addition, by leveraging AWS analytics services including Amazon Kinesis (AWS’s service for easily collecting, processing, and analyzing video and data streams in real time) and machine learning services such as Amazon SageMaker (AWS’s service that enables data scientists and developers to build, train, and deploy machine learning models quickly), the NHL will be able to audit its feeds to broadcast partners in real time. This capability will enable the NHL to create a smart monitoring system that detects and automatically fixes potential feed issues, offering fans a seamless in-game experience across viewing platforms. “AWS’s state-of-the-art technology and services will provide us with capabilities to deliver analytics and insights that highlight the speed and skill of our game to drive deeper fan engagement,” said NHL Commissioner Gary Bettman. “AWS is unmatched in the portfolio of cloud services that it delivers, including computer vision and machine learning, and we intend to leverage them across the board to provide advanced analysis to our teams, officials, and media partners faster than ever before. We’re thrilled to have AWS join the NHL’s family of blue-chip technology partners as we continue our focus on innovation and building the most advanced technology solutions in sports.” “AWS is working with the world’s most renowned sports leagues to better understand their data and innovate upon it using our deep portfolio of machine learning services,” said Andy Jassy, CEO of Amazon Web Services, Inc. “With this agreement, AWS will provide our industry-leading cloud technology to the NHL, becoming a foundational partner in delivering NHL performance analytics and collaborating to enhance the way people experience hockey by providing more engaging content and greater insights to fans. AWS’s breadth and depth of services, our proven experience in sports analytics, and our relentless focus on innovation give the NHL the ability to bring an entirely new perspective and layer of fan involvement to the game of hockey.” The NHL will be introducing its new analytics using AWS services and technology throughout the upcoming season. For more information, please visit www.aws.amazon.com/sports. About Amazon Web Services For almost 15 years, Amazon Web Services has been the world’s most comprehensive and broadly adopted cloud platform. AWS has been continually expanding its services to support virtually any cloud workload, and it now has more than 200 fully featured services for compute, storage, databases, networking, analytics, machine learning and artificial intelligence (AI), Internet of Things (IoT), mobile, security, hybrid, virtual and augmented reality (VR and AR), media, and application development, deployment, and management from 77 Availability Zones (AZs) within 24 geographic regions, with announced plans for 18 more Availability Zones and six more AWS Regions in Australia, India, Indonesia, Japan, Spain and Switzerland. Millions of customers—including the fastest-growing startups, largest enterprises, and leading government agencies—trust AWS to power their infrastructure, become more agile, and lower costs. To learn more about AWS, visit aws.amazon.com. About Amazon Amazon is guided by four principles: customer obsession rather than competitor focus, passion for invention, commitment to operational excellence, and long-term thinking. Customer reviews, 1-Click shopping, personalized recommendations, Prime, Fulfillment by Amazon, AWS, Kindle Direct Publishing, Kindle, Fire tablets, Fire TV, Amazon Echo, and Alexa are some of the products and services pioneered by Amazon. For more information, visit amazon.com/about and follow @AmazonNews. About the NHL The National Hockey League (NHL), founded in 1917, consists of 31 Member Clubs and proudly welcomes its 32nd franchise, the Seattle Kraken, for the 2021-22 season. Each team roster reflects the League’s international makeup with players from more than 20 countries represented, all vying for the most cherished and historic trophy in professional sports – the Stanley Cup. Every year, the NHL entertains more than 670 million fans in-arena and through its partners on national television and radio; more than 151 million followers - league, team and player accounts combined - across Facebook, Twitter, Instagram, Snapchat and YouTube; and more than 100 million fans online at NHL.com. The League broadcasts games in more than 160 countries and territories through its rightsholders including NBC/NBCSN and the NHL Network in the U.S., Sportsnet and TVA in Canada, Viasat in the Nordic Region and CCTV and Tencent in China. The NHL reaches fans worldwide with games available online in every country including via its live and on-demand streaming service NHL.TV. Fans are engaged across the League’s digital assets on mobile devices via the free NHL App; across nine social media platforms; on SiriusXM NHL Network Radio; and on NHL.com, available in eight languages and featuring unprecedented access to player and team statistics as well as every regular-season and playoff game box score dating back to the League’s inception, powered by SAP. The NHL is committed to building healthy and vibrant communities through the sport of hockey by increasing youth participation and engagement; fostering positive family experiences; promoting inclusion, positive culture and leadership; and supporting sustainable community impact.",businesswire.com,https://www.businesswire.com/news/home/20210210005858/en/AWS-Teams-with-the-National-Hockey-League-to-be-the-Official-Cloud-Infrastructure-Provider-of-the-NHL,https://images.financialmodelingprep.com/news/aws-teams-with-the-national-hockey-league-to-be-20210210.jpg
AMZN,2021-02-02,2021-01-26,2021-02-16,AMZN,,2021-02-10 20:00:03,2021-02-10T20:00:03-05:00,2021-02-10,Are Young Investors Secretly Value Investors?,"The WSB/Reddit short squeeze traders were mostly trading in stocks that have, historically, been considered values. Is a new generation of investors falling in love with value?",zacks.com,https://www.zacks.com/stock/news/1261307/are-young-investors-secretly-value-investors,https://images.financialmodelingprep.com/news/are-young-investors-secretly-value-investors-20210210.jpg
AMZN,2021-02-02,2021-01-26,2021-02-16,AMZN,,2021-02-10 20:46:03,2021-02-10T20:46:03-05:00,2021-02-10,Top Tech Stocks to Buy Amid Strong Earnings and Bullish Outlook,"Technology impacts nearly every aspect of our lives and the economy, and with a bullish setup for 2021, investors might want to add a few tech names to their portfolios.",zacks.com,https://www.zacks.com/stock/news/1261316/top-tech-stocks-to-buy-amid-strong-earnings-and-bullish-outlook,https://images.financialmodelingprep.com/news/top-tech-stocks-to-buy-amid-strong-earnings-and-20210210.jpg
AMZN,2021-02-02,2021-01-26,2021-02-16,AMZN,,2021-02-11 01:31:02,2021-02-11T01:31:02-05:00,2021-02-11,A Very Strong Earnings Picture,A Very Strong Earnings Picture,zacks.com,https://www.zacks.com/commentary/1261189/a-very-strong-earnings-picture,https://images.financialmodelingprep.com/news/a-very-strong-earnings-picture-20210211.jpg
AMZN,2021-02-02,2021-01-26,2021-02-16,AMZN,,2021-02-11 01:31:08,2021-02-11T01:31:08-05:00,2021-02-11,A Very Strong Earnings Picture,A Very Strong Earnings Picture,zacks.com,https://www.zacks.com/commentary/1261194/a-very-strong-earnings-picture,https://images.financialmodelingprep.com/news/a-very-strong-earnings-picture-20210211.jpg
AMZN,2021-02-02,2021-01-26,2021-02-16,AMZN,,2021-02-11 02:21:25,2021-02-11T02:21:25-05:00,2021-02-11,Amazon Working On Project To Let Customers Enjoy Services Using 'Digital Currency',"Amazon.com, Inc (NASDAQ: AMZN) appears to be preparing to launch a “digital currency” project, beginning with Mexico, based on the company's job listings. What Happened: “We are building a tech team to build innovative payment products for customers in emerging markets and are looking for talented SDEs [Software Development Engineers] and SDMs [Software Development Managers] to join our journey,” stated the Jeff Bezos-led company in the ad, first noticed on CoinDesk.",benzinga.com,https://www.benzinga.com/markets/cryptocurrency/21/02/19606587/amazon-working-on-project-to-let-customers-enjoy-services-using-digital-currency,https://images.financialmodelingprep.com/news/amazon-working-on-project-to-let-customers-enjoy-services-20210211.jpg
