ticker,event_date,window_start,window_end,symbol,symbols,publishedDate,publishedDateET,date_et,title,text,site,url,image
GOOGL,2023-10-24,2023-10-10,2023-11-07,GOOGL,,2023-10-30 06:16:01,2023-10-30T06:16:01-04:00,2023-10-30,2 fallen cybersecurity stocks for patient bargain hunters,Cybersecurity stocks have been strong performers this earnings season. Many leaders are higher priced stocks in the $100 to over $300 range.,marketbeat.com,https://www.marketbeat.com/originals/2-fallen-cybersecurity-stocks-for-patient-bargain-hunters/?utm_source=snapi,https://images.financialmodelingprep.com/news/2-fallen-cybersecurity-stocks-for-patient-bargain-hunters-20231030.jpg
GOOGL,2023-10-24,2023-10-10,2023-11-07,GOOGL,,2023-10-30 06:18:20,2023-10-30T06:18:20-04:00,2023-10-30,Google CEO Sundar Pichai to testify in US antitrust trial,"Sundar Pichai, CEO of Alphabet Inc and its subsidiary Google, will testify on Monday in the once-in-a generation antitrust fight with the U.S. government over Google's dominance of search and some parts of search advertising.",reuters.com,https://www.reuters.com/legal/google-ceo-sundar-pichai-testify-us-antitrust-trial-2023-10-30/,https://images.financialmodelingprep.com/news/google-ceo-sundar-pichai-to-testify-in-us-antitrust-20231030.jpg
GOOGL,2023-10-24,2023-10-10,2023-11-07,GOOGL,,2023-10-30 08:08:56,2023-10-30T08:08:56-04:00,2023-10-30,Google owner Alphabet ploughs $2bn into AI start-up Anthropic,"Alphabet Inc (NASDAQ:GOOG), Google's parent company, has committed to a $2 billion investment in Anthropic, the artificial intelligence (AI) start-up. The San Francisco-based company, co-founded by Dario Amodei, formerly of ChatGPT investor OpenAI, has already achieved a valuation surpassing $5 billion.",proactiveinvestors.com,https://www.proactiveinvestors.com/companies/news/1031368?SNAPI,https://images.financialmodelingprep.com/news/google-owner-alphabet-ploughs-2bn-into-ai-startup-anthropic-20231030.jpg
GOOGL,2023-10-24,2023-10-10,2023-11-07,GOOGL,,2023-10-30 08:15:00,2023-10-30T08:15:00-04:00,2023-10-30,Alphabet's Latest Earnings Teaches Investors a Valuable Lesson,Alphabet stock fell considerably following its Q3 earnings. The tech powerhouse reported generally strong results.,fool.com,https://www.fool.com/investing/2023/10/30/alphabets-earnings-teaches-investors-lesson/,https://images.financialmodelingprep.com/news/alphabets-latest-earnings-teaches-investors-a-valuable-lesson-20231030.jpg
GOOGL,2023-10-24,2023-10-10,2023-11-07,GOOGL,,2023-10-30 09:46:06,2023-10-30T09:46:06-04:00,2023-10-30,4 Internet Stocks Poised to Top Estimates This Earnings Season,"Here, we pick four internet stocks ??? DASH, PYPL, W and YELP?",zacks.com,https://www.zacks.com/stock/news/2174300/4-internet-stocks-poised-to-top-estimates-this-earnings-season,https://images.financialmodelingprep.com/news/4-internet-stocks-poised-to-top-estimates-this-earnings-20231030.jpg
GOOGL,2023-10-24,2023-10-10,2023-11-07,GOOGL,,2023-10-30 11:47:00,2023-10-30T11:47:00-04:00,2023-10-30,"Biden's executive order on AI could reshape the technology's impact on economy, national security","President Biden's sweeping executive order on artificial intelligence, expected to be issued Monday afternoon, could greatly shape how AI evolves as it extends its tentacles into the U.S. economy and national security.",marketwatch.com,https://www.marketwatch.com/story/bidens-executive-order-on-ai-could-reshape-the-technologys-impact-on-economy-national-security-840cbedb,https://images.financialmodelingprep.com/news/bidens-executive-order-on-ai-could-reshape-the-technologys-20231030.jpg
GOOGL,2023-10-24,2023-10-10,2023-11-07,GOOGL,,2023-10-30 12:35:24,2023-10-30T12:35:24-04:00,2023-10-30,Google C.E.O. Says Tech Giant Has Improved the Web for All Consumers,"Sundar Pichai, the chief executive of Google, appeared in court to defend his company against a landmark federal antitrust case.",nytimes.com,https://www.nytimes.com/2023/10/30/technology/google-sundar-pichai-antitrust-trial.html,https://images.financialmodelingprep.com/news/google-ceo-says-tech-giant-has-improved-the-web-for-20231030.jpg
GOOGL,2023-10-24,2023-10-10,2023-11-07,GOOGL,,2023-10-30 12:47:33,2023-10-30T12:47:33-04:00,2023-10-30,5 Inverse Tech ETFs That Rose on Nasdaq Entry Into Correction,"The so-called ""Magnificent Seven"" failed to reassure investors in the face of heightened geopolitical risks and rising Treasury yields.",zacks.com,https://www.zacks.com/stock/news/2174630/5-inverse-tech-etfs-that-rose-on-nasdaq-entry-into-correction,https://images.financialmodelingprep.com/news/5-inverse-tech-etfs-that-rose-on-nasdaq-entry-20231030.jpg
GOOGL,2023-10-24,2023-10-10,2023-11-07,GOOGL,,2023-10-30 13:07:07,2023-10-30T13:07:07-04:00,2023-10-30,Google: The Most Attractive Mega-Cap Stock After Q3,"Google's Q3 performance showcases strong growth with double-digit revenue expansion and a significant 42% increase in earnings. The market reacted with a selloff. Concerns about the growth of Google Cloud are overblown, as growth in this segment is still solid. Future AI projects will likely boost Cloud performance. Google's strong results in its core search business and its diversification efforts, such as the success of its Pixel phones, make it a robust mega-cap stock.",seekingalpha.com,https://seekingalpha.com/article/4645062-google-most-attractive-mega-cap-stock-after-q3,https://images.financialmodelingprep.com/news/google-the-most-attractive-megacap-stock-after-q3-20231030.jpg
GOOGL,2023-10-24,2023-10-10,2023-11-07,GOOGL,,2023-10-30 14:02:02,2023-10-30T14:02:02-04:00,2023-10-30,"Why Artificial Intelligence (AI) Stocks Meta Platforms, Amazon, and Alphabet Rallied Monday Morning",AI stocks have been at the forefront of the 2023 market rally. Big tech companies are well positioned to profit from the latest advances in AI.,fool.com,https://www.fool.com/investing/2023/10/30/why-artificial-intelligence-ai-stocks-meta-platfor/,https://images.financialmodelingprep.com/news/why-artificial-intelligence-ai-stocks-meta-platforms-amazon-and-20231030.jpg
GOOGL,2023-10-24,2023-10-10,2023-11-07,GOOGL,,2023-10-30 14:29:00,2023-10-30T14:29:00-04:00,2023-10-30,Google CEO defends paying Apple and others to make Google the default search engine on devices,"Testifying in the biggest U.S. antitrust case in a quarter century, Google CEO Sundar Pichai defended his company's practice of paying Apple and other tech companies to make Google the default search engine on their devices, saying the intent was to make the user experience ""seamless and easy.''",techxplore.com,https://techxplore.com/news/2023-10-google-ceo-defends-paying-apple.html,https://images.financialmodelingprep.com/news/google-ceo-defends-paying-apple-and-others-to-make-20231030.jpg
GOOGL,2023-10-24,2023-10-10,2023-11-07,GOOGL,,2023-10-30 14:51:13,2023-10-30T14:51:13-04:00,2023-10-30,Alphabet CEO Sundar Pichai testifies in U.S. antitrust trial to defend Google's search business,It was the first opportunity for the government's attorneys to press Google's top executive in open court on actions to secure its search dominance.,cnbc.com,https://www.cnbc.com/2023/10/30/google-ceo-sundar-pichai-testifies-in-us-antitrust-trial.html,https://images.financialmodelingprep.com/news/alphabet-ceo-sundar-pichai-testifies-in-us-antitrust-trial-20231030.jpg
GOOGL,2023-10-24,2023-10-10,2023-11-07,GOOGL,,2023-10-30 16:00:19,2023-10-30T16:00:19-04:00,2023-10-30,Google CEO Defends Deals Making Google The Default Search Engine,Sundar Pichai—testifying during Google's antitrust trial—said deals with Apple and others were meant to make the user experience “seamless and easy.”,forbes.com,https://www.forbes.com/sites/tylerroush/2023/10/30/google-ceo-defends-deals-making-google-the-default-search-engine/,https://images.financialmodelingprep.com/news/google-ceo-defends-deals-making-google-the-default-search-20231030.jpg
GOOGL,2023-10-24,2023-10-10,2023-11-07,GOOGL,,2023-10-30 16:32:11,2023-10-30T16:32:11-04:00,2023-10-30,A Deep Dive into 2023's Surprising Trends (8 Extreme Charts),"Like a fingerprint, each market is unique. However, as Stock Strategist Andrew Rocco illustrates, 2023 is especially abnormal, with many extremes.",zacks.com,https://www.zacks.com/commentary/2174801/a-deep-dive-into-2023-s-surprising-trends-8-extreme-charts,https://images.financialmodelingprep.com/news/a-deep-dive-into-2023s-surprising-trends-8-extreme-20231030.jpg
GOOGL,2023-10-24,2023-10-10,2023-11-07,GOOGL,,2023-10-30 18:03:04,2023-10-30T18:03:04-04:00,2023-10-30,Time to Buy Amazon's Stock on Upbeat AI Commentary and Strong Q3 Results?,"With Amazon's (AMZN) stock now up +56% year to date, let's see if it's time to buy AMZN shares for more upside following the company's strong Q3 results.",zacks.com,https://www.zacks.com/stock/news/2174818/time-to-buy-amazon-s-stock-on-upbeat-ai-commentary-and-strong-q3-results,https://images.financialmodelingprep.com/news/time-to-buy-amazons-stock-on-upbeat-ai-commentary-20231030.jpg
GOOGL,2023-10-24,2023-10-10,2023-11-07,GOOGL,,2023-10-30 22:30:32,2023-10-30T22:30:32-04:00,2023-10-30,5 things we learned so far about the Google antitrust case,"Google CEO Sundar Pichai testified Monday in the U.S. government's antitrust trial against the company. The executive defended Google's business tactics, including its deal with Apple and other partners to make Google the default search engine.",techcrunch.com,https://techcrunch.com/2023/10/30/5-things-we-learned-so-far-about-the-google-antitrust-case/,https://images.financialmodelingprep.com/news/5-things-we-learned-so-far-about-the-google-20231030.jpg
GOOGL,2023-10-24,2023-10-10,2023-11-07,GOOGL,,2023-10-31 05:03:00,2023-10-31T05:03:00-04:00,2023-10-31,2 Smartest Tech Stocks to Buy in 2023 and Beyond,Alphabet and Nvidia have enjoyed solid revenue growth this year after a challenging 2022. Alphabet is profiting from growth in its search and YouTube segments.,fool.com,https://www.fool.com/investing/2023/10/31/2-smartest-tech-stocks-to-buy-in-2023-and-beyond/,https://images.financialmodelingprep.com/news/2-smartest-tech-stocks-to-buy-in-2023-and-20231031.jpg
GOOGL,2023-10-24,2023-10-10,2023-11-07,GOOGL,,2023-10-31 06:00:00,2023-10-31T06:00:00-04:00,2023-10-31,2 Stock-Split Stocks That Could Skyrocket in a Bull Market,Amazon and Alphabet both completed stock splits last year after their shares soared. These market leaders could see their share prices take off in a market favoring growth.,fool.com,https://www.fool.com/investing/2023/10/31/2-stock-split-stocks-could-soar-in-bull-market/,https://images.financialmodelingprep.com/news/2-stocksplit-stocks-that-could-skyrocket-in-a-bull-20231031.jpg
GOOGL,2023-10-24,2023-10-10,2023-11-07,GOOGL,,2023-10-31 06:03:00,2023-10-31T06:03:00-04:00,2023-10-31,"Google Cloud Hit a Snag, but Here's Why Alphabet Stock Is a Buy Anyway","Alphabet stock fell after the market was disappointed with Google Cloud growth. Further down the income statement, though, Google Cloud is doing more than just fine.",fool.com,https://www.fool.com/investing/2023/10/31/google-cloud-hit-a-snag-but-heres-why-alphabet-sto/,https://images.financialmodelingprep.com/news/google-cloud-hit-a-snag-but-heres-why-alphabet-20231031.jpg
GOOGL,2023-10-24,2023-10-10,2023-11-07,GOOGL,,2023-10-31 06:11:11,2023-10-31T06:11:11-04:00,2023-10-31,Could 7 Tech Giants Drag Down the Broader Market?,"That group consists of Apple Inc. NASDAQ: AAPL, Microsoft Corp. NASDAQ: MSFT, Alphabet Inc. NASDAQ: GOOGL, Amazon.com Inc. NASDAQ: AMZN, Nvidia Corp. NASDAQ: NVDA, Tesla Inc. NASDAQ: TSLA and Meta Platforms Inc. NASDAQ: META.",marketbeat.com,https://www.marketbeat.com/originals/could-7-tech-giants-drag-down-the-broader-market/?utm_source=snapi,https://images.financialmodelingprep.com/news/could-7-tech-giants-drag-down-the-broader-market-20231031.jpg
GOOGL,2023-10-24,2023-10-10,2023-11-07,GOOGL,,2023-10-31 06:15:00,2023-10-31T06:15:00-04:00,2023-10-31,2 Reasons the 12% Sell-Off in This Trillion-Dollar Stock Is Way Overdone,Alphabet released its third-quarter report on Oct. 24. There was a notable acceleration in the core parts of Alphabet's business.,fool.com,https://www.fool.com/investing/2023/10/31/2-reasons-12-drop-trillion-dollar-stock-overdone/,https://images.financialmodelingprep.com/news/2-reasons-the-12-selloff-in-this-trilliondollar-stock-20231031.jpg
GOOGL,2023-10-24,2023-10-10,2023-11-07,GOOGL,,2023-10-31 07:05:00,2023-10-31T07:05:00-04:00,2023-10-31,Alphabet Stock Is Sinking: Here's Why Now Could Be a Great Time to Buy,"Alphabet recently reported its third-quarter earnings. The company is seeing strong growth from its advertising services, but disappointing growth from the cloud.",fool.com,https://www.fool.com/investing/2023/10/31/alphabet-stock-is-sinking-heres-why-now-could-be-a/,https://images.financialmodelingprep.com/news/alphabet-stock-is-sinking-heres-why-now-could-be-20231031.jpg
GOOGL,2023-10-24,2023-10-10,2023-11-07,GOOGL,,2023-10-31 09:53:00,2023-10-31T09:53:00-04:00,2023-10-31,"Investing $1,000 in These 2 Top Stocks Would Be a Brilliant Move","Medtronic's diversification and excellent dividend make it a good pick for conservative investors. Alphabet's stock recently took a dive, but the company retains its leadership in multiple industries.",fool.com,https://www.fool.com/investing/2023/10/31/investing-1000-in-these-2-top-stocks-would-be-a/,https://images.financialmodelingprep.com/news/investing-1000-in-these-2-top-stocks-would-be-20231031.jpg
GOOGL,2023-10-24,2023-10-10,2023-11-07,GOOGL,,2023-10-31 10:32:25,2023-10-31T10:32:25-04:00,2023-10-31,Alphabet Inc. (GOOGL) is Attracting Investor Attention: Here is What You Should Know,"Zacks.com users have recently been watching Alphabet (GOOGL) quite a bit. Thus, it is worth knowing the facts that could determine the stock's prospects.",zacks.com,https://www.zacks.com/stock/news/2175266/alphabet-inc-googl-is-attracting-investor-attention-here-is-what-you-should-know,https://images.financialmodelingprep.com/news/alphabet-inc-googl-is-attracting-investor-attention-here-is-20231031.jpg
GOOGL,2023-10-24,2023-10-10,2023-11-07,GOOGL,,2023-10-31 12:44:55,2023-10-31T12:44:55-04:00,2023-10-31,Google DeepMind boss hits back at Meta AI chief over ‘fearmongering' claim,"Demis Hassabis said that Google DeepMind wasn't trying to achieve ""regulatory capture"" when it came to the discussion on how best to approach AI.",cnbc.com,https://www.cnbc.com/2023/10/31/google-deepmind-boss-hits-back-at-meta-ai-chief-over-fearmongering-claim.html,https://images.financialmodelingprep.com/news/google-deepmind-boss-hits-back-at-meta-ai-chief-20231031.jpg
GOOGL,2023-10-24,2023-10-10,2023-11-07,GOOGL,,2023-10-31 12:53:15,2023-10-31T12:53:15-04:00,2023-10-31,Google Stock Upgrade: Don't Miss The Bigger Picture,"Google's stock has fallen by around 13% since its last earnings report, but investors are missing the bigger picture. Google has two main competitive advantages to help it thrive in the era of generative AI - a rich data treasure trove and a multi-service platform. Nexus believes that the current valuation of Google stock is attractive and upgrades it to a 'buy'.",seekingalpha.com,https://seekingalpha.com/article/4645427-google-stock-upgrade-dont-miss-the-bigger-picture,https://images.financialmodelingprep.com/news/google-stock-upgrade-dont-miss-the-bigger-picture-20231031.jpg
GOOGL,2023-10-24,2023-10-10,2023-11-07,GOOGL,,2023-10-31 17:02:07,2023-10-31T17:02:07-04:00,2023-10-31,Google and Match Group reach settlement in app store antitrust case,"Google and Match announced today they've reached a settlement in the antitrust battle Match waged against the tech giant, even as its court case continues with Fortnite maker Epic Games. As part of the settlement agreement, Match Group — which owns Tinder, Hinge, OKCupid, Match.",techcrunch.com,https://techcrunch.com/2023/10/31/google-and-match-group-reach-settlement-in-app-store-antitrust-case/,https://images.financialmodelingprep.com/news/google-and-match-group-reach-settlement-in-app-store-20231031.jpg
GOOGL,2023-10-24,2023-10-10,2023-11-07,GOOGL,,2023-10-31 17:03:26,2023-10-31T17:03:26-04:00,2023-10-31,It's Time To Consider Buying Google,"Alphabet Inc., aka Google, recently reported better-than-expected earnings results. However, its stock was punished because cloud revenue grew slightly less than expected. Google's recent 15% stock correction presents a buying opportunity, as the company's earnings and profitability potential remain strong.",seekingalpha.com,https://seekingalpha.com/article/4645567-its-time-to-consider-buying-google,https://images.financialmodelingprep.com/news/its-time-to-consider-buying-google-20231031.jpg
GOOGL,2023-10-24,2023-10-10,2023-11-07,GOOGL,,2023-11-01 05:20:00,2023-11-01T05:20:00-04:00,2023-11-01,What Meta Platforms' and Google's Results Mean for Roku and The Trade Desk,"Meta Platforms and Alphabet reported financial results last week. In each case, growth was better than expected, suggesting the digital advertising market may be mounting a recovery.",fool.com,https://www.fool.com/investing/2023/11/01/meta-platforms-alphabet-results-roku-ttd-stock/,https://images.financialmodelingprep.com/news/what-meta-platforms-and-googles-results-mean-for-roku-20231101.jpg
GOOGL,2023-10-24,2023-10-10,2023-11-07,GOOGL,,2023-11-01 07:09:24,2023-11-01T07:09:24-04:00,2023-11-01,Skip the Cloud Noise. The Reason GOOG Stock Is a Screaming Buy Now.,"You wouldn't know it from the many negative headlines about the lower-than-expected revenue of Alphabet's (NASDAQ: GOOG , NASDAQ: GOOGL ) Google Cloud business last quarter, but advertising accounts for most of the firm's revenue. And, in line with my previous predictions, the growth of the company's advertising revenue meaningfully accelerated last quarter as fears about a recession in the U.S. considerably eased.",investorplace.com,https://investorplace.com/2023/11/skip-the-cloud-noise-the-reason-goog-stock-is-a-screaming-buy-now/,https://images.financialmodelingprep.com/news/skip-the-cloud-noise-the-reason-goog-stock-is-20231101.png
GOOGL,2023-10-24,2023-10-10,2023-11-07,GOOGL,,2023-11-01 07:15:00,2023-11-01T07:15:00-04:00,2023-11-01,Here's Why I'm Buying the Dip On Alphabet's Stock Hand Over Fist,Google Cloud's revenue growth slowed in Q3. Other business areas saw accelerating growth.,fool.com,https://www.fool.com/investing/2023/11/01/heres-why-im-buying-the-dip-on-alphabets-stock-han/,https://images.financialmodelingprep.com/news/heres-why-im-buying-the-dip-on-alphabets-stock-20231101.jpg
GOOGL,2023-10-24,2023-10-10,2023-11-07,GOOGL,,2023-11-01 10:20:00,2023-11-01T10:20:00-04:00,2023-11-01,This one stock could potentially undo the 2023 rebound if it falls another 10% as one analyst expects,Can the S&P 500 index and Nasdaq Composite hold on to their 2023 gains if Nvidia Corp. falls? It's a question that's cropping up more and more these days.,marketwatch.com,https://www.marketwatch.com/story/this-one-stock-could-potentially-undo-the-2023-rebound-if-it-falls-another-10-as-one-analyst-expects-19cda4c9,https://images.financialmodelingprep.com/news/this-one-stock-could-potentially-undo-the-2023-rebound-20231101.jpg
GOOGL,2023-10-24,2023-10-10,2023-11-07,GOOGL,,2023-11-01 10:40:12,2023-11-01T10:40:12-04:00,2023-11-01,"Google: Advertising Revenue Starts To Normalize, Initiates With 'Buy'",Alphabet experienced strong revenue growth during the pandemic but has started to normalize in the post-pandemic era. The total advertising business represents a significant portion of Alphabet's revenue and has shown growth during the pandemic. Alphabet's cloud business accounts for approximately 10% of their revenue and is expected to continue growing rapidly in the future.,seekingalpha.com,https://seekingalpha.com/article/4645818-google-alphabet-advertising-revenue-starts-to-normalize-initiates-with-buy,https://images.financialmodelingprep.com/news/google-advertising-revenue-starts-to-normalize-initiates-with-buy-20231101.jpg
GOOGL,2023-10-24,2023-10-10,2023-11-07,GOOGL,,2023-11-01 11:00:28,2023-11-01T11:00:28-04:00,2023-11-01,Google Aims New Shopping Tools at Boosting Small Business Sales,"People want to make conscious choices and contribute to the success of local and independent enterprises. This inclination to “shop small” is driven by various factors, including a desire to nurture the local economy, promote unique and artisanal products, and build a stronger sense of community.",pymnts.com,https://www.pymnts.com/news/retail/2023/google-aims-new-shopping-tools-at-boosting-small-business-sales/?utm_source=snapi,https://images.financialmodelingprep.com/news/google-aims-new-shopping-tools-at-boosting-small-business-20231101.jpg
GOOGL,2023-10-24,2023-10-10,2023-11-07,GOOGL,,2023-11-01 11:24:05,2023-11-01T11:24:05-04:00,2023-11-01,Google trims Bay Area jobs at offices it had leased a few years ago,Google has revealed plans to trim dozens of jobs in the Bay Area in a fresh round of job cuts—but these most recent reductions represent a tiny fraction of the layoffs the tech titan had disclosed early this year.,techxplore.com,https://techxplore.com/news/2023-11-google-trims-bay-area-jobs.html,https://images.financialmodelingprep.com/news/google-trims-bay-area-jobs-at-offices-it-had-20231101.jpg
GOOGL,2023-10-24,2023-10-10,2023-11-07,GOOGL,,2023-11-01 11:30:01,2023-11-01T11:30:01-04:00,2023-11-01,"Google's 2019 'Code Yellow' blurred line between search, ads","The former head of search at Alphabet Inc.""s Google told colleagues in February 2019 that his team was ""getting too involved with ads for the good of the product and company,"" according to emails shown at the Justice Department's landmark antitrust trial against the search giant.",techxplore.com,https://techxplore.com/news/2023-11-google-code-yellow-blurred-line.html,https://images.financialmodelingprep.com/news/googles-2019-code-yellow-blurred-line-between-search-ads-20231101.jpg
GOOGL,2023-10-24,2023-10-10,2023-11-07,GOOGL,,2023-11-01 12:02:11,2023-11-01T12:02:11-04:00,2023-11-01,EPS Season: Unveiling the 3 Biggest Winners,Better-than-expected earnings reports often spark up trends. Stock Strategist Andrew Rocco unveils 3 of the season's biggest winners.,zacks.com,https://www.zacks.com/commentary/2176495/eps-season-unveiling-the-3-biggest-winners,https://images.financialmodelingprep.com/news/eps-season-unveiling-the-3-biggest-winners-20231101.jpg
GOOGL,2023-10-24,2023-10-10,2023-11-07,GOOGL,,2023-11-01 15:02:07,2023-11-01T15:02:07-04:00,2023-11-01,Earnings Season Top Performer: A Must Own Cloud Solutions Stock,"Arista Networks  ANET  reported earnings on Monday, October 30, and blew out earnings expectations, sending the stock to new all-time highs.",zacks.com,https://www.zacks.com/commentary/2176681/earnings-season-top-performer-a-must-own-cloud-solutions-stock,https://images.financialmodelingprep.com/news/earnings-season-top-performer-a-must-own-cloud-solutions-20231101.jpg
GOOGL,2023-10-24,2023-10-10,2023-11-07,GOOGL,,2023-11-01 15:49:24,2023-11-01T15:49:24-04:00,2023-11-01,Google Begins Rollout of AI Tools for Creating Product Imagery,"Google has begun the rollout of Product Studio, a set of artificial intelligence (AI) tools that help merchants create and manage product imagery. The tools, whose upcoming launch was initially announced in May, began rolling out Wednesday (Nov.",pymnts.com,https://www.pymnts.com/news/artificial-intelligence/2023/google-begins-rollout-ai-tools-creating-product-imagery/?utm_source=snapi,https://images.financialmodelingprep.com/news/google-begins-rollout-of-ai-tools-for-creating-product-20231101.jpg
GOOGL,2023-10-24,2023-10-10,2023-11-07,GOOGL,,2023-11-01 18:02:04,2023-11-01T18:02:04-04:00,2023-11-01,Ignore the Noise and Buy These 2 Stocks for Long-Term Wealth Building,"In recent weeks volatility in the stock market has increased markedly. With rising geopolitical tensions in the Middle East, interest rates pushing 16-year highs and every other economist warning about the impending recession, it is no wonder investors are getting nervous.",zacks.com,https://www.zacks.com/commentary/2176717/ignore-the-noise-and-buy-these-2-stocks-for-long-term-wealth-building,https://images.financialmodelingprep.com/news/ignore-the-noise-and-buy-these-2-stocks-for-20231101.jpg
GOOGL,2023-10-24,2023-10-10,2023-11-07,GOOGL,,2023-11-02 06:20:00,2023-11-02T06:20:00-04:00,2023-11-02,Has Microsoft Proved It's a Better Growth Stock Than Alphabet?,"Microsoft has a broader business than Alphabet with multiple product categories generating more than 20% growth last quarter. Alphabet, however, could have the better assets in Google Search and YouTube.",fool.com,https://www.fool.com/investing/2023/11/02/has-microsoft-proved-its-a-better-growth-stock-tha/,https://images.financialmodelingprep.com/news/has-microsoft-proved-its-a-better-growth-stock-than-20231102.jpg
GOOGL,2023-10-24,2023-10-10,2023-11-07,GOOGL,,2023-11-02 06:25:00,2023-11-02T06:25:00-04:00,2023-11-02,Roadkill Alert: Why GOOG Stock Is About to Get Run Over,"For now, Google and YouTube parent company Alphabet (NASDAQ: GOOG , NASDAQ: GOOGL ) has a dominant position in the search-engine market. However, nowadays there are other companies, like Microsoft (NASDAQ: MSFT ), which could use artificial intelligence technology to steal Alphabet's market share.",investorplace.com,https://investorplace.com/2023/11/roadkill-alert-why-goog-stock-is-about-to-get-run-over/,https://images.financialmodelingprep.com/news/roadkill-alert-why-goog-stock-is-about-to-get-20231102.jpg
