ticker,event_date,window_start,window_end,symbol,symbols,publishedDate,publishedDateET,date_et,title,text,site,url,image
TSLA,2024-10-23,2024-10-16,2024-11-06,TSLA,,2024-11-04 10:58:03,2024-11-04T10:58:03-05:00,2024-11-04,Tesla Stock: Why I Remain A Buyer,"Tesla, Inc.'s automotive sales are resilient vs. amidst a challenging backdrop in the industry. The rollout of affordable models in H1 FY25 are a key volumes catalyst. Margin performance is at local highs but is likely to revert a bit, driven by fluctuations in the nature of energy business projects and lower average selling price pressures. Valuations are at a premium, driven by full self-drive and Optimus expectations. I believe this is acceptable, contingent on the timelines of robotaxis and FSD rollout being intact in FY25.",seekingalpha.com,https://seekingalpha.com/article/4732731-tesla-stock-why-i-remain-a-buyer,https://images.financialmodelingprep.com/news/tesla-stock-why-i-remain-a-buyer-20241104.jpg
TSLA,2024-10-23,2024-10-16,2024-11-06,TSLA,,2024-11-04 11:24:40,2024-11-04T11:24:40-05:00,2024-11-04,Tesla Reigns Supreme In Texas EV Market As Drivers Weigh Environment Vs. Savings,"Tesla Inc TSLA stands tall as the go-to electric vehicle (EV) choice in Texas, with 48.7% of respondents naming it their primary vehicle—significantly higher than the national average of 37.6%.",benzinga.com,https://www.benzinga.com/markets/esg/24/11/41718893/tesla-reigns-supreme-in-texas-ev-market-as-drivers-weigh-environment-vs-savings,https://images.financialmodelingprep.com/news/tesla-reigns-supreme-in-texas-ev-market-as-drivers-20241104.jpg
TSLA,2024-10-23,2024-10-16,2024-11-06,TSLA,,2024-11-04 11:50:48,2024-11-04T11:50:48-05:00,2024-11-04,Wall Street analyst's Tesla stock prediction if Trump wins,Tesla (NASDAQ: TSLA) is among the major Wall Street names under the lens of investors and analysts ahead of the United States presidential election.,finbold.com,https://finbold.com/wall-street-analysts-tesla-stock-prediction-if-trump-wins/,https://images.financialmodelingprep.com/news/wall-street-analysts-tesla-stock-prediction-if-trump-wins-20241104.jpg
TSLA,2024-10-23,2024-10-16,2024-11-06,TSLA,,2024-11-04 12:00:00,2024-11-04T12:00:00-05:00,2024-11-04,Investing Groups Digest: Mag 7 In The Market Spotlight,"Seeking Alpha's Investing Group leaders presented their earnings assessments from Mag 7 tech giants. Are investors missing hidden opportunities with BDCs, CEFs, mREITs, and preferreds? The case is made for breaking up Realty Income.",seekingalpha.com,https://seekingalpha.com/article/4732434-investing-groups-digest-mag-7-in-the-market-spotlight,https://images.financialmodelingprep.com/news/investing-groups-digest-mag-7-in-the-market-spotlight-20241104.jpg
TSLA,2024-10-23,2024-10-16,2024-11-06,TSLA,,2024-11-04 13:21:27,2024-11-04T13:21:27-05:00,2024-11-04,Tesla Stock Extends Losing Streak Ahead of Election Day,Tesla stock is headed toward its sixth straight loss Monday and Wall Street is staying on the sidelines. Here's why.,kiplinger.com,https://www.kiplinger.com/investing/stocks/tesla-tsla-stock-extends-losing-streak-ahead-of-election-day,https://images.financialmodelingprep.com/news/tesla-stock-extends-losing-streak-ahead-of-election-day-20241104.jpg
TSLA,2024-10-23,2024-10-16,2024-11-06,TSLA,,2024-11-04 13:46:00,2024-11-04T13:46:00-05:00,2024-11-04,Options Trades in TSLA and BA,"Tesla (TSLA) is driving down the wrong path in its stock price, while Boeing (BA) continues to suffer over uncertainty in its union's contract negotiations. Kevin Hincks looks into example options trading strategies for both companies.",youtube.com,https://www.youtube.com/watch?v=YNEjBR6kBkA,https://images.financialmodelingprep.com/news/options-trades-in-tsla-and-ba-20241104.jpg
TSLA,2024-10-23,2024-10-16,2024-11-06,TSLA,,2024-11-04 13:50:33,2024-11-04T13:50:33-05:00,2024-11-04,Jeff Bezos and OpenAI invest in robot startup Physical Intelligence at $2.4 billion valuation,"Physical Intelligence, a robot startup based in San Francisco, has raised $400 million at a $2.4 billion post-money valuation, the company confirmed Monday to CNBC. Investors included Amazon founder Jeff Bezos, OpenAI, Thrive Capital and Lux Capital.",cnbc.com,https://www.cnbc.com/2024/11/04/jeff-bezos-and-openai-invest-in-robot-startup-physical-intelligence.html,https://images.financialmodelingprep.com/news/jeff-bezos-and-openai-invest-in-robot-startup-physical-20241104.jpg
TSLA,2024-10-23,2024-10-16,2024-11-06,TSLA,,2024-11-04 15:26:21,2024-11-04T15:26:21-05:00,2024-11-04,"3 Momentum Stocks About to Surge (TSLA, NOW, ANET)",One of my favorite ways to pick winning stocks by combining two of the most effective methods out there; the Zacks Rank and momentum. The Zacks Rank is a highly effective quantitative strategy that aggregates all analyst ratings of a stock and converts them into a simple ranking.,zacks.com,https://www.zacks.com/commentary/2363734/3-momentum-stocks-about-to-surge-tsla-now-anet?cid=CS-STOCKNEWSAPI-FT-investment_ideas-2363734,https://images.financialmodelingprep.com/news/3-momentum-stocks-about-to-surge-tsla-now-anet-20241104.jpg
TSLA,2024-10-23,2024-10-16,2024-11-06,TSLA,,2024-11-04 16:15:00,2024-11-04T16:15:00-05:00,2024-11-04,"SHAREHOLDER ALERT: Pomerantz Law Firm Investigates Claims On Behalf of Investors of Tesla, Inc. - TSLA","NEW YORK, NY / ACCESSWIRE / November 4, 2024 / Pomerantz LLP is investigating claims on behalf of investors of Tesla, Inc. (""Tesla"" or the ""Company"") (NASDAQ:TSLA). Such investors are advised to contact Danielle Peyton at newaction@pomlaw.com or 646-581-9980, ext.",accesswire.com,https://www.accesswire.com/938974/shareholder-alert-pomerantz-law-firm-investigates-claims-on-behalf-of-investors-of-tesla-inc--tsla,https://images.financialmodelingprep.com/news/shareholder-alert-pomerantz-law-firm-investigates-claims-on-behalf-of-investors-of-tesla-20241104.jpg
TSLA,2024-10-23,2024-10-16,2024-11-06,TSLA,,2024-11-04 18:19:33,2024-11-04T18:19:33-05:00,2024-11-04,Rivian's head of software says the company is not trying to be like Tesla regarding automation,Rivian Chief Software Officer Wassym Bensaid says the future of cars will be hands-free. That doesn't mean Rivian is on a full sprint toward autonomous driving.,businessinsider.com,https://www.businessinsider.com/rivian-autonomous-driving-not-goal-like-tesla-not-wassym-bensaid-2024-11,https://images.financialmodelingprep.com/news/rivians-head-of-software-says-the-company-is-not-20241104.jpg
TSLA,2024-10-23,2024-10-16,2024-11-06,TSLA,,2024-11-04 21:00:00,2024-11-04T21:00:00-05:00,2024-11-04,"Meet Musk's Fixer, the Powerful Executive Reshaping Tesla","Omead Afshar, known for his ability to mind-meld with the CEO, steps into the prominent role as the auto business confronts challenges.",wsj.com,https://www.wsj.com/articles/omead-afshar-elon-musk-fixer-735a8b9a,https://images.financialmodelingprep.com/news/meet-musks-fixer-the-powerful-executive-reshaping-tesla-20241104.jpg
TSLA,2024-10-23,2024-10-16,2024-11-06,TSLA,,2024-11-05 01:51:04,2024-11-05T01:51:04-05:00,2024-11-05,Tesla's China Exposure a Risk But Musk Won't Be 'Useful Idiot': Strategy Risks,"Geopolitical and data analysis firm Strategy Risks says Tesla's heavy exposure to China is a threat to the EV maker, as it tries to navigate an increasingly-adversarial relationship between Washington and Beijing. Despite this, Tesla CEO Elon Musk is unlikely to serve as a ""useful idiot"" for China, even if the billionaire takes a role under a potential second Trump administration, says Strategy Risks CEO Isaac Stone Fish as he speaks with Yvonne Man and David Ingles on ""Bloomberg: The China Show.",youtube.com,https://www.youtube.com/watch?v=W9JHIaSON9U,https://images.financialmodelingprep.com/news/teslas-china-exposure-a-risk-but-musk-wont-be-20241105.jpg
TSLA,2024-10-23,2024-10-16,2024-11-06,TSLA,,2024-11-05 04:48:14,2024-11-05T04:48:14-05:00,2024-11-05,Tesla increases wages at German gigafactory by 4%,"Tesla has raised the wages of all employees at its gigafactory outside Berlin by 4% since the start of November, the U.S. carmaker said on Tuesday.",reuters.com,https://www.reuters.com/business/autos-transportation/tesla-increases-wages-german-gigafactory-by-4-2024-11-05/,https://images.financialmodelingprep.com/news/tesla-increases-wages-at-german-gigafactory-by-4-20241105.jpg
TSLA,2024-10-23,2024-10-16,2024-11-06,TSLA,,2024-11-05 05:16:00,2024-11-05T05:16:00-05:00,2024-11-05,"Tesla Stock Is Up as Investors Weigh Pros and Cons of Trump, Harris Administrations","Who is better for Tesla stock, Trump or Harris? It isn't an easy question for investors to answer.",barrons.com,https://www.barrons.com/articles/tesla-stock-trump-harris-election-4c294534,https://images.financialmodelingprep.com/news/tesla-stock-is-up-as-investors-weigh-pros-and-20241105.jpg
TSLA,2024-10-23,2024-10-16,2024-11-06,TSLA,,2024-11-05 06:08:35,2024-11-05T06:08:35-05:00,2024-11-05,"Musk now says it's 'pointless' to build a $25,000 Tesla for human drivers","When Reuters reported in April that Tesla had scrapped plans for a long-promised, next-generation $25,000 electric vehicle, the automaker's stock plunged. Chief Executive Elon Musk rushed to respond on X, his social-media network.",reuters.com,https://www.reuters.com/business/autos-transportation/musk-now-says-its-pointless-build-25000-tesla-human-drivers-2024-11-05/,https://images.financialmodelingprep.com/news/musk-now-says-its-pointless-to-build-a-25000-20241105.jpg
TSLA,2024-10-23,2024-10-16,2024-11-06,TSLA,,2024-11-05 07:08:09,2024-11-05T07:08:09-05:00,2024-11-05,AI sets date when Tesla (TSLA) stock will hit $300,"After reporting impressive results for Q3 2024, Tesla (NASDAQ: TSLA) was on track to claim the $300 mark, but the share price has since retraced.",finbold.com,https://finbold.com/ai-sets-date-when-tesla-tsla-stock-will-hit-300/,https://images.financialmodelingprep.com/news/ai-sets-date-when-tesla-tsla-stock-will-hit-20241105.jpg
TSLA,2024-10-23,2024-10-16,2024-11-06,TSLA,,2024-11-05 07:35:01,2024-11-05T07:35:01-05:00,2024-11-05,Tesla criticizes Biden's plan to ban Chinese tech in cars,"Tesla has criticized the US government's plans to ban Chinese software from US cars. In a regulatory filing, the automaker said the new rules would add ""unneeded regulatory burdens.",businessinsider.com,https://www.businessinsider.com/tesla-criticizes-biden-plan-to-ban-chinese-tech-in-cars-2024-11,https://images.financialmodelingprep.com/news/tesla-criticizes-bidens-plan-to-ban-chinese-tech-in-20241105.jpg
TSLA,2024-10-23,2024-10-16,2024-11-06,TSLA,,2024-11-05 08:00:00,2024-11-05T08:00:00-05:00,2024-11-05,"Should Netflix Replace Tesla in the ""Magnificent Seven""?",These two industry-leading enterprises have disrupted their end markets.,fool.com,https://www.fool.com/investing/2024/11/05/should-netflix-replace-tesla-magnificent-seven/,https://images.financialmodelingprep.com/news/should-netflix-replace-tesla-in-the-magnificent-seven-20241105.jpg
TSLA,2024-10-23,2024-10-16,2024-11-06,TSLA,,2024-11-05 10:00:00,2024-11-05T10:00:00-05:00,2024-11-05,Are Tech Valuations Stretched to The Breaking Point? The Most Likely Answer May Surprise You,Tech giants' seemingly high valuations may actually understate their true worth as artificial intelligence reshapes the global economy.,fool.com,https://www.fool.com/investing/2024/11/05/are-tech-valuations-stretched-to-the-breaking-poin/,https://images.financialmodelingprep.com/news/are-tech-valuations-stretched-to-the-breaking-point-the-20241105.jpg
TSLA,2024-10-23,2024-10-16,2024-11-06,TSLA,,2024-11-05 10:14:11,2024-11-05T10:14:11-05:00,2024-11-05,These 2 Big Players Are Set to Compete With Elon Musk's Starlink,"Along with Tesla NASDAQ: TSLA, billionaire Elon Musk also founded the revolutionary space company SpaceX. The firm made headlines several weeks ago after it was successfully able to recover a booster that sent a rocket into space.",marketbeat.com,https://www.marketbeat.com/stock-ideas/these-2-big-players-are-set-to-compete-with-elon-musks-starlink/,https://images.financialmodelingprep.com/news/these-2-big-players-are-set-to-compete-with-20241105.jpg
TSLA,2024-10-23,2024-10-16,2024-11-06,TSLA,,2024-11-05 12:00:00,2024-11-05T12:00:00-05:00,2024-11-05,Unplugged Performance Debuts Nation's First Tesla Model S Plaid Police Vehicle at SEMA 2024,"LAS VEGAS, Nov. 05, 2024 (GLOBE NEWSWIRE) -- Unplugged Performance, through its UP.FIT division, is set to make a groundbreaking debut at SEMA 2024 by unveiling the nation's first Tesla Model S Plaid specifically designed for law enforcement applications. The “UP.FIT Tesla Model S Plaid Pursuit” is the latest innovation in Unplugged Performance's lineup of specialized vehicles, tailored to meet the high-performance needs of first responders.",globenewswire.com,https://www.globenewswire.com/news-release/2024/11/05/2975096/0/en/Unplugged-Performance-Debuts-Nation-s-First-Tesla-Model-S-Plaid-Police-Vehicle-at-SEMA-2024.html,https://images.financialmodelingprep.com/news/unplugged-performance-debuts-nations-first-tesla-model-s-plaid-20241105.jpg
TSLA,2024-10-23,2024-10-16,2024-11-06,TSLA,,2024-11-05 15:23:31,2024-11-05T15:23:31-05:00,2024-11-05,"3-Stock Lunch: Chevron, Apple & Tesla","Michael Farr, Hightower Advisors chief market strategist, joins 'Power Lunch' to discuss stock plays for three stocks.",youtube.com,https://www.youtube.com/watch?v=WjOsWH0oL6A,https://images.financialmodelingprep.com/news/3stock-lunch-chevron-apple-tesla-20241105.jpg
TSLA,2024-10-23,2024-10-16,2024-11-06,TSLA,,2024-11-05 16:43:00,2024-11-05T16:43:00-05:00,2024-11-05,"Nvidia, Tesla, and the Other 8 Top Stocks in the S&P 500 Are Strikingly Expensive. Be Nervous.","The valuations depend in part on the stocks' ability to weather any near-term waves of inflation, rising bond yields, and other big-picture shifts.",barrons.com,https://www.barrons.com/articles/stocks-valuations-high-sp-500-d30c6e48,https://images.financialmodelingprep.com/news/nvidia-tesla-and-the-other-8-top-stocks-in-20241105.jpg
TSLA,2024-10-23,2024-10-16,2024-11-06,TSLA,,2024-11-05 23:48:51,2024-11-05T23:48:51-05:00,2024-11-05,Tesla gains more than 9% in extended trading as election data rolls in,Tesla shares rallied in extended trading Tuesday night. The electric vehicle maker is regarded a beneficiary of the so-called Trump trade.,cnbc.com,https://www.cnbc.com/2024/11/05/tesla-gains-more-than-9percent-in-extended-trading-as-election-data-rolls-in.html,https://images.financialmodelingprep.com/news/tesla-gains-more-than-9-in-extended-trading-as-20241105.jpg
TSLA,2024-10-23,2024-10-16,2024-11-06,TSLA,,2024-11-06 02:19:56,2024-11-06T02:19:56-05:00,2024-11-06,Tesla pops 14% in Frankfurt as early US vote results lift 'Trump trades',"Tesla's Frankfurt-listed shares rallied over 14% at the open on Wednesday, as investors were increasingly pricing in a win for Republican Donald Trump in the U.S. presidential race against Democratic Vice President Kamala Harris.",reuters.com,https://www.reuters.com/business/autos-transportation/tesla-pops-14-frankfurt-early-us-vote-results-lift-trump-trades-2024-11-06/,https://images.financialmodelingprep.com/news/tesla-pops-14-in-frankfurt-as-early-us-vote-20241106.jpg
TSLA,2024-10-23,2024-10-16,2024-11-06,TSLA,,2024-11-06 04:09:48,2024-11-06T04:09:48-05:00,2024-11-06,"A Trump win could add $40–$50 to Tesla's stock price, says Wedbush's Dan Ives","Dan Ives, managing director at Wedbush, discusses how the Trump administration could potentially benefit Tesla.",youtube.com,https://www.youtube.com/watch?v=sGAiIXC89OA,https://images.financialmodelingprep.com/news/a-trump-win-could-add-4050-to-teslas-stock-20241106.jpg
TSLA,2024-10-23,2024-10-16,2024-11-06,TSLA,,2024-11-06 04:31:00,2024-11-06T04:31:00-05:00,2024-11-06,Tesla Stock Soars 12% After Trump Calls Musk a 'Genius' in Election Night Speech,"Trump made a speech declaring victory early Wednesday morning, although the Associated Press still hasn't called the race for either candidate.",barrons.com,https://www.barrons.com/articles/tesla-stock-musk-trump-election-rivian-1086ba9f,https://images.financialmodelingprep.com/news/tesla-stock-soars-12-after-trump-calls-musk-a-20241106.jpg
TSLA,2024-10-23,2024-10-16,2024-11-06,TSLA,,2024-11-06 04:46:36,2024-11-06T04:46:36-05:00,2024-11-06,"Trump's media business, Tesla surge as former president nears second term","Shares of Tesla , Donald Trump's media business and domestic-focused small-cap companies surged on Wednesday in anticipation of a win for the former president even though some key states in the U.S. election are yet to post results.",reuters.com,https://www.reuters.com/markets/us/trumps-media-business-tesla-surge-former-president-nears-second-term-2024-11-06/,https://images.financialmodelingprep.com/news/trumps-media-business-tesla-surge-as-former-president-nears-20241106.jpg
TSLA,2024-10-23,2024-10-16,2024-11-06,TSLA,,2024-11-06 06:12:51,2024-11-06T06:12:51-05:00,2024-11-06,Tesla value to add $110bn as Musk seen reaping rewards of Trump win,"Tesla Inc (NASDAQ:TSLA) shares headed over 14% higher in pre-market trading on Wednesday following confirmation of Donald Trump's win in the US presidential election. Elon Musk had been a prominent vocal supporter of Trump throughout the former president's election campaign, prompting speculation his electric vehicle firm will now reap the rewards.",proactiveinvestors.co.uk,https://www.proactiveinvestors.co.uk/companies/news/1059983,https://images.financialmodelingprep.com/news/tesla-value-to-add-110bn-as-musk-seen-reaping-20241106.jpg
TSLA,2024-10-23,2024-10-16,2024-11-06,TSLA,,2024-11-06 06:32:53,2024-11-06T06:32:53-05:00,2024-11-06,Tesla and US banks surge as Trump returns to White House,"Shares in Trump Media & Technology Group Corp (NASDAQ:DJT), Tesla Inc and most big US banks surged as US election results pointed to Donald Trump returning to the White House for a second term as president.  Trump was declared victor, the Associated Press reported on Wednesday morning, as the Republican party candidate reached the 270-electoral college vote threshold.",proactiveinvestors.com,https://www.proactiveinvestors.com/companies/news/1059985,https://images.financialmodelingprep.com/news/tesla-and-us-banks-surge-as-trump-returns-to-20241106.jpg
TSLA,2024-10-23,2024-10-16,2024-11-06,TSLA,,2024-11-06 06:46:28,2024-11-06T06:46:28-05:00,2024-11-06,"Dow, Nasdaq Futures Race Higher As Trump Wins White House: DJT, Tesla Shares Surge — Veteran Investor Predicts US Economy Could 'Take Off'",U.S. stocks could witness a strong opening on Wednesday after former President Donald Trump emerged victorious after a long-drawn battle with Joe Biden and Kamala Harris.,benzinga.com,https://www.benzinga.com/news/earnings/24/11/41769412/dow-nasdaq-futures-race-higher-as-trump-wins-white-house-djt-tesla-shares-surge-veteran-investor-pr,https://images.financialmodelingprep.com/news/dow-nasdaq-futures-race-higher-as-trump-wins-white-20241106.jpg
TSLA,2024-10-23,2024-10-16,2024-11-06,TSLA,,2024-11-06 07:05:01,2024-11-06T07:05:01-05:00,2024-11-06,Wall Street analyst revises Tesla stock price after Trump's win,"With Donald Trump reclaiming the White House for a second term, a Wall Street analyst has noted that the win could be bullish for Tesla (NASDAQ: TSLA).",finbold.com,https://finbold.com/wall-street-analyst-revises-tesla-stock-price-after-trumps-win/,https://images.financialmodelingprep.com/news/wall-street-analyst-revises-tesla-stock-price-after-trumps-20241106.jpg
TSLA,2024-10-23,2024-10-16,2024-11-06,TSLA,,2024-11-06 07:23:00,2024-11-06T07:23:00-05:00,2024-11-06,Tesla's stock is soaring on Trump's win. Here's why Wall Street is so upbeat.,"CEO Elon Musk has close ties to Trump. Plus, Tesla could benefit from potential higher Chinese tariffs, an analyst says.",marketwatch.com,https://www.marketwatch.com/story/teslas-stock-is-soaring-on-trumps-win-heres-why-wall-street-is-so-upbeat-4319d735,https://images.financialmodelingprep.com/news/teslas-stock-is-soaring-on-trumps-win-heres-why-20241106.jpg
TSLA,2024-10-23,2024-10-16,2024-11-06,TSLA,,2024-11-06 07:31:34,2024-11-06T07:31:34-05:00,2024-11-06,"Stock market today: Tesla, DJT, and Bitcoin all surge on Donald Trump's presidential win","Stock market futures are up across the board in premarket trading this morning after Donald Trump was declared the winner of the 2024 presidential election. As of the time of this writing, S&P futures are up 2.3%, Dow futures are up 2.95%, and Nasdaq futures are up 1.76%.",fastcompany.com,https://www.fastcompany.com/91223511/stock-market-today-tesla-djt-bitcoin-rise-donald-trump-presidential-win,https://images.financialmodelingprep.com/news/stock-market-today-tesla-djt-and-bitcoin-all-surge-20241106.jpg
TSLA,2024-10-23,2024-10-16,2024-11-06,TSLA,,2024-11-06 07:35:25,2024-11-06T07:35:25-05:00,2024-11-06,Tesla Shares Soar 12% Toward Record In Premarket Trading As Trump Wins Election,"Shares of Tesla surged by 12% in premarket trading Wednesday morning, sending the company's stock toward a new record after Donald Trump was reelected as president, while analysts signaled a Trump victory would likely benefit Elon Musk's firm.",forbes.com,https://www.forbes.com/sites/tylerroush/2024/11/06/tesla-shares-soar-12-toward-record-in-premarket-trading-as-trump-wins-election/,https://images.financialmodelingprep.com/news/tesla-shares-soar-12-toward-record-in-premarket-trading-20241106.jpg
TSLA,2024-10-23,2024-10-16,2024-11-06,TSLA,,2024-11-06 07:55:03,2024-11-06T07:55:03-05:00,2024-11-06,Tesla and AI to benefit from Trump presidency; EV maker up 3.5% premarket,"Donald Trump's election victory is expected to bring a strategic boost to Tesla Inc (NASDAQ:TSLA), with Wedbush analysts projecting major policy shifts that could favour the electric vehicle (EV) maker. According to the investment bank, Trump's administration is likely to scale back federal EV rebates and tax incentives, which would impact much of the industry.",proactiveinvestors.co.uk,https://www.proactiveinvestors.co.uk/companies/news/1059994,https://images.financialmodelingprep.com/news/tesla-and-ai-to-benefit-from-trump-presidency-ev-20241106.jpg
TSLA,2024-10-23,2024-10-16,2024-11-06,TSLA,,2024-11-06 08:20:46,2024-11-06T08:20:46-05:00,2024-11-06,Tesla Jumps as Musk Seen Winning Under Trump Presidency,Shares of Tesla (TSLA) are jumping as much as 14% in premarket trading Wednesday on investor bets that the electric vehicle (EV) maker run by Elon Musk will be a major beneficiary of Donald Trump's return to the presidency.,investopedia.com,https://www.investopedia.com/tesla-jumps-as-musk-seen-winning-under-trump-presidency-8740434,https://images.financialmodelingprep.com/news/tesla-jumps-as-musk-seen-winning-under-trump-presidency-20241106.jpg
TSLA,2024-10-23,2024-10-16,2024-11-06,TSLA,,2024-11-06 09:23:13,2024-11-06T09:23:13-05:00,2024-11-06,"Live Markets Today: Russell 2000 Up 6%, Nasdaq Jumps After Trump Victory | TSLA, DJT, RIVN",Stock market indexes are jumping massive amounts in premarket trading in reaction to last night's election.,247wallst.com,https://247wallst.com/?p=1450449&preview=true&preview_id=1450449&utm_source=snapi,https://images.financialmodelingprep.com/news/live-markets-today-russell-2000-up-6-nasdaq-jumps-20241106.jpg
TSLA,2024-10-23,2024-10-16,2024-11-06,TSLA,,2024-11-06 09:24:07,2024-11-06T09:24:07-05:00,2024-11-06,Donald Trump's election victory is a 'home run' for Tesla,"Tesla stock surged 12% in premarket trading following Trump's election victory. Elon Musk has been an outspoken supporter of Trump, spending months campaigning for him.",businessinsider.com,https://www.businessinsider.com/donald-trump-election-victory-tesla-shares-elon-musk-ev-president-2024-11,https://images.financialmodelingprep.com/news/donald-trumps-election-victory-is-a-home-run-for-20241106.jpg
TSLA,2024-10-23,2024-10-16,2024-11-06,TSLA,,2024-11-06 09:31:12,2024-11-06T09:31:12-05:00,2024-11-06,ETF Strategies to Consider as Trump Nears Victory,Republican candidate Donald Trump claimed victory in the 2024 US presidential election after Fox News projected that he had defeated his Democratic rival Kamala Harris.,zacks.com,https://www.zacks.com/stock/news/2364988/etf-strategies-to-consider-as-trump-nears-victory?cid=CS-STOCKNEWSAPI-FT-etf_news_and_commentary-2364988,https://images.financialmodelingprep.com/news/etf-strategies-to-consider-as-trump-nears-victory-20241106.jpg
TSLA,2024-10-23,2024-10-16,2024-11-06,TSLA,,2024-11-06 09:32:58,2024-11-06T09:32:58-05:00,2024-11-06,"Tesla Stock $1,000","Donald Trump is heading back to the White House, and Tesla could be one of the biggest winners. Tesla CEO Elon Musk played a pivotal role in Trump's 2024 campaign, making substantial financial contributions, actively campaigning for Trump, and leveraging his social media platform, X, to boost support.",forbes.com,https://www.forbes.com/sites/greatspeculations/2024/11/06/tesla-stock-1000/,https://images.financialmodelingprep.com/news/tesla-stock-1000-20241106.jpg
TSLA,2024-10-23,2024-10-16,2024-11-06,TSLA,,2024-11-06 10:06:58,2024-11-06T10:06:58-05:00,2024-11-06,Tesla's Stock Jumps After Trump's Victory,Investors believe that the electric car company led by Elon Musk will benefit from his support of the president-elect.,nytimes.com,https://www.nytimes.com/2024/11/06/business/tesla-stock-elon-musk-trump.html,https://images.financialmodelingprep.com/news/teslas-stock-jumps-after-trumps-victory-20241106.jpg
