ticker,event_date,window_start,window_end,symbol,symbols,publishedDate,publishedDateET,date_et,title,text,site,url,image
TSLA,2024-10-23,2024-10-16,2024-11-06,TSLA,,2024-10-25 07:47:20,2024-10-25T07:47:20-04:00,2024-10-25,"Nasdaq 100: Robust Tesla Earnings, Sales Forecast Set Stage For Rally","The Nasdaq 100, after reaching record highs, has recently experienced a pullback as analysts revise their earnings expectations.",fxempire.com,https://www.fxempire.com/forecasts/article/nasdaq-100-robust-tesla-earnings-sales-forecast-set-stage-for-rally-1471306,https://images.financialmodelingprep.com/news/nasdaq-100-robust-tesla-earnings-sales-forecast-set-stage-20241025.jpg
TSLA,2024-10-23,2024-10-16,2024-11-06,TSLA,,2024-10-25 07:54:00,2024-10-25T07:54:00-04:00,2024-10-25,Tesla Stock Jumped 22%. What History Says Happens Next.,The EV maker has had big one-day gains before. Here's how that played out.,barrons.com,https://www.barrons.com/articles/tesla-stock-market-today-c99e7ec6,https://images.financialmodelingprep.com/news/tesla-stock-jumped-22-what-history-says-happens-next-20241025.jpg
TSLA,2024-10-23,2024-10-16,2024-11-06,TSLA,,2024-10-25 08:10:18,2024-10-25T08:10:18-04:00,2024-10-25,Tesla earnings are 'hard story to poke holes in': Strategist,"As Tesla (TSLA) shares moved higher after the company's third quarter report, Interactive Brokers chief strategist Steve Sosnick sat down with Julie Hyman and Josh Lipton to discuss the results and how he thinks about the electric vehicle (EV) giant. “Basically, this is a hard story to poke holes in, and you really can't, which is why the stock is up 20%,” Sosnick says, adding that “It was not as much that they beat on their current EPS, which is of course very important, but it's that the guidance was really terrific and they beat in the right ways.",youtube.com,https://www.youtube.com/watch?v=VwC2YUCS1To,https://images.financialmodelingprep.com/news/tesla-earnings-are-hard-story-to-poke-holes-in-20241025.jpg
TSLA,2024-10-23,2024-10-16,2024-11-06,TSLA,,2024-10-25 08:15:01,2024-10-25T08:15:01-04:00,2024-10-25,"Tesla skyrockets on Q3 results, boosting stocks","Tesla (TSLA) was the first member of the Magnificent Seven to report earnings this season, posting mixed results that has sent the stock ripping and roaring by nearly 20% higher. How should investors be looking at the broader tech trade coming off of Tesla's results?",youtube.com,https://www.youtube.com/watch?v=BJeO09PE6GU,https://images.financialmodelingprep.com/news/tesla-skyrockets-on-q3-results-boosting-stocks-20241025.jpg
TSLA,2024-10-23,2024-10-16,2024-11-06,TSLA,,2024-10-25 08:25:13,2024-10-25T08:25:13-04:00,2024-10-25,"Tesla's energy storage business was the highlight of its blowout earnings, and Elon Musk says it's 'growing like wildfire'","Tesla reported blowout earnings this week, but its biggest growth driver wasn't cars or robots. Its energy business grew by over 50% year over year, earning Tesla over $7 billion in revenue so far in 2024.",businessinsider.com,https://www.businessinsider.com/teslas-biggest-growth-business-q3-energy-storage-batteries-2024-10,https://images.financialmodelingprep.com/news/teslas-energy-storage-business-was-the-highlight-of-its-20241025.jpg
TSLA,2024-10-23,2024-10-16,2024-11-06,TSLA,,2024-10-25 08:25:28,2024-10-25T08:25:28-04:00,2024-10-25,Tesla earnings: A revenue breakdown of the EV maker's businesses,Tesla (TSLA) experienced a record-breaking day following a mixed third quarter showing. Yahoo Finance anchor Julie Hyman breaks down Tesla's earnings in today's Chart of the Day.,youtube.com,https://www.youtube.com/watch?v=w7FrNxZ-RoE,https://images.financialmodelingprep.com/news/tesla-earnings-a-revenue-breakdown-of-the-ev-makers-20241025.jpg
TSLA,2024-10-23,2024-10-16,2024-11-06,TSLA,,2024-10-25 09:10:26,2024-10-25T09:10:26-04:00,2024-10-25,Could GM Stock Could Be Better Than Tesla Stock if You're Bullish on EVs and Driverless Tech?,Investors could have a better option with GM at a fraction of the valuation of Tesla.,fool.com,https://www.fool.com/investing/2024/10/25/heres-why-gm-stock-could-be-better-than-tesla-stoc/,https://images.financialmodelingprep.com/news/could-gm-stock-could-be-better-than-tesla-stock-20241025.jpg
TSLA,2024-10-23,2024-10-16,2024-11-06,TSLA,,2024-10-25 09:18:54,2024-10-25T09:18:54-04:00,2024-10-25,Tesla Stock Soars Following Surprisingly Spectacular Financial Results,"It was hard to find a misstep in the company's latest quarter, and the stock price reaction reflects those realities.",fool.com,https://www.fool.com/investing/2024/10/25/tesla-stock-soars-following-surprisingly-spectacul/,https://images.financialmodelingprep.com/news/tesla-stock-soars-following-surprisingly-spectacular-financial-results-20241025.jpg
TSLA,2024-10-23,2024-10-16,2024-11-06,TSLA,,2024-10-25 10:31:40,2024-10-25T10:31:40-04:00,2024-10-25,Nasdaq Hits All-Time High—First Since July As Tesla Stock Leads Tech Rally,"The Nasdaq Composite jumped to an all-time high Friday, a first for the tech-heavy stock index in more than three months as the group shook off tailwinds such as rising bond yields and enjoyed a boost from Tesla's share price.",forbes.com,https://www.forbes.com/sites/dereksaul/2024/10/25/nasdaq-hits-all-time-high-first-since-july-as-tesla-stock-leads-tech-rally/,https://images.financialmodelingprep.com/news/nasdaq-hits-alltime-highfirst-since-july-as-tesla-stock-20241025.jpg
TSLA,2024-10-23,2024-10-16,2024-11-06,TSLA,,2024-10-25 10:54:00,2024-10-25T10:54:00-04:00,2024-10-25,"Cathie Wood's ETFs sell Tesla's stock, after another earnings-related surge","Cathie Wood's ETFs used Tesla's blowout earnings report to trim their stakes, just like they did in July after blowout deliveries data",marketwatch.com,https://www.marketwatch.com/story/cathie-woods-etfs-sell-teslas-stock-after-another-earnings-related-surge-ea456f67,https://images.financialmodelingprep.com/news/cathie-woods-etfs-sell-teslas-stock-after-another-earningsrelated-20241025.jpg
TSLA,2024-10-23,2024-10-16,2024-11-06,TSLA,,2024-10-25 10:59:53,2024-10-25T10:59:53-04:00,2024-10-25,Top 3 most shorted stocks in the S&P 500 Index,"The market might be in a bull run at the moment, there's a lot of volatility present — in 2024, short sellers have managed to secure record profits, even off of notable winners such as Nvidia (NASDAQ: NVDA) and Tesla (NASDAQ: TSLA), as evidenced by the record-breaking weekly profit seen in late April.",finbold.com,https://finbold.com/top-3-most-shorted-stocks-in-the-sp-500-index/,https://images.financialmodelingprep.com/news/top-3-most-shorted-stocks-in-the-sp-500-20241025.jpg
TSLA,2024-10-23,2024-10-16,2024-11-06,TSLA,,2024-10-25 11:00:00,2024-10-25T11:00:00-04:00,2024-10-25,"SHAREHOLDER ALERT: Pomerantz Law Firm Investigates Claims On Behalf of Investors of Tesla, Inc. - TSLA","NEW YORK , Oct. 25, 2024 /PRNewswire/ -- Pomerantz LLP is investigating claims on behalf of investors of  Tesla, Inc. (""Tesla"" or the ""Company"") (NASDAQ: TSLA). Such investors are advised to contact Danielle Peyton at newaction@pomlaw.com or 646-581-9980, ext.",prnewswire.com,https://www.prnewswire.com/news-releases/shareholder-alert-pomerantz-law-firm-investigates-claims-on-behalf-of-investors-of-tesla-inc---tsla-302286718.html,https://images.financialmodelingprep.com/news/shareholder-alert-pomerantz-law-firm-investigates-claims-on-behalf-of-investors-of-tesla-20241025.jpg
TSLA,2024-10-23,2024-10-16,2024-11-06,TSLA,,2024-10-25 11:01:10,2024-10-25T11:01:10-04:00,2024-10-25,Tesla Records its Best Day in 11 Years: 5 ETF Winners,"Tesla has its best day in 11 years, adding $150 billion to its market valuation.",zacks.com,https://www.zacks.com/stock/news/2357825/tesla-records-its-best-day-in-11-years-5-etf-winners?cid=CS-STOCKNEWSAPI-FT-etf_news_and_commentary-2357825,https://images.financialmodelingprep.com/news/tesla-records-its-best-day-in-11-years-5-20241025.jpg
TSLA,2024-10-23,2024-10-16,2024-11-06,TSLA,,2024-10-25 11:13:26,2024-10-25T11:13:26-04:00,2024-10-25,TSLA eyes $380 as Tesla's Q3 earnings erase Robotaxi setback,"Tesla Inc. (NASDAQ: TSLA) saw its stock surge nearly 20% in a single session following its Q3 earnings report, which surpassed Wall Street expectations and reignited investor confidence after recent concerns about the company's growth trajectory.",finbold.com,https://finbold.com/tsla-eyes-380-as-teslas-q3-earnings-erase-robotaxi-setback/,https://images.financialmodelingprep.com/news/tsla-eyes-380-as-teslas-q3-earnings-erase-robotaxi-20241025.jpg
TSLA,2024-10-23,2024-10-16,2024-11-06,TSLA,,2024-10-25 11:16:04,2024-10-25T11:16:04-04:00,2024-10-25,"Tesla's Stock Taps the Brakes, But It's Still Rising—And So Is the Magnificent Seven",Yesterday's hit stock has cooled a bit today—but it's still working its way higher.,investopedia.com,https://www.investopedia.com/tesla-stock-taps-the-brakes-but-its-still-rising-magnificent-seven-8734228,https://images.financialmodelingprep.com/news/teslas-stock-taps-the-brakes-but-its-still-risingand-20241025.jpg
TSLA,2024-10-23,2024-10-16,2024-11-06,TSLA,,2024-10-25 11:31:53,2024-10-25T11:31:53-04:00,2024-10-25,Options Trades in TSLA and NFLX,"After BIG earnings reports and BIG moves higher, Alex Coffey takes a look at Tesla (TSLA) and Netflix (NFLX) to close out the week. ======== Schwab Network ======== Empowering every investor and trader, every market day.",youtube.com,https://www.youtube.com/watch?v=dg-zjGxhAM0,https://images.financialmodelingprep.com/news/options-trades-in-tsla-and-nflx-20241025.jpg
TSLA,2024-10-23,2024-10-16,2024-11-06,TSLA,,2024-10-25 11:57:20,2024-10-25T11:57:20-04:00,2024-10-25,Tesla stock price prediction if Kamala Harris wins Presidency,"The third-quarter (Q3) earnings report abruptly ended Tesla's (NASDAQ: TSLA) losing streak and led the electric vehicle (EV) maker to have one of its best stock market days ever, as the EV maker surged more than 24% within a single session.",finbold.com,https://finbold.com/tesla-stock-price-prediction-if-kamala-harris-wins-presidency/,https://images.financialmodelingprep.com/news/tesla-stock-price-prediction-if-kamala-harris-wins-presidency-20241025.jpg
TSLA,2024-10-23,2024-10-16,2024-11-06,TSLA,,2024-10-25 12:17:08,2024-10-25T12:17:08-04:00,2024-10-25,Dan Ives: A.I. a $1 Trillion Dollar Story for TSLA,Wedbush's Dan Ives is back and has a message for Tesla (TSLA) bears: Go back into hibernation mode. Ives has a $300 price target on Elon Musk's E.V.,youtube.com,https://www.youtube.com/watch?v=WDA3v0QLpd0,https://images.financialmodelingprep.com/news/dan-ives-ai-a-1-trillion-dollar-story-for-20241025.jpg
TSLA,2024-10-23,2024-10-16,2024-11-06,TSLA,,2024-10-25 12:41:52,2024-10-25T12:41:52-04:00,2024-10-25,"Tesla: Elon Musk Doesn't Deliver, But Money Talks","Tesla's stock surged 20% post-earnings due to improved margins and future model plans, despite missing revenue estimates. Elon Musk's optimistic forecasts include new affordable models by 2025 and ramping up Cybercab production to 2 million units by 2026. While Tesla's recent performance is promising, sustaining margins and meeting future targets are crucial for long-term investor confidence. Can Musk deliver?",seekingalpha.com,https://seekingalpha.com/article/4729644-tesla-elon-musk-does-not-deliver-but-money-talks,https://images.financialmodelingprep.com/news/tesla-elon-musk-doesnt-deliver-but-money-talks-20241025.jpg
TSLA,2024-10-23,2024-10-16,2024-11-06,TSLA,,2024-10-25 12:49:14,2024-10-25T12:49:14-04:00,2024-10-25,Tesla shares head for highest close in 13 months as post-earnings rally continues,"Following Tesla's best day on the market since 2013, the stock rose almost 3% on Friday, putting it on pace for its highest close since September of last year. The two-day pop comes after the company reported better-than-expected earnings and CEO Elon Musk offered an optimistic projection for 2025.",cnbc.com,https://www.cnbc.com/2024/10/25/tesla-shares-rise-to-highest-in-over-a-year-after-q3-earnings.html,https://images.financialmodelingprep.com/news/tesla-shares-head-for-highest-close-in-13-months-20241025.jpg
TSLA,2024-10-23,2024-10-16,2024-11-06,TSLA,,2024-10-25 13:26:32,2024-10-25T13:26:32-04:00,2024-10-25,"Final Trades: Tesla, Sweetgreen, AbbVie and Digital Realty",CNBC's Investment Committee join 'Halftime Report' to give you their top stocks to watch.,youtube.com,https://www.youtube.com/watch?v=qOrBIqG2tzA,https://images.financialmodelingprep.com/news/final-trades-tesla-sweetgreen-abbvie-and-digital-realty-20241025.jpg
TSLA,2024-10-23,2024-10-16,2024-11-06,TSLA,,2024-10-25 14:50:08,2024-10-25T14:50:08-04:00,2024-10-25,Tesla To Rally Over 21%? Here Are 10 Top Analyst Forecasts For Friday,"Top Wall Street analysts changed their outlook on these top names. For a complete view of all analyst rating changes, including upgrades and downgrades, please see our analyst ratings page.",benzinga.com,https://www.benzinga.com/news/24/10/41554083/tesla-to-rally-over-21-here-are-10-top-analyst-forecasts-for-friday,https://images.financialmodelingprep.com/news/tesla-to-rally-over-21-here-are-10-top-20241025.jpg
TSLA,2024-10-23,2024-10-16,2024-11-06,TSLA,,2024-10-25 15:01:11,2024-10-25T15:01:11-04:00,2024-10-25,Is Tesla's Stock Pop Sustainable? TSLA ETFs in Focus,Tesla's stock jumped post upbeat outlook and earnings beat. But cautious investors may wait until they see concrete signs of solid delivery growth before jumping into the stock.,zacks.com,https://www.zacks.com/stock/news/2358077/is-tesla-s-stock-pop-sustainable-tsla-etfs-in-focus?cid=CS-STOCKNEWSAPI-FT-etf_news_and_commentary-2358077,https://images.financialmodelingprep.com/news/is-teslas-stock-pop-sustainable-tsla-etfs-in-focus-20241025.jpg
TSLA,2024-10-23,2024-10-16,2024-11-06,TSLA,,2024-10-25 16:10:22,2024-10-25T16:10:22-04:00,2024-10-25,Tesla Stock Closes At Highest Share Price Since September 2023 Thanks To 26% Post-Earnings Rally,"Tesla shares built on their historic Thursday rally as the electric vehicle maker closed the week on a high note, the latest twist in the ever-volatile stock market action for the firm helmed by Elon Musk, the world's richest man.",forbes.com,https://www.forbes.com/sites/dereksaul/2024/10/25/tesla-stock-closes-at-highest-share-price-since-september-2023-thanks-to-26-post-earnings-rally/,https://images.financialmodelingprep.com/news/tesla-stock-closes-at-highest-share-price-since-september-20241025.jpg
TSLA,2024-10-23,2024-10-16,2024-11-06,TSLA,,2024-10-25 16:52:37,2024-10-25T16:52:37-04:00,2024-10-25,"Weekly Wrap: NDX Rallies, TSLA Surges, BA Strike Continues, MCD E. Coli Outbreak",Markets finish the week mixed but the Nasdaq-100 (NDX) continues its winning streak with 7 consecutive weeks of positive gains. Tesla (TSLA) among the top performers following a huge 22% surge after earnings.,youtube.com,https://www.youtube.com/watch?v=7gvKGSSILPw,https://images.financialmodelingprep.com/news/weekly-wrap-ndx-rallies-tsla-surges-ba-strike-continues-20241025.jpg
TSLA,2024-10-23,2024-10-16,2024-11-06,TSLA,,2024-10-25 17:00:18,2024-10-25T17:00:18-04:00,2024-10-25,Tesla: Don't Be Fooled By The Market,"Tesla, Inc.'s 20% post-earnings surge has recovered most losses incurred after its underwhelming Robotaxi event. Tesla's solid Q3 earnings release supports the thesis that the worst is likely behind the EV leader. However, the market isn't dumb, given Tesla's sky-high valuation amid EV growth challenges.",seekingalpha.com,https://seekingalpha.com/article/4729587-tesla-dont-be-fooled-by-the-market,https://images.financialmodelingprep.com/news/tesla-dont-be-fooled-by-the-market-20241025.jpg
TSLA,2024-10-23,2024-10-16,2024-11-06,TSLA,,2024-10-25 17:25:00,2024-10-25T17:25:00-04:00,2024-10-25,"The Score: McDonald's, Tesla, Spirit Airlines and More Stocks That Defined the Week",Here are some of the major companies whose stocks moved on the week's news.,wsj.com,https://www.wsj.com/articles/the-score-mcdonalds-tesla-spirit-airlines-and-more-stocks-that-defined-the-week-b4709253,https://images.financialmodelingprep.com/news/the-score-mcdonalds-tesla-spirit-airlines-and-more-stocks-20241025.jpg
TSLA,2024-10-23,2024-10-16,2024-11-06,TSLA,,2024-10-25 18:35:25,2024-10-25T18:35:25-04:00,2024-10-25,Previewing Big Tech Earnings,"This week takes us into the heart of the Q3 earnings season, with the reporting docket stacked with 168 S&P 500 members and several of the Mag 7 companies.",zacks.com,https://www.zacks.com/commentary/2358098/previewing-big-tech-earnings?cid=CS-STOCKNEWSAPI-FT-earnings_preview-2358098,https://images.financialmodelingprep.com/news/previewing-big-tech-earnings-20241025.jpg
TSLA,2024-10-23,2024-10-16,2024-11-06,TSLA,,2024-10-25 19:50:10,2024-10-25T19:50:10-04:00,2024-10-25,Court Rules Elon Musk Is Not Required To Remove Controversial Tweet About Tesla Union,"A 2018 tweet made by Tesla CEO Elon Musk suggesting workers would lose stock options if they formed a union was ruled as protected speech Friday, preventing Musk from having to follow a prior court order commanding him to delete the controversial post.",forbes.com,https://www.forbes.com/sites/antoniopequenoiv/2024/10/25/court-rules-elon-musk-is-not-required-to-remove-controversial-tweet-about-tesla-union/,https://images.financialmodelingprep.com/news/court-rules-elon-musk-is-not-required-to-remove-20241025.jpg
TSLA,2024-10-23,2024-10-16,2024-11-06,TSLA,,2024-10-25 20:44:07,2024-10-25T20:44:07-04:00,2024-10-25,Tesla ends the week on a high fueled by earnings 'surprise',Tesla stock has surged since the company reported earnings on Wednesday. Wall Street analysts broke down the factors they believe are fueling the rally.,businessinsider.com,https://www.businessinsider.com/tesla-stock-price-ends-week-high-after-earnings-2024-10,https://images.financialmodelingprep.com/news/tesla-ends-the-week-on-a-high-fueled-by-20241025.jpg
TSLA,2024-10-23,2024-10-16,2024-11-06,TSLA,,2024-10-25 21:21:58,2024-10-25T21:21:58-04:00,2024-10-25,"US labor board wrongly ordered Tesla's Musk to delete anti-union tweet, court rules",A divided U.S. appeals court on Friday ruled that the National Labor Relations Board went too far by ordering Tesla CEO Elon Musk to delete a 2018 tweet stating employees of the electric vehicle maker would lose stock options if they unionized.,reuters.com,https://www.reuters.com/legal/us-labor-board-wrongly-ordered-teslas-musk-delete-anti-union-tweet-court-rules-2024-10-26/,https://images.financialmodelingprep.com/news/us-labor-board-wrongly-ordered-teslas-musk-to-delete-20241025.jpg
TSLA,2024-10-23,2024-10-16,2024-11-06,TSLA,,2024-10-26 05:15:00,2024-10-26T05:15:00-04:00,2024-10-26,Tesla's Secret to Success in the Third Quarter of 2024,The key for Tesla investors is where growth is coming from.,fool.com,https://www.fool.com/investing/2024/10/26/where-teslas-money-came-from/,https://images.financialmodelingprep.com/news/teslas-secret-to-success-in-the-third-quarter-of-20241026.jpg
TSLA,2024-10-23,2024-10-16,2024-11-06,TSLA,,2024-10-26 07:00:00,2024-10-26T07:00:00-04:00,2024-10-26,Tesla's blowout earnings still leaves investors with these questions,A closer look at Tesla's automotive gross margins and other aspects of its business are still big question marks for investors.,marketwatch.com,https://www.marketwatch.com/story/teslas-blowout-earnings-still-leaves-investors-with-these-questions-304d2644,https://images.financialmodelingprep.com/news/teslas-blowout-earnings-still-leaves-investors-with-these-questions-20241026.jpg
TSLA,2024-10-23,2024-10-16,2024-11-06,TSLA,,2024-10-26 13:25:04,2024-10-26T13:25:04-04:00,2024-10-26,Here's Tesla's (TSLA) stock path to $4 trillion market cap,"Tesla (NASDAQ: TSLA) hitting a market capitalization of $4 trillion is a target thrown around several times, even by CEO Elon Musk, and an analyst has outlined a path to achieving this goal.",finbold.com,https://finbold.com/heres-teslas-tsla-stock-path-to-4-trillion-market-cap/,https://images.financialmodelingprep.com/news/heres-teslas-tsla-stock-path-to-4-trillion-market-20241026.jpg
TSLA,2024-10-23,2024-10-16,2024-11-06,TSLA,,2024-10-27 04:11:10,2024-10-27T04:11:10-04:00,2024-10-27,'There Are Some Horses': Maintaining Tesla With A Buy,"I'm maintaining Tesla with a buy for mid-term investors after 3Q24 earnings made the stock close 22% higher on Thursday. GAAP gross margin impressed at 19.8%, significantly above consensus, marking the second consecutive margin expansion after six quarters of decline. Management forecasts vehicle production to increase by 20%-30% in 2025, and Cybercab production to dramatically increase by 2026.",seekingalpha.com,https://seekingalpha.com/article/4729923-tesla-stock-maintaining-buy-rating,https://images.financialmodelingprep.com/news/there-are-some-horses-maintaining-tesla-with-a-buy-20241027.jpg
TSLA,2024-10-23,2024-10-16,2024-11-06,TSLA,,2024-10-27 05:47:00,2024-10-27T05:47:00-04:00,2024-10-27,"Tesla Makes Money Selling Electric Vehicles, but 86% of Its Earnings Could Soon Come From This Instead",Cathie Wood doesn't believe Tesla's future rests on selling passenger electric vehicles.,fool.com,https://www.fool.com/investing/2024/10/27/tesla-makes-money-selling-electric-vehicles-but-86/,https://images.financialmodelingprep.com/news/tesla-makes-money-selling-electric-vehicles-but-86-of-20241027.jpg
TSLA,2024-10-23,2024-10-16,2024-11-06,TSLA,,2024-10-27 12:00:00,2024-10-27T12:00:00-04:00,2024-10-27,"SHAREHOLDER ALERT: Pomerantz Law Firm Investigates Claims On Behalf of Investors of Tesla, Inc. - TSLA","NEW YORK, NY / ACCESSWIRE / October 27, 2024 / Pomerantz LLP is investigating claims on behalf of investors of Tesla, Inc. (""Tesla"" or the ""Company"") (NASDAQ:TSLA). Such investors are advised to contact Danielle Peyton at newaction@pomlaw.com or 646-581-9980, ext.",accesswire.com,https://www.accesswire.com/935443/shareholder-alert-pomerantz-law-firm-investigates-claims--on-behalf-of-investors-of-tesla-inc--tsla,https://images.financialmodelingprep.com/news/shareholder-alert-pomerantz-law-firm-investigates-claims-on-behalf-of-investors-of-tesla-20241027.jpg
TSLA,2024-10-23,2024-10-16,2024-11-06,TSLA,,2024-10-27 12:05:00,2024-10-27T12:05:00-04:00,2024-10-27,Tesla Shares Surge on Delivery Forecast. Is It Time to Buy the Stock?,CEO Elon Musk predicts 20% to 30% delivery growth next year.,fool.com,https://www.fool.com/investing/2024/10/27/tesla-shares-jump-on-delivery-forecast-is-it-time/,https://images.financialmodelingprep.com/news/tesla-shares-surge-on-delivery-forecast-is-it-time-20241027.jpg
TSLA,2024-10-23,2024-10-16,2024-11-06,TSLA,,2024-10-28 02:49:46,2024-10-28T02:49:46-04:00,2024-10-28,$260 is the resistance level for Tesla stock: Strategist,Michele Schneider of Marketgauge.com shares her outlook for Tesla.,youtube.com,https://www.youtube.com/watch?v=vfy_vx4JR8k,https://images.financialmodelingprep.com/news/260-is-the-resistance-level-for-tesla-stock-strategist-20241028.jpg
TSLA,2024-10-23,2024-10-16,2024-11-06,TSLA,,2024-10-28 04:00:57,2024-10-28T04:00:57-04:00,2024-10-28,"Stride and Tesla Gain, but CE 100 Slips 1.4% Amid Market Volatility","And now earnings season is here, in full swing, and a series of double-digit advances and declines among our CE 100 population wound up sending the overall Index 1.4% lower. The markets, in general, were volatile too, as only the tech-heavy Nasdaq was up by 0.",pymnts.com,https://www.pymnts.com/connectedeconomy/2024/stride-and-tesla-gain-but-ce-100-slips-1percent-amid-market-volatility/,https://images.financialmodelingprep.com/news/stride-and-tesla-gain-but-ce-100-slips-14-20241028.jpg
TSLA,2024-10-23,2024-10-16,2024-11-06,TSLA,,2024-10-28 05:06:00,2024-10-28T05:06:00-04:00,2024-10-28,"2 ""Magnificent Seven"" Stocks That Can Plunge by Up to 98%, According to Select Wall Street Pundits","Among Apple, Nvidia, Microsoft, Alphabet, Amazon, Meta Platforms, and Tesla, there are two industry-leading companies Wall Street experts believe will lose at least 90% of their value.",fool.com,https://www.fool.com/investing/2024/10/28/2-magnificent-seven-stocks-plunge-98-wall-street/,https://images.financialmodelingprep.com/news/2-magnificent-seven-stocks-that-can-plunge-by-up-20241028.jpg
TSLA,2024-10-23,2024-10-16,2024-11-06,TSLA,,2024-10-28 05:15:00,2024-10-28T05:15:00-04:00,2024-10-28,You Won't Believe This Shocking Statement From Tesla CEO Elon Musk,"Elon Musk commented on the company's potential valuation, and the potential is staggering.",fool.com,https://www.fool.com/investing/2024/10/28/you-wont-believe-the-shocking-statement-from-tesla/,https://images.financialmodelingprep.com/news/you-wont-believe-this-shocking-statement-from-tesla-ceo-20241028.jpg
TSLA,2024-10-23,2024-10-16,2024-11-06,TSLA,,2024-10-28 05:15:00,2024-10-28T05:15:00-04:00,2024-10-28,Tesla Plans A Big Fourth Quarter. Here's How It's Going To Do It.,"Over the weekend, Tesla extended some 0% financing deals for car buyers in China.",barrons.com,https://www.barrons.com/articles/tesla-stock-china-incentives-58ec1082,https://images.financialmodelingprep.com/news/tesla-plans-a-big-fourth-quarter-heres-how-its-20241028.jpg
TSLA,2024-10-23,2024-10-16,2024-11-06,TSLA,,2024-10-28 05:58:12,2024-10-28T05:58:12-04:00,2024-10-28,"Tesla's profit margins improve, but targets for 2025 face scrutiny, says Goldman Sachs","Goldman Sachs has maintained its 'neutral' rating on Tesla Inc (NASDAQ:TSLA) despite a boost in the company's profit margins, pointing to significant challenges that could affect the electric vehicle maker's ambitious targets for 2025. Elon Musk's EV maker recently reported a gross margin of 19.8% for the third quarter of 2024, exceeding both Goldman Sachs's forecast and market expectations.",proactiveinvestors.co.uk,https://www.proactiveinvestors.co.uk/companies/news/1059256,https://images.financialmodelingprep.com/news/teslas-profit-margins-improve-but-targets-for-2025-face-20241028.jpg
