ticker,event_date,window_start,window_end,symbol,symbols,publishedDate,publishedDateET,date_et,title,text,site,url,image
TSLA,2024-10-23,2024-10-16,2024-11-06,TSLA,,2024-10-29 16:31:14,2024-10-29T16:31:14-04:00,2024-10-29,"Elon Musk, Trump allies say his tariff plans could cause short-term pain for consumers","Donald Trump's campaign surrogates like Tesla CEO Elon Musk and Cantor Fitzgerald CEO Howard Lutnick accept that the Republican presidential nominee's policy plan could trigger short-term economic pain, but they contend it will be worth the potential payoff. Trump's economic pitch includes a cocktail of tax cuts and a universal tariff proposal that dozens of independent economists expect would swell federal deficits and reheat inflation.",cnbc.com,https://www.cnbc.com/2024/10/29/elon-musk-trump-allies-economy-plan-short-term-pain-harris-election.html,https://images.financialmodelingprep.com/news/elon-musk-trump-allies-say-his-tariff-plans-could-20241029.jpg
TSLA,2024-10-23,2024-10-16,2024-11-06,TSLA,,2024-10-29 17:03:41,2024-10-29T17:03:41-04:00,2024-10-29,"Tesla: I Like The Business, Not Sure About The Stock","Tesla, Inc.'s stock is overvalued, driven by hype and unrealistic future expectations, making it a risky investment despite the company's impressive business achievements. Cathie Wood's lofty price targets for Tesla are more hype than analysis, perpetuating froth in an already overvalued stock. Tesla's valuation is unsustainable, trading at 9x P/S compared to automotive peers' 1.5x, indicating a significant downside risk.",seekingalpha.com,https://seekingalpha.com/article/4730612-tesla-i-like-the-business-not-sure-about-the-stock,https://images.financialmodelingprep.com/news/tesla-i-like-the-business-not-sure-about-the-20241029.jpg
TSLA,2024-10-23,2024-10-16,2024-11-06,TSLA,,2024-10-30 06:00:00,2024-10-30T06:00:00-04:00,2024-10-30,Where Will Tesla Be in 10 Years?,This historically booming stock might not live up to the hype.,fool.com,https://www.fool.com/investing/2024/10/30/where-will-tesla-be-in-10-years/,https://images.financialmodelingprep.com/news/where-will-tesla-be-in-10-years-20241030.jpg
TSLA,2024-10-23,2024-10-16,2024-11-06,TSLA,,2024-10-30 06:40:00,2024-10-30T06:40:00-04:00,2024-10-30,1 Chart That Shows Why Tesla Is Still Overvalued,Weakness in the EV market could spoil Tesla's recent recovery.,fool.com,https://www.fool.com/investing/2024/10/30/1-chart-that-shows-why-tesla-is-still-overvalued/,https://images.financialmodelingprep.com/news/1-chart-that-shows-why-tesla-is-still-overvalued-20241030.jpg
TSLA,2024-10-23,2024-10-16,2024-11-06,TSLA,,2024-10-30 07:22:44,2024-10-30T07:22:44-04:00,2024-10-30,Volvo and Polestar EVs Get Tesla Supercharger Access Next Month,The Swedish premium automakers will begin offering NACS adapters for their 2025 model year electric SUVs starting on Nov. 18.,cnet.com,https://www.cnet.com/roadshow/news/volvo-polestar-evs-getting-tesla-supercharger-access-next-month/,https://images.financialmodelingprep.com/news/volvo-and-polestar-evs-get-tesla-supercharger-access-next-20241030.jpg
TSLA,2024-10-23,2024-10-16,2024-11-06,TSLA,,2024-10-30 08:57:00,2024-10-30T08:57:00-04:00,2024-10-30,Tesla's Sales Fall Behind BYD's for the First Time,"BYD's third quarter sales came in at $28.2 billion, higher that's Tesla's third quarter sales of $25.2 billion. That's a first.",barrons.com,https://www.barrons.com/articles/tesla-byd-ev-car-sales-stock-price-0ea94896,https://images.financialmodelingprep.com/news/teslas-sales-fall-behind-byds-for-the-first-time-20241030.jpg
TSLA,2024-10-23,2024-10-16,2024-11-06,TSLA,,2024-10-30 10:16:11,2024-10-30T10:16:11-04:00,2024-10-30,"Tesla Rocks, But They Are Behind Waymo With Robotaxis","Google's Waymo is doing more than 150,000 robotaxi rides per week, but Tesla still doesn't offer driverless rides to the public. FSD 12.5.4 offers hands-free driving but still sometimes struggles with common-sense issues and navigation errors. Tesla's valuation includes significant potential from semi-supervised FSD licensing, robotaxi and Optimus.",seekingalpha.com,https://seekingalpha.com/article/4730846-tesla-rocks-but-they-are-behind-waymo-with-robotaxis,https://images.financialmodelingprep.com/news/tesla-rocks-but-they-are-behind-waymo-with-robotaxis-20241030.jpg
TSLA,2024-10-23,2024-10-16,2024-11-06,TSLA,,2024-10-30 10:22:55,2024-10-30T10:22:55-04:00,2024-10-30,Tesla stock price prediction if Donald Trump wins Presidency,"Having initially positioned himself as an ally of the American car industry but an opponent of the electric vehicle (EV) sector, Donald Trump quickly caused significant speculation on what his reelection would mean for the biggest player in the field, Tesla Motors (NASDAQ: TSLA).",finbold.com,https://finbold.com/tesla-stock-price-prediction-if-donald-trump-wins-presidency/,https://images.financialmodelingprep.com/news/tesla-stock-price-prediction-if-donald-trump-wins-presidency-20241030.jpg
TSLA,2024-10-23,2024-10-16,2024-11-06,TSLA,,2024-10-30 11:13:40,2024-10-30T11:13:40-04:00,2024-10-30,IDRV: A Good Bet Beyond Tesla,"The iShares Self-Driving EV and Tech ETF offers a cost-effective way to invest in global companies advancing self-driving tech and electric vehicles. IDRV's holdings include Tesla, Li Auto, Arcadium Lithium, XPeng, and BYD, providing a comprehensive view of the EV sector and supply chain. The fund's sector allocation focuses on Consumer Discretionary, Industrials, Materials, and Information Technology, with significant investments in Chinese firms.",seekingalpha.com,https://seekingalpha.com/article/4730861-idrv-a-good-bet-beyond-tesla,https://images.financialmodelingprep.com/news/idrv-a-good-bet-beyond-tesla-20241030.jpg
TSLA,2024-10-23,2024-10-16,2024-11-06,TSLA,,2024-10-30 17:19:39,2024-10-30T17:19:39-04:00,2024-10-30,"Why Tesla's sales are slipping in California, and what it means for Elon Musk's car company",Tesla's falling California sales point to bigger problems for the car company. Changes to the EV market are finally catching up to Tesla.,businessinsider.com,https://www.businessinsider.com/tesla-falling-california-sales-are-bad-for-elon-musk-2024-10,https://images.financialmodelingprep.com/news/why-teslas-sales-are-slipping-in-california-and-what-20241030.jpg
TSLA,2024-10-23,2024-10-16,2024-11-06,TSLA,,2024-10-30 19:10:34,2024-10-30T19:10:34-04:00,2024-10-30,Tech Flexes Earnings Power: A Closer Look,"The market loved the Tesla report last week and had a similar reaction to the Alphabet release, which have both helped kick off the reporting cycle for the Mag 7 group.",zacks.com,https://www.zacks.com/commentary/2361106/tech-flexes-earnings-power-a-closer-look?cid=CS-STOCKNEWSAPI-FT-earnings_trends-2361106,https://images.financialmodelingprep.com/news/tech-flexes-earnings-power-a-closer-look-20241030.jpg
TSLA,2024-10-23,2024-10-16,2024-11-06,TSLA,,2024-10-30 19:10:36,2024-10-30T19:10:36-04:00,2024-10-30,Tech Flexes Earnings Power: A Closer Look,"The market loved the Tesla report last week and had a similar reaction to the Alphabet release, which have both helped kick off the reporting cycle for the Mag 7 group.",zacks.com,https://www.zacks.com/commentary/2361155/tech-flexes-earnings-power-a-closer-look?cid=CS-STOCKNEWSAPI-FT-earnings_outlook-2361155,https://images.financialmodelingprep.com/news/tech-flexes-earnings-power-a-closer-look-20241030.jpg
TSLA,2024-10-23,2024-10-16,2024-11-06,TSLA,,2024-10-30 20:33:49,2024-10-30T20:33:49-04:00,2024-10-30,BYD Sales Beat Tesla for First Time in Battle of EV Giants,China's BYD Co. reported quarterly revenue that beat Tesla Inc. for the first time since the pair have gone head-to-head in global EV sales. Minmin Low reports on Bloomberg Television.,youtube.com,https://www.youtube.com/watch?v=eodiBwyQChM,https://images.financialmodelingprep.com/news/byd-sales-beat-tesla-for-first-time-in-battle-20241030.jpg
TSLA,2024-10-23,2024-10-16,2024-11-06,TSLA,,2024-10-31 00:56:34,2024-10-31T00:56:34-04:00,2024-10-31,"Harris vs Trump: Whoever wins US elections, Tesla is set to thrive, say analysts","Wall Street's focus on the auto industry has taken a political twist as analysts and investors assess which stocks stand to benefit regardless of the outcome of the upcoming US presidential election. While much of the auto sector has struggled, Tesla Inc.",invezz.com,https://invezz.com/news/2024/10/31/whether-its-harris-or-trump-in-white-house-tesla-is-set-to-thrive-say-analysts/,https://images.financialmodelingprep.com/news/harris-vs-trump-whoever-wins-us-elections-tesla-is-20241031.jpg
TSLA,2024-10-23,2024-10-16,2024-11-06,TSLA,,2024-10-31 02:13:43,2024-10-31T02:13:43-04:00,2024-10-31,BYD Quarterly Sales Beat Tesla for First Time,China's BYD Co. reported quarterly revenue that beat Tesla Inc. for the first time since the pair have gone head-to-head in global EV sales. Minmin Low reports on Bloomberg Television.,youtube.com,https://www.youtube.com/watch?v=cDj0HjXwS9M,https://images.financialmodelingprep.com/news/byd-quarterly-sales-beat-tesla-for-first-time-20241031.jpg
TSLA,2024-10-23,2024-10-16,2024-11-06,TSLA,,2024-10-31 02:23:01,2024-10-31T02:23:01-04:00,2024-10-31,Chinese EV maker BYD's quarterly sales overtook Tesla's for the first time,"On Wednesday, BYD reported revenue for the three months ended Sept. 30 of 201.12 billion yuan ($28.24 billion), up 24% from a year ago.",cnbc.com,https://www.cnbc.com/2024/10/31/chinese-ev-maker-byds-quarterly-sales-overtook-teslas-for-the-first-time.html,https://images.financialmodelingprep.com/news/chinese-ev-maker-byds-quarterly-sales-overtook-teslas-for-20241031.jpg
TSLA,2024-10-23,2024-10-16,2024-11-06,TSLA,,2024-10-31 04:27:00,2024-10-31T04:27:00-04:00,2024-10-31,Tesla Stock Closes Out Incredible Month. It's Ending Where it Started.,Who would have though that a month with a self-driving technology event and quarterly earnings would yield so little for Tesla stock?,barrons.com,https://www.barrons.com/articles/tesla-stock-october-moves-today-2e42b3c9,https://images.financialmodelingprep.com/news/tesla-stock-closes-out-incredible-month-its-ending-where-20241031.jpg
TSLA,2024-10-23,2024-10-16,2024-11-06,TSLA,,2024-10-31 04:45:00,2024-10-31T04:45:00-04:00,2024-10-31,Will Lucid Be Worth More Than Tesla by 2040?,Could this underdog EV maker overtake the market leader in the future?,fool.com,https://www.fool.com/investing/2024/10/31/will-lucid-be-worth-more-than-tesla-by-2040/,https://images.financialmodelingprep.com/news/will-lucid-be-worth-more-than-tesla-by-2040-20241031.jpg
TSLA,2024-10-23,2024-10-16,2024-11-06,TSLA,,2024-10-31 05:52:00,2024-10-31T05:52:00-04:00,2024-10-31,2 Top Stocks That Can Supercharge Your Portfolio in 2025 and Beyond,These growth stocks have room to run based on near-term catalysts.,fool.com,https://www.fool.com/investing/2024/10/31/top-stocks-supercharge-portfolio-2025-beyond/,https://images.financialmodelingprep.com/news/2-top-stocks-that-can-supercharge-your-portfolio-in-20241031.jpg
TSLA,2024-10-23,2024-10-16,2024-11-06,TSLA,,2024-10-31 07:08:00,2024-10-31T07:08:00-04:00,2024-10-31,"Tesla Supplier STMicro Warns of Weaker Sales. ON Semi, Texas Instruments Stocks Fall.","Demand for semiconductors has been bumpy recently. While names like Nvidia are benefiting from the artificial intelligence boom, chip makers focused on other sectors aren't faring as well.",barrons.com,https://www.barrons.com/articles/tesla-apple-stmicro-on-semi-stock-4a8b9276,https://images.financialmodelingprep.com/news/tesla-supplier-stmicro-warns-of-weaker-sales-on-semi-20241031.jpg
TSLA,2024-10-23,2024-10-16,2024-11-06,TSLA,,2024-10-31 11:28:00,2024-10-31T11:28:00-04:00,2024-10-31,Uber Has a Bigger Worry Than Tesla's Robotaxis. What's Driving the Stock Down.,Uber stock is slipping with the focus on whether it is running out of new customers and if existing ones will become more cautious on spending.,barrons.com,https://www.barrons.com/articles/uber-stock-price-lyft-tesla-robotaxis-0e5183e4,https://images.financialmodelingprep.com/news/uber-has-a-bigger-worry-than-teslas-robotaxis-whats-20241031.jpg
TSLA,2024-10-23,2024-10-16,2024-11-06,TSLA,,2024-10-31 11:52:45,2024-10-31T11:52:45-04:00,2024-10-31,Options Trades in TSLA and RIVN,"As Tesla's (TSLA) up-and-down October month comes to a close, Kevin Hincks looks back on a month that saw the EV maker hit 52-week highs and unveil its Cybercab vehicle. Kevin looks at a pair of options trading strategies for Tesla and Rivian (RIVN).",youtube.com,https://www.youtube.com/watch?v=qIk2bLjdzKI,https://images.financialmodelingprep.com/news/options-trades-in-tsla-and-rivn-20241031.jpg
TSLA,2024-10-23,2024-10-16,2024-11-06,TSLA,,2024-10-31 14:06:50,2024-10-31T14:06:50-04:00,2024-10-31,Ford pauses F-150 Lightning production as Tesla Cybertruck heats up,"Ford will pause production of its F-150 Lightning electric pickup truck starting in mid-November for almost two months as it struggles with decreased demand, increased competition, and losses in its electric vehicle business.",techcrunch.com,https://techcrunch.com/2024/10/31/ford-pauses-f-150-lightning-production-as-tesla-cybertruck-heats-up/,https://images.financialmodelingprep.com/news/ford-pauses-f150-lightning-production-as-tesla-cybertruck-heats-20241031.jpg
TSLA,2024-10-23,2024-10-16,2024-11-06,TSLA,,2024-10-31 15:13:46,2024-10-31T15:13:46-04:00,2024-10-31,Stock Of The Day: Emotions Drive Tesla As EV Maker Finds Resistance At This Level,"If understood and applied correctly, Technical Analysis is the study of investor and trader psychology. Successful traders understand that emotions make technical analysis patterns appear on charts.",benzinga.com,https://www.benzinga.com/trading-ideas/technicals/24/10/41662778/stock-of-the-day-emotions-drive-tesla-as-ev-maker-finds-resistance-at-this-level,https://images.financialmodelingprep.com/news/stock-of-the-day-emotions-drive-tesla-as-ev-20241031.jpg
TSLA,2024-10-23,2024-10-16,2024-11-06,TSLA,,2024-10-31 15:15:00,2024-10-31T15:15:00-04:00,2024-10-31,"SHAREHOLDER ALERT: Pomerantz Law Firm Investigates Claims On Behalf of Investors of Tesla, Inc. - TSLA","NEW YORK, NY / ACCESSWIRE / October 31, 2024 / Pomerantz LLP is investigating claims on behalf of investors of Tesla, Inc. (""Tesla"" or the ""Company"") (NASDAQ:TSLA). Such investors are advised to contact Danielle Peyton at newaction@pomlaw.com or 646-581-9980, ext.",accesswire.com,https://www.accesswire.com/937717/shareholder-alert-pomerantz-law-firm-investigates-claims--on-behalf-of-investors-of-tesla-inc--tsla,https://images.financialmodelingprep.com/news/shareholder-alert-pomerantz-law-firm-investigates-claims-on-behalf-of-investors-of-tesla-20241031.jpg
TSLA,2024-10-23,2024-10-16,2024-11-06,TSLA,,2024-10-31 19:27:08,2024-10-31T19:27:08-04:00,2024-10-31,Judge aims to rule on Elon Musk's $56 bln Tesla pay by year end,"The Delaware judge considering whether a vote by Tesla shareholders reinstated Elon Musk's $56 billion pay package which the court had voided will try to issue a ruling this year, according to the judge's letter to the lawyers in the case.",reuters.com,https://www.reuters.com/legal/judge-aims-rule-elon-musks-56-bln-tesla-pay-by-year-end-2024-10-31/,https://images.financialmodelingprep.com/news/judge-aims-to-rule-on-elon-musks-56-bln-20241031.jpg
TSLA,2024-10-23,2024-10-16,2024-11-06,TSLA,,2024-11-01 07:38:00,2024-11-01T07:38:00-04:00,2024-11-01,Don't Let Tesla's Big Moves Fool You. The Stock Is Stuck and Will Stay That Way.,The automakers shares look like they will fail to close above a key level for two conesutive weeks. That is a bad sign.,barrons.com,https://www.barrons.com/articles/tesla-stock-price-today-chart-technical-analysis-072f1645,https://images.financialmodelingprep.com/news/dont-let-teslas-big-moves-fool-you-the-stock-20241101.jpg
TSLA,2024-10-23,2024-10-16,2024-11-06,TSLA,,2024-11-01 10:54:00,2024-11-01T10:54:00-04:00,2024-11-01,BYD's Sales Hit a Record. It's Neck and Neck in EV Race With Tesla.,"The Chinese manufacturer sold more than 500,000 passenger vehicles in a month for the first time in October.",barrons.com,https://www.barrons.com/articles/byd-ev-record-sales-tesla-c358fbca,https://images.financialmodelingprep.com/news/byds-sales-hit-a-record-its-neck-and-neck-20241101.jpg
TSLA,2024-10-23,2024-10-16,2024-11-06,TSLA,,2024-11-01 11:04:21,2024-11-01T11:04:21-04:00,2024-11-01,BYD bests Tesla for the first time,"BYD's third-quarter revenue rose 11.5%, propelling it ahead of Tesla for the first time. Transcript: Conway Gittens: 12,000.",youtube.com,https://www.youtube.com/watch?v=fMwAFGibcFw,https://images.financialmodelingprep.com/news/byd-bests-tesla-for-the-first-time-20241101.jpg
TSLA,2024-10-23,2024-10-16,2024-11-06,TSLA,,2024-11-01 12:36:47,2024-11-01T12:36:47-04:00,2024-11-01,TSLA stock climbs as Elon Musk says ‘Tesla FSD is now almost entirely AI',"On November 1, shares of electric vehicle maker Tesla (NASDAQ: TSLA) opened at $252.34 before dropping to an intraday low of $250. However, shortly after, the stock began a gradual climb upward as co-founder and CEO Elon Musk took to X.",finbold.com,https://finbold.com/tsla-stock-climbs-as-elon-musk-says-tesla-fsd-is-now-almost-entirely-ai/,https://images.financialmodelingprep.com/news/tsla-stock-climbs-as-elon-musk-says-tesla-fsd-20241101.jpg
TSLA,2024-10-23,2024-10-16,2024-11-06,TSLA,,2024-11-01 12:40:21,2024-11-01T12:40:21-04:00,2024-11-01,5 reasons BYD is surging ahead after eclipsing Tesla's quarterly sales for the first time,BYD has just notched another big victory in its fight to overtake Elon Musk. The Chinese EV maker's quarterly revenues outstripped Tesla's for the first time.,businessinsider.com,https://www.businessinsider.com/why-byd-is-beating-tesla-ev-rivals-china-2024-11,https://images.financialmodelingprep.com/news/5-reasons-byd-is-surging-ahead-after-eclipsing-teslas-20241101.jpg
TSLA,2024-10-23,2024-10-16,2024-11-06,TSLA,,2024-11-01 15:28:35,2024-11-01T15:28:35-04:00,2024-11-01,"3-Stock Lunch: Apple, Amazon and Tesla","Quint Tatro, Joule Financial founder, joins 'Power Lunch' to discuss stock plays for three stocks.",youtube.com,https://www.youtube.com/watch?v=za9SHiie1jA,https://images.financialmodelingprep.com/news/3stock-lunch-apple-amazon-and-tesla-20241101.jpg
TSLA,2024-10-23,2024-10-16,2024-11-06,TSLA,,2024-11-01 15:43:15,2024-11-01T15:43:15-04:00,2024-11-01,UBER vs TSLA vs Waymo: Who Will Drive the Autonomous Future?,"Uber Technologies (UBER) sold off on Thursday after earnings, which Emil Michael calls ""surprising."" His reasoning for the reaction was Tesla's (TSLA) clearer roadmap for its self-driving cybercab.",youtube.com,https://www.youtube.com/watch?v=usHVwnOqagw,https://images.financialmodelingprep.com/news/uber-vs-tsla-vs-waymo-who-will-drive-the-20241101.jpg
TSLA,2024-10-23,2024-10-16,2024-11-06,TSLA,,2024-11-01 17:19:00,2024-11-01T17:19:00-04:00,2024-11-01,You Won't Believe What Elon Musk Just Said About Tesla,Elon Musk just told investors that he thinks Tesla will emerge as the world's most valuable company.,fool.com,https://www.fool.com/investing/2024/11/01/you-wont-believe-what-elon-musk-just-said-about-te/,https://images.financialmodelingprep.com/news/you-wont-believe-what-elon-musk-just-said-about-20241101.jpg
TSLA,2024-10-23,2024-10-16,2024-11-06,TSLA,,2024-11-01 18:35:18,2024-11-01T18:35:18-04:00,2024-11-01,Breaking Down Magnificent 7 Earnings Results,"Of the six members of ‘The Magnificent 7' group of stocks that have reported September-quarter results already, the market didn't like three – Apple AAPL, Microsoft MSFT, and Meta META – but loved the Tesla TSLA report and liked what it saw from Alphabet GOOGL and Amazon AMZN.",zacks.com,https://www.zacks.com/commentary/2362899/breaking-down-magnificent-7-earnings-results?cid=CS-STOCKNEWSAPI-FT-earnings_preview-2362899,https://images.financialmodelingprep.com/news/breaking-down-magnificent-7-earnings-results-20241101.jpg
TSLA,2024-10-23,2024-10-16,2024-11-06,TSLA,,2024-11-02 08:49:32,2024-11-02T08:49:32-04:00,2024-11-02,Will Waymo Self-Driving Car Hurt Tesla?,"Waymo, the largest shareholder of which is Alphabet (NASDAQ: GOOG), was founded 15 years ago and began developing a complete version of self-driving car software seven years ago.",247wallst.com,https://247wallst.com/cars-and-drivers/2024/11/02/will-waymo-self-driving-car-hurt-tesla/,https://images.financialmodelingprep.com/news/will-waymo-selfdriving-car-hurt-tesla-20241102.jpg
TSLA,2024-10-23,2024-10-16,2024-11-06,TSLA,,2024-11-02 12:00:00,2024-11-02T12:00:00-04:00,2024-11-02,"SHAREHOLDER ALERT: Pomerantz Law Firm Investigates Claims On Behalf of Investors of Tesla, Inc. - TSLA","NEW YORK , Nov. 2, 2024 /PRNewswire/ -- Pomerantz LLP is investigating claims on behalf of investors of  Tesla, Inc. (""Tesla"" or the ""Company"") (NASDAQ: TSLA). Such investors are advised to contact Danielle Peyton at newaction@pomlaw.com or 646-581-9980, ext.",prnewswire.com,https://www.prnewswire.com/news-releases/shareholder-alert-pomerantz-law-firm-investigates-claims-on-behalf-of-investors-of-tesla-inc---tsla-302293734.html,https://images.financialmodelingprep.com/news/shareholder-alert-pomerantz-law-firm-investigates-claims-on-behalf-of-investors-of-tesla-20241102.jpg
TSLA,2024-10-23,2024-10-16,2024-11-06,TSLA,,2024-11-04 04:24:00,2024-11-04T04:24:00-05:00,2024-11-04,Cathie Wood and Elon Musk Say Tesla Will Be Worth $7 Trillion. So Why Are Insiders Dumping the Stock?,Three Tesla insiders filed to sell some of their Tesla stock in the third quarter. Is this a signal or just noise?,fool.com,https://www.fool.com/investing/2024/11/04/cathie-wood-and-elon-musk-say-tesla-will-be-worth/,https://images.financialmodelingprep.com/news/cathie-wood-and-elon-musk-say-tesla-will-be-20241104.jpg
TSLA,2024-10-23,2024-10-16,2024-11-06,TSLA,,2024-11-04 04:36:18,2024-11-04T04:36:18-05:00,2024-11-04,Tesla's Oct China-made EV sales fall 5.3% y/y,"U.S. automaker Tesla sold 68,280 China-made electric vehicles in October, down 5.3% from a year earlier, data from the China Passenger Car Association (CPCA) showed on Monday.",reuters.com,https://www.reuters.com/business/autos-transportation/teslas-oct-china-made-ev-sales-fall-53-yy-2024-11-04/,https://images.financialmodelingprep.com/news/teslas-oct-chinamade-ev-sales-fall-53-yy-20241104.jpg
TSLA,2024-10-23,2024-10-16,2024-11-06,TSLA,,2024-11-04 06:58:53,2024-11-04T06:58:53-05:00,2024-11-04,Tesla faces potential 'backfire' effect from Musk's support for Trump,"Tesla Inc (NASDAQ:TSLA) boss Elon Musk's decision to back Donald Trump for president could “backfire” with various negative consequences, according to a Wall Street analyst. In the run up to the US presidential election, Musk has been a conspicuous supporter of the former president at rallies, as well as hosting town hall meetings and donating $100 million to create a political action committee to support the Republican party candidate.",proactiveinvestors.com,https://www.proactiveinvestors.com/companies/news/1059795,https://images.financialmodelingprep.com/news/tesla-faces-potential-backfire-effect-from-musks-support-for-20241104.jpg
TSLA,2024-10-23,2024-10-16,2024-11-06,TSLA,,2024-11-04 07:27:00,2024-11-04T07:27:00-05:00,2024-11-04,Tesla Stock Is Down Again for the Sixth Straight Day,"Coming into Monday trading, Tesla stock was down for five consecutive trading days, losing about 8% over that span.",barrons.com,https://www.barrons.com/articles/tesla-stock-price-evs-962c757b,https://images.financialmodelingprep.com/news/tesla-stock-is-down-again-for-the-sixth-straight-20241104.jpg
TSLA,2024-10-23,2024-10-16,2024-11-06,TSLA,,2024-11-04 07:35:46,2024-11-04T07:35:46-05:00,2024-11-04,Tesla and Ford Threat Is Quality of China EVs,24/7 Wall St. Insights The quality of Chinese electric vehicles could threaten Tesla Inc.,247wallst.com,https://247wallst.com/cars-and-drivers/2024/11/04/tesla-and-ford-threat-is-quality-of-china-evs/,https://images.financialmodelingprep.com/news/tesla-and-ford-threat-is-quality-of-china-evs-20241104.jpg
TSLA,2024-10-23,2024-10-16,2024-11-06,TSLA,,2024-11-04 09:00:40,2024-11-04T09:00:40-05:00,2024-11-04,Chinese Electric Vehicle Stocks Rise as Deliveries Jump in October,"Investors on Wall Street were bullish on Chinese electric vehicle stocks Monday morning after companies such as BYD, XPeng (XPEV), Li Auto (LI), and others released October delivery data late Friday.",investopedia.com,https://www.investopedia.com/chinese-electric-vehicle-stocks-rise-8738937,https://images.financialmodelingprep.com/news/chinese-electric-vehicle-stocks-rise-as-deliveries-jump-in-20241104.jpg
TSLA,2024-10-23,2024-10-16,2024-11-06,TSLA,,2024-11-04 09:19:54,2024-11-04T09:19:54-05:00,2024-11-04,Elon Musk's Big Gamble: Will Tesla Stock Plunge if Kamala Harris Wins the Election?,The Tesla CEO has been an outspoken advocate for GOP presidential candidate Donald Trump. Will it backfire?,fool.com,https://www.fool.com/investing/2024/11/04/elon-musk-gamble-tesla-stock-kamala-harris-win/,https://images.financialmodelingprep.com/news/elon-musks-big-gamble-will-tesla-stock-plunge-if-20241104.jpg
TSLA,2024-10-23,2024-10-16,2024-11-06,TSLA,,2024-11-04 09:38:11,2024-11-04T09:38:11-05:00,2024-11-04,Tesla Has Too Many Issues To Make For A Solid Investment,"Although shares have Tesla have rebounded some, the company has plenty of fundamental issues, especially when it comes to the competitive environment. The business continues to lose market share, and the stock is incredibly expensive at this time. The firm makes for a “strong sell” candidate based on these issues and others, such as a robotaxi plan that is unlikely to bear fruit.",seekingalpha.com,https://seekingalpha.com/article/4732700-tesla-has-too-many-issues-to-make-for-a-solid-investment,https://images.financialmodelingprep.com/news/tesla-has-too-many-issues-to-make-for-a-20241104.jpg
