ticker,event_date,window_start,window_end,symbol,symbols,publishedDate,publishedDateET,date_et,title,text,site,url,image
TSLA,2024-10-23,2024-10-16,2024-11-06,TSLA,,2024-10-28 06:07:13,2024-10-28T06:07:13-04:00,2024-10-28,"Musk's bold 2025 prediction on Tesla sales faces skepticism, scrutiny","Tesla CEO Elon Musk stunned investors and analysts with plans to grow vehicle sales by 30% next year, buoyed by a new, cheaper model and enthusiasm for self-driving software, but delivering on that promise would surprise much of Wall Street.",reuters.com,https://www.reuters.com/business/autos-transportation/musks-bold-2025-prediction-tesla-sales-faces-skepticism-scrutiny-2024-10-28/,https://images.financialmodelingprep.com/news/musks-bold-2025-prediction-on-tesla-sales-faces-skepticism-20241028.jpg
TSLA,2024-10-23,2024-10-16,2024-11-06,TSLA,,2024-10-28 07:37:14,2024-10-28T07:37:14-04:00,2024-10-28,This Analyst With 86% Accuracy Rate Sees Around 11% Downside In Tesla - Here Are 5 Stock Picks For Last Week From Wall Street's Most Accurate Analysts,"U.S. stocks settled mixed on Friday, with the Nasdaq Composite surging to an all-time high during the session. Both the Dow Jones and S&P 500 ended a six-week winning streak, falling around 1% and 2.7%, respectively.",benzinga.com,https://www.benzinga.com/trading-ideas/long-ideas/24/10/41570698/this-analyst-with-86-accuracy-rate-sees-around-11-downside-in-tesla-here-are-5-stock-pic,https://images.financialmodelingprep.com/news/this-analyst-with-86-accuracy-rate-sees-around-11-20241028.jpg
TSLA,2024-10-23,2024-10-16,2024-11-06,TSLA,,2024-10-28 07:56:05,2024-10-28T07:56:05-04:00,2024-10-28,Tesla stock hits 13-month high; is $300 next for TSLA?,"Though the third-quarter (Q3) report did not exceed – or even meet – expectations with all the critical metrics, it nonetheless proved positive enough to break Tesla's (NASDAQ: TSLA) long losing streak in 2024.",finbold.com,https://finbold.com/tesla-stock-hits-13-month-high-is-300-next-for-tsla/,https://images.financialmodelingprep.com/news/tesla-stock-hits-13month-high-is-300-next-for-20241028.jpg
TSLA,2024-10-23,2024-10-16,2024-11-06,TSLA,,2024-10-28 08:40:00,2024-10-28T08:40:00-04:00,2024-10-28,Why Tesla's Growth Isn't Slowing,"Tesla's Q3-2024 automotive revenue reached $20.016 billion, showing resilience despite seasonal demand shifts and macroeconomic fluctuations. Energy revenue surged 174.4% over ten quarters, highlighting Tesla's growing focus on diversified revenue beyond automotive sales. Services revenue, including maintenance and insurance, grew by 90.3% in Q3-2024, strengthening customer loyalty and lifetime value.",seekingalpha.com,https://seekingalpha.com/article/4730066-why-teslas-growth-isnt-slowing,https://images.financialmodelingprep.com/news/why-teslas-growth-isnt-slowing-20241028.jpg
TSLA,2024-10-23,2024-10-16,2024-11-06,TSLA,,2024-10-28 08:44:33,2024-10-28T08:44:33-04:00,2024-10-28,"Tesla doesn't need a low-end vehicle to continue to grow, says Oppenheimer's Colin Rusch","Colin Rusch, Oppenheimer senior research analyst, joins 'Squawk Box' to discuss Tesla's quarterly results and post earnings surge, what's next for the EV maker, Tesla's autonomous driving ambitions, competition from China, and more.",youtube.com,https://www.youtube.com/watch?v=pQQrR_l3HWE,https://images.financialmodelingprep.com/news/tesla-doesnt-need-a-lowend-vehicle-to-continue-to-20241028.jpg
TSLA,2024-10-23,2024-10-16,2024-11-06,TSLA,,2024-10-28 08:46:20,2024-10-28T08:46:20-04:00,2024-10-28,3 Top Stocks It's Not Too Late to Buy Today,"Some investors are weary of buying into stocks when the S&P 500 index is trading near its all-time high and has also made new highs recently, but that doesn't mean all stocks are overpriced or not worth considering. Today's list of stocks will offer investors a chance to align their portfolios with the current scenarios playing out in the economy, or at least the expectations for the coming quarters.",marketbeat.com,https://www.marketbeat.com/originals/3-top-stocks-its-not-too-late-to-buy-today/,https://images.financialmodelingprep.com/news/3-top-stocks-its-not-too-late-to-buy-20241028.jpg
TSLA,2024-10-23,2024-10-16,2024-11-06,TSLA,,2024-10-28 09:18:26,2024-10-28T09:18:26-04:00,2024-10-28,Tesla To Rally Around 11%? Here Are 10 Top Analyst Forecasts For Monday,"Top Wall Street analysts changed their outlook on these top names. For a complete view of all analyst rating changes, including upgrades and downgrades, please see our analyst ratings page.",benzinga.com,https://www.benzinga.com/news/24/10/41575029/tesla-to-rally-around-11-here-are-10-top-analyst-forecasts-for-monday,https://images.financialmodelingprep.com/news/tesla-to-rally-around-11-here-are-10-top-20241028.jpg
TSLA,2024-10-23,2024-10-16,2024-11-06,TSLA,,2024-10-28 09:21:10,2024-10-28T09:21:10-04:00,2024-10-28,Tesla Shared Insightful Information With Nvidia Stock Investors,Tesla continues to push the boundaries of artificial intelligence with its deep knowledge of autonomous solutions.,fool.com,https://www.fool.com/investing/2024/10/28/tesla-shared-insightful-information-with-nvidia-st/,https://images.financialmodelingprep.com/news/tesla-shared-insightful-information-with-nvidia-stock-investors-20241028.jpg
TSLA,2024-10-23,2024-10-16,2024-11-06,TSLA,,2024-10-28 10:14:00,2024-10-28T10:14:00-04:00,2024-10-28,Tesla Earnings Are In: We Missed The Upgrade - Intra Quarter Trade,"Tesla stock is surging Thursday after the third quarter earnings call and its best quarter in over a year. We missed the upgrade. Tesla surged on second-consecutive gross margin expansion to 19.80%, lower cost of goods sold per vehicle, and Musk's 20-30% growth outlook for next year. We expect to see trouble on the Q4 report as better margins aren't expected to stick yet and Tesla is unlikely to hit its 2024 vehicle goals.",seekingalpha.com,https://seekingalpha.com/article/4730084-tesla-earnings-are-in-we-missed-the-upgrade-intra-quarter-trade,https://images.financialmodelingprep.com/news/tesla-earnings-are-in-we-missed-the-upgrade-intra-20241028.jpg
TSLA,2024-10-23,2024-10-16,2024-11-06,TSLA,,2024-10-28 10:28:56,2024-10-28T10:28:56-04:00,2024-10-28,Takeaways From Tesla's Q3: Interest Rate Tailwinds And Energy Expansion,"Tesla, Inc. remains profitable despite sector struggles, with plans to launch affordable vehicles in 2025 and expecting 20-30% vehicle sales growth. The company is reshaping its business model with a focus on autonomous ride-hailing and energy storage, driven by FSD and Megapack production. Lower interest rates and increased energy demand from tech firms could boost sales and prompt revenue estimate revisions, enhancing TSLA's growth prospects.",seekingalpha.com,https://seekingalpha.com/article/4730088-takeaways-from-tesla-q3-interest-rate-tailwinds-and-energy-expansion,https://images.financialmodelingprep.com/news/takeaways-from-teslas-q3-interest-rate-tailwinds-and-energy-20241028.jpg
TSLA,2024-10-23,2024-10-16,2024-11-06,TSLA,,2024-10-28 10:56:10,2024-10-28T10:56:10-04:00,2024-10-28,Tesla: Uncertain Return Profile At These Frothy Levels,"Tesla, Inc. has demonstrated its ability to remain an EV market leader, attributed to the lower COGS/ASPs and expanding profit margins in Q3 '24. Tesla management has also reiterated their mass-market model deliveries from H1 '25 onwards, with it likely to trigger higher volume sales as borrowing costs moderate. Even so, TSLA offers an uncertain return profile at a triple-digit FWD P/E, despite the promising long-term prospects in the EV/robotaxi/humanoid robot end markets.",seekingalpha.com,https://seekingalpha.com/article/4730098-tesla-uncertain-return-profile-at-these-frothy-levels,https://images.financialmodelingprep.com/news/tesla-uncertain-return-profile-at-these-frothy-levels-20241028.jpg
TSLA,2024-10-23,2024-10-16,2024-11-06,TSLA,,2024-10-28 11:45:22,2024-10-28T11:45:22-04:00,2024-10-28,"Tesla Stock Soars On Surprise Earnings Beat: Buy, Sell, Or Hold?","Tesla, Inc.'s stock has surged 26% in 2 days, after Q3 earnings beat consensus expectations, and management provided an optimistic vehicle growth outlook of 20-30% for next year. From a technical perspective, Tesla has broken out above a key resistance level, and looks primed for a momentum-driven run into the $300s going into year-end and 2025. Despite positive business momentum, TSLA's 5-year expected CAGR return has dropped to ~10%. And potential economic headwinds justify maintaining a “Hold” rating.",seekingalpha.com,https://seekingalpha.com/article/4730110-tesla-stock-soars-on-surprise-earnings-beat-buy-sell-or-hold,https://images.financialmodelingprep.com/news/tesla-stock-soars-on-surprise-earnings-beat-buy-sell-20241028.jpg
TSLA,2024-10-23,2024-10-16,2024-11-06,TSLA,,2024-10-28 12:45:00,2024-10-28T12:45:00-04:00,2024-10-28,"Tesla's robotaxi dreams will start small, these analysts say","Tesla has promised a fleet of Cybercabs by 2026 and millions of the robotaxis at some point in the future, but analysts at Deutsche Bank sought to temper expectations and map out how a Cybercab rollout could happen.",marketwatch.com,https://www.marketwatch.com/story/teslas-robotaxi-dreams-will-start-small-these-analysts-say-ee5a8e1a,https://images.financialmodelingprep.com/news/teslas-robotaxi-dreams-will-start-small-these-analysts-say-20241028.jpg
TSLA,2024-10-23,2024-10-16,2024-11-06,TSLA,,2024-10-28 12:53:27,2024-10-28T12:53:27-04:00,2024-10-28,Tesla: A Rare Opportunity Presents Itself (Rating Upgrade),"Tesla, Inc.'s Q3 2024 report and Robotaxi event provided enough insights and details to allow proper valuation of the segment. Most business segments are revised up in my intrinsic valuation, both in terms of growth and profitability. The energy segment shows exponential growth both in terms of sales and gross margins. This should be a core driver moving forward.",seekingalpha.com,https://seekingalpha.com/article/4730129-tesla-rare-opportunity-presents-itself-rating-upgrade,https://images.financialmodelingprep.com/news/tesla-a-rare-opportunity-presents-itself-rating-upgrade-20241028.jpg
TSLA,2024-10-23,2024-10-16,2024-11-06,TSLA,,2024-10-28 13:10:42,2024-10-28T13:10:42-04:00,2024-10-28,Tesla Outperforms In The Face Of Global Automotive Decline (Rating Upgrade),"Tesla, Inc.'s Q3 '24 earnings exceeded expectations with strong revenue growth and margin improvements, driven by energy generation & storage. Tesla may realize significant economies of scale through the release of its Cybercab and its low-cost models. Margins may compress in the near-term as the firm ramps up production. Tesla is nearing the completion of an entirely independent autonomous ecosystem driven by its internally developed AI.",seekingalpha.com,https://seekingalpha.com/article/4730136-tesla-outperforms-in-the-face-of-global-automotive-decline-rating-upgrade,https://images.financialmodelingprep.com/news/tesla-outperforms-in-the-face-of-global-automotive-decline-20241028.jpg
TSLA,2024-10-23,2024-10-16,2024-11-06,TSLA,,2024-10-28 14:20:12,2024-10-28T14:20:12-04:00,2024-10-28,Great News for Tesla Stock Investors,The company delivered fantastic quarterly financial results.,fool.com,https://www.fool.com/investing/2024/10/28/great-news-for-tesla-stock-investors/,https://images.financialmodelingprep.com/news/great-news-for-tesla-stock-investors-20241028.jpg
TSLA,2024-10-23,2024-10-16,2024-11-06,TSLA,,2024-10-28 15:34:00,2024-10-28T15:34:00-04:00,2024-10-28,KBRA Assigns Preliminary Ratings to Tesla Sustainable Energy Trust 2024-1,"NEW YORK--(BUSINESS WIRE)-- #creditratingagency--KBRA assigns preliminary ratings to three classes (five tranches) of notes totaling $500.00 million issued by Tesla Sustainable Energy Trust 2024-1 (""TSET 2024-1"" or the ""Issuer""), an ABS transaction secured by residental solar retail installment contracts (""RIC""). TSET 2024-1 represents the inaugural term ABS securitization collateralized by a pool of residential solar RICs originated by Tesla, Inc. (""Tesla"") and sold to Tesla Finance LLC (“Tesla Finance” or the “Com.",businesswire.com,https://www.businesswire.com/news/home/20241028321147/en/KBRA-Assigns-Preliminary-Ratings-to-Tesla-Sustainable-Energy-Trust-2024-1/,https://images.financialmodelingprep.com/news/kbra-assigns-preliminary-ratings-to-tesla-sustainable-energy-trust-20241028.jpg
TSLA,2024-10-23,2024-10-16,2024-11-06,TSLA,,2024-10-28 16:32:25,2024-10-28T16:32:25-04:00,2024-10-28,Elon Musk Is Making Tesla Great Again (Technical Analysis),"Tesla, Inc.'s technical analysis is overwhelmingly positive across all time frames, indicating strong bullish momentum and support levels, making it a buy. Despite modest Q3 earnings, CEO Elon Musk's 2025 growth estimates significantly boost Tesla's outlook, justifying its current valuation. The stock's P/E and P/S ratios are historically low for Tesla, making the valuation more reasonable given the projected growth.",seekingalpha.com,https://seekingalpha.com/article/4730193-elon-musk-is-making-tesla-great-again-technical-analysis,https://images.financialmodelingprep.com/news/elon-musk-is-making-tesla-great-again-technical-analysis-20241028.jpg
TSLA,2024-10-23,2024-10-16,2024-11-06,TSLA,,2024-10-28 18:16:22,2024-10-28T18:16:22-04:00,2024-10-28,5 Reasons to be Bullish Stocks in Q4,"Though stocks are enjoying a historically strong presidential election year, all signs suggest the bull market will continue into Q4. Stock Strategist Andrew Rocco explains.",zacks.com,https://www.zacks.com/commentary/2358987/5-reasons-to-be-bullish-stocks-in-q4?cid=CS-STOCKNEWSAPI-FT-investment_ideas-2358987,https://images.financialmodelingprep.com/news/5-reasons-to-be-bullish-stocks-in-q4-20241028.jpg
TSLA,2024-10-23,2024-10-16,2024-11-06,TSLA,,2024-10-28 20:30:16,2024-10-28T20:30:16-04:00,2024-10-28,Tesla: Dismantling the 2025 Bear Case (Debunking 5 Myths),"Tesla is one of the biggest battleground stocks on Wall Street. However, details from its third-quarter earnings report suggest that bears are on the wrong side of the trade.",zacks.com,https://www.zacks.com/commentary/2359146/tesla-dismantling-the-2025-bear-case-debunking-5-myths?cid=CS-STOCKNEWSAPI-FT-investment_ideas-2359146,https://images.financialmodelingprep.com/news/tesla-dismantling-the-2025-bear-case-debunking-5-myths-20241028.jpg
TSLA,2024-10-23,2024-10-16,2024-11-06,TSLA,,2024-10-29 04:44:00,2024-10-29T04:44:00-04:00,2024-10-29,Tesla's Profit Margins Soared. Here's Why That's Unlikely to Persist.,"The EV company is increasingly focusing on sales growth, which could leave profit margins at risk.",fool.com,https://www.fool.com/investing/2024/10/29/teslas-profit-margins-soared-heres-why-thats-unlik/,https://images.financialmodelingprep.com/news/teslas-profit-margins-soared-heres-why-thats-unlikely-to-20241029.jpg
TSLA,2024-10-23,2024-10-16,2024-11-06,TSLA,,2024-10-29 05:05:00,2024-10-29T05:05:00-04:00,2024-10-29,What's Going on With Tesla Stock?,A fantastic quarter has Tesla stock investors excited about the future.,fool.com,https://www.fool.com/investing/2024/10/29/whats-going-on-with-tesla-stock/,https://images.financialmodelingprep.com/news/whats-going-on-with-tesla-stock-20241029.jpg
TSLA,2024-10-23,2024-10-16,2024-11-06,TSLA,,2024-10-29 05:26:00,2024-10-29T05:26:00-04:00,2024-10-29,Tesla's Growth to Come From 'Multiple New Models'. The Stock Is Down.,Investors are still mulling over what Tesla CEO Elon Musk's recent growth comments about 2025 mean for shares of the EV maker.,barrons.com,https://www.barrons.com/articles/teslas-stock-price-new-models-e5c49141,https://images.financialmodelingprep.com/news/teslas-growth-to-come-from-multiple-new-models-the-20241029.jpg
TSLA,2024-10-23,2024-10-16,2024-11-06,TSLA,,2024-10-29 05:41:34,2024-10-29T05:41:34-04:00,2024-10-29,"The Zacks Analyst Blog Meta, Tesla, Thermo Fisher Scientific and Food Comes From","Meta, Tesla, Thermo Fisher Scientific and Food Comes From are included in this Analyst Blog.",zacks.com,https://www.zacks.com/stock/news/2359173/the-zacks-analyst-blog-meta-tesla-thermo-fisher-scientific-and-food-comes-from?cid=CS-STOCKNEWSAPI-FT-press_releases-2359173,https://images.financialmodelingprep.com/news/the-zacks-analyst-blog-meta-tesla-thermo-fisher-scientific-20241029.jpg
TSLA,2024-10-23,2024-10-16,2024-11-06,TSLA,,2024-10-29 06:15:00,2024-10-29T06:15:00-04:00,2024-10-29,Did Tesla Just Turn the Profit Corner?,"In retrospect, last year's misery may have been worth it.",fool.com,https://www.fool.com/investing/2024/10/29/did-tesla-just-turn-the-profit-corner/,https://images.financialmodelingprep.com/news/did-tesla-just-turn-the-profit-corner-20241029.jpg
TSLA,2024-10-23,2024-10-16,2024-11-06,TSLA,,2024-10-29 07:25:00,2024-10-29T07:25:00-04:00,2024-10-29,"Tesla, Inc. Investigation Ongoing: Contact Levi & Korsinsky to Discuss Your Rights - TSLA","NEW YORK, NY / ACCESSWIRE / October 29, 2024 / Levi & Korsinsky notifies investors that it has commenced an investigation of Tesla, Inc. (""Tesla, Inc."") (NASDAQ:TSLA) concerning possible violations of federal securities laws. On October 10, 2024, Tesla unveiled the Company's Cybercab self-driving concept car at the Company's ""We, Robot"" event and announced plans to create a fleet of autonomous vehicles and robots, with the goal of starting production before 2027.",accesswire.com,https://www.accesswire.com/936515/tesla-inc-investigation-ongoing-contact-levi-korsinsky-to-discuss-your-rights--tsla,https://images.financialmodelingprep.com/news/tesla-inc-investigation-ongoing-contact-levi-korsinsky-to-discuss-20241029.jpg
TSLA,2024-10-23,2024-10-16,2024-11-06,TSLA,,2024-10-29 08:33:30,2024-10-29T08:33:30-04:00,2024-10-29,Monster Tesla insider trading alert for 2025,"Major insider stock sales, particularly those executed near highs not seen in some time, tend to unnerve investors, though they are generally pre-planned to ensure compliance with regulatory rules and guidelines and mostly not reflective of short-term dynamics or expectations.",finbold.com,https://finbold.com/monster-tesla-insider-trading-alert-for-2025/,https://images.financialmodelingprep.com/news/monster-tesla-insider-trading-alert-for-2025-20241029.jpg
TSLA,2024-10-23,2024-10-16,2024-11-06,TSLA,,2024-10-29 09:00:00,2024-10-29T09:00:00-04:00,2024-10-29,Tesla: Rally Is Just Beginning (Rating Upgrade),"Tesla, Inc.'s stock initially plunged post-robotaxi event, but rebounded strongly due to impressive Q3 earnings and improved margins, gaining 26.2% over two sessions. Q3 highlights: Adjusted EPS of $0.72 beat estimates by 24.14%, net income rose 17.3%, and gross profit surged 20% annually. Despite high forward valuation metrics, Tesla's recent price movements suggest market confidence, breaking long-term downtrend lines and establishing higher lows since January 2023.",seekingalpha.com,https://seekingalpha.com/article/4730173-tesla-rally-is-just-beginning-rating-upgrade,https://images.financialmodelingprep.com/news/tesla-rally-is-just-beginning-rating-upgrade-20241029.jpg
TSLA,2024-10-23,2024-10-16,2024-11-06,TSLA,,2024-10-29 10:05:23,2024-10-29T10:05:23-04:00,2024-10-29,"Tesla, Inc. (TSLA) Is a Trending Stock: Facts to Know Before Betting on It","Tesla (TSLA) has received quite a bit of attention from Zacks.com users lately. Therefore, it is wise to be aware of the facts that can impact the stock's prospects.",zacks.com,https://www.zacks.com/stock/news/2359338/tesla-inc-tsla-is-a-trending-stock-facts-to-know-before-betting-on-it?cid=CS-STOCKNEWSAPI-FT-tale_of_the_tape|most_searched_stocks-2359338,https://images.financialmodelingprep.com/news/tesla-inc-tsla-is-a-trending-stock-facts-to-20241029.jpg
TSLA,2024-10-23,2024-10-16,2024-11-06,TSLA,,2024-10-29 10:11:00,2024-10-29T10:11:00-04:00,2024-10-29,Tesla Stock: Margins Bounce Back For This AI Leader,"Q3 saw Tesla report sequential growth for both production and deliveries after a weak Q1, where deliveries dropped below 400,000 for the first time since late 2022. CEO Elon Musk stated that the automaker is shooting for “20% to 30% vehicle growth next year,” or roughly at least 2.1 million vehicles assuming TSLA ends 2024 at around 1.75 million. From Q4 2023 to Q2 2024, ASPs were relatively unchanged while production costs rose 3.7%, denting both automotive margins and impacting profitability.",seekingalpha.com,https://seekingalpha.com/article/4730381-tesla-stock-margins-bounce-back-for-this-ai-leader,https://images.financialmodelingprep.com/news/tesla-stock-margins-bounce-back-for-this-ai-leader-20241029.jpg
TSLA,2024-10-23,2024-10-16,2024-11-06,TSLA,,2024-10-29 10:33:42,2024-10-29T10:33:42-04:00,2024-10-29,Tesla: Set To Have Its iPhone Moment,"Electric vehicles are likely at or entering the early acceleration phase of the S-curve, which means that EV adoption can accelerate from here. Price parity with ICE vehicles is expected to be reached by 2027, and robotaxis will provide low-cost-per-mile transportation and generate revenue for owners. This will accelerate the transition to EVs. Tesla may face regulatory issues regarding its robotaxi ambitions. However, Google's Waymo is paving the regulatory path for Tesla, which can make things a bit easier.",seekingalpha.com,https://seekingalpha.com/article/4730387-tesla-set-to-have-its-iphone-moment,https://images.financialmodelingprep.com/news/tesla-set-to-have-its-iphone-moment-20241029.jpg
TSLA,2024-10-23,2024-10-16,2024-11-06,TSLA,,2024-10-29 11:18:32,2024-10-29T11:18:32-04:00,2024-10-29,Tesla: Early Signs Of Growth Inflection Raise Questions About Sustainability,"Tesla, Inc.'s stock surged over 25% post-3Q FY2024 earnings, driven by early signs of inflections in margins, EPS growth, and delivery growth. Tesla's Q3 revenue fell short of consensus expectations, driven by disappointing deliveries, despite achieving its second-highest regulatory credit revenue. The company achieved 105% QoQ in FCF in 3Q despite a significant increase in capex.",seekingalpha.com,https://seekingalpha.com/article/4730406-tesla-early-signs-of-growth-inflection-raise-questions-about-sustainability,https://images.financialmodelingprep.com/news/tesla-early-signs-of-growth-inflection-raise-questions-about-20241029.jpg
TSLA,2024-10-23,2024-10-16,2024-11-06,TSLA,,2024-10-29 11:54:29,2024-10-29T11:54:29-04:00,2024-10-29,How Elon Musk Might Use His Pull With Trump to Help Tesla,"Although Donald Trump has opposed policies that favor electric cars, if he becomes president he could ease regulatory scrutiny of Tesla or protect lucrative credits and subsidies.",nytimes.com,https://www.nytimes.com/2024/10/29/business/economy/elon-musk-trump-tesla.html,https://images.financialmodelingprep.com/news/how-elon-musk-might-use-his-pull-with-trump-20241029.jpg
TSLA,2024-10-23,2024-10-16,2024-11-06,TSLA,,2024-10-29 12:05:54,2024-10-29T12:05:54-04:00,2024-10-29,Should You Buy Tesla ETFs After the Robotaxi Letdown?,"Tesla (NASDAQ:TSLA) stock has been a truly incredible thing to watch, at least over the course of the past few weeks.",247wallst.com,https://247wallst.com/investing/2024/10/29/should-you-buy-tesla-etfs-after-the-robotaxi-letdown/,https://images.financialmodelingprep.com/news/should-you-buy-tesla-etfs-after-the-robotaxi-letdown-20241029.jpg
TSLA,2024-10-23,2024-10-16,2024-11-06,TSLA,,2024-10-29 12:20:19,2024-10-29T12:20:19-04:00,2024-10-29,Elon Musk shares bold prediction on humanoid robots that could make Tesla a ‘$25T company',"The Optimus robot is the humanoid robot under development by Tesla and could multiply the company's valuation, according to Musk.",nypost.com,https://nypost.com/2024/10/29/business/elon-musk-predicts-10-billion-humanoid-robots-in-use-by-2040/,https://images.financialmodelingprep.com/news/elon-musk-shares-bold-prediction-on-humanoid-robots-that-20241029.jpg
TSLA,2024-10-23,2024-10-16,2024-11-06,TSLA,,2024-10-29 12:31:31,2024-10-29T12:31:31-04:00,2024-10-29,Tesla Extends 0% Loans In China: Will It Help Hit 1.81 Million Vehicles In 2024?,Electric vehicle leader Tesla Inc TSLA could be betting on 0% interest loans to help boost its delivery figures in China for the fourth quarter as analysts see 2024 deliveries of 1.8 million hittable.,benzinga.com,https://www.benzinga.com/markets/asia/24/10/41605537/tesla-extends-0-loans-in-china-will-it-help-hit-1-81-million-vehicles-in-2024,https://images.financialmodelingprep.com/news/tesla-extends-0-loans-in-china-will-it-help-20241029.jpg
TSLA,2024-10-23,2024-10-16,2024-11-06,TSLA,,2024-10-29 13:35:28,2024-10-29T13:35:28-04:00,2024-10-29,Tesla: Finally More Than Just A Car Company,"Tesla, Inc.'s vision includes Robotaxis, Optimus, Dojo & AI, with positive synergies, but Elon Musk's political activism is becoming a significant risk factor. Q3 earnings show automotive margins under pressure, but energy and service sectors are strengthening. Tesla may continue sacrificing margins to outcompete rivals, aiming for long-term market share gains.",seekingalpha.com,https://seekingalpha.com/article/4730489-tesla-finally-more-than-just-a-car-company,https://images.financialmodelingprep.com/news/tesla-finally-more-than-just-a-car-company-20241029.jpg
