ticker,event_date,window_start,window_end,symbol,symbols,publishedDate,publishedDateET,date_et,title,text,site,url,image
JPM,2024-01-12,2023-12-29,2024-01-26,JPM,,2024-01-15 06:41:00,2024-01-15T06:41:00-05:00,2024-01-15,JPMorgan Chase's Moat Revealed: What Investors Can Learn From the Banking Giant,JPMorgan Chase posted record earnings during 2024. The bank benefitted from higher interest rates and its acquisition of First Republic's assets and deposits.,fool.com,https://www.fool.com/investing/2024/01/15/jpmorgan-chases-moat-revealed-what-investors-can-l/,https://images.financialmodelingprep.com/news/jpmorgan-chases-moat-revealed-what-investors-can-learn-from-20240115.jpg
JPM,2024-01-12,2023-12-29,2024-01-26,JPM,,2024-01-15 08:23:00,2024-01-15T08:23:00-05:00,2024-01-15,S&P 500 forecast for end of 2024,"Last year, and its final quarter in particular, saw remarkable growth both on the stock market and with numerous cryptocurrencies.",finbold.com,https://finbold.com/sp-500-forecast-for-end-of-2024/?utm_source=snapi,https://images.financialmodelingprep.com/news/sp-500-forecast-for-end-of-2024-20240115.jpg
JPM,2024-01-12,2023-12-29,2024-01-26,JPM,,2024-01-15 09:01:10,2024-01-15T09:01:10-05:00,2024-01-15,5 Best Inverse/Leveraged ETFs of Last Week,"Overall, Wall Street concluded the week with a mixed performance, with bank earnings falling short of expectations.",zacks.com,https://www.zacks.com/stock/news/2209997/5-best-inverse-leveraged-etfs-of-last-week,https://images.financialmodelingprep.com/news/5-best-inverseleveraged-etfs-of-last-week-20240115.jpg
JPM,2024-01-12,2023-12-29,2024-01-26,JPM,,2024-01-15 18:23:12,2024-01-15T18:23:12-05:00,2024-01-15,Need to Rebalance Your Portfolio? Add These 3 Defensive Stocks NOW,"For investors banking on some volatility in 2024, now may be a good time to consider rebalancing one's portfolio. After all, the beginning of the year is often the time many investors consider the balance of their portfolios.",investorplace.com,https://investorplace.com/2024/01/need-to-rebalance-your-portfolio-add-these-3-defensive-stocks-now/,https://images.financialmodelingprep.com/news/need-to-rebalance-your-portfolio-add-these-3-defensive-20240115.png
JPM,2024-01-12,2023-12-29,2024-01-26,JPM,,2024-01-16 01:52:52,2024-01-16T01:52:52-05:00,2024-01-16,JPMorgan says India is its No. 1 market in Asia; investors are unlikely to return to China this year,"India is JPMorgan's top pick in Asia, and one of its favorite markets globally, according to the investment bank's Asian Equity Strategist Mixo Das.",cnbc.com,https://www.cnbc.com/2024/01/16/jpmorgan-says-india-is-its-no-1-market-in-asia-and-a-favorite-globally.html,https://images.financialmodelingprep.com/news/jpmorgan-says-india-is-its-no-1-market-in-20240116.jpeg
JPM,2024-01-12,2023-12-29,2024-01-26,JPM,,2024-01-16 06:05:17,2024-01-16T06:05:17-05:00,2024-01-16,Big US banks to call on Fed to rewrite contentious bank capital rule,"Banks on Tuesday will urge the U.S. Federal Reserve to completely overhaul a draft rule hiking bank capital, in the latest leg of Wall Street's effort to water down the Basel Endgame proposal that bankers say will hurt the economy.",reuters.com,https://www.reuters.com/business/finance/big-us-banks-call-fed-rewrite-contentious-bank-capital-rule-2024-01-16/,https://images.financialmodelingprep.com/news/big-us-banks-to-call-on-fed-to-rewrite-20240116.jpg
JPM,2024-01-12,2023-12-29,2024-01-26,JPM,,2024-01-16 08:19:20,2024-01-16T08:19:20-05:00,2024-01-16,Banking stocks' financial results this earnings season: the scars of 2023,"This afternoon (or morning if you're in the States), Morgan Stanley and Goldman Sachs posted their financial results for the 2023 FY. The other financial services titans like JPMorgan, Citigroup and Wells Fargo all reported theirs last Friday.",invezz.com,https://invezz.com/news/2024/01/16/banks-results-this-earnings-season-the-scars-of-2023/?utm_source=snapi,https://images.financialmodelingprep.com/news/banking-stocks-financial-results-this-earnings-season-the-scars-20240116.jpg
JPM,2024-01-12,2023-12-29,2024-01-26,JPM,,2024-01-16 09:23:00,2024-01-16T09:23:00-05:00,2024-01-16,SEC fines JPM Morgan Chase for whistle-blowing violation charge,JPMorgan Chase & Co. has agreed to pay an $18 million fine without admitting or denying charges by the U.S. Securities and Exchange Commission that it violated whistleblower protection rules with its confidentiality agreements during a three-year period.,marketwatch.com,https://www.marketwatch.com/story/sec-fines-jpm-morgan-chase-for-whistle-blowing-violation-charge-57f1ceac,https://images.financialmodelingprep.com/news/sec-fines-jpm-morgan-chase-for-whistleblowing-violation-charge-20240116.jpg
JPM,2024-01-12,2023-12-29,2024-01-26,JPM,,2024-01-16 11:12:02,2024-01-16T11:12:02-05:00,2024-01-16,Three of 'Big Six' U.S. banks tap bond market post-earnings,"Three of the six largest U.S. banks announced new bond issues on Tuesday, kicking off an expected heavy week for new bank debt.",reuters.com,https://www.reuters.com/markets/rates-bonds/three-big-six-us-banks-tap-bond-market-post-earnings-2024-01-16/,https://images.financialmodelingprep.com/news/three-of-big-six-us-banks-tap-bond-market-20240116.jpg
JPM,2024-01-12,2023-12-29,2024-01-26,JPM,,2024-01-16 11:42:00,2024-01-16T11:42:00-05:00,2024-01-16,J.P. Morgan Releases 2024 Alternatives Outlook: Navigating a Shifting Investment Landscape,"Research explores opportunities in Multi-Alternatives Strategies, Core Private Infrastructure, Private Equity and Commercial Real Estate NEW YORK , Jan. 16, 2024 /PRNewswire/ -- J.P. Morgan today released its 2024 outlook for the alternative investment landscape.",prnewswire.com,https://www.prnewswire.com/news-releases/jp-morgan-releases-2024-alternatives-outlook-navigating-a-shifting-investment-landscape-302036012.html,https://images.financialmodelingprep.com/news/jp-morgan-releases-2024-alternatives-outlook-navigating-a-shifting-20240116.jpg
JPM,2024-01-12,2023-12-29,2024-01-26,JPM,,2024-01-16 12:25:39,2024-01-16T12:25:39-05:00,2024-01-16,JPMorgan Settles SEC Charges Its Contracts Violated Whistleblower Law,JPMorgan Chase (JPM) settled charges with the Securities and Exchange Commission (SEC) Tuesday over allegations it impeded hundreds of advisory clients and brokerage customers from reporting potential violations of securities law.,investopedia.com,https://www.investopedia.com/jpmorgan-settles-sec-charges-its-contracts-violated-whistleblower-law-8426746,https://images.financialmodelingprep.com/news/jpmorgan-settles-sec-charges-its-contracts-violated-whistleblower-law-20240116.jpg
JPM,2024-01-12,2023-12-29,2024-01-26,JPM,,2024-01-16 15:13:51,2024-01-16T15:13:51-05:00,2024-01-16,US banks show improved earnings visibility in 4Q,"US bank earnings, with more than $1 trillion in market capital reported on the first day of the fourth quarter earnings season alone, support the view of Bank of America analysts for a continued re-rating higher of bank stocks. In a note to clients following the release of the latest financial reports from JPMorgan Chase & Co (NYSE:JPM), Citigroup Inc (NYSE:C), Wells Fargo & Company (NYSE:WFC) and Bank of New York Mellon Corp (NYSE:BK, ETR:BN9) on Friday, the analysts noted that their view was supported by improving earnings per share (EPS) visibility and the US economy avoiding a hard landing.",proactiveinvestors.com,https://www.proactiveinvestors.com/companies/news/1038552?SNAPI,https://images.financialmodelingprep.com/news/us-banks-show-improved-earnings-visibility-in-4q-20240116.jpg
JPM,2024-01-12,2023-12-29,2024-01-26,JPM,,2024-01-16 17:15:00,2024-01-16T17:15:00-05:00,2024-01-16,JPMorgan Chase Elects Mark Weinberger to its Board of Directors,"NEW YORK--(BUSINESS WIRE)--JPMorgan Chase (NYSE: JPM) announced today that Mark Weinberger, 62, has been elected to its Board of Directors, effective immediately. He will also serve as a member of the Board's Audit Committee. Mr. Weinberger was Global Chairman and Chief Executive Officer of Ernst & Young (EY) from 2013 to 2019. During his tenure, he led the global professional services organization through a purpose-driven transformation across more than 150 countries to deliver on EY's mis.",businesswire.com,https://www.businesswire.com/news/home/20240116602140/en/JPMorgan-Chase-Elects-Mark-Weinberger-to-its-Board-of-Directors/,https://images.financialmodelingprep.com/news/jpmorgan-chase-elects-mark-weinberger-to-its-board-of-20240116.jpg
JPM,2024-01-12,2023-12-29,2024-01-26,JPM,,2024-01-16 18:00:00,2024-01-16T18:00:00-05:00,2024-01-16,3 Reasons To Consider Selling Covered Calls On JPMorgan Chase,"There are big risks for JPMorgan, especially if the past examples of yield curve inversion come to pass even remotely. A return to the 200-day moving average is the best-case scenario for JPMorgan Chase. Investors may consider longer-dated covered calls to create some defense while matching best case upside for the stock.",seekingalpha.com,https://seekingalpha.com/article/4662784-3-reasons-to-consider-selling-covered-calls-on-jpmorgan-chase,https://images.financialmodelingprep.com/news/3-reasons-to-consider-selling-covered-calls-on-jpmorgan-20240116.jpg
JPM,2024-01-12,2023-12-29,2024-01-26,JPM,,2024-01-16 18:42:36,2024-01-16T18:42:36-05:00,2024-01-16,3 Top-Rated S&P 500 Stocks Wall Street Analysts Are Loving Now: January 2024,"Although markets have gotten off to a difficult start, Wall Street analysts continue to love and recommend several stocks to investors. Some of these highly praised stocks are mega-cap technology concerns and companies associated with artificial intelligence (AI).",investorplace.com,https://investorplace.com/2024/01/3-top-rated-sp-500-stocks-wall-street-analysts-are-loving-now-january-2024/,https://images.financialmodelingprep.com/news/3-toprated-sp-500-stocks-wall-street-analysts-are-20240116.png
JPM,2024-01-12,2023-12-29,2024-01-26,JPM,,2024-01-17 05:06:00,2024-01-17T05:06:00-05:00,2024-01-17,"3 Dow Stocks With 40% to 45% Upside in 2024, According to Select Wall Street Analysts","The Dow Jones Industrial Average has served as a barometer of Wall Street's health since the late 1800s. Though most Dow stocks are slow-growing, some may still offer abundant upside.",fool.com,https://www.fool.com/investing/2024/01/17/3-dow-stocks-40-to-45-upside-in-2024-wall-street/,https://images.financialmodelingprep.com/news/3-dow-stocks-with-40-to-45-upside-in-20240117.jpg
JPM,2024-01-12,2023-12-29,2024-01-26,JPM,,2024-01-17 07:35:00,2024-01-17T07:35:00-05:00,2024-01-17,"I Am Grabbing These CD-Equivalents Before The Opportunity Disappears, Yields +5.5%",Are you planning to rush into CDs and money market funds to lock in yields before the Fed cuts rates? Wake up and see the inflation-adjusted returns of these so-called guaranteed 5% yields. We discuss lower-risk preferred securities that offer better yields and significant capital upside.,seekingalpha.com,https://seekingalpha.com/article/4662873-i-am-grabbing-these-cd-equivalents-before-the-opportunity-disappears-yields-plus-5-5-percent,https://images.financialmodelingprep.com/news/i-am-grabbing-these-cdequivalents-before-the-opportunity-disappears-20240117.jpg
JPM,2024-01-12,2023-12-29,2024-01-26,JPM,,2024-01-17 08:58:13,2024-01-17T08:58:13-05:00,2024-01-17,Jamie Dimon warns 'all these very powerful forces' will impact U.S. economy in 2024 and 2025,"Dimon has remained cautious over the past few years, despite record profits at JPMorgan Chase and a U.S. economy that has defied expectations.",cnbc.com,https://www.cnbc.com/2024/01/17/jamie-dimon-warns-on-us-economy-in-2024-2025.html,https://images.financialmodelingprep.com/news/jamie-dimon-warns-all-these-very-powerful-forces-will-20240117.jpg
JPM,2024-01-12,2023-12-29,2024-01-26,JPM,,2024-01-17 11:39:00,2024-01-17T11:39:00-05:00,2024-01-17,Jamie Dimon still sees no value in bitcoin after ETFs debut: ‘please stop talking about this s___',"Jamie Dimon, chief executive at JPMorgan Chase & Co. JPM, +0.11%, said he still sees no value in bitcoin and is done with talking about the crypto, after the first several bitcoin exchange traded funds debuted in the U.S. last week.",marketwatch.com,https://www.marketwatch.com/story/jamie-dimon-still-sees-no-value-in-bitcoin-after-etfs-debut-please-stop-talking-about-this-s-949b7c54,https://images.financialmodelingprep.com/news/jamie-dimon-still-sees-no-value-in-bitcoin-after-20240117.jpg
JPM,2024-01-12,2023-12-29,2024-01-26,JPM,,2024-01-17 12:05:00,2024-01-17T12:05:00-05:00,2024-01-17,Jamie Dimon says ‘it's a mistake to assume everything is hunky-dory',"JPMorgan Chase & Co. Chief Executive Jamie Dimon said Wednesday he remains cautious in the face of “powerful forces” ranging from war to fiscal policy, despite growing consensus that there will be a soft landing for the U.S. economy.",marketwatch.com,https://www.marketwatch.com/story/jamie-dimon-says-its-a-mistake-to-assume-everything-is-hunky-dory-3737d15d,https://images.financialmodelingprep.com/news/jamie-dimon-says-its-a-mistake-to-assume-everything-20240117.jpg
JPM,2024-01-12,2023-12-29,2024-01-26,JPM,,2024-01-17 19:51:05,2024-01-17T19:51:05-05:00,2024-01-17,Q4 Earnings Season Kicks Off Positively,"Note: The following is an excerpt from this week's Earnings Trends report. You can access the full report that contains detailed historical actual and estimates for the current and following periods, please click here>>>",zacks.com,https://www.zacks.com/commentary/2211799/q4-earnings-season-kicks-off-positively?cid=CS-STOCKNEWSAPI-FT-earnings_outlook-2211799,https://images.financialmodelingprep.com/news/q4-earnings-season-kicks-off-positively-20240117.jpg
JPM,2024-01-12,2023-12-29,2024-01-26,JPM,,2024-01-18 14:17:40,2024-01-18T14:17:40-05:00,2024-01-18,7 Must-Have Stocks for Serious Wealth Accumulation,"Certain stocks stand out as stalwarts in finance and commerce, charting a course toward serious wealth accumulation. The strategies of these seven companies reveal a tapestry of edgy leadership.",investorplace.com,https://investorplace.com/2024/01/7-must-have-stocks-for-serious-wealth-accumulation/,https://images.financialmodelingprep.com/news/7-musthave-stocks-for-serious-wealth-accumulation-20240118.jpg
JPM,2024-01-12,2023-12-29,2024-01-26,JPM,,2024-01-18 16:23:12,2024-01-18T16:23:12-05:00,2024-01-18,JPMorgan CEO Jamie Dimon's pay rises 4% for 2023,"JPMorgan Chase CEO Jamie Dimon's compensation climbed about 4.3% to $36 million for 2023, the bank said on Thursday.",reuters.com,https://www.reuters.com/business/finance/jpmorgan-ceo-jamie-dimons-pay-rises-4-2023-2024-01-18/,https://images.financialmodelingprep.com/news/jpmorgan-ceo-jamie-dimons-pay-rises-4-for-2023-20240118.jpg
JPM,2024-01-12,2023-12-29,2024-01-26,JPM,,2024-01-18 17:20:22,2024-01-18T17:20:22-05:00,2024-01-18,Jamie Dimon gets $36 million in compensation after historic year for JPMorgan,JPMorgan Chase reported the largest annual profit of any US bank ever in 2023. The bank's board increased CEO Jamie Dimon's pay by 4% to $36 million.,businessinsider.com,https://www.businessinsider.com/how-much-is-jamie-dimon-jpmorgan-chase-ceo-paid-2024-1,https://images.financialmodelingprep.com/news/jamie-dimon-gets-36-million-in-compensation-after-historic-20240118.jpg
JPM,2024-01-12,2023-12-29,2024-01-26,JPM,,2024-01-19 03:47:25,2024-01-19T03:47:25-05:00,2024-01-19,JPMorgan Chase's Jamie Dimon nets $36m in pay and bonuses,"JPMorgan Chase & Co (NYSE:JPM)'s Jamie Dimon was paid $36 million last year, a 4% rise.  The compensation package included a $1.5 million base salary and a substantial bonus, primarily in stock, and was reward for another stellar year for the US bank, which booked a record profit of almost $50bn last year.",proactiveinvestors.com,https://www.proactiveinvestors.co.uk/companies/news/1038888?SNAPI,https://images.financialmodelingprep.com/news/jpmorgan-chases-jamie-dimon-nets-36m-in-pay-and-20240119.jpg
JPM,2024-01-12,2023-12-29,2024-01-26,JPM,,2024-01-19 08:00:23,2024-01-19T08:00:23-05:00,2024-01-19,"With Solid Profits, Citigroup Is Righting the Ship","Financials sector earnings have been mixed so far. Decent numbers were reported by JPMorgan Chase & Co. (JPM, Financial), while Bank of America Corp. (BAC, Financial), Wells Fargo & Co. (WFC, Financial) and Citigroup Inc. (C, Financial) dealt with their own issues.",gurufocus.com,https://www.gurufocus.com/news/2153389/with-solid-profits-citigroup-is-righting-the-ship,https://images.financialmodelingprep.com/news/with-solid-profits-citigroup-is-righting-the-ship-20240119.jpg
JPM,2024-01-12,2023-12-29,2024-01-26,JPM,,2024-01-19 08:02:00,2024-01-19T08:02:00-05:00,2024-01-19,Jamie Dimon gets $1.5M raise and heaps of praise after JPMorgan Chase's record profit,JPMorgan Chase & Co. is giving Chief Executive Jamie Dimon a $1.5 million base salary raise for his “continued exemplary leadership” of the biggest bank in the United States.,marketwatch.com,https://www.marketwatch.com/story/jamie-dimon-gets-1-5m-raise-and-heaps-of-praise-after-jpmorgan-chases-record-profit-ebfca436,https://images.financialmodelingprep.com/news/jamie-dimon-gets-15m-raise-and-heaps-of-praise-20240119.jpg
JPM,2024-01-12,2023-12-29,2024-01-26,JPM,,2024-01-19 10:00:22,2024-01-19T10:00:22-05:00,2024-01-19,JPMorgan Chase & Co. (JPM) Is a Trending Stock: Facts to Know Before Betting on It,"Recently, Zacks.com users have been paying close attention to JPMorgan Chase & Co. (JPM). This makes it worthwhile to examine what the stock has in store.",zacks.com,https://www.zacks.com/stock/news/2212725/jpmorgan-chase-co-jpm-is-a-trending-stock-facts-to-know-before-betting-on-it?cid=CS-STOCKNEWSAPI-FT-tale_of_the_tape|most_searched_stocks-2212725,https://images.financialmodelingprep.com/news/jpmorgan-chase-co-jpm-is-a-trending-stock-facts-20240119.jpg
JPM,2024-01-12,2023-12-29,2024-01-26,JPM,,2024-01-19 12:01:34,2024-01-19T12:01:34-05:00,2024-01-19,JPMorgan Chase: Consider Buying With A Downward Forecast,JPMorgan Chase & Co. released guidance for the coming fiscal year projecting a quarterly downtrend in results. JPMorgan is a leader in the industry and has experienced significant growth over the past decade. The diversification and profitability point to a likely industry out-performance in the future.,seekingalpha.com,https://seekingalpha.com/article/4663774-jpmorgan-chase-consider-buying-with-a-downward-forecast,https://images.financialmodelingprep.com/news/jpmorgan-chase-consider-buying-with-a-downward-forecast-20240119.jpg
JPM,2024-01-12,2023-12-29,2024-01-26,JPM,,2024-01-19 12:07:37,2024-01-19T12:07:37-05:00,2024-01-19,"JPMorgan CEO Jamie Dimon gets $36M pay package, 4.3% raise in 2023","JPMorgan's board awarded chief executive Jamie Dimon a 4.3% raise in 2023, lifting his annual pay to $36 million after the bank posted record profits for the fiscal year. The board granted Dimon a $1.5 million salary and $34.5 million of performance-based incentive compensation, according to a regulatory filing Thursday reviewed by Bloomberg.",nypost.com,https://nypost.com/2024/01/19/business/jpmorgan-boss-jamie-dimon-gets-36-million-pay-package-in-2023/,https://images.financialmodelingprep.com/news/jpmorgan-ceo-jamie-dimon-gets-36m-pay-package-43-20240119.jpg
JPM,2024-01-12,2023-12-29,2024-01-26,JPM,,2024-01-20 09:00:00,2024-01-20T09:00:00-05:00,2024-01-20,Our Top 10 Dividend Growth Stocks - January 2024,This article focuses on selecting high-growth dividend stocks that have rapidly grown their dividends in the recent past rather than simply sport a high current yield. We use our proprietary models to rate quantitatively and qualitatively and select the top ten names from an initial list of nearly 400 dividend stocks. The article provides criteria for selecting high-growth dividend stocks. It offers a step-by-step guide on structuring a portfolio based on this strategy.,seekingalpha.com,https://seekingalpha.com/article/4663329-our-top-10-dividend-growth-stocks-january-2024,https://images.financialmodelingprep.com/news/our-top-10-dividend-growth-stocks-january-2024-20240120.jpg
JPM,2024-01-12,2023-12-29,2024-01-26,JPM,,2024-01-21 07:07:00,2024-01-21T07:07:00-05:00,2024-01-21,Comparing 3 Magnificent Bank Stocks: 1 Is the Best Buy Now,"These are three of the best-run banks in the world, but one stands a little apart as the best buy.",fool.com,https://www.fool.com/investing/2024/01/21/comparing-3-magnificent-bank-stocks-1-is-the-best/,https://images.financialmodelingprep.com/news/comparing-3-magnificent-bank-stocks-1-is-the-best-20240121.jpg
JPM,2024-01-12,2023-12-29,2024-01-26,JPM,,2024-01-21 08:14:59,2024-01-21T08:14:59-05:00,2024-01-21,2 Ideal Barron's/Fortune New-Year 2024 Dividend Buys,"Barron's 10 favorite Stocks for 2024 came-out 1/17/24. Their New-Year Roundtable, published 1/11/24, listed 8 stocks of note for 2024 and mentioned 15 more. Fortune published their 13 inflation-proof list. Barron's interviews of eleven financial industry Roundtable pros tapped 8 predictions with 15 stocks mentioned. Three stocks made more than one list: Microsoft, Nvidia, Google. Nevertheless, the combined Barron's/Fortune list tracked-by YCharts as of 1/17/24 projected ten-top analyst-estimated net-gains from WTFC, PEP, JPM, ORCL, NVDA, GOLD, KMI, CVX, XOM and topped-by BABA ranging 14% to 70%.",seekingalpha.com,https://seekingalpha.com/article/4664038-2-ideal-barronsfortune-new-year-2024-dividend-buys,https://images.financialmodelingprep.com/news/2-ideal-barronsfortune-newyear-2024-dividend-buys-20240121.jpg
JPM,2024-01-12,2023-12-29,2024-01-26,JPM,,2024-01-22 07:31:06,2024-01-22T07:31:06-05:00,2024-01-22,3 undervalued stocks: Is now the right time to buy?,"For savvy investors, hunting down undervalued stocks can mean unearthing overlooked stocks with big potential. In any market cycle, undervalued stocks are there, waiting to be scooped up at bargain prices, but they tend to get even less attention in a bull market, as we saw in 2023.",marketbeat.com,https://www.marketbeat.com/originals/3-undervalued-stocks-is-now-the-right-time-to-buy/?utm_source=snapi,https://images.financialmodelingprep.com/news/3-undervalued-stocks-is-now-the-right-time-to-20240122.jpg
JPM,2024-01-12,2023-12-29,2024-01-26,JPM,,2024-01-22 08:00:38,2024-01-22T08:00:38-05:00,2024-01-22,9 Stocks Powered 40% Of The S&P 500's Surge To A New High,The S&P 500's most recent surge to an all-time high is good news for investors. But just a few stocks drove almost half of the rally.,investors.com,https://www.investors.com/etfs-and-funds/sectors/sp500-stocks-powered-40-percent-of-surge-to-a-new-high/,https://images.financialmodelingprep.com/news/9-stocks-powered-40-of-the-sp-500s-surge-20240122.jpg
JPM,2024-01-12,2023-12-29,2024-01-26,JPM,,2024-01-22 08:13:00,2024-01-22T08:13:00-05:00,2024-01-22,The FDIC Assessed $16 Billion to Banks For Last Year's Banking Failures: Here's How Much the Big Banks Are Paying,The failures of Silicon Valley Bank and First Republic Bank last year cost the Federal Deposit Insurance Corporation (FDIC) $18.7 billion. The FDIC imposed a special assessment on 114 financial institutions totaling $16.3 billion to recover lost funds.,fool.com,https://www.fool.com/investing/2024/01/22/the-fdic-assessed-16-billion-to-banks-for-last-yea/,https://images.financialmodelingprep.com/news/the-fdic-assessed-16-billion-to-banks-for-last-20240122.jpg
JPM,2024-01-12,2023-12-29,2024-01-26,JPM,,2024-01-22 08:29:21,2024-01-22T08:29:21-05:00,2024-01-22,"Wall Street opposition to Trump collapses, as 'pipe dream' of primary defeat ends",Executives on Wall Street have no plans to try to stop Donald Trump as he surges to the Republican nomination.,cnbc.com,https://www.cnbc.com/2024/01/22/wall-street-opposition-to-trump-collapses-as-pipe-dream-of-primary-defeat-ends.html,https://images.financialmodelingprep.com/news/wall-street-opposition-to-trump-collapses-as-pipe-dream-20240122.jpg
JPM,2024-01-12,2023-12-29,2024-01-26,JPM,,2024-01-22 12:46:12,2024-01-22T12:46:12-05:00,2024-01-22,Financial ETF Breaks Out to 52-Week High: Stocks to Watch,New yearly highs for banks are bullish and a sign of strength.,zacks.com,https://www.zacks.com/commentary/2213599/financial-etf-breaks-out-to-52-week-high-stocks-to-watch?cid=CS-STOCKNEWSAPI-FT-investment_ideas-2213599,https://images.financialmodelingprep.com/news/financial-etf-breaks-out-to-52week-high-stocks-to-20240122.jpg
JPM,2024-01-12,2023-12-29,2024-01-26,JPM,,2024-01-22 19:42:20,2024-01-22T19:42:20-05:00,2024-01-22,Wall Street's Bullish Surprise: What the Surge in Consumer Confidence Means for Stocks,"Very positive consumer confidence and retail sales data, along with strong earnings and positive comments from multiple, major companies, have finally made the Street see that the economy can perform well even if interest rates aren't extremely low or poised to sink sharply. Meanwhile, the economic expansion still is likely to continue to be rather strong for a long time and the Federal Reserve remains poised to cut interest rates later this year.",investorplace.com,https://investorplace.com/2024/01/wall-streets-bullish-surprise-what-the-surge-in-consumer-confidence-means-for-stocks/,https://images.financialmodelingprep.com/news/wall-streets-bullish-surprise-what-the-surge-in-consumer-confidence-20240122.jpg
JPM,2024-01-12,2023-12-29,2024-01-26,JPM,,2024-01-23 06:15:00,2024-01-23T06:15:00-05:00,2024-01-23,7 Dividend Stocks to Buy for Income and Stability in 2024,Want to generate extra income without working extra hours? Dividend stocks allow many investors to fulfill that goal.,investorplace.com,https://investorplace.com/2024/01/7-dividend-stocks-to-buy-for-income-and-stability-in-2024/,https://images.financialmodelingprep.com/news/7-dividend-stocks-to-buy-for-income-and-stability-20240123.jpg
