ticker,event_date,window_start,window_end,symbol,symbols,publishedDate,publishedDateET,date_et,title,text,site,url,image
JPM,2024-01-12,2023-12-29,2024-01-26,JPM,,2024-01-23 13:04:07,2024-01-23T13:04:07-05:00,2024-01-23,Bank ETFs in Focus on Mixed Q4 Earnings,"The financial sector, which accounts for around one--fifth of the S&P 500 Index, had a mixed Q4.",zacks.com,https://www.zacks.com/stock/news/2214397/bank-etfs-in-focus-on-mixed-q4-earnings?cid=CS-STOCKNEWSAPI-FT-etf_news_and_commentary-2214397,https://images.financialmodelingprep.com/news/bank-etfs-in-focus-on-mixed-q4-earnings-20240123.jpg
JPM,2024-01-12,2023-12-29,2024-01-26,JPM,,2024-01-24 10:46:10,2024-01-24T10:46:10-05:00,2024-01-24,"A Fan of Morgan Stanley, JP Morgan? Buy Intermediate Treasury ETFs","Two renowned Wall Street firms, Morgan Stanley and JPMorgan, are advising investors to consider purchasing five-year U.S. Treasury notes, per Bloomberg, as quoted on Yahoo Finance.",zacks.com,https://www.zacks.com/stock/news/2214996/a-fan-of-morgan-stanley-jp-morgan-buy-intermediate-treasury-etfs?cid=CS-STOCKNEWSAPI-FT-etf_news_and_commentary-2214996,https://images.financialmodelingprep.com/news/a-fan-of-morgan-stanley-jp-morgan-buy-intermediate-20240124.jpg
JPM,2024-01-12,2023-12-29,2024-01-26,JPM,,2024-01-24 14:55:00,2024-01-24T14:55:00-05:00,2024-01-24,Bank of America ‘letter of education' puts teeth into return-to-office mandate,"Bank of America Corp. has issued “letter of education” messages that threaten disciplinary action against employees who choose to work from home, as the megabank puts some teeth into its return-to-office mandates.",marketwatch.com,https://www.marketwatch.com/story/bank-of-america-letter-of-education-puts-teeth-into-return-to-office-mandate-dc186854,https://images.financialmodelingprep.com/news/bank-of-america-letter-of-education-puts-teeth-into-returntooffice-20240124.jpg
JPM,2024-01-12,2023-12-29,2024-01-26,JPM,,2024-01-25 06:15:00,2024-01-25T06:15:00-05:00,2024-01-25,The Biggest Stock Winners and Losers of Q4 Earnings Season,"We're now in the thick of earnings season and results are coming in at a fast and furious rate and it's time to look at the Q4 earnings winners you should shortlist. With 10% of S&P 500-listed companies having now reported financial results for the fourth and final quarter of 2023, 62% of companies have reported both better-than-expected earnings per share and revenue, according to data from FactSet.",investorplace.com,https://investorplace.com/2024/01/the-biggest-stock-winners-and-losers-of-q4-earnings-season/,https://images.financialmodelingprep.com/news/the-biggest-stock-winners-and-losers-of-q4-earnings-20240125.jpg
JPM,2024-01-12,2023-12-29,2024-01-26,JPM,,2024-01-25 16:00:00,2024-01-25T16:00:00-05:00,2024-01-25,JPMorgan Chase Announces Expanded Roles for Top Executives,"NEW YORK--(BUSINESS WIRE)--JPMorgan Chase (NYSE: JPM) today announced new and increased responsibilities for a number of key executives that will build upon the company's successes and continue to position the firm for the future. Jennifer Piepszak, Co-Chief Executive Officer of Consumer and Community Banking (CCB), and Troy Rohrbaugh, Co-head of Markets and Securities Services, will become Co-CEOs of the expanded Commercial & Investment Bank, which will bring together our major wholesale b.",businesswire.com,https://www.businesswire.com/news/home/20240125209722/en/JPMorgan-Chase-Announces-Expanded-Roles-for-Top-Executives/,https://images.financialmodelingprep.com/news/jpmorgan-chase-announces-expanded-roles-for-top-executives-20240125.jpg
JPM,2024-01-12,2023-12-29,2024-01-26,JPM,,2024-01-25 17:14:00,2024-01-25T17:14:00-05:00,2024-01-25,Jamie Dimon Shakes Up JPMorgan Leadership Again,"Jennifer Piepszak, a CEO contender, moves to leading the corporate and investment bank.",wsj.com,https://www.wsj.com/articles/jamie-dimon-shakes-up-jpmorgans-leadership-once-again-602687ad,https://images.financialmodelingprep.com/news/jamie-dimon-shakes-up-jpmorgan-leadership-again-20240125.jpg
JPM,2024-01-12,2023-12-29,2024-01-26,JPM,,2024-01-25 17:27:15,2024-01-25T17:27:15-05:00,2024-01-25,JPMorgan Chase shuffles top leaders as race to succeed Jamie Dimon drags on,The top JPMorgan executives involved in the changes are considered frontrunners to succeed Jamie Dimon as CEO.,cnbc.com,https://www.cnbc.com/2024/01/25/jpmorgan-chase-shuffles-top-leaders-under-jamie-dimon.html,https://images.financialmodelingprep.com/news/jpmorgan-chase-shuffles-top-leaders-as-race-to-succeed-20240125.jpg
JPM,2024-01-12,2023-12-29,2024-01-26,JPM,,2024-01-25 18:30:22,2024-01-25T18:30:22-05:00,2024-01-25,JPMorgan CEO Jamie Dimon shuffles top bosses as Wall Street focuses on succession,"Dimon's succession plans have long been the subject of speculation. In May, the 67-year-old signaled he could depart in 3-1/2 years.",nypost.com,https://nypost.com/2024/01/25/business/jpmorgan-ceo-jamie-dimon-shuffles-top-bosses-as-wall-street-focuses-on-succession/,https://images.financialmodelingprep.com/news/jpmorgan-ceo-jamie-dimon-shuffles-top-bosses-as-wall-street-20240125.jpg
JPM,2024-01-12,2023-12-29,2024-01-26,JPM,,2024-01-25 19:36:43,2024-01-25T19:36:43-05:00,2024-01-25,Key executives at JPMorgan taking on new roles,JPMorgan Chase shuffled executives on Thursday to give them more experience running different businesses as Wall Street focuses on succession plans for CEO Jamie Dimon.,reuters.com,https://www.reuters.com/business/key-executives-jpmorgan-taking-new-roles-2024-01-26/,https://images.financialmodelingprep.com/news/key-executives-at-jpmorgan-taking-on-new-roles-20240125.jpg
JPM,2024-01-12,2023-12-29,2024-01-26,JPM,,2024-01-26 08:08:00,2024-01-26T08:08:00-05:00,2024-01-26,JPMorgan's Jamie Dimon shuffles top management in potential stage-setting move for a successor,JPMorgan Chase & Co. Chief Executive Jamie Dimon has announced a major series of promotions and title changes with a potential successor among them to run the U.S.'s largest bank.,marketwatch.com,https://www.marketwatch.com/story/jpmorgans-jamie-dimon-shuffles-top-management-in-potential-stage-setting-move-for-a-successor-d48d32be,https://images.financialmodelingprep.com/news/jpmorgans-jamie-dimon-shuffles-top-management-in-potential-stagesetting-20240126.jpg
JPM,2024-01-12,2023-12-29,2024-01-26,JPM,,2024-01-26 08:22:00,2024-01-26T08:22:00-05:00,2024-01-26,JPMorgan's Executive Shuffle Adds Clarity to Who Might Succeed Jamie Dimon One Day,The CEO has led the bank since 2005.,barrons.com,https://www.barrons.com/articles/jpmorgan-chase-jamie-dimon-executive-changes-ec52177f,https://images.financialmodelingprep.com/news/jpmorgans-executive-shuffle-adds-clarity-to-who-might-succeed-20240126.jpg
JPM,2024-01-12,2023-12-29,2024-01-26,JPM,,2024-01-26 10:16:05,2024-01-26T10:16:05-05:00,2024-01-26,"JPMorgan Forms Expanded Commercial & Investment Bank, Makes Management Changes",JPMorgan Chase has made several changes to its leadership and organizational structure as it works to “position the firm for the future.,pymnts.com,https://www.pymnts.com/personnel/2024/jpmorgan-forms-expanded-commercial-investment-bank-makes-management-changes/?utm_source=snapi,https://images.financialmodelingprep.com/news/jpmorgan-forms-expanded-commercial-investment-bank-makes-management-changes-20240126.jpg
JPM,2024-01-12,2023-12-29,2024-01-26,JPM,,2024-01-26 10:31:20,2024-01-26T10:31:20-05:00,2024-01-26,Is It Worth Investing in JPMorgan Chase & Co. (JPM) Based on Wall Street's Bullish Views?,"The recommendations of Wall Street analysts are often relied on by investors when deciding whether to buy, sell, or hold a stock. Media reports about these brokerage-firm-employed (or sell-side) analysts changing their ratings often affect a stock's price.",zacks.com,https://www.zacks.com/stock/news/2216471/is-it-worth-investing-in-jpmorgan-chase-co-jpm-based-on-wall-street-s-bullish-views?cid=CS-STOCKNEWSAPI-FT-fundamental_analysis|average_broker_rating-2216471,https://images.financialmodelingprep.com/news/is-it-worth-investing-in-jpmorgan-chase-co-jpm-20240126.jpg
JPM,2024-01-12,2023-12-29,2024-01-26,JPM,,2024-01-26 16:09:00,2024-01-26T16:09:00-05:00,2024-01-26,JPMorgan Chase to Present at the UBS Financial Services Forum,"NEW YORK--(BUSINESS WIRE)--Jeremy Barnum, Chief Financial Officer of JPMorgan Chase & Co., will present at the UBS Financial Services Forum at the Ritz Carlton Hotel in Key Biscayne, Florida on Tuesday, February 27, 2024 at 8:50 a.m. (Eastern). A live webcast will be available on the day of the conference at www.jpmorganchase.com under Investor Relations, Events & Presentations. JPMorgan Chase & Co. (NYSE: JPM) is a leading financial services firm based in the United States of Ameri.",businesswire.com,https://www.businesswire.com/news/home/20240126260973/en/JPMorgan-Chase-to-Present-at-the-UBS-Financial-Services-Forum/,https://images.financialmodelingprep.com/news/jpmorgan-chase-to-present-at-the-ubs-financial-services-20240126.jpg
JPM,2024-01-12,2023-12-29,2024-01-26,JPM,,2024-01-26 16:15:00,2024-01-26T16:15:00-05:00,2024-01-26,JPMorgan Chase Financial Company LLC Launches New Alerian MLP Index® ETN (NYSE Arca: AMJB),NEW YORK--(BUSINESS WIRE)--JPMorgan Chase Financial Company LLC (“JPMCFC”) announced that today is the first day of trading on the NYSE Arca for its Alerian MLP Index® ETNs due 2044 under the ticker symbol “AMJB” (the “ETNs”). Any payment on the ETNs is fully and unconditionally guaranteed by JPMorgan Chase & Co. The ETNs are designed to track the performance of the Alerian MLP Index® (the “Index”). The ETNs pay a variable quarterly coupon linked to the cash distributions paid on the compan.,businesswire.com,https://www.businesswire.com/news/home/20240126759471/en/JPMorgan-Chase-Financial-Company-LLC-Launches-New-Alerian-MLP-Index%C2%AE-ETN-NYSE-Arca-AMJB/,https://images.financialmodelingprep.com/news/jpmorgan-chase-financial-company-llc-launches-new-alerian-mlp-20240126.jpg
JPM,2024-01-12,2023-12-29,2024-01-26,JPM,,2024-01-26 16:30:51,2024-01-26T16:30:51-05:00,2024-01-26,JPMorgan CEO Jamie Dimon warns US driving toward a cliff as debt snowballs,"JPMorgan Chase CEO Jamie Dimon warned Friday that America is headed toward a cliff with its soaring debt, saying it must be addressed before it causes a crisis.",foxbusiness.com,https://www.foxbusiness.com/politics/jpmorgan-ceo-jamie-dimon-warns-us-driving-toward-cliff-debt-snowballs,https://images.financialmodelingprep.com/news/jpmorgan-ceo-jamie-dimon-warns-us-driving-toward-a-20240126.jpg
