ticker,event_date,window_start,window_end,symbol,symbols,publishedDate,publishedDateET,date_et,title,text,site,url,image
V,2025-07-29,2025-07-22,2025-08-12,V,,2025-07-22 11:00:36,2025-07-22T11:00:36-04:00,2025-07-22,Visa (V) Earnings Expected to Grow: What to Know Ahead of Next Week's Release,Visa (V) possesses the right combination of the two key ingredients for a likely earnings beat in its upcoming report. Get prepared with the key expectations.,zacks.com,https://www.zacks.com/stock/news/2603479/visa-v-earnings-expected-to-grow-what-to-know-ahead-of-next-week-s-release?cid=CS-STOCKNEWSAPI-FT-tale_of_the_tape|yseop_template_9-2603479,https://images.financialmodelingprep.com/news/visa-v-earnings-expected-to-grow-what-to-know-20250722.jpg
V,2025-07-29,2025-07-22,2025-08-12,V,,2025-07-22 11:26:09,2025-07-22T11:26:09-04:00,2025-07-22,Visa vs. Affirm: Old Guard or Fintech Fire - Who Wins the Payment War?,"Visa Inc.  V and Affirm Holdings, Inc. AFRM both are now operating at the forefront of the payments landscape, one as a decades-old card network with global scale, the other as a fast-growing fintech innovator in buy now, pay later (BNPL). Visa processes trillions in consumer and commercial payments each year, earning reliable fee-based revenues.",zacks.com,https://www.zacks.com/stock/news/2603608/visa-vs-affirm-old-guard-or-fintech-fire-who-wins-the-payment-war?cid=CS-STOCKNEWSAPI-FT-analyst_blog|most_popular_stocks-2603608,https://images.financialmodelingprep.com/news/visa-vs-affirm-old-guard-or-fintech-fire-who-20250722.jpg
V,2025-07-29,2025-07-22,2025-08-12,V,,2025-07-22 13:23:00,2025-07-22T13:23:00-04:00,2025-07-22,3 Brilliant Dividend Stocks to Buy Now and Hold for the Long Term,"Dividend stocks come in all shapes and sizes, so there's no one-size-fits-all approach that works for everyone. That's actually good news, since every investor is unique.",fool.com,https://www.fool.com/investing/2025/07/22/3-brilliant-dividend-stocks-to-buy-now-and-hold-fo/,https://images.financialmodelingprep.com/news/3-brilliant-dividend-stocks-to-buy-now-and-hold-20250722.jpg
V,2025-07-29,2025-07-22,2025-08-12,V,,2025-07-23 10:01:51,2025-07-23T10:01:51-04:00,2025-07-23,3 Crypto-Centric Stocks to Grab on the Ongoing Bitcoin Rally,"HOOD, V and IBKR are riding the Bitcoin wave, with strong growth prospects and rising earnings estimates for 2025.",zacks.com,https://www.zacks.com/stock/news/2607719/3-crypto-centric-stocks-to-grab-on-the-ongoing-bitcoin-rally?cid=CS-STOCKNEWSAPI-FT-analyst_blog|investment_ideas-2607719,https://images.financialmodelingprep.com/news/3-cryptocentric-stocks-to-grab-on-the-ongoing-bitcoin-20250723.jpg
V,2025-07-29,2025-07-22,2025-08-12,V,,2025-07-23 10:51:29,2025-07-23T10:51:29-04:00,2025-07-23,Visa Swiping Toward a Beat: Should You Buy Before Q3 Earnings?,V is likely positioned for another earnings beat as digital payments surge and volumes rise in fiscal Q3.,zacks.com,https://www.zacks.com/stock/news/2607616/visa-swiping-toward-a-beat-should-you-buy-before-q3-earnings?cid=CS-STOCKNEWSAPI-FT-analyst_blog|most_popular_stocks-2607616,https://images.financialmodelingprep.com/news/visa-swiping-toward-a-beat-should-you-buy-before-20250723.jpg
V,2025-07-29,2025-07-22,2025-08-12,V,,2025-07-23 11:43:11,2025-07-23T11:43:11-04:00,2025-07-23,Visa opens first Africa data centre in Johannesburg,"Visa Inc launched its first data centre in Africa on Wednesday, capitalising on the emerging economy's rapid growth in digital payments, company executives said.",reuters.com,https://www.reuters.com/world/africa/visa-opens-first-africa-data-centre-johannesburg-2025-07-23/,https://images.financialmodelingprep.com/news/visa-opens-first-africa-data-centre-in-johannesburg-20250723.jpg
V,2025-07-29,2025-07-22,2025-08-12,V,,2025-07-23 16:10:37,2025-07-23T16:10:37-04:00,2025-07-23,"How to Build a Super Low Cost Passive Income Fund for Only $25,000","Key Points The RSPA ETF will immediately turn the bulk of your $25,000 account into a diversified income machine. Smaller allocations into SCHD, JEPQ, and FDVV will help you build a low-fee passive income foundation. Are you ahead, or behind on retirement? SmartAsset’s free tool can match you with a financial advisor in minutes to help you answer that today. Each advisor has been carefully vetted, and must act in your best interests. Don’t waste another minute; get started by clicking here.(Sponsor) How far can $25,000 get you? If you have a well-considered plan in place, you can actually turn your small account into a passive income factory. This can be done with a carefully selected group of high-yield, low-fee exchange traded funds (ETFs). With just $25,000, you can build a super-low-cost portfolio that consistently pays you cash dividends/distributions. Plus, you can de-risk your portfolio through multi-sector diversification and investment in famous large-cap companies. So, let&#8217;s start right now with a smart-money plan to extract sizable cash payouts from a small but growing account. Start With RSPA for Extra Diversification Out of a $25,000 account, you can confidently put $10,000 into just one ETF. That&#8217;s because the Invesco S&amp;P 500 Equal Weight Income Advantage ETF (NYSEARCA:RSPA) checks all of the right boxes for a small-sized high-growth portfolio. To populate a small-sized portfolio, I would want to use funds that invest in successful, blue-chip business. I would also insist that the ETFs should be diversified and need to have annual operating expenses below 0.5%. With a focus on companies in the prestigious S&amp;P 500 index, the Invesco S&amp;P 500 Equal Weight Income Advantage ETF has 525 stocks in its holdings. Suffice it to say, then, that the RSPA ETF is widely diversified. When you examine the fund&#8217;s holdings list, you&#8217;ll find established large-cap leaders across multiple economic sectors. Some examples are Coca-Cola (NYSE:KO), Johnson &amp; Johnson (NYSE:JNJ), JPMorgan Chase (NYSE:JPM), and Consolidated Edison (NYSE:ED). An interesting feature of the Invesco S&amp;P 500 Equal Weight Income Advantage ETF is that each of the holdings has a small, roughly equal weighing to the other stocks in the fund. That way, you won&#8217;t over-invest in any single stock. In addition, the RSPA ETF is low-cost as it only deducts annualized operating fees of 0.29%. And for all of you yield hunters out there, the Invesco S&amp;P 500 Equal Weight Income Advantage ETF currently features a 12-month distribution rate of 9.42%. All in all, this ultra-diversified fund is ideal for a $25,000 account and I would feel comfortable dedicating $10,000 toward RSPA. Expand Your Portfolio With SCHD and JEPQ Even though the RSPA ETF would already expose you to 500+ stocks, you still probably wouldn&#8217;t want to toss your entire $25,000 into just one fund. Consequently, we will now explore three more ETFs and, after conducting your own due diligence, you could invest $5,000 in each one of them. The first of these three intriguing funds is the Schwab U.S. Dividend Equity ETF (NYSEARCA:SCHD). This ETF tracks the Dow Jones U.S. Dividend 100 Index and has a portfolio comprising 103 stocks. Again, we&#8217;re looking for famous large-cap names and multi-sector diversification. The Schwab U.S. Dividend Equity ETF meets these expectations with recognizable stocks like Home Depot (NYSE:HD), Merck (NYSE:MRK), Lockheed Martin (NYSE:LMT), and Chevron (NYSE:CVX). Moreover, the Schwab U.S. Dividend Equity ETF serves up a trailing 12-month distribution yield of 3.87% but only deducts 0.06% worth of annual operating expenses. Therefore, investors should have no objections to allocating $5,000 toward the SCHD ETF. Next up is the JPMorgan Nasdaq Equity Premium Income ETF (NASDAQ:JEPQ), which is centered around the technology-focused NASDAQ 100 index. This fund includes 107 stocks so you can participate in the growth of tech&#8217;s heavy hitters, such as NVIDIA (NASDAQ:NVDA), Microsoft (NASDAQ:MSFT), Apple (NASDAQ:AAPL), and Amazon (NASDAQ:AMZN). Committing $5,000 of your $25,000 portfolio to the JEPQ ETF will unlock extra share-price appreciation potential from a variety of top tech firms. You&#8217;ll also get access to substantial cash distributions as the JPMorgan Nasdaq Equity Premium Income ETF features an impressive 11.52% annual yield. We&#8217;re still sticking to the low-cost theme here since JEPQ only deducts operating fees of 0.35% per year. So, why not add some technology-fueled firepower to your small portfolio with the JPMorgan Nasdaq Equity Premium Income ETF? Round It Out With FDVV To round out your $25,000 passive-income plan, you could assign $5,000 toward the Fidelity High Dividend ETF (NYSEARCA:FDVV). Instead of concentrating on the Dow Jones Industrial Average, S&amp;P 500, or NASDAQ 100, the FVDD ETF corresponds to the Fidelity High Dividend Index. Among the holdings list of the Fidelity High Dividend ETF, you&#8217;ll find large-cap superstars like Exxon Mobil (NYSE:XOM), Visa (NYSE:V), Procter &amp; Gamble (NYSE:PG), and Bank of America (NYSE:BAC). Overall, you&#8217;ll get exposure to plenty of consistent dividend deliverers with FDVV. The other need-to-know stats are that the Fidelity High Dividend ETF offers a trailing 12-month distribution yield of 3.07% but only deducts 0.16% in annualized operating expenses. With all of those benefits in mind, you can proudly add $5,000 worth of FDVV shares to your $25,000 account. Now, you&#8217;ve got a four-pack of funds with RSPA as your anchor as well as SCHD, JEPQ, and FDVV for extra diversification. That&#8217;s a savvy plan to keep the fees to a minimum while turning your $25,000 account into a low-risk regular income producer.The post How to Build a Super Low Cost Passive Income Fund for Only $25,000 appeared first on 24/7 Wall St..",https://247wallst.com,https://247wallst.com/investing/2025/07/23/how-to-build-a-super-low-cost-passive-income-fund-for-only-25000/,https://images.financialmodelingprep.com/news/how-to-build-a-super-low-cost-passive-income-20250723.jpg
V,2025-07-29,2025-07-22,2025-08-12,V,,2025-07-24 09:51:31,2025-07-24T09:51:31-04:00,2025-07-24,These 2 Business Services Stocks Could Beat Earnings: Why They Should Be on Your Radar,Why investors should use the Zacks Earnings ESP tool to help find stocks that are poised to top quarterly earnings estimates.,zacks.com,https://www.zacks.com/stock/news/2612050/these-2-business-services-stocks-could-beat-earnings-why-they-should-be-on-your-radar?cid=CS-STOCKNEWSAPI-FT-tale_of_the_tape|zacks_education_earnings_esp-2612050,https://images.financialmodelingprep.com/news/these-2-business-services-stocks-could-beat-earnings-why-20250724.jpg
V,2025-07-29,2025-07-22,2025-08-12,V,,2025-07-24 10:16:34,2025-07-24T10:16:34-04:00,2025-07-24,Gear Up for Visa (V) Q3 Earnings: Wall Street Estimates for Key Metrics,"Besides Wall Street's top-and-bottom-line estimates for Visa (V), review projections for some of its key metrics to gain a deeper understanding of how the company might have fared during the quarter ended June 2025.",zacks.com,https://www.zacks.com/stock/news/2612150/gear-up-for-visa-v-q3-earnings-wall-street-estimates-for-key-metrics?cid=CS-STOCKNEWSAPI-FT-fundamental_analysis|nfm_preview-2612150,https://images.financialmodelingprep.com/news/gear-up-for-visa-v-q3-earnings-wall-street-20250724.jpg
V,2025-07-29,2025-07-22,2025-08-12,V,,2025-07-25 04:15:00,2025-07-25T04:15:00-04:00,2025-07-25,Better Growth Stock: Costco vs. Visa,"Consumers can use a Visa (V -0.16%) card to shop at warehouse club retailer Costco (COST -0.68%), but should investors buy either one of these growth stocks? The answer isn't exactly clear-cut.",fool.com,https://www.fool.com/investing/2025/07/25/better-growth-stock-costco-vs-visa/,https://images.financialmodelingprep.com/news/better-growth-stock-costco-vs-visa-20250725.jpg
V,2025-07-29,2025-07-22,2025-08-12,V,,2025-07-25 04:23:00,2025-07-25T04:23:00-04:00,2025-07-25,3 Reasons to Buy Visa Stock Like There's No Tomorrow,"If you're looking for a combination of performance and security, there are few stocks in the market today that could top Visa (V -0.37%). The credit card company offers a payments network that connects banks, merchants, and consumers -- and gets a cut of the payment every time someone swipes their card.",fool.com,https://www.fool.com/investing/2025/07/25/3-reasons-to-buy-visa-stock-like-theres-no-tomorro/,https://images.financialmodelingprep.com/news/3-reasons-to-buy-visa-stock-like-theres-no-20250725.jpg
V,2025-07-29,2025-07-22,2025-08-12,V,,2025-07-25 08:56:07,2025-07-25T08:56:07-04:00,2025-07-25,4 Stocks to Boost Your Portfolio as Nasdaq Continues to Rally,"Nasdaq's rally gains steam as tech giants like AMZN, META, V and MSFT show strong earnings momentum and AI tailwinds.",zacks.com,https://www.zacks.com/stock/news/2616926/4-stocks-to-boost-your-portfolio-as-nasdaq-continues-to-rally?cid=CS-STOCKNEWSAPI-FT-analyst_blog|investment_ideas-2616926,https://images.financialmodelingprep.com/news/4-stocks-to-boost-your-portfolio-as-nasdaq-continues-20250725.jpg
V,2025-07-29,2025-07-22,2025-08-12,V,,2025-07-25 09:41:00,2025-07-25T09:41:00-04:00,2025-07-25,"Visa, CVS, and 4 More Oversold Stocks Worth a Look Before Earnings",Stocks that have gained too much are more susceptible to big drops than companies that dropped heading into their results.,barrons.com,https://www.barrons.com/articles/visa-cvs-oversold-stocks-buy-earnings-798e78a9,https://images.financialmodelingprep.com/news/visa-cvs-and-4-more-oversold-stocks-worth-a-20250725.jpg
V,2025-07-29,2025-07-22,2025-08-12,V,,2025-07-25 13:25:54,2025-07-25T13:25:54-04:00,2025-07-25,"Final Trades: Gilead, Blackstone, Disney and Visa",The Investment Committee give you their top stocks to watch for the second half.,youtube.com,https://www.youtube.com/watch?v=mCTGuEjYSFg,https://images.financialmodelingprep.com/news/final-trades-gilead-blackstone-disney-and-visa-20250725.jpg
V,2025-07-29,2025-07-22,2025-08-12,V,,2025-07-25 15:07:41,2025-07-25T15:07:41-04:00,2025-07-25,"Disagree with stablecoin disruption thesis for Visa and Mastercard, says Mizuho's Dan Dolev","Dan Dolev, Mizuho senior fintech analyst, joins 'Power Lunch' to discuss changes to the payment space with the passage of the GENIUS Act, stablecoin's use cases and much more.",youtube.com,https://www.youtube.com/watch?v=w57fJuhkg7w,https://images.financialmodelingprep.com/news/disagree-with-stablecoin-disruption-thesis-for-visa-and-mastercard-20250725.jpg
V,2025-07-29,2025-07-22,2025-08-12,V,,2025-07-25 17:25:14,2025-07-25T17:25:14-04:00,2025-07-25,Mastercard Vs Visa Stock: Which is the Better Investment Ahead of Earnings?,"Investors will be looking forward to Visa's (V) and Mastercard's (MA) quarterly reports next week on Tuesday, July 29, and Thursday, July 31, respectively.",zacks.com,https://www.zacks.com/stock/news/2618708/mastercard-vs-visa-stock-which-is-the-better-investment-ahead-of-earnings?cid=CS-STOCKNEWSAPI-FT-stocks_in_the_news-2618708,https://images.financialmodelingprep.com/news/mastercard-vs-visa-stock-which-is-the-better-investment-20250725.jpg
V,2025-07-29,2025-07-22,2025-08-12,V,,2025-07-25 20:44:00,2025-07-25T20:44:00-04:00,2025-07-25,5 No-Brainer Warren Buffett Stocks to Buy Right Now,"Warren Buffett is departing as Berkshire Hathaway (NYSE: BRK.A) (NYSE: BRK.B) CEO at the end of 2025, but that doesn't mean his stock ideas are, or won't be, worth following. The five stocks below that are in Berkshire Hathaway's portfolio look especially promising.",fool.com,https://www.fool.com/investing/2025/07/25/warren-buffett-stocks-buy-berkshire-brk/,https://images.financialmodelingprep.com/news/5-nobrainer-warren-buffett-stocks-to-buy-right-now-20250725.jpg
V,2025-07-29,2025-07-22,2025-08-12,V,,2025-07-26 10:11:40,2025-07-26T10:11:40-04:00,2025-07-26,1 Reason to Buy Visa (V),"Visa (V 0.90%) is a dominant force in the financial services industry. It runs a leading payments platform that connects consumers, banks, and merchants across the globe.",fool.com,https://www.fool.com/investing/2025/07/26/1-reason-to-buy-visa-v/,https://images.financialmodelingprep.com/news/1-reason-to-buy-visa-v-20250726.jpg
V,2025-07-29,2025-07-22,2025-08-12,V,,2025-07-28 07:00:00,2025-07-28T07:00:00-04:00,2025-07-28,Warren Buffett Has 40% of Berkshire Hathaway's $293 Billion Portfolio Invested in 5 Artificial Intelligence (AI) Stocks,"In general, Warren Buffett has stayed away from tech companies in Berkshire Hathaway's investment portfolio. But one big tech trend has expanded well beyond tech companies: artificial intelligence (AI).",fool.com,https://www.fool.com/investing/2025/07/28/warren-buffett-has-40-of-berkshire-hathaways-293-b/,https://images.financialmodelingprep.com/news/warren-buffett-has-40-of-berkshire-hathaways-293-billion-20250728.jpg
V,2025-07-29,2025-07-22,2025-08-12,V,,2025-07-28 07:30:00,2025-07-28T07:30:00-04:00,2025-07-28,Flex Becomes First FinTech to Launch Visa Infinite Business Credit Card,NEW YORK--(BUSINESS WIRE)-- #Flex--Flex Becomes First FinTech to Launch Visa Infinite Business Credit Card.,businesswire.com,https://www.businesswire.com/news/home/20250728440254/en/Flex-Becomes-First-FinTech-to-Launch-Visa-Infinite-Business-Credit-Card/,https://images.financialmodelingprep.com/news/flex-becomes-first-fintech-to-launch-visa-infinite-business-20250728.jpg
V,2025-07-29,2025-07-22,2025-08-12,V,,2025-07-28 11:54:28,2025-07-28T11:54:28-04:00,2025-07-28,"Visa, Mastercard set for higher profits on solid spending trends","Visa and Mastercard are expected to report higher quarterly profits this week on steady consumer spending, and analysts will scrutinize how demand for travel and discretionary purchases is shaping up in the face of tariff uncertainty.",reuters.com,https://www.reuters.com/business/finance/visa-mastercard-set-higher-profits-solid-spending-trends-2025-07-28/,https://images.financialmodelingprep.com/news/visa-mastercard-set-for-higher-profits-on-solid-spending-20250728.jpg
V,2025-07-29,2025-07-22,2025-08-12,V,,2025-07-28 12:16:04,2025-07-28T12:16:04-04:00,2025-07-28,PayPal and Visa Earnings: A Closer Look,"Earnings season continues to roll along, with results so far being positive. Like recent periods, the big banks helped kick off the period on a strong enough note, with many other companies following suit over the past week.",zacks.com,https://www.zacks.com/commentary/2619294/paypal-and-visa-earnings-a-closer-look?cid=CS-STOCKNEWSAPI-FT-investment_ideas-2619294,https://images.financialmodelingprep.com/news/paypal-and-visa-earnings-a-closer-look-20250728.jpg
V,2025-07-29,2025-07-22,2025-08-12,V,,2025-07-28 19:06:04,2025-07-28T19:06:04-04:00,2025-07-28,S&P 500 & Nasdaq Notch New All-Time Closing Highs,"Markets lost a bit of steam mid-session this Monday, but a late surge into the close brought the S&P 500 and the Nasdaq indexes to new record closing highs.",zacks.com,https://www.zacks.com/stock/news/2630713/s-p-500-nasdaq-notch-new-all-time-closing-highs?cid=CS-STOCKNEWSAPI-FT-ahead_of_wall_street-2630713,https://images.financialmodelingprep.com/news/sp-500-nasdaq-notch-new-alltime-closing-highs-20250728.jpg
V,2025-07-29,2025-07-22,2025-08-12,V,,2025-07-28 20:15:00,2025-07-28T20:15:00-04:00,2025-07-28,2 No-Brainer Warren Buffett Stocks to Buy Right Now,"Warren Buffett's investment moves are legendary, and even as he prepares to step away from the day-to-day duties of running Berkshire Hathaway, investors still look to the massive portfolio he's built through his conglomerate for investment ideas.",fool.com,https://www.fool.com/investing/2025/07/28/2-no-brainer-warren-buffett-stocks-to-buy-right-no/,https://images.financialmodelingprep.com/news/2-nobrainer-warren-buffett-stocks-to-buy-right-now-20250728.jpg
V,2025-07-29,2025-07-22,2025-08-12,V,,2025-07-29 08:13:58,2025-07-29T08:13:58-04:00,2025-07-29,How To Earn $500 A Month From Visa Stock Ahead Of Q3 Earnings,"Visa Inc. V is set to report third-quarter earnings after the closing bell on Tuesday, July 29. The report follows news that Japan's Fair Trade Commission has taken its first administrative action against the credit card industry, targeting Visa Worldwide Pte Ltd.",benzinga.com,https://www.benzinga.com/trading-ideas/dividends/25/07/46684911/how-to-earn-500-a-month-from-visa-stock-ahead-of-q3-earnings,https://images.financialmodelingprep.com/news/how-to-earn-500-a-month-from-visa-stock-20250729.jpg
V,2025-07-29,2025-07-22,2025-08-12,V,,2025-07-29 08:46:11,2025-07-29T08:46:11-04:00,2025-07-29,Regulatory Tailwinds Likely to Drive Cryptocurrency Momentum: 5 Picks,"Regulatory boosts and crypto strength spark upside in HOOD, IBKR, IREN, V and CIFR as these five stocks ride the digital wave.",zacks.com,https://www.zacks.com/stock/news/2633217/regulatory-tailwinds-likely-to-drive-cryptocurrency-momentum-5-picks?cid=CS-STOCKNEWSAPI-FT-analyst_blog|investment_ideas-2633217,https://images.financialmodelingprep.com/news/regulatory-tailwinds-likely-to-drive-cryptocurrency-momentum-5-picks-20250729.jpg
V,2025-07-29,2025-07-22,2025-08-12,V,,2025-07-29 09:10:44,2025-07-29T09:10:44-04:00,2025-07-29,Options Corner: V Ahead of Earnings,"As investors await the latest quarterly results from Visa (V), Rick Ducat breaks down the technical picture taking shape on the charts. He notes the outperformance year-to-date against the broader Financials Sector and S&P 500 (SPX).",youtube.com,https://www.youtube.com/watch?v=8-ZxSAPsBv0,https://images.financialmodelingprep.com/news/options-corner-v-ahead-of-earnings-20250729.jpg
V,2025-07-29,2025-07-22,2025-08-12,V,,2025-07-29 11:30:03,2025-07-29T11:30:03-04:00,2025-07-29,Visa (V) Cashing In on Earnings Weighs on Consumer Strength,"Visa (V) reports earnings after the close Tuesday. Its stock is up almost 40% year-over-year, but valuation concerns are catching up to the company.",youtube.com,https://www.youtube.com/watch?v=4ZMfe84iis4,https://images.financialmodelingprep.com/news/visa-v-cashing-in-on-earnings-weighs-on-consumer-20250729.jpg
V,2025-07-29,2025-07-22,2025-08-12,V,,2025-07-29 15:30:52,2025-07-29T15:30:52-04:00,2025-07-29,Live Coverage: Will Visa (V) Stock Rise After 3Q Earnings?,Visa  (NYSE:V) reports fiscal Q3 2025 results after the bell tonight.,247wallst.com,https://247wallst.com/investing/2025/07/29/live-coverage-will-visa-v-stock-rise-after-3q-earnings/,https://images.financialmodelingprep.com/news/live-coverage-will-visa-v-stock-rise-after-3q-20250729.jpg
V,2025-07-29,2025-07-22,2025-08-12,V,,2025-07-29 16:05:00,2025-07-29T16:05:00-04:00,2025-07-29,Visa Fiscal Third Quarter 2025 Financial Results,SAN FRANCISCO--(BUSINESS WIRE)--Visa (NYSE: V) today announced its fiscal third quarter 2025 financial results through an earnings release that will be furnished with the Securities and Exchange Commission on a Form 8-K and available on its Investor Relations website at investor.visa.com/financial-information/quarterly-earnings/default.aspx. Visa will host a live audio webcast at 2:00 p.m. Pacific Time (5:00 p.m. Eastern Time) to discuss these financial results. The webcast and all related mate.,businesswire.com,https://www.businesswire.com/news/home/20250729817576/en/Visa-Fiscal-Third-Quarter-2025-Financial-Results/,https://images.financialmodelingprep.com/news/visa-fiscal-third-quarter-2025-financial-results-20250729.jpg
V,2025-07-29,2025-07-22,2025-08-12,V,,2025-07-29 16:20:30,2025-07-29T16:20:30-04:00,2025-07-29,"Visa Q3 Earnings Highlights: Double Beat, CEO Says Consumer Spending Remains 'Resilient'",Visa Inc V reported third-quarter financial results after market close Tuesday. Here are the key highlights.,benzinga.com,https://www.benzinga.com/markets/earnings/25/07/46705658/visa-q3-earnings-highlights-double-beat-ceo-says-consumer-spending-remains-resilient,https://images.financialmodelingprep.com/news/visa-q3-earnings-highlights-double-beat-ceo-says-consumer-spending-20250729.jpg
V,2025-07-29,2025-07-22,2025-08-12,V,,2025-07-29 16:29:00,2025-07-29T16:29:00-04:00,2025-07-29,"Visa says spending is growing at a healthy rate, but its stock dips after earnings",Visa is seeing “resilient” trends in discretionary and non-discretionary spending categories.,marketwatch.com,https://www.marketwatch.com/story/visa-says-spending-is-growing-at-a-healthy-rate-but-its-stock-dips-after-earnings-2be9de59,https://images.financialmodelingprep.com/news/visa-says-spending-is-growing-at-a-healthy-rate-20250729.jpg
V,2025-07-29,2025-07-22,2025-08-12,V,,2025-07-29 16:31:05,2025-07-29T16:31:05-04:00,2025-07-29,Visa beats consensus estimates,CNBC's Hugh Son delivers Visa's quarterly earnings results.,youtube.com,https://www.youtube.com/watch?v=U5IzHQA3gU0,https://images.financialmodelingprep.com/news/visa-beats-consensus-estimates-20250729.jpg
V,2025-07-29,2025-07-22,2025-08-12,V,,2025-07-29 17:11:17,2025-07-29T17:11:17-04:00,2025-07-29,Visa Sees No Sign of a Slowdown,Here's our initial take on Visa's (V -1.00%) latest financial report.,fool.com,https://www.fool.com/investing/2025/07/29/visa-sees-no-sign-of-a-slowdown/,https://images.financialmodelingprep.com/news/visa-sees-no-sign-of-a-slowdown-20250729.jpg
V,2025-07-29,2025-07-22,2025-08-12,V,,2025-07-29 18:16:08,2025-07-29T18:16:08-04:00,2025-07-29,Visa (V) Q3 Earnings and Revenues Surpass Estimates,"Visa (V) came out with quarterly earnings of $2.98 per share, beating the Zacks Consensus Estimate of $2.86 per share. This compares to earnings of $2.42 per share a year ago.",zacks.com,https://www.zacks.com/stock/news/2635380/visa-v-q3-earnings-and-revenues-surpass-estimates?cid=CS-STOCKNEWSAPI-FT-tale_of_the_tape|yseop_template_4-2635380,https://images.financialmodelingprep.com/news/visa-v-q3-earnings-and-revenues-surpass-estimates-20250729.jpg
