ticker,event_date,window_start,window_end,symbol,symbols,publishedDate,publishedDateET,date_et,title,text,site,url,image
V,2025-07-29,2025-07-22,2025-08-12,V,,2025-07-29 19:01:25,2025-07-29T19:01:25-04:00,2025-07-29,Visa (V) Reports Q3 Earnings: What Key Metrics Have to Say,"Although the revenue and EPS for Visa (V) give a sense of how its business performed in the quarter ended June 2025, it might be worth considering how some key metrics compare with Wall Street estimates and the year-ago numbers.",zacks.com,https://www.zacks.com/stock/news/2635667/visa-v-reports-q3-earnings-what-key-metrics-have-to-say?cid=CS-STOCKNEWSAPI-FT-fundamental_analysis|nfm-2635667,https://images.financialmodelingprep.com/news/visa-v-reports-q3-earnings-what-key-metrics-have-20250729.jpg
V,2025-07-29,2025-07-22,2025-08-12,V,,2025-07-29 19:06:08,2025-07-29T19:06:08-04:00,2025-07-29,Markets Give Up Gains Amid Major News Week,"Q2 earnings reports, while demonstrating a healthy quarter overall, has begun to show some dents in the armor, especially in non-Big Tech spaces.",zacks.com,https://www.zacks.com/stock/news/2635649/markets-give-up-gains-amid-major-news-week?cid=CS-STOCKNEWSAPI-FT-ahead_of_wall_street-2635649,https://images.financialmodelingprep.com/news/markets-give-up-gains-amid-major-news-week-20250729.jpg
V,2025-07-29,2025-07-22,2025-08-12,V,,2025-07-29 23:25:29,2025-07-29T23:25:29-04:00,2025-07-29,Visa Inc. (V) Q3 2025 Earnings Call Transcript,"Visa Inc. (NYSE:V ) Q3 2025 Earnings Conference Call July 29, 2025 5:00 PM ET Company Participants Jennifer Como - Head of Investor Relations Ryan McInerney - President, CEO & Director Christopher Suh - Chief Financial Officer Conference Call Participants Harshita Rawat - Sanford C. Bernstein & Co., LLC.",seekingalpha.com,https://seekingalpha.com/article/4805845-visa-inc-v-q3-2025-earnings-call-transcript,https://images.financialmodelingprep.com/news/visa-inc-v-q3-2025-earnings-call-transcript-20250729.jpg
V,2025-07-29,2025-07-22,2025-08-12,V,,2025-07-30 05:36:35,2025-07-30T05:36:35-04:00,2025-07-30,Sainsbury's blames Visa card issues for online payment failure,"J Sainsbury, the supermarket chain, was on Wednesday racing to resolve an issue with the card payments giant Visa which was impacting customers' ability to pay for their online grocery orders.",news.sky.com,https://news.sky.com/story/sainsbury8217s-blames-visa-card-issues-for-online-payment-failure-13403905,https://images.financialmodelingprep.com/news/sainsburys-blames-visa-card-issues-for-online-payment-failure-20250730.jpg
V,2025-07-29,2025-07-22,2025-08-12,V,,2025-07-30 07:00:00,2025-07-30T07:00:00-04:00,2025-07-30,"Visa Brings Google Pay Integration to Fleet Cards, Enabling Tokenization and Push-to-Wallet Across the Digital Wallet Ecosystem","SAN FRANCISCO--(BUSINESS WIRE)--Visa (NYSE: V), a global leader in digital payments, today announced a major advancement for Fleet Operators. With the addition of Google Pay tokenization and push-to-wallet, Visa addresses the long-standing challenge of fleet data tags being tied solely to the plastic card chip. Now, fleet data tags can be configured by the issuer, fintech or processor, allowing custom data tags to be dynamically provisioned during the tokenization process. Once loaded into Goog.",businesswire.com,https://www.businesswire.com/news/home/20250730966229/en/Visa-Brings-Google-Pay-Integration-to-Fleet-Cards-Enabling-Tokenization-and-Push-to-Wallet-Across-the-Digital-Wallet-Ecosystem/,https://images.financialmodelingprep.com/news/visa-brings-google-pay-integration-to-fleet-cards-enabling-20250730.jpg
V,2025-07-29,2025-07-22,2025-08-12,V,,2025-07-30 08:46:11,2025-07-30T08:46:11-04:00,2025-07-30,Buy Visa Stock on Impressive Q2 Earnings and Strong Business Visibility,"Visa posts strong Q2 earnings, expands in AI and stablecoins, and eyes long-term growth through digital payment innovation.",zacks.com,https://www.zacks.com/stock/news/2638161/buy-visa-stock-on-impressive-q2-earnings-and-strong-business-visibility?cid=CS-STOCKNEWSAPI-FT-analyst_blog|investment_ideas-2638161,https://images.financialmodelingprep.com/news/buy-visa-stock-on-impressive-q2-earnings-and-strong-20250730.jpg
V,2025-07-29,2025-07-22,2025-08-12,V,,2025-07-30 12:31:12,2025-07-30T12:31:12-04:00,2025-07-30,Visa Q3 Earnings Beat Estimates on Strong Cross-Border Volumes,"V posts 23% y/y EPS growth in Q3 and beats estimates, fueled by rising cross-border and processed transaction volumes.",zacks.com,https://www.zacks.com/stock/news/2639255/visa-q3-earnings-beat-estimates-on-strong-cross-border-volumes?cid=CS-STOCKNEWSAPI-FT-analyst_blog|earnings_article-2639255,https://images.financialmodelingprep.com/news/visa-q3-earnings-beat-estimates-on-strong-crossborder-volumes-20250730.jpg
V,2025-07-29,2025-07-22,2025-08-12,V,,2025-07-30 13:00:40,2025-07-30T13:00:40-04:00,2025-07-30,Credit card companies no longer value a $50k monthly spend,"Credit card companies offer various perks to attract and retain customers. You may get a good welcome bonus if you spend enough money within a few months, and you will also likely receive points or cash back on every purchase. However, a Fat FIRE advocate recently expressed dissatisfaction with Amex Platinum. This individual no longer feels valued by the company despite spending $50,000 each month. Other Redditors jumped into the comments to share their thoughts about this trend and recommend some ways to maximize credit card benefits. Key Points Some credit card companies don&#8217;t have the same reward structures that made them so popular. A Redditor who spends more than $50,000 per month is looking for alternatives after AMEX fell below their expectations. It’s hard to believe, but today there are credit cards offering up to 6% cash back, $200 statement credits, $0 annual fees, travel rewards, and more. See for yourself, I couldn’t believe it at first. Frankly, with rewards this good we don’t expect them to be available forever. But if you sign up today you can secure some of the best rewards we’ve ever seen. Click here to get started. Use Bank Of America The top commenter suggested putting $100,000 into a Merrill Lynch or Bank of America account and then using the company&#8217;s Visa card for maximum benefits. This setup will net you 3.5% cashback on travel and dining, plus 2.625% cashback on everything else. The recommendation came from someone who was fed up with using different credit cards for different categories and opening a bunch of cards just for their bonuses. This route can save you a lot of time while allowing you to secure top-tier rewards. Bank of America also doesn&#8217;t have an annual membership fee that is tied to those benefits. To top it all off, there are a lot of expenses that count as travel and dining, even if it&#8217;s not obvious. &#8220;They are *extremely* generous about how they code for travel and dining. For example, I pay monthly maintenance expenses on several rental properties with the card. Magically, that&#8217;s counted as lodging, so I get 3.5% back,&#8221; the top commenter stated. Fees Add Up The original poster isn&#8217;t the only one who&#8217;s fed up with Amex cards. One Redditor commented that the Amex Centurion card isn&#8217;t as good as it used to be, despite paying roughly $5,000 in fees. The Redditor got plenty of upvotes from that comment. You can choose from many credit cards that do not have annual fees. If you don&#8217;t have to contend with an annual fee, all of your rewards are pure profit as long as you pay off your credit card balance at the end of each month. Plenty of credit cards offer unlimited 2% cashback on every purchase, and that may be enough to edge out some of the credit cards with annual fees. While big spenders may be able to justify the high annual fee, it isn&#8217;t worth it for everyone. Travelers Benefit The Most From High-End Credit Cards Another Redditor mentioned that most of the top-tier credit cards only serve people who travel often. While this setup benefits regular travelers, it&#8217;s important to keep this distinction in mind if you do not travel. It&#8217;s important to view each credit card while considering how you spend your money and what you want out of life. Some people enjoy traveling, but opting for a simple cashback credit card may be the better choice for others. However, that doesn&#8217;t mean you&#8217;re getting the deal of a lifetime if you enjoy boarding airplanes and going to new destinations. Some Redditors criticized the travel portals of various credit cards. They said that hotel and car prices include travel agent markups and are not competitive. It&#8217;s always good to review the numbers before opening a card or making any big travel purchases to ensure you are getting the best deal. The post Credit card companies no longer value a $50k monthly spend appeared first on 24/7 Wall St..",https://247wallst.com,https://247wallst.com/personal-finance/2025/07/29/credit-card-companies-no-longer-value-a-50k-monthly-spend/,https://images.financialmodelingprep.com/news/credit-card-companies-no-longer-value-a-50k-monthly-20250730.jpg
V,2025-07-29,2025-07-22,2025-08-12,V,,2025-07-30 13:18:29,2025-07-30T13:18:29-04:00,2025-07-30,Trade Tracker: Jim Lebenthal sells Visa,"Jim Lebenthal, Chief Equity Strategist at Cerity Partners, joins CNBC's ""Halftime Report"" to explain why he's selling Visa at these levels. The Investment Committee debate the move.",youtube.com,https://www.youtube.com/watch?v=g-6D5XcThRQ,https://images.financialmodelingprep.com/news/trade-tracker-jim-lebenthal-sells-visa-20250730.jpg
V,2025-07-29,2025-07-22,2025-08-12,V,,2025-07-30 14:11:25,2025-07-30T14:11:25-04:00,2025-07-30,Visa Is A Prime Example Of Letting Your Winners Run,"Visa Inc. delivered a double beat in Q3 FY2025 earnings, outperforming expectations across revenue and EPS. Valuation remains high, with multiples reflecting the market pricing in decades of growth and reliability. The main risk is that any disruption to Visa's growth narrative could trigger a re-rating and loss of shareholder value, but that seems unlikely.",seekingalpha.com,https://seekingalpha.com/article/4806237-visa-is-a-prime-example-of-letting-your-winners-run,https://images.financialmodelingprep.com/news/visa-is-a-prime-example-of-letting-your-winners-20250730.jpg
V,2025-07-29,2025-07-22,2025-08-12,V,,2025-07-30 20:29:42,2025-07-30T20:29:42-04:00,2025-07-30,"Visa Beats Q3 Earnings Expectations, So Why Did the Market Panic?","Visa NYSE: V is a dominant player in the worldwide payments industry, and even amid macroeconomic difficulties, the stock has delivered impressive performance in 2025 so far.",marketbeat.com,https://www.marketbeat.com/originals/visa-beats-q3-earnings-expectations-so-why-did-the-market-panic/,https://images.financialmodelingprep.com/news/visa-beats-q3-earnings-expectations-so-why-did-the-20250730.jpg
V,2025-07-29,2025-07-22,2025-08-12,V,,2025-07-31 07:07:00,2025-07-31T07:07:00-04:00,2025-07-31,Visa Cardholders Get First Shot at Applying for FIFA World Cup 26™ Tickets,"WASHINGTON--(BUSINESS WIRE)--It's official: the road to the FIFA World Cup 26™ starts with Visa. As the Official Payment Technology Partner of FIFA and a global leader in digital payments, Visa cardholders with a Visa Debit, Credit or reloadable Visa prepaid cards globally will receive exclusive early access to apply for tickets to the most anticipated sporting event in the world. The first-ever Visa Presale Draw was announced at the Visa Payments Vault in Washington, D.C., where government off.",businesswire.com,https://www.businesswire.com/news/home/20250731190789/en/Visa-Cardholders-Get-First-Shot-at-Applying-for-FIFA-World-Cup-26%E2%84%A2-Tickets/,https://images.financialmodelingprep.com/news/visa-cardholders-get-first-shot-at-applying-for-fifa-world-20250731.jpg
V,2025-07-29,2025-07-22,2025-08-12,V,,2025-07-31 09:14:00,2025-07-31T09:14:00-04:00,2025-07-31,Mastercard earnings show robust spending — and send an upbeat message for Visa investors,One thing is clear at a high level after the latest earnings results from the biggest payment-technology companies: Consumers are still spending despite an uncertain economic environment.,marketwatch.com,https://www.marketwatch.com/story/mastercard-earnings-show-robust-spending-and-send-an-upbeat-message-for-visa-investors-559d0202,https://images.financialmodelingprep.com/news/mastercard-earnings-show-robust-spending-and-send-an-upbeat-message-20250731.jpg
V,2025-07-29,2025-07-22,2025-08-12,V,,2025-07-31 12:39:13,2025-07-31T12:39:13-04:00,2025-07-31,Visa Bolsters Stablecoin Support for Its Settlement Platform,"Visa plans to support more stablecoins and blockchains on its settlement platform. Visa's settlement platform is adding support for two additional stablecoins backed by the U.S. dollar, two blockchains and euro-backed EURC, according to a Thursday (July 31) press release.",pymnts.com,https://www.pymnts.com/cryptocurrency/2025/visa-bolsters-stablecoin-support-settlement-platform/,https://images.financialmodelingprep.com/news/visa-bolsters-stablecoin-support-for-its-settlement-platform-20250731.jpg
V,2025-07-29,2025-07-22,2025-08-12,V,,2025-08-01 08:15:00,2025-08-01T08:15:00-04:00,2025-08-01,2 Top Stocks to Buy Now If You Want Decades of Passive Income,"Any company that can pay and raise its dividends over long periods almost certainly has strong underlying operations. So, corporations of this caliber can offer a lot more than just passive income.",fool.com,https://www.fool.com/investing/2025/08/01/2-top-stocks-to-buy-now-if-you-want-decades-of-pas/,https://images.financialmodelingprep.com/news/2-top-stocks-to-buy-now-if-you-want-decades-20250801.jpg
V,2025-07-29,2025-07-22,2025-08-12,V,,2025-08-01 09:05:41,2025-08-01T09:05:41-04:00,2025-08-01,4 Crypto-Centric Stocks to Buy Before Bitcoin Resumes Its Rally,"Crypto stocks like IBKR, HOOD, V and PYPL show growth promise as Bitcoin steadies, eyeing a fresh rally after recent setbacks.",zacks.com,https://www.zacks.com/stock/news/2648782/4-crypto-centric-stocks-to-buy-before-bitcoin-resumes-its-rally?cid=CS-STOCKNEWSAPI-FT-analyst_blog|investment_ideas-2648782,https://images.financialmodelingprep.com/news/4-cryptocentric-stocks-to-buy-before-bitcoin-resumes-its-20250801.jpg
V,2025-07-29,2025-07-22,2025-08-12,V,,2025-08-01 10:15:59,2025-08-01T10:15:59-04:00,2025-08-01,Visa (NYSE: V) Stock Price Prediction and Forecast 2025-2030 (August 2025),"So far this year, Visa Inc. (NYSE: V) has unveiled a scam disruption initiative, adoption of its “Tap to Phone” technology has soared, it unveiled its vision for artificial intelligence (AI) in commerce, and it expanded of its stablecoin settlement capabilities.",247wallst.com,https://247wallst.com/forecasts/2025/08/01/visa-v-price-prediction-and-forecast-2025-2030/,https://images.financialmodelingprep.com/news/visa-nyse-v-stock-price-prediction-and-forecast-20252030-20250801.jpg
V,2025-07-29,2025-07-22,2025-08-12,V,,2025-08-02 13:42:44,2025-08-02T13:42:44-04:00,2025-08-02,4 Warren Buffett Dividend Stocks You Can Buy and Hold Forever Crushed Q2 Earnings,"If any investor has stood the test of time, it's Warren Buffett, and with good reason.",247wallst.com,https://247wallst.com/investing/2025/08/02/4-warren-buffett-dividend-stocks-you-can-hold-forever-crushed-q2-earnings/,https://images.financialmodelingprep.com/news/4-warren-buffett-dividend-stocks-you-can-buy-and-20250802.jpg
V,2025-07-29,2025-07-22,2025-08-12,V,,2025-08-04 10:02:07,2025-08-04T10:02:07-04:00,2025-08-04,Visa Inc. (V) Is a Trending Stock: Facts to Know Before Betting on It,"Zacks.com users have recently been watching Visa (V) quite a bit. Thus, it is worth knowing the facts that could determine the stock's prospects.",zacks.com,https://www.zacks.com/stock/news/2661643/visa-inc-v-is-a-trending-stock-facts-to-know-before-betting-on-it?cid=CS-STOCKNEWSAPI-FT-tale_of_the_tape|most_searched_stocks-2661643,https://images.financialmodelingprep.com/news/visa-inc-v-is-a-trending-stock-facts-to-20250804.jpg
V,2025-07-29,2025-07-22,2025-08-12,V,,2025-08-05 06:00:00,2025-08-05T06:00:00-04:00,2025-08-05,Should Investors Buy Visa Stock?,The threat of disruption to the payment processing industry has investors wary of Visa (V 0.81%) stock.,fool.com,https://www.fool.com/investing/2025/08/05/should-investors-buy-visa-stock/,https://images.financialmodelingprep.com/news/should-investors-buy-visa-stock-20250805.jpg
V,2025-07-29,2025-07-22,2025-08-12,V,,2025-08-05 16:24:52,2025-08-05T16:24:52-04:00,2025-08-05,"Visa: Earnings Confirm Trends Remain Strong, Buy","Visa remains a buy due to its consistent double-digit earnings growth, high returns on capital, and resilient business model. Recent Q3 results confirm Visa's compounding engine status, with 14% revenue and 23% EPS growth, plus strong performance in value-added services. Stablecoin risks are overblown; Visa's entrenched network, consumer habits, and ongoing innovation make disruption unlikely in core payments.",seekingalpha.com,https://seekingalpha.com/article/4809012-visa-earnings-confirm-trends-remain-strong-remain-buy,https://images.financialmodelingprep.com/news/visa-earnings-confirm-trends-remain-strong-buy-20250805.jpg
V,2025-07-29,2025-07-22,2025-08-12,V,,2025-08-06 05:00:00,2025-08-06T05:00:00-04:00,2025-08-06,"The Best Warren Buffett Stock to Buy With $1,000 Right Now",Warren Buffett has a strong case for being the most well-known name in the investing world. He has spent six decades leading Berkshire Hathaway to become one of the world's premier companies and has made many investors rich along the way.,fool.com,https://www.fool.com/investing/2025/08/06/the-best-warren-buffett-stocks-to-buy-with-1000-ri/,https://images.financialmodelingprep.com/news/the-best-warren-buffett-stock-to-buy-with-1000-20250806.jpg
V,2025-07-29,2025-07-22,2025-08-12,V,,2025-08-08 11:51:07,2025-08-08T11:51:07-04:00,2025-08-08,Visa's Solid Q3 Momentum Meets a Puzzling Pullback: Right Time to Buy?,"Visa posts double-digit Q3 gains in cross-border volumes and earnings, but shares slide 5.5% amid rising costs and regulatory risks.",zacks.com,https://www.zacks.com/stock/news/2684298/visa-s-solid-q3-momentum-meets-a-puzzling-pullback-right-time-to-buy?cid=CS-STOCKNEWSAPI-FT-analyst_blog|most_popular_stocks-2684298,https://images.financialmodelingprep.com/news/visas-solid-q3-momentum-meets-a-puzzling-pullback-right-20250808.jpg
V,2025-07-29,2025-07-22,2025-08-12,V,,2025-08-08 12:41:20,2025-08-08T12:41:20-04:00,2025-08-08,WEX or V: Which Is the Better Value Stock Right Now?,Investors with an interest in Financial Transaction Services stocks have likely encountered both Wex (WEX) and Visa (V). But which of these two stocks is more attractive to value investors?,zacks.com,https://www.zacks.com/stock/news/2684527/wex-or-v-which-is-the-better-value-stock-right-now?cid=CS-STOCKNEWSAPI-FT-tale_of_the_tape|yseop_template_3-2684527,https://images.financialmodelingprep.com/news/wex-or-v-which-is-the-better-value-stock-20250808.jpg
V,2025-07-29,2025-07-22,2025-08-12,V,,2025-08-09 08:23:03,2025-08-09T08:23:03-04:00,2025-08-09,"Visa: Speculations Are Over, Buying Diversified IT And Finance In One (Rating Upgrade)","I upgrade Visa to a buy, driven by strong financials, robust fundamentals, and a favorable valuation near fair value after a recent correction. Visa's business is evolving beyond consumer payments, with B2B and value-added services now driving 60% of revenue and outpacing legacy segments. Exceptional profitability, high solvency, and consistent EPS outperformance support Visa's long-term investment case, despite slightly slower projected EPS growth.",seekingalpha.com,https://seekingalpha.com/article/4811760-visa-speculations-are-over-buying-diversified-it-and-finance-in-one-rating-upgrade,https://images.financialmodelingprep.com/news/visa-speculations-are-over-buying-diversified-it-and-finance-20250809.jpg
V,2025-07-29,2025-07-22,2025-08-12,V,,2025-08-10 05:10:00,2025-08-10T05:10:00-04:00,2025-08-10,Better Growth Stock: Costco vs. Visa,Visa (V 1.44%) and Costco Wholesale (COST 0.39%) both are attractive and well-run businesses. A key highlight for each is growth.,fool.com,https://www.fool.com/investing/2025/08/10/better-growth-stock-costco-vs-visa/,https://images.financialmodelingprep.com/news/better-growth-stock-costco-vs-visa-20250810.jpg
V,2025-07-29,2025-07-22,2025-08-12,V,,2025-08-12 08:30:54,2025-08-12T08:30:54-04:00,2025-08-12,Visa Sees Stablecoins ‘Massively Expanding' Its Opportunities,"Visa's stablecoin strategies could include the launch of its own coin someday. That's according to a report Tuesday (Aug. 12) from Bloomberg News, citing sources familiar with the matter, as the news outlet examines Visa's wider efforts in the stablecoin space.",pymnts.com,https://www.pymnts.com/cryptocurrency/2025/visa-sees-stablecoins-massively-expanding-its-opportunities/,https://images.financialmodelingprep.com/news/visa-sees-stablecoins-massively-expanding-its-opportunities-20250812.jpg
V,2025-07-29,2025-07-22,2025-08-12,V,,2025-08-12 09:22:16,2025-08-12T09:22:16-04:00,2025-08-12,"Serious Credit Card Delinquencies Hit 14-Year High: 2 Stocks to Buy, 1 to Avoid","Key Points in This Article: Credit card delinquencies hit 12.3% in Q2 2025, near the 2011 all-time high of 13.7%.",247wallst.com,https://247wallst.com/investing/2025/08/12/serious-credit-card-delinquencies-hit-14-year-high-2-stocks-to-buy-1-to-avoid/,https://images.financialmodelingprep.com/news/serious-credit-card-delinquencies-hit-14year-high-2-stocks-20250812.jpg
V,2025-07-29,2025-07-22,2025-08-12,V,,2025-08-12 13:50:44,2025-08-12T13:50:44-04:00,2025-08-12,What Keeps Visa at the Forefront of Cybersecurity Innovation?,"V's $12B tech investment and AI-driven tools are blocking billions in fraud, keeping it ahead in cybersecurity innovation.",zacks.com,https://www.zacks.com/stock/news/2703052/what-keeps-visa-at-the-forefront-of-cybersecurity-innovation?cid=CS-STOCKNEWSAPI-FT-analyst_blog|quick_take-2703052,https://images.financialmodelingprep.com/news/what-keeps-visa-at-the-forefront-of-cybersecurity-innovation-20250812.jpg
