ticker,earnings_date,day0_date,day0_dt,call_date,call_dt,call_gap_days,news_folder_date,phase,publishedDate,site,publisher,url,title,text
MA,2022-07-28,2022-07-28,,2022-07-28,2022-07-28T09:00:00-04:00,0,2022-07-28,post,2022-08-08 09:00:00,prnewswire.com,PRNewsWire,https://www.prnewswire.com/news-releases/rei-co-op-and-capital-one-announce-new-rei-co-op-mastercard-301601446.html,REI Co-op and Capital One Announce New REI Co-op Mastercard,"REI Co-op and Capital One Announce New REI Co-op Mastercard
The partnership supports both companies' values, while providing enhanced rewards and benefits for co-op members  and the outdoor community MCLEAN, Va. , Aug. 8, 2022 /PRNewswire/ -- Today, REI Co-op, the largest consumer co-op and outdoor specialty retailer in the United States, and Capital One, introduced their card partnership and launched the new REI Co-op® Mastercard® program."
MA,2022-07-28,2022-07-28,,2022-07-28,2022-07-28T09:00:00-04:00,0,2022-07-28,post,2022-08-08 14:18:15,zacks.com,Zacks Investment Research,https://www.zacks.com/stock/news/1965536/looking-for-a-growth-stock-3-reasons-why-mastercard-ma-is-a-solid-choice,Looking for a Growth Stock? 3 Reasons Why MasterCard (MA) is a Solid Choice,"Looking for a Growth Stock? 3 Reasons Why MasterCard (MA) is a Solid Choice
MasterCard (MA) could produce exceptional returns because of its solid growth attributes."
MA,2022-07-28,2022-07-28,,2022-07-28,2022-07-28T09:00:00-04:00,0,2022-07-28,post,2022-08-10 05:06:00,fool.com,The Motley Fool,https://www.fool.com/investing/2022/08/10/5-safest-warren-buffett-stocks-you-can-buy-now/,5 of the Safest Warren Buffett Stocks You Can Confidently Buy Right Now,"5 of the Safest Warren Buffett Stocks You Can Confidently Buy Right Now
Following in the Oracle of Omaha's footsteps has been making investors richer for decades."
MA,2022-07-28,2022-07-28,,2022-07-28,2022-07-28T09:00:00-04:00,0,2022-07-28,post,2022-08-11 10:32:46,zacks.com,Zacks Investment Research,https://www.zacks.com/stock/news/1967107/5-stocks-with-high-roe-to-buy-on-downtrend-in-inflation-data,5 Stocks With High ROE to Buy on Downtrend in Inflation Data,"5 Stocks With High ROE to Buy on Downtrend in Inflation Data
Marriott (MAR), Mastercard (MA), Builders FirstSource (BLDR), Rockwell (ROK) and ON Semiconductor (ON) are some of the stocks with high ROE to profit as inflation shows signs of cooling."
MA,2022-10-27,2022-10-27,,2022-10-27,2022-10-27T09:00:00-04:00,0,2022-10-27,pre,2022-10-14 05:35:00,fool.com,The Motley Fool,https://www.fool.com/investing/2022/10/14/ready-for-long-term-growth-cant-go-wrong-stocks/,Ready for Long-Term Growth? You Can't Go Wrong With These 3 Stocks,"Ready for Long-Term Growth? You Can't Go Wrong With These 3 Stocks
Some businesses are not only built to last, but built to thrive in any and all environments."
MA,2022-10-27,2022-10-27,,2022-10-27,2022-10-27T09:00:00-04:00,0,2022-10-27,pre,2022-10-17 19:39:43,247wallst.com,24/7 Wall Street,https://247wallst.com/investing/2022/10/17/mastercard-to-help-banks-offer-crypto-trading-to-clients-with-pilot-project/,Mastercard to Help Banks Offer Crypto Trading to Clients With Pilot Project,"Mastercard to Help Banks Offer Crypto Trading to Clients With Pilot Project
Mastercard is planning to launch a project in 2023 that allows banks and financial institutions to provide crypto trading services to their clients, according to a CNBC report."
MA,2022-10-27,2022-10-27,,2022-10-27,2022-10-27T09:00:00-04:00,0,2022-10-27,pre,2022-10-17 16:58:33,foxbusiness.com,Fox Business,https://www.foxbusiness.com/markets/visa-mastercard-draw-new-government-scrutiny-over-debit-card-routing,"Visa, Mastercard draw new government scrutiny over debit-card routing","Visa, Mastercard draw new government scrutiny over debit-card routing
Visa and Mastercard are being investigated by the Federal Trade Commission over their methods of routing digital transactions involving security tokens."
MA,2022-10-27,2022-10-27,,2022-10-27,2022-10-27T09:00:00-04:00,0,2022-10-27,pre,2022-10-17 14:22:00,marketwatch.com,Market Watch,https://www.marketwatch.com/story/visa-mastercard-facing-ftc-probe-over-debit-card-competition-on-online-payments-11666030970,"Visa, Mastercard facing FTC probe over debit-card competition on online payments","Visa, Mastercard facing FTC probe over debit-card competition on online payments
The Federal Trade Commission is investigating whether Visa Inc. and Mastercard Inc.'s security tokens restrict debit-card routing competition on online payments, according to people familiar with the matter."
MA,2022-10-27,2022-10-27,,2022-10-27,2022-10-27T09:00:00-04:00,0,2022-10-27,pre,2022-10-17 12:39:00,wsj.com,The Wall Street Journal,https://www.wsj.com/articles/visa-mastercard-draw-new-government-scrutiny-over-debit-card-routing-11666024794,"Visa, Mastercard Draw New Government Scrutiny","Visa, Mastercard Draw New Government Scrutiny
The Federal Trade Commission is examining whether the companies' security tokens prevent online debit-card payments from going over other networks, according to people familiar with the matter."
MA,2022-10-27,2022-10-27,,2022-10-27,2022-10-27T09:00:00-04:00,0,2022-10-27,pre,2022-10-17 11:02:57,forbes.com,Forbes,https://www.forbes.com/sites/qai/2022/10/17/mastercard-is-bringing-crypto-trading-to-your-bank/,Mastercard Is Bringing Crypto Trading To Your Bank,"Mastercard Is Bringing Crypto Trading To Your Bank
The program will see Mastercard act as a middleman between banks and crypto trading platform Paxos."
MA,2022-10-27,2022-10-27,,2022-10-27,2022-10-27T09:00:00-04:00,0,2022-10-27,pre,2022-10-17 11:02:43,kitco.com,Kitco,https://www.kitco.com/news/2022-10-17/Mastercard-launches-platform-to-help-banks-offer-crypto-trading.html,Mastercard launches platform to help banks offer crypto trading,"Mastercard launches platform to help banks offer crypto trading
(Kitco News) - Mastercard announces Crypto Source, a new program that will enable financial institutions to begin offering secure crypto trading services to their customers."
MA,2022-10-27,2022-10-27,,2022-10-27,2022-10-27T09:00:00-04:00,0,2022-10-27,pre,2022-10-17 08:52:05,marketwatch.com,Market Watch,https://www.marketwatch.com/story/mastercard-offers-crypto-trading-to-financial-customers-via-alliance-with-paxos-trust-co-2022-10-17,Mastercard offers crypto trading to financial customers via alliance with Paxos Trust Co.,"Mastercard offers crypto trading to financial customers via alliance with Paxos Trust Co.
Mastercard Inc. MA, -1.79% shares rose 3.9% on Monday after it said it's launching Crypto Source, a program to help financial institutions offer secure crypto trading capabilities and services to their customers. Mastercard's financial institution partners will be able to engage in buy, hold and sell services for select crypto assets."
MA,2022-10-27,2022-10-27,,2022-10-27,2022-10-27T09:00:00-04:00,0,2022-10-27,pre,2022-10-17 08:30:00,businesswire.com,Business Wire,https://www.businesswire.com/news/home/20221017005547/en/Mastercard-to-bring-crypto-trading-capabilities-to-banks,Mastercard to bring crypto trading capabilities to banks,"Mastercard to bring crypto trading capabilities to banks
PURCHASE, N.Y.--(BUSINESS WIRE)--Mastercard today introduces Crypto SourceTM, a new program to enable financial institutions to bring secure crypto trading capabilities and services to their customers. The 2022 Mastercard New Payments Index reported that 29% of respondents globally hold cryptocurrency as an investment, with another 65% indicating a preference for crypto-related services to be provided by their current trusted financial institution.* In partnership with regulated and licensed crypto custody providers, Mastercard's financial institution partners will gain access to a comprehensive suite of buy, hold and sell services for select crypto assets, augmented with proven identity, cyber, security and advisory services. This Crypto Source offering is complemented by Mastercard Crypto SecureTM to bring additional security to the crypto ecosystem and support card issuers in their compliance with complex regulations. Now, Mastercard’s suite of crypto-related offerings for banks and fintechs includes: Technology and partnership support to enable buy, hold and sell of select crypto assets Security management including Mastercard’s identity solutions, crypto analytics, transaction monitoring, anti-money laundering, ‘Know Your Business’ and lifecycle stages, cybersecurity, and biometrics Crypto spend and cash out capabilities offered through a range of products, including crypto cards, open banking and cross border services. Financial institutions would also be able to offer additional functionality using Mastercard’s technology such as digital receipts and loyalty solutions Crypto program management including program design, product development and technology implementation, as well as go-to-market optimization and marketing consultancy services, providing end-to-end support for banks, fintechs and issuers to offer crypto programs at scale “At Mastercard, trust is our business. What we are announcing today is a connected approach to services that will help bring users safely and securely into the crypto ecosystem. Our recent investments in this space, such as the acquisition of CipherTrace and Ekata, are providing us with a unique set of capabilities to help provide our customers and consumers with the most technically advanced solutions available in the market,” said Ajay Bhalla, President, Cyber & Intelligence at Mastercard. To support this program, Mastercard is expanding its partnership and work with Paxos Trust Company, a leading regulated blockchain infrastructure platform. The partnership aims for Paxos to provide crypto-asset trading and custody services on behalf of the banks, while Mastercard will leverage its technology to integrate those capabilities into banks’ interfaces, resulting in a seamless experience for the consumer. “Our commitment is simple – to explore crypto and the underlying digital assets technology to support consumer choice in payments. Today is an exciting step in our crypto journey that draws on the strengths of our global businesses, from open banking and identity verification to analytics and fraud monitoring to settlement solutions. We’re excited to build on our long-term partnership with Paxos – co-innovating to bring safe and secure technology to financial institutions. Our crypto product innovations will provide choice at scale and continue to bring one-of-a-kind opportunities to financial institutions as they seek to offer new, advanced services to their customers,” said Jorn Lambert, Chief Digital Officer at Mastercard. “Mastercard has a powerful network of financial institutions around the world. This exciting offering developed by Paxos and Mastercard will give FIs the fastest and most trusted way to offer safe, reliable crypto access for their consumers globally. We’re thrilled to partner with Mastercard to further accelerate the mainstream adoption of digital assets,” said Walter Hessert, Head of Strategy at Paxos. Over the past few years, Mastercard has been working alongside its customers and partners to bring new services and capabilities that help make crypto more accessible, safe and secure. These efforts have been complemented with the addition of new technologies through Finicity, Ekata, RiskRecon and CipherTrace. This unique combination of services provides eligible financial institutions the opportunity to directly manage crypto asset investments for consumers. Mastercard also continues to support banks, governments and others through its Crypto & Digital Currencies Consulting Services. Mastercard Crypto Source is currently being prepared for pilot programs. Additional details on broader availability will be made available at a later date. Source: *Research conducted by The Harris Poll and Mastercard Global Foresights, Insights and Analytics from March 21 to April 21, 2022. Online interviews were conducted among 35,040 global adults (17,071 women, 17,969 men) and includes nationally representative samples from markets across 5 regions. About Mastercard (NYSE:MA): Mastercard is a global technology company in the payments industry. Our mission is to connect and power an inclusive, digital economy that benefits everyone, everywhere by making transactions safe, simple, smart and accessible. Using secure data and networks, partnerships and passion, our innovations and solutions help individuals, financial institutions, governments and businesses realize their greatest potential. Our decency quotient, or DQ, drives our culture and everything we do inside and outside of our company. With connections across more than 210 countries and territories, we are building a sustainable world that unlocks priceless possibilities for all. www.mastercard.com Mastercard Crypto and Blockchain"
MA,2022-10-27,2022-10-27,,2022-10-27,2022-10-27T09:00:00-04:00,0,2022-10-27,pre,2022-10-17 08:30:00,businesswire.com,Business Wire,https://www.businesswire.com/news/home/20221017005547/en/Mastercard-to-bring-crypto-trading-capabilities-to-banks/,Mastercard to bring crypto trading capabilities to banks,"Mastercard to bring crypto trading capabilities to banks
PURCHASE, N.Y."
MA,2022-10-27,2022-10-27,,2022-10-27,2022-10-27T09:00:00-04:00,0,2022-10-27,pre,2022-10-19 17:55:10,investorplace.com,InvestorPlace,https://investorplace.com/2022/10/a-generational-turning-point-in-stocks/,A “Generational” Turning Point in Stocks,"A “Generational” Turning Point in Stocks
Why Luke believes the bear market is over"
MA,2022-10-27,2022-10-27,,2022-10-27,2022-10-27T09:00:00-04:00,0,2022-10-27,pre,2022-10-20 14:15:31,reuters.com,Reuters,https://www.reuters.com/business/finance/visa-mastercard-profits-expected-jump-travel-rebounds-2022-10-20/,"Visa, Mastercard profits expected to jump as travel rebounds","Visa, Mastercard profits expected to jump as travel rebounds
U.S. card companies are expected to benefit as pandemic-weary consumers continue to fuel demand for travel, one of the biggest contributors to revenue, despite rising inflation."
MA,2022-10-27,2022-10-27,,2022-10-27,2022-10-27T09:00:00-04:00,0,2022-10-27,pre,2022-10-22 05:06:00,fool.com,The Motley Fool,https://www.fool.com/investing/2022/10/22/nasdaq-bear-market-5-growth-stocks-regret-not-buy/,Nasdaq Bear Market: 5 Terrific Growth Stocks You'll Regret Not Buying on the Dip,"Nasdaq Bear Market: 5 Terrific Growth Stocks You'll Regret Not Buying on the Dip
These bargain-priced growth stocks are ripe for the picking with the Nasdaq Composite plunging by as much as 38%."
MA,2022-10-27,2022-10-27,,2022-10-27,2022-10-27T09:00:00-04:00,0,2022-10-27,pre,2022-10-24 15:03:09,zacks.com,Zacks Investment Research,https://www.zacks.com/stock/news/1996305/mastercard-ma-gears-up-for-q3-earnings-what-lies-ahead,Mastercard (MA) Gears Up for Q3 Earnings: What Lies Ahead?,"Mastercard (MA) Gears Up for Q3 Earnings: What Lies Ahead?
Mastercard's (MA) third-quarter results are likely to reflect higher GDV and cross-border volumes."
MA,2022-10-27,2022-10-27,,2022-10-27,2022-10-27T09:00:00-04:00,0,2022-10-27,pre,2022-10-24 10:00:00,businesswire.com,Business Wire,https://www.businesswire.com/news/home/20221024005272/en/Mastercard-Teams-up-With-Marvel-Studios%E2%80%99-Black-Panther-Wakanda-Forever-to-Spotlight-Small-Business-Superheroes,Mastercard Teams up With Marvel Studios’ Black Panther: Wakanda Forever to Spotlight Small Business Superheroes,"Mastercard Teams up With Marvel Studios’ Black Panther: Wakanda Forever to Spotlight Small Business Superheroes
PURCHASE, N.Y.--(BUSINESS WIRE)--Mastercard announced today its collaboration with Marvel Studios’ “Black Panther: Wakanda Forever”, in theaters November 11, to spotlight Black excellence and the irrepressible strength of Black women – both on and off the screen. With Priceless experiences, digital engagements and shoppable content that supports and celebrates the superpowers of Black business leaders, Mastercard is honoring the film’s inspiring message that the spirit of Wakanda is all around us. “Through representation and access to tools and resources, Mastercard is proud to honor the Black women-owned businesses that strive for success despite the systemic inequalities they face every day,” said Rustom Dastoor, EVP of Marketing and Communications, Mastercard North America. “When we see role models that look like us, which the film so impactfully demonstrates, it expands our sense of what’s possible, including a more diverse, inclusive economic future.” In a Wakanda-inspired commercial spot and supporting campaign, Egypt Otis, the owner of Comma Bookstore & Social Hub – a Flint, Michigan small business that specializes in Black and Brown literature, art and music – stars as a real-life superhero by being a role model to a young shopper. The girl realizes through her imagination and interaction with Egypt that superheroes are all around us, igniting excitement for the film, her ambition for the future, and the belief that she herself has that same potential. “To serve as the face of possibility for aspiring Black women and young girls makes me feel like a superhero of sorts – just for living my truth,” said Otis. “Mastercard’s Strivers Initiative has provided me the resources and platform to help my business thrive and further empower our community, which to me is truly priceless.” Mastercard’s support of the film is an extension of the company’s $500 million commitment to helping close the racial wealth and economic gap in the U.S. by supporting Black women-owned businesses through its Strivers Initiative, and partnerships with HBCUs and youth groups around the country, as well as Mastercard’s sustained efforts to build a more inclusive digital economy by providing the digital tools to help small businesses get online and thrive. In celebration of the film, select small business owners and youth groups will enjoy exclusive screenings in New York City and Atlanta ahead of the film’s release. Designed to create a multisensory experience, the screenings will feature film-inspired décor, photo opportunities, celebratory food and drink options, a Hall of Heroes video installation honoring attendees and other entrepreneurs, free branded swag and more. Separately, Mastercard is launching various Priceless engagements and shoppable activations, including: Mastercard Small Biz Marketplace (Instagram): Consumers can discover a reimagined shoppable social experience of exclusively Black women-owned small businesses and products from across the country with opportunities to shop, share & support them directly on Instagram. Social Content Community Series: Unlocking even more consumer power, Mastercard will feature Talia R. Boone, founder of Los Angeles based immersive floral wellness service Postal Petals®, Jean Brownhill, founder of online contractor network for Minority and Women-owned Business Enterprises Sweeten Enterprise, and Mandy Bowman, founder of the Black-owned business marketplace Official Black Wall Street - in a content series across social platforms, that illustrates their journey to success and impact they make through their business. The Mastercard Small Business Metaverse: in November 2022, Mastercard will launch an immersive virtual reality experience in Meta Horizon Worlds to connect consumers to a world where they can discover a variety of Black-owned small businesses and participate in activities designed to bring to life their unique stories and entrepreneurial journeys. This will be both a space for consumers to engage and learn about new products, and for Mastercard to host custom content bringing together leading entrepreneurs with the next generation. Marvel Studios’ “Black Panther: Wakanda Forever” releases in theaters November 11. For more information, please visit: www.marvel.com/movies/black-panther-wakanda-forever. Through mastercard.com/smallbiz visitors can learn the financial tools, benefits and education that helps small businesses thrive and Start Something Priceless. ABOUT MARVEL STUDIOS’ BLACK PANTHER: WAKANDA FOREVER: In Marvel Studios’ “Black Panther: Wakanda Forever,” Queen Ramonda (Angela Bassett), Shuri (Letitia Wright), M’Baku (Winston Duke), Okoye (Danai Gurira) and the Dora Milaje (including Florence Kasumba), fight to protect their nation from intervening world powers in the wake of King T’Challa’s death. As the Wakandans strive to embrace their next chapter, the heroes must band together with the help of War Dog Nakia (Lupita Nyong’o) and Everett Ross (Martin Freeman) and forge a new path for the kingdom of Wakanda. Introducing Tenoch Huerta Mejía as Namor, king of a hidden undersea nation, the film also stars Dominique Thorne, Michaela Coel, Mabel Cadena and Alex Livanalli. “Black Panther: Wakanda Forever,” directed by Ryan Coogler and produced by Kevin Feige and Nate Moore, opens in U.S. theaters Nov. 11, 2022. ABOUT MASTERCARD (NYSE: MA) Mastercard is a global technology company in the payments industry. Our mission is to connect and power an inclusive, digital economy that benefits everyone, everywhere by making transactions safe, simple, smart and accessible. Using secure data and networks, partnerships and passion, our innovations and solutions help individuals, financial institutions, governments and businesses realize their greatest potential. Our decency quotient, or DQ, drives our culture and everything we do inside and outside of our company. With connections across more than 210 countries and territories, we are building a sustainable world that unlocks priceless possibilities for all. www.mastercard.com"
MA,2022-10-27,2022-10-27,,2022-10-27,2022-10-27T09:00:00-04:00,0,2022-10-27,pre,2022-10-24 05:06:00,fool.com,The Motley Fool,https://www.fool.com/investing/2022/10/24/7-top-stocks-that-can-make-you-richer-in-2023/,7 Top Stocks That Can Make You Richer in 2023,"7 Top Stocks That Can Make You Richer in 2023
Bargains abound following a tumultuous year for Wall Street."
MA,2022-10-27,2022-10-27,,2022-10-27,2022-10-27T09:00:00-04:00,0,2022-10-27,pre,2022-10-26 22:33:42,seekingalpha.com,Seeking Alpha,https://seekingalpha.com/article/4549651-buy-7-october-buffett-dividend-dog-stocks-watch-one-more,Buy 7 October Buffett Dividend Dogs And Watch One More,"Buy 7 October Buffett Dividend Dogs And Watch One More
This Buffett holdings list from Kiplinger first appeared 8/15/22 on line. YCharts and Dogs of The Dow also track this Buffett/Berkshire batch. Here is your update from 10/24/22 YCharts data. 31 of 47 current Berkshire-Hathaway-owned-stocks pay dividends. As of 10/24/22, the top-ten ranged 3.28%-5.18% by annual-yield and 45 of 47 ranged -2.67% to 65.66% per broker-estimated price-target-upsides."
MA,2022-10-27,2022-10-27,,2022-10-27,2022-10-27T09:00:00-04:00,0,2022-10-27,pre,2022-10-26 09:29:23,investorplace.com,InvestorPlace,https://investorplace.com/2022/10/7-stocks-set-for-a-stellar-earnings-smasher/,7 Stocks Set for a Stellar Earnings Smasher,"7 Stocks Set for a Stellar Earnings Smasher
It's a big week for stock investors, with several top U.S. companies reporting their third-quarter earnings. Most experts expect earnings to be poor, with the trends seen earlier in the year projected to continue into the third and fourth quarters."
MA,2022-10-27,2022-10-27,,2022-10-27,2022-10-27T09:00:00-04:00,0,2022-10-27,post,2022-10-27 16:33:15,zacks.com,Zacks Investment Research,https://www.zacks.com/stock/news/1998892/mastercard-s-ma-q3-earnings-beat-estimates-on-better-gdv,Mastercard's (MA) Q3 Earnings Beat Estimates on Better GDV,"Mastercard's (MA) Q3 Earnings Beat Estimates on Better GDV
Mastercard's (MA) third-quarter results show improved consumer spending reflected in higher GDV and solid cross-border volume, partly offset by increased operating expenses."
MA,2022-10-27,2022-10-27,,2022-10-27,2022-10-27T09:00:00-04:00,0,2022-10-27,post,2022-10-27 14:22:32,invezz.com,Invezz,https://invezz.com/news/2022/10/27/should-i-buy-mastercard-shares-after-the-q3-results/,Should I buy Mastercard shares after the Q3 results?,"Should I buy Mastercard shares after the Q3 results?
Mastercard Incorporated (NYSE: MA) reported better-than-expected third-quarter results this Thursday, and CEO Michael Miebach said that consumer spending remains resilient and cross-border travel continues to recover. Mastercard continues to improve its position in the market Mastercard reported better-than-expected third-quarter results this Thursday; total revenue has increased by 15.5% Y/Y to $5."
MA,2022-10-27,2022-10-27,,2022-10-27,2022-10-27T09:00:00-04:00,0,2022-10-27,post,2022-10-27 13:05:05,seekingalpha.com,Seeking Alpha,https://seekingalpha.com/article/4549935-mastercard-ma-q3-2022-earnings-call-transcript,Mastercard (MA) Q3 2022 Earnings Call Transcript,"Mastercard (MA) Q3 2022 Earnings Call Transcript
Mastercard Incorporated (NYSE:MA ) Q3 2022 Earnings Conference Call October 27, 2022 9:00 AM ET Company Participants Michael Miebach - Chief Executive Officer Sachin Mehra - Chief Financial Officer Warren Kneeshaw - Head of Investor Relations Conference Call Participants Sanjay Sakhrani - KBW Lisa Ellis - MoffettNathanson Darrin Peller - Wolfe Research Harshita Rawat - Bernstein Tien-Tsin Huang - JP Morgan Ashwin Shirvaikar - Citi Rayna Kumar - UBS Jason Kupferberg - Bank of America Tim Chiodo - Credit Suisse Andrew Jeffrey - Truist Securities Bryan Keane - Deutsche Bank Ramsey El-Assal - Barclays Bob Napoli - William Blair Jamie Friedman - Susquehanna Financial Operator Good morning. My name is Audra and I will be your conference Operator today."
