ticker,earnings_date,day0_date,day0_dt,call_date,call_dt,call_gap_days,news_folder_date,phase,publishedDate,site,publisher,url,title,text
MA,2023-10-26,2023-10-26,,2023-10-26,2023-10-26T09:00:00-04:00,0,2023-10-26,post,2023-10-30 12:47:22,zacks.com,Zacks Investment Research,https://www.zacks.com/stock/news/2174663/wex-vs-ma-which-stock-is-the-better-value-option,WEX vs. MA: Which Stock Is the Better Value Option?,"WEX vs. MA: Which Stock Is the Better Value Option?
Investors interested in stocks from the Financial Transaction Services sector have probably already heard of Wex (WEX) and MasterCard (MA). But which of these two companies is the best option for those looking for undervalued stocks?"
MA,2023-10-26,2023-10-26,,2023-10-26,2023-10-26T09:00:00-04:00,0,2023-10-26,post,2023-10-30 13:37:14,pymnts.com,PYMNTS,https://www.pymnts.com/news/b2b-payments/2023/agoda-and-mastercard-strengthen-partnership-on-travel-industry-b2b-payments/?utm_source=snapi,Agoda and Mastercard Strengthen Partnership on Travel Industry B2B Payments,"Agoda and Mastercard Strengthen Partnership on Travel Industry B2B Payments
Singapore-based digital travel platform Agoda has reportedly expanded its partnership with Mastercard to enhance B2B payments within the travel and tourism industry. The collaboration aims to address the increasing digitalization of the sector and streamline transactions between digital travel platforms, hotels, airlines, suppliers and vendors globally, Payment Expert reported Monday (Oct. 30)."
MA,2023-10-26,2023-10-26,,2023-10-26,2023-10-26T09:00:00-04:00,0,2023-10-26,post,2023-10-31 12:46:26,zacks.com,Zacks Investment Research,https://www.zacks.com/commentary/2175232/5-financial-transaction-stocks-to-watch-amid-booming-digitization,5 Financial Transaction Stocks to Watch Amid Booming Digitization,"5 Financial Transaction Stocks to Watch Amid Booming Digitization
A booming digital era, favorable consumer spending habits and technology advancements may drive the Financial Transaction Services space. Stocks like V, MA, FI, GPN and FLT are poised to benefit from the favorable industry trends."
MA,2023-10-26,2023-10-26,,2023-10-26,2023-10-26T09:00:00-04:00,0,2023-10-26,post,2023-11-01 09:30:43,benzinga.com,Benzinga,https://www.benzinga.com/trading-ideas/23/11/35537532/crisis-or-opportunity-analyzing-mastercards-5-post-earnings-plunge-and-prospects-for-a-robust-recov?utm_source=snapi,Crisis Or Opportunity? Analyzing Mastercard's 5% Post-Earnings Plunge And Prospects For A Robust Recovery - Mastercard (NYSE:MA),"Crisis Or Opportunity? Analyzing Mastercard's 5% Post-Earnings Plunge And Prospects For A Robust Recovery - Mastercard (NYSE:MA)
Mastercard Inc MA stock price dropped by 5% after the release of its latest earnings report."
MA,2023-10-26,2023-10-26,,2023-10-26,2023-10-26T09:00:00-04:00,0,2023-10-26,post,2023-11-01 14:16:47,pymnts.com,PYMNTS,https://www.pymnts.com/smbs/2023/mastercard-eedenbull-collaborate-smb-spend-management-tool/?utm_source=snapi,Mastercard and EedenBull Collaborate on SMB Spend Management Tool,"Mastercard and EedenBull Collaborate on SMB Spend Management Tool
Mastercard and EedenBull, a FinTech focused on digital payment management solutions, teamed up to introduce a card and spend management solution for small- to medium-sized businesses (SMBs) in the Asia-Pacific (APAC) region."
MA,2023-10-26,2023-10-26,,2023-10-26,2023-10-26T09:00:00-04:00,0,2023-10-26,post,2023-11-02 09:25:00,businesswire.com,Business Wire,https://www.businesswire.com/news/home/20231101343694/en/Mastercard-Partners-With-Live-Nation-to-Offer-Exclusive-Live-Music-Benefits-and-Experiences-for-Cardholders-Around-the-World/,Mastercard Partners With Live Nation to Offer Exclusive Live Music Benefits and Experiences for Cardholders Around the World,"Mastercard Partners With Live Nation to Offer Exclusive Live Music Benefits and Experiences for Cardholders Around the World
PURCHASE, N.Y. & LOS ANGELES--(BUSINESS WIRE)-- #PricelessExperiences--Mastercard partners with Live Nation to bring exclusive music benefits to millions of cardholders in 19 markets across Asia-Pacific and Europe."
MA,2023-10-26,2023-10-26,,2023-10-26,2023-10-26T09:00:00-04:00,0,2023-10-26,post,2023-11-03 06:10:00,investorplace.com,InvestorPlace,https://investorplace.com/2023/11/find-stability-in-the-market-with-these-7-blue-chip-stocks-to-buy/,Find Stability in the Market With These 7 Blue-Chip Stocks to Buy,"Find Stability in the Market With These 7 Blue-Chip Stocks to Buy
The stock market has helped many investors generate long-term returns. However, the market has various stretches of high volatility that can rattle many investors."
MA,2023-10-26,2023-10-26,,2023-10-26,2023-10-26T09:00:00-04:00,0,2023-10-26,post,2023-11-03 06:50:00,fool.com,The Motley Fool,https://www.fool.com/investing/2023/11/03/reduce-excessive-credit-card-fees-why-visa-and-mas/,"""Reduce Excessive Credit Card Fees"": Why Visa and Mastercard Investors Should Keep an Eye on Congress","""Reduce Excessive Credit Card Fees"": Why Visa and Mastercard Investors Should Keep an Eye on Congress
Members of Congress have reintroduced the Credit Card Competition Act, which aims to increase competition among credit card processors. Proponents say the bill will lower fees for merchants, who could pass those savings on to consumers."
MA,2023-10-26,2023-10-26,,2023-10-26,2023-10-26T09:00:00-04:00,0,2023-10-26,post,2023-11-03 09:47:54,zacks.com,Zacks Investment Research,https://www.zacks.com/stock/news/2177894/why-you-should-tap-fintech-etfs-stocks-in-the-holiday-season,Why You Should Tap Fintech ETFs & Stocks in the Holiday Season,"Why You Should Tap Fintech ETFs & Stocks in the Holiday Season
Despite decreasing personal income and savings rates, Americans' personal expenditure saw a sequential increase in September. Holiday season sales forecast is also upbeat."
MA,2023-10-26,2023-10-26,,2023-10-26,2023-10-26T09:00:00-04:00,0,2023-10-26,post,2023-11-04 06:30:00,fool.com,The Motley Fool,https://www.fool.com/investing/2023/11/04/beat-the-nasdaq-this-dividend-stock-has-actually-d/,Beat the Nasdaq? This Dividend Stock Has Actually Done It,"Beat the Nasdaq? This Dividend Stock Has Actually Done It
Mastercard is a leading payments network company. The business is jaw-droppingly lucrative."
MA,2023-10-26,2023-10-26,,2023-10-26,2023-10-26T09:00:00-04:00,0,2023-10-26,post,2023-11-06 10:37:48,seekingalpha.com,Seeking Alpha,https://seekingalpha.com/article/4648006-4-factor-dividend-growth-portfolio-year-one-on-books,4 Factor Dividend Growth Portfolio: Year One Is On The Books,"4 Factor Dividend Growth Portfolio: Year One Is On The Books
The 4-factor dividend growth portfolio is a strategy that leverages the stock selection process of Schwab U.S. Dividend Equity ETF, with a few minor twists. The portfolio fell by 3.07% in October, underperforming the S&P 500 by 0.97%. Year-to-date, the portfolio is up 3.61%."
MA,2023-10-26,2023-10-26,,2023-10-26,2023-10-26T09:00:00-04:00,0,2023-10-26,post,2023-11-07 05:59:00,fool.com,The Motley Fool,https://www.fool.com/investing/2023/11/07/better-buy-visa-or-mastercard/,Better Buy: Visa or Mastercard?,"Better Buy: Visa or Mastercard?
Visa has a lower price-to-earnings ratio than Mastercard. Visa has a higher annual dividend yield after a recent 16% raise."
MA,2023-10-26,2023-10-26,,2023-10-26,2023-10-26T09:00:00-04:00,0,2023-10-26,post,2023-11-08 07:15:00,seekingalpha.com,Seeking Alpha,https://seekingalpha.com/article/4648144-7-dividend-aristocrats-you-should-buy-before-too-late,7 Dividend Aristocrats You Should Buy Before It's Too Late,"7 Dividend Aristocrats You Should Buy Before It's Too Late
U.S. stocks had their best week in a year, with the S&P soaring almost 6% and tech stocks surging over 7%. It was a primarily speculation-driven rally with the lowest-quality stocks up 18%. But that doesn't mean high-quality dividend growth isn't available at a steep discount. Growth at a reasonable price, with a PEG ratio of close to 1, can help avoid paying dangerous valuations for quality companies."
MA,2023-10-26,2023-10-26,,2023-10-26,2023-10-26T09:00:00-04:00,0,2023-10-26,post,2023-11-08 09:30:00,forbes.com,Forbes,https://www.forbes.com/sites/brettowens/2023/11/08/3-top-dividend-growers-for-2024/,3 Top Dividend Growers For 2024,"3 Top Dividend Growers For 2024
2024 is setting up to be a great year for us contrarian dividend investors—but to take full advantage, we need to buy now—while fear is still in the air."
MA,2023-10-26,2023-10-26,,2023-10-26,2023-10-26T09:00:00-04:00,0,2023-10-26,post,2023-11-09 18:01:41,investorplace.com,InvestorPlace,https://investorplace.com/2023/11/how-trading-beats-buy-and-hold/,How Trading Beats Buy-and-Hold,"How Trading Beats Buy-and-Hold
Is it really so bad to miss the best days of market performance?"
MA,2024-01-31,2024-01-31,,2024-01-31,2024-01-31T09:00:00-05:00,0,2024-01-31,pre,2024-01-18 15:37:56,investorplace.com,InvestorPlace,https://investorplace.com/2024/01/3-top-rated-fintech-stocks-wall-street-analysts-are-loving-now-january-2024/,3 Top-Rated Fintech Stocks Wall Street Analysts Are Loving Now: January 2024,"3 Top-Rated Fintech Stocks Wall Street Analysts Are Loving Now: January 2024
Fintech companies make it easier for people and companies to manage their money and financial transactions. Investors can benefit from the growing demand for financial technology services by investing in various fintech stocks."
MA,2024-01-31,2024-01-31,,2024-01-31,2024-01-31T09:00:00-05:00,0,2024-01-31,pre,2024-01-18 14:11:30,investorplace.com,InvestorPlace,https://investorplace.com/2024/01/3-forever-dividend-stocks-to-lock-up-now-and-throw-away-the-key/,3 ‘Forever' Dividend Stocks to Lock Up Now and Throw Away the Key,"3 ‘Forever' Dividend Stocks to Lock Up Now and Throw Away the Key
While there's no one best way to invest, buying dividend stocks has to rank high on the list. That's because dividend payers tend to be successful, profitable companies tested in the crucible of numerous market and business cycles."
MA,2024-01-31,2024-01-31,,2024-01-31,2024-01-31T09:00:00-05:00,0,2024-01-31,pre,2024-01-18 13:51:03,zacks.com,Zacks Investment Research,https://www.zacks.com/stock/news/2212375/mastercard-ma-renews-tie-up-boosts-digitization-in-pakistan?cid=CS-STOCKNEWSAPI-FT-analyst_blog|company_news_-_finance_sector-2212375,"Mastercard (MA) Renews Tie-Up, Boosts Digitization in Pakistan","Mastercard (MA) Renews Tie-Up, Boosts Digitization in Pakistan
Mastercard (MA) teams up with UBL to infuse attractive features within MA's card offerings and thereby, enabling Pakistan's consumers to easily adopt digital means."
MA,2024-01-31,2024-01-31,,2024-01-31,2024-01-31T09:00:00-05:00,0,2024-01-31,pre,2024-01-18 08:00:18,gurufocus.com,GuruFocus,https://www.gurufocus.com/news/2153186/consider-a-blockchain-etf-as-an-alternative-to-bitcoin,Consider a Blockchain ETF as an Alternative to Bitcoin,"Consider a Blockchain ETF as an Alternative to Bitcoin
As a portfolio manager with an active investment strategy, I always found investing in exchange-traded funds somewhat unexciting. On the other side of the aisle was crypto, which is not for the faint of heart and not an asset class that I wanted to include in my investment portfolio."
MA,2024-01-31,2024-01-31,,2024-01-31,2024-01-31T09:00:00-05:00,0,2024-01-31,pre,2024-01-20 09:00:00,seekingalpha.com,Seeking Alpha,https://seekingalpha.com/article/4663329-our-top-10-dividend-growth-stocks-january-2024,Our Top 10 Dividend Growth Stocks - January 2024,"Our Top 10 Dividend Growth Stocks - January 2024
This article focuses on selecting high-growth dividend stocks that have rapidly grown their dividends in the recent past rather than simply sport a high current yield. We use our proprietary models to rate quantitatively and qualitatively and select the top ten names from an initial list of nearly 400 dividend stocks. The article provides criteria for selecting high-growth dividend stocks. It offers a step-by-step guide on structuring a portfolio based on this strategy."
MA,2024-01-31,2024-01-31,,2024-01-31,2024-01-31T09:00:00-05:00,0,2024-01-31,pre,2024-01-20 08:24:00,fool.com,The Motley Fool,https://www.fool.com/investing/2024/01/20/2-top-tech-stocks-you-need-for-2024-and-beyond/,2 Top Tech Stocks You Need for 2024 and Beyond,"2 Top Tech Stocks You Need for 2024 and Beyond
Visa and Mastercard have been wonderful long-term investments but both hit speed bumps in recent years. Profitable growth could continue for many more years to come thanks to these companies' business models."
MA,2024-01-31,2024-01-31,,2024-01-31,2024-01-31T09:00:00-05:00,0,2024-01-31,pre,2024-01-22 18:56:24,zacks.com,Zacks Investment Research,https://www.zacks.com/stock/news/2213793/mastercard-ma-surpasses-market-returns-some-facts-worth-knowing?cid=CS-STOCKNEWSAPI-FT-tale_of_the_tape|yseop_template_6v1-2213793,MasterCard (MA) Surpasses Market Returns: Some Facts Worth Knowing,"MasterCard (MA) Surpasses Market Returns: Some Facts Worth Knowing
MasterCard (MA) closed at $439.75 in the latest trading session, marking a +0.68% move from the prior day."
MA,2024-01-31,2024-01-31,,2024-01-31,2024-01-31T09:00:00-05:00,0,2024-01-31,pre,2024-01-22 07:30:00,seekingalpha.com,Seeking Alpha,https://seekingalpha.com/article/4663895-mastercard-a-dividend-growth-beast-worth-buying-now,Mastercard: A Dividend Growth Beast Worth Buying Now,"Mastercard: A Dividend Growth Beast Worth Buying Now
Buying businesses with secular growth tailwinds tends to yield impressive results over the long haul. Mastercard posted solid net revenue and non-GAAP EPS growth in the third quarter. The company's healthy financial position earns it an A+ credit rating from S&P on a stable outlook."
MA,2024-01-31,2024-01-31,,2024-01-31,2024-01-31T09:00:00-05:00,0,2024-01-31,pre,2024-01-23 17:57:28,investorplace.com,InvestorPlace,https://investorplace.com/2024/01/beyond-the-magnificent-7-stocks-3-underdogs-to-watch-in-2024/,Beyond the Magnificent 7 Stocks: 3 Underdogs to Watch in 2024,"Beyond the Magnificent 7 Stocks: 3 Underdogs to Watch in 2024
The positive future performance of the economy hinges on addressing concerns about businesses' adaptation to post-pandemic dynamics. Efforts include renegotiating discounts with manufacturers as retailers seek to regain bargaining power."
MA,2024-01-31,2024-01-31,,2024-01-31,2024-01-31T09:00:00-05:00,0,2024-01-31,pre,2024-01-23 15:09:31,investorplace.com,InvestorPlace,https://investorplace.com/2024/01/12-stocks-near-record-highs-thanks-to-bullish-consumer-sentiment/,12 Stocks Near Record Highs Thanks to Bullish Consumer Sentiment,"12 Stocks Near Record Highs Thanks to Bullish Consumer Sentiment
The stock market is off to a solid start of 2024. All the major indices are at or near all-time highs, thanks in large part to bullish sentiment for tech."
MA,2024-01-31,2024-01-31,,2024-01-31,2024-01-31T09:00:00-05:00,0,2024-01-31,pre,2024-01-23 10:50:56,zacks.com,Zacks Investment Research,https://www.zacks.com/commentary/2214021/5-financial-transaction-stocks-to-gain-from-favorable-consumer-spending?cid=CS-STOCKNEWSAPI-FT-industry_outlook-2214021,5 Financial Transaction Stocks to Gain From Favorable Consumer Spending,"5 Financial Transaction Stocks to Gain From Favorable Consumer Spending
The widespread uptake of digital payments and continuous pursuit of M&A strategies may aid the Financial Transaction Services space. Stocks like V, MA, FI, FIS and EFX are poised to benefit from the favorable industry trends."
MA,2024-01-31,2024-01-31,,2024-01-31,2024-01-31T09:00:00-05:00,0,2024-01-31,pre,2024-01-23 07:45:00,fool.com,The Motley Fool,https://www.fool.com/investing/2024/01/23/3-things-need-to-know-before-buy-top-buffett-stock/,3 Things You Need to Know Before Buying This Top Warren Buffett Stock,"3 Things You Need to Know Before Buying This Top Warren Buffett Stock
American Express's business model differs from the two largest payment networks. A recognized brand and network effects support the company's strong industry position."
MA,2024-01-31,2024-01-31,,2024-01-31,2024-01-31T09:00:00-05:00,0,2024-01-31,pre,2024-01-23 03:08:17,proactiveinvestors.com,Proactive Investors,https://www.proactiveinvestors.co.uk/companies/news/1039108?SNAPI,Cornerstone FS agrees to launch corporate cards with Mastercard,"Cornerstone FS agrees to launch corporate cards with Mastercard
Cornerstone FS PLC (AIM:CSFS) told investors it is expanding its customer offering with the launch of a corporate card scheme with Mastercard planned for the third quarter of the year.  Under the agreement signed with the card payment network processor, the AIM-listed company will be able to issue commercial cards for its corporate customers with branding from Cornerstone and Mastercard."
MA,2024-01-31,2024-01-31,,2024-01-31,2024-01-31T09:00:00-05:00,0,2024-01-31,pre,2024-01-24 18:51:14,zacks.com,Zacks Investment Research,https://www.zacks.com/stock/news/2215288/mastercard-ma-stock-declines-while-market-improves-some-information-for-investors?cid=CS-STOCKNEWSAPI-FT-tale_of_the_tape|yseop_template_6-2215288,MasterCard (MA) Stock Declines While Market Improves: Some Information for Investors,"MasterCard (MA) Stock Declines While Market Improves: Some Information for Investors
MasterCard (MA) reachead $438.70 at the closing of the latest trading day, reflecting a -0.01% change compared to its last close."
MA,2024-01-31,2024-01-31,,2024-01-31,2024-01-31T09:00:00-05:00,0,2024-01-31,pre,2024-01-24 14:22:20,pymnts.com,PYMNTS,https://www.pymnts.com/news/biometrics/2024/mastercard-launches-service-to-ease-adoption-of-biometric-authentication/?utm_source=snapi,Mastercard Launches Service to Ease Adoption of Biometric Authentication,"Mastercard Launches Service to Ease Adoption of Biometric Authentication
Mastercard has launched the Mastercard Biometric Authentication Service, a solution aimed at enhancing security and convenience for consumers. The service leverages biometrics, such as fingerprints, iris scans and facial recognition, to verify identity and secure personal data, the company said in a Wednesday (Jan. 24) press release."
MA,2024-01-31,2024-01-31,,2024-01-31,2024-01-31T09:00:00-05:00,0,2024-01-31,pre,2024-01-24 11:21:05,zacks.com,Zacks Investment Research,https://www.zacks.com/stock/news/2215069/4-service-firms-poised-to-beat-estimates-this-earnings-season?cid=CS-STOCKNEWSAPI-FT-earnings_esp-2215069,4 Service Firms Poised to Beat Estimates This Earnings Season,"4 Service Firms Poised to Beat Estimates This Earnings Season
Here, we have picked four business service stocks that are likely to beat earnings estimates, namely, Booz Allen (BAH), FLEETCOR (FLT), Rollins (ROL) and Mastercard (MA)."
MA,2024-01-31,2024-01-31,,2024-01-31,2024-01-31T09:00:00-05:00,0,2024-01-31,pre,2024-01-24 11:16:10,zacks.com,Zacks Investment Research,https://www.zacks.com/stock/news/2215064/mastercard-ma-and-adgm-collaborate-to-boost-uae-sme-growth?cid=CS-STOCKNEWSAPI-FT-analyst_blog|company_news_-_finance_sector-2215064,Mastercard (MA) and ADGM Collaborate to Boost UAE SME Growth,"Mastercard (MA) and ADGM Collaborate to Boost UAE SME Growth
Mastercard (MA) and ADGM join forces to propel UAE's SME sector, fostering digital transformation and growth through innovative payment solutions and financing opportunities."
MA,2024-01-31,2024-01-31,,2024-01-31,2024-01-31T09:00:00-05:00,0,2024-01-31,pre,2024-01-24 11:06:52,zacks.com,Zacks Investment Research,https://www.zacks.com/stock/news/2215043/mastercard-ma-reports-next-week-wall-street-expects-earnings-growth?cid=CS-STOCKNEWSAPI-FT-tale_of_the_tape|yseop_template_9-2215043,MasterCard (MA) Reports Next Week: Wall Street Expects Earnings Growth,"MasterCard (MA) Reports Next Week: Wall Street Expects Earnings Growth
MasterCard (MA) possesses the right combination of the two key ingredients for a likely earnings beat in its upcoming report. Get prepared with the key expectations."
MA,2024-01-31,2024-01-31,,2024-01-31,2024-01-31T09:00:00-05:00,0,2024-01-31,pre,2024-01-24 09:00:00,businesswire.com,Business Wire,https://www.businesswire.com/news/home/20240124388149/en/The-Recording-Academy%C2%AE%E2%80%99s-GRAMMY%C2%AE-House-Presented-by-Mastercard%C2%AE-Returns-Thurs-Feb.-1-%E2%80%93-Sat-Feb.-3-2024/,"The Recording Academy®'s GRAMMY® House, Presented by Mastercard®, Returns Thurs, Feb. 1 – Sat, Feb. 3, 2024","The Recording Academy®'s GRAMMY® House, Presented by Mastercard®, Returns Thurs, Feb. 1 – Sat, Feb. 3, 2024
SANTA MONICA, Calif.--(BUSINESS WIRE)--The Recording Academy®'s GRAMMY® House is returning for a second consecutive year for music makers, culture creators and rising industry leaders to participate in three program-packed days leading up to the 66th Annual GRAMMY Awards® airing Sun, Feb. 4 on CBS and Paramount+. GRAMMY House is presented by Mastercard and runs from Thurs, Feb. 1, 2024, to Sat, Feb. 3, 2024, in Los Angeles. As a longtime sponsor of the GRAMMY Awards, Mastercard is committed to."
MA,2024-01-31,2024-01-31,,2024-01-31,2024-01-31T09:00:00-05:00,0,2024-01-31,pre,2024-01-24 09:00:00,businesswire.com,Business Wire,https://www.businesswire.com/news/home/20240124745602/en/Mastercard-and-The-Clearing-House-Extend-Partnership-on-Real-Time-Payments/,Mastercard and The Clearing House Extend Partnership on Real-Time Payments,"Mastercard and The Clearing House Extend Partnership on Real-Time Payments
PURCHASE, N.Y. & NEW YORK--(BUSINESS WIRE)--Mastercard and The Clearing House (TCH) have announced an extended multi-year partnership, bringing the companies together to collaborate on innovative capabilities for consumers, businesses and governments to evolve and embrace the digital economy through real-time payments (RTP) adoption on the RTP® network. The partnership continues Mastercard's role as the exclusive instant payments software provider for TCH's RTP network, enabling both companies."
MA,2024-01-31,2024-01-31,,2024-01-31,2024-01-31T09:00:00-05:00,0,2024-01-31,pre,2024-01-25 13:21:05,zacks.com,Zacks Investment Research,https://www.zacks.com/stock/news/2216051/mastercard-ma-and-the-clearing-house-extend-partnership?cid=CS-STOCKNEWSAPI-FT-analyst_blog|company_news_-_corporate_actions-2216051,Mastercard (MA) and The Clearing House Extend Partnership,"Mastercard (MA) and The Clearing House Extend Partnership
Mastercard (MA) and The Clearing House strengthen their collaboration, propelling real-time payments innovation in the digital economy."
MA,2024-01-31,2024-01-31,,2024-01-31,2024-01-31T09:00:00-05:00,0,2024-01-31,pre,2024-01-25 05:45:00,fool.com,The Motley Fool,https://www.fool.com/investing/2024/01/25/mastercard-stock-buy-sell-or-hold/,"Mastercard Stock: Buy, Sell, or Hold?","Mastercard Stock: Buy, Sell, or Hold?
Top- and bottom-line growth is healthy despite Mastercard's colossal size. A robust competitive position helps maintain strong fundamentals."
MA,2024-01-31,2024-01-31,,2024-01-31,2024-01-31T09:00:00-05:00,0,2024-01-31,pre,2024-01-26 15:25:41,investopedia.com,Investopedia,https://www.investopedia.com/international-fee-growth-leads-mastercard-s-expected-profit-gain-8549624,International Fee Growth Leads Mastercard's Expected Profit Gain,"International Fee Growth Leads Mastercard's Expected Profit Gain
Continued growth in both payments processing and value-added services is likely to propel Mastercard Inc.'s fourth-quarter earnings to solid gains when the company reports on Jan. 31, analysts say."
MA,2024-01-31,2024-01-31,,2024-01-31,2024-01-31T09:00:00-05:00,0,2024-01-31,pre,2024-01-26 10:46:06,zacks.com,Zacks Investment Research,https://www.zacks.com/stock/news/2216485/here-s-why-mastercard-ma-is-a-strong-growth-stock?cid=CS-STOCKNEWSAPI-FT-tale_of_the_tape|zacks_education_growth_score-2216485,Here's Why MasterCard (MA) is a Strong Growth Stock,"Here's Why MasterCard (MA) is a Strong Growth Stock
Whether you're a value, growth, or momentum investor, finding strong stocks becomes easier with the Zacks Style Scores, a top feature of the Zacks Premium research service."
MA,2024-01-31,2024-01-31,,2024-01-31,2024-01-31T09:00:00-05:00,0,2024-01-31,pre,2024-01-26 10:21:29,zacks.com,Zacks Investment Research,https://www.zacks.com/stock/news/2216438/exploring-analyst-estimates-for-mastercard-ma-q4-earnings-beyond-revenue-and-eps?cid=CS-STOCKNEWSAPI-FT-fundamental_analysis|nfm_preview-2216438,"Exploring Analyst Estimates for MasterCard (MA) Q4 Earnings, Beyond Revenue and EPS","Exploring Analyst Estimates for MasterCard (MA) Q4 Earnings, Beyond Revenue and EPS
Get a deeper insight into the potential performance of MasterCard (MA) for the quarter ended December 2023 by going beyond Wall Street's top -and-bottom-line estimates and examining the estimates for some of its key metrics."
MA,2024-01-31,2024-01-31,,2024-01-31,2024-01-31T09:00:00-05:00,0,2024-01-31,pre,2024-01-26 07:06:06,zacks.com,Zacks Investment Research,https://www.zacks.com/stock/news/2216305/can-mastercard-s-ma-q4-earnings-beat-on-cross-border-volumes?cid=CS-STOCKNEWSAPI-FT-analyst_blog|earnings_preview-2216305,Can Mastercard's (MA) Q4 Earnings Beat on Cross-Border Volumes?,"Can Mastercard's (MA) Q4 Earnings Beat on Cross-Border Volumes?
Mastercard's (MA) fourth-quarter results are likely to reflect increased operating costs, GDV and transactions."
MA,2024-01-31,2024-01-31,,2024-01-31,2024-01-31T09:00:00-05:00,0,2024-01-31,pre,2024-01-27 09:30:00,fool.com,The Motley Fool,https://www.fool.com/investing/2024/01/27/buy-magnificent-warren-buffett-stock-2024/,"Should You Buy This Magnificent Warren Buffett Stock With $1,000 in 2024?","Should You Buy This Magnificent Warren Buffett Stock With $1,000 in 2024?
Consistently high levels of profitability are par for the course for Mastercard. As a two-sided platform, Mastercard benefits from ""network effects."
