ticker,earnings_date,day0_date,day0_dt,call_date,call_dt,call_gap_days,news_folder_date,phase,publishedDate,site,publisher,url,title,text
MA,2021-10-28,2021-10-28,,2021-10-28,2021-10-28T09:00:00-04:00,0,2021-10-28,pre,2021-10-20 13:59:55,zacks.com,Zacks Investment Research,https://www.zacks.com/stock/news/1813374/has-mastercard-ma-outpaced-other-business-services-stocks-this-year,Has Mastercard (MA) Outpaced Other Business Services Stocks This Year?,"Has Mastercard (MA) Outpaced Other Business Services Stocks This Year?
Is (MA) Outperforming Other Business Services Stocks This Year?"
MA,2021-10-28,2021-10-28,,2021-10-28,2021-10-28T09:00:00-04:00,0,2021-10-28,pre,2021-10-20 19:18:49,zacks.com,Zacks Investment Research,https://www.zacks.com/stock/news/1813770/mastercard-ma-stock-sinks-as-market-gains-what-you-should-know,MasterCard (MA) Stock Sinks As Market Gains: What You Should Know,"MasterCard (MA) Stock Sinks As Market Gains: What You Should Know
In the latest trading session, MasterCard (MA) closed at $356.77, marking a -1.47% move from the previous day."
MA,2021-10-28,2021-10-28,,2021-10-28,2021-10-28T09:00:00-04:00,0,2021-10-28,pre,2021-10-21 06:00:00,businesswire.com,Business Wire,https://www.businesswire.com/news/home/20211021005243/en/Mastercard-Advances-B2B-Payments-with-New-Supply-Chain-Finance-Offering-Empowering-More-Businesses-to-Secure-Working-Capital-They-Need-to-Grow,"Mastercard Advances B2B Payments with New Supply Chain Finance Offering, Empowering More Businesses to Secure Working Capital They Need to Grow","Mastercard Advances B2B Payments with New Supply Chain Finance Offering, Empowering More Businesses to Secure Working Capital They Need to Grow
PURCHASE, N.Y.--(BUSINESS WIRE)--Mastercard today announced a new supply chain finance capability within Track Business Payment Service (Track BPS) – designed to increase access to working capital while lowering costs, reducing complexity and risk, and accelerating automation when businesses pay and get paid. Launched in partnership with Demica, a leading global provider of supply chain finance technology, this new offering empowers Mastercard partners to provide their business customers with access to affordable working capital. Mastercard Track, an open-loop network, can now connect providers of B2B payments and their respective buyer and supplier customers to working capital. A lack of scalable solutions in the market has put supply chain financing out of reach for many businesses. As a result, only the largest suppliers can access working capital solutions, while trillions of dollars are tied up in accounts receivable each year. Mastercard’s solution unlocks a network for working capital - covering small businesses and global corporations alike, driving speed to market, and offering ease of integration for payment partners. Demica brings a global, flexible, multi-product financing platform and expansive network of banks and other funders at scale. Payment partners and their customers can benefit from Demica’s capabilities ranging from advisory services, supplier onboarding, and a white-labelled deployment process. “We are delighted to be working with Mastercard to transform the B2B payments landscape. This partnership will unite Demica’s scalable platform technology with Mastercard’s powerful infrastructure to make a real difference for businesses globally,” said Matt Wreford, CEO, Demica. “Our platform automates financing of payables and receivables and our global network of banks and non-bank investors opens up access to new sources of capital – we’re excited to bring these benefits to more companies through our global partnership with Mastercard.” By launching this first of its kind, embedded working capital capability in Mastercard’s Track Business Payment Service multi-rail platform, Mastercard is doubling down on its commitment to empower every business to get the working capital they need to thrive. This solution enables payment partners to extend the reach of buyer programs to more of their supply chain partners, strengthening supplier relationships. Suppliers gain improved access to competitively priced early payments and enjoy enhanced user experiences, such as one-time enrollment, standard agreements, and easy implementation leveraging their partner connections. Craig Vosburg, Chief Product Officer, Mastercard says, “Helping businesses optimize their working capital has been one of the key goals of Mastercard Track Business Payment Service. Disparate systems and processes in the current B2B ecosystem continue to make cash flow management complicated, increase operating costs, and hinder business growth. Our new offering and partnership with Demica help solve these pain points by allowing buyers and suppliers to unlock their working capital and deploy it to grow their businesses – enabling choice and scale and accelerating financial inclusion.” Mastercard is integrating its Track Business Payment Service network and its blockchain-based Mastercard Provenance Solution in supply chains across industries. Buyers and suppliers will see improved visibility, traceability, and procure-to-pay cycle times. As a result, payment partners can use this data to reduce risk, decrease reconciliation costs, and help further advance early payments in the accounts payable and receivable processes. The offering will provide access and support to a new suite of APIs to power each step of the commercial payments journey. Learn more at Mastercard Developers. This new supply chain finance offering is available on Account-to-Account (A2A) rails in the United States with plans for global expansion throughout 2022 as Mastercard continues to onboard partners in this space through its focused approach to global trade. New Track BPS Partners Offer Choice for Customers Around the World Mastercard continues its strong growth with network partners supporting Track Business Payment Service which is now live in regions around the world for A2A and global card payments. Today, businesses of all sizes can use this service to optimize payments and streamline reconciliation through payment partners in financial services, fintech, and business automation services industries. New partnerships in North America include HSBC, FreshBooks, FISPAN and SnapAP who will offer the Track Business Payment Service capability to their commercial customers. In addition, global scale continues around the world with new partners in the Middle East & Africa, Latin America, Europe and Asia Pacific including: Abu Dhabi Commercial Bank, Abu Dhabi Islamic Bank, Cirralto, Emirates Islamic Bank P.J.S.C, First Abu Dhabi Bank, FlowPay, H&CO, Mashreq Bank, RAKBANK, RFM Loyalty, Standard Bank, and Telr. About Mastercard (NYSE:MA): Mastercard is a global technology company in the payments industry. Our mission is to connect and power an inclusive, digital economy that benefits everyone, everywhere by making transactions safe, simple, smart and accessible. Using secure data and networks, partnerships and passion, our innovations and solutions help individuals, financial institutions, governments and businesses realize their greatest potential. Our decency quotient, or DQ, drives our culture and everything we do inside and outside of our company. With connections across more than 210 countries and territories, we are building a sustainable world that unlocks priceless possibilities for all. About Demica: We are a market-leading fintech, powering the trade finance programmes of the world’s largest trade banks and corporations. Demica’s proposition is simple: our intuitive, cloud-based platform enables financial institutions and corporates to automate and scale their working capital solutions. Today, we have over US$18bn of programs running through our platform, across the full spectrum of working capital products. Funded by a diverse range of banks and institutional investors, these programs enable companies to strengthen their supply chains and redeploy capital to drive growth. To learn more, visit Demica.com."
MA,2021-10-28,2021-10-28,,2021-10-28,2021-10-28T09:00:00-04:00,0,2021-10-28,pre,2021-10-21 06:00:00,businesswire.com,Business Wire,https://www.businesswire.com/news/home/20211021005243/en/Mastercard-Advances-B2B-Payments-with-New-Supply-Chain-Finance-Offering-Empowering-More-Businesses-to-Secure-Working-Capital-They-Need-to-Grow/,"Mastercard Advances B2B Payments with New Supply Chain Finance Offering, Empowering More Businesses to Secure Working Capital They Need to Grow","Mastercard Advances B2B Payments with New Supply Chain Finance Offering, Empowering More Businesses to Secure Working Capital They Need to Grow
PURCHASE, N.Y.--(BUSINESS WIRE)--Mastercard Advances B2B Payments with New Supply Chain Finance Offering, Empowering More Businesses to Secure Working Capital They Need to Grow"
MA,2021-10-28,2021-10-28,,2021-10-28,2021-10-28T09:00:00-04:00,0,2021-10-28,pre,2021-10-21 12:08:56,investorplace.com,InvestorPlace,https://investorplace.com/2021/10/7-stocks-to-buy-for-a-spooky-halloween-and-beyond/,7 Stocks to Buy for a Spooky Halloween and Beyond,"7 Stocks to Buy for a Spooky Halloween and Beyond
Pent-up demand and savings should mean higher sales for these seven stocks to buy during this holiday season. The post 7 Stocks to Buy for a Spooky Halloween and Beyond appeared first on InvestorPlace."
MA,2021-10-28,2021-10-28,,2021-10-28,2021-10-28T09:00:00-04:00,0,2021-10-28,pre,2021-10-22 15:19:03,zacks.com,Zacks Investment Research,https://www.zacks.com/stock/news/1815335/what-s-in-the-cards-for-mastercard-s-ma-earnings-in-q3,What's in the Cards for Mastercard's (MA) Earnings in Q3?,"What's in the Cards for Mastercard's (MA) Earnings in Q3?
Mastercard's (MA) Q3 results are likely to reflect growth in revenues and earnings."
MA,2021-10-28,2021-10-28,,2021-10-28,2021-10-28T09:00:00-04:00,0,2021-10-28,pre,2021-10-23 05:51:00,fool.com,The Motley Fool,https://www.fool.com/investing/2021/10/23/3-no-brainer-stocks-to-buy-if-stock-market-crash/,3 No-Brainer Stocks to Buy If There's a Stock Market Crash,"3 No-Brainer Stocks to Buy If There's a Stock Market Crash
Crashes and corrections are a common occurrence, and the perfect opportunity to buy great companies at a discount."
MA,2021-10-28,2021-10-28,,2021-10-28,2021-10-28T09:00:00-04:00,0,2021-10-28,pre,2021-10-24 06:35:00,fool.com,The Motley Fool,https://www.fool.com/investing/2021/10/24/got-5000-3-stocks-to-hold-for-the-next-20-years/,"Got $5,000? 3 Stocks To Hold for the Next 20 Years","Got $5,000? 3 Stocks To Hold for the Next 20 Years
These stocks are betting on huge trends, and they're likely to win big."
MA,2021-10-28,2021-10-28,,2021-10-28,2021-10-28T09:00:00-04:00,0,2021-10-28,pre,2021-10-25 09:00:09,cnbc.com,CNBC,https://www.cnbc.com/2021/10/25/mastercard-says-any-bank-or-merchant-on-its-vast-network-can-soon-offer-crypto-services.html,Mastercard says any bank or merchant on its vast network can soon offer crypto services,"Mastercard says any bank or merchant on its vast network can soon offer crypto services
The announcement could lead to a significant expansion in the ways regular Americans earn and spend bitcoin and other cryptocurrencies."
MA,2021-10-28,2021-10-28,,2021-10-28,2021-10-28T09:00:00-04:00,0,2021-10-28,pre,2021-10-25 09:30:00,businesswire.com,Business Wire,https://www.businesswire.com/news/home/20211025005487/en/Mastercard-and-Bakkt-Partner-to-Offer-Innovative-Crypto-and-Loyalty-Solutions/,Mastercard and Bakkt Partner to Offer Innovative Crypto and Loyalty Solutions,"Mastercard and Bakkt Partner to Offer Innovative Crypto and Loyalty Solutions
LAS VEGAS & ALPHARETTA, Ga. & PURCHASE, N.Y.--(BUSINESS WIRE)--Today at Money20/20, Mastercard (NYSE: MA) and Bakkt (NYSE: BKKT) announced a multifaceted partnership to make it easier for merchants, banks and fintechs in the U.S. to embrace and offer a broad set of cryptocurrency solutions and services. Consumers, in turn, will experience expanded access to the digital asset ecosystem. Bakkt extends Mastercard's ecosystem of cryptocurrency partners enabling Crypto-as-a-Service, which provides q"
MA,2021-10-28,2021-10-28,,2021-10-28,2021-10-28T09:00:00-04:00,0,2021-10-28,pre,2021-10-25 09:51:37,fool.com,The Motley Fool,https://www.fool.com/investing/2021/10/25/dividend-stock-rolling-in-cash-is-it-a-buy-visa/,This Dividend Stock Is Rolling in Cash. But Is It a Buy?,"This Dividend Stock Is Rolling in Cash. But Is It a Buy?
Visa's excellent cash position is just one indication of why it's a great buy for its dividend and long-term returns."
MA,2021-10-28,2021-10-28,,2021-10-28,2021-10-28T09:00:00-04:00,0,2021-10-28,pre,2021-10-25 10:01:05,marketwatch.com,Market Watch,https://www.marketwatch.com/story/bakkt-shares-rise-25-after-partnership-with-mastercard-271635170287,Bakkt shares jump 25% on news of Mastercard partnership,"Bakkt shares jump 25% on news of Mastercard partnership
Bakkt Holdings Inc. shares were up 25% to $11.47 after the company said it was working with Mastercard Inc. to make it easier for merchants, banks and fintechs in the U.S. to use and offer a broad set of cryptocurrency solutions and services."
MA,2021-10-28,2021-10-28,,2021-10-28,2021-10-28T09:00:00-04:00,0,2021-10-28,pre,2021-10-25 11:11:22,forbes.com,Forbes,https://www.forbes.com/sites/jonathanponciano/2021/10/25/mastercard-debuts-new-partnership-to-help-banks-offer-crypto-credit-card-rewards/,Mastercard Debuts New Partnership To Help Banks Offer Crypto Credit Card Rewards,"Mastercard Debuts New Partnership To Help Banks Offer Crypto Credit Card Rewards
Shares of the digital wallet company tapped for the move skyrocketed more than 80% after the announcement."
MA,2021-10-28,2021-10-28,,2021-10-28,2021-10-28T09:00:00-04:00,0,2021-10-28,pre,2021-10-25 11:47:01,markets.businessinsider.com,Business Insider,https://markets.businessinsider.com/news/currencies/mastercard-crypto-merchants-cryptocurrency-bitcoin-network-payments-bakkt-stock-2021-10,Mastercard will allow US banks and millions of merchants to integrate crypto into their products,"Mastercard will allow US banks and millions of merchants to integrate crypto into their products
Mastercard users will be able to earn loyalty rewards based on digital assets."
MA,2021-10-28,2021-10-28,,2021-10-28,2021-10-28T09:00:00-04:00,0,2021-10-28,pre,2021-10-25 16:08:09,pymnts.com,PYMNTS,https://www.pymnts.com/cryptocurrency/2021/bakkt-stock-nears-25-dollars-per-share-after-mastercard-crypto-team-up/,Bakkt Stock Nears $25 Per Share After Mastercard Crypto Team-Up,"Bakkt Stock Nears $25 Per Share After Mastercard Crypto Team-Up
Digital asset platform Bakkt saw its stock jump significantly Monday (Oct. 25) in the wake of its collaboration with Mastercard that gives cryptocurrency access to its customers, Barron's reported. Mastercard will embed Bakkt's crypto offerings across its banking and shopping platforms, allowing users to buy, sell and hold digital currencies in their wallets, according to […]"
MA,2021-10-28,2021-10-28,,2021-10-28,2021-10-28T09:00:00-04:00,0,2021-10-28,pre,2021-10-25 17:21:00,fool.com,The Motley Fool,https://www.fool.com/investing/2021/10/25/markets-hit-records-is-this-red-hot-crypto-stock-n/,Markets Hit Records; Is This Red-Hot Crypto Stock Next?,"Markets Hit Records; Is This Red-Hot Crypto Stock Next?
Find out whether Bitcoin's big gains will translate into all-time highs for a recent IPO."
MA,2021-10-28,2021-10-28,,2021-10-28,2021-10-28T09:00:00-04:00,0,2021-10-28,pre,2021-10-25 19:20:00,businesswire.com,Business Wire,https://www.businesswire.com/news/home/20211025005836/en/Mastercard-Introduces-Accessible-Card-for-Blind-and-Partially-Sighted-People,Mastercard Introduces Accessible Card for Blind and Partially Sighted People,"Mastercard Introduces Accessible Card for Blind and Partially Sighted People
PURCHASE, N.Y.--(BUSINESS WIRE)--Mastercard extends its commitment to inclusivity by introducing a new accessible card standard for blind and partially sighted people, called the Touch Card. There are few effective ways for the visually impaired to quickly determine whether they're holding a credit, debit or prepaid card, particularly as more cards move to flat designs without embossed name and numbers. Mastercard is addressing this challenge with a simple yet effective innovation. “The Touch Card will provide a greater sense of security, inclusivity and independence to the 2.2 billion people around the world with visual impairments,“ says Raja Rajamannar, chief marketing and communications officer. “For the visually impaired, identifying their payment cards is a real struggle. This tactile solution allows consumers to correctly orient the card and know which payment card they are using.” With the new Touch Card, Mastercard has improved upon a current design standard by introducing a system of notches on the side of the card to help consumers use the right card, the right way, by touch alone. The new Touch Card credit cards have a round notch; debit cards have a broad squarish notch; and prepaid cards have a triangular notch. The standard has been designed to work with point-of-sale terminals and ATMs, ensuring it can be deployed at scale. Mastercard’s concept has been vetted and endorsed by The Royal National Institute of Blind People (RNIB) in the U.K. and VISIONS/Services for the Blind and Visually Impaired in the U.S. The card was co-designed by IDEMIA, the global leader in Augmented Identity, providing trusted solutions in the physical as well as digital space. “As the banking industry responds to new trends and developments, it’s critical that any innovation brings progress for everyone, including those with a visual impairment,” says David Clarke, RNIB’s director of services. “We’re very pleased that Mastercard understands how important it is that blind and partially sighted people have equal and independent access to their own finances.“ “Innovation should always be driven by the impulse to include,” adds Rajamannar, who is also the company’s Healthcare president. “With one in seven people experiencing some form of disability, designing these products with accessibility in mind gives them equal opportunity to benefit from the ease and security of a digital world. No one should be left behind.” Mastercard has been embedding its signature melody at checkout counters worldwide, a signal to everyone – the sight impaired in particular – that their card transaction has gone through successfully. Mastercard’s launch of the Touch Card underscores its commitment to inclusivity. It follows the introduction of True Name™, designed in support of the transgender and non-binary communities. The company’s commitment as a brand is to not only stand against inequity but to be an agent for change. About Mastercard (NYSE: MA) Mastercard is a global technology company in the payments industry. Our mission is to connect and power an inclusive, digital economy that benefits everyone, everywhere by making transactions safe, simple, smart and accessible. Using secure data and networks, partnerships and passion, our innovations and solutions help individuals, financial institutions, governments and businesses realize their greatest potential. Our decency quotient, or DQ, drives our culture and everything we do inside and outside of our company. With connections across more than 210 countries and territories, we are building a sustainable world that unlocks priceless possibilities for all. www.mastercard.com"
MA,2021-10-28,2021-10-28,,2021-10-28,2021-10-28T09:00:00-04:00,0,2021-10-28,pre,2021-10-25 19:20:00,businesswire.com,Business Wire,https://www.businesswire.com/news/home/20211025005836/en/Mastercard-Introduces-Accessible-Card-for-Blind-and-Partially-Sighted-People/,Mastercard Introduces Accessible Card for Blind and Partially Sighted People,"Mastercard Introduces Accessible Card for Blind and Partially Sighted People
PURCHASE, N.Y.--(BUSINESS WIRE)--Mastercard today introduced a new accessible card standard for blind and partially sighted people, called the Touch Card."
MA,2021-10-28,2021-10-28,,2021-10-28,2021-10-28T09:00:00-04:00,0,2021-10-28,pre,2021-10-26 03:22:30,benzinga.com,Benzinga,https://www.benzinga.com/markets/cryptocurrency/21/10/23550638/how-bakkt-and-mastercard-partnership-is-yet-another-step-toward-normalization-of-crypto,How Bakkt And Mastercard Partnership Is Yet Another Step Toward 'Normalization' Of Crypto,"How Bakkt And Mastercard Partnership Is Yet Another Step Toward 'Normalization' Of Crypto
Cryptocurrencies like Bitcoin (CRYPTO: BTC) and Ethereum (CRYPTO: ETH) are hurtling towards mainstream adoption and the latest partnership between Mastercard Inc (NYSE:MA) and Bakkt Holdings Inc (NYSE:BKKT) could prove an important step in that direction. The Latest Deal: The partnership between Mastercard and Bakkt is multifaceted and encompasses merchants and consumers."
MA,2021-10-28,2021-10-28,,2021-10-28,2021-10-28T09:00:00-04:00,0,2021-10-28,pre,2021-10-26 04:28:18,invezz.com,Invezz,https://invezz.com/news/2021/10/26/best-exchanges-where-you-can-trade-bakkt-stock-after-its-partnership-with-mastercard-and-fiserv/,Best exchanges where you can trade Bakkt stock after its partnership with MasterCard and Fiserv,"Best exchanges where you can trade Bakkt stock after its partnership with MasterCard and Fiserv
Bakkt stock (NYSE: BKKT) has skyrocketed after it announced it is partnering with two financial giants; MasterCard and Fiserv. To help stock traders eying to invest in the Bakkt stock, Invezz has created a brief article on what it is and the best places to trade it."
MA,2021-10-28,2021-10-28,,2021-10-28,2021-10-28T09:00:00-04:00,0,2021-10-28,pre,2021-10-27 11:00:27,forbes.com,Forbes,https://www.forbes.com/sites/greatspeculations/2021/10/27/mastercard-stock-to-edge-past-the-street-expectations-in-q3/,Mastercard Stock To Edge Past The Street Expectations In Q3?,"Mastercard Stock To Edge Past The Street Expectations In Q3?
It was driven by a 69% y-o-y jump in cross-border transaction revenues, followed by a 39% rise in domestic assessment, and a 37% increase in transaction processing revenues."
MA,2021-10-28,2021-10-28,,2021-10-28,2021-10-28T09:00:00-04:00,0,2021-10-28,pre,2021-10-28 08:01:00,businesswire.com,Business Wire,https://www.businesswire.com/news/home/20211028005634/en/Mastercard-Incorporated-Third-Quarter-2021-Financial-Results-Available-on-Company%E2%80%99s-Website,Mastercard Incorporated Third-Quarter 2021 Financial Results Available on Company’s Website,"Mastercard Incorporated Third-Quarter 2021 Financial Results Available on Company’s Website
PURCHASE, N.Y.--(BUSINESS WIRE)--Mastercard Incorporated (NYSE: MA) today announced its third quarter 2021 financial results through an earnings release available on the company’s Investor Relations website at investor.mastercard.com. The earnings release will be furnished with the Securities and Exchange Commission (SEC) on a Form 8-K and available here. At 9:00 a.m. ET today, the company will host a conference call to discuss these financial results. Conference Call Details: U.S. dial-in: 833-714-0894 International dial-in (outside the U.S.): +1-778-560-2664 U.K. local dial-in: 02035478612 Conference ID: 9160547 A replay of the call will be available for 30 days using the following dial-in: U.S. dial-in: 800-585-8367 International dial-in (outside the U.S.): +1-416-621-4642 Conference ID: 9160547 The webcast recording and all related materials can also be accessed at investor.mastercard.com. About Mastercard Incorporated (NYSE: MA), www.mastercard.com Mastercard is a global technology company in the payments industry. Our mission is to connect and power an inclusive, digital economy that benefits everyone, everywhere by making transactions safe, simple, smart and accessible. Using secure data and networks, partnerships and passion, our innovations and solutions help individuals, financial institutions, governments and businesses realize their greatest potential. Our decency quotient, or DQ, drives our culture and everything we do inside and outside of our company. With connections across more than 210 countries and territories, we are building a sustainable world that unlocks priceless possibilities for all."
MA,2021-10-28,2021-10-28,,2021-10-28,2021-10-28T09:00:00-04:00,0,2021-10-28,pre,2021-10-28 08:01:00,businesswire.com,Business Wire,https://www.businesswire.com/news/home/20211028005634/en/Mastercard-Incorporated-Third-Quarter-2021-Financial-Results-Available-on-Company%E2%80%99s-Website/,Mastercard Incorporated Third-Quarter 2021 Financial Results Available on Company's Website,"Mastercard Incorporated Third-Quarter 2021 Financial Results Available on Company's Website
PURCHASE, N.Y.--(BUSINESS WIRE)--Mastercard announced its third quarter 2021 financial results through a release available on the company's IR website at investor.mastercard.com."
MA,2021-10-28,2021-10-28,,2021-10-28,2021-10-28T09:00:00-04:00,0,2021-10-28,pre,2021-10-28 08:08:00,reuters.com,Reuters,https://www.reuters.com/business/finance/mastercards-third-quarter-profit-soars-60-2021-10-28/,Mastercard's third-quarter profit soars 60% on spending recovery,"Mastercard's third-quarter profit soars 60% on spending recovery
(Reuters) -Mastercard Inc reported a nearly 60% rise in third-quarter profit on Thursday, spurred by an improvement in domestic spending and a healthy recovery in cross-border spending."
