ticker,event_date,window_start,window_end,symbol,symbols,publishedDate,publishedDateET,date_et,title,text,site,url,image
HD,2024-05-14,2024-04-30,2024-05-28,HD,,2024-05-14 11:32:03,2024-05-14T11:32:03-04:00,2024-05-14,"The Home Depot, Inc. (HD) Q1 2024 Earnings Call Transcript","The Home Depot, Inc. (NYSE:HD ) Q1 2024 Earnings Conference Call May 14, 2024 9:00 AM ET Company Participants Isabel Janci – Vice President of Investor Relations and Treasurer Ted Decker – Chair, President and CEO Ann-Marie Campbell – Senior Executive Vice President Billy Bastek – Executive Vice President, Merchandising Richard McPhail – Executive Vice President and Chief Financial Officer Chip Devine – Senior Vice President-Outside Sales Conference Call Participants Chris Horvers – JPMorgan Simeon Gutman – Morgan Stanley Zach Fadem – Wells Fargo Scot Ciccarelli – Truist Michael Lasser – UBS Chuck Grom – Gordon Haskett Steven Zaccone – Citi Brian Nagel – Oppenheimer Steven Forbes – Guggenheim Operator Greetings, and welcome to the Home Depot First Quarter 2024 Earnings Conference Call. At this time, all participants are in a listen-only mode.",seekingalpha.com,https://seekingalpha.com/article/4693109-home-depot-inc-hd-q1-2024-earnings-call-transcript,https://images.financialmodelingprep.com/news/the-home-depot-inc-hd-q1-2024-earnings-call-20240514.jpg
HD,2024-05-14,2024-04-30,2024-05-28,HD,,2024-05-14 11:37:00,2024-05-14T11:37:00-04:00,2024-05-14,Home Depot Still Looks Sturdy,"High rates and low housing turnover are a drag, but there is much to like.",wsj.com,https://www.wsj.com/articles/home-depot-still-looks-sturdy-e980b614,https://images.financialmodelingprep.com/news/home-depot-still-looks-sturdy-20240514.jpg
HD,2024-05-14,2024-04-30,2024-05-28,HD,,2024-05-14 12:10:39,2024-05-14T12:10:39-04:00,2024-05-14,"Home Depot Affirms 2024 Guidance While Posting Earnings Beat, Sales Miss","Home Depot's (HD) first-quarter results released Tuesday included an earnings beat but slight revenue miss, as the company is still suffering from customers putting off larger projects and purchases.",investopedia.com,https://www.investopedia.com/home-depot-earnings-q1-fy-2024-results-8648018,https://images.financialmodelingprep.com/news/home-depot-affirms-2024-guidance-while-posting-earnings-beat-20240514.jpg
HD,2024-05-14,2024-04-30,2024-05-28,HD,,2024-05-14 12:26:05,2024-05-14T12:26:05-04:00,2024-05-14,"Home Depot (HD) Q1 Earnings Surpass, Sales Miss Estimates","Home Depot's (HD) Q1 results reflect the impacts of the late start of spring and continued soft demand for some discretionary projects, which weighed on sales. Higher costs hurt the bottom line.",zacks.com,https://www.zacks.com/stock/news/2273705/home-depot-hd-q1-earnings-surpass-sales-miss-estimates?cid=CS-STOCKNEWSAPI-FT-analyst_blog|earnings_article-2273705,https://images.financialmodelingprep.com/news/home-depot-hd-q1-earnings-surpass-sales-miss-estimates-20240514.jpg
HD,2024-05-14,2024-04-30,2024-05-28,HD,,2024-05-14 19:31:05,2024-05-14T19:31:05-04:00,2024-05-14,Nasdaq Closes at New Record High; CPI on Deck,"Considering the challenges with PPI this morning, this demonstrates a bullish sentiment remaining in the market.",zacks.com,https://www.zacks.com/stock/news/2273796/nasdaq-closes-at-new-record-high-cpi-on-deck?cid=CS-STOCKNEWSAPI-FT-ahead_of_wall_street-2273796,https://images.financialmodelingprep.com/news/nasdaq-closes-at-new-record-high-cpi-on-deck-20240514.jpg
HD,2024-05-14,2024-04-30,2024-05-28,HD,,2024-05-15 08:00:00,2024-05-15T08:00:00-04:00,2024-05-15,THE HOME DEPOT LAUNCHES MILITARY MOVING HUB TO SUPPORT MILITARY RELOCATIONS,"Program offers exclusive shopping discounts and moving resources for U.S. Armed Forces and Military Spouses ATLANTA , May 15, 2024 /PRNewswire/ -- In honor of Armed Forces Day, The Home Depot launched a new Military Moving hub designed to offer information tailored to military families to learn how to save time and money on their next Personally Procured Move (PPM), including a downloadable permanent change of station (PCS)  checklist and more to the hundreds of thousands of active-duty military families who relocate every year. Military families on average relocate every 2-3 years, with military retirees averaging six or more relocations over their military career.",prnewswire.com,https://www.prnewswire.com/news-releases/the-home-depot-launches-military-moving-hub-to-support-military-relocations-302145433.html,https://images.financialmodelingprep.com/news/the-home-depot-launches-military-moving-hub-to-support-20240515.jpg
HD,2024-05-14,2024-04-30,2024-05-28,HD,,2024-05-15 11:45:52,2024-05-15T11:45:52-04:00,2024-05-15,Home Depot co-founder Ken Langone rips Biden's 'absurd' claim over inflation,"After Biden repeated an incorrect inflation statistic for the second time, Home Depot legend Ken Langone criticized the ""most absurd remark"" and called the president a liar.",foxbusiness.com,https://www.foxbusiness.com/economy/home-depot-co-founder-ken-langone-rips-bidens-absurd-claim-inflation,https://images.financialmodelingprep.com/news/home-depot-cofounder-ken-langone-rips-bidens-absurd-claim-20240515.jpg
HD,2024-05-14,2024-04-30,2024-05-28,HD,,2024-05-16 07:00:00,2024-05-16T07:00:00-04:00,2024-05-16,Should You Pick Home Depot Stock Over Procter & Gamble?,"We believe that Home Depot stock (NYSE: HD) is currently a better pick over Procter & Gamble stock (NYSE: PG), given its better prospects. Although Home Depot is a consumer cyclical and P&G is a consumer defensive company, we compare them due to their similar operating income of $20-$22 billion over the last twelve months.",forbes.com,https://www.forbes.com/sites/greatspeculations/2024/05/16/should-you-pick-home-depot-stock-over-procter--gamble/,https://images.financialmodelingprep.com/news/should-you-pick-home-depot-stock-over-procter-gamble-20240516.jpg
HD,2024-05-14,2024-04-30,2024-05-28,HD,,2024-05-16 12:30:12,2024-05-16T12:30:12-04:00,2024-05-16,Best Long-Term Stocks To Invest In Right Now? 2 For Your List,Retail stocks to check out in the stock market now.,stockmarket.com,https://stockmarket.com/featured/best-long-term-stocks-to-invest-in-right-now-2-for-your-list-2024-05-16,https://images.financialmodelingprep.com/news/best-longterm-stocks-to-invest-in-right-now-2-20240516.jpg
HD,2024-05-14,2024-04-30,2024-05-28,HD,,2024-05-16 16:10:00,2024-05-16T16:10:00-04:00,2024-05-16,The Home Depot Declares First Quarter Dividend of $2.25,"ATLANTA , May 16, 2024 /PRNewswire/ -- The Home Depot®, the world's largest home improvement retailer, today announced that its board of directors declared a first quarter cash dividend of $2.25 per share. The dividend is payable on June 13, 2024, to shareholders of record on the close of business on May 30, 2024.",prnewswire.com,https://www.prnewswire.com/news-releases/the-home-depot-declares-first-quarter-dividend-of-2-25--302148244.html,https://images.financialmodelingprep.com/news/the-home-depot-declares-first-quarter-dividend-of-225-20240516.jpg
HD,2024-05-14,2024-04-30,2024-05-28,HD,,2024-05-16 17:35:39,2024-05-16T17:35:39-04:00,2024-05-16,Home Depot: Improving Growth Prospects,"The Home Depot is well-positioned for revenue and margin growth, with benefits from easing AUR comparisons and normalized demand patterns. The company's revenue outlook is positive, with strong customer engagement and sales, especially in Pro sales and building materials. Margin growth prospects are positive, with benefits from operating leverage, lower shrinkage, and technological advancements to improve efficiency.",seekingalpha.com,https://seekingalpha.com/article/4693974-home-depot-improving-growth-prospects,https://images.financialmodelingprep.com/news/home-depot-improving-growth-prospects-20240516.jpg
HD,2024-05-14,2024-04-30,2024-05-28,HD,,2024-05-17 03:11:00,2024-05-17T03:11:00-04:00,2024-05-17,Is Home Depot Stock Going to $390? 1 Wall Street Analyst Thinks So.,Relatively high interest rates are choking off demand for home improvement. Home Depot's recent comparable sales decline was less than in previous months.,fool.com,https://www.fool.com/investing/2024/05/17/is-home-depot-stock-going-to-390-1-wall-street-ana/,https://images.financialmodelingprep.com/news/is-home-depot-stock-going-to-390-1-wall-20240517.jpg
HD,2024-05-14,2024-04-30,2024-05-28,HD,,2024-05-17 06:00:00,2024-05-17T06:00:00-04:00,2024-05-17,Storm Shelter: 7 Safe Haven Stocks to Batten Down the Hatches,"With the market potentially entering a period of consolidation, investors may want to consider safe haven stocks to buy. No, it's not the most exciting idea.",investorplace.com,https://investorplace.com/2024/05/storm-shelter-7-safe-haven-stocks-to-batten-down-the-hatches/,https://images.financialmodelingprep.com/news/storm-shelter-7-safe-haven-stocks-to-batten-down-20240517.png
HD,2024-05-14,2024-04-30,2024-05-28,HD,,2024-05-17 06:41:00,2024-05-17T06:41:00-04:00,2024-05-17,3 Stocks to Buy for an Active 2024 Hurricane Season,The Atlantic hurricane season hits the east and southern coast of the United States hard. Many homes and businesses see damage that could take years to repair.,investorplace.com,https://investorplace.com/2024/05/3-stocks-to-buy-for-an-active-2024-hurricane-season/,https://images.financialmodelingprep.com/news/3-stocks-to-buy-for-an-active-2024-hurricane-20240517.jpg
HD,2024-05-14,2024-04-30,2024-05-28,HD,,2024-05-17 13:22:00,2024-05-17T13:22:00-04:00,2024-05-17,The furniture industry's recovery relies on customers getting used to paying more,"During Wayfair Inc.'s earnings call this month, Kate Gulliver, the online furniture retailer's chief financial officer, said that after a two-year slump, demand for sofas, beds, chairs and home decor would eventually get back to normal.",marketwatch.com,https://www.marketwatch.com/story/the-furniture-industrys-recovery-relies-on-customers-getting-used-to-paying-more-f10f5fb7,https://images.financialmodelingprep.com/news/the-furniture-industrys-recovery-relies-on-customers-getting-used-20240517.jpg
HD,2024-05-14,2024-04-30,2024-05-28,HD,,2024-05-18 08:00:00,2024-05-18T08:00:00-04:00,2024-05-18,3 Facts You Need to Know About Home Depot Before You Buy the Stock,"Home Depot generates half of its sales from professionals, a lucrative customer cohort. Consumers aren't willing to tackle renovation projects like they were a few years ago.",fool.com,https://www.fool.com/investing/2024/05/18/facts-must-know-home-depot-before-buy-stock/,https://images.financialmodelingprep.com/news/3-facts-you-need-to-know-about-home-depot-20240518.jpg
HD,2024-05-14,2024-04-30,2024-05-28,HD,,2024-05-18 09:22:35,2024-05-18T09:22:35-04:00,2024-05-18,Some consumers are punting big purchases like pools and mattresses,"There are some signs that shoppers are holding off on big-ticket buys, the latest signal of the economy contracting at the hands of tighter monetary policy.",cnbc.com,https://www.cnbc.com/2024/05/18/some-consumers-are-punting-big-purchases-like-pools-and-mattresses.html,https://images.financialmodelingprep.com/news/some-consumers-are-punting-big-purchases-like-pools-and-20240518.jpeg
HD,2024-05-14,2024-04-30,2024-05-28,HD,,2024-05-18 10:15:00,2024-05-18T10:15:00-04:00,2024-05-18,Is Home Depot Stock on Track to Double Your Money in the Next 10 Years?,Home Depot's sales trends have been under pressure due to macro uncertainty. The colossal size of the home-improvement industry gives this business plenty of growth runway.,fool.com,https://www.fool.com/investing/2024/05/18/home-depot-stock-track-double-your-money-10-years/,https://images.financialmodelingprep.com/news/is-home-depot-stock-on-track-to-double-your-20240518.jpg
HD,2024-05-14,2024-04-30,2024-05-28,HD,,2024-05-19 03:55:00,2024-05-19T03:55:00-04:00,2024-05-19,Home Depot Same-Store Sales Fall Again. Where Is the Stock Headed?,Home Depot has seen its same-store sales fall for six straight quarters. Home remodeling activity is expected to remain weak into the second half of this year.,fool.com,https://www.fool.com/investing/2024/05/19/home-depot-same-store-sales-fall-again-stock/,https://images.financialmodelingprep.com/news/home-depot-samestore-sales-fall-again-where-is-the-20240519.jpg
HD,2024-05-14,2024-04-30,2024-05-28,HD,,2024-05-19 10:26:00,2024-05-19T10:26:00-04:00,2024-05-19,Where Will Home Depot Stock Be in 1 Year?,"There was a delayed start to the spring selling season, but management isn't worried. Home Depot is expecting a second year of modest sales declines in 2024.",fool.com,https://www.fool.com/investing/2024/05/19/where-will-home-depot-stock-be-in-1-year/,https://images.financialmodelingprep.com/news/where-will-home-depot-stock-be-in-1-year-20240519.jpg
HD,2024-05-14,2024-04-30,2024-05-28,HD,,2024-05-20 07:30:01,2024-05-20T07:30:01-04:00,2024-05-20,Are consumers pulling back on spending? It depends which CEO you ask,"Companies like PepsiCo have warned about a weak low-income consumer, while Delta Air Lines and Chipotle have benefited from their high-income customer bases.",cnbc.com,https://www.cnbc.com/2024/05/20/consumer-pullback-ceos.html,https://images.financialmodelingprep.com/news/are-consumers-pulling-back-on-spending-it-depends-which-20240520.jpeg
HD,2024-05-14,2024-04-30,2024-05-28,HD,,2024-05-20 08:20:47,2024-05-20T08:20:47-04:00,2024-05-20,S&P 500: Lowe's Earnings Follow Home Depot Results Amid Same-Store Sales Skid,"S&P 500 component Lowe's (LOW) reports first-quarter earnings and revenue early Tuesday as analysts expect another same-store sales decrease following results from rival Home Depot (HD) last week. LOW stock gained ground Monday. Analysts forecast Lowe's first-quarter earnings to drop 20% to $2.95 per share with sales totaling $21.14 billion, down more than 5% compared to last year, according to FactSet. The consensus among analysts also has same-store sales decreasing 5.5%. That would be the sixth consecutive quarter with a same-store sales decline, dating back to Q3 2022 — just like Home Depot. At the end of February, Lowe's management guided full-year EPS of $12-$12.30 with revenue of $84-$85 billion. Lowe's expected same-store sales to decline 2%-3% in 2024. Lowe's stock advanced 0.4% during premarket trade on Monday. The S&P 500 stock edged down 0.5% to 231.11 Friday, falling 1.7% on the week. However, LOW shares are up more than 1.3% in May. Last week, Lowe's rival Home Depot, also a S&P 500 component, announced better-than expected first-quarter earnings and reaffirmed 2024 guidance. Home Depot's Q1 earnings fell 5% to $3.63 per share while sales totaled $36.42 billion, down more than 2% compared to Q1 2023. The big box retailer also continues to predict 2024 revenue and EPS to grow around 1% while same-store sales for 2024 are forecast to decrease 1%. LOW shares are in a consolidation with a 262.49 buy point, but is trading modestly below its 50-day line, according to MarketSurge analysis. Lowe's stock approached all-time highs on March 22, hitting 262.49. Since then, the S&P 500 stock has dropped 12%, with a recent low of 224.68 on April 25. For 2024, Lowe's stock is up around 4%. Meanwhile, Home Depot stock hit a 2024 high of 396.87 on March 21 and has also fallen since then, finding support at its 200-day moving average. HD stock is below its 50-day line. Lowe's stock has a 45 Composite Rating out of a best-possible 99. The S&P 500 stock also has a 54 Relative Strength Rating and a 76 EPS Rating. Please follow Kit Norton on X @KitNorton for more coverage. Is Tesla Stock A Buy Or A Sell? Get Full Access To IBD Stock Lists And Ratings Learning How To Pick Great Stocks? Read Investor's Corner Is Rivian A Buy Right Now After It Launched Its New Product Line?",https://www.investors.com,https://www.investors.com/news/sp-500-lowes-stock-earnings-home-depot/,https://images.financialmodelingprep.com/news/sp-500-lowes-earnings-follow-home-depot-results-amid-20240520.jpg
HD,2024-05-14,2024-04-30,2024-05-28,HD,,2024-05-20 09:00:05,2024-05-20T09:00:05-04:00,2024-05-20,3 Dow Stocks to Watch as The Index Hits a New High,"This year, the stock market could show investors a new divide, unlike anything that portfolios have dealt with in the past economic cycle. After contracting for over 15 months, the U.S. manufacturing and industrial sector could be set up to outperform others, even if there are currently hot issues in the technology sector.",marketbeat.com,https://www.marketbeat.com/stock-ideas/3-dow-stocks-to-watch-as-the-index-hits-a-new-high/,https://images.financialmodelingprep.com/news/3-dow-stocks-to-watch-as-the-index-hits-20240520.jpg
HD,2024-05-14,2024-04-30,2024-05-28,HD,,2024-05-20 11:15:28,2024-05-20T11:15:28-04:00,2024-05-20,Former Home Depot CEO warns Biden's economy created a 'wrecking ball' for the next president,Former Chrysler and Home Depot CEO Bob Nardelli sounded off on inflationary pressures affecting Americans and policy decisions that have contributed to the hardship.,foxbusiness.com,https://www.foxbusiness.com/media/former-home-depot-ceo-biden-economy-created-wrecking-ball-next-president,https://images.financialmodelingprep.com/news/former-home-depot-ceo-warns-bidens-economy-created-a-20240520.jpg
HD,2024-05-14,2024-04-30,2024-05-28,HD,,2024-05-20 11:51:00,2024-05-20T11:51:00-04:00,2024-05-20,"As hurricane season arrives, these stocks could present opportunities","With hurricane season about to start, key stocks in the home-improvement and consumer-staples industries could present opportunities, according to investing-information website Trading.biz.",marketwatch.com,https://www.marketwatch.com/story/as-hurricane-season-arrives-these-stocks-could-present-opportunities-16cc0cc1,https://images.financialmodelingprep.com/news/as-hurricane-season-arrives-these-stocks-could-present-opportunities-20240520.jpg
HD,2024-05-14,2024-04-30,2024-05-28,HD,,2024-05-21 04:55:00,2024-05-21T04:55:00-04:00,2024-05-21,Home Depot's Earnings Signal Trouble for Lowe's. Home Improvement Demand Is Soft.,"Analysts expect a 5.4% drop in revenue for Lowes' first fiscal quarter, underscoring the impact of the housing market's stagnation.",barrons.com,https://www.barrons.com/articles/home-improvement-demand-lowes-3f1617d2,https://images.financialmodelingprep.com/news/home-depots-earnings-signal-trouble-for-lowes-home-improvement-20240521.jpg
HD,2024-05-14,2024-04-30,2024-05-28,HD,,2024-05-21 11:19:58,2024-05-21T11:19:58-04:00,2024-05-21,Retire in Style: 3 Stocks to Buy Now for a Plush Future,"If you're looking to retire comfortably with a jumbo-sized nest egg, focus on businesses that raise the bar on themselves. In the age of generative artificial intelligence (AI), I'd look out for companies that adapt quickly to unlock substantial benefits.",investorplace.com,https://investorplace.com/2024/05/retire-in-style-3-stocks-to-buy-now-for-a-plush-future/,https://images.financialmodelingprep.com/news/retire-in-style-3-stocks-to-buy-now-for-20240521.jpg
HD,2024-05-14,2024-04-30,2024-05-28,HD,,2024-05-21 12:56:17,2024-05-21T12:56:17-04:00,2024-05-21,Home Depot Makes Notable Cross Below Critical Moving Average,"In trading on Tuesday, shares of Home Depot crossed below their 200 day moving average of $335.37, changing hands as low as $332.32 per share. Home Depot Inc shares are currently trading off about 0.9% on the day.",forbes.com,https://www.forbes.com/sites/dividendchannel/2024/05/21/home-depot-makes-notable-cross-below-critical-moving-average/,https://images.financialmodelingprep.com/news/home-depot-makes-notable-cross-below-critical-moving-average-20240521.jpg
HD,2024-05-14,2024-04-30,2024-05-28,HD,,2024-05-21 14:17:34,2024-05-21T14:17:34-04:00,2024-05-21,The Meme Casino Reopens,Not your thing? Then check out our tips on how to evaluate exchange-traded funds.,fool.com,https://www.fool.com/investing/2024/05/21/the-meme-casino-reopens/,https://images.financialmodelingprep.com/news/the-meme-casino-reopens-20240521.jpg
HD,2024-05-14,2024-04-30,2024-05-28,HD,,2024-05-22 08:30:00,2024-05-22T08:30:00-04:00,2024-05-22,Home Depot: This Dog Hunts (Technical Analysis),"Home Depot recorded better-than-expected EPS figures but fell short on revenues in Q1. In this high-interest rate environment, many people might not want to invest in kitchens and bathrooms, so the company seems to be focusing more on professional customers. We explain why we think this home improvement retailing giant might be supported with buy-on-dips trading strategies going forward.",seekingalpha.com,https://seekingalpha.com/article/4694975-home-depot-this-dog-hunts-technical-analysis,https://images.financialmodelingprep.com/news/home-depot-this-dog-hunts-technical-analysis-20240522.jpg
HD,2024-05-14,2024-04-30,2024-05-28,HD,,2024-05-22 10:05:40,2024-05-22T10:05:40-04:00,2024-05-22,"The Home Depot, Inc. (HD) is Attracting Investor Attention: Here is What You Should Know","Recently, Zacks.com users have been paying close attention to Home Depot (HD). This makes it worthwhile to examine what the stock has in store.",zacks.com,https://www.zacks.com/stock/news/2277108/the-home-depot-inc-hd-is-attracting-investor-attention-here-is-what-you-should-know?cid=CS-STOCKNEWSAPI-FT-tale_of_the_tape|most_searched_stocks-2277108,https://images.financialmodelingprep.com/news/the-home-depot-inc-hd-is-attracting-investor-attention-20240522.jpg
HD,2024-05-14,2024-04-30,2024-05-28,HD,,2024-05-23 05:05:00,2024-05-23T05:05:00-04:00,2024-05-23,2 Top Dividend Stocks to Pile Into Right Now,Home Depot is a market-crushing stock that's flat this year but has big ambitions. Realty Income offers everything a dividend investor could want -- and more.,fool.com,https://www.fool.com/investing/2024/05/23/2-top-dividend-stocks-to-pile-into-right-now/,https://images.financialmodelingprep.com/news/2-top-dividend-stocks-to-pile-into-right-now-20240523.jpg
HD,2024-05-14,2024-04-30,2024-05-28,HD,,2024-05-23 05:05:00,2024-05-23T05:05:00-04:00,2024-05-23,1 Spectacular Dividend Stock Down 19% You'll Regret Not Buying on the Dip,Passive income investors can generate income at regular intervals by investing in dividend stocks.,fool.com,https://www.fool.com/investing/2024/05/23/1-spectacular-dividend-stock-down-19-youll-regret/,https://images.financialmodelingprep.com/news/1-spectacular-dividend-stock-down-19-youll-regret-not-20240523.jpg
HD,2024-05-14,2024-04-30,2024-05-28,HD,,2024-05-23 09:00:00,2024-05-23T09:00:00-04:00,2024-05-23,The Home Depot and Instacart Announce Nationwide Partnership to Offer Same-Day Delivery,"The world's largest home improvement retailer now offers delivery in as fast as an hour SAN FRANCISCO and ATLANTA , May 23, 2024 /PRNewswire/ -- Instacart (Nasdaq: CART), the leading grocery technology company in North America, and The Home Depot (NYSE: HD), the world's largest home improvement retailer, today announced a nationwide partnership to offer same-day delivery in as fast as an hour from nearly 2000 store locations. Customers can now order a wide range of home improvement items on Instacart's platform – from garden essentials and building supplies to light fixtures– and have them rapidly delivered directly to their doorstep.",prnewswire.com,https://www.prnewswire.com/news-releases/the-home-depot-and-instacart-announce-nationwide-partnership-to-offer-same-day-delivery-302153812.html,https://images.financialmodelingprep.com/news/the-home-depot-and-instacart-announce-nationwide-partnership-to-20240523.jpg
HD,2024-05-14,2024-04-30,2024-05-28,HD,,2024-05-23 09:28:22,2024-05-23T09:28:22-04:00,2024-05-23,3 Retail Stocks to Add to Your Cart in May,"The U.S. retail sector, recognized as the world's largest, has demonstrated remarkable resilience. It expanded by nearly 20% in 2021 with strong growth continuing into 2022.",investorplace.com,https://investorplace.com/2024/05/3-retail-stocks-to-add-to-your-cart-in-may/,https://images.financialmodelingprep.com/news/3-retail-stocks-to-add-to-your-cart-in-20240523.jpg
HD,2024-05-14,2024-04-30,2024-05-28,HD,,2024-05-23 12:50:39,2024-05-23T12:50:39-04:00,2024-05-23,Home Depot Teams With Instacart to Bolster eCommerce Offerings,"Home Depot teamed with Instacart to offer customers same-day delivery on home improvement products. The partnership offers delivery in as fast as an hour from nearly 2,000 stores, according to a Thursday (May 23) press release.",pymnts.com,https://www.pymnts.com/partnerships/2024/home-depot-teams-with-instacart-bolster-ecommerce-offerings/,https://images.financialmodelingprep.com/news/home-depot-teams-with-instacart-to-bolster-ecommerce-offerings-20240523.jpg
HD,2024-05-14,2024-04-30,2024-05-28,HD,,2024-05-23 12:50:39,2024-05-23T12:50:39-04:00,2024-05-23,Home Depot Teams With Instacart to Bolster eCommerce Offerings,"Home Depot teamed with Instacart to offer customers same-day delivery on home improvement products. The partnership offers delivery in as fast as an hour from nearly 2,000 stores, according to a Thursday (May 23) press release.",pymnts.com,https://www.pymnts.com/partnerships/2024/home-depot-teams-with-instacart-bolster-ecommerce-offerings/?utm_source=snapi,https://images.financialmodelingprep.com/news/home-depot-teams-with-instacart-to-bolster-ecommerce-offerings-20240523.jpg
HD,2024-05-14,2024-04-30,2024-05-28,HD,,2024-05-24 06:00:00,2024-05-24T06:00:00-04:00,2024-05-24,7 Stocks to Buy if the Market Ends Up Plunging,"Stocks to buy if the market fails: that's the other side of the coin to the search query, is the market overvalued right now? Pop that question into your favorite search engine and you're bound to find endless opinions.",investorplace.com,https://investorplace.com/2024/05/7-stocks-to-buy-if-the-market-ends-up-plunging/,https://images.financialmodelingprep.com/news/7-stocks-to-buy-if-the-market-ends-up-20240524.png
