ticker,event_date,window_start,window_end,symbol,symbols,publishedDate,publishedDateET,date_et,title,text,site,url,image
HD,2024-05-14,2024-04-30,2024-05-28,HD,,2024-05-24 09:15:00,2024-05-24T09:15:00-04:00,2024-05-24,3 Super Safe Dividend Stocks to Buy in a Market Correction,Caterpillar's dividend is sustainable throughout the economic cycle.  Consumer staples giant Procter & Gamble can fortify investors' portfolios.,fool.com,https://www.fool.com/investing/2024/05/24/3-super-safe-dividend-stocks-buy-market-correction/,https://images.financialmodelingprep.com/news/3-super-safe-dividend-stocks-to-buy-in-a-20240524.jpg
HD,2024-05-14,2024-04-30,2024-05-28,HD,,2024-05-24 11:41:11,2024-05-24T11:41:11-04:00,2024-05-24,Home Depot (HD) Teams With Instacart to Offer Same-Day Delivery,"Home Depot's (HD) strategic efforts, including the ""One Home Depot"" investment plan, appear encouraging.",zacks.com,https://www.zacks.com/stock/news/2278794/home-depot-hd-teams-with-instacart-to-offer-same-day-delivery?cid=CS-STOCKNEWSAPI-FT-analyst_blog|company_news_-_corporate_actions-2278794,https://images.financialmodelingprep.com/news/home-depot-hd-teams-with-instacart-to-offer-sameday-20240524.jpg
HD,2024-05-14,2024-04-30,2024-05-28,HD,,2024-05-25 02:04:00,2024-05-25T02:04:00-04:00,2024-05-25,"3 Stocks That Turned $1,000 Into $1 million","Since you can't know for sure which stocks will be the biggest winners, portfolio diversification is key. Choosing strong companies and holding onto their stocks for years, if not decades, is a recipe for investing success.",fool.com,https://www.fool.com/investing/2024/05/25/3-stocks-that-turned-1000-into-1-million/,https://images.financialmodelingprep.com/news/3-stocks-that-turned-1000-into-1-million-20240525.jpg
HD,2024-05-14,2024-04-30,2024-05-28,HD,,2024-05-25 02:56:00,2024-05-25T02:56:00-04:00,2024-05-25,3 Dividend Stocks That Are Well Positioned to Provide a Lifetime of Passive Income,"Home Depot remains a top pick for housing-focused investors.  York Water might not have the highest dividend yield, but its allure is seen in other ways.",fool.com,https://www.fool.com/investing/2024/05/25/3-dividend-stocks-buy-lifetime-passive-income/,https://images.financialmodelingprep.com/news/3-dividend-stocks-that-are-well-positioned-to-provide-a-20240525.jpg
HD,2024-05-14,2024-04-30,2024-05-28,HD,,2024-05-27 12:46:20,2024-05-27T12:46:20-04:00,2024-05-27,Reliable Rewards: 7 Dividend Stocks to Count On in Any Market,"Earlier, the Federal Reserve stood poised to cut the benchmark interest rate, which boded well for reliable dividend stocks. Essentially, Uncle Sam's high yields wouldn't compete with the passive income stemming from private enterprises.",investorplace.com,https://investorplace.com/2024/05/reliable-rewards-7-dividend-stocks-to-count-on-in-any-market/,https://images.financialmodelingprep.com/news/reliable-rewards-7-dividend-stocks-to-count-on-in-any-20240527.jpg
HD,2024-05-14,2024-04-30,2024-05-28,HD,,2024-05-27 18:13:00,2024-05-27T18:13:00-04:00,2024-05-27,3 Top Dividend Stocks That Should Pay You Forever,"Costco has a wide moat and plenty of opportunities for future growth. If you had reinvested all your dividends from Home Depot stock, you'd have a lot more money today.",fool.com,https://www.fool.com/investing/2024/05/27/3-top-dividend-stocks-that-should-pay-you-forever/,https://images.financialmodelingprep.com/news/3-top-dividend-stocks-that-should-pay-you-forever-20240527.jpg
HD,2024-05-14,2024-04-30,2024-05-28,HD,,2024-05-28 05:15:00,2024-05-28T05:15:00-04:00,2024-05-28,"Down Year-to-Date, Are Home Depot and Lowe's No-Brainer Dividend Stocks to Buy Now?",Home Depot and Lowe's expect weak full-year results. Macroeconomic indicators tell a similar story.,fool.com,https://www.fool.com/investing/2024/05/28/down-year-to-date-buy-home-depot-lowes-stock/,https://images.financialmodelingprep.com/news/down-yeartodate-are-home-depot-and-lowes-nobrainer-dividend-stocks-20240528.jpg
HD,2024-05-14,2024-04-30,2024-05-28,HD,,2024-05-28 11:06:14,2024-05-28T11:06:14-04:00,2024-05-28,Eye These 5 Retail Building Products Stocks From a Prospering Industry,"Focus on virtual platforms to boost customer engagement has been leading to a surge in online business transactions for many players in the Retail Building Products industry. HD, LOW, FAST, BECN and GMS look well-poised for growth.",zacks.com,https://www.zacks.com/commentary/2279869/eye-these-5-retail-building-products-stocks-from-a-prospering-industry?cid=CS-STOCKNEWSAPI-FT-industry_outlook-2279869,https://images.financialmodelingprep.com/news/eye-these-5-retail-building-products-stocks-from-a-20240528.jpg
