ticker,event_date,window_start,window_end,symbol,symbols,publishedDate,publishedDateET,date_et,title,text,site,url,image
V,2024-10-29,2024-10-15,2024-11-12,V,,2024-11-11 11:52:20,2024-11-11T11:52:20-05:00,2024-11-11,"My Outlook On Visa Materialized, But There May Be More Upside Left","Visa's stock price has increased by over 15% since the first time I published my bullish thesis, materializing my expectations. Visa reported 11.7% total revenue growth and 16% EPS growth, with stable cost growth and substantial shareholder rewards through buybacks and dividends. Visa expects high single-digit to low double-digit revenue and operating expense growth for FY 2025, with high-end low double-digit EPS growth.",seekingalpha.com,https://seekingalpha.com/article/4736065-my-outlook-on-visa-materialized-but-there-may-be-more-upside-left,https://images.financialmodelingprep.com/news/my-outlook-on-visa-materialized-but-there-may-be-20241111.jpg
V,2024-10-29,2024-10-15,2024-11-12,V,,2024-11-11 13:18:00,2024-11-11T13:18:00-05:00,2024-11-11,Rosen Law Firm Encourages Visa Inc. Investors to Inquire About Securities Class Action Investigation - V,"NEW YORK , Nov. 11, 2024 /PRNewswire/ -- Why: November 9, 2024. Rosen Law Firm, a global investor rights law firm, continues to investigate potential securities claims on behalf of shareholders of Visa Inc. (NYSE: V) resulting from allegations that Visa may have issued materially misleading business information to the investing public.",prnewswire.com,https://www.prnewswire.com/news-releases/rosen-law-firm-encourages-visa-inc-investors-to-inquire-about-securities-class-action-investigation--v-302300737.html,https://images.financialmodelingprep.com/news/rosen-law-firm-encourages-visa-inc-investors-to-inquire-20241111.jpg
V,2024-10-29,2024-10-15,2024-11-12,V,,2024-11-11 15:01:12,2024-11-11T15:01:12-05:00,2024-11-11,"4 Stocks to Gain as Dow Roars Past 44,000 for the First Time","Stocks like NVDA, AMZN, V and CRM will benefit from the Dow's ongoing rally.",zacks.com,https://www.zacks.com/stock/news/2368426/4-stocks-to-gain-as-dow-roars-past-44-000-for-the-first-time?cid=CS-STOCKNEWSAPI-FT-analyst_blog|investment_ideas-2368426,https://images.financialmodelingprep.com/news/4-stocks-to-gain-as-dow-roars-past-44000-20241111.jpg
V,2024-10-29,2024-10-15,2024-11-12,V,,2024-11-12 05:36:40,2024-11-12T05:36:40-05:00,2024-11-12,"The Zacks Analyst Blog NVIDIA, Amazon, Visa and Salesforce","NVIDIA, Amazon, Visa and Salesforce are included in this Analyst Blog.",zacks.com,https://www.zacks.com/stock/news/2368520/the-zacks-analyst-blog-nvidia-amazon-visa-and-salesforce?cid=CS-STOCKNEWSAPI-FT-press_releases-2368520,https://images.financialmodelingprep.com/news/the-zacks-analyst-blog-nvidia-amazon-visa-and-salesforce-20241112.jpg
V,2024-10-29,2024-10-15,2024-11-12,V,,2024-11-12 06:00:00,2024-11-12T06:00:00-05:00,2024-11-12,Visa Recognizes Creators as Small Businesses,"LISBON, Portugal--(BUSINESS WIRE)--At the opening session of Web Summit in Lisbon, Portugal, Visa unveiled significant commitments to digital creators. Acknowledging the impact of creators on the digital economy, Visa officially recognized creators as small businesses. Today, creators can easily and securely pay and be paid with Visa's financial tools, resources and products made available to small businesses worldwide. Visa is also helping creators get paid fast. More than two-thirds of creato.",businesswire.com,https://www.businesswire.com/news/home/20241112254574/en/Visa-Recognizes-Creators-as-Small-Businesses/,https://images.financialmodelingprep.com/news/visa-recognizes-creators-as-small-businesses-20241112.jpg
V,2024-10-29,2024-10-15,2024-11-12,V,,2024-11-12 06:00:00,2024-11-12T06:00:00-05:00,2024-11-12,Visa Flexible Credential Goes Global: Transforming the Card for a Digital Future,"SAN FRANCISCO & LISBON, Portugal--(BUSINESS WIRE)--For years, the card didn't change. Built for an analog world, one card for one type, debit or credit. The Visa Flexible Credential has fundamentally changed that, allowing people to pay from different account funding sources with a single card. Today, Visa (V: NYSE) announced that the Flexible Credential is expanding to the U.S. and will be rolling out with Affirm, and in the United Arab Emirates with Liv, giving millions more people greater ch.",businesswire.com,https://www.businesswire.com/news/home/20241112887047/en/Visa-Flexible-Credential-Goes-Global-Transforming-the-Card-for-a-Digital-Future/,https://images.financialmodelingprep.com/news/visa-flexible-credential-goes-global-transforming-the-card-for-20241112.jpg
V,2024-10-29,2024-10-15,2024-11-12,V,,2024-11-12 06:04:07,2024-11-12T06:04:07-05:00,2024-11-12,Visa teams up with Affirm to launch card for flexible payments in US,"Visa is partnering with fintech company Affirm to roll out a card in the U.S. that customers can use for both debit transactions and buy now, pay later purchases, reflecting the growing demand for flexibility in payment options.",reuters.com,https://www.reuters.com/business/finance/visa-teams-up-with-affirm-launch-card-flexible-payments-us-2024-11-12/,https://images.financialmodelingprep.com/news/visa-teams-up-with-affirm-to-launch-card-for-20241112.jpg
V,2024-10-29,2024-10-15,2024-11-12,V,,2024-11-12 19:46:00,2024-11-12T19:46:00-05:00,2024-11-12,V BREAKING NEWS: Visa Inc. Investors that Suffered Losses are Encouraged to Contact Rosen Law about Ongoing Investigation into the Company – V,"NEW YORK, Nov. 12, 2024 (GLOBE NEWSWIRE) -- Rosen Law Firm, a global investor rights law firm, continues to investigate Visa Inc. (NYSE: V) for potential violations of the federal securities laws.",globenewswire.com,https://www.globenewswire.com/news-release/2024/11/13/2979853/673/en/V-BREAKING-NEWS-Visa-Inc-Investors-that-Suffered-Losses-are-Encouraged-to-Contact-Rosen-Law-about-Ongoing-Investigation-into-the-Company-V.html,https://images.financialmodelingprep.com/news/v-breaking-news-visa-inc-investors-that-suffered-losses-20241112.jpg
V,2024-10-29,2024-10-15,2024-11-12,V,,2024-11-12 21:00:00,2024-11-12T21:00:00-05:00,2024-11-12,"VISA ALERT: Bragar Eagel & Squire, P.C. is Investigating Visa Inc. on Behalf of Visa Stockholders and Encourages Investors to Contact the Firm","NEW YORK, Nov. 12, 2024 (GLOBE NEWSWIRE) -- Bragar Eagel & Squire, P.C., a nationally recognized stockholder rights law firm, is investigating potential claims against Visa Inc. (“Visa” or the “Company”) (NYSE: V) on behalf of Visa stockholders. Our investigation concerns whether Visa has violated the federal securities laws and/or engaged in other unlawful business practices.",globenewswire.com,https://www.globenewswire.com/news-release/2024/11/13/2979880/0/en/VISA-ALERT-Bragar-Eagel-Squire-P-C-is-Investigating-Visa-Inc-on-Behalf-of-Visa-Stockholders-and-Encourages-Investors-to-Contact-the-Firm.html,https://images.financialmodelingprep.com/news/visa-alert-bragar-eagel-squire-pc-is-investigating-visa-20241112.jpg
