ticker,event_date,window_start,window_end,symbol,symbols,publishedDate,publishedDateET,date_et,title,text,site,url,image
V,2024-10-29,2024-10-15,2024-11-12,V,,2024-10-15 04:50:00,2024-10-15T04:50:00-04:00,2024-10-15,3 Unstoppable Stocks to Buy With the Dow at an All-Time High,The Dow can go higher -- and so can these great Dow stocks.,fool.com,https://www.fool.com/investing/2024/10/15/3-unstoppable-stocks-to-buy-with-the-dow-at-an-all/,https://images.financialmodelingprep.com/news/3-unstoppable-stocks-to-buy-with-the-dow-at-20241015.jpg
V,2024-10-29,2024-10-15,2024-11-12,V,,2024-10-15 06:10:00,2024-10-15T06:10:00-04:00,2024-10-15,2 No-Brainer Warren Buffett Stocks to Buy Right Now,These stocks will help you grow your savings for a happy retirement.,fool.com,https://www.fool.com/investing/2024/10/15/no-brainer-warren-buffett-stocks-buy-right-now/,https://images.financialmodelingprep.com/news/2-nobrainer-warren-buffett-stocks-to-buy-right-now-20241015.jpg
V,2024-10-29,2024-10-15,2024-11-12,V,,2024-10-15 11:00:00,2024-10-15T11:00:00-04:00,2024-10-15,The Schall Law Firm Encourages Shareholder Participation In An Inquiry Into Visa Inc For Securities Law Violations,"LOS ANGELES, CA / ACCESSWIRE / October 15, 2024 / The Schall Law Firm, a national shareholder rights litigation firm, announces that it is investigating claims on behalf of investors of Visa Inc. (""Visa"" or ""the Company"") (NYSE:V) for violations of the securities laws. The investigation focuses on whether the Company issued false and/or misleading statements and/or failed to disclose information pertinent to investors.",accesswire.com,https://www.accesswire.com/viewarticle.aspx?id=931526&lang=en,https://images.financialmodelingprep.com/news/the-schall-law-firm-encourages-shareholder-participation-in-an-inquiry-20241015.jpg
V,2024-10-29,2024-10-15,2024-11-12,V,,2024-10-15 16:30:00,2024-10-15T16:30:00-04:00,2024-10-15,SHAREHOLDER ALERT: Pomerantz Law Firm Investigates Claims On Behalf of Investors of Visa Inc. - V,"NEW YORK, NY / ACCESSWIRE / October 15, 2024 / Pomerantz LLP is investigating claims on behalf of investors of Visa Inc. (""Visa"" or the ""Company"") (NYSE:V). Such investors are advised to contact Danielle Peyton at newaction@pomlaw.com or 646-581-9980, ext.",accesswire.com,https://www.accesswire.com/viewarticle.aspx?id=932008&lang=en,https://images.financialmodelingprep.com/news/shareholder-alert-pomerantz-law-firm-investigates-claims-on-behalf-of-investors-of-visa-20241015.jpg
V,2024-10-29,2024-10-15,2024-11-12,V,,2024-10-16 05:55:00,2024-10-16T05:55:00-04:00,2024-10-16,"Visa: Buy, Sell, or Hold?",Regulators are coming after Visa's dominant role in the payments industry.,fool.com,https://www.fool.com/investing/2024/10/16/visa-buy-sell-or-hold/,https://images.financialmodelingprep.com/news/visa-buy-sell-or-hold-20241016.jpg
V,2024-10-29,2024-10-15,2024-11-12,V,,2024-10-16 08:00:00,2024-10-16T08:00:00-04:00,2024-10-16,Visa and Analytic Partners Announce Multi-Year Deal to Transform Commercial Analytics for Merchants and Brands,"SAN FRANCISCO--(BUSINESS WIRE)--Visa (NYSE: V), a global leader in digital payments, today announced that it has entered into a new strategic partnership with Analytic Partners, a global analytics solution provider. Together, Visa and Analytic Partners plan to address commercial challenges faced by merchants and brands, including improving the return on advertising investments, with value-enhancing AI-driven data analytics. In a dynamic business environment rich with data, companies need meanin.",businesswire.com,https://www.businesswire.com/news/home/20241016497534/en/Visa-and-Analytic-Partners-Announce-Multi-Year-Deal-to-Transform-Commercial-Analytics-for-Merchants-and-Brands/,https://images.financialmodelingprep.com/news/visa-and-analytic-partners-announce-multiyear-deal-to-transform-20241016.jpg
V,2024-10-29,2024-10-15,2024-11-12,V,,2024-10-16 08:53:00,2024-10-16T08:53:00-04:00,2024-10-16,Should You Buy Visa Stock While It's Below $300?,"Visa is a powerhouse, market-beating stock.",fool.com,https://www.fool.com/investing/2024/10/16/should-you-buy-visa-stock-while-its-below-300/,https://images.financialmodelingprep.com/news/should-you-buy-visa-stock-while-its-below-300-20241016.jpg
V,2024-10-29,2024-10-15,2024-11-12,V,,2024-10-16 14:15:00,2024-10-16T14:15:00-04:00,2024-10-16,"Bronstein, Gewirtz & Grossman, LLC Initiates an Investigation into Allegations Against Visa Inc. (V) And Encourages Investors to Reach Out","NEW YORK CITY, NY / ACCESSWIRE / October 16, 2024 / Bronstein, Gewirtz & Grossman, LLC is investigating potential claims on behalf of purchasers of Visa Inc. (""Visa"" or ""the Company"") (NYSE:V). Investors who purchased Visa securities are encouraged to obtain additional information and assist the investigation by visiting the firm's site: bgandg.com/V.",accesswire.com,https://www.accesswire.com/viewarticle.aspx?id=932503&lang=en,https://images.financialmodelingprep.com/news/bronstein-gewirtz-grossman-llc-initiates-an-investigation-into-allegations-against-visa-20241016.jpg
V,2024-10-29,2024-10-15,2024-11-12,V,,2024-10-17 11:00:00,2024-10-17T11:00:00-04:00,2024-10-17,The Schall Law Firm Encourages Shareholder Participation In An Inquiry Into Visa Inc For Securities Law Violations,"LOS ANGELES, CA / ACCESSWIRE / October 17, 2024 / The Schall Law Firm, a national shareholder rights litigation firm, announces that it is investigating claims on behalf of investors of Visa Inc. (""Visa"" or ""the Company"") (NYSE:V) for violations of the securities laws. The investigation focuses on whether the Company issued false and/or misleading statements and/or failed to disclose information pertinent to investors.",accesswire.com,https://www.accesswire.com/viewarticle.aspx?id=932625&lang=en,https://images.financialmodelingprep.com/news/the-schall-law-firm-encourages-shareholder-participation-in-an-inquiry-20241017.jpg
V,2024-10-29,2024-10-15,2024-11-12,V,,2024-10-17 19:29:00,2024-10-17T19:29:00-04:00,2024-10-17,SHAREHOLDER ALERT: Pomerantz Law Firm Investigates Claims On Behalf of Investors of Visa Inc. - V,"NEW YORK , Oct. 17, 2024 /PRNewswire/ -- Pomerantz LLP is investigating claims on behalf of investors of Visa Inc. (""Visa"" or the ""Company"") (NYSE: V). Such investors are advised to contact Danielle Peyton at newaction@pomlaw.com or 646-581-9980, ext.",prnewswire.com,https://www.prnewswire.com/news-releases/shareholder-alert-pomerantz-law-firm-investigates-claims-on-behalf-of-investors-of-visa-inc---v-302279858.html,https://images.financialmodelingprep.com/news/shareholder-alert-pomerantz-law-firm-investigates-claims-on-behalf-of-investors-of-visa-20241017.jpg
V,2024-10-29,2024-10-15,2024-11-12,V,,2024-10-17 21:05:00,2024-10-17T21:05:00-04:00,2024-10-17,Rosen Law Firm Encourages Visa Inc. Investors to Inquire About Securities Class Action Investigation - V,"NEW YORK , Oct. 17, 2024 /PRNewswire/ -- Rosen Law Firm, a global investor rights law firm, announces an investigation of potential securities claims on behalf of shareholders of Visa Inc. (NYSE: V) resulting from allegations that Visa may have issued materially misleading business information to the investing public. So What: If you purchased Visa securities you may be entitled to compensation without payment of any out of pocket fees or costs through a contingency fee arrangement.",prnewswire.com,https://www.prnewswire.com/news-releases/rosen-law-firm-encourages-visa-inc-investors-to-inquire-about-securities-class-action-investigation--v-302279883.html,https://images.financialmodelingprep.com/news/rosen-law-firm-encourages-visa-inc-investors-to-inquire-20241017.jpg
V,2024-10-29,2024-10-15,2024-11-12,V,,2024-10-18 04:15:00,2024-10-18T04:15:00-04:00,2024-10-18,Visa Targeted in Justice Department Monopoly Lawsuit: Time to Buy the Stock?,"Counterintuitively, antitrust lawsuits often have little significance for a stock.",fool.com,https://www.fool.com/investing/2024/10/18/visa-stock-falls-after-justice-department-monopoly/,https://images.financialmodelingprep.com/news/visa-targeted-in-justice-department-monopoly-lawsuit-time-to-20241018.jpg
V,2024-10-29,2024-10-15,2024-11-12,V,,2024-10-18 11:00:00,2024-10-18T11:00:00-04:00,2024-10-18,Visa Inc. Is Being Investigated For Possible Securities Fraud And Affected Investors Are Urged To Reach Out To The Schall Law Firm,"LOS ANGELES, CA / ACCESSWIRE / October 18, 2024 / The Schall Law Firm, a national shareholder rights litigation firm, announces that it is investigating claims on behalf of investors of Visa Inc. (""Visa"" or ""the Company"") (NYSE:V) for violations of the securities laws. The investigation focuses on whether the Company issued false and/or misleading statements and/or failed to disclose information pertinent to investors.",accesswire.com,https://www.accesswire.com/viewarticle.aspx?id=932987&lang=en,https://images.financialmodelingprep.com/news/visa-inc-is-being-investigated-for-possible-securities-fraud-20241018.jpg
V,2024-10-29,2024-10-15,2024-11-12,V,,2024-10-18 19:58:00,2024-10-18T19:58:00-04:00,2024-10-18,V INVESTOR NEWS: Visa Inc. Investors that Suffered Losses are Encouraged to Contact RLF About Ongoing Investigation into the Company (NYSE: V),"NEW YORK, Oct. 18, 2024 (GLOBE NEWSWIRE) -- Why: Rosen Law Firm, a global investor rights law firm, continues to investigate potential securities claims on behalf of shareholders of Visa Inc. (NYSE: V) resulting from allegations that Visa may have issued materially misleading business information to the investing public.",globenewswire.com,https://www.globenewswire.com/news-release/2024/10/18/2965771/673/en/V-INVESTOR-NEWS-Visa-Inc-Investors-that-Suffered-Losses-are-Encouraged-to-Contact-RLF-About-Ongoing-Investigation-into-the-Company-NYSE-V.html,https://images.financialmodelingprep.com/news/v-investor-news-visa-inc-investors-that-suffered-losses-20241018.jpg
V,2024-10-29,2024-10-15,2024-11-12,V,,2024-10-18 23:00:00,2024-10-18T23:00:00-04:00,2024-10-18,"Visa Wanted a Vast Empire. First, It Had to Beat Back Its Foes.","By wooing partners and strong-arming competitors, Visa sits atop the payments world and in the sights of the Justice Department",wsj.com,https://www.wsj.com/articles/visa-wanted-a-vast-empire-first-it-had-to-beat-back-its-foes-3b3067f3,https://images.financialmodelingprep.com/news/visa-wanted-a-vast-empire-first-it-had-to-20241018.jpg
V,2024-10-29,2024-10-15,2024-11-12,V,,2024-10-19 11:00:00,2024-10-19T11:00:00-04:00,2024-10-19,The Schall Law Firm Encourages Shareholder Participation In An Inquiry Into Visa Inc For Securities Law Violations,"LOS ANGELES, CA / ACCESSWIRE / October 19, 2024 / The Schall Law Firm, a national shareholder rights litigation firm, announces that it is investigating claims on behalf of investors of Visa Inc. (""Visa"" or ""the Company"") (NYSE:V) for violations of the securities laws. The investigation focuses on whether the Company issued false and/or misleading statements and/or failed to disclose information pertinent to investors.",accesswire.com,https://www.accesswire.com/viewarticle.aspx?id=933176&lang=en,https://images.financialmodelingprep.com/news/the-schall-law-firm-encourages-shareholder-participation-in-an-20241019.jpg
V,2024-10-29,2024-10-15,2024-11-12,V,,2024-10-19 12:00:00,2024-10-19T12:00:00-04:00,2024-10-19,SHAREHOLDER ALERT: Pomerantz Law Firm Investigates Claims On Behalf of Investors of Visa Inc. - V,"NEW YORK, NY / ACCESSWIRE / October 19, 2024 / Pomerantz LLP is investigating claims on behalf of investors of Visa Inc. (""Visa"" or the ""Company"") (NYSE:V). Such investors are advised to contact Danielle Peyton at newaction@pomlaw.com or 646-581-9980, ext.",accesswire.com,https://www.accesswire.com/viewarticle.aspx?id=932863&lang=en,https://images.financialmodelingprep.com/news/shareholder-alert-pomerantz-law-firm-investigates-claims-on-behalf-of-investors-of-20241019.jpg
V,2024-10-29,2024-10-15,2024-11-12,V,,2024-10-20 00:21:14,2024-10-20T00:21:14-04:00,2024-10-20,Mastercard: Differences From Visa Are Critical To Understand,"Mastercard's upcoming Q3 results are crucial for validating its premium over Visa and assessing my three-pillar growth thesis. Key differences: Visa is larger, more U.S.-focused, and more profitable, while Mastercard aggressively pursues customer acquisition. Mastercard's value-added services and new flows are growing faster than consumer payments, reflective of the future drivers of the business.",seekingalpha.com,https://seekingalpha.com/article/4727841-mastercard-differences-from-visa-are-critical-to-understand,https://images.financialmodelingprep.com/news/mastercard-differences-from-visa-are-critical-to-understand-20241020.jpg
V,2024-10-29,2024-10-15,2024-11-12,V,,2024-10-20 10:00:00,2024-10-20T10:00:00-04:00,2024-10-20,"Bronstein, Gewirtz & Grossman, LLC Encourages Visa Inc. (V) Investors to Inquire about Securities Investigation","NEW YORK CITY, NY / ACCESSWIRE / October 20, 2024 / Bronstein, Gewirtz & Grossman, LLC is investigating potential claims on behalf of purchasers of Visa Inc. (""Visa"" or ""the Company"") (NYSE:V). Investors who purchased Visa securities are encouraged to obtain additional information and assist the investigation by visiting the firm's site: bgandg.com/V.",accesswire.com,https://www.accesswire.com/viewarticle.aspx?id=932504&lang=en,https://images.financialmodelingprep.com/news/bronstein-gewirtz-grossman-llc-encourages-visa-inc-v-investors-20241020.jpg
V,2024-10-29,2024-10-15,2024-11-12,V,,2024-10-20 11:00:00,2024-10-20T11:00:00-04:00,2024-10-20,Visa Inc. Is Being Investigated For Securities Fraud And Investors With Losses Are Urged To Contact The Schall Law Firm,"LOS ANGELES, CA / ACCESSWIRE / October 20, 2024 / The Schall Law Firm, a national shareholder rights litigation firm, announces that it is investigating claims on behalf of investors of Visa Inc. (""Visa"" or ""the Company"") (NYSE:V) for violations of the securities laws. The investigation focuses on whether the Company issued false and/or misleading statements and/or failed to disclose information pertinent to investors.",accesswire.com,https://www.accesswire.com/viewarticle.aspx?id=933257&lang=en,https://images.financialmodelingprep.com/news/visa-inc-is-being-investigated-for-securities-fraud-and-20241020.jpg
V,2024-10-29,2024-10-15,2024-11-12,V,,2024-10-20 20:00:00,2024-10-20T20:00:00-04:00,2024-10-20,Visa's Growth Corporates Working Capital Index Reveals 300% Increase in Working Capital Efficiency,"SAN FRANCISCO--(BUSINESS WIRE)--Visa (NYSE:V), a global leader in digital payments, announced the findings from its second annual global Growth Corporates Working Capital Index. The findings revealed an astounding increase in working capital usage and efficiency, with an 81% adoption rate of at least one working capital solution in 2024. Beyond increased adoption, top-performing companies1 saved an average of $11 million in interest and fees – a YoY efficiency increase of 300%. The Index survey.",businesswire.com,https://www.businesswire.com/news/home/20241020450871/en/Visa%E2%80%99s-Growth-Corporates-Working-Capital-Index-Reveals-300-Increase-in-Working-Capital-Efficiency/,https://images.financialmodelingprep.com/news/visas-growth-corporates-working-capital-index-reveals-300-increase-20241020.jpg
V,2024-10-29,2024-10-15,2024-11-12,V,,2024-10-20 21:00:00,2024-10-20T21:00:00-04:00,2024-10-20,"144-Hour Visa-Free Transit Unlocks Wonders of Yunnan: ""Yunnan: A Many-Splendored Life"" Awaits You","KUNMING, China--(BUSINESS WIRE)-- #WorldCulturalHeritage--""Yunnan: A Many-Splendored Life"" is a lifestyle with fantastic nature and great ecosystems.",businesswire.com,https://www.businesswire.com/news/home/20241020373774/en/144-Hour-Visa-Free-Transit-Unlocks-Wonders-of-Yunnan-Yunnan-A-Many-Splendored-Life-Awaits-You/,https://images.financialmodelingprep.com/news/144hour-visafree-transit-unlocks-wonders-of-yunnan-yunnan-a-20241020.jpg
V,2024-10-29,2024-10-15,2024-11-12,V,,2024-10-21 06:04:00,2024-10-21T06:04:00-04:00,2024-10-21,What Is the Dividend Payout for Visa?,Visa prioritizes returning capital to shareholders.,fool.com,https://www.fool.com/investing/2024/10/21/what-is-the-dividend-payout-for-visa/,https://images.financialmodelingprep.com/news/what-is-the-dividend-payout-for-visa-20241021.jpg
V,2024-10-29,2024-10-15,2024-11-12,V,,2024-10-21 09:53:00,2024-10-21T09:53:00-04:00,2024-10-21,"If I Could Only Buy 3 Warren Buffett Stocks Through 2025, I'd Pick These Dividend Stocks","Coca-Cola, Visa, and Chevron are three industry leading companies with long runways for future growth.",fool.com,https://www.fool.com/investing/2024/10/21/buy-warren-buffett-dividend-stocks-2025/,https://images.financialmodelingprep.com/news/if-i-could-only-buy-3-warren-buffett-stocks-20241021.jpg
V,2024-10-29,2024-10-15,2024-11-12,V,,2024-10-21 10:06:10,2024-10-21T10:06:10-04:00,2024-10-21,Visa Inc. (V) is Attracting Investor Attention: Here is What You Should Know,"Recently, Zacks.com users have been paying close attention to Visa (V). This makes it worthwhile to examine what the stock has in store.",zacks.com,https://www.zacks.com/stock/news/2353724/visa-inc-v-is-attracting-investor-attention-here-is-what-you-should-know?cid=CS-STOCKNEWSAPI-FT-tale_of_the_tape|most_searched_stocks-2353724,https://images.financialmodelingprep.com/news/visa-inc-v-is-attracting-investor-attention-here-is-20241021.jpg
V,2024-10-29,2024-10-15,2024-11-12,V,,2024-10-21 11:00:00,2024-10-21T11:00:00-04:00,2024-10-21,The Schall Law Firm Encourages Shareholder Participation In An Inquiry Into Visa Inc For Securities Related Infractions,"LOS ANGELES, CA / ACCESSWIRE / October 21, 2024 / The Schall Law Firm, a national shareholder rights litigation firm, announces that it is investigating claims on behalf of investors of Visa Inc. (""Visa"" or ""the Company"") (NYSE:V) for violations of the securities laws. The investigation focuses on whether the Company issued false and/or misleading statements and/or failed to disclose information pertinent to investors.",accesswire.com,https://www.accesswire.com/viewarticle.aspx?id=933401&lang=en,https://images.financialmodelingprep.com/news/the-schall-law-firm-encourages-shareholder-participation-in-an-inquiry-20241021.jpg
V,2024-10-29,2024-10-15,2024-11-12,V,,2024-10-21 22:20:00,2024-10-21T22:20:00-04:00,2024-10-21,V INVESTOR NEWS: Visa Inc. Investors that Suffered Losses are Encouraged to Contact RLF About Ongoing Investigation into the Company (NYSE: V),"NEW YORK, Oct. 21, 2024 (GLOBE NEWSWIRE) -- Why: Rosen Law Firm, a global investor rights law firm, continues to investigate potential securities claims on behalf of shareholders of Visa Inc. (NYSE: V) resulting from allegations that Visa may have issued materially misleading business information to the investing public.",globenewswire.com,https://www.globenewswire.com/news-release/2024/10/22/2966606/673/en/V-INVESTOR-NEWS-Visa-Inc-Investors-that-Suffered-Losses-are-Encouraged-to-Contact-RLF-About-Ongoing-Investigation-into-the-Company-NYSE-V.html,https://images.financialmodelingprep.com/news/v-investor-news-visa-inc-investors-that-suffered-losses-20241021.jpg
V,2024-10-29,2024-10-15,2024-11-12,V,,2024-10-22 10:00:00,2024-10-22T10:00:00-04:00,2024-10-22,"Bronstein, Gewirtz & Grossman, LLC Announces an Investigation Against Visa Inc. (V) and Encourages Investors to Learn More About the Investigation","NEW YORK CITY, NY / ACCESSWIRE / October 22, 2024 / Bronstein, Gewirtz & Grossman, LLC is investigating potential claims on behalf of purchasers of Visa Inc. (""Visa"" or ""the Company"") (NYSE:V). Investors who purchased Visa securities are encouraged to obtain additional information and assist the investigation by visiting the firm's site: bgandg.com/V.",accesswire.com,https://www.accesswire.com/viewarticle.aspx?id=932506&lang=en,https://images.financialmodelingprep.com/news/bronstein-gewirtz-grossman-llc-announces-an-investigation-against-visa-20241022.jpg
V,2024-10-29,2024-10-15,2024-11-12,V,,2024-10-22 11:05:38,2024-10-22T11:05:38-04:00,2024-10-22,Visa (V) Reports Next Week: Wall Street Expects Earnings Growth,Visa (V) possesses the right combination of the two key ingredients for a likely earnings beat in its upcoming report. Get prepared with the key expectations.,zacks.com,https://www.zacks.com/stock/news/2354936/visa-v-reports-next-week-wall-street-expects-earnings-growth?cid=CS-STOCKNEWSAPI-FT-tale_of_the_tape|yseop_template_9-2354936,https://images.financialmodelingprep.com/news/visa-v-reports-next-week-wall-street-expects-earnings-20241022.jpg
V,2024-10-29,2024-10-15,2024-11-12,V,,2024-10-22 18:51:05,2024-10-22T18:51:05-04:00,2024-10-22,Here's Why Visa (V) Fell More Than Broader Market,"In the latest trading session, Visa (V) closed at $285.28, marking a -1.84% move from the previous day.",zacks.com,https://www.zacks.com/stock/news/2355324/here-s-why-visa-v-fell-more-than-broader-market?cid=CS-STOCKNEWSAPI-FT-tale_of_the_tape|yseop_template_6-2355324,https://images.financialmodelingprep.com/news/heres-why-visa-v-fell-more-than-broader-market-20241022.jpg
V,2024-10-29,2024-10-15,2024-11-12,V,,2024-10-22 19:00:00,2024-10-22T19:00:00-04:00,2024-10-22,V INVESTOR NEWS: Visa Inc. Investors that Suffered Losses are Encouraged to Contact RLF about Ongoing Investigation into the Company (NYSE: V),"NEW YORK , Oct. 22, 2024 /PRNewswire/ -- Rosen Law Firm, a leading securities law firm, announces an investigation into Visa Inc. (NYSE: V) for potential violations of the federal securities laws. If you purchased Visa securities you may be entitled to compensation without payment of any out of pocket fees or costs through a contingency fee arrangement.",prnewswire.com,https://www.prnewswire.com/news-releases/v-investor-news-visa-inc-investors-that-suffered-losses-are-encouraged-to-contact-rlf-about-ongoing-investigation-into-the-company-nyse-v-302283578.html,https://images.financialmodelingprep.com/news/v-investor-news-visa-inc-investors-that-suffered-losses-20241022.jpg
V,2024-10-29,2024-10-15,2024-11-12,V,,2024-10-23 08:00:00,2024-10-23T08:00:00-04:00,2024-10-23,"Criminals Reverting to Old-School Tactics with New Twists, Visa's State of Scams Report Shows","SAN FRANCISCO--(BUSINESS WIRE)--Ahead of Money20/20 US, Visa, a global leader in digital payments, today published the State of Scams: Fall 2024 Biannual Threats Report. The latest edition of the report brings to light several emerging threats and scams targeting banks and consumers, including a surprising resurgence of small-scale physical crime. “Visa invested $11 billion dollars in technology and infrastructure in the past five years, and our network is more secure than ever,” said Paul Faba.",businesswire.com,https://www.businesswire.com/news/home/20241023398641/en/Criminals-Reverting-to-Old-School-Tactics-with-New-Twists-Visa%E2%80%99s-State-of-Scams-Report-Shows/,https://images.financialmodelingprep.com/news/criminals-reverting-to-oldschool-tactics-with-new-twists-visas-20241023.jpg
V,2024-10-29,2024-10-15,2024-11-12,V,,2024-10-23 09:09:02,2024-10-23T09:09:02-04:00,2024-10-23,"Watch PayPal, Visa crypto execs discuss the future of stablecoins and regulation at DC Fintech Week","DC Fintech Week is set to host a panel Wednesday morning called ""Stablecoins Unshackled: New Features, Integrations and Frontiers.""",cnbc.com,https://www.cnbc.com/2024/10/23/watch-paypal-visa-crypto-execs-discuss-the-future-of-stablecoins.html,https://images.financialmodelingprep.com/news/watch-paypal-visa-crypto-execs-discuss-the-future-of-20241023.jpg
V,2024-10-29,2024-10-15,2024-11-12,V,,2024-10-23 10:00:00,2024-10-23T10:00:00-04:00,2024-10-23,"Bronstein, Gewirtz & Grossman, LLC Is Investigating Visa Inc. (V) And Encourages Shareholders to Connect","NEW YORK CITY, NY / ACCESSWIRE / October 23, 2024 / Bronstein, Gewirtz & Grossman, LLC is investigating potential claims on behalf of purchasers of Visa Inc. (""Visa"" or ""the Company"") (NYSE:V). Investors who purchased Visa securities are encouraged to obtain additional information and assist the investigation by visiting the firm's site: bgandg.com/V.",accesswire.com,https://www.accesswire.com/viewarticle.aspx?id=932507&lang=en,https://images.financialmodelingprep.com/news/bronstein-gewirtz-grossman-llc-is-investigating-visa-inc-v-20241023.jpg
V,2024-10-29,2024-10-15,2024-11-12,V,,2024-10-23 10:35:56,2024-10-23T10:35:56-04:00,2024-10-23,Brokers Suggest Investing in Visa (V): Read This Before Placing a Bet,"When deciding whether to buy, sell, or hold a stock, investors often rely on analyst recommendations. Media reports about rating changes by these brokerage-firm-employed (or sell-side) analysts often influence a stock's price, but are they really important?",zacks.com,https://www.zacks.com/stock/news/2355718/brokers-suggest-investing-in-visa-v-read-this-before-placing-a-bet?cid=CS-STOCKNEWSAPI-FT-fundamental_analysis|average_broker_rating-2355718,https://images.financialmodelingprep.com/news/brokers-suggest-investing-in-visa-v-read-this-before-20241023.jpg
