ticker,event_date,window_start,window_end,symbol,symbols,publishedDate,publishedDateET,date_et,title,text,site,url,image
V,2024-10-29,2024-10-15,2024-11-12,V,,2024-10-23 16:00:00,2024-10-23T16:00:00-04:00,2024-10-23,"V INVESTOR ALERT: Bronstein, Gewirtz and Grossman, LLC Announces an Investigation into Visa Inc. and Encourages Investors to Contact the Firm","NEW YORK, Oct. 23, 2024 (GLOBE NEWSWIRE) -- Attorney Advertising -- Bronstein, Gewirtz & Grossman, LLC is investigating potential claims on behalf of purchasers of Visa Inc. (“Visa” or “the Company”) (NYSE: V). Investors who purchased Visa securities are encouraged to obtain additional information and assist the investigation by visiting the firm's site: bgandg.com/V.",globenewswire.com,https://www.globenewswire.com/news-release/2024/10/23/2968151/9788/en/V-INVESTOR-ALERT-Bronstein-Gewirtz-and-Grossman-LLC-Announces-an-Investigation-into-Visa-Inc-and-Encourages-Investors-to-Contact-the-Firm.html,https://images.financialmodelingprep.com/news/v-investor-alert-bronstein-gewirtz-and-grossman-llc-announces-20241023.jpg
V,2024-10-29,2024-10-15,2024-11-12,V,,2024-10-23 18:30:00,2024-10-23T18:30:00-04:00,2024-10-23,SHAREHOLDER ALERT: Pomerantz Law Firm Investigates Claims On Behalf of Investors of Visa Inc. - V,"NEW YORK, NY / ACCESSWIRE / October 23, 2024 / Pomerantz LLP is investigating claims on behalf of investors of Visa Inc. (""Visa"" or the ""Company"") (NYSE:V). Such investors are advised to contact Danielle Peyton at newaction@pomlaw.com or 646-581-9980, ext.",accesswire.com,https://www.accesswire.com/935150/shareholder-alert-pomerantz-law-firm-investigates-claims--on-behalf-of-investors-of-visa-inc--v,https://images.financialmodelingprep.com/news/shareholder-alert-pomerantz-law-firm-investigates-claims-on-behalf-of-investors-of-visa-20241023.jpg
V,2024-10-29,2024-10-15,2024-11-12,V,,2024-10-24 09:51:18,2024-10-24T09:51:18-04:00,2024-10-24,These 2 Business Services Stocks Could Beat Earnings: Why They Should Be on Your Radar,Finding stocks expected to beat quarterly earnings estimates becomes an easier task with our Zacks Earnings ESP.,zacks.com,https://www.zacks.com/stock/news/2356602/these-2-business-services-stocks-could-beat-earnings-why-they-should-be-on-your-radar?cid=CS-STOCKNEWSAPI-FT-tale_of_the_tape|zacks_education_earnings_esp-2356602,https://images.financialmodelingprep.com/news/these-2-business-services-stocks-could-beat-earnings-why-20241024.jpg
V,2024-10-29,2024-10-15,2024-11-12,V,,2024-10-24 10:21:18,2024-10-24T10:21:18-04:00,2024-10-24,Ahead of Visa (V) Q4 Earnings: Get Ready With Wall Street Estimates for Key Metrics,Get a deeper insight into the potential performance of Visa (V) for the quarter ended September 2024 by going beyond Wall Street's top -and-bottom-line estimates and examining the estimates for some of its key metrics.,zacks.com,https://www.zacks.com/stock/news/2356688/ahead-of-visa-v-q4-earnings-get-ready-with-wall-street-estimates-for-key-metrics?cid=CS-STOCKNEWSAPI-FT-fundamental_analysis|nfm_preview-2356688,https://images.financialmodelingprep.com/news/ahead-of-visa-v-q4-earnings-get-ready-with-20241024.jpg
V,2024-10-29,2024-10-15,2024-11-12,V,,2024-10-24 13:35:27,2024-10-24T13:35:27-04:00,2024-10-24,Visa Stock Before Q4 Earnings: Should You Buy Now or Wait for Results?,"V's fiscal fourth-quarter earnings are likely to have benefited from growth in Gross Dollar Volume, processed transactions and payment volumes.",zacks.com,https://www.zacks.com/stock/news/2357139/visa-stock-before-q4-earnings-should-you-buy-now-or-wait-for-results?cid=CS-STOCKNEWSAPI-FT-analyst_blog|most_popular_stocks-2357139,https://images.financialmodelingprep.com/news/visa-stock-before-q4-earnings-should-you-buy-now-20241024.jpg
V,2024-10-29,2024-10-15,2024-11-12,V,,2024-10-24 17:41:00,2024-10-24T17:41:00-04:00,2024-10-24,V INVESTOR NEWS: Visa Inc. Investors that Suffered Losses are Encouraged to Contact RLF About Ongoing Investigation into the Company (NYSE: V),"NEW YORK, Oct. 24, 2024 (GLOBE NEWSWIRE) -- Why: Rosen Law Firm, a global investor rights law firm, continues to investigate potential securities claims on behalf of shareholders of Visa Inc. (NYSE: V) resulting from allegations that Visa may have issued materially misleading business information to the investing public.",globenewswire.com,https://www.globenewswire.com/news-release/2024/10/24/2969178/673/en/V-INVESTOR-NEWS-Visa-Inc-Investors-that-Suffered-Losses-are-Encouraged-to-Contact-RLF-About-Ongoing-Investigation-into-the-Company-NYSE-V.html,https://images.financialmodelingprep.com/news/v-investor-news-visa-inc-investors-that-suffered-losses-20241024.jpg
V,2024-10-29,2024-10-15,2024-11-12,V,,2024-10-25 04:25:00,2024-10-25T04:25:00-04:00,2024-10-25,3 Dividend-Paying Financial Stocks That Could Make You a Millionaire,Looking to build a million-dollar nest egg? Look at this trio of financial dividend payers covering a broad spectrum of investment styles.,fool.com,https://www.fool.com/investing/2024/10/25/dividend-paying-financial-stocks-millionaire/,https://images.financialmodelingprep.com/news/3-dividendpaying-financial-stocks-that-could-make-you-a-20241025.jpg
V,2024-10-29,2024-10-15,2024-11-12,V,,2024-10-25 05:15:00,2024-10-25T05:15:00-04:00,2024-10-25,Is Visa Stock a Buy?,"As Visa faces increasing regulatory scrutiny, its stock is worth revisiting.",fool.com,https://www.fool.com/investing/2024/10/25/is-visa-stock-a-buy/,https://images.financialmodelingprep.com/news/is-visa-stock-a-buy-20241025.jpg
V,2024-10-29,2024-10-15,2024-11-12,V,,2024-10-25 11:00:00,2024-10-25T11:00:00-04:00,2024-10-25,SHAREHOLDER ALERT: Pomerantz Law Firm Investigates Claims On Behalf of Investors of Visa Inc. - V,"NEW YORK , Oct. 25, 2024 /PRNewswire/ -- Pomerantz LLP is investigating claims on behalf of investors of Visa Inc. (""Visa"" or the ""Company"") (NYSE: V). Such investors are advised to contact Danielle Peyton at newaction@pomlaw.com or 646-581-9980, ext.",prnewswire.com,https://www.prnewswire.com/news-releases/shareholder-alert-pomerantz-law-firm-investigates-claims-on-behalf-of-investors-of-visa-inc---v-302286746.html,https://images.financialmodelingprep.com/news/shareholder-alert-pomerantz-law-firm-investigates-claims-on-behalf-of-investors-of-visa-20241025.jpg
V,2024-10-29,2024-10-15,2024-11-12,V,,2024-10-26 04:30:00,2024-10-26T04:30:00-04:00,2024-10-26,2 Reliable Dividend Stocks You Can Buy and Hold Forever,There are reasons beyond the dividends to invest in these stocks.,fool.com,https://www.fool.com/investing/2024/10/26/2-reliable-dividend-stocks-you-can-buy-and-hold-fo/,https://images.financialmodelingprep.com/news/2-reliable-dividend-stocks-you-can-buy-and-hold-20241026.jpg
V,2024-10-29,2024-10-15,2024-11-12,V,,2024-10-26 11:00:00,2024-10-26T11:00:00-04:00,2024-10-26,Visa Inc. Is Being Investigated For Securities Fraud And Investors With Losses Are Urged To Contact The Schall Law Firm,"LOS ANGELES, CA / ACCESSWIRE / October 26, 2024 / The Schall Law Firm, a national shareholder rights litigation firm, announces that it is investigating claims on behalf of investors of Visa Inc. (""Visa"" or ""the Company"") (NYSE:V) for violations of the securities laws. The investigation focuses on whether the Company issued false and/or misleading statements and/or failed to disclose information pertinent to investors.",accesswire.com,https://www.accesswire.com/935738/visa-inc-is-being-investigated-for-securities-fraud-and-investors-with-losses-are-urged-to-contact-the-schall-law-firm,https://images.financialmodelingprep.com/news/visa-inc-is-being-investigated-for-securities-fraud-and-20241026.jpg
V,2024-10-29,2024-10-15,2024-11-12,V,,2024-10-27 05:24:00,2024-10-27T05:24:00-04:00,2024-10-27,"The Best Warren Buffett Stocks to Buy With $3,000 Right Now","Visa, Nu, and Chubb all survived Buffett's pruning of Berkshire's portfolio.",fool.com,https://www.fool.com/investing/2024/10/27/the-best-warren-buffett-stocks-to-buy-with-3000-ri/,https://images.financialmodelingprep.com/news/the-best-warren-buffett-stocks-to-buy-with-3000-20241027.jpg
V,2024-10-29,2024-10-15,2024-11-12,V,,2024-10-27 10:00:00,2024-10-27T10:00:00-04:00,2024-10-27,"Bronstein, Gewirtz & Grossman, LLC Initiates an Investigation into Allegations Against Visa Inc. (V) And Encourages Stockholders to Reach Out","NEW YORK CITY, NY / ACCESSWIRE / October 27, 2024 / Bronstein, Gewirtz & Grossman, LLC is investigating potential claims on behalf of purchasers of Visa Inc. (""Visa"" or ""the Company"") (NYSE:V). Investors who purchased Visa securities are encouraged to obtain additional information and assist the investigation by visiting the firm's site: bgandg.com/V.",accesswire.com,https://www.accesswire.com/932509/bronstein-gewirtz-grossman-llc-initiates-an-investigation-into-allegations-against-visa-inc-v-and-encourages-stockholders-to-reach-out,https://images.financialmodelingprep.com/news/bronstein-gewirtz-grossman-llc-initiates-an-investigation-into-allegations-20241027.jpg
V,2024-10-29,2024-10-15,2024-11-12,V,,2024-10-27 11:00:00,2024-10-27T11:00:00-04:00,2024-10-27,The Schall Law Firm Encourages Shareholder Participation In An Inquiry Into Visa Inc For Securities Law Violations,"LOS ANGELES, CA / ACCESSWIRE / October 27, 2024 / The Schall Law Firm, a national shareholder rights litigation firm, announces that it is investigating claims on behalf of investors of Visa Inc. (""Visa"" or ""the Company"") (NYSE:V) for violations of the securities laws. The investigation focuses on whether the Company issued false and/or misleading statements and/or failed to disclose information pertinent to investors.",accesswire.com,https://www.accesswire.com/935854/the-schall-law-firm-encourages-shareholder-participation-in-an-inquiry-into-visa-inc-for-securities-law-violations,https://images.financialmodelingprep.com/news/the-schall-law-firm-encourages-shareholder-participation-in-an-inquiry-20241027.jpg
V,2024-10-29,2024-10-15,2024-11-12,V,,2024-10-27 11:10:00,2024-10-27T11:10:00-04:00,2024-10-27,Rosen Law Firm Encourages Visa Inc. Investors to Inquire About Securities Class Action Investigation - V,"NEW YORK , Oct. 27, 2024 /PRNewswire/ -- Why: Rosen Law Firm, a global investor rights law firm, continues to investigate potential securities claims on behalf of shareholders of Visa Inc. (NYSE: V) resulting from allegations that Visa may have issued materially misleading business information to the investing public. So What: If you purchased Visa securities you may be entitled to compensation without payment of any out of pocket fees or costs through a contingency fee arrangement.",prnewswire.com,https://www.prnewswire.com/news-releases/rosen-law-firm-encourages-visa-inc-investors-to-inquire-about-securities-class-action-investigation--v-302287720.html,https://images.financialmodelingprep.com/news/rosen-law-firm-encourages-visa-inc-investors-to-inquire-20241027.jpg
V,2024-10-29,2024-10-15,2024-11-12,V,,2024-10-27 12:00:00,2024-10-27T12:00:00-04:00,2024-10-27,SHAREHOLDER ALERT: Pomerantz Law Firm Investigates Claims On Behalf of Investors of Visa Inc. - V,"NEW YORK, NY / ACCESSWIRE / October 27, 2024 / Pomerantz LLP is investigating claims on behalf of investors of Visa Inc. (""Visa"" or the ""Company"") (NYSE:V). Such investors are advised to contact Danielle Peyton at newaction@pomlaw.com or 646-581-9980, ext.",accesswire.com,https://www.accesswire.com/935615/shareholder-alert-pomerantz-law-firm-investigates-claims-on-behalf-of-investors-of-visa-inc--v,https://images.financialmodelingprep.com/news/shareholder-alert-pomerantz-law-firm-investigates-claims-on-behalf-of-investors-of-visa-20241027.jpg
V,2024-10-29,2024-10-15,2024-11-12,V,,2024-10-27 16:00:00,2024-10-27T16:00:00-04:00,2024-10-27,"V INVESTOR ALERT: Bronstein, Gewirtz and Grossman, LLC Announces an Investigation into Visa Inc. and Encourages Investors to Contact the Firm","NEW YORK , Oct. 27, 2024 /PRNewswire/ -- Attorney Advertising -- Bronstein, Gewirtz & Grossman, LLC is investigating potential claims on behalf of purchasers of Visa Inc. (""Visa"" or ""the Company"") (NYSE: V). Investors who purchased Visa securities are encouraged to obtain additional information and assist the investigation by visiting the firm's site: bgandg.com/V.",prnewswire.com,https://www.prnewswire.com/news-releases/v-investor-alert-bronstein-gewirtz-and-grossman-llc-announces-an-investigation-into-visa-inc-and-encourages-investors-to-contact-the-firm-302278834.html,https://images.financialmodelingprep.com/news/v-investor-alert-bronstein-gewirtz-and-grossman-llc-announces-20241027.jpg
V,2024-10-29,2024-10-15,2024-11-12,V,,2024-10-28 16:00:00,2024-10-28T16:00:00-04:00,2024-10-28,"V INVESTOR ALERT: Bronstein, Gewirtz and Grossman, LLC Announces an Investigation into Visa Inc. and Encourages Investors to Contact the Firm","NEW YORK--(BUSINESS WIRE)---- $V #V--Attorney Advertising--Bronstein, Gewirtz & Grossman, LLC is investigating potential claims on behalf of purchasers of Visa Inc. (“Visa” or “the Company”) (NYSE: V). Investors who purchased Visa securities are encouraged to obtain additional information and assist the investigation by visiting the firm's site: bgandg.com/V. Investigation Details On September 24, 2024, The United States Department of Justice issued a release entitled “Justice Department Sues Visa fo.",businesswire.com,https://www.businesswire.com/news/home/20241028048658/en/V-INVESTOR-ALERT-Bronstein-Gewirtz-and-Grossman-LLC-Announces-an-Investigation-into-Visa-Inc.-and-Encourages-Investors-to-Contact-the-Firm/,https://images.financialmodelingprep.com/news/v-investor-alert-bronstein-gewirtz-and-grossman-llc-announces-20241028.jpg
V,2024-10-29,2024-10-15,2024-11-12,V,,2024-10-28 18:36:00,2024-10-28T18:36:00-04:00,2024-10-28,V INVESTOR NEWS: Visa Inc. Investors that Suffered Losses are Encouraged to Contact Rosen Law about Ongoing Investigation into the Company – V,"NEW YORK, Oct. 28, 2024 (GLOBE NEWSWIRE) -- Rosen Law Firm, a global investor rights law firm, continues to investigate Visa Inc. (NYSE: V) for potential violations of the federal securities laws.",globenewswire.com,https://www.globenewswire.com/news-release/2024/10/28/2970417/673/en/V-INVESTOR-NEWS-Visa-Inc-Investors-that-Suffered-Losses-are-Encouraged-to-Contact-Rosen-Law-about-Ongoing-Investigation-into-the-Company-V.html,https://images.financialmodelingprep.com/news/v-investor-news-visa-inc-investors-that-suffered-losses-20241028.jpg
V,2024-10-29,2024-10-15,2024-11-12,V,,2024-10-29 10:00:00,2024-10-29T10:00:00-04:00,2024-10-29,"Bronstein, Gewirtz & Grossman, LLC Announces an Investigation Against Visa Inc. (V) and Encourages Investors to Learn More About the Investigation","NEW YORK CITY, NY / ACCESSWIRE / October 29, 2024 / Bronstein, Gewirtz & Grossman, LLC is investigating potential claims on behalf of purchasers of Visa Inc. (""Visa"" or ""the Company"") (NYSE:V). Investors who purchased Visa securities are encouraged to obtain additional information and assist the investigation by visiting the firm's site: bgandg.com/V.",accesswire.com,https://www.accesswire.com/932511/bronstein-gewirtz-grossman-llc-announces-an-investigation-against-visa-inc-v-and-encourages-investors-to-learn-more-about-the-investigation,https://images.financialmodelingprep.com/news/bronstein-gewirtz-grossman-llc-announces-an-investigation-against-visa-20241029.jpg
V,2024-10-29,2024-10-15,2024-11-12,V,,2024-10-29 12:00:00,2024-10-29T12:00:00-04:00,2024-10-29,SHAREHOLDER ALERT: Pomerantz Law Firm Investigates Claims On Behalf of Investors of Visa Inc. - V,"NEW YORK, NY / ACCESSWIRE / October 29, 2024 / Pomerantz LLP is investigating claims on behalf of investors of Visa Inc. (""Visa"" or the ""Company"") (NYSE:V). Such investors are advised to contact Danielle Peyton at newaction@pomlaw.com or 646-581-9980, ext.",accesswire.com,https://www.accesswire.com/936331/shareholder-alert-pomerantz-law-firm-investigates-claims-on-behalf-of-investors-of-visa-inc--v,https://images.financialmodelingprep.com/news/shareholder-alert-pomerantz-law-firm-investigates-claims-on-behalf-of-investors-of-visa-20241029.jpg
V,2024-10-29,2024-10-15,2024-11-12,V,,2024-10-29 12:01:04,2024-10-29T12:01:04-04:00,2024-10-29,Is Visa's Grip on Payments About to Slip?,Stablecoins are coming for Visa's cash cow.,fool.com,https://www.fool.com/investing/2024/10/29/is-visas-grip-on-payments-about-to-slip/,https://images.financialmodelingprep.com/news/is-visas-grip-on-payments-about-to-slip-20241029.jpg
V,2024-10-29,2024-10-15,2024-11-12,V,,2024-10-29 13:49:41,2024-10-29T13:49:41-04:00,2024-10-29,"V Shows Consumer ""Cut Back Spending on Cash, Not Credit""","@LikeFolio 's Landon Swan says Visa (V) is a ""safe place"" to put your money. Despite higher interest rates and inflation pinching consumers, the company shows promise ahead of its earnings report.",youtube.com,https://www.youtube.com/watch?v=MOF1DKSXq3Q,https://images.financialmodelingprep.com/news/v-shows-consumer-cut-back-spending-on-cash-not-20241029.jpg
V,2024-10-29,2024-10-15,2024-11-12,V,,2024-10-29 14:45:00,2024-10-29T14:45:00-04:00,2024-10-29,"Visa Plans to Lay Off Around 1,400 Employees and Contractors","Roughly 1,000 of the cuts are expected to eliminate technology positions, while most of the rest will focus on merchant sales and global digital partnerships roles.",wsj.com,https://www.wsj.com/articles/visa-plans-to-lay-off-around-1-400-employees-and-contractors-cd278c71,https://images.financialmodelingprep.com/news/visa-plans-to-lay-off-around-1400-employees-and-20241029.jpg
V,2024-10-29,2024-10-15,2024-11-12,V,,2024-10-29 16:00:00,2024-10-29T16:00:00-04:00,2024-10-29,"V INVESTOR ALERT: Bronstein, Gewirtz and Grossman, LLC Announces an Investigation into Visa Inc. and Encourages Investors to Contact the Firm","NEW YORK, Oct. 29, 2024 (GLOBE NEWSWIRE) -- Attorney Advertising -- Bronstein, Gewirtz & Grossman, LLC is investigating potential claims on behalf of purchasers of Visa Inc. (“Visa” or “the Company”) (NYSE: V). Investors who purchased Visa securities are encouraged to obtain additional information and assist the investigation by visiting the firm's site: bgandg.com/V.",globenewswire.com,https://www.globenewswire.com/news-release/2024/10/29/2971184/9788/en/V-INVESTOR-ALERT-Bronstein-Gewirtz-and-Grossman-LLC-Announces-an-Investigation-into-Visa-Inc-and-Encourages-Investors-to-Contact-the-Firm.html,https://images.financialmodelingprep.com/news/v-investor-alert-bronstein-gewirtz-and-grossman-llc-announces-20241029.jpg
V,2024-10-29,2024-10-15,2024-11-12,V,,2024-10-29 16:05:00,2024-10-29T16:05:00-04:00,2024-10-29,Visa Fiscal Fourth Quarter and Full-Year 2024 Financial Results,SAN FRANCISCO--(BUSINESS WIRE)--Visa (NYSE: V) today announced its fiscal fourth quarter and full-year 2024 financial results through an earnings release that will be furnished with the Securities and Exchange Commission on a Form 8-K and available on its Investor Relations website at investor.visa.com/financial-information/quarterly-earnings/default.aspx. Visa will host a live audio webcast at 2:00 p.m. Pacific Time (5:00 p.m. Eastern Time) to discuss these financial results. The webcast and a.,businesswire.com,https://www.businesswire.com/news/home/20241029309175/en/Visa-Fiscal-Fourth-Quarter-and-Full-Year-2024-Financial-Results/,https://images.financialmodelingprep.com/news/visa-fiscal-fourth-quarter-and-fullyear-2024-financial-results-20241029.jpg
V,2024-10-29,2024-10-15,2024-11-12,V,,2024-10-29 16:34:00,2024-10-29T16:34:00-04:00,2024-10-29,Visa gets a boost from higher payment volumes and transactions,Shares of Visa Inc. rise more than 2% in the extended session Tuesday as company sees “stable growth” across its business.,marketwatch.com,https://www.marketwatch.com/story/visa-gets-a-boost-from-higher-payment-volumes-and-transactions-d576e30d,https://images.financialmodelingprep.com/news/visa-gets-a-boost-from-higher-payment-volumes-and-20241029.jpg
V,2024-10-29,2024-10-15,2024-11-12,V,,2024-10-29 17:41:22,2024-10-29T17:41:22-04:00,2024-10-29,"Visa to Lay Off 1,400 as It Streamlines International Business","Visa will reportedly lay off 1,400 employees and contractors, including about 1,000 in technology positions, by the end of the year. The company aims to streamline its international business with these cuts, The Wall Street Journal (WSJ) reported Tuesday (Oct. 29).",pymnts.com,https://www.pymnts.com/visa/2024/visa-to-lay-off-1400-as-it-streamlines-international-business/,https://images.financialmodelingprep.com/news/visa-to-lay-off-1400-as-it-streamlines-international-20241029.jpg
V,2024-10-29,2024-10-15,2024-11-12,V,,2024-10-29 18:20:21,2024-10-29T18:20:21-04:00,2024-10-29,Visa (V) Q4 Earnings and Revenues Top Estimates,"Visa (V) came out with quarterly earnings of $2.71 per share, beating the Zacks Consensus Estimate of $2.58 per share. This compares to earnings of $2.33 per share a year ago.",zacks.com,https://www.zacks.com/stock/news/2359969/visa-v-q4-earnings-and-revenues-top-estimates?cid=CS-STOCKNEWSAPI-FT-tale_of_the_tape|yseop_template_4-2359969,https://images.financialmodelingprep.com/news/visa-v-q4-earnings-and-revenues-top-estimates-20241029.jpg
V,2024-10-29,2024-10-15,2024-11-12,V,,2024-10-29 18:30:00,2024-10-29T18:30:00-04:00,2024-10-29,Coinbase to Integrate Visa Direct to Deliver Real-Time Account Funding for Customers,"SAN FRANCISCO--(BUSINESS WIRE)--Visa (NYSE: V), a world leader in digital payments, today announced a partnership with Coinbase, a trusted place to buy, sell, and manage crypto. This partnership adds convenience and new services for Coinbase customers across the US and EU, including real-time1, reliable, and secure money movement. By integrating with the Visa Direct network, Coinbase customers will be able to deposit funds into their Coinbase account in real-time1 using eligible Visa debit card.",businesswire.com,https://www.businesswire.com/news/home/20241029279588/en/Coinbase-to-Integrate-Visa-Direct-to-Deliver-Real-Time-Account-Funding-for-Customers/,https://images.financialmodelingprep.com/news/coinbase-to-integrate-visa-direct-to-deliver-realtime-account-20241029.jpg
V,2024-10-29,2024-10-15,2024-11-12,V,,2024-10-29 19:26:17,2024-10-29T19:26:17-04:00,2024-10-29,"Alphabet, Visa, Reddit Up on Strong Earnings Numbers","Meanwhile, Chipotle and AMD beat on earnings but are sliding in late trading on weaker guidance.",zacks.com,https://www.zacks.com/stock/news/2360112/alphabet-visa-reddit-up-on-strong-earnings-numbers?cid=CS-STOCKNEWSAPI-FT-ahead_of_wall_street-2360112,https://images.financialmodelingprep.com/news/alphabet-visa-reddit-up-on-strong-earnings-numbers-20241029.jpg
V,2024-10-29,2024-10-15,2024-11-12,V,,2024-10-29 20:31:10,2024-10-29T20:31:10-04:00,2024-10-29,Here's What Key Metrics Tell Us About Visa (V) Q4 Earnings,"Although the revenue and EPS for Visa (V) give a sense of how its business performed in the quarter ended September 2024, it might be worth considering how some key metrics compare with Wall Street estimates and the year-ago numbers.",zacks.com,https://www.zacks.com/stock/news/2360147/here-s-what-key-metrics-tell-us-about-visa-v-q4-earnings?cid=CS-STOCKNEWSAPI-FT-fundamental_analysis|nfm-2360147,https://images.financialmodelingprep.com/news/heres-what-key-metrics-tell-us-about-visa-v-20241029.jpg
V,2024-10-29,2024-10-15,2024-11-12,V,,2024-10-29 21:29:09,2024-10-29T21:29:09-04:00,2024-10-29,Visa Inc. (V) Q4 2024 Earnings Conference Call Transcript,"Visa Inc. (NYSE:V ) Q4 2024 Earnings Conference Call October 29, 2024 5:00 PM ET Company Participants Jennifer Como - Global Head of IR Ryan McInerney - CEO Chris Suh - CFO Conference Call Participants Harshita Rawat - Bernstein Ramsey El-Assal - Barclays Sanjay Sakhrani - KBW Paul Golding - Macquarie Tien-Tsin Huang - JPMorgan Rayna Kumar - Oppenheimer Andrew Schmidt - Citigroup Dave Koning - Baird Tim Chiodo - UBS Bryan Keane - Deutsche Bank Jason Kupferberg - Bank of America Craig Maurer - FT Partners Trevor Williams - Jefferies Darrin Peller - Wolfe Research Operator Welcome to Visa's Fiscal Fourth Quarter and Full Year 2024 Earnings Conference Call. All participants are in a listen-only mode until the question-and-answer session.",seekingalpha.com,https://seekingalpha.com/article/4730695-visa-inc-v-q4-2024-earnings-conference-call-transcript,https://images.financialmodelingprep.com/news/visa-inc-v-q4-2024-earnings-conference-call-transcript-20241029.jpg
V,2024-10-29,2024-10-15,2024-11-12,V,,2024-10-29 21:39:30,2024-10-29T21:39:30-04:00,2024-10-29,"Visa Direct Transactions Leap 38%, Tokens Pass 11.5 Billion Milestone","Visa's fiscal fourth quarter results underscored the payment network's traction beyond card payments, as new payment flows in particular gained momentum. Commentary from the call and from the earnings supplement and earnings release show that overall payments volume grew 8% year over year.",pymnts.com,https://www.pymnts.com/visa/2024/visa-direct-transactions-leap-38-tokens-pass-11-5-billion-milestone/,https://images.financialmodelingprep.com/news/visa-direct-transactions-leap-38-tokens-pass-115-billion-20241029.jpg
V,2024-10-29,2024-10-15,2024-11-12,V,,2024-10-30 07:00:00,2024-10-30T07:00:00-04:00,2024-10-30,3 Dividend Growth Stocks to Buy and Never Sell,These 3 dividend growth stocks have crushed the market and show no signs of slowing down.,fool.com,https://www.fool.com/investing/2024/10/30/3-dividend-growth-stocks-to-buy-and-never-sell/,https://images.financialmodelingprep.com/news/3-dividend-growth-stocks-to-buy-and-never-sell-20241030.jpg
