ticker,event_date,window_start,window_end,symbol,symbols,publishedDate,publishedDateET,date_et,title,text,site,url,image
V,2024-10-29,2024-10-15,2024-11-12,V,,2024-10-30 07:29:11,2024-10-30T07:29:11-04:00,2024-10-30,Visa climbs as robust consumer spending drives profit beat,"Visa Inc (NYSE:V, ETR:3V64) shares ticked higher in pre-market trading on Wednesday after the payment card firm unveiled better than expected profit for the fourth quarter. Per share earnings climbed by 17% to $2.65 over the three months to September, Visa reported on Tuesday evening, surpassing analysts' estimates for $2.58.",proactiveinvestors.com,https://www.proactiveinvestors.com/companies/news/1059481,https://images.financialmodelingprep.com/news/visa-climbs-as-robust-consumer-spending-drives-profit-beat-20241030.jpg
V,2024-10-29,2024-10-15,2024-11-12,V,,2024-10-30 10:03:09,2024-10-30T10:03:09-04:00,2024-10-30,Coinbase Teams With Visa for Real-Time Crypto Deposits,"Visa has launched a money movement partnership with cryptocurrency exchange Coinbase. The collaboration connects Coinbase to the Visa Direct network, letting the exchange's customers deposit funds into their accounts via eligible Visa debit cards, according to a Tuesday (Oct. 29) news release.",pymnts.com,https://www.pymnts.com/cryptocurrency/2024/coinbase-teams-with-visa-for-real-time-crypto-deposits/,https://images.financialmodelingprep.com/news/coinbase-teams-with-visa-for-realtime-crypto-deposits-20241030.jpg
V,2024-10-29,2024-10-15,2024-11-12,V,,2024-10-30 13:55:25,2024-10-30T13:55:25-04:00,2024-10-30,"Visa Beats Q4 Earnings on Strong Payments Volume, Hikes Dividend",V's fiscal Q4 results gain from strong payment volumes and cross-border growth. It estimates net revenues to grow in high-single-digit to low-double-digits on an adjusted constant-dollar basis in fiscal 2025.,zacks.com,https://www.zacks.com/stock/news/2360989/visa-beats-q4-earnings-on-strong-payments-volume-hikes-dividend?cid=CS-STOCKNEWSAPI-FT-analyst_blog|earnings_article-2360989,https://images.financialmodelingprep.com/news/visa-beats-q4-earnings-on-strong-payments-volume-hikes-20241030.jpg
V,2024-10-29,2024-10-15,2024-11-12,V,,2024-10-30 14:00:40,2024-10-30T14:00:40-04:00,2024-10-30,Why Visa Stock Popped After Earnings Today,"Surprise, surprise: In a nation of credit card holders, Visa stock is doing just fine.",fool.com,https://www.fool.com/investing/2024/10/30/why-visa-stock-popped-after-earnings-today/,https://images.financialmodelingprep.com/news/why-visa-stock-popped-after-earnings-today-20241030.jpg
V,2024-10-29,2024-10-15,2024-11-12,V,,2024-10-30 14:01:08,2024-10-30T14:01:08-04:00,2024-10-30,Google and Visa Just Crushed Earnings. Time to Buy?,Google parent Alphabet (NASDAQ:GOOG)(NASDAQ:GOOGL) and Visa (NYSE:V) reported quarterly earnings and absolutely hit it out of the park.,247wallst.com,https://247wallst.com/investing/2024/10/30/google-and-visa-just-crushed-earnings-time-to-buy/,https://images.financialmodelingprep.com/news/google-and-visa-just-crushed-earnings-time-to-buy-20241030.jpg
V,2024-10-29,2024-10-15,2024-11-12,V,,2024-10-30 22:50:42,2024-10-30T22:50:42-04:00,2024-10-30,'Seamless money movement' is required for any megaregion to be effective: Visa group president,"Oliver Jenkyn, Visa group president, says he likens money movement to ""blood in a body.""",youtube.com,https://www.youtube.com/watch?v=WFXpSE5BNto,https://images.financialmodelingprep.com/news/seamless-money-movement-is-required-for-any-megaregion-to-20241030.jpg
V,2024-10-29,2024-10-15,2024-11-12,V,,2024-10-31 05:00:00,2024-10-31T05:00:00-04:00,2024-10-31,Visa Looks Cheap Even Though It's Near 52-Week Highs,Visa's stock price is just 2.5% below its 52-week high and up nearly 24% during the past year. And the stock still looks attractively priced.,fool.com,https://www.fool.com/investing/2024/10/31/visa-looks-cheap-even-though-its-near-52-week-high/,https://images.financialmodelingprep.com/news/visa-looks-cheap-even-though-its-near-52week-highs-20241031.jpg
V,2024-10-29,2024-10-15,2024-11-12,V,,2024-10-31 08:13:02,2024-10-31T08:13:02-04:00,2024-10-31,Visa's View on the Holiday Shopping Season,"Visa chief economist Wayne Best unveils the company's holiday spending forecast, and whether consumers will be shelling out more for gifts this year.",youtube.com,https://www.youtube.com/watch?v=K-ZPz9YBxzA,https://images.financialmodelingprep.com/news/visas-view-on-the-holiday-shopping-season-20241031.jpg
V,2024-10-29,2024-10-15,2024-11-12,V,,2024-10-31 16:30:00,2024-10-31T16:30:00-04:00,2024-10-31,SHAREHOLDER ALERT: Pomerantz Law Firm Investigates Claims On Behalf of Investors of Visa Inc. - V,"NEW YORK, NY / ACCESSWIRE / October 31, 2024 / Pomerantz LLP is investigating claims on behalf of investors of Visa Inc. (""Visa"" or the ""Company"") (NYSE:V). Such investors are advised to contact Danielle Peyton at newaction@pomlaw.com or 646-581-9980, ext.",accesswire.com,https://www.accesswire.com/937772/shareholder-alert-pomerantz-law-firm-investigates-claims-on-behalf-of-investors-of-visa-inc--v,https://images.financialmodelingprep.com/news/shareholder-alert-pomerantz-law-firm-investigates-claims-on-behalf-of-investors-of-visa-20241031.jpg
V,2024-10-29,2024-10-15,2024-11-12,V,,2024-11-01 13:56:00,2024-11-01T13:56:00-04:00,2024-11-01,Rosen Law Firm Encourages Visa Inc. Investors to Inquire About Securities Class Action Investigation - V,"NEW YORK , Nov. 1, 2024 /PRNewswire/ --  Why: Rosen Law Firm, a global investor rights law firm, continues to investigate potential securities claims on behalf of shareholders of Visa Inc. (NYSE: V) resulting from allegations that Visa may have issued materially misleading business information to the investing public. So What: If you purchased Visa securities you may be entitled to compensation without payment of any out of pocket fees or costs through a contingency fee arrangement.",prnewswire.com,https://www.prnewswire.com/news-releases/rosen-law-firm-encourages-visa-inc-investors-to-inquire-about-securities-class-action-investigation--v-302294288.html,https://images.financialmodelingprep.com/news/rosen-law-firm-encourages-visa-inc-investors-to-inquire-20241101.jpg
V,2024-10-29,2024-10-15,2024-11-12,V,,2024-11-01 14:15:45,2024-11-01T14:15:45-04:00,2024-11-01,"Calls of the Day: Berkshire Hathaway, Citigroup, Visa and Uber",The Investment Committee debate the latest Calls Of The Day.,youtube.com,https://www.youtube.com/watch?v=QmUGxbC2Dsk,https://images.financialmodelingprep.com/news/calls-of-the-day-berkshire-hathaway-citigroup-visa-and-20241101.jpg
V,2024-10-29,2024-10-15,2024-11-12,V,,2024-11-01 15:04:02,2024-11-01T15:04:02-04:00,2024-11-01,Visa and Mastercard Earnings Shine Spotlight on B2B Innovations,"For the payment networks, the continued shift beyond consumer cards has trillions of dollars' worth of B2B transactions firmly in sight.",pymnts.com,https://www.pymnts.com/news/b2b-payments/2024/visa-and-mastercard-earnings-shine-spotlight-on-b2b-innovations/,https://images.financialmodelingprep.com/news/visa-and-mastercard-earnings-shine-spotlight-on-b2b-innovations-20241101.jpg
V,2024-10-29,2024-10-15,2024-11-12,V,,2024-11-01 15:22:59,2024-11-01T15:22:59-04:00,2024-11-01,Visa Uses More Than 500 Generative AI Applications,"Visa reportedly uses more than 500 generative artificial intelligence applications and is looking to add more. The company aims to gain the benefits of the technology sooner than others and keep up with the increasingly sophisticated threats the industry faces from fraudsters, The Wall Street Journal reported Friday (Nov. 1).",pymnts.com,https://www.pymnts.com/news/artificial-intelligence/2024/visa-uses-more-than-500-generative-ai-applications/,https://images.financialmodelingprep.com/news/visa-uses-more-than-500-generative-ai-applications-20241101.jpg
V,2024-10-29,2024-10-15,2024-11-12,V,,2024-11-02 11:00:00,2024-11-02T11:00:00-04:00,2024-11-02,Visa Inc. Is Being Investigated For Securities Fraud And Investors With Losses Are Urged To Contact The Schall Law Firm,"LOS ANGELES, CA / ACCESSWIRE / November 2, 2024 / The Schall Law Firm, a national shareholder rights litigation firm, announces that it is investigating claims on behalf of investors of Visa Inc. (""Visa"" or ""the Company"") (NYSE:V) for violations of the securities laws. The investigation focuses on whether the Company issued false and/or misleading statements and/or failed to disclose information pertinent to investors.",accesswire.com,https://www.accesswire.com/938293/visa-inc-is-being-investigated-for-securities-fraud-and-investors-with-losses-are-urged-to-contact-the-schall-law-firm,https://images.financialmodelingprep.com/news/visa-inc-is-being-investigated-for-securities-fraud-and-20241102.jpg
V,2024-10-29,2024-10-15,2024-11-12,V,,2024-11-02 12:00:00,2024-11-02T12:00:00-04:00,2024-11-02,SHAREHOLDER ALERT: Pomerantz Law Firm Investigates Claims On Behalf of Investors of Visa Inc. - V,"NEW YORK , Nov. 2, 2024 /PRNewswire/ -- Pomerantz LLP is investigating claims on behalf of investors of Visa Inc. (""Visa"" or the ""Company"") (NYSE: V).  Such investors are advised to contact Danielle Peyton at newaction@pomlaw.com or 646-581-9980, ext.",prnewswire.com,https://www.prnewswire.com/news-releases/shareholder-alert-pomerantz-law-firm-investigates-claims-on-behalf-of-investors-of-visa-inc---v-302293743.html,https://images.financialmodelingprep.com/news/shareholder-alert-pomerantz-law-firm-investigates-claims-on-behalf-of-investors-of-visa-20241102.jpg
V,2024-10-29,2024-10-15,2024-11-12,V,,2024-11-02 17:58:00,2024-11-02T17:58:00-04:00,2024-11-02,V INVESTOR NEWS: Visa Inc. Investors that Suffered Losses are Encouraged to Contact Rosen Law about Ongoing Investigation into the Company – V,"NEW YORK, Nov. 02, 2024 (GLOBE NEWSWIRE) -- Rosen Law Firm, a global investor rights law firm, continues to investigate Visa Inc. (NYSE: V) for potential violations of the federal securities laws.",globenewswire.com,https://www.globenewswire.com/news-release/2024/11/02/2973653/673/en/V-INVESTOR-NEWS-Visa-Inc-Investors-that-Suffered-Losses-are-Encouraged-to-Contact-Rosen-Law-about-Ongoing-Investigation-into-the-Company-V.html,https://images.financialmodelingprep.com/news/v-investor-news-visa-inc-investors-that-suffered-losses-20241102.jpg
V,2024-10-29,2024-10-15,2024-11-12,V,,2024-11-03 05:30:00,2024-11-03T05:30:00-05:00,2024-11-03,This Dow Dividend Growth Stock Just Delivered Record Results and Raised Its Dividend to An All-Time High. Here's Why It's a Screaming Buy in November.,"Visa continues to offer investors an attractive balance of growth, income, and value.",fool.com,https://www.fool.com/investing/2024/11/03/dow-dividend-growth-stock-record-results-buy-now/,https://images.financialmodelingprep.com/news/this-dow-dividend-growth-stock-just-delivered-record-results-20241103.jpg
V,2024-10-29,2024-10-15,2024-11-12,V,,2024-11-03 11:00:00,2024-11-03T11:00:00-05:00,2024-11-03,The Schall Law Firm Encourages Shareholder Participation In An Inquiry Into Visa Inc For Securities Law Violations,"LOS ANGELES, CA / ACCESSWIRE / November 3, 2024 / The Schall Law Firm, a national shareholder rights litigation firm, announces that it is investigating claims on behalf of investors of Visa Inc. (""Visa"" or ""the Company"") (NYSE:V) for violations of the securities laws. The investigation focuses on whether the Company issued false and/or misleading statements and/or failed to disclose information pertinent to investors.",accesswire.com,https://www.accesswire.com/938399/the-schall-law-firm-encourages-shareholder-participation-in-an-inquiry-into-visa-inc-for-securities-law-violations,https://images.financialmodelingprep.com/news/the-schall-law-firm-encourages-shareholder-participation-in-an-20241103.jpg
V,2024-10-29,2024-10-15,2024-11-12,V,,2024-11-03 12:40:41,2024-11-03T12:40:41-05:00,2024-11-03,Visa's Growth Unshaken By Regulatory Risks,"Visa achieved an 8% YoY increase in Q4 payments volume, driven by stable U.S. demand and strong international growth. Cross-border volume rose 13% YoY, with e-commerce fueling a 15% increase in card-not-present transactions, underscoring digital demand. Processed transactions grew 10% YoY, strengthening Visa's market dominance and aligning with its FY 2025 growth guidance.",seekingalpha.com,https://seekingalpha.com/article/4732595-visas-growth-unshaken-by-regulatory-risks,https://images.financialmodelingprep.com/news/visas-growth-unshaken-by-regulatory-risks-20241103.jpg
V,2024-10-29,2024-10-15,2024-11-12,V,,2024-11-04 10:06:19,2024-11-04T10:06:19-05:00,2024-11-04,Here is What to Know Beyond Why Visa Inc. (V) is a Trending Stock,"Visa (V) has received quite a bit of attention from Zacks.com users lately. Therefore, it is wise to be aware of the facts that can impact the stock's prospects.",zacks.com,https://www.zacks.com/stock/news/2363155/here-is-what-to-know-beyond-why-visa-inc-v-is-a-trending-stock?cid=CS-STOCKNEWSAPI-FT-tale_of_the_tape|most_searched_stocks-2363155,https://images.financialmodelingprep.com/news/here-is-what-to-know-beyond-why-visa-inc-20241104.jpg
V,2024-10-29,2024-10-15,2024-11-12,V,,2024-11-04 11:00:00,2024-11-04T11:00:00-05:00,2024-11-04,Visa Inc. Is Being Investigated For Securities Fraud And Investors With Losses Are Urged To Contact The Schall Law Firm,"LOS ANGELES, CA / ACCESSWIRE / November 4, 2024 / The Schall Law Firm, a national shareholder rights litigation firm, announces that it is investigating claims on behalf of investors of Visa Inc. (""Visa"" or ""the Company"") (NYSE:V) for violations of the securities laws. The investigation focuses on whether the Company issued false and/or misleading statements and/or failed to disclose information pertinent to investors.",accesswire.com,https://www.accesswire.com/938562/visa-inc-is-being-investigated-for-securities-fraud-and-investors-with-losses-are-urged-to-contact-the-schall-law-firm,https://images.financialmodelingprep.com/news/visa-inc-is-being-investigated-for-securities-fraud-and-20241104.jpg
V,2024-10-29,2024-10-15,2024-11-12,V,,2024-11-04 16:49:00,2024-11-04T16:49:00-05:00,2024-11-04,Visa Inc. Investors: Company Investigated by the Portnoy Law Firm,Investors can contact the law firm at no cost to learn more about recovering their losses,globenewswire.com,https://www.globenewswire.com/news-release/2024/11/04/2974510/0/en/Visa-Inc-Investors-Company-Investigated-by-the-Portnoy-Law-Firm.html,https://images.financialmodelingprep.com/news/visa-inc-investors-company-investigated-by-the-portnoy-law-20241104.jpg
V,2024-10-29,2024-10-15,2024-11-12,V,,2024-11-05 17:11:00,2024-11-05T17:11:00-05:00,2024-11-05,V INVESTOR NEWS: Visa Inc. Investors that Suffered Losses are Encouraged to Contact Rosen Law about Ongoing Investigation into the Company – V,"NEW YORK, Nov. 05, 2024 (GLOBE NEWSWIRE) -- Rosen Law Firm, a global investor rights law firm, continues to investigate Visa Inc. (NYSE: V) for potential violations of the federal securities laws.",globenewswire.com,https://www.globenewswire.com/news-release/2024/11/05/2975292/673/en/V-INVESTOR-NEWS-Visa-Inc-Investors-that-Suffered-Losses-are-Encouraged-to-Contact-Rosen-Law-about-Ongoing-Investigation-into-the-Company-V.html,https://images.financialmodelingprep.com/news/v-investor-news-visa-inc-investors-that-suffered-losses-20241105.jpg
V,2024-10-29,2024-10-15,2024-11-12,V,,2024-11-06 11:21:38,2024-11-06T11:21:38-05:00,2024-11-06,"Why Bank of America, Visa, and Capital One Are Ripping After a Trump Victory",Bank stocks soared after Donald Trump won the U.S. presidential election on expectations of an easier regulatory backdrop.,fool.com,https://www.fool.com/investing/2024/11/06/why-bank-of-america-visa-and-capital-one-are-rippi/,https://images.financialmodelingprep.com/news/why-bank-of-america-visa-and-capital-one-are-20241106.jpg
V,2024-10-29,2024-10-15,2024-11-12,V,,2024-11-06 12:24:20,2024-11-06T12:24:20-05:00,2024-11-06,"Exclusive: EU regulators investigate if Visa, Mastercard fees harm retailers, document shows","EU antitrust regulators are investigating whether the fees charged by Visa and Mastercard have a negative impact on retailers, an EU document seen by Reuters showed.",reuters.com,https://www.reuters.com/business/retail-consumer/eu-regulators-investigate-if-visa-mastercard-fees-harm-retailers-document-shows-2024-11-06/,https://images.financialmodelingprep.com/news/exclusive-eu-regulators-investigate-if-visa-mastercard-fees-harm-20241106.jpg
V,2024-10-29,2024-10-15,2024-11-12,V,,2024-11-06 16:10:29,2024-11-06T16:10:29-05:00,2024-11-06,Report: EU Investigating Visa and Mastercard for Potentially Harmful Fees,"The European Commission has reportedly launched a probe into whether Mastercard and Visa's fees are hurting merchants. The commission sent out questionnaires to retailers and payment service providers about both Visa and Mastercard in September, giving them until October to respond, Reuters reported Wednesday (Nov. 6), citing an EU document it had seen.",pymnts.com,https://www.pymnts.com/antitrust/2024/report-eu-investigating-visa-and-mastercard-for-potentially-harmful-fees/,https://images.financialmodelingprep.com/news/report-eu-investigating-visa-and-mastercard-for-potentially-harmful-20241106.jpg
V,2024-10-29,2024-10-15,2024-11-12,V,,2024-11-06 16:15:00,2024-11-06T16:15:00-05:00,2024-11-06,SHAREHOLDER ALERT: Pomerantz Law Firm Investigates Claims On Behalf of Investors of Visa Inc. - V,"NEW YORK, NY / ACCESSWIRE / November 6, 2024 / Pomerantz LLP is investigating claims on behalf of investors of Visa Inc. (""Visa"" or the ""Company"") (NYSE:V). Such investors are advised to contact Danielle Peyton at newaction@pomlaw.com or 646-581-9980, ext.",accesswire.com,https://www.accesswire.com/939810/shareholder-alert-pomerantz-law-firm-investigates-claims--on-behalf-of-investors-of-visa-inc--v,https://images.financialmodelingprep.com/news/shareholder-alert-pomerantz-law-firm-investigates-claims-on-behalf-of-investors-of-visa-20241106.jpg
V,2024-10-29,2024-10-15,2024-11-12,V,,2024-11-06 23:03:07,2024-11-06T23:03:07-05:00,2024-11-06,17 Upcoming Dividend Increases,"This week, 17 companies with an average dividend increase of 8.3% are highlighted, emphasizing consistent dividend growth and outperforming benchmarks. My investment strategy focuses on buying, holding, and adding companies with consistent dividend increases and superior performance compared to benchmarks. The list is created using data from the ""U.S. Dividend Champions"" spreadsheet and NASDAQ, featuring companies with at least five years of dividend growth.",seekingalpha.com,https://seekingalpha.com/article/4734078-17-upcoming-dividend-increases,https://images.financialmodelingprep.com/news/17-upcoming-dividend-increases-20241106.jpg
V,2024-10-29,2024-10-15,2024-11-12,V,,2024-11-07 09:30:00,2024-11-07T09:30:00-05:00,2024-11-07,2 Top Dividend-Growth Finance Stocks to Buy in November,"If you are looking to benefit from a growing income stream, then you'll want to get to know Visa and Rexford as November gets underway.",fool.com,https://www.fool.com/investing/2024/11/07/2-top-dividend-growth-finance-stocks-to-buy-in-nov/,https://images.financialmodelingprep.com/news/2-top-dividendgrowth-finance-stocks-to-buy-in-november-20241107.jpg
V,2024-10-29,2024-10-15,2024-11-12,V,,2024-11-07 17:50:15,2024-11-07T17:50:15-05:00,2024-11-07,Dividend Watch: Three Companies Boosting Quarterly Payouts,"Earnings season continues to move at a rapid pace, with many companies reporting daily. And recently, these three companies delivered news of higher dividend payouts.",zacks.com,https://www.zacks.com/commentary/2366798/dividend-watch-three-companies-boosting-quarterly-payouts?cid=CS-STOCKNEWSAPI-FT-investment_ideas-2366798,https://images.financialmodelingprep.com/news/dividend-watch-three-companies-boosting-quarterly-payouts-20241107.jpg
V,2024-10-29,2024-10-15,2024-11-12,V,,2024-11-08 06:30:00,2024-11-08T06:30:00-05:00,2024-11-08,2 Monster Warren Buffett Stocks to Hold for the Next 100 Years,You can buy and hold these two Buffett stocks for a lifetime.,fool.com,https://www.fool.com/investing/2024/11/08/monster-warren-buffett-stocks-visa-mastercard/,https://images.financialmodelingprep.com/news/2-monster-warren-buffett-stocks-to-hold-for-the-20241108.jpg
V,2024-10-29,2024-10-15,2024-11-12,V,,2024-11-08 10:36:21,2024-11-08T10:36:21-05:00,2024-11-08,Is Visa (V) a Buy as Wall Street Analysts Look Optimistic?,"The recommendations of Wall Street analysts are often relied on by investors when deciding whether to buy, sell, or hold a stock. Media reports about these brokerage-firm-employed (or sell-side) analysts changing their ratings often affect a stock's price.",zacks.com,https://www.zacks.com/stock/news/2367390/is-visa-v-a-buy-as-wall-street-analysts-look-optimistic?cid=CS-STOCKNEWSAPI-FT-fundamental_analysis|average_broker_rating-2367390,https://images.financialmodelingprep.com/news/is-visa-v-a-buy-as-wall-street-analysts-20241108.jpg
V,2024-10-29,2024-10-15,2024-11-12,V,,2024-11-08 11:25:36,2024-11-08T11:25:36-05:00,2024-11-08,"After Visa's Q4 Triumph, Should Investors Buy the Stock?","Despite the concerns of spending being affected by factors like inflation, interest rates, and overall tightening macroeconomic backdrop, V's numbers continue to grow.",zacks.com,https://www.zacks.com/stock/news/2367552/after-visa-s-q4-triumph-should-investors-buy-the-stock?cid=CS-STOCKNEWSAPI-FT-analyst_blog|most_popular_stocks-2367552,https://images.financialmodelingprep.com/news/after-visas-q4-triumph-should-investors-buy-the-stock-20241108.jpg
V,2024-10-29,2024-10-15,2024-11-12,V,,2024-11-08 12:00:00,2024-11-08T12:00:00-05:00,2024-11-08,SHAREHOLDER ALERT: Pomerantz Law Firm Investigates Claims On Behalf of Investors of Visa Inc. - V,"NEW YORK, NY / ACCESSWIRE / November 8, 2024 / Pomerantz LLP is investigating claims on behalf of investors of Visa Inc. (""Visa"" or the ""Company"") (NYSE:V). Such investors are advised to contact Danielle Peyton at newaction@pomlaw.com or 646-581-9980, ext.",accesswire.com,https://www.accesswire.com/940274/shareholder-alert-pomerantz-law-firm-investigates-claims-on-behalf-of-investors-of-visa-inc--v,https://images.financialmodelingprep.com/news/shareholder-alert-pomerantz-law-firm-investigates-claims-on-behalf-of-investors-of-visa-20241108.jpg
V,2024-10-29,2024-10-15,2024-11-12,V,,2024-11-08 18:25:00,2024-11-08T18:25:00-05:00,2024-11-08,V BREAKING NEWS: Visa Inc. Investors that Suffered Losses are Encouraged to Contact Rosen Law about Ongoing Investigation into the Company – V,"NEW YORK, Nov. 08, 2024 (GLOBE NEWSWIRE) -- Rosen Law Firm, a global investor rights law firm, continues to investigate Visa Inc. (NYSE: V) for potential violations of the federal securities laws.",globenewswire.com,https://www.globenewswire.com/news-release/2024/11/08/2977923/673/en/V-BREAKING-NEWS-Visa-Inc-Investors-that-Suffered-Losses-are-Encouraged-to-Contact-Rosen-Law-about-Ongoing-Investigation-into-the-Company-V.html,https://images.financialmodelingprep.com/news/v-breaking-news-visa-inc-investors-that-suffered-losses-20241108.jpg
V,2024-10-29,2024-10-15,2024-11-12,V,,2024-11-09 03:24:00,2024-11-09T03:24:00-05:00,2024-11-09,Want Decades of Passive Income? Buy This Warren Buffett Stock and Hold On,"Warren Buffett owns a number of dividend stocks, but I see one in particular as a great choice for long-term investors right now.",fool.com,https://www.fool.com/investing/2024/11/09/want-decades-of-passive-income-buy-this-warren-buf/,https://images.financialmodelingprep.com/news/want-decades-of-passive-income-buy-this-warren-buffett-20241109.jpg
V,2024-10-29,2024-10-15,2024-11-12,V,,2024-11-09 07:45:00,2024-11-09T07:45:00-05:00,2024-11-09,2 Warren Buffett Stocks to Buy Hand Over Fist in November,"Warren Buffett may be the top investor ever, which is why you should monitor his portfolio.",fool.com,https://www.fool.com/investing/2024/11/09/2-warren-buffett-stocks-to-buy-hand-over-fist-in-n/,https://images.financialmodelingprep.com/news/2-warren-buffett-stocks-to-buy-hand-over-fist-20241109.jpg
V,2024-10-29,2024-10-15,2024-11-12,V,,2024-11-09 11:07:04,2024-11-09T11:07:04-05:00,2024-11-09,"Visa: Current Upside Is Limited, But A Strong Idea Long-Term",The company's fair value by the historical method is 29x earnings. The current price upside based on technical analysis does not exceed 5.5%. Visa has significant levels of net margin of 55% and return on equity of 50%.,seekingalpha.com,https://seekingalpha.com/article/4735506-visa-stock-current-upside-limited-but-strong-idea-long-term,https://images.financialmodelingprep.com/news/visa-current-upside-is-limited-but-a-strong-idea-20241109.jpg
V,2024-10-29,2024-10-15,2024-11-12,V,,2024-11-10 11:00:00,2024-11-10T11:00:00-05:00,2024-11-10,SHAREHOLDER ALERT: Pomerantz Law Firm Investigates Claims On Behalf of Investors of Visa Inc. - V,"NEW YORK , Nov. 10, 2024 /PRNewswire/ -- Pomerantz LLP is investigating claims on behalf of investors of Visa Inc. (""Visa"" or the ""Company"") (NYSE: V). Such investors are advised to contact Danielle Peyton at newaction@pomlaw.com or 646-581-9980, ext.",prnewswire.com,https://www.prnewswire.com/news-releases/shareholder-alert-pomerantz-law-firm-investigates-claims-on-behalf-of-investors-of-visa-inc---v-302300257.html,https://images.financialmodelingprep.com/news/shareholder-alert-pomerantz-law-firm-investigates-claims-on-behalf-of-investors-of-visa-20241110.jpg
