ticker,event_date,window_start,window_end,symbol,symbols,publishedDate,publishedDateET,date_et,title,text,site,url,image
MSFT,2023-07-25,2023-07-18,2023-08-08,MSFT,,2023-07-24 16:06:03,2023-07-24T16:06:03-04:00,2023-07-24,Will Cloud Computing Results Aid Big Tech Earnings?,"Cloud computing has become a major focus in the market over the last several years, with the technology allowing companies and consumers to achieve digital feats that otherwise felt impossible.",zacks.com,https://www.zacks.com/commentary/2126412/will-cloud-computing-results-aid-big-tech-earnings,https://images.financialmodelingprep.com/news/will-cloud-computing-results-aid-big-tech-earnings-20230724.jpg
MSFT,2023-07-25,2023-07-18,2023-08-08,MSFT,,2023-07-24 16:31:35,2023-07-24T16:31:35-04:00,2023-07-24,Microsoft's Bing Chat comes to Chrome and Safari in tests for ‘select users',"Microsoft's AI chatbot, Bing Chat, is coming to non-Microsoft browsers the company today confirmed following various reports of the AI chatbot being spotted in other browsers like Google Chrome and Apple's Safari.",techcrunch.com,https://techcrunch.com/2023/07/24/microsofts-bing-chat-comes-to-chrome-and-safari-in-tests-for-select-users/,https://images.financialmodelingprep.com/news/microsofts-bing-chat-comes-to-chrome-and-safari-in-20230724.jpg
MSFT,2023-07-25,2023-07-18,2023-08-08,MSFT,,2023-07-24 17:39:57,2023-07-24T17:39:57-04:00,2023-07-24,Stock Market Starts Huge Week With Gains As Dow Extends Win Streak To 11 Sessions; This Is How Much Microsoft Lost In Nasdaq 100 Rebalance,"The stock market started the week with gains. The Nasdaq 100 rebalance cut the weighting of Microsoft, Nvidia and others.",investors.com,https://www.investors.com/market-trend/the-big-picture/stocks-market-starts-huge-week-with-gains-as-dow-extends-win-streak-to-11-sessions-this-is-how-much-microsoft-lost-in-nasdaq-100-rebalance/,https://images.financialmodelingprep.com/news/stock-market-starts-huge-week-with-gains-as-dow-20230724.jpg
MSFT,2023-07-25,2023-07-18,2023-08-08,MSFT,,2023-07-24 19:45:08,2023-07-24T19:45:08-04:00,2023-07-24,7 Smart Stocks to Buy if You Believe the Inflation Battle Is Far From Over,"Inflation resistant stocks might seem an idea destined for gradual irrelevance based on economic reports from the past few weeks. First up, the headline print of the June jobs report came in lower than expected, representing a rather sharp pivot from prior labor market data.",investorplace.com,https://investorplace.com/2023/07/7-smart-stocks-to-buy-if-you-believe-the-inflation-battle-is-far-from-over/,https://images.financialmodelingprep.com/news/7-smart-stocks-to-buy-if-you-believe-the-20230724.jpg
MSFT,2023-07-25,2023-07-18,2023-08-08,MSFT,,2023-07-24 19:51:03,2023-07-24T19:51:03-04:00,2023-07-24,"Dow Up 10 Straight Sessions; NXPI Beats, WHR Mixed","NXP Semi topped estimates on both top and bottom lines, while Whirlpool beat easily on earnings but missed on revenues.",zacks.com,https://www.zacks.com/stock/news/2126557/dow-up-10-straight-sessions-nxpi-beats-whr-mixed,https://images.financialmodelingprep.com/news/dow-up-10-straight-sessions-nxpi-beats-whr-mixed-20230724.jpg
MSFT,2023-07-25,2023-07-18,2023-08-08,MSFT,,2023-07-24 22:35:19,2023-07-24T22:35:19-04:00,2023-07-24,"The problem with X? Meta, Microsoft, hundreds more own trademarks to new Twitter name",Billionaire Elon Musk's decision to rebrand Twitter as X could be complicated legally: companies including Meta and Microsoft already have intellectual property rights to the same letter.,reuters.com,https://www.reuters.com/technology/problem-with-x-meta-microsoft-hundreds-more-own-trademarks-new-twitter-name-2023-07-25/,https://images.financialmodelingprep.com/news/the-problem-with-x-meta-microsoft-hundreds-more-own-20230724.jpg
MSFT,2023-07-25,2023-07-18,2023-08-08,MSFT,,2023-07-25 02:00:00,2023-07-25T02:00:00-04:00,2023-07-25,It's Microsoft Earnings Day. Watch AI and the Cloud.,"Shares of the software giant are up 44% so far this year, recently setting a record high.",barrons.com,https://www.barrons.com/articles/microsoft-earnings-stock-price-231e11a9,https://images.financialmodelingprep.com/news/its-microsoft-earnings-day-watch-ai-and-the-cloud-20230725.jpg
MSFT,2023-07-25,2023-07-18,2023-08-08,MSFT,,2023-07-25 03:53:02,2023-07-25T03:53:02-04:00,2023-07-25,"If You Can Only Buy One Metaverse Stock, It Better Be One of These 3 Names",Analysts from Bloomberg Intelligence project that the metaverse might achieve an $800 billion valuation by 2024. This prospect attracts investors seeking prime metaverse stocks.,investorplace.com,https://investorplace.com/2023/07/best-metaverse-stocks-to-buy-in-2023/,https://images.financialmodelingprep.com/news/if-you-can-only-buy-one-metaverse-stock-it-better-20230725.png
MSFT,2023-07-25,2023-07-18,2023-08-08,MSFT,,2023-07-25 05:10:00,2023-07-25T05:10:00-04:00,2023-07-25,3 Smart Reasons to Buy Microsoft Stock Right Now,"A game-changing partnership placed Microsoft at the vanguard of the artificial intelligence revolution. Leaders matter in the tech world, and Microsoft has some of the best in the business.",fool.com,https://www.fool.com/investing/2023/07/25/3-smart-reasons-to-buy-microsoft-stock-right-now/,https://images.financialmodelingprep.com/news/3-smart-reasons-to-buy-microsoft-stock-right-now-20230725.jpeg
MSFT,2023-07-25,2023-07-18,2023-08-08,MSFT,,2023-07-25 06:57:47,2023-07-25T06:57:47-04:00,2023-07-25,"Steve Ballmer's $120 billion fortune makes him richer than Warren Buffett, Mark Zuckerberg, and Google's cofounders. The former Microsoft CEO can thank AI hype and a contract quirk.","Steve Ballmer is richer than Warren Buffett, Mark Zuckerberg, Larry Page, and Sergey Brin. The former Microsoft CEO is worth $120 billion, thanks to his estimated 4% stake in the company.",markets.businessinsider.com,https://markets.businessinsider.com/news/stocks/ballmer-microsoft-net-worth-buffett-zuckerberg-brin-page-google-billionaires-2023-7,https://images.financialmodelingprep.com/news/steve-ballmers-120-billion-fortune-makes-him-richer-than-warren-20230725.jpg
MSFT,2023-07-25,2023-07-18,2023-08-08,MSFT,,2023-07-25 07:00:00,2023-07-25T07:00:00-04:00,2023-07-25,"MediaKind Launches MK/IO, The New Home for Users of Microsoft Azure Media Services","FRISCO, Texas--(BUSINESS WIRE)--Offering a seamless migration for Azure Media Services customers, MediaKind's MK/IO video streaming platform is available in the Azure Marketplace.",businesswire.com,https://www.businesswire.com/news/home/20230724984386/en/MediaKind-Launches-MKIO-The-New-Home-for-Users-of-Microsoft-Azure-Media-Services/,https://images.financialmodelingprep.com/news/mediakind-launches-mkio-the-new-home-for-users-of-microsoft-20230725.jpg
MSFT,2023-07-25,2023-07-18,2023-08-08,MSFT,,2023-07-25 08:21:00,2023-07-25T08:21:00-04:00,2023-07-25,"Microsoft earnings: What to expect as Azure, AI come into focus","As Microsoft Corp. gears up to report earnings in the present, it's becoming ever harder for Wall Street not to get swept up by the future.",marketwatch.com,https://www.marketwatch.com/story/microsoft-earnings-what-to-expect-as-azure-ai-come-into-focus-e9408cdf,https://images.financialmodelingprep.com/news/microsoft-earnings-what-to-expect-as-azure-ai-come-20230725.jpg
MSFT,2023-07-25,2023-07-18,2023-08-08,MSFT,,2023-07-25 08:45:00,2023-07-25T08:45:00-04:00,2023-07-25,Hitachi Vantara Announces Integrated Solution With Microsoft Azure That Transforms Hybrid Cloud Management,"New collaboration reflects companies' shared commitment to addressing customers' data complexity and infrastructure modernization challenges  SANTA CLARA, Calif. , July 25, 2023 /PRNewswire/ --  Hitachi Vantara , the modern infrastructure, data management and digital solutions subsidiary of Hitachi, Ltd.",prnewswire.com,https://www.prnewswire.com/news-releases/hitachi-vantara-announces-integrated-solution-with-microsoft-azure-that-transforms-hybrid-cloud-management-301884472.html,https://images.financialmodelingprep.com/news/hitachi-vantara-announces-integrated-solution-with-microsoft-azure-that-20230725.jpg
MSFT,2023-07-25,2023-07-18,2023-08-08,MSFT,,2023-07-25 08:48:00,2023-07-25T08:48:00-04:00,2023-07-25,Dow strives for 12th day of gains as Microsoft and Alphabet earnings loom,U.S. stock index futures were slightly higher early Tuesday as the second quarter earnings reporting season picked up pace and traders looked ahead to the Federal Reserve's interest rate decision on Wednesday.,marketwatch.com,https://www.marketwatch.com/story/dow-strives-for-12th-day-of-gains-as-microsoft-and-alphabet-earnings-loom-4ec4b9df,https://images.financialmodelingprep.com/news/dow-strives-for-12th-day-of-gains-as-microsoft-20230725.jpg
MSFT,2023-07-25,2023-07-18,2023-08-08,MSFT,,2023-07-25 09:00:00,2023-07-25T09:00:00-04:00,2023-07-25,"Microsoft Executive Shawn Bice to Discuss the Intersection of AI, Cloud, and Cybersecurity at Cloud Security Alliance's SECtember 2023","SEATTLE--(BUSINESS WIRE)-- #AI--Shawn Bice to keynote SECtember, discussing the widespread integration of Generative AI within cloud security solutions and what the future may hold.",businesswire.com,https://www.businesswire.com/news/home/20230725019107/en/Microsoft-Executive-Shawn-Bice-to-Discuss-the-Intersection-of-AI-Cloud-and-Cybersecurity-at-Cloud-Security-Alliance%E2%80%99s-SECtember-2023/,https://images.financialmodelingprep.com/news/microsoft-executive-shawn-bice-to-discuss-the-intersection-of-20230725.jpg
MSFT,2023-07-25,2023-07-18,2023-08-08,MSFT,,2023-07-25 09:02:36,2023-07-25T09:02:36-04:00,2023-07-25,Top 3 DJIA component returns in 2023,"When central banks raise interest rates, bond prices fall because yields rise. As such, bonds become an attractive investment, while investing in the stock market bears more risk.",invezz.com,https://invezz.com/news/2023/07/25/top-3-djia-component-returns-in-2023/?utm_source=snapi,https://images.financialmodelingprep.com/news/top-3-djia-component-returns-in-2023-20230725.jpg
MSFT,2023-07-25,2023-07-18,2023-08-08,MSFT,,2023-07-25 10:37:42,2023-07-25T10:37:42-04:00,2023-07-25,"7 Top AI Companies Including Microsoft, Amazon, and Alphabet Signed a Safety Pact: Here's What It Means",Seven of America's top developers of AI convened at the White House last Friday. They voluntarily signed an agreement that sets out a series of AI safety guidelines.,fool.com,https://www.fool.com/investing/2023/07/25/7-ai-companies-microsoft-amazon-alphabet-safety/,https://images.financialmodelingprep.com/news/7-top-ai-companies-including-microsoft-amazon-and-alphabet-20230725.jpg
MSFT,2023-07-25,2023-07-18,2023-08-08,MSFT,,2023-07-25 11:39:47,2023-07-25T11:39:47-04:00,2023-07-25,OpenAI rolls out ChatGPT app for Android,"OpenAI, the buzzy AI startup backed by Microsoft, debuted the Android version of its ChatGPT app on Tuesday.",cnbc.com,https://www.cnbc.com/2023/07/25/chatgpt-app-for-android-release.html,https://images.financialmodelingprep.com/news/openai-rolls-out-chatgpt-app-for-android-20230725.jpeg
MSFT,2023-07-25,2023-07-18,2023-08-08,MSFT,,2023-07-25 12:00:01,2023-07-25T12:00:01-04:00,2023-07-25,Microsoft set to report earnings after the close,Microsoft is trying to capitalize on demand for artificial intelligence services while also cutting costs,cnbc.com,https://www.cnbc.com/2023/07/25/microsoft-msft-q4-earnings-report-2023.html,https://images.financialmodelingprep.com/news/microsoft-set-to-report-earnings-after-the-close-20230725.jpg
MSFT,2023-07-25,2023-07-18,2023-08-08,MSFT,,2023-07-25 12:39:51,2023-07-25T12:39:51-04:00,2023-07-25,Generative AI Views Of MIT Prof And Goldman CIO Bode Well For Microsoft,An MIT professor and Goldman's CIO told me GAI has a bright future. It could add $14 billion a year to Microsoft's revenue,forbes.com,https://www.forbes.com/sites/petercohan/2023/07/25/generative-ai-views-of-mit-prof-and-goldman-cio-bode-well-for-microsoft/,https://images.financialmodelingprep.com/news/generative-ai-views-of-mit-prof-and-goldman-cio-bode-20230725.jpg
MSFT,2023-07-25,2023-07-18,2023-08-08,MSFT,,2023-07-25 13:34:02,2023-07-25T13:34:02-04:00,2023-07-25,3 AI Stocks Still Worth Buying for the Long Haul,"Artificial intelligence ( AI ) adoption has the potential to boost productivity growth significantly, according to Goldman Sachs (NYSE: GS ). These three rapidly growing AI stocks offer immense potential, with their current stock prices yet to fully reflect it.",investorplace.com,https://investorplace.com/2023/07/3-ai-stocks-still-worth-buying-for-the-long-haul/,https://images.financialmodelingprep.com/news/3-ai-stocks-still-worth-buying-for-the-long-20230725.jpg
MSFT,2023-07-25,2023-07-18,2023-08-08,MSFT,,2023-07-25 14:15:31,2023-07-25T14:15:31-04:00,2023-07-25,3 Stocks You Better Be Buying on Each and Every Dip,"In the long term, stocks with wide economic moats deliver higher returns due to their competitive advantages. They can protect their market position and profits to achieve higher returns.",investorplace.com,https://investorplace.com/2023/07/3-stocks-you-better-be-buying-on-each-and-every-dip/,https://images.financialmodelingprep.com/news/3-stocks-you-better-be-buying-on-each-and-20230725.png
MSFT,2023-07-25,2023-07-18,2023-08-08,MSFT,,2023-07-25 15:15:11,2023-07-25T15:15:11-04:00,2023-07-25,Trading Strategies For Microsoft Stock Before And After Q4 Earnings - Microsoft (NASDAQ:MSFT),Microsoft Corporation MSFT is set to print its fourth-quarter 2023 financial results after the market closes on Tuesday. The stock was rising almost 2% heading into the event.,benzinga.com,https://www.benzinga.com/trading-ideas/long-ideas/23/07/33376184/trading-strategies-for-microsoft-stock-before-and-after-q4-earnings?utm_source=snapi,https://images.financialmodelingprep.com/news/trading-strategies-for-microsoft-stock-before-and-after-q4-20230725.jpg
MSFT,2023-07-25,2023-07-18,2023-08-08,MSFT,,2023-07-25 16:05:42,2023-07-25T16:05:42-04:00,2023-07-25,Microsoft Earnings: AI Lifts Redmond To Highest Quarterly Sales Ever,Microsoft's market valuation has swelled by $820 billion this year as its share price soared to its highest level ever thanks in large part to mass AI hysteria.,forbes.com,https://www.forbes.com/sites/dereksaul/2023/07/25/microsoft-earnings-ai-lifts-redmond-to-highest-quarterly-sales-ever/,https://images.financialmodelingprep.com/news/microsoft-earnings-ai-lifts-redmond-to-highest-quarterly-sales-20230725.jpg
MSFT,2023-07-25,2023-07-18,2023-08-08,MSFT,,2023-07-25 16:06:00,2023-07-25T16:06:00-04:00,2023-07-25,Microsoft earnings press release available on Investor Relations website,"REDMOND, Wash. , July 25, 2023 /PRNewswire/ -- Microsoft Corp. on Tuesday announced that fiscal year 2023 fourth quarter financial results are available on its Investor Relations website.",prnewswire.com,https://www.prnewswire.com/news-releases/microsoft-earnings-press-release-available-on-investor-relations-website-301885616.html,https://images.financialmodelingprep.com/news/microsoft-earnings-press-release-available-on-investor-relations-website-20230725.jpg
MSFT,2023-07-25,2023-07-18,2023-08-08,MSFT,,2023-07-25 16:12:46,2023-07-25T16:12:46-04:00,2023-07-25,"Microsoft, Google and Snap set to report earnings","Microsoft, Google and Snap set to report earnings",cnn.com,https://www.cnn.com/tech/live-news/big-tech-earnings/index.html,https://images.financialmodelingprep.com/news/microsoft-google-and-snap-set-to-report-earnings-20230725.jpg
MSFT,2023-07-25,2023-07-18,2023-08-08,MSFT,,2023-07-25 16:13:00,2023-07-25T16:13:00-04:00,2023-07-25,"Microsoft earnings top estimates, but stock falls as investors await forecast","Microsoft Corp. easily topped profit and revenue expectations for its latest quarter, though its shares were moving lower in after-hours trading.",marketwatch.com,https://www.marketwatch.com/story/microsoft-earnings-top-estimates-but-stock-falls-as-investors-await-forecast-b17f205f,https://images.financialmodelingprep.com/news/microsoft-earnings-top-estimates-but-stock-falls-as-investors-20230725.jpg
MSFT,2023-07-25,2023-07-18,2023-08-08,MSFT,,2023-07-25 16:32:54,2023-07-25T16:32:54-04:00,2023-07-25,Microsoft reports 4Q earnings beat but Azure cloud growth declines,"Microsoft posted a fiscal fourth-quarter 2023 earnings beat but its stock fell on a modest decline in the growth of its cloud platform Azure from the previous quarter.  For 4Q, which ended June 30, 2023, the company reported a 21% jump in diluted earnings per share (EPS) to $2.69.",proactiveinvestors.com,https://www.proactiveinvestors.com/companies/news/1021698?SNAPI,https://images.financialmodelingprep.com/news/microsoft-reports-4q-earnings-beat-but-azure-cloud-growth-20230725.jpg
MSFT,2023-07-25,2023-07-18,2023-08-08,MSFT,,2023-07-25 16:58:40,2023-07-25T16:58:40-04:00,2023-07-25,Microsoft reports $20.1B quarterly profit as it promises to lead 'the new AI platform shift',"Microsoft on Tuesday reported fiscal fourth-quarter profit of $20.1 billion, or $2.69 per share, beating analyst expectations for $2.55 per share.",techxplore.com,https://techxplore.com/news/2023-07-microsoft-201b-quarterly-profit-ai.html,https://images.financialmodelingprep.com/news/microsoft-reports-201b-quarterly-profit-as-it-promises-to-20230725.jpg
MSFT,2023-07-25,2023-07-18,2023-08-08,MSFT,,2023-07-25 17:10:37,2023-07-25T17:10:37-04:00,2023-07-25,"Microsoft Cloud Business Boosts Results, But Shares Still Sink",Software giant Microsoft beat expectations for its fiscal fourth quarter thanks to continued growth in its cloud computing businesses.,investors.com,https://www.investors.com/news/technology/msft-stock-microsoft-cloud-business-boosts-q4-results/,https://images.financialmodelingprep.com/news/microsoft-cloud-business-boosts-results-but-shares-still-sink-20230725.jpg
MSFT,2023-07-25,2023-07-18,2023-08-08,MSFT,,2023-07-25 18:09:42,2023-07-25T18:09:42-04:00,2023-07-25,Microsoft's big bet on AI is paying off,"The tech giant reported more than $20 billion in quarterly profit as CEO Satya Nadella said it is focused on “leading the new AI platform shift.” REDMOND, Wash.",fastcompany.com,https://www.fastcompany.com/90928584/microsoft-earnings-big-bet-ai-paying-off,https://images.financialmodelingprep.com/news/microsofts-big-bet-on-ai-is-paying-off-20230725.gif
MSFT,2023-07-25,2023-07-18,2023-08-08,MSFT,,2023-07-25 18:34:15,2023-07-25T18:34:15-04:00,2023-07-25,Microsoft Q4 results: ‘they're at top of the mountain to monetise AI',"Microsoft Corp (NASDAQ: MSFT) inched down in after-hours on Tuesday even though it reported market-beating results for its fourth financial quarter. Azure continues to slow down Investors seem unhappy with Azure, though, which came in down sequentially.",invezz.com,https://invezz.com/news/2023/07/25/microsoft-q4-earnings-wedbush-dan-ives-outlook/?utm_source=snapi,https://images.financialmodelingprep.com/news/microsoft-q4-results-theyre-at-top-of-the-mountain-20230725.jpg
MSFT,2023-07-25,2023-07-18,2023-08-08,MSFT,,2023-07-25 18:40:52,2023-07-25T18:40:52-04:00,2023-07-25,Lean on Active ETFs in Earnings Week Bonanza,"Earnings season has shifted into gear with Microsoft (MSFT) and Alphabet (GOOGL) dropping earnings news Tuesday. With other big names including Amazon (AMZN) also arriving this week, active ETFs in earnings week could be a potent option.",etftrends.com,https://www.etftrends.com/active-etfs-channel/lean-on-active-etfs-in-earnings-week-bonanza/,https://images.financialmodelingprep.com/news/lean-on-active-etfs-in-earnings-week-bonanza-20230725.jpg
MSFT,2023-07-25,2023-07-18,2023-08-08,MSFT,,2023-07-25 18:40:56,2023-07-25T18:40:56-04:00,2023-07-25,"Where to Get Exposure to Alphabet, Microsoft Before Earnings Reports","Investors may be wondering which ETFs offer the most exposure to the handful of names that are reporting earnings after the bell on Tuesday. Key earnings reports being released after market close today include Alphabet (GOOG), Microsoft (MSFT), Visa (V), and Snap (SNAP).",etftrends.com,https://www.etftrends.com/innovative-etfs-channel/where-get-exposure-alphabet-microsoft-before-earnings-reports/,https://images.financialmodelingprep.com/news/where-to-get-exposure-to-alphabet-microsoft-before-earnings-20230725.jpg
MSFT,2023-07-25,2023-07-18,2023-08-08,MSFT,,2023-07-25 18:41:48,2023-07-25T18:41:48-04:00,2023-07-25,Microsoft shares fall after earnings report even as AI bet bears fruit,Company's $56.2bn revenue beat Wall Street expectations but slowing growth for cloud service Azure proved to be a dampener,theguardian.com,https://www.theguardian.com/technology/2023/jul/25/microsoft-q2-2023-earnings-report-share-drop,https://images.financialmodelingprep.com/news/microsoft-shares-fall-after-earnings-report-even-as-ai-20230725.jpg
MSFT,2023-07-25,2023-07-18,2023-08-08,MSFT,,2023-07-25 18:42:05,2023-07-25T18:42:05-04:00,2023-07-25,"If You Can Only Buy 1 Long-Term Stock, It Better Be One of These Names",The best long-term stocks are the kind of investment you can buy and forget about almost immediately. The stock market is filled with chatter about how different events might impact long-term prospects.,investorplace.com,https://investorplace.com/2023/07/if-you-can-only-buy-1-long-term-stock-it-better-be-one-of-these-names/,https://images.financialmodelingprep.com/news/if-you-can-only-buy-1-longterm-stock-it-20230725.jpg
MSFT,2023-07-25,2023-07-18,2023-08-08,MSFT,,2023-07-25 19:05:00,2023-07-25T19:05:00-04:00,2023-07-25,LinkedIn sheds nearly 200 in Bay Area job cuts: report,"Microsoft Corp.'s MSFT, +1.70% LinkedIn has laid off nearly 200 workers in the San Francisco Bay Area, according to a published report Tuesday in the San Jose Mercury News. The social-media business site had imposed belt-tightening measures in recent months, including a significant reduction in business travel.",marketwatch.com,https://www.marketwatch.com/story/linkedin-sheds-nearly-200-in-bay-area-job-cuts-report-f66d2ab7,https://images.financialmodelingprep.com/news/linkedin-sheds-nearly-200-in-bay-area-job-cuts-20230725.jpeg
MSFT,2023-07-25,2023-07-18,2023-08-08,MSFT,,2023-07-25 19:08:29,2023-07-25T19:08:29-04:00,2023-07-25,"Cavalcade of Earnings: MSFT, GOOGL, SNAP & More","While Alphabet is trading +6% on its earnings news, Snap is down big: -18% as of this hour.",zacks.com,https://www.zacks.com/stock/news/2127337/cavalcade-of-earnings-msft-googl-snap-more,https://images.financialmodelingprep.com/news/cavalcade-of-earnings-msft-googl-snap-more-20230725.jpg
MSFT,2023-07-25,2023-07-18,2023-08-08,MSFT,,2023-07-25 19:08:55,2023-07-25T19:08:55-04:00,2023-07-25,Microsoft (MSFT) Surpasses Q4 Earnings and Revenue Estimates,"Microsoft (MSFT) came out with quarterly earnings of $2.69 per share, beating the Zacks Consensus Estimate of $2.54 per share. This compares to earnings of $2.23 per share a year ago.",zacks.com,https://www.zacks.com/stock/news/2127279/microsoft-msft-surpasses-q4-earnings-and-revenue-estimates,https://images.financialmodelingprep.com/news/microsoft-msft-surpasses-q4-earnings-and-revenue-estimates-20230725.jpg
MSFT,2023-07-25,2023-07-18,2023-08-08,MSFT,,2023-07-25 19:32:47,2023-07-25T19:32:47-04:00,2023-07-25,Gene Munster picks Google stock over Microsoft after Q2 earnings,Alphabet Inc (NASDAQ: GOOGL) says it performed better-than-expected in its second financial quarter. Shares jumped roughly 8.0% in after-hours.,invezz.com,https://invezz.com/news/2023/07/25/gene-munster-google-stock-over-microsoft-q2-earnings/?utm_source=snapi,https://images.financialmodelingprep.com/news/gene-munster-picks-google-stock-over-microsoft-after-q2-20230725.jpg
MSFT,2023-07-25,2023-07-18,2023-08-08,MSFT,,2023-07-25 19:49:00,2023-07-25T19:49:00-04:00,2023-07-25,Google and Microsoft Paying Big to Play in AI,The tech giants at the forefront of the AI race show recovering growth in their core businesses.,wsj.com,https://www.wsj.com/articles/google-and-microsoft-paying-big-to-play-in-ai-48cae808,https://images.financialmodelingprep.com/news/google-and-microsoft-paying-big-to-play-in-ai-20230725.jpg
MSFT,2023-07-25,2023-07-18,2023-08-08,MSFT,,2023-07-25 20:49:18,2023-07-25T20:49:18-04:00,2023-07-25,"Microsoft is 'in the lead' with new cloud-based A.I. workloads, CEO Nadella says","Microsoft might not be the market leader in cloud infrastructure, but CEO Satya Nadella believes the company does have a leg up in cloud-based AI workloads.",cnbc.com,https://www.cnbc.com/2023/07/25/microsoft-is-in-the-lead-with-cloud-based-ai-workloads-nadella-says.html,https://images.financialmodelingprep.com/news/microsoft-is-in-the-lead-with-new-cloudbased-ai-20230725.jpeg
MSFT,2023-07-25,2023-07-18,2023-08-08,MSFT,,2023-07-25 20:54:00,2023-07-25T20:54:00-04:00,2023-07-25,"Microsoft's AI payday will take time, and investors need to be patient","Investors who may have gotten ahead of their skis on artificial intelligence heard some sobering words from Microsoft Corp. on Tuesday, as its top executives reminded them that the payoff from AI will take some time, while spending will increase.",marketwatch.com,https://www.marketwatch.com/story/microsofts-ai-payday-will-take-time-and-investors-need-to-be-patient-b017b731,https://images.financialmodelingprep.com/news/microsofts-ai-payday-will-take-time-and-investors-need-20230725.jpg
