ticker,event_date,window_start,window_end,symbol,symbols,publishedDate,publishedDateET,date_et,title,text,site,url,image
MSFT,2023-07-25,2023-07-18,2023-08-08,MSFT,,2023-07-18 01:03:30,2023-07-18T01:03:30-04:00,2023-07-18,Microsoft: Still The Cornerstone Of A Great Portfolio,"Microsoft's shares have delivered a total return of 109% in two years, outpacing the broader market's 48%, with the company's stability and presence across the tech landscape making it a strong choice for growth portfolios. Microsoft is well-positioned to benefit from the growth of artificial intelligence, with its Azure platform set to play a pivotal role in future AI systems and potentially generate $150B in annual revenue. Despite potential short-term margin contraction due to increased capital expenditure, Microsoft is expected to see significant top-line growth.",seekingalpha.com,https://seekingalpha.com/article/4617672-microsoft-still-the-cornerstone-of-a-great-portfolio,https://images.financialmodelingprep.com/news/microsoft-still-the-cornerstone-of-a-great-portfolio-20230718.jpg
MSFT,2023-07-25,2023-07-18,2023-08-08,MSFT,,2023-07-18 04:50:00,2023-07-18T04:50:00-04:00,2023-07-18,Microsoft Looks to Extend Activision Blizzard Deal Deadline: Report,"The tech giant wants to extend the contract for its $69 billion acquisition of the videogame company, which is due to expire on Tuesday, Reuters reported.",barrons.com,https://www.barrons.com/articles/microsoft-activision-blizzard-deal-deadline-stock-26975150,https://images.financialmodelingprep.com/news/microsoft-looks-to-extend-activision-blizzard-deal-deadline-report-20230718.jpg
MSFT,2023-07-25,2023-07-18,2023-08-08,MSFT,,2023-07-18 05:21:04,2023-07-18T05:21:04-04:00,2023-07-18,"AI could play part in future financial crisis, SEC chair warns","Artificial intelligence (AI) could pose a risk to financial market stability by prompting hoards of investors toward the same stocks, America's financial watchdog has warned. Securities and Exchange Commission chairman Gary Gensler argued dominance in the AI sector could ultimately restrict the range of models and data firms use for information.",proactiveinvestors.co.uk,https://www.proactiveinvestors.co.uk/companies/news/1020991?SNAPI,https://images.financialmodelingprep.com/news/ai-could-play-part-in-future-financial-crisis-sec-20230718.jpg
MSFT,2023-07-25,2023-07-18,2023-08-08,MSFT,,2023-07-18 06:05:00,2023-07-18T06:05:00-04:00,2023-07-18,Apple vs. Microsoft: Which Is the Better Dividend Stock?,"Apple's payout ratio is impressively low, at just 16%. Microsoft has been paying dividends to shareholders every year since 2003.",fool.com,https://www.fool.com/investing/2023/07/18/apple-vs-microsoft-which-is-the-better-dividend-st/,https://images.financialmodelingprep.com/news/apple-vs-microsoft-which-is-the-better-dividend-stock-20230718.jpg
MSFT,2023-07-25,2023-07-18,2023-08-08,MSFT,,2023-07-18 06:26:57,2023-07-18T06:26:57-04:00,2023-07-18,Warren Buffett cuts Activision stake as Microsoft deal edges closer,"Warren Buffett's Berkshire Hathaway Inc (NYSE:BRK.A) cut a large portion of its stake in Activision Blizzard Inc (NASDAQ:ATVI) as approval of its merger with Microsoft Corporation (NASDAQ:MSFT) edges closer. The Nebraska-based company now only owns 1.9% of the video game publisher, according to a filing by Activision on Monday.",proactiveinvestors.co.uk,https://www.proactiveinvestors.co.uk/companies/news/1020997?SNAPI,https://images.financialmodelingprep.com/news/warren-buffett-cuts-activision-stake-as-microsoft-deal-edges-20230718.jpg
MSFT,2023-07-25,2023-07-18,2023-08-08,MSFT,,2023-07-18 06:30:47,2023-07-18T06:30:47-04:00,2023-07-18,Warren Buffett cashed in his monster bet on Microsoft buying Activision Blizzard - but left some money on the table,"Warren Buffett exited his wager on Microsoft buying Activision Blizzard last quarter, filings show. Buffett built a $5 billion Activision stake, wagering the stock would hit Microsoft's offer of $95.",markets.businessinsider.com,https://markets.businessinsider.com/news/stocks/warren-buffett-berkshire-microsoft-activision-stock-portfolio-arbitrage-merger-regulation-2023-7,https://images.financialmodelingprep.com/news/warren-buffett-cashed-in-his-monster-bet-on-microsoft-20230718.jpg
MSFT,2023-07-25,2023-07-18,2023-08-08,MSFT,,2023-07-18 07:49:00,2023-07-18T07:49:00-04:00,2023-07-18,"Nvidia, Microsoft, Apple and 4 More Stocks to Play AI. Why Alphabet Misses Out.","Melius Research started coverage of Nvidia, Microsoft and Apple with Buy ratings on their AI potential but were more skeptical about Google-parent Alphabet.",barrons.com,https://www.barrons.com/articles/nvidia-microsoft-apple-ai-alphabet-stock-40ba74,https://images.financialmodelingprep.com/news/nvidia-microsoft-apple-and-4-more-stocks-to-play-20230718.jpg
MSFT,2023-07-25,2023-07-18,2023-08-08,MSFT,,2023-07-18 08:15:00,2023-07-18T08:15:00-04:00,2023-07-18,"Growth And Earnings Recovery, Probable Fed Pivot And High Quality Stocks With Victor Dergunov","Victor Dergunov runs The Financial Prophet and today talks Q2 earnings, Fed's probable pivot, inflation, and high quality stocks. Continue to buy high quality companies on pullbacks and why Victor believes in Tesla.",seekingalpha.com,https://seekingalpha.com/article/4617766-growth-and-earnings-recovery-probable-fed-pivot-and-high-quality-stocks-with-victor-dergunov,https://images.financialmodelingprep.com/news/growth-and-earnings-recovery-probable-fed-pivot-and-high-20230718.jpg
MSFT,2023-07-25,2023-07-18,2023-08-08,MSFT,,2023-07-18 08:37:03,2023-07-18T08:37:03-04:00,2023-07-18,Teladoc Health expands Microsoft tie-up to automate documentation with AI,Teladoc Health is expanding a partnership with Microsoft to use the tech giant's artificial intelligence services to automate clinical documentation on its telehealth platform.,reuters.com,https://www.reuters.com/business/healthcare-pharmaceuticals/teladoc-health-expands-microsoft-tie-up-automate-documentation-with-ai-2023-07-18/,https://images.financialmodelingprep.com/news/teladoc-health-expands-microsoft-tieup-to-automate-documentation-with-20230718.jpg
MSFT,2023-07-25,2023-07-18,2023-08-08,MSFT,,2023-07-18 08:38:47,2023-07-18T08:38:47-04:00,2023-07-18,UK to restrict randomised in-game purchases over gambling fears,"Gaming companies in the UK will face tougher restrictions on sale of loot boxes, which allow players to purchase randomly assigned in-game extras. Citing concerns over gambling, industry body Ukie has unveiled a host of measures to restrict such products, including their sale to under 18s.",proactiveinvestors.co.uk,https://www.proactiveinvestors.co.uk/companies/news/1021016?SNAPI,https://images.financialmodelingprep.com/news/uk-to-restrict-randomised-ingame-purchases-over-gambling-fears-20230718.jpg
MSFT,2023-07-25,2023-07-18,2023-08-08,MSFT,,2023-07-18 09:01:00,2023-07-18T09:01:00-04:00,2023-07-18,Red Hat Expands Capabilities of JBoss Enterprise Application Platform Offerings on Microsoft Azure,"RALEIGH, N.C.--(BUSINESS WIRE)--Red Hat, Inc., the world's leading provider of open source solutions, today announced advancements to Red Hat JBoss Enterprise Application Platform (JBoss EAP) on Microsoft Azure, including new consumption models and clustering features. JBoss EAP on Microsoft Azure enables customers to modernize and deliver existing Jakarta EE applications and build new ones with greater speed and efficiency on a fully-managed cloud platform. With multiple ways to use JBoss EAP.",businesswire.com,https://www.businesswire.com/news/home/20230718936486/en/Red-Hat-Expands-Capabilities-of-JBoss-Enterprise-Application-Platform-Offerings-on-Microsoft-Azure/,https://images.financialmodelingprep.com/news/red-hat-expands-capabilities-of-jboss-enterprise-application-platform-20230718.jpg
MSFT,2023-07-25,2023-07-18,2023-08-08,MSFT,,2023-07-18 09:24:00,2023-07-18T09:24:00-04:00,2023-07-18,Teladoc's stock pops as company partners with Microsoft on AI,"Teladoc Health Inc. shares TDOC, +0.77% were moving more than 6% higher in Tuesday's premarket action after the telehealth company said it has expanded its partnership with Microsoft Corp. MSFT, +0.14% Teladoc “is furthering its collaboration with Microsoft” by “working together” on integrating Azure and Nuance artificial-intelligence tools into its platform. “We are focused on using AI to reassert and build the doctor-patient relationship at a time when technology frequently does the opposite,” Vidya Raman-Tangella, Teladoc's chief medical officer, said in a release.",marketwatch.com,https://www.marketwatch.com/story/teladocs-stock-pops-as-company-partners-with-microsoft-on-ai-fbee432,https://images.financialmodelingprep.com/news/teladocs-stock-pops-as-company-partners-with-microsoft-on-20230718.jpg
MSFT,2023-07-25,2023-07-18,2023-08-08,MSFT,,2023-07-18 09:45:00,2023-07-18T09:45:00-04:00,2023-07-18,"Microsoft Announces New Cybersecurity Products, but Are Small Security Software Stocks Really in Trouble?","Microsoft announced new security products -- ironically, the same day it revealed a breach. Cybersecurity companies can't match Microsoft's distribution, but are often able to create better solutions.",fool.com,https://www.fool.com/investing/2023/07/18/microsoft-announces-new-cybersecurity-products-but/,https://images.financialmodelingprep.com/news/microsoft-announces-new-cybersecurity-products-but-are-small-security-20230718.jpg
MSFT,2023-07-25,2023-07-18,2023-08-08,MSFT,,2023-07-18 09:47:26,2023-07-18T09:47:26-04:00,2023-07-18,TDOC Stock Alert: Teladoc Doubles Down on Microsoft AI Partnership,"Teladoc (NYSE: TDOC ) stock is on the move Tuesday as the company expands its Microsoft (NASDAQ: MSFT ) AI partnership. According to a press release, Teladoc plans to work with Microsoft to enhance its Teladoc Health Solo platform.",investorplace.com,https://investorplace.com/2023/07/tdoc-stock-alert-teladoc-doubles-down-on-microsoft-ai-partnership/,https://images.financialmodelingprep.com/news/tdoc-stock-alert-teladoc-doubles-down-on-microsoft-ai-20230718.jpg
MSFT,2023-07-25,2023-07-18,2023-08-08,MSFT,,2023-07-18 10:33:00,2023-07-18T10:33:00-04:00,2023-07-18,Teladoc Turns to Microsoft's AI for Healthcare Automation,Teladoc says the integration of Microsoft's AI technology will automate the creation of clinical documentation during virtual exams.,barrons.com,https://www.barrons.com/articles/teladoc-stock-microsoft-ai-3947a2fa,https://images.financialmodelingprep.com/news/teladoc-turns-to-microsofts-ai-for-healthcare-automation-20230718.jpg
MSFT,2023-07-25,2023-07-18,2023-08-08,MSFT,,2023-07-18 11:13:31,2023-07-18T11:13:31-04:00,2023-07-18,Here's What to Expect from the FTC's Investigation Into OpenAI,The Federal Trade Commission (FTC) requested information regarding OpenAI's data and technology. Some individuals allege that OpenAI is using copyrighted material to train its AI chatbot.,fool.com,https://www.fool.com/investing/2023/07/18/heres-what-to-expect-from-the-ftcs-investigation-i/,https://images.financialmodelingprep.com/news/heres-what-to-expect-from-the-ftcs-investigation-into-20230718.jpg
MSFT,2023-07-25,2023-07-18,2023-08-08,MSFT,,2023-07-18 11:19:26,2023-07-18T11:19:26-04:00,2023-07-18,Microsoft (MSFT) Reports Next Week: Wall Street Expects Earnings Growth,Microsoft (MSFT) doesn't possess the right combination of the two key ingredients for a likely earnings beat in its upcoming report. Get prepared with the key expectations.,zacks.com,https://www.zacks.com/stock/news/2122885/microsoft-msft-reports-next-week-wall-street-expects-earnings-growth,https://images.financialmodelingprep.com/news/microsoft-msft-reports-next-week-wall-street-expects-earnings-20230718.jpg
MSFT,2023-07-25,2023-07-18,2023-08-08,MSFT,,2023-07-18 11:30:00,2023-07-18T11:30:00-04:00,2023-07-18,BetterUp Partners with Microsoft Viva to Drive Peak Performance and Well-Being for Millions in the Workplace,"SAN FRANCISCO--(BUSINESS WIRE)--BetterUp®, the human transformation company, today announced a partnership and integration with Microsoft Viva, the employee experience platform, to bring tools for personalized insights and performance improvement into the workplace. Starting next month, millions of Microsoft Viva users will have access to BetterUp through dynamic science-backed journeys designed to help people uncover greater purpose, performance, productivity, and well-being. The BetterUp expe.",businesswire.com,https://www.businesswire.com/news/home/20230718819951/en/BetterUp-Partners-with-Microsoft-Viva-to-Drive-Peak-Performance-and-Well-Being-for-Millions-in-the-Workplace/,https://images.financialmodelingprep.com/news/betterup-partners-with-microsoft-viva-to-drive-peak-performance-20230718.jpg
MSFT,2023-07-25,2023-07-18,2023-08-08,MSFT,,2023-07-18 11:30:25,2023-07-18T11:30:25-04:00,2023-07-18,Microsoft's Bing Chat A.I. bot now lets you search using images,Users can now take or upload a photo to Bing Chat and ask for more information on it via desktop or the Bing app.,cnbc.com,https://www.cnbc.com/2023/07/18/microsofts-bing-chat-ai-bot-now-lets-you-search-using-images.html,https://images.financialmodelingprep.com/news/microsofts-bing-chat-ai-bot-now-lets-you-search-20230718.jpeg
MSFT,2023-07-25,2023-07-18,2023-08-08,MSFT,,2023-07-18 12:26:00,2023-07-18T12:26:00-04:00,2023-07-18,Microsoft and Meta team up on AI language model for commercial use,"Microsoft Corp. MSFT, +4.73% plans to release a new version of Meta Platforms Inc.'s META, -0.07% AI language model that will make the software available to companies for the first time. Meta's AI model, called Llama 2, will be free and available to developers building software on Microsoft's Azure cloud-computing platform, the companies said in a statement announcing the partnership Tuesday.",marketwatch.com,https://www.marketwatch.com/story/microsoft-and-meta-team-up-on-ai-language-model-for-commercial-use-165b5617,https://images.financialmodelingprep.com/news/microsoft-and-meta-team-up-on-ai-language-model-20230718.jpg
MSFT,2023-07-25,2023-07-18,2023-08-08,MSFT,,2023-07-18 12:33:20,2023-07-18T12:33:20-04:00,2023-07-18,Microsoft stock pops 5% after it announces $30 per month A.I. subscription for Microsoft 365,"Microsoft will charge users an additional $30 per month for the use of generative AI with tools like Teams, Excel and Word.",cnbc.com,https://www.cnbc.com/2023/07/18/microsoft-stock-pops-on-ai-subscription-for-microsoft-365.html,https://images.financialmodelingprep.com/news/microsoft-stock-pops-5-after-it-announces-30-per-20230718.jpg
MSFT,2023-07-25,2023-07-18,2023-08-08,MSFT,,2023-07-18 12:48:45,2023-07-18T12:48:45-04:00,2023-07-18,"Microsoft goes beyond OpenAI, makes Meta's new A.I. model available to Azure customers","Meta's new artificial intelligence language model, dubbed Llama 2, will be available on Microsoft's Azure cloud-computing service.",cnbc.com,https://www.cnbc.com/2023/07/18/microsoft-makes-metas-new-ai-model-available-to-azure-customers.html,https://images.financialmodelingprep.com/news/microsoft-goes-beyond-openai-makes-metas-new-ai-model-20230718.jpeg
MSFT,2023-07-25,2023-07-18,2023-08-08,MSFT,,2023-07-18 12:50:36,2023-07-18T12:50:36-04:00,2023-07-18,Microsoft (MSFT) Introduces Affordable Tier for Xbox Game Pass,"Microsoft (MSFT) introduces a more affordable subscription tier for Xbox Game Pass, which replaces the existing Xbox Live Gold subscription.",zacks.com,https://www.zacks.com/stock/news/2123177/microsoft-msft-introduces-affordable-tier-for-xbox-game-pass,https://images.financialmodelingprep.com/news/microsoft-msft-introduces-affordable-tier-for-xbox-game-pass-20230718.jpg
MSFT,2023-07-25,2023-07-18,2023-08-08,MSFT,,2023-07-18 13:06:00,2023-07-18T13:06:00-04:00,2023-07-18,"Bank ETFs bounce, with this fund heading for potentially best month since 2021",Exchange-traded funds that buy bank stocks were jumping Tuesday as investors assessed Wall Street's latest batch of second-quarter earnings results from giants including Bank of America and Morgan Stanley.,marketwatch.com,https://www.marketwatch.com/story/bank-etfs-bounce-with-this-fund-heading-for-potentially-best-month-since-2021-d55cc5aa,https://images.financialmodelingprep.com/news/bank-etfs-bounce-with-this-fund-heading-for-potentially-20230718.jpg
MSFT,2023-07-25,2023-07-18,2023-08-08,MSFT,,2023-07-18 13:19:05,2023-07-18T13:19:05-04:00,2023-07-18,"Meta, Microsoft team up to offer AI model Llama for commercial use","The model, which Meta previously provided only to select academics for research purposes, also will be made available via direct download and through Amazon Web Services, Hugging Face and other providers.",nypost.com,https://nypost.com/2023/07/18/meta-microsoft-team-up-to-offer-ai-model-llama-for-commercial-use/,https://images.financialmodelingprep.com/news/meta-microsoft-team-up-to-offer-ai-model-llama-20230718.jpg
MSFT,2023-07-25,2023-07-18,2023-08-08,MSFT,,2023-07-18 13:51:09,2023-07-18T13:51:09-04:00,2023-07-18,MSFT Stock Alert: Microsoft Just Hit a New All-Time High,"One of the most high-profile artificial intelligence (AI) plays in the market right now is undoubtedly Microsoft (NASDAQ: MSFT ). Most investors are well aware of the company's key investment in OpenAI, the company behind ChatGPT.",investorplace.com,https://investorplace.com/2023/07/msft-stock-alert-microsoft-just-hit-a-new-all-time-high/,https://images.financialmodelingprep.com/news/msft-stock-alert-microsoft-just-hit-a-new-alltime-20230718.jpg
MSFT,2023-07-25,2023-07-18,2023-08-08,MSFT,,2023-07-18 14:18:00,2023-07-18T14:18:00-04:00,2023-07-18,"Microsoft stock jumps into record territory, adds more than 125 points to the Dow's price","Shares of Microsoft Corp. MSFT, +5.48% surged 5.5% toward a record close, to pace the Dow Jones Industrial Average's DJIA, +1.01% gainers, after the software behemoth set higher-than-expected prices on artificial-intelligence-powered Office documents. The stock's price gain of $19.06 was on track to be it's third-best since it went public in March 1986, behind the $19.95 rally on April 26, 2023 and the $19.77 advance on March 13, 2020.",marketwatch.com,https://www.marketwatch.com/story/microsoft-stock-jumps-into-record-territory-adds-more-than-125-points-to-the-dows-price-1db7942e,https://images.financialmodelingprep.com/news/microsoft-stock-jumps-into-record-territory-adds-more-than-20230718.jpg
MSFT,2023-07-25,2023-07-18,2023-08-08,MSFT,,2023-07-18 14:35:04,2023-07-18T14:35:04-04:00,2023-07-18,Microsoft Security Breach: A Wake-Up Call For Board Of Directors,"Given the recent Microsoft cyber breach, I thought it would be helpful to share an overview of some the steps boards can take in their journey toward cyber readiness.",forbes.com,https://www.forbes.com/sites/betsyatkins/2023/07/18/microsoft-security-breach-a-wake-up-call-for-board-of-directors/,https://images.financialmodelingprep.com/news/microsoft-security-breach-a-wakeup-call-for-board-of-20230718.jpg
MSFT,2023-07-25,2023-07-18,2023-08-08,MSFT,,2023-07-18 14:35:39,2023-07-18T14:35:39-04:00,2023-07-18,Microsoft-Activision Blizzard merger nearly clear of obstacles - but future for gamers remains unclear,"Microsoft has cleared nearly all of the major obstacles in its path to securing the biggest acquisition in gaming history but, for gamers, the future remains unclear.",news.sky.com,https://news.sky.com/story/microsoft-activision-blizzard-merger-nearly-clear-of-obstacles-but-future-for-gamers-remains-unclear-12923127,https://images.financialmodelingprep.com/news/microsoftactivision-blizzard-merger-nearly-clear-of-obstacles-but-future-20230718.jpg
MSFT,2023-07-25,2023-07-18,2023-08-08,MSFT,,2023-07-18 14:38:00,2023-07-18T14:38:00-04:00,2023-07-18,Microsoft Stock Is Spiking on Aggressive Pricing for AI Software,"Software giant Microsoft plans to charge $30 a month per user for the new artificial-intelligence software, a potentially huge price hike for customers who adopt it.",barrons.com,https://www.barrons.com/articles/microsoft-stock-ai-software-ad2baf04,https://images.financialmodelingprep.com/news/microsoft-stock-is-spiking-on-aggressive-pricing-for-ai-20230718.jpg
MSFT,2023-07-25,2023-07-18,2023-08-08,MSFT,,2023-07-18 14:42:50,2023-07-18T14:42:50-04:00,2023-07-18,Microsoft adds $154 billion in market value after it announces $30 per month AI subscription,Microsoft stock surged as much as 6% on Tuesday after the company unveiled an AI subscription for its Office 365 platform. The software giant will charge $30 per month per user to have AI capabilities integrated into its Microsoft Office platform.,markets.businessinsider.com,https://markets.businessinsider.com/news/stocks/microsoft-stock-price-copilot-ai-office-365-monthly-subscription-msft-2023-7,https://images.financialmodelingprep.com/news/microsoft-adds-154-billion-in-market-value-after-it-announces-20230718.jpg
MSFT,2023-07-25,2023-07-18,2023-08-08,MSFT,,2023-07-18 14:51:30,2023-07-18T14:51:30-04:00,2023-07-18,Meta to make new version of AI model available free of charge on Microsoft,Move gives start-ups and other businesses a low-cost opportunity to compete with OpenAI's ChatGPT and Google's Bard,theguardian.com,https://www.theguardian.com/technology/2023/jul/18/ai-free-open-source-microsoft,https://images.financialmodelingprep.com/news/meta-to-make-new-version-of-ai-model-available-20230718.jpg
MSFT,2023-07-25,2023-07-18,2023-08-08,MSFT,,2023-07-18 15:15:00,2023-07-18T15:15:00-04:00,2023-07-18,Veeam Partners with Microsoft to Bring New Data Protection and Ransomware Recovery Capabilities to Veeam Backup for Microsoft 365,"COLUMBUS, Ohio--(BUSINESS WIRE)-- #DataProtection--Veeam Backup for Microsoft 365, which protects 15M+ Microsoft 365 users, will deliver new backup and restore capabilities with Microsoft 365 Backup.",businesswire.com,https://www.businesswire.com/news/home/20230718359973/en/Veeam-Partners-with-Microsoft-to-Bring-New-Data-Protection-and-Ransomware-Recovery-Capabilities-to-Veeam-Backup-for-Microsoft-365/,https://images.financialmodelingprep.com/news/veeam-partners-with-microsoft-to-bring-new-data-protection-20230718.jpg
MSFT,2023-07-25,2023-07-18,2023-08-08,MSFT,,2023-07-18 15:32:52,2023-07-18T15:32:52-04:00,2023-07-18,Why Microsoft Rallied to an All-Time High Today,"At its Inspire conference, Microsoft announced pricing for its AI CoPilot feature for Office. A newer Bing Chat for Enterprise was also unveiled.",fool.com,https://www.fool.com/investing/2023/07/18/why-microsoft-rallied-today/,https://images.financialmodelingprep.com/news/why-microsoft-rallied-to-an-alltime-high-today-20230718.jpg
MSFT,2023-07-25,2023-07-18,2023-08-08,MSFT,,2023-07-18 15:51:43,2023-07-18T15:51:43-04:00,2023-07-18,House Republicans urge FTC to drop antitrust fight against Microsoft-Activision deal,Twenty-two Republican lawmakers urged the Federal Trade Commission to drop its fight against Microsoft's deal to buy video game maker Activision Blizzard.,nypost.com,https://nypost.com/2023/07/18/house-republicans-urge-lina-khans-ftc-to-drop-fight-against-microsoft-activision-deal/,https://images.financialmodelingprep.com/news/house-republicans-urge-ftc-to-drop-antitrust-fight-against-20230718.jpg
MSFT,2023-07-25,2023-07-18,2023-08-08,MSFT,,2023-07-18 16:00:36,2023-07-18T16:00:36-04:00,2023-07-18,"Microsoft Announces $30 AI Subscription, Doubles Down On AI Partnerships",Microsoft announced an AI-powered premium version of its Microsoft 365 product that would cost users $30 per month. And it's doubling down on AI applications through tie-ups with companies like Meta.,investopedia.com,https://www.investopedia.com/microsoft-announces-usd30-ai-subscription-doubles-down-on-ai-partnerships-7562505,https://images.financialmodelingprep.com/news/microsoft-announces-30-ai-subscription-doubles-down-on-ai-20230718.jpg
MSFT,2023-07-25,2023-07-18,2023-08-08,MSFT,,2023-07-18 16:04:38,2023-07-18T16:04:38-04:00,2023-07-18,Microsoft closes at record after revealing pricing for new A.I. subscription,Microsoft shares rallied to an all-time high after the company announced pricing for its new Microsoft 365 artificial intelligence subscription service.,cnbc.com,https://www.cnbc.com/2023/07/18/microsoft-stock-hits-all-time-high-on-new-copilot-ai-subscription.html,https://images.financialmodelingprep.com/news/microsoft-closes-at-record-after-revealing-pricing-for-new-20230718.jpeg
MSFT,2023-07-25,2023-07-18,2023-08-08,MSFT,,2023-07-18 16:39:52,2023-07-18T16:39:52-04:00,2023-07-18,Microsoft brings Meta's large language model Llama 2 to Azure,"Microsoft Corporation (NASDAQ:MSFT) is doubling down on its commitment to advancing artificial intelligence (AI), even going so far as to make a chief rival's software available to Microsoft Azure customers.  The company that spent billions investing in ChatGPT-developer Open AI announced at its Inspire conference that Meta's new large language model, named Llama 2, will be available on the Azure cloud computing service.",proactiveinvestors.com,https://www.proactiveinvestors.com/companies/news/1021053?SNAPI,https://images.financialmodelingprep.com/news/microsoft-brings-metas-large-language-model-llama-2-to-azure-20230718.jpg
MSFT,2023-07-25,2023-07-18,2023-08-08,MSFT,,2023-07-18 16:40:07,2023-07-18T16:40:07-04:00,2023-07-18,Microsoft Stock Closes At All-Time High After Revealing New AI-Powered Platform,Other tech giants such as Apple and Nvidia also hit all-time highs in recent weeks.,forbes.com,https://www.forbes.com/sites/antoniopequenoiv/2023/07/18/microsoft-stock-closes-at-all-time-high-after-revealing-new-ai-powered-platform/,https://images.financialmodelingprep.com/news/microsoft-stock-closes-at-alltime-high-after-revealing-new-20230718.jpg
