ticker,event_date,window_start,window_end,symbol,symbols,publishedDate,publishedDateET,date_et,title,text,site,url,image
MA,2022-01-27,2022-01-20,2022-02-10,MA,,2022-01-27 08:01:00,2022-01-27T08:01:00-05:00,2022-01-27,Mastercard Incorporated Fourth-Quarter and Full-Year 2021 Financial Results Available on Company's Website,"PURCHASE, N.Y.--(BUSINESS WIRE)--Mastercard announced its fourth-quarter and full-year 2021 financial results through a release available on the company's Investor Relations website.",businesswire.com,https://www.businesswire.com/news/home/20220127005551/en/Mastercard-Incorporated-Fourth-Quarter-and-Full-Year-2021-Financial-Results-Available-on-Company%E2%80%99s-Website/,https://images.financialmodelingprep.com/news/mastercard-incorporated-fourthquarter-and-fullyear-2021-financial-results-available-20220127.jpg
MA,2022-01-27,2022-01-20,2022-02-10,MA,,2022-01-27 08:04:00,2022-01-27T08:04:00-05:00,2022-01-27,"Mastercard profit jumps 33% on spending, travel boost","Mastercard Inc reported a 33% jump in fourth-quarter profit on Thursday, as a rise in domestic spending and growth in cross-border volumes following an uptick in international travel drove higher transactions through its cards.",reuters.com,https://www.reuters.com/business/finance/mastercard-profit-jumps-33-spending-travel-boost-2022-01-27/,https://images.financialmodelingprep.com/news/mastercard-profit-jumps-33-on-spending-travel-boost-20220127.jpg
MA,2022-01-27,2022-01-20,2022-02-10,MA,,2022-01-27 08:26:00,2022-01-27T08:26:00-05:00,2022-01-27,Earnings Results: Mastercard exceeds earnings expectations as consumer spending rebound continues,"Mastercard Inc. delivered earnings and revenue ahead of expectations Thursday, as the financial-services company benefited from a continued rebound in consumer spending.",marketwatch.com,https://www.marketwatch.com/story/mastercard-exceeds-earnings-expectations-as-consumer-spending-rebound-continues-11643289989,https://images.financialmodelingprep.com/news/earnings-results-mastercard-exceeds-earnings-expectations-as-consumer-spending-20220127.jpg
MA,2022-01-27,2022-01-20,2022-02-10,MA,,2022-01-27 10:22:00,2022-01-27T10:22:00-05:00,2022-01-27,Mastercard's Profit Topped Estimates. Investors Don't Appear Impressed.,Mastercard stock was weak after the company issued tepid guidance. It's an overhang for Visa as well.,barrons.com,https://www.barrons.com/articles/mastercard-profit-topped-estimates-stock-51643296179,https://images.financialmodelingprep.com/news/mastercards-profit-topped-estimates-investors-dont-appear-impressed-20220127.jpg
MA,2022-01-27,2022-01-20,2022-02-10,MA,,2022-01-27 10:46:25,2022-01-27T10:46:25-05:00,2022-01-27,MasterCard (MA) Q4 Earnings and Revenues Top Estimates,"MasterCard (MA) delivered earnings and revenue surprises of 7.31% and 1.62%, respectively, for the quarter ended December 2021. Do the numbers hold clues to what lies ahead for the stock?",zacks.com,https://www.zacks.com/stock/news/1858149/mastercard-ma-q4-earnings-and-revenues-top-estimates,https://images.financialmodelingprep.com/news/mastercard-ma-q4-earnings-and-revenues-top-estimates-20220127.jpg
MA,2022-01-27,2022-01-20,2022-02-10,MA,,2022-01-27 13:34:15,2022-01-27T13:34:15-05:00,2022-01-27,Mastercard Incorporated (MA) CEO Michael Miebach on Q4 2021 Results - Earnings Call Transcript,Mastercard Incorporated (MA) CEO Michael Miebach on Q4 2021 Results - Earnings Call Transcript,seekingalpha.com,https://seekingalpha.com/article/4482177-mastercard-incorporated-ma-ceo-michael-miebach-on-q4-2021-results-earnings-call-transcript,https://images.financialmodelingprep.com/news/mastercard-incorporated-ma-ceo-michael-miebach-on-q4-2021-20220127.jpg
MA,2022-01-27,2022-01-20,2022-02-10,MA,,2022-01-27 14:43:21,2022-01-27T14:43:21-05:00,2022-01-27,"Cramer's Investing Club: Mastercard's earnings, outlook for travel recovery justify stock price","While the full-year 2022 outlook was more or less in line, we think it was better than feared.",cnbc.com,https://www.cnbc.com/2022/01/27/cramers-investing-club-mastercards-earnings-outlook-for-travel-recovery-justify-stock-price.html,https://images.financialmodelingprep.com/news/cramers-investing-club-mastercards-earnings-outlook-for-travel-recovery-20220127.jpeg
MA,2022-01-27,2022-01-20,2022-02-10,MA,,2022-01-27 16:10:23,2022-01-27T16:10:23-05:00,2022-01-27,Mastercard (MA) Q4 Earnings Beat on Consumer Spending Recovery,Mastercard's (MA) fourth-quarter cross-border spending rises above the pre-pandemic level.,zacks.com,https://www.zacks.com/stock/news/1858487/mastercard-ma-q4-earnings-beat-on-consumer-spending-recovery,https://images.financialmodelingprep.com/news/mastercard-ma-q4-earnings-beat-on-consumer-spending-recovery-20220127.jpg
MA,2022-01-27,2022-01-20,2022-02-10,MA,,2022-01-28 15:10:28,2022-01-28T15:10:28-05:00,2022-01-28,Stocks' Chaotic Ride Continues as Major Indexes Swing to Green,"Stocks reverse again, swinging into the green in what has been a roller coaster ride.",investopedia.com,https://www.investopedia.com/stocks-roller-coaster-ride-continues-as-major-indexes-swing-to-green-5217407,https://images.financialmodelingprep.com/news/stocks-chaotic-ride-continues-as-major-indexes-swing-to-20220128.jpg
MA,2022-01-27,2022-01-20,2022-02-10,MA,,2022-01-28 17:13:41,2022-01-28T17:13:41-05:00,2022-01-28,Why Mastercard Stock Blasted 9% Higher Today,A convincing bottom-line beat is bringing the bulls back into the stock.,fool.com,https://www.fool.com/investing/2022/01/28/why-mastercard-stock-blasted-9-higher-today/,https://images.financialmodelingprep.com/news/why-mastercard-stock-blasted-9-higher-today-20220128.jpg
MA,2022-01-27,2022-01-20,2022-02-10,MA,,2022-01-29 06:15:00,2022-01-29T06:15:00-05:00,2022-01-29,3 Unstoppable Investments Everyone Needs in Their Portfolios,"These all-purpose, all-weather companies can defy economic cycles.",fool.com,https://www.fool.com/investing/2022/01/29/3-unstoppable-investments-everyone-needs-in-their/,https://images.financialmodelingprep.com/news/3-unstoppable-investments-everyone-needs-in-their-portfolios-20220129.jpg
MA,2022-01-27,2022-01-20,2022-02-10,MA,,2022-01-31 11:47:32,2022-01-31T11:47:32-05:00,2022-01-31,Where Will Mastercard Stock Be In 5 Years?,"Mastercard stock was up 9.1% on Friday, after strong Q4 results the day before showed how its multi-year structural growth has continued. Volumes rebounded strongly in Q4, with total volume up 31% and Cross-Border ex. Intra-Europe volume up 63% year-on-year.",seekingalpha.com,https://seekingalpha.com/article/4482947-mastercard-stock-5-years,https://images.financialmodelingprep.com/news/where-will-mastercard-stock-be-in-5-years-20220131.jpg
MA,2022-01-27,2022-01-20,2022-02-10,MA,,2022-02-01 04:00:58,2022-02-01T04:00:58-05:00,2022-02-01,3 Reasons to Add Visa & Mastercard to Your Shopping List,"Visa (NYSE:V) and Mastercard (NYSE:MA) are two of the most important names in the digital payments industry. These global leaders have forever changed the way that consumers, businesses, and governments handle financial transactions a",marketbeat.com,https://www.marketbeat.com/originals/3-reasons-to-add-visa-and-mastercard-to-your-shopping-list/?SNAPI,https://images.financialmodelingprep.com/news/3-reasons-to-add-visa-mastercard-to-your-shopping-20220201.jpg
MA,2022-01-27,2022-01-20,2022-02-10,MA,,2022-02-01 13:50:08,2022-02-01T13:50:08-05:00,2022-02-01,Mastercard (MA) Ties Up to Infuse Digitization in Catalonia,Mastercard (MA) joins forces with the Government of Catalonia to work on a series of projects to gradually integrate digitization within the region's economy.,zacks.com,https://www.zacks.com/stock/news/1860754/mastercard-ma-ties-up-to-infuse-digitization-in-catalonia,https://images.financialmodelingprep.com/news/mastercard-ma-ties-up-to-infuse-digitization-in-catalonia-20220201.jpg
MA,2022-01-27,2022-01-20,2022-02-10,MA,,2022-02-03 15:47:15,2022-02-03T15:47:15-05:00,2022-02-03,"Robert Olstein Axes Lowe's, Chops Dollar Tree Stake","Robert Olstein (Trades, Portfolio), chairman and chief investment officer of Olstein Capital Management, disclosed this week that his firm's top five trades during the fourth quarter of 2021 included the closure of its position in Lowe's Companies Inc. ( LOW , Financial), the reduction of its holdings in Dollar Tree Inc. ( DLTR , Financial) and CVS Health Corp. ( CVS , Financial) and boosts to its stakes in Generac Holdings Inc. ( GNRC , Financial) and Mastercard Inc. ( MA , Financial).",gurufocus.com,https://www.gurufocus.com/news/1633898/robert-olstein-axes-lowes-chops-dollar-tree-stake,https://images.financialmodelingprep.com/news/robert-olstein-axes-lowes-chops-dollar-tree-stake-20220203.jpg
MA,2022-01-27,2022-01-20,2022-02-10,MA,,2022-02-05 07:00:00,2022-02-05T07:00:00-05:00,2022-02-05,"Giant Charity Bought Visa, Mastercard, and Krispy Kreme Stock. Here's What It Sold.","Wellcome Trust, one of the world's largest charities, bought more Visa stock, and initiated positions in Mastercard and Krispy Kreme. It sold Keurig Dr Pepper.",barrons.com,https://www.barrons.com/articles/visa-stock-mastercard-krispy-kreme-keurig-51643831781,https://images.financialmodelingprep.com/news/giant-charity-bought-visa-mastercard-and-krispy-kreme-stock-20220205.jpg
MA,2022-01-27,2022-01-20,2022-02-10,MA,,2022-02-07 11:34:44,2022-02-07T11:34:44-05:00,2022-02-07,Mastercard Partnership Is the Icing on the Cake for Exela Technologies,XELA stock deserves to be far above $1 as Exela extends its digital-payments platform into the potentially lucrative European market. The post Mastercard Partnership Is the Icing on the Cake for Exela Technologies appeared first on InvestorPlace.,investorplace.com,https://investorplace.com/2022/02/mastercard-partnership-is-the-icing-on-the-cake-for-xela-stock-holders/,https://images.financialmodelingprep.com/news/mastercard-partnership-is-the-icing-on-the-cake-for-20220207.jpg
MA,2022-01-27,2022-01-20,2022-02-10,MA,,2022-02-08 09:00:00,2022-02-08T09:00:00-05:00,2022-02-08,"HELLO ALICE LAUNCHES THE YEAR OF SMALL BUSINESS, A MOVEMENT IN PARTNERSHIP WITH NAACP, U.S. HISPANIC CHAMBER OF COMMERCE, GLOBAL ENTREPRENEURSHIP NETWORK, AND MASTERCARD®","HOUSTON, Feb. 8, 2022 /PRNewswire/ -- Today, Hello Alice , the largest platform helping small businesses launch and grow in America, proudly announces that 2022 will be the Year of Small Business , a movement in partnership with NAACP, U.S. Hispanic Chamber of Commerce, Global Entrepreneurship Network (GEN), and Mastercard. The Year of Small Business (YOSB) will open up equitable access to capital, direct consumer spending toward small business owners, and provide business education, networks, and opportunities to 3 million small business owners.",prnewswire.com,https://www.prnewswire.com/news-releases/hello-alice-launches-the-year-of-small-business--a-movement-in-partnership-with-naacp-us-hispanic-chamber-of-commerce-global-entrepreneurship-network-and-mastercard-301477538.html,https://images.financialmodelingprep.com/news/hello-alice-launches-the-year-of-small-business-a-20220208.jpg
MA,2022-01-27,2022-01-20,2022-02-10,MA,,2022-02-08 13:41:35,2022-02-08T13:41:35-05:00,2022-02-08,10 Fintech Stocks To Own Until 2032 and Beyond,"While falling out of favor for now, in the long-term the 'digitalization of money' trend could send these 10 fintech stocks higher. The post 10 Fintech Stocks To Own Until 2032 and Beyond appeared first on InvestorPlace.",investorplace.com,https://investorplace.com/2022/02/10-fintech-stocks-to-own-until-2032-and-beyond/,https://images.financialmodelingprep.com/news/10-fintech-stocks-to-own-until-2032-and-beyond-20220208.jpg
MA,2022-01-27,2022-01-20,2022-02-10,MA,,2022-02-08 14:42:30,2022-02-08T14:42:30-05:00,2022-02-08,5 Best Digital Payments Stocks To Buy Right Now,The digital payments market is one of the largest and fastest-growing businesses within the finance and tech sectors. Adoption of digital payments over traditional cash and credit cards accelerated during the pandemic in 2020 and 2021.,benzinga.com,https://www.benzinga.com/analyst-ratings/analyst-color/22/02/25484937/5-best-digital-payments-stocks-to-buy-right-now,https://images.financialmodelingprep.com/news/5-best-digital-payments-stocks-to-buy-right-now-20220208.jpg
MA,2022-01-27,2022-01-20,2022-02-10,MA,,2022-02-08 16:15:00,2022-02-08T16:15:00-05:00,2022-02-08,Mastercard Board of Directors Announces Quarterly Dividend,"PURCHASE, N.Y.--(BUSINESS WIRE)--Mastercard Incorporated (NYSE: MA) today announced that its Board of Directors has declared a quarterly cash dividend of 49 cents per share. The cash dividend will be paid on May 9, 2022 to holders of record of its Class A common stock and Class B common stock as of April 8, 2022. Additionally, the company announced that its annual meeting of stockholders will take place on June 21, 2022 at 8:30 a.m. Eastern Time. When filed, the definitive proxy statement will confirm the format and location of the meeting. Stockholders of record as of the close of business on April 22, 2022 will be entitled to vote. About Mastercard Incorporated (NYSE: MA), www.mastercard.com Mastercard is a global technology company in the payments industry. Our mission is to connect and power an inclusive, digital economy that benefits everyone, everywhere by making transactions safe, simple, smart and accessible. Using secure data and networks, partnerships and passion, our innovations and solutions help individuals, financial institutions, governments and businesses realize their greatest potential. Our decency quotient, or DQ, drives our culture and everything we do inside and outside of our company. With connections across more than 210 countries and territories, we are building a sustainable world that unlocks priceless possibilities for all. Forward Looking Statements Statements in this press release which are not historical facts are forward-looking and subject to the safe harbor provisions of the Private Securities Litigation Reform Act of 1995. When used in this press release, the words “believe”, “expect”, “could”, “may”, “would”, “will”, “trend” and similar words are intended to identify forward-looking statements. Examples of forward-looking statements include, but are not limited to, statements relating to the manner and amount of purchases by Mastercard pursuant to its share repurchase program dependent upon price and market conditions, as well as Mastercard’s future prospects, developments and business strategies. Forward-looking statements speak only as of the date they are made, and the company undertakes no duty to update any forward-looking statements made in this press release or to conform such statements to actual results or changes in the company’s expectations.",businesswire.com,https://www.businesswire.com/news/home/20220208006089/en/Mastercard-Board-of-Directors-Announces-Quarterly-Dividend,https://images.financialmodelingprep.com/news/mastercard-board-of-directors-announces-quarterly-dividend-20220208.jpg
MA,2022-01-27,2022-01-20,2022-02-10,MA,,2022-02-09 15:56:34,2022-02-09T15:56:34-05:00,2022-02-09,"FinTech Kashat, Mastercard Partner to Expand Financial Services to Egypt's Underserved","With as many as 67% of Egypt's residents without a bank account, Mastercard and FinTech Kashat have signed a deal to digitize onboarding, disbursement and collections for the Middle East and North Africa, the companies announced Tuesday (Feb 8). The five-year agreement comes as Egypt's population of nearly 65 million people above the age of […]",pymnts.com,https://www.pymnts.com/financial-inclusion-3/2022/fintech-kashat-mastercard-partner-to-expand-financial-services-to-egypts-underserved/,https://images.financialmodelingprep.com/news/fintech-kashat-mastercard-partner-to-expand-financial-services-to-20220209.jpg
MA,2022-01-27,2022-01-20,2022-02-10,MA,,2022-02-09 16:35:39,2022-02-09T16:35:39-05:00,2022-02-09,Tillful Launches Card for Small Businesses With Highnote and Mastercard,"Small and medium-sized business (SMB) credit platform Tillful has collaborated with payment card creation company Highnote and Mastercard on the Tillful Card, which will increase SMBs' access to credit and growth capital, according to a Wednesday (Feb. 9) Highnote press release. The Tillful Card joins the company's suite of products that give business owners access […]",pymnts.com,https://www.pymnts.com/credit-cards/2022/tillful-launches-card-for-small-businesses-with-highnote-and-mastercard/,https://images.financialmodelingprep.com/news/tillful-launches-card-for-small-businesses-with-highnote-and-20220209.jpg
MA,2022-01-27,2022-01-20,2022-02-10,MA,,2022-02-10 07:01:00,2022-02-10T07:01:00-05:00,2022-02-10,"Mastercard SpendingPulse: January U.S. Retail Sales Up 7.2%*, Marking Solid Start to 2022","PURCHASE, N.Y.--(BUSINESS WIRE)--2022 kicked off with gains across nearly all retail sectors, according to Mastercard SpendingPulseTM, which measures in-store and online retail sales across all forms of payment. This January, U.S. retail sales excluding auto increased 7.2% year-over-year (YOY), with online sales growing 10.4% compared to January 2021. Despite the shadow of Omicron and elevated inflation, consumer spending was buoyed by pent-up savings, wage growth and the continued re-opening of the “experience economy.” Beneficiaries included Department Stores, Apparel and Luxury, which all saw double-digit growth. Key retail trends were a continuation from the strong holiday season, including: The shift back to services: The pandemic arrested a decades-long trend of more spending on services vs goods. Since the middle of last year, this tide has begun to shift back to services – or experiences – as consumers resume in-person activities. According to Mastercard SpendingPulse, Restaurant sales grew 36.7% YOY and 16.6% compared to pre-pandemic levels. Digital demand: E-commerce sales growth shows no signs of stopping, with double-digit increases in January even compared to the strong base in 2021. Compared to pre-pandemic levels, e-commerce sales were up 110.1%, underscoring the sustained and significant nature of the shift to digital. New year, new looks: Apparel sales were up 37.6% in January YOY, the strongest growth rate for January in SpendingPulse history. The Apparel sector has experienced positive growth for 11 consecutive months as consumers refresh wardrobes and dress to impress for gatherings and events taking place in 2022. Department Stores have similarly gained from resurgent spending, with January sales up 10.5% YOY and 9.8% vs. pre-pandemic levels. Luxe for loved ones: Luxury (+45.3% YOY) and Jewelry (+19.8% YOY) sales continued to outperform in January ahead of Valentine’s Day. “Coming on the heels of the holidays, January typically marks a month of returns and exchanges. However, the strong growth across sectors reflects the optimism and eagerness for the year ahead,” said Steve Sadove, senior advisor for Mastercard and former CEO and Chairman of Saks Incorporated. “With nearly all sectors up, we see consumers returning to their shopping habits with a continued emphasis on digital.” *Excluding automotive sales About Mastercard SpendingPulse: Mastercard SpendingPulse reports on national retail sales across all payment types in select markets around the world. The findings are based on aggregate sales activity in the Mastercard payments network, coupled with survey-based estimates for certain other payment forms, such as cash and check. Mastercard SpendingPulse defines “U.S. retail sales” as sales at retailers and food services merchants of all sizes. Sales activity within the services sector (for example, travel services such as airlines and lodging) are not included. About Mastercard (NYSE: MA) Mastercard is a global technology company in the payments industry. Our mission is to connect and power an inclusive, digital economy that benefits everyone, everywhere by making transactions safe, simple, smart and accessible. Using secure data and networks, partnerships and passion, our innovations and solutions help individuals, financial institutions, governments and businesses realize their greatest potential. Our decency quotient, or DQ, drives our culture and everything we do inside and outside of our company. With connections across more than 210 countries and territories, we are building a sustainable world that unlocks priceless possibilities for all. www.mastercard.com",businesswire.com,https://www.businesswire.com/news/home/20220210005277/en/Mastercard-SpendingPulse-January-U.S.-Retail-Sales-Up-7.2*-Marking-Solid-Start-to-2022,https://images.financialmodelingprep.com/news/mastercard-spendingpulse-january-us-retail-sales-up-72-marking-20220210.jpg
MA,2022-01-27,2022-01-20,2022-02-10,MA,,2022-02-10 07:01:00,2022-02-10T07:01:00-05:00,2022-02-10,"Mastercard SpendingPulse: January U.S. Retail Sales Up 7.2%*, Marking Solid Start to 2022","PURCHASE, N.Y.--(BUSINESS WIRE)-- #SpendingInsights--2022 kicked off with gains across nearly all retail sectors, according to Mastercard SpendingPulse, which measures in-store and online retail sales.",businesswire.com,https://www.businesswire.com/news/home/20220210005277/en/Mastercard-SpendingPulse-January-U.S.-Retail-Sales-Up-7.2*-Marking-Solid-Start-to-2022/,https://images.financialmodelingprep.com/news/mastercard-spendingpulse-january-us-retail-sales-up-72-marking-solid-20220210.jpg
MA,2022-01-27,2022-01-20,2022-02-10,MA,,2022-02-10 09:06:23,2022-02-10T09:06:23-05:00,2022-02-10,"E-commerce doubles in January compared to 2019, apparel shows strength, says Mastercard SpendingPulse data","E-commerce sales more than doubled in January compared to January 2019, up 110.1%, according to the latest data from Mastercard MA, +1.87% SpendingPulse. Digital sales grew 10.4% over last year.",marketwatch.com,https://www.marketwatch.com/story/e-commerce-doubles-in-january-compared-to-2019-apparel-shows-strength-says-mastercard-spendingpulse-data-2022-02-10,https://images.financialmodelingprep.com/news/ecommerce-doubles-in-january-compared-to-2019-apparel-shows-20220210.jpg
