ticker,event_date,window_start,window_end,symbol,symbols,publishedDate,publishedDateET,date_et,title,text,site,url,image
ORCL,2024-06-11,2024-05-28,2024-06-25,ORCL,,2024-05-28 07:10:00,2024-05-28T07:10:00-04:00,2024-05-28,Michael Burry Sold Oracle Stock But You Should Keep Buying,"Oracle (NYSE: ORCL ) has not exactly gone “to the moon,” but Oracle stock has certainly racked up some solid gains since the start of the year. Shares in the software giant are up by around 16.6% year-to-date.",investorplace.com,https://investorplace.com/2024/05/michael-burry-sold-oracle-stock-but-you-should-keep-buying/,https://images.financialmodelingprep.com/news/michael-burry-sold-oracle-stock-but-you-should-keep-20240528.jpg
ORCL,2024-06-11,2024-05-28,2024-06-25,ORCL,,2024-05-28 13:17:19,2024-05-28T13:17:19-04:00,2024-05-28,3 Innovative Tech Stocks Ready for 100% Gains in 5 Years,"The tech sector is well-known for innovation. Indeed, most investors who want growth focus on names in the software, subscriptions and services areas of the tech market.",investorplace.com,https://investorplace.com/2024/05/3-innovative-tech-stocks-ready-for-100-gains-in-5-years/,https://images.financialmodelingprep.com/news/3-innovative-tech-stocks-ready-for-100-gains-in-20240528.png
ORCL,2024-06-11,2024-05-28,2024-06-25,ORCL,,2024-05-29 07:25:08,2024-05-29T07:25:08-04:00,2024-05-29,The 4 Horsemen of the Generative AI Revolution,"Generative AI is here and in a big way. The rise of generative AI already impacts our daily lives and will only grow as the infrastructure is built, models are trained, and applications are developed.",marketbeat.com,https://www.marketbeat.com/originals/the-4-horsemen-of-the-generative-ai-revolution/,https://images.financialmodelingprep.com/news/the-4-horsemen-of-the-generative-ai-revolution-20240529.jpg
ORCL,2024-06-11,2024-05-28,2024-06-25,ORCL,,2024-05-29 07:30:00,2024-05-29T07:30:00-04:00,2024-05-29,Streamline Health® Announces New RevID™ Contract with 400-Bed Health System,"Oracle Health partnership enables 400-bed, southern California health system to leverage RevID's automated charge reconciliation for improved financial performance Oracle Health partnership enables 400-bed, southern California health system to leverage RevID's automated charge reconciliation for improved financial performance",globenewswire.com,https://www.globenewswire.com/news-release/2024/05/29/2889733/0/en/Streamline-Health-Announces-New-RevID-Contract-with-400-Bed-Health-System.html,https://images.financialmodelingprep.com/news/streamline-health-announces-new-revid-contract-with-400bed-health-20240529.jpg
ORCL,2024-06-11,2024-05-28,2024-06-25,ORCL,,2024-05-30 03:00:00,2024-05-30T03:00:00-04:00,2024-05-30,Oracle Plans to Open Two Public Cloud Regions in Morocco,"Oracle will be the first hyperscaler to open public cloud regions in North Africa New public cloud regions will help accelerate the implementation of Morocco's digital government initiatives Organizations across Africa will be able to drive innovation and accelerate digital transformation with Oracle Cloud Infrastructure's high performance and security, powerful data and AI, and distributed cloud capabilities AUSTIN, Texas and CASABLANCA, Morocco , May 30, 2024 /PRNewswire/ -- Oracle today announced plans to open two Oracle Cloud Regions in Morocco to offer enterprise cloud services to local and regional organizations across Africa. The upcoming new regions will enable Oracle customers and partners to migrate mission-critical workloads from their data centers to Oracle Cloud Infrastructure (OCI), while helping them comply with local regulations.",prnewswire.com,https://www.prnewswire.com/news-releases/oracle-plans-to-open-two-public-cloud-regions-in-morocco-302158936.html,https://images.financialmodelingprep.com/news/oracle-plans-to-open-two-public-cloud-regions-in-20240530.jpg
ORCL,2024-06-11,2024-05-28,2024-06-25,ORCL,,2024-05-30 06:57:00,2024-05-30T06:57:00-04:00,2024-05-30,Double Delight- 3 Tech Stocks Delivering Dividends and Growth,"The tech industry is a hot space right now. Investors are watching the segment with keen interest, and it is understandable why there is so much attention on the space.",investorplace.com,https://investorplace.com/2024/05/double-delight-3-tech-stocks-delivering-dividends-and-growth/,https://images.financialmodelingprep.com/news/double-delight-3-tech-stocks-delivering-dividends-and-growth-20240530.jpg
ORCL,2024-06-11,2024-05-28,2024-06-25,ORCL,,2024-06-02 07:30:47,2024-06-02T07:30:47-04:00,2024-06-02,Top Stocks To Watch in June,"The S&P 500 this year had its best May since the rip-roaring days of 2020, rising 4.8% over the month. However, much of that gain came at the beginning of the month as Wall Street cheered encouraging economic data and a slew of earnings reports showing the resilience of corporate earnings.",investopedia.com,https://www.investopedia.com/stocks-to-watch-june-2024-8656773,https://images.financialmodelingprep.com/news/top-stocks-to-watch-in-june-20240602.jpg
ORCL,2024-06-11,2024-05-28,2024-06-25,ORCL,,2024-06-02 08:00:00,2024-06-02T08:00:00-04:00,2024-06-02,3 Dividend-Paying Tech Stocks to Buy in June,Microsoft emerged as arguably the most resilient big tech stock. Taiwan Semiconductor dominates the contract-chip market and is getting a tailwind from AI.,fool.com,https://www.fool.com/investing/2024/06/02/3-dividend-paying-tech-stocks-to-buy-in-june/,https://images.financialmodelingprep.com/news/3-dividendpaying-tech-stocks-to-buy-in-june-20240602.jpg
ORCL,2024-06-11,2024-05-28,2024-06-25,ORCL,,2024-06-03 13:14:30,2024-06-03T13:14:30-04:00,2024-06-03,'AI Nirvana' Fades For Data Software Stocks. Oracle Earnings To Offer Next Test.,Data software players that were hot picks as AI stocks last year are slumping this year. Can Oracle turn the tide?,investors.com,https://www.investors.com/news/technology/ai-stocks-oracle-stock-data-mongodb/,https://images.financialmodelingprep.com/news/ai-nirvana-fades-for-data-software-stocks-oracle-earnings-20240603.jpg
ORCL,2024-06-11,2024-05-28,2024-06-25,ORCL,,2024-06-03 18:51:07,2024-06-03T18:51:07-04:00,2024-06-03,Oracle (ORCL) Exceeds Market Returns: Some Facts to Consider,"In the latest trading session, Oracle (ORCL) closed at $119.28, marking a +1.78% move from the previous day.",zacks.com,https://www.zacks.com/stock/news/2282990/oracle-orcl-exceeds-market-returns-some-facts-to-consider?cid=CS-STOCKNEWSAPI-FT-tale_of_the_tape|yseop_template_6-2282990,https://images.financialmodelingprep.com/news/oracle-orcl-exceeds-market-returns-some-facts-to-consider-20240603.jpg
ORCL,2024-06-11,2024-05-28,2024-06-25,ORCL,,2024-06-04 05:15:00,2024-06-04T05:15:00-04:00,2024-06-04,2 AI Stocks to Buy and Hold for the Next Decade,Arista Networks and Oracle are benefiting from the AI boom. Arista has emerged as the AI networking leader.,fool.com,https://www.fool.com/investing/2024/06/04/2-ai-stocks-to-buy-and-hold-for-the-next-decade/,https://images.financialmodelingprep.com/news/2-ai-stocks-to-buy-and-hold-for-the-20240604.jpg
ORCL,2024-06-11,2024-05-28,2024-06-25,ORCL,,2024-06-04 09:00:00,2024-06-04T09:00:00-04:00,2024-06-04,"Oracle Health RevElate Patient Accounting Drives Faster, More Accurate Reimbursements","Solution increases efficiency, transparency, and financial outcomes for Charleston-based medical network AUSTIN, Texas , June 4, 2024 /PRNewswire/ -- Charleston Area Medical Center, Inc. (CAMC) is using Oracle Health RevElate Patient Accounting to improve its billing accuracy, accelerate reimbursements, and strengthen its financial position. CAMC has implemented RevElate Patient Accounting, an electronic health record-agnostic solution, in its ambulatory clinics and four of its Charleston facilities.",prnewswire.com,https://www.prnewswire.com/news-releases/oracle-health-revelate-patient-accounting-drives-faster-more-accurate-reimbursements-302163324.html,https://images.financialmodelingprep.com/news/oracle-health-revelate-patient-accounting-drives-faster-more-accurate-20240604.jpg
ORCL,2024-06-11,2024-05-28,2024-06-25,ORCL,,2024-06-04 10:15:00,2024-06-04T10:15:00-04:00,2024-06-04,"Have $3,000? These 3 Stocks Could Be Bargain Buys for 2024 and Beyond",Oracle's cloud business looks ready to continue expanding. AT&T's growth rates should finally stabilize after its recent spinoffs.,fool.com,https://www.fool.com/investing/2024/06/04/have-3000-these-3-stocks-could-be-bargain-buys-for/,https://images.financialmodelingprep.com/news/have-3000-these-3-stocks-could-be-bargain-buys-20240604.jpg
ORCL,2024-06-11,2024-05-28,2024-06-25,ORCL,,2024-06-04 10:36:20,2024-06-04T10:36:20-04:00,2024-06-04,Brokers Suggest Investing in Oracle (ORCL): Read This Before Placing a Bet,"When deciding whether to buy, sell, or hold a stock, investors often rely on analyst recommendations. Media reports about rating changes by these brokerage-firm-employed (or sell-side) analysts often influence a stock's price, but are they really important?",zacks.com,https://www.zacks.com/stock/news/2283217/brokers-suggest-investing-in-oracle-orcl-read-this-before-placing-a-bet?cid=CS-STOCKNEWSAPI-FT-fundamental_analysis|average_broker_rating-2283217,https://images.financialmodelingprep.com/news/brokers-suggest-investing-in-oracle-orcl-read-this-before-20240604.jpg
ORCL,2024-06-11,2024-05-28,2024-06-25,ORCL,,2024-06-04 16:05:00,2024-06-04T16:05:00-04:00,2024-06-04,Oracle Sets the Date for its Fourth Quarter Fiscal Year 2024 Earnings Announcement,"Earnings Results to be released on June 11, 2024, After the Close of the Market AUSTIN, Texas , June 4, 2024 /PRNewswire/ -- Oracle Corporation today announced that its fourth quarter and fiscal year 2024 results will be released on Tuesday, June 11th, after the close of the market.  Oracle will host a conference call and live webcast at 4:00 p.m.",prnewswire.com,https://www.prnewswire.com/news-releases/oracle-sets-the-date-for-its-fourth-quarter-fiscal-year-2024-earnings-announcement-302163708.html,https://images.financialmodelingprep.com/news/oracle-sets-the-date-for-its-fourth-quarter-fiscal-20240604.jpg
ORCL,2024-06-11,2024-05-28,2024-06-25,ORCL,,2024-06-05 02:05:19,2024-06-05T02:05:19-04:00,2024-06-05,"Oracle: Strong EPS Growth Expected In 2025 And 2026, Watching Q4 Margins (Rating Upgrade)","Semiconductor stocks are outperforming software companies amid an AI arms race, leaving some SaaS firms attractively priced. Ahead of earnings next week, I am upgrading shares of Oracle from a hold to a buy, but its SaaS figures and margins will be key to watch. ORCL sports solid free cash flow and low-20s earnings multiple while its chart continues to consolidate.",seekingalpha.com,https://seekingalpha.com/article/4697468-oracle-strong-eps-growth-expected-in-2025-and-26-watching-q4-margins-rating-upgrade,https://images.financialmodelingprep.com/news/oracle-strong-eps-growth-expected-in-2025-and-2026-20240605.jpg
ORCL,2024-06-11,2024-05-28,2024-06-25,ORCL,,2024-06-05 06:30:00,2024-06-05T06:30:00-04:00,2024-06-05,3 S&P 500 Stocks to Buy in June Before They Ascend to New Heights,"As the month of June kicks off, there are several S&P 500 stocks to buy that showcase a promising future. With market sentiment shifting in response to global events, inflation data and Federal Reserve policies, investors remain keen to identify stocks with substantial growth potential.",investorplace.com,https://investorplace.com/2024/06/3-sp-500-stocks-to-buy-in-june-before-they-ascend-to-new-heights/,https://images.financialmodelingprep.com/news/3-sp-500-stocks-to-buy-in-june-before-20240605.jpg
ORCL,2024-06-11,2024-05-28,2024-06-25,ORCL,,2024-06-05 10:05:29,2024-06-05T10:05:29-04:00,2024-06-05,Oracle Corporation (ORCL) Is a Trending Stock: Facts to Know Before Betting on It,"Oracle (ORCL) has been one of the stocks most watched by Zacks.com users lately. So, it is worth exploring what lies ahead for the stock.",zacks.com,https://www.zacks.com/stock/news/2283813/oracle-corporation-orcl-is-a-trending-stock-facts-to-know-before-betting-on-it?cid=CS-STOCKNEWSAPI-FT-tale_of_the_tape|most_searched_stocks-2283813,https://images.financialmodelingprep.com/news/oracle-corporation-orcl-is-a-trending-stock-facts-to-20240605.jpg
ORCL,2024-06-11,2024-05-28,2024-06-25,ORCL,,2024-06-05 12:06:17,2024-06-05T12:06:17-04:00,2024-06-05,Does Oracle's (ORCL) Healthcare Roster Suggest Bright Prospects?,Oracle's (ORCL) portfolio of offerings and increased adoption in the healthcare sector are expected to aid top-line growth in the near term.,zacks.com,https://www.zacks.com/stock/news/2284216/does-oracle-s-orcl-healthcare-roster-suggest-bright-prospects?cid=CS-STOCKNEWSAPI-FT-analyst_blog|company_news_tech_sector-2284216,https://images.financialmodelingprep.com/news/does-oracles-orcl-healthcare-roster-suggest-bright-prospects-20240605.jpg
ORCL,2024-06-11,2024-05-28,2024-06-25,ORCL,,2024-06-06 09:00:03,2024-06-06T09:00:03-04:00,2024-06-06,"Up 14% YTD, How Will Oracle Stock Trend After Q4 Results?","Oracle (NYSE: ORCL) stock has gained 14% YTD as compared to the 11% rise in the S&P 500 index. Notable, its peer Salesforce (NYSE: CRM) stock was up 10% over the same period.",forbes.com,https://www.forbes.com/sites/greatspeculations/2024/06/06/up-14-ytd-how-will-oracle-stock-trend-after-q4-results/,https://images.financialmodelingprep.com/news/up-14-ytd-how-will-oracle-stock-trend-after-20240606.jpg
ORCL,2024-06-11,2024-05-28,2024-06-25,ORCL,,2024-06-06 09:58:12,2024-06-06T09:58:12-04:00,2024-06-06,Buy Alert: 2 Top Dividend Stocks To Buy In June,Selling in May and going away doesn't work.,seekingalpha.com,https://seekingalpha.com/article/4697771-buy-alert-2-top-dividend-stocks-to-buy-in-june,https://images.financialmodelingprep.com/news/buy-alert-2-top-dividend-stocks-to-buy-in-20240606.jpg
ORCL,2024-06-11,2024-05-28,2024-06-25,ORCL,,2024-06-06 10:15:32,2024-06-06T10:15:32-04:00,2024-06-06,Stay Ahead of the Game With Oracle (ORCL) Q4 Earnings: Wall Street's Insights on Key Metrics,"Looking beyond Wall Street's top -and-bottom-line estimate forecasts for Oracle (ORCL), delve into some of its key metrics to gain a deeper insight into the company's potential performance for the quarter ended May 2024.",zacks.com,https://www.zacks.com/stock/news/2284545/stay-ahead-of-the-game-with-oracle-orcl-q4-earnings-wall-street-s-insights-on-key-metrics?cid=CS-STOCKNEWSAPI-FT-fundamental_analysis|nfm_preview-2284545,https://images.financialmodelingprep.com/news/stay-ahead-of-the-game-with-oracle-orcl-q4-20240606.jpg
ORCL,2024-06-11,2024-05-28,2024-06-25,ORCL,,2024-06-06 15:37:00,2024-06-06T15:37:00-04:00,2024-06-06,Unleashing the Power of Tech Stocks: 7 Must-Have Investments Now,Technology connects billions of people and has changed how we communicate and obtain information.  It's hard to think of a time when people had to trudge through the rain to get to their local library.,investorplace.com,https://investorplace.com/2024/06/unleashing-the-power-of-tech-stocks-7-must-have-investments-now/,https://images.financialmodelingprep.com/news/unleashing-the-power-of-tech-stocks-7-musthave-investments-20240606.png
ORCL,2024-06-11,2024-05-28,2024-06-25,ORCL,,2024-06-07 10:18:50,2024-06-07T10:18:50-04:00,2024-06-07,Oracle seen delivering higher revenues on cloud strength for fiscal Q4,"Oracle Corp (NYSE:ORCL, ETR:ORC) is expected to report higher sales but a modest decline in profits for the fiscal fourth quarter when it hands down its latest quarterly results after the stock market closes on Tuesday, June 11. The cloud services provider is expected to report a 5.2% increase in sales to $14.56 billion from $13.84 billion in the year-ago quarter.",proactiveinvestors.com,https://www.proactiveinvestors.com/companies/news/1049407,https://images.financialmodelingprep.com/news/oracle-seen-delivering-higher-revenues-on-cloud-strength-for-20240607.jpg
ORCL,2024-06-11,2024-05-28,2024-06-25,ORCL,,2024-06-07 11:13:30,2024-06-07T11:13:30-04:00,2024-06-07,"Oracle Stock, Broadcom Show Strength Ahead Of Earnings; Adobe Stuck In Downtrend",Oracle stock surged on March 12 the last time the software giant reported earnings. Oracle bulls are hoping for a similar reaction Tuesday.,investors.com,https://www.investors.com/research/earnings-preview/oracle-stock-broadcom-show-strength-ahead-of-earnings-adobe-stuck-in-downtrend/,https://images.financialmodelingprep.com/news/oracle-stock-broadcom-show-strength-ahead-of-earnings-adobe-20240607.jpg
ORCL,2024-06-11,2024-05-28,2024-06-25,ORCL,,2024-06-07 12:31:20,2024-06-07T12:31:20-04:00,2024-06-07,Assessing Oracle (ORCL) Stock Ahead of Q4 Earnings Release,"Oracle's (ORCL) fourth-quarter results are likely to reflect its progress in driving cloud adoption, leveraging strategic partnerships and delivering innovative AI solutions amid stiff competition.",zacks.com,https://www.zacks.com/stock/news/2285443/assessing-oracle-orcl-stock-ahead-of-q4-earnings-release?cid=CS-STOCKNEWSAPI-FT-analyst_blog|most_popular_stocks-2285443,https://images.financialmodelingprep.com/news/assessing-oracle-orcl-stock-ahead-of-q4-earnings-release-20240607.jpg
ORCL,2024-06-11,2024-05-28,2024-06-25,ORCL,,2024-06-08 09:27:31,2024-06-08T09:27:31-04:00,2024-06-08,What You Need To Know Ahead of Oracle's Earnings Report,"Oracle (ORCL) is set to report earnings for the fourth quarter of fiscal 2024 after the bell on Tuesday, with investors watching for cloud infrastructure growth and strategy updates about sovereign artificial intelligence (AI).",investopedia.com,https://www.investopedia.com/oracle-q4-fy-2024-earnings-preview-8660219,https://images.financialmodelingprep.com/news/what-you-need-to-know-ahead-of-oracles-earnings-20240608.jpg
ORCL,2024-06-11,2024-05-28,2024-06-25,ORCL,,2024-06-10 09:00:00,2024-06-10T09:00:00-04:00,2024-06-10,Should You Buy Oracle Stock Before June 11?,Oracle is capitalizing on the growing popularity of artificial intelligence.,fool.com,https://www.fool.com/investing/2024/06/10/should-you-buy-oracle-stock-before-june-11/,https://images.financialmodelingprep.com/news/should-you-buy-oracle-stock-before-june-11-20240610.jpg
ORCL,2024-06-11,2024-05-28,2024-06-25,ORCL,,2024-06-10 11:20:16,2024-06-10T11:20:16-04:00,2024-06-10,"Quiet Day Ahead of Fed, Inflation This Week","Last month, we were greeted with a +3.4% Inflation Rate and +3.6% on core CPI year over year.",zacks.com,https://www.zacks.com/stock/news/2286077/quiet-day-ahead-of-fed-inflation-this-week?cid=CS-STOCKNEWSAPI-FT-ahead_of_wall_street-2286077,https://images.financialmodelingprep.com/news/quiet-day-ahead-of-fed-inflation-this-week-20240610.jpg
ORCL,2024-06-11,2024-05-28,2024-06-25,ORCL,,2024-06-10 11:27:20,2024-06-10T11:27:20-04:00,2024-06-10,Oracle Likely To Report Lower Q4 Earnings; Here Are The Recent Forecast Changes From Wall Street's Most Accurate Analysts,"Oracle Corporation will release earnings results for its fourth quarter, after the closing bell on Tuesday.",benzinga.com,https://www.benzinga.com/trading-ideas/long-ideas/24/06/39253725/oracle-likely-to-report-lower-q4-earnings-here-are-the-recent-forecast-changes-from-wall,https://images.financialmodelingprep.com/news/oracle-likely-to-report-lower-q4-earnings-here-are-20240610.jpg
ORCL,2024-06-11,2024-05-28,2024-06-25,ORCL,,2024-06-10 11:55:00,2024-06-10T11:55:00-04:00,2024-06-10,Oracle Earnings Preview: Watch Operating Margin For 'Peak Oracle',"Street consensus is expecting $1.65 in EPS in $14.56 billion in revenue for expected yoy growth of -1% and +5% respectively. Operating income is expected to come in at $6.65 billion for expected yoy growth of 8%. Oracle is not an expensive stock on a valuation basis, but as an enterprise software vendor trying to find a strategy for AI, the growth is better in Microsoft as you'd expect since Azure and the Intelligent Cloud were both better suited for the cloud than Oracle's offering.",seekingalpha.com,https://seekingalpha.com/article/4698421-oracle-earnings-preview-watch-operating-margin-for-peak-oracle,https://images.financialmodelingprep.com/news/oracle-earnings-preview-watch-operating-margin-for-peak-oracle-20240610.jpg
ORCL,2024-06-11,2024-05-28,2024-06-25,ORCL,,2024-06-10 16:03:51,2024-06-10T16:03:51-04:00,2024-06-10,The 3 Best Tech Stocks to Buy in June 2024,"Tech stocks have been on a remarkable rally lately, largely fueled by investors capitalizing on the artificial intelligence (AI) hype. To a rather large extent, this trend is being fueled by Nvidia (NASDAQ: NVDA ).",investorplace.com,https://investorplace.com/2024/06/the-3-best-tech-stocks-to-buy-in-june-2024/,https://images.financialmodelingprep.com/news/the-3-best-tech-stocks-to-buy-in-june-20240610.png
ORCL,2024-06-11,2024-05-28,2024-06-25,ORCL,,2024-06-11 06:50:00,2024-06-11T06:50:00-04:00,2024-06-11,3 Ultra-Cheap Cloud Stocks Worth Watching in June,"As investors triple down on the hottest AI stocks this June, more value-oriented investors should look to some of the neglected cloud companies, many of which have AI upside of their own. Of course, many investors seem to be getting incredibly impatient when it comes to cloud software firms, even as they consistently pull the curtain on new AI features, innovations, functionality, and copilots.",investorplace.com,https://investorplace.com/2024/06/3-ultra-cheap-cloud-stocks-worth-watching-in-june/,https://images.financialmodelingprep.com/news/3-ultracheap-cloud-stocks-worth-watching-in-june-20240611.png
ORCL,2024-06-11,2024-05-28,2024-06-25,ORCL,,2024-06-11 08:17:01,2024-06-11T08:17:01-04:00,2024-06-11,"Academy Sports, Oracle And Other Top Stocks To Watch This Tuesday","With U.S. stock futures trading lower on Tuesday morning, some of the stocks that may grab investor focus today are as follows:",benzinga.com,https://www.benzinga.com/news/earnings/24/06/39268866/academy-sports-oracle-and-other-top-stocks-to-watch-this-tuesday,https://images.financialmodelingprep.com/news/academy-sports-oracle-and-other-top-stocks-to-watch-this-20240611.jpg
ORCL,2024-06-11,2024-05-28,2024-06-25,ORCL,,2024-06-11 08:48:05,2024-06-11T08:48:05-04:00,2024-06-11,How To Earn $500 A Month From Oracle Stock Ahead Of Q4 Earnings,"Oracle Corporation ORCL will release earnings results for its fourth quarter, after the closing bell on Tuesday.",benzinga.com,https://www.benzinga.com/news/earnings/24/06/39269691/how-to-earn-500-a-month-from-oracle-stock-ahead-of-q4-earnings,https://images.financialmodelingprep.com/news/how-to-earn-500-a-month-from-oracle-stock-20240611.jpg
ORCL,2024-06-11,2024-05-28,2024-06-25,ORCL,,2024-06-11 09:00:00,2024-06-11T09:00:00-04:00,2024-06-11,Ricoh Selects Rimini Street to Optimize and Secure its Oracle EBS and Oracle Database Instances,"LAS VEGAS--(BUSINESS WIRE)--Rimini Street, Inc. (Nasdaq: RMNI), a global provider of end-to-end enterprise software support, products and services, the leading third-party support provider for Oracle and SAP software, and a Salesforce and AWS partner, today announced that Ricoh Company, Ltd., a global leader in image processing and digital transformation solutions, has selected Rimini Support™ and Rimini Protect™ to safeguard and optimize its existing Oracle EBS and Oracle Database environments.",businesswire.com,https://www.businesswire.com/news/home/20240611454301/en/Ricoh-Selects-Rimini-Street-to-Optimize-and-Secure-its-Oracle-EBS-and-Oracle-Database-Instances/,https://images.financialmodelingprep.com/news/ricoh-selects-rimini-street-to-optimize-and-secure-its-20240611.jpg
ORCL,2024-06-11,2024-05-28,2024-06-25,ORCL,,2024-06-11 16:02:00,2024-06-11T16:02:00-04:00,2024-06-11,Oracle and Google Cloud Announce a Groundbreaking Multicloud Partnership,"Google Cloud will offer Oracle Cloud Infrastructure database services and high-speed network interconnect with Oracle     Partnership helps customers simplify cloud migration, multicloud deployment, and management     AUSTIN, Texas and SUNNYVALE, Calif. , June 11, 2024 /PRNewswire/ -- Oracle and Google Cloud today announced a partnership that gives customers the choice to combine Oracle Cloud Infrastructure (OCI) and Google Cloud technologies to help accelerate their application migrations and modernization.",prnewswire.com,https://www.prnewswire.com/news-releases/oracle-and-google-cloud-announce-a-groundbreaking-multicloud-partnership-302169907.html,https://images.financialmodelingprep.com/news/oracle-and-google-cloud-announce-a-groundbreaking-multicloud-partnership-20240611.jpg
ORCL,2024-06-11,2024-05-28,2024-06-25,ORCL,,2024-06-11 16:02:00,2024-06-11T16:02:00-04:00,2024-06-11,OpenAI Selects Oracle Cloud Infrastructure to Extend Microsoft Azure AI Platform,"AUSTIN, Texas , June 11, 2024 /PRNewswire/ -- Oracle, Microsoft, and OpenAl are partnering to extend the Microsoft Azure Al platform to Oracle Cloud Infrastructure (OCI) to provide additional capacity for OpenAl. OpenAI is the AI research and development company behind ChatGPT, which provides generative AI services to more than 100 million users every month.",prnewswire.com,https://www.prnewswire.com/news-releases/openai-selects-oracle-cloud-infrastructure-to-extend-microsoft-azure-ai-platform-302169896.html,https://images.financialmodelingprep.com/news/openai-selects-oracle-cloud-infrastructure-to-extend-microsoft-azure-20240611.jpg
