ticker,event_date,window_start,window_end,symbol,symbols,publishedDate,publishedDateET,date_et,title,text,site,url,image
ORCL,2024-06-11,2024-05-28,2024-06-25,ORCL,,2024-06-20 19:23:56,2024-06-20T19:23:56-04:00,2024-06-20,"AI Money: Nvidia Soars, Oracle Invests $1B in Spain","In a week of seismic shifts in the tech industry, Nvidia has claimed the title of world's most valuable company, surpassing a $3 trillion market cap on the back of soaring artificial intelligence (AI) demand, while Oracle announced a $1 billion investment in Spanish cloud infrastructure to compete with other cloud giants in Europe.",pymnts.com,https://www.pymnts.com/artificial-intelligence-2/2024/ai-money-nvidia-soars-oracle-invests-1b-in-spain/,https://images.financialmodelingprep.com/news/ai-money-nvidia-soars-oracle-invests-1b-in-spain-20240620.jpg
ORCL,2024-06-11,2024-05-28,2024-06-25,ORCL,,2024-06-21 09:50:50,2024-06-21T09:50:50-04:00,2024-06-21,Oracle (ORCL) Expands Cloud Presence in Spain With $1B Outlay,"Oracle (ORCL) announces plans to invest more than $1 billion to establish a third cloud region in Madrid, Spain.",zacks.com,https://www.zacks.com/stock/news/2291528/oracle-orcl-expands-cloud-presence-in-spain-with-1b-outlay?cid=CS-STOCKNEWSAPI-FT-analyst_blog|company_news_tech_sector-2291528,https://images.financialmodelingprep.com/news/oracle-orcl-expands-cloud-presence-in-spain-with-1b-20240621.jpg
ORCL,2024-06-11,2024-05-28,2024-06-25,ORCL,,2024-06-24 06:00:00,2024-06-24T06:00:00-04:00,2024-06-24,AI-Powered Oracle Clinical Digital Assistant Transforms Interactions Between Practitioners and Patients,"Generally available in the US for ambulatory clinics, the solution combines voice with generative AI to help eliminate EHR clicks, reduce provider burnout, and improve quality of care Early adopters report ""game-changing"" results, saving 20-40% in documentation time AUSTIN, Texas , June 24, 2024 /PRNewswire/ -- Oracle today announced general availability of the Oracle Clinical Digital Assistant for ambulatory clinics in the US. The mobile offering combines generative AI, clinical intelligence, multimodal voice and screen driven assistance, and simplified workflows into a single, unified solution that enables providers to give their full attention to the needs of their patients.",prnewswire.com,https://www.prnewswire.com/news-releases/ai-powered-oracle-clinical-digital-assistant-transforms-interactions-between-practitioners-and-patients-302179594.html,https://images.financialmodelingprep.com/news/aipowered-oracle-clinical-digital-assistant-transforms-interactions-between-practitioners-20240624.jpg
ORCL,2024-06-11,2024-05-28,2024-06-25,ORCL,,2024-06-24 10:18:12,2024-06-24T10:18:12-04:00,2024-06-24,Should You Buy Nvidia Stock Instead of Oracle Stock?,Oracle is one of the lesser-known companies benefiting from the boom in artificial intelligence facilitated by Nvidia and the advent of large language models.,fool.com,https://www.fool.com/investing/2024/06/24/should-you-buy-nvidia-stock-instead-of-oracle-stoc/,https://images.financialmodelingprep.com/news/should-you-buy-nvidia-stock-instead-of-oracle-stock-20240624.jpg
ORCL,2024-06-11,2024-05-28,2024-06-25,ORCL,,2024-06-24 12:00:00,2024-06-24T12:00:00-04:00,2024-06-24,Oracle Named a Leader in the 2024 Gartner® Magic Quadrant™ for Analytics and Business Intelligence Platforms,"Oracle recognized based on its Ability to Execute and Completeness of Vision AUSTIN, Texas , June 24, 2024 /PRNewswire/ -- Oracle has been named a Leader in the 2024 Gartner® Magic Quadrant™ for Analytics and Business Intelligence Platforms. Oracle was recognized based on its Ability to Execute and Completeness of Vision.",prnewswire.com,https://www.prnewswire.com/news-releases/oracle-named-a-leader-in-the-2024-gartner-magic-quadrant-for-analytics-and-business-intelligence-platforms-302180444.html,https://images.financialmodelingprep.com/news/oracle-named-a-leader-in-the-2024-gartner-magic-20240624.jpg
ORCL,2024-06-11,2024-05-28,2024-06-25,ORCL,,2024-06-24 17:57:34,2024-06-24T17:57:34-04:00,2024-06-24,Oracle warns that a TikTok ban would hurt business,"Oracle said a ban on TikTok in the U.S. could hurt revenue and profit. In April, President Joe Biden signed a bill demanding that ByteDance sell TikTok in nine months, or one year if an extension is approved, if the short-video company wants to avoid a ban in the U.S.",cnbc.com,https://www.cnbc.com/2024/06/24/oracle-warns-that-a-tiktok-ban-would-hurt-business.html,https://images.financialmodelingprep.com/news/oracle-warns-that-a-tiktok-ban-would-hurt-business-20240624.jpg
ORCL,2024-06-11,2024-05-28,2024-06-25,ORCL,,2024-06-25 06:31:41,2024-06-25T06:31:41-04:00,2024-06-25,TikTok's U.S. ban could cost Oracle up to $800 million,"A potential U.S. ban on TikTok may significantly impact Oracle's revenue, as the software giant acknowledged in its annual report released on Monday. This development follows President Joe Biden's April bill requiring ByteDance, TikTok's Chinese owner, to sell the platform within nine months to avoid a ban in the U.S.",invezz.com,https://invezz.com/news/2024/06/25/tiktoks-u-s-ban-could-cost-oracle-up-to-800-million/,https://images.financialmodelingprep.com/news/tiktoks-us-ban-could-cost-oracle-up-to-800-20240625.jpg
ORCL,2024-06-11,2024-05-28,2024-06-25,ORCL,,2024-06-25 08:00:00,2024-06-25T08:00:00-04:00,2024-06-25,Oracle Cloud Helps Health Insurers Reduce Data Complexity and IT Costs,"New Oracle Health Insurance Data Exchange Cloud Service simplifies and secures data exchange with CMS and employer groups AUSTIN, Texas , June 25, 2024 /PRNewswire/ -- Oracle introduced the Oracle Health Insurance Data Exchange Cloud Service, a new solution their complex data exchange needs. With the ability to create custom data mapping and designed to help healthcare insurers more easily onboard evolving data formats and simplify validation rules, insurers can speed the processing of new and proprietary data formats, streamline integration with partners such as the Centers for Medicare and Medicaid Services (CMS), and reduce costly and time-consuming IT projects with a modern, secure data exchange solution.",prnewswire.com,https://www.prnewswire.com/news-releases/oracle-cloud-helps-health-insurers-reduce-data-complexity-and-it-costs-302180649.html,https://images.financialmodelingprep.com/news/oracle-cloud-helps-health-insurers-reduce-data-complexity-and-20240625.jpg
ORCL,2024-06-11,2024-05-28,2024-06-25,ORCL,,2024-06-25 10:11:27,2024-06-25T10:11:27-04:00,2024-06-25,Oracle (ORCL) Launches AI Assistant for Healthcare Providers,"Oracle (ORCL) announces the general availability of its Clinical Digital Assistant, an AI-powered tool designed to improve patient care in ambulatory clinics across the United States.",zacks.com,https://www.zacks.com/stock/news/2292931/oracle-orcl-launches-ai-assistant-for-healthcare-providers?cid=CS-STOCKNEWSAPI-FT-analyst_blog|company_news_tech_sector-2292931,https://images.financialmodelingprep.com/news/oracle-orcl-launches-ai-assistant-for-healthcare-providers-20240625.jpg
ORCL,2024-06-11,2024-05-28,2024-06-25,ORCL,,2024-06-25 12:08:14,2024-06-25T12:08:14-04:00,2024-06-25,Oracle says US ban of TikTok would hurt its profits,"The law “will make it unlawful to provide internet hosting services to TikTok,” an annual report published Monday read.",nypost.com,https://nypost.com/2024/06/25/business/oracle-says-us-ban-of-tiktok-would-hurt-its-profits/,https://images.financialmodelingprep.com/news/oracle-says-us-ban-of-tiktok-would-hurt-its-20240625.jpg
ORCL,2024-06-11,2024-05-28,2024-06-25,ORCL,,2024-06-25 16:59:05,2024-06-25T16:59:05-04:00,2024-06-25,ORCL Stock Alert: Is a TikTok Ban Enough to Kill Oracle?,"Across the United States, many people are still wondering whether TikTok will be banned in the country. Indeed, the popular content-creation app is facing an uncertain future after President Joe Biden signed a bill decreeing that ByteDance — the platform's Chinese parent company — will have to either sell the platform or face a U.S. ban.",investorplace.com,https://investorplace.com/2024/06/orcl-stock-alert-is-a-tiktok-ban-enough-to-kill-oracle/,https://images.financialmodelingprep.com/news/orcl-stock-alert-is-a-tiktok-ban-enough-to-20240625.jpg
