ticker,event_date,window_start,window_end,symbol,symbols,publishedDate,publishedDateET,date_et,title,text,site,url,image
COST,2023-09-26,2023-09-19,2023-10-10,COST,,2023-10-04 16:33:00,2023-10-04T16:33:00-04:00,2023-10-04,Costco notches gain in same-store sales for September,"Costco Wholesale Corp. COST, +1.20% on Wednesday said that total same-store sales rose 4.5% in September, better than the pace it reported for August and its fiscal fourth quarter. Same-store sales were up 3.2% in the U.S. and 6.7% in Canada through the five weeks ending Oct. 1.",marketwatch.com,https://www.marketwatch.com/story/costco-notches-gain-in-same-store-sales-for-september-ca99b196,https://images.financialmodelingprep.com/news/costco-notches-gain-in-samestore-sales-for-september-20231004.jpg
COST,2023-09-26,2023-09-19,2023-10-10,COST,,2023-10-05 07:00:00,2023-10-05T07:00:00-04:00,2023-10-05,"Costco's 24-carat gold bars are priced at about $1,950 — and reportedly selling out. Should you buy these, or gold in general, right now?","For between $60-$120 a year, Costco members enjoy deeply discounted household essentials, grocery items and more. The retailer has even branched out into some, um, more unique offerings such as engagement rings, swimming pools and even caskets, at low prices.",marketwatch.com,https://www.marketwatch.com/story/costcos-24-carat-gold-bars-are-priced-at-about-1-950-and-reportedly-selling-out-should-you-buy-these-or-gold-in-general-right-now-ce154744,https://images.financialmodelingprep.com/news/costcos-24carat-gold-bars-are-priced-at-about-1950-and-20231005.jpg
COST,2023-09-26,2023-09-19,2023-10-10,COST,,2023-10-05 07:57:00,2023-10-05T07:57:00-04:00,2023-10-05,3 Blue-Chip Stocks Ready to Break Out This Quarter,"Making stock predictions is challenging, but historical market data does provide useful insights. Since 1928, the average change in the S&P 500 index has been positive for each month of Q4.",investorplace.com,https://investorplace.com/2023/10/3-blue-chip-stocks-ready-to-break-out-this-quarter/,https://images.financialmodelingprep.com/news/3-bluechip-stocks-ready-to-break-out-this-quarter-20231005.jpg
COST,2023-09-26,2023-09-19,2023-10-10,COST,,2023-10-05 08:11:57,2023-10-05T08:11:57-04:00,2023-10-05,Costco delivers strong growth in sales in September,"Costco Wholesale Corporation (NASDAQ:COST) reported a solid rise in same-store sales in September boosted by growth in Canada and in its international business. Net sales totalled $22.75 billion for the retail month of September, the five weeks ended October 1, an increase of 6.0% from $21.46 billion last year.",proactiveinvestors.com,https://www.proactiveinvestors.com/companies/news/1028831?SNAPI,https://images.financialmodelingprep.com/news/costco-delivers-strong-growth-in-sales-in-september-20231005.jpg
COST,2023-09-26,2023-09-19,2023-10-10,COST,,2023-10-05 09:04:29,2023-10-05T09:04:29-04:00,2023-10-05,This Is What Airbnb Has In Common With Costco And Amazon,"Airbnb's stock has experienced high volatility, and it is currently seeing a strong pullback. I believe that Airbnb's profitability and growth trajectory make it a winner of the next decade. Airbnb's balance sheet reveals a hidden asset in the form of unearned fees, which contributes to its profitability.",seekingalpha.com,https://seekingalpha.com/article/4639172-this-is-what-airbnb-has-in-common-with-costco-and-amazon,https://images.financialmodelingprep.com/news/this-is-what-airbnb-has-in-common-with-costco-20231005.jpg
COST,2023-09-26,2023-09-19,2023-10-10,COST,,2023-10-05 09:45:00,2023-10-05T09:45:00-04:00,2023-10-05,"Stock Split Watch: 1 Growth Stock Up 157% in 5 Years to Buy Now, According to Wall Street","Costco's shares have nearly tripled the return of the benchmark S&P 500 over the last five years, . The retailer topped expectations in its latest quarter though pressures still weigh on the consumer.",fool.com,https://www.fool.com/investing/2023/10/05/stock-split-watch-1-growth-stock-up-157-to-buy-now/,https://images.financialmodelingprep.com/news/stock-split-watch-1-growth-stock-up-157-in-20231005.jpg
COST,2023-09-26,2023-09-19,2023-10-10,COST,,2023-10-05 10:31:29,2023-10-05T10:31:29-04:00,2023-10-05,Costco Wholesale Corporation (COST) Is a Trending Stock: Facts to Know Before Betting on It,"Recently, Zacks.com users have been paying close attention to Costco (COST). This makes it worthwhile to examine what the stock has in store.",zacks.com,https://www.zacks.com/stock/news/2160667/costco-wholesale-corporation-cost-is-a-trending-stock-facts-to-know-before-betting-on-it,https://images.financialmodelingprep.com/news/costco-wholesale-corporation-cost-is-a-trending-stock-facts-20231005.jpg
COST,2023-09-26,2023-09-19,2023-10-10,COST,,2023-10-05 12:02:12,2023-10-05T12:02:12-04:00,2023-10-05,Costco's (COST) Comparable Sales Display Strength in September,Costco's (COST) distinctive membership business model and pricing power set it apart from traditional players. Comparable sales for the retail month of September rise 4.5%.,zacks.com,https://www.zacks.com/stock/news/2160882/costco-s-cost-comparable-sales-display-strength-in-september,https://images.financialmodelingprep.com/news/costcos-cost-comparable-sales-display-strength-in-september-20231005.jpg
COST,2023-09-26,2023-09-19,2023-10-10,COST,,2023-10-05 19:02:14,2023-10-05T19:02:14-04:00,2023-10-05,Costco: Unlikely To Provide Meaningful Returns Going Forward,"Costco has shown consistent revenue growth and profitability, with a loyal membership base. Despite their profitability, they trade at a substantial premium relative to their cash flow. Given the headwinds of inflation and shaky e-commerce growth, I believe COST is a Strong Sell.",seekingalpha.com,https://seekingalpha.com/article/4639283-costco-unlikely-to-provide-meaningful-returns-going-forward,https://images.financialmodelingprep.com/news/costco-unlikely-to-provide-meaningful-returns-going-forward-20231005.jpg
COST,2023-09-26,2023-09-19,2023-10-10,COST,,2023-10-06 05:48:00,2023-10-06T05:48:00-04:00,2023-10-06,1 Number That Shows Why Costco Trades at a Premium to Its Competitors,Costco trades at a significant premium to its retail peers. The company's return on capital is roughly double that of Walmart.,fool.com,https://www.fool.com/investing/2023/10/06/1-number-that-shows-why-costco-trades-at-a-premium/,https://images.financialmodelingprep.com/news/1-number-that-shows-why-costco-trades-at-a-20231006.jpg
COST,2023-09-26,2023-09-19,2023-10-10,COST,,2023-10-06 09:00:00,2023-10-06T09:00:00-04:00,2023-10-06,"Costco: So Many Things To Like, Except One","Costco has experienced strong growth over the past decade, outperforming its largest competitor Walmart. The company has a strong business model, offering low prices and high-quality products to its members. Costco has a history of paying dividends and has also rewarded shareholders with special dividends, as well as implementing a share buyback program.",seekingalpha.com,https://seekingalpha.com/article/4638766-costco-many-things-to-like-except-one,https://images.financialmodelingprep.com/news/costco-so-many-things-to-like-except-one-20231006.jpg
COST,2023-09-26,2023-09-19,2023-10-10,COST,,2023-10-06 10:00:00,2023-10-06T10:00:00-04:00,2023-10-06,Is This the Single Biggest Bear Argument for Costco Stock?,"The mammoth retailer's historical financial performance has been stellar. Its stock has richly rewarded investors, but it trades at an expensive multiple today.",fool.com,https://www.fool.com/investing/2023/10/06/is-this-the-single-biggest-bear-argument-costco/,https://images.financialmodelingprep.com/news/is-this-the-single-biggest-bear-argument-for-costco-20231006.jpg
COST,2023-09-26,2023-09-19,2023-10-10,COST,,2023-10-06 12:06:00,2023-10-06T12:06:00-04:00,2023-10-06,Walmart and Costco lead selloff of consumer-staple stocks after jobs report ignites rate hike worries,"Consumer staples companies fell across the board on Friday, after a stronger-than-expected September jobs report raised concerns it may lead the Federal Reserve to again hike interest rates.",marketwatch.com,https://www.marketwatch.com/story/walmart-and-costco-lead-selloff-of-consumer-staple-stocks-after-jobs-report-ignites-rate-hike-worries-7fcc628a,https://images.financialmodelingprep.com/news/walmart-and-costco-lead-selloff-of-consumerstaple-stocks-after-jobs-20231006.jpg
COST,2023-09-26,2023-09-19,2023-10-10,COST,,2023-10-06 13:25:36,2023-10-06T13:25:36-04:00,2023-10-06,Food retailers and producers are getting slammed as GLP-1 drugs like Ozempic raise growing alarms about demand,"The rise of GLP-1 drugs is driving consumer staples stocks lower as patients eat less food. Shares of PepsiCo, Coca-Cola, Walmart, and Costco have been slammed on the prospect of less food demand.",markets.businessinsider.com,https://markets.businessinsider.com/news/stocks/glp1-weight-loss-drugs-ozempic-walmart-stock-costco-cocacola-pepsico-2023-10,https://images.financialmodelingprep.com/news/food-retailers-and-producers-are-getting-slammed-as-glp1-drugs-20231006.jpg
COST,2023-09-26,2023-09-19,2023-10-10,COST,,2023-10-06 14:10:00,2023-10-06T14:10:00-04:00,2023-10-06,Why Costco Stock Was Slipping Today,A Walmart exec said new weight-loss drugs were starting to have an impact on grocery sales. Costco makes a majority of its sales from groceries.,fool.com,https://www.fool.com/investing/2023/10/06/why-costco-stock-was-slipping-today/,https://images.financialmodelingprep.com/news/why-costco-stock-was-slipping-today-20231006.jpg
COST,2023-09-26,2023-09-19,2023-10-10,COST,,2023-10-07 09:37:00,2023-10-07T09:37:00-04:00,2023-10-07,Is Costco Wholesale a Healthcare Stock Now?,Costco is known for selling goods and services in bulk and at mass scale. Primary care health checkups are one of those services now.,fool.com,https://www.fool.com/investing/2023/10/07/is-costco-wholesale-a-healthcare-stock-now/,https://images.financialmodelingprep.com/news/is-costco-wholesale-a-healthcare-stock-now-20231007.jpg
COST,2023-09-26,2023-09-19,2023-10-10,COST,,2023-10-07 09:53:00,2023-10-07T09:53:00-04:00,2023-10-07,Better Buy: Costco vs. BJ's Wholesale Club,Costco is growing faster and has a larger base of members. Shares of smaller rival BJ's Wholesale are valued at a discount.,fool.com,https://www.fool.com/investing/2023/10/07/better-buy-costco-vs-bjs-wholesale-club/,https://images.financialmodelingprep.com/news/better-buy-costco-vs-bjs-wholesale-club-20231007.jpg
COST,2023-09-26,2023-09-19,2023-10-10,COST,,2023-10-09 04:14:10,2023-10-09T04:14:10-04:00,2023-10-09,Here's Why Costco Can Continue To Beat The Market Despite Rich Valuation,"Costco is the face of the high quality vs. rich valuation arguments among investors. On one side, we have a company with over 127 million loyal customers, who pay an annual fee to shop at Costco's warehouses, which are unparalleled in their value proposition. On the other side, there's a stock trading at a 36x P/E, much higher than the market's average, and above the levels of other extraordinary and faster-growing companies.",seekingalpha.com,https://seekingalpha.com/article/4639654-why-costco-can-continue-to-beat-market-despite-rich-valuation,https://images.financialmodelingprep.com/news/heres-why-costco-can-continue-to-beat-the-market-20231009.jpg
COST,2023-09-26,2023-09-19,2023-10-10,COST,,2023-10-09 08:42:02,2023-10-09T08:42:02-04:00,2023-10-09,"No Tricks, Just 3 Sweet Treats for Your Portfolio in October","It's time to look at some sweet treats with Halloween just approaching. Whether the economy is expanding or in recession, a sweet tooth will always crave sweets.",marketbeat.com,https://www.marketbeat.com/originals/no-tricks-just-3-sweet-treats-for-your-portfolio-in-october/?utm_source=snapi,https://images.financialmodelingprep.com/news/no-tricks-just-3-sweet-treats-for-your-portfolio-20231009.jpg
COST,2023-09-26,2023-09-19,2023-10-10,COST,,2023-10-09 12:54:52,2023-10-09T12:54:52-04:00,2023-10-09,3 Stocks I Bet Warren Buffett Wishes He Held Onto,"Warren Buffett is widely considered the greatest investor of all-time. His holding company, Berkshire Hathaway (NYSE: BRK-A /NYSE: BRK-B ) has a vast investment portfolio currently worth $340 billion.",investorplace.com,https://investorplace.com/2023/10/3-stocks-i-bet-warren-buffett-wishes-he-held-onto/,https://images.financialmodelingprep.com/news/3-stocks-i-bet-warren-buffett-wishes-he-held-20231009.jpg
COST,2023-09-26,2023-09-19,2023-10-10,COST,,2023-10-10 08:52:00,2023-10-10T08:52:00-04:00,2023-10-10,"Like It or Not, Costco's Sales Growth Is Slowing","This year's comparable-store sales growth is below the company's pre-pandemic average. The slowdown could be the result of closer proximity to competitors' stores, or even sheer retail saturation.",fool.com,https://www.fool.com/investing/2023/10/10/like-it-or-not-costcos-sales-growth-is-slowing/,https://images.financialmodelingprep.com/news/like-it-or-not-costcos-sales-growth-is-slowing-20231010.jpg
COST,2023-09-26,2023-09-19,2023-10-10,COST,,2023-10-10 09:38:07,2023-10-10T09:38:07-04:00,2023-10-10,Costco accused of sharing customers' ‘highly personal' health data with Facebook owner Meta,"Court documents filed in Seattle federal court claim that Costco installed Meta Pixel on its website, and the analytical tool handed over a swath of users' personal data to the Facebook parent company without consent.",nypost.com,https://nypost.com/2023/10/10/costco-accused-of-sharing-customers-health-data-with-meta/,https://images.financialmodelingprep.com/news/costco-accused-of-sharing-customers-highly-personal-health-data-20231010.jpg
COST,2023-09-26,2023-09-19,2023-10-10,COST,,2023-10-10 12:01:24,2023-10-10T12:01:24-04:00,2023-10-10,4 Stocks From the Buoyant Retail Discount Store Space,"Better pricing, effective inventory management and operational initiatives are likely to drive Retail - Discount Stores companies. Costco (COST), The TJX Companies (TJX), Target (TGT) and Ross Stores (ROST) look well-placed.",zacks.com,https://www.zacks.com/commentary/2163365/4-stocks-from-the-buoyant-retail-discount-store-space,https://images.financialmodelingprep.com/news/4-stocks-from-the-buoyant-retail-discount-store-space-20231010.jpg
COST,2023-09-26,2023-09-19,2023-10-10,COST,,2023-10-10 15:08:47,2023-10-10T15:08:47-04:00,2023-10-10,Stock Superstars: A Look at Q3 Earning's Top 3 Performers,"Wagering on the top earnings performers is always a wise strategy in navigating your portfolio toward stability. Undeniably, a gentle undercurrent of optimism courses through, as evidenced by the S&P 500 Index, with a 13% uptick this year.",investorplace.com,https://investorplace.com/2023/10/stock-superstars-a-look-at-q3-earnings-top-3-performers/,https://images.financialmodelingprep.com/news/stock-superstars-a-look-at-q3-earnings-top-3-20231010.jpg
