ticker,event_date,window_start,window_end,symbol,symbols,publishedDate,publishedDateET,date_et,title,text,site,url,image
NVDA,2022-11-16,2022-11-02,2022-11-30,NVDA,,2022-11-21 16:15:15,2022-11-21T16:15:15-05:00,2022-11-21,"Nvidia: Gaming Scales Balancing Out, Buy",We continue to be buy-rated on Nvidia Corporation. The stock has rebounded 22% since we moved it to a buy in late October. We believe Nvidia has already put the gaming weakness behind it and believe the downside of crypto-mining GPU demand has been priced into the stock.,seekingalpha.com,https://seekingalpha.com/article/4559628-nvda-gaming-scales-balancing-out-buy,https://images.financialmodelingprep.com/news/nvidia-gaming-scales-balancing-out-buy-20221121.jpg
NVDA,2022-11-16,2022-11-02,2022-11-30,NVDA,,2022-11-21 21:28:00,2022-11-21T21:28:00-05:00,2022-11-21,We've Slashed Our Fair Value Estimate Of Nvidia,"Nvidia is facing headwinds from supply chain hurdles and inflation, gaming revenue weakness, and elevated inventory levels, though we continue to believe its long-term growth outlook is bright. That said, we've cut our fair value estimate since our last update to account for near-term recessionary conditions and more conservative assumptions within our discounted cash flow framework.",seekingalpha.com,https://seekingalpha.com/article/4559674-nvidia-nvda-stock-slashed-fair-value-estimate,https://images.financialmodelingprep.com/news/weve-slashed-our-fair-value-estimate-of-nvidia-20221121.jpg
NVDA,2022-11-16,2022-11-02,2022-11-30,NVDA,,2022-11-21 23:06:49,2022-11-21T23:06:49-05:00,2022-11-21,Micron Vs. Nvidia - One Is Clearly Better,Micron Technology and NVIDIA have both taken hits this year. Weakness in chip demand has led to declining shipments by both companies.,seekingalpha.com,https://seekingalpha.com/article/4559691-micron-nvidia-stock-better-buy,https://images.financialmodelingprep.com/news/micron-vs-nvidia-one-is-clearly-better-20221121.jpg
NVDA,2022-11-16,2022-11-02,2022-11-30,NVDA,,2022-11-22 06:10:00,2022-11-22T06:10:00-05:00,2022-11-22,3 Under-the-Radar Gaming Stocks You Can Buy and Hold for the Next Decade,"Looking to invest in gaming? Nvidia, Corsair Gaming, and Warner Bros.",fool.com,https://www.fool.com/investing/2022/11/22/under-the-radar-gaming-stocks-for-next-decade/,https://images.financialmodelingprep.com/news/3-undertheradar-gaming-stocks-you-can-buy-and-hold-for-20221122.jpg
NVDA,2022-11-16,2022-11-02,2022-11-30,NVDA,,2022-11-22 06:31:13,2022-11-22T06:31:13-05:00,2022-11-22,NVIDIA Corporation: Too Many Comeback Catalysts to Ignore,"Despite being down nearly 50% year-to-date, Nvidia has access to an expanding set of end markets and growth opportunities that could translate to a comeback.",marketbeat.com,https://www.marketbeat.com/originals/nvidia-corporation-too-many-comeback-catalysts-to-ignore/?SNAPI,https://images.financialmodelingprep.com/news/nvidia-corporation-too-many-comeback-catalysts-to-ignore-20221122.jpg
NVDA,2022-11-16,2022-11-02,2022-11-30,NVDA,,2022-11-22 13:10:00,2022-11-22T13:10:00-05:00,2022-11-22,Nvidia: Here We Go Again,"Over the course of its short lifespan, NVDA has had to reinvent itself three times. It is clear that there are some business segments, particularly with Data Center and Automotive, that are continuing to reach new heights, whereas Gaming and Professional Visualization continue to work through noticeable issues.",seekingalpha.com,https://seekingalpha.com/article/4559886-nvidia-here-we-go-again,https://images.financialmodelingprep.com/news/nvidia-here-we-go-again-20221122.jpg
NVDA,2022-11-16,2022-11-02,2022-11-30,NVDA,,2022-11-22 14:57:35,2022-11-22T14:57:35-05:00,2022-11-22,"Nvidia: Goodbye Crypto, Hello AI","While Nvidia's revenue prospects from the crypto mining sector seem to have been left behind, AI shows great promise. We view Nvidia as a buy at current price levels, even more so if it trends toward its October lows.",seekingalpha.com,https://seekingalpha.com/article/4559930-nvidia-nvda-stock-goodbye-crypto-hello-ai,https://images.financialmodelingprep.com/news/nvidia-goodbye-crypto-hello-ai-20221122.jpg
NVDA,2022-11-16,2022-11-02,2022-11-30,NVDA,,2022-11-23 06:30:00,2022-11-23T06:30:00-05:00,2022-11-23,A New Tailwind Emerges for Nvidia Stock -- Share Repurchases,Nvidia is a better value than many investors think it is.,fool.com,https://www.fool.com/investing/2022/11/23/a-new-tailwind-emerges-for-nvidia-stock-share-repu/,https://images.financialmodelingprep.com/news/a-new-tailwind-emerges-for-nvidia-stock-share-repurchases-20221123.jpg
NVDA,2022-11-16,2022-11-02,2022-11-30,NVDA,,2022-11-23 08:15:00,2022-11-23T08:15:00-05:00,2022-11-23,Nvidia's Most Important Segment Is Slowing. Should You Sell the Stock?,Data center growth was nearly flat compared to last quarter -- a troubling sign.,fool.com,https://www.fool.com/investing/2022/11/23/nvidias-most-important-segment-is-slowing-should-y/,https://images.financialmodelingprep.com/news/nvidias-most-important-segment-is-slowing-should-you-sell-20221123.jpg
NVDA,2022-11-16,2022-11-02,2022-11-30,NVDA,,2022-11-23 11:35:11,2022-11-23T11:35:11-05:00,2022-11-23,"Dear Semiconductor Stocks Fans, Mark Your Calendars for Nov. 29","One of President Joe Biden's first stops after Thanksgiving 2022 will be to Bay City, Michigan. On Sept. 1, Governor Gretchen Whitmer celebrated the opening of the city's new semiconductor wafer manufacturing plant.",investorplace.com,https://investorplace.com/2022/11/dear-semiconductor-stocks-fans-mark-your-calendars-for-nov-29/,https://images.financialmodelingprep.com/news/dear-semiconductor-stocks-fans-mark-your-calendars-for-nov-29-20221123.jpg
NVDA,2022-11-16,2022-11-02,2022-11-30,NVDA,,2022-11-23 14:24:00,2022-11-23T14:24:00-05:00,2022-11-23,Stocks With China Exposure Are Rising With Reopening Hopes,"Evercore strategists say companies including Estée Lauder, Apple, and Nike with significant sales from China could rise if Covid lockdowns ease.",barrons.com,https://www.barrons.com/articles/stocks-china-exposure-reopening-hopes-51669231415,https://images.financialmodelingprep.com/news/stocks-with-china-exposure-are-rising-with-reopening-hopes-20221123.jpg
NVDA,2022-11-16,2022-11-02,2022-11-30,NVDA,,2022-11-24 06:18:18,2022-11-24T06:18:18-05:00,2022-11-24,What Nvidia's New Text-To-3D Means For Engineering & Product Design,"Magic3D is reportedly over twice as fast as DreamFusion, published less than 2 months prior. The rapid changes in Generative AI have huge implications for engineering and manufacturing.",forbes.com,https://www.forbes.com/sites/andrewegner/2022/11/24/what-nvidias-new-text-to-3d-means-for-engineering--product-design/,https://images.financialmodelingprep.com/news/what-nvidias-new-textto3d-means-for-engineering-product-design-20221124.jpg
NVDA,2022-11-16,2022-11-02,2022-11-30,NVDA,,2022-11-24 07:30:00,2022-11-24T07:30:00-05:00,2022-11-24,Here's Nvidia's Fastest-Growing Segment -- and It's Not Data Center or Gaming,Nvidia positioned itself as a leader in this small but rapidly growing industry.,fool.com,https://www.fool.com/investing/2022/11/24/heres-nvidias-fastest-growing-data-center-gaming/,https://images.financialmodelingprep.com/news/heres-nvidias-fastestgrowing-segment-and-its-not-data-center-20221124.jpg
NVDA,2022-11-16,2022-11-02,2022-11-30,NVDA,,2022-11-25 07:00:00,2022-11-25T07:00:00-05:00,2022-11-25,What's Going On With Nvidia Stock?,The tech powerhouse has experienced several ups and downs in the last few weeks.,fool.com,https://www.fool.com/investing/2022/11/25/whats-going-on-with-nvidia-stock/,https://images.financialmodelingprep.com/news/whats-going-on-with-nvidia-stock-20221125.jpg
NVDA,2022-11-16,2022-11-02,2022-11-30,NVDA,,2022-11-25 13:37:26,2022-11-25T13:37:26-05:00,2022-11-25,3 Tech Stocks You Can Count on in This Uncertain Market,"2022 was a tough one for tech stocks. Most were walloped with higher interest rates, fears of aggressive rate hikes, geopolitical issues, economic concerns, and fed-up consumers.",investorplace.com,https://investorplace.com/2022/11/3-tech-stocks-you-can-count-on-in-this-uncertain-market/,https://images.financialmodelingprep.com/news/3-tech-stocks-you-can-count-on-in-this-uncertain-20221125.jpg
NVDA,2022-11-16,2022-11-02,2022-11-30,NVDA,,2022-11-26 08:00:00,2022-11-26T08:00:00-05:00,2022-11-26,What's Going On With Some of the Biggest Names in Retail?,Plus we've got an interview with Chewy CEO Sumit Singh.,fool.com,https://www.fool.com/investing/2022/11/26/whats-going-on-with-some-of-the-biggest-names-in-r/,https://images.financialmodelingprep.com/news/whats-going-on-with-some-of-the-biggest-names-20221126.jpg
NVDA,2022-11-16,2022-11-02,2022-11-30,NVDA,,2022-11-26 10:37:35,2022-11-26T10:37:35-05:00,2022-11-26,2 Quantum Computing Stocks To Watch Right Now,Are these the best quantum computing stocks to buy right now?,stockmarket.com,https://stockmarket.com/featured/2-quantum-computing-stocks-to-watch-right-now-2022-11-26,https://images.financialmodelingprep.com/news/2-quantum-computing-stocks-to-watch-right-now-20221126.jpg
NVDA,2022-11-16,2022-11-02,2022-11-30,NVDA,,2022-11-26 14:11:10,2022-11-26T14:11:10-05:00,2022-11-26,Analyst: these three tech stocks will do well in 2023,"Tech stocks sure have had a rough 2022 as the Fed moved to aggressively lift rates in hopes of taming record inflation. But the next year, as per a Senior Neuberger Berman analyst, could be a different story, at least for a handful of stocks in this space.",invezz.com,https://invezz.com/news/2022/11/26/three-tech-stocks-will-do-well-in-2023/,https://images.financialmodelingprep.com/news/analyst-these-three-tech-stocks-will-do-well-in-20221126.jpg
NVDA,2022-11-16,2022-11-02,2022-11-30,NVDA,,2022-11-27 05:10:00,2022-11-27T05:10:00-05:00,2022-11-27,Better Semiconductor Stock: Mobileye vs. Nvidia,Which of these chipmakers is a better investment right now?,fool.com,https://www.fool.com/investing/2022/11/27/better-semiconductor-stock-mobileye-vs-nvidia/,https://images.financialmodelingprep.com/news/better-semiconductor-stock-mobileye-vs-nvidia-20221127.jpg
NVDA,2022-11-16,2022-11-02,2022-11-30,NVDA,,2022-11-27 07:20:00,2022-11-27T07:20:00-05:00,2022-11-27,The Smartest Stocks to Buy With $20 Right Now and Hold Forever,These two stocks have important characteristics to drive long-term returns.,fool.com,https://www.fool.com/investing/2022/11/27/the-smartest-stocks-to-buy-with-20-right-now-and-h/,https://images.financialmodelingprep.com/news/the-smartest-stocks-to-buy-with-20-right-now-20221127.jpg
NVDA,2022-11-16,2022-11-02,2022-11-30,NVDA,,2022-11-27 09:00:00,2022-11-27T09:00:00-05:00,2022-11-27,Nvidia Stock Q&A With Wall Street Investors,Management went to great lengths to offer transparency to Nvidia stock investors.,fool.com,https://www.fool.com/investing/2022/11/27/nvidia-stock-qa-with-wall-street-investors/,https://images.financialmodelingprep.com/news/nvidia-stock-qa-with-wall-street-investors-20221127.jpg
NVDA,2022-11-16,2022-11-02,2022-11-30,NVDA,,2022-11-27 09:24:32,2022-11-27T09:24:32-05:00,2022-11-27,Top Wall Street analysts say buy these stocks during a market downturn,"TipRanks analyst ranking service pinpoints Wall Street's best-performing stocks, including Disney and Nvidia.",cnbc.com,https://www.cnbc.com/2022/11/27/top-wall-street-analysts-say-buy-stocks-like-disney-nvidia.html,https://images.financialmodelingprep.com/news/top-wall-street-analysts-say-buy-these-stocks-during-20221127.jpg
NVDA,2022-11-16,2022-11-02,2022-11-30,NVDA,,2022-11-28 10:07:00,2022-11-28T10:07:00-05:00,2022-11-28,Has AMD Replaced Nvidia as a Top Semiconductor Company?,Both companies' Q3 was disappointing.,fool.com,https://www.fool.com/investing/2022/11/28/has-amd-replaced-nvidia-as-a-top-semiconductor-com/,https://images.financialmodelingprep.com/news/has-amd-replaced-nvidia-as-a-top-semiconductor-company-20221128.jpg
NVDA,2022-11-16,2022-11-02,2022-11-30,NVDA,,2022-11-28 10:57:34,2022-11-28T10:57:34-05:00,2022-11-28,Nvidia Sees Better Times Ahead as 2023 Nears,Could this be the bottom for the semiconductor stock?,fool.com,https://www.fool.com/investing/2022/11/28/nvidia-sees-better-times-ahead-as-2023-nears/,https://images.financialmodelingprep.com/news/nvidia-sees-better-times-ahead-as-2023-nears-20221128.jpg
NVDA,2022-11-16,2022-11-02,2022-11-30,NVDA,,2022-11-29 10:51:41,2022-11-29T10:51:41-05:00,2022-11-29,Nvidia Stock Forecast For 2023: What To Watch For,"NVIDIA's actual third-quarter top line and fourth-quarter revenue guidance were largely consistent with investors' expectations. In assessing NVDA's calendar year 2023 outlook, one should watch out for key drivers like gaming revenue recovery, alternative product sales for Chinese data center clients, and sustained share repurchases.",seekingalpha.com,https://seekingalpha.com/article/4561107-nvidia-stock-forecast-2023,https://images.financialmodelingprep.com/news/nvidia-stock-forecast-for-2023-what-to-watch-for-20221129.jpg
NVDA,2022-11-16,2022-11-02,2022-11-30,NVDA,,2022-11-29 18:03:10,2022-11-29T18:03:10-05:00,2022-11-29,Time to Buy Beaten-Down Chip Stocks?,"The fun has seemingly come to a screeching halt in 2022 for chip stocks, with many of these once beloved stocks residing deep in the red year-to-date.",zacks.com,https://www.zacks.com/stock/news/2023413/time-to-buy-beaten-down-chip-stocks,https://images.financialmodelingprep.com/news/time-to-buy-beatendown-chip-stocks-20221129.jpg
NVDA,2022-11-16,2022-11-02,2022-11-30,NVDA,,2022-11-30 05:15:00,2022-11-30T05:15:00-05:00,2022-11-30,"Smart Investors Should Buy These 3 Stocks, Down Between 46% and 73%, Heading Into 2023","By looking past recent stock price results, smart investors can find bargains heading into the new year.",fool.com,https://www.fool.com/investing/2022/11/30/down-between-46-and-73-smart-investors-should-buy/,https://images.financialmodelingprep.com/news/smart-investors-should-buy-these-3-stocks-down-between-20221130.jpg
NVDA,2022-11-16,2022-11-02,2022-11-30,NVDA,,2022-11-30 05:40:00,2022-11-30T05:40:00-05:00,2022-11-30,3 Reasons Nvidia Could Crush the Market in 2023,The graphics specialist has some notable catalysts that could help it outperform in the new year.,fool.com,https://www.fool.com/investing/2022/11/30/3-reasons-nvidia-could-crush-the-market-in-2023/,https://images.financialmodelingprep.com/news/3-reasons-nvidia-could-crush-the-market-in-2023-20221130.jpg
NVDA,2022-11-16,2022-11-02,2022-11-30,NVDA,,2022-11-30 10:55:13,2022-11-30T10:55:13-05:00,2022-11-30,Nvidia: Let's Have Another Look At This One,"What's the fundamental outlook at the moment for NVDA? Our prior setup did not fulfill the structure of price we were looking for, but another setup is now taking shape.",seekingalpha.com,https://seekingalpha.com/article/4561388-nvidia-another-look-at-stock,https://images.financialmodelingprep.com/news/nvidia-lets-have-another-look-at-this-one-20221130.jpg
NVDA,2022-11-16,2022-11-02,2022-11-30,NVDA,,2022-11-30 13:10:00,2022-11-30T13:10:00-05:00,2022-11-30,Applying Wright's Law To AI Accelerators,"ARK believes the demand for hardware to power AI use cases will reach $1.7 trillion in revenue by 2030, largely driven by the massive productivity gains associated with AI-enabled software. Compared to the K80 chip that Nvidia released in 2014, the latest AI training accelerator delivers 195x the performance on a total cost of ownership adjusted basis.",seekingalpha.com,https://seekingalpha.com/article/4561438-wrights-law-ai-accelerators,https://images.financialmodelingprep.com/news/applying-wrights-law-to-ai-accelerators-20221130.jpg
NVDA,2022-11-16,2022-11-02,2022-11-30,NVDA,,2022-11-30 14:43:02,2022-11-30T14:43:02-05:00,2022-11-30,NVIDIA Corporation (NVDA) Credit Suisse 26th Annual Technology Conference (Transcript),"NVIDIA Corporation (NASDAQ:NVDA ) Credit Suisse 26th Annual Technology Conference Call November 30, 2022 10:55 AM ET Company Participants Colette Kress - Chief Financial Officer Conference Call Participants Christopher Caso - Credit Suisse Christopher Caso So thanks, everyone. So I'm Chris Caso, the Credit Suisse semiconductor analyst; so welcome back to the conference.",seekingalpha.com,https://seekingalpha.com/article/4561493-nvidia-corporation-nvda-credit-suisse-26th-annual-technology-conference-transcript,https://images.financialmodelingprep.com/news/nvidia-corporation-nvda-credit-suisse-26th-annual-technology-conference-20221130.jpg
NVDA,2022-11-16,2022-11-02,2022-11-30,NVDA,,2022-11-30 19:55:18,2022-11-30T19:55:18-05:00,2022-11-30,3 Seriously Undervalued Semiconductor Stocks to Buy Now,"The semiconductor sector has had a rough go of it lately. In addition to the tech-led broader bear market, it was hit first by pandemic-induced supply chain woes and then by a cyclical downturn as demand for many products plummeted amid a slowing economy.",investorplace.com,https://investorplace.com/undervalued-semiconductor-stocks/,https://images.financialmodelingprep.com/news/3-seriously-undervalued-semiconductor-stocks-to-buy-now-20221130.jpg
NVDA,2022-11-16,2022-11-02,2022-11-30,NVDA,,2022-11-30 23:02:57,2022-11-30T23:02:57-05:00,2022-11-30,5 Top ESG Stocks For 2022 And The Outlook For 2023,"ESG reporting policies and standardization has taken off over the last decade, promoting investors to park their cash in lucrative ESG stocks. Assets under management by UN Principles for Responsible Investment signatories surpassed more than $100 trillion, up 75% from 2015.",seekingalpha.com,https://seekingalpha.com/article/4561604-5-top-esg-stocks-for-2022-and-the-outlook-for-2023,https://images.financialmodelingprep.com/news/5-top-esg-stocks-for-2022-and-the-outlook-20221130.jpg
