ticker,event_date,window_start,window_end,symbol,symbols,publishedDate,publishedDateET,date_et,title,text,site,url,image
MSFT,2024-04-25,2024-04-11,2024-05-09,MSFT,,2024-04-11 05:54:00,2024-04-11T05:54:00-04:00,2024-04-11,"SoFI Technologies, Microsoft, Amazon, AMD, and Other Tech Stocks in Focus Today",Tech stocks had a bad day Wednesday after U.S. inflation data came in hot but were looking to stabilize early Thursday.,barrons.com,https://www.barrons.com/articles/sofi-technologies-microsoft-amazon-amd-tech-stocks-today-33276207,https://images.financialmodelingprep.com/news/sofi-technologies-microsoft-amazon-amd-and-other-tech-stocks-20240411.jpg
MSFT,2024-04-25,2024-04-11,2024-05-09,MSFT,,2024-04-11 06:00:00,2024-04-11T06:00:00-04:00,2024-04-11,Wall Street Favorites: 3 Dow Stocks With Strong Buy Ratings for April 2024,"The Dow Jones Industrial Average (Dow) stocks may be worth looking at if you're looking to check out of the expensive tech (and AI) trade for the time being. Indeed, being a member of the Dow doesn't necessarily mean there's undervaluation to be had.",investorplace.com,https://investorplace.com/2024/04/wall-street-favorites-3-dow-stocks-with-strong-buy-ratings-for-april-2024/,https://images.financialmodelingprep.com/news/wall-street-favorites-3-dow-stocks-with-strong-buy-ratings-20240411.png
MSFT,2024-04-25,2024-04-11,2024-05-09,MSFT,,2024-04-11 08:15:00,2024-04-11T08:15:00-04:00,2024-04-11,"JPMorgan Chase CEO Jamie Dimon Says Artificial Intelligence (AI) Could Be as Transformational as the Printing Press, Steam Engine, Electricity, Computing, and the Internet. 2 Stocks to Buy If He's Right.",The JPMorgan Chase CEO sees big things ahead for artificial intelligence. Generative AI has the potential to significantly increase user productivity.,fool.com,https://www.fool.com/investing/2024/04/11/jpmorgan-ceo-jamie-dimon-says-ai-could-be/,https://images.financialmodelingprep.com/news/jpmorgan-chase-ceo-jamie-dimon-says-artificial-intelligence-ai-could-20240411.jpg
MSFT,2024-04-25,2024-04-11,2024-05-09,MSFT,,2024-04-11 09:04:57,2024-04-11T09:04:57-04:00,2024-04-11,"ISA trends: Nvidia, Microsoft, Tesla in, Lloyds and Barclays booted","UK retail investors are jumping into US technology megacap stocks, with Magnificent Seven technology giants Nvidia Corporation, Microsoft Corp (NASDAQ:MSFT) and Tesla Inc (NASDAQ:TSLA, ETR:TL0) among the most popular ISA investments at the moment. AJ Bell data shows that tech exposure and income-yielding stocks are top of the pile as ISA customers shoot for tax-free capital gains and dividends.",proactiveinvestors.co.uk,https://www.proactiveinvestors.co.uk/companies/news/1045099,https://images.financialmodelingprep.com/news/isa-trends-nvidia-microsoft-tesla-in-lloyds-and-barclays-booted-20240411.jpg
MSFT,2024-04-25,2024-04-11,2024-05-09,MSFT,,2024-04-11 09:04:57,2024-04-11T09:04:57-04:00,2024-04-11,"ISA trends: Nvidia, Microsoft, Tesla in, Lloyds and Barclays booted","UK retail investors are jumping into US technology megacap stocks, with Magnificent Seven technology giants Nvidia Corporation, Microsoft Corp (NASDAQ:MSFT) and Tesla Inc (NASDAQ:TSLA, ETR:TL0) among the most popular ISA investments at the moment. AJ Bell data shows that tech exposure and income-yielding stocks are top of the pile as ISA customers shoot for tax-free capital gains and dividends.",proactiveinvestors.co.uk,https://www.proactiveinvestors.co.uk/companies/news/1045099?SNAPI,https://images.financialmodelingprep.com/news/isa-trends-nvidia-microsoft-tesla-in-lloyds-and-barclays-booted-20240411.jpg
MSFT,2024-04-25,2024-04-11,2024-05-09,MSFT,,2024-04-11 11:50:00,2024-04-11T11:50:00-04:00,2024-04-11,"Microsoft Earnings Can Double by Fiscal 2029, Morgan Stanley Says. Here's How.","In Morgan Stanley's “bull case,” the company's AI revenue could reach $120 billion in fiscal 2029.",barrons.com,https://www.barrons.com/articles/microsoft-stock-price-ai-earnings-buy-461eb046,https://images.financialmodelingprep.com/news/microsoft-earnings-can-double-by-fiscal-2029-morgan-stanley-20240411.jpg
MSFT,2024-04-25,2024-04-11,2024-05-09,MSFT,,2024-04-11 12:03:42,2024-04-11T12:03:42-04:00,2024-04-11,"BofA Analyst Favors Large Cap Microsoft, Salesforce As Top AI Software Stocks","Large cap software companies such as Microsoft and Salesforce stock are outperforming as investors rethink the sector's upside from generative AI, says a Bank of America analyst.",investors.com,https://www.investors.com/news/technology/bofa-analyst-favors-large-cap-microsoft-salesforce-as-top-ai-software-stocks/,https://images.financialmodelingprep.com/news/bofa-analyst-favors-large-cap-microsoft-salesforce-as-top-20240411.jpg
MSFT,2024-04-25,2024-04-11,2024-05-09,MSFT,,2024-04-11 12:17:59,2024-04-11T12:17:59-04:00,2024-04-11,All-Time High Flyers: 7 Stocks to Buy as the Market Peaks,"If you're wondering which stocks to buy in April, here's a good place to start. The stock market is off to a difficult start in the second quarter.",investorplace.com,https://investorplace.com/2024/04/all-time-high-flyers-7-stocks-to-buy-as-the-market-peaks/,https://images.financialmodelingprep.com/news/alltime-high-flyers-7-stocks-to-buy-as-the-20240411.jpg
MSFT,2024-04-25,2024-04-11,2024-05-09,MSFT,,2024-04-11 13:08:48,2024-04-11T13:08:48-04:00,2024-04-11,7 Boring Stocks to Buy as Inflation Crimps Sentiment,"The case for boring stocks to buy stems from good news that could actually be bad news. Yes, we're playing that silly game again.",investorplace.com,https://investorplace.com/2024/04/7-boring-stocks-to-buy-as-inflation-crimps-sentiment/,https://images.financialmodelingprep.com/news/7-boring-stocks-to-buy-as-inflation-crimps-sentiment-20240411.png
MSFT,2024-04-25,2024-04-11,2024-05-09,MSFT,,2024-04-11 14:02:28,2024-04-11T14:02:28-04:00,2024-04-11,"If You Can Only Buy One AI Stock in April, It Better Be One of These 3 Names","The artificial intelligence (AI) boom has single-handedly taken the stock market to new heights in the past year. However, the top AI stocks to buy have taken a breather in the past few weeks.",investorplace.com,https://investorplace.com/2024/04/if-you-can-only-buy-one-ai-stock-in-april-it-better-be-one-of-these-3-names/,https://images.financialmodelingprep.com/news/if-you-can-only-buy-one-ai-stock-in-20240411.jpg
MSFT,2024-04-25,2024-04-11,2024-05-09,MSFT,,2024-04-11 15:02:00,2024-04-11T15:02:00-04:00,2024-04-11,US says Russian hackers stole federal government emails during Microsoft cyberattack,CISA said the latest theft of government email — blamed on Russian government hackers — presents “a grave and unacceptable risk” to U.S. federal agencies.,techcrunch.com,https://techcrunch.com/2024/04/11/us-cisa-russia-apt-29-government-email-theft-microsoft/,https://images.financialmodelingprep.com/news/us-says-russian-hackers-stole-federal-government-emails-during-20240411.jpg
MSFT,2024-04-25,2024-04-11,2024-05-09,MSFT,,2024-04-11 15:16:04,2024-04-11T15:16:04-04:00,2024-04-11,US cyber agency says Russian hackers use Microsoft access to steal government emails,The U.S. cyber watchdog agency CISA says that Russian government-backed hackers have used their access to Microsoft's email system to steal correspondence between officials and the tech giant.,reuters.com,https://www.reuters.com/technology/cybersecurity/us-cyber-agency-says-russian-hackers-use-microsoft-access-steal-government-2024-04-11/,https://images.financialmodelingprep.com/news/us-cyber-agency-says-russian-hackers-use-microsoft-access-20240411.jpg
MSFT,2024-04-25,2024-04-11,2024-05-09,MSFT,,2024-04-12 04:40:00,2024-04-12T04:40:00-04:00,2024-04-12,1 Artificial Intelligence (AI) Stock That Could Help Make You a Millionaire,"Microsoft is already well invested in AI, even if it's not yet being utilized to its full potential. The AI market itself is expected to grow at a double-digit pace for the next several years.",fool.com,https://www.fool.com/investing/2024/04/12/artificial-intelligence-ai-stock-help-millionaire/,https://images.financialmodelingprep.com/news/1-artificial-intelligence-ai-stock-that-could-help-make-20240412.jpg
MSFT,2024-04-25,2024-04-11,2024-05-09,MSFT,,2024-04-12 05:11:53,2024-04-12T05:11:53-04:00,2024-04-12,"Microsoft hack included government emails, US cyber agency confirms","Hackers stole emails from several US federal agencies in an attack on Microsoft earlier this year, the country's cyber security agency confirmed yesterday. Microsoft revealed the attack in January, which was said to have been carried out by a Russian state-backed hacking group through corporate email accounts.",proactiveinvestors.co.uk,https://www.proactiveinvestors.co.uk/companies/news/1045174?SNAPI,https://images.financialmodelingprep.com/news/microsoft-hack-included-government-emails-us-cyber-agency-confirms-20240412.jpg
MSFT,2024-04-25,2024-04-11,2024-05-09,MSFT,,2024-04-12 05:11:53,2024-04-12T05:11:53-04:00,2024-04-12,"Microsoft hack included government emails, US cyber agency confirms","Hackers stole emails from several US federal agencies in an attack on Microsoft earlier this year, the country's cyber security agency confirmed yesterday. Microsoft revealed the attack in January, which was said to have been carried out by a Russian state-backed hacking group through corporate email accounts.",proactiveinvestors.co.uk,https://www.proactiveinvestors.co.uk/companies/news/1045174,https://images.financialmodelingprep.com/news/microsoft-hack-included-government-emails-us-cyber-agency-confirms-20240412.jpg
MSFT,2024-04-25,2024-04-11,2024-05-09,MSFT,,2024-04-12 05:17:00,2024-04-12T05:17:00-04:00,2024-04-12,"Amazon, Microsoft, and Other Tech Stocks in Focus Today",Nasdaq futures were holding steady early Friday.,barrons.com,https://www.barrons.com/articles/amazon-microsoft-tech-stocks-today-8cecb926,https://images.financialmodelingprep.com/news/amazon-microsoft-and-other-tech-stocks-in-focus-today-20240412.jpg
MSFT,2024-04-25,2024-04-11,2024-05-09,MSFT,,2024-04-12 08:07:59,2024-04-12T08:07:59-04:00,2024-04-12,7 Must-Buy Stocks Whenever the Market Falters,The stock market has enjoyed a good run to start the year. The S&P 500 and Nasdaq Composite are both up by roughly 10% year-to-date.,investorplace.com,https://investorplace.com/2024/04/7-must-buy-stocks-whenever-the-market-falters/,https://images.financialmodelingprep.com/news/7-mustbuy-stocks-whenever-the-market-falters-20240412.jpg
MSFT,2024-04-25,2024-04-11,2024-05-09,MSFT,,2024-04-12 08:33:42,2024-04-12T08:33:42-04:00,2024-04-12,"Exclusive: OpenAI's Altman pitches ChatGPT Enterprise to large firms, including some Microsoft customers","OpenAI Chief Executive Sam Altman has hosted hundreds of Fortune 500 company executives in San Francisco, New York and London this month where he and other OpenAI executives pitched AI services for corporate use, going head to head in some cases with financial backer Microsoft, attendees told Reuters.",reuters.com,https://www.reuters.com/technology/openais-altman-pitches-chatgpt-enterprise-large-firms-including-some-microsoft-2024-04-12/,https://images.financialmodelingprep.com/news/exclusive-openais-altman-pitches-chatgpt-enterprise-to-large-firms-20240412.jpg
MSFT,2024-04-25,2024-04-11,2024-05-09,MSFT,,2024-04-12 09:00:01,2024-04-12T09:00:01-04:00,2024-04-12,LinkedIn betting it can take on TikTok and Instagram in influencer marketing,"With LinkedIn facing a slowdown in growth, the company is jumping into influencer marketing, trying to compete with TikTok and Instagram.",cnbc.com,https://www.cnbc.com/2024/04/12/linkedin-expands-thought-leader-ads-eyeing-tiktok-and-instagram.html,https://images.financialmodelingprep.com/news/linkedin-betting-it-can-take-on-tiktok-and-instagram-20240412.jpeg
MSFT,2024-04-25,2024-04-11,2024-05-09,MSFT,,2024-04-12 11:01:23,2024-04-12T11:01:23-04:00,2024-04-12,5 ETFs to Tap Amazon's Growth Story,"Amazon (AMZN) registered its first new all-time high in almost three years, reflecting a dramatic rebound from its slump in 2022 and the resurgence of confidence in the company's future growth potential.",zacks.com,https://www.zacks.com/stock/news/2254589/5-etfs-to-tap-amazon-s-growth-story?cid=CS-STOCKNEWSAPI-FT-etf_news_and_commentary-2254589,https://images.financialmodelingprep.com/news/5-etfs-to-tap-amazons-growth-story-20240412.jpg
MSFT,2024-04-25,2024-04-11,2024-05-09,MSFT,,2024-04-12 11:50:16,2024-04-12T11:50:16-04:00,2024-04-12,"GOOGL, MSFT, AMZN & META Pose Threat to NVDA With In-House Chips","Alphabet (GOOGL), Amazon, Meta and Microsoft are making in-house AI chips, which is concerning for NVIDIA.",zacks.com,https://www.zacks.com/stock/news/2254700/googl-msft-amzn-meta-pose-threat-to-nvda-with-in-house-chips?cid=CS-STOCKNEWSAPI-FT-analyst_blog|industry_focus-2254700,https://images.financialmodelingprep.com/news/googl-msft-amzn-meta-pose-threat-to-nvda-with-20240412.jpg
MSFT,2024-04-25,2024-04-11,2024-05-09,MSFT,,2024-04-12 12:26:04,2024-04-12T12:26:04-04:00,2024-04-12,5 ETFs Leading the Tech Rebound: Will the Rally Continue?,"The technology sector gained momentum in the Apr 11 trading session, buoyed by a jump in big tech stocks. The upside came on softer-than-expected producer prices data, which supported the belief that inflation is cooling.",zacks.com,https://www.zacks.com/stock/news/2254672/5-etfs-leading-the-tech-rebound-will-the-rally-continue?cid=CS-STOCKNEWSAPI-FT-etf_news_and_commentary-2254672,https://images.financialmodelingprep.com/news/5-etfs-leading-the-tech-rebound-will-the-rally-20240412.jpg
MSFT,2024-04-25,2024-04-11,2024-05-09,MSFT,,2024-04-13 03:55:42,2024-04-13T03:55:42-04:00,2024-04-13,Microsoft: Decent Buying Opportunity,"Microsoft's share price has surged significantly over the past few months. I go over the company's financials and upcoming plans for the future, specifically for AI, gaming and cloud technology. Using a simple EPS projection, and considering other analyst estimates, I assign a 'Buy' rating on Microsoft stock, at a price target of $425.21.",seekingalpha.com,https://seekingalpha.com/article/4683583-microsoft-decent-buying-opportunity,https://images.financialmodelingprep.com/news/microsoft-decent-buying-opportunity-20240413.jpg
MSFT,2024-04-25,2024-04-11,2024-05-09,MSFT,,2024-04-13 06:31:00,2024-04-13T06:31:00-04:00,2024-04-13,3 Dow Jones Dividend Stocks That Are Within 5% of Their 52-Week Highs to Buy Now,Microsoft has transformed its business for the better. Walmart is a fair price relative to its historic valuation.,fool.com,https://www.fool.com/investing/2024/04/13/3-dow-jones-dividend-stocks-close-52-week-high/,https://images.financialmodelingprep.com/news/3-dow-jones-dividend-stocks-that-are-within-5-20240413.jpg
MSFT,2024-04-25,2024-04-11,2024-05-09,MSFT,,2024-04-13 07:30:00,2024-04-13T07:30:00-04:00,2024-04-13,How Is Nvidia Cheaper Than Microsoft?,Nvidia and Microsoft are both benefiting from the AI boom. Nvidia is growing much quicker than Microsoft.,fool.com,https://www.fool.com/investing/2024/04/13/how-is-nvidia-cheaper-than-microsoft/,https://images.financialmodelingprep.com/news/how-is-nvidia-cheaper-than-microsoft-20240413.jpg
MSFT,2024-04-25,2024-04-11,2024-05-09,MSFT,,2024-04-13 07:30:00,2024-04-13T07:30:00-04:00,2024-04-13,My Biggest Losses And Lessons,"All investors, including even Warren Buffett, have suffered big losses. We take risks to earn returns and sometimes, risk factors play out. At other times, we also made mistakes in our analysis.",seekingalpha.com,https://seekingalpha.com/article/4682934-my-biggest-losses-and-lessons,https://images.financialmodelingprep.com/news/my-biggest-losses-and-lessons-20240413.jpg
MSFT,2024-04-25,2024-04-11,2024-05-09,MSFT,,2024-04-13 09:30:00,2024-04-13T09:30:00-04:00,2024-04-13,3 Stocks to Supercharge Your Wealth for 2030 and Beyond,"It might sound obvious, but when looking for stocks for long-term wealth in 2030 and beyond, the goal should be to find stocks poised to trade significantly higher. However, successfully capitalizing on gains over such an extended period is not obvious or simple.",investorplace.com,https://investorplace.com/2024/04/three-stocks-to-supercharge-your-wealth-for-2030-and-beyond/,https://images.financialmodelingprep.com/news/3-stocks-to-supercharge-your-wealth-for-2030-and-20240413.jpg
MSFT,2024-04-25,2024-04-11,2024-05-09,MSFT,,2024-04-13 10:00:00,2024-04-13T10:00:00-04:00,2024-04-13,7 Must-Own Tech Stocks to Capitalize on the AI Frenzy,"In the current market scenario, the one sector that promises significant returns in the coming years is the tech sector. Driven by artificial intelligence ( AI ), the tech sector has been thriving, and tech stocks have been hitting new highs over the past few months.",investorplace.com,https://investorplace.com/2024/04/7-must-own-tech-stocks-to-capitalize-on-the-ai-frenzy/,https://images.financialmodelingprep.com/news/7-mustown-tech-stocks-to-capitalize-on-the-ai-20240413.png
MSFT,2024-04-25,2024-04-11,2024-05-09,MSFT,,2024-04-13 11:25:00,2024-04-13T11:25:00-04:00,2024-04-13,Could Datadog Become the Next Microsoft?,Datadog's growth is slowing down as the observability market matures. It doesn't seem interested in horizontally expanding its business.,fool.com,https://www.fool.com/investing/2024/04/13/could-datadog-become-the-next-microsoft/,https://images.financialmodelingprep.com/news/could-datadog-become-the-next-microsoft-20240413.jpg
MSFT,2024-04-25,2024-04-11,2024-05-09,MSFT,,2024-04-13 18:15:00,2024-04-13T18:15:00-04:00,2024-04-13,3 Millionaire-Maker Artificial Intelligence Stocks,"Nvidia's dominance in GPUs has allowed it to achieve a majority market share in AI chips. Meanwhile, Microsoft's vast financial resources led to a lucrative partnership with OpenAI and access to some of the most advanced AI models.",fool.com,https://www.fool.com/investing/2024/04/13/3-millionaire-maker-artificial-intelligence-stocks/,https://images.financialmodelingprep.com/news/3-millionairemaker-artificial-intelligence-stocks-20240413.jpg
MSFT,2024-04-25,2024-04-11,2024-05-09,MSFT,,2024-04-14 06:30:00,2024-04-14T06:30:00-04:00,2024-04-14,"3 Artificial Intelligence (AI) Stocks to Buy With $1,000 and Hold for Forever",Microsoft has several wide-moat franchises that will benefit from its partnership with OpenAI. ASML has a monopoly on crucial chipmaking technology for AI chips and memory.,fool.com,https://www.fool.com/investing/2024/04/14/3-artificial-intelligence-ai-stocks-to-buy-with-10/,https://images.financialmodelingprep.com/news/3-artificial-intelligence-ai-stocks-to-buy-with-1000-20240414.jpg
MSFT,2024-04-25,2024-04-11,2024-05-09,MSFT,,2024-04-14 08:09:36,2024-04-14T08:09:36-04:00,2024-04-14,Nvidia Analyst Expects Stock To Collapse,Nvidia's (NASDAQ: NVDA) stock has sold off slightly lately.,247wallst.com,https://247wallst.com/investing/2024/04/14/nvidia-analyst-expects-stock-to-collapse/,https://images.financialmodelingprep.com/news/nvidia-analyst-expects-stock-to-collapse-20240414.jpg
MSFT,2024-04-25,2024-04-11,2024-05-09,MSFT,,2024-04-14 08:09:36,2024-04-14T08:09:36-04:00,2024-04-14,Nvidia Analyst Expects Stock To Collapse,Nvidia's (NASDAQ: NVDA) stock has sold off slightly lately.,247wallst.com,https://247wallst.com/investing/2024/04/14/nvidia-analyst-expects-stock-to-collapse/?utm_source=snapi,https://images.financialmodelingprep.com/news/nvidia-analyst-expects-stock-to-collapse-20240414.jpg
MSFT,2024-04-25,2024-04-11,2024-05-09,MSFT,,2024-04-14 14:50:00,2024-04-14T14:50:00-04:00,2024-04-14,"Billionaire Dan Loeb Sold Amazon and Microsoft but Bought This ""Magnificent Seven"" Stock",Loeb took some profits off the table in Q4 with Amazon and Microsoft. His Third Point hedge fund increased its stake in Meta Platforms.,fool.com,https://www.fool.com/investing/2024/04/14/billionaire-dan-loeb-sold-amazon-and-microsoft-but/,https://images.financialmodelingprep.com/news/billionaire-dan-loeb-sold-amazon-and-microsoft-but-bought-20240414.jpg
MSFT,2024-04-25,2024-04-11,2024-05-09,MSFT,,2024-04-14 17:00:00,2024-04-14T17:00:00-04:00,2024-04-14,3 Dividend Stocks to Buy for Lifelong Cash Flow,Dividend stocks allow investors to get paid just by holding onto shares. This investing model can help people cover their living costs without having to sell shares.,investorplace.com,https://investorplace.com/2024/04/3-dividend-stocks-to-buy-for-lifelong-cash-flow/,https://images.financialmodelingprep.com/news/3-dividend-stocks-to-buy-for-lifelong-cash-flow-20240414.jpg
MSFT,2024-04-25,2024-04-11,2024-05-09,MSFT,,2024-04-14 20:52:01,2024-04-14T20:52:01-04:00,2024-04-14,"Microsoft-backed Rubrik aims to raise as much as $713 mln in IPO, source says","Cybersecurity software firm Rubrik, which counts Microsoft among its prominent investors, is aiming to raise as much as $713 million in its initial public offering, according to a person familiar with the matter.",reuters.com,https://www.reuters.com/technology/microsoft-backed-rubrik-aims-raise-much-713-mln-ipo-source-says-2024-04-15/,https://images.financialmodelingprep.com/news/microsoftbacked-rubrik-aims-to-raise-as-much-as-713-20240414.jpg
MSFT,2024-04-25,2024-04-11,2024-05-09,MSFT,,2024-04-15 05:45:00,2024-04-15T05:45:00-04:00,2024-04-15,What's Billionaire Ken Griffin's Biggest Holding? You Might Be Surprised.,"Griffin's Citadel hedge fund owns thousands of stocks, including all the ""Magnificent Seven"" stocks. However, the billionaire's biggest bet is perhaps surprising and relatively unexciting.",fool.com,https://www.fool.com/investing/2024/04/15/whats-billionaire-ken-griffins-biggest-holding-you/,https://images.financialmodelingprep.com/news/whats-billionaire-ken-griffins-biggest-holding-you-might-be-20240415.jpg
MSFT,2024-04-25,2024-04-11,2024-05-09,MSFT,,2024-04-15 07:00:00,2024-04-15T07:00:00-04:00,2024-04-15,"Paystand Brings Full Payments Integration to Microsoft Business Central, Including NAV, GP and AX","SCOTTS VALLEY, Calif.--(BUSINESS WIRE)--Paystand brings full payments integration to Microsoft Dynamics 365 Business Central and will support Dynamics NAV, GP, AX, and Dynamics 365 Finance.",businesswire.com,https://www.businesswire.com/news/home/20240415782079/en/Paystand-Brings-Full-Payments-Integration-to-Microsoft-Business-Central-Including-NAV-GP-and-AX/,https://images.financialmodelingprep.com/news/paystand-brings-full-payments-integration-to-microsoft-business-central-20240415.jpg
MSFT,2024-04-25,2024-04-11,2024-05-09,MSFT,,2024-04-15 07:00:00,2024-04-15T07:00:00-04:00,2024-04-15,Wall Street Favorites: 7 Nasdaq Stocks With Strong Buy Ratings for April 2024,"When it comes to Nasdaq stocks with strong buy ratings, mega-cap tech stocks may be what may first come to mind. To some extent, this is a correct assumption.",investorplace.com,https://investorplace.com/2024/04/wall-street-favorites-7-nasdaq-stocks-with-strong-buy-ratings-for-april-2024/,https://images.financialmodelingprep.com/news/wall-street-favorites-7-nasdaq-stocks-with-strong-buy-20240415.jpg
MSFT,2024-04-25,2024-04-11,2024-05-09,MSFT,,2024-04-15 09:12:17,2024-04-15T09:12:17-04:00,2024-04-15,3 Growth Stocks to Buy Now for Explosive 10X Returns: April Edition,"The stock market has been ablaze in the past year, fueled by a handful of growth stocks to buy. Over the past year, artificial intelligence (AI) became a key catalyst for the stock market, with growth stocks serving as vehicles to capitalize on this trend.",investorplace.com,https://investorplace.com/2024/04/3-growth-stocks-to-buy-now-for-explosive-10x-returns-april-edition/,https://images.financialmodelingprep.com/news/3-growth-stocks-to-buy-now-for-explosive-10x-20240415.jpg
MSFT,2024-04-25,2024-04-11,2024-05-09,MSFT,,2024-04-15 13:09:08,2024-04-15T13:09:08-04:00,2024-04-15,3 Nasdaq Stocks to Buy Now: Q2 Edition,"The Nasdaq lists thousands of publicly traded companies. Investors have plenty of choices, but some of the picks in the famed market are better than others.",investorplace.com,https://investorplace.com/2024/04/3-nasdaq-stocks-to-buy-now-q2-edition/,https://images.financialmodelingprep.com/news/3-nasdaq-stocks-to-buy-now-q2-edition-20240415.jpg
MSFT,2024-04-25,2024-04-11,2024-05-09,MSFT,,2024-04-15 15:10:04,2024-04-15T15:10:04-04:00,2024-04-15,"Microsoft, beset by hacks, grapples with problem years in the making",The world's largest seller of cybersecurity products has a problem with its own cybersecurity.,techxplore.com,https://techxplore.com/news/2024-04-microsoft-hacks-grapples-problem-years.html,https://images.financialmodelingprep.com/news/microsoft-beset-by-hacks-grapples-with-problem-years-in-20240415.jpg
MSFT,2024-04-25,2024-04-11,2024-05-09,MSFT,,2024-04-15 18:51:08,2024-04-15T18:51:08-04:00,2024-04-15,Here's Why Microsoft (MSFT) Fell More Than Broader Market,"Microsoft (MSFT) closed at $413.64 in the latest trading session, marking a -1.96% move from the prior day.",zacks.com,https://www.zacks.com/stock/news/2255626/here-s-why-microsoft-msft-fell-more-than-broader-market?cid=CS-STOCKNEWSAPI-FT-tale_of_the_tape|yseop_template_6-2255626,https://images.financialmodelingprep.com/news/heres-why-microsoft-msft-fell-more-than-broader-market-20240415.jpg
MSFT,2024-04-25,2024-04-11,2024-05-09,MSFT,,2024-04-16 00:01:01,2024-04-16T00:01:01-04:00,2024-04-16,"Ad transparency tools are 'major disappointment' ahead of election, new study shows","A new study concludes that ad transparency tools from major platforms like Google, Meta and X are insufficient for users and researchers.",cnbc.com,https://www.cnbc.com/2024/04/16/ad-transparency-tools-major-disappointment-ahead-of-election-study.html,https://images.financialmodelingprep.com/news/ad-transparency-tools-are-major-disappointment-ahead-of-election-20240416.jpeg
