ticker,event_date,window_start,window_end,symbol,symbols,publishedDate,publishedDateET,date_et,title,text,site,url,image
MSFT,2024-04-25,2024-04-11,2024-05-09,MSFT,,2024-04-30 13:50:49,2024-04-30T13:50:49-04:00,2024-04-30,US newspapers sue OpenAI for copyright infringement over AI training,"A group of newspapers, including the New York Daily News and Chicago Tribune, sued Microsoft and OpenAI in New York federal court on Tuesday, accusing them of misusing reporters' work to train their generative artificial-intelligence systems.",reuters.com,https://www.reuters.com/legal/us-newspapers-sue-openai-copyright-infringement-over-ai-training-2024-04-30/,https://images.financialmodelingprep.com/news/us-newspapers-sue-openai-for-copyright-infringement-over-ai-20240430.jpg
MSFT,2024-04-25,2024-04-11,2024-05-09,MSFT,,2024-04-30 14:29:03,2024-04-30T14:29:03-04:00,2024-04-30,Eight US newspapers sue OpenAI and Microsoft for copyright infringement,"The Chicago Tribune, Denver Post and others file suit saying the tech companies ‘purloin millions' of articles without permission",theguardian.com,https://www.theguardian.com/technology/2024/apr/30/us-newspaper-openai-lawsuit,https://images.financialmodelingprep.com/news/eight-us-newspapers-sue-openai-and-microsoft-for-copyright-20240430.jpg
MSFT,2024-04-25,2024-04-11,2024-05-09,MSFT,,2024-04-30 15:13:01,2024-04-30T15:13:01-04:00,2024-04-30,"US newspapers sue OpenAI, Microsoft over AI chatbots",Eight US newspapers sued OpenAI and Microsoft in a New York federal court Tuesday for violating their copyright to train the technology behind the ChatGPT and Copilot chatbots.,techxplore.com,https://techxplore.com/news/2024-04-newspapers-sue-openai-microsoft-ai.html,https://images.financialmodelingprep.com/news/us-newspapers-sue-openai-microsoft-over-ai-chatbots-20240430.jpg
MSFT,2024-04-25,2024-04-11,2024-05-09,MSFT,,2024-04-30 15:53:00,2024-04-30T15:53:00-04:00,2024-04-30,8 U.S. newspapers sue ChatGPT-maker OpenAI and Microsoft for copyright infringement,"NEW YORK — A group of eight U.S. newspapers is suing ChatGPT-maker OpenAI and Microsoft, alleging that the technology companies have been “purloining millions” of copyrighted news articles without permission or payment to train their artificial-intelligence chatbots.",marketwatch.com,https://www.marketwatch.com/story/8-u-s-newspapers-sue-chatgpt-maker-openai-and-microsoft-for-copyright-infringement-4e1bd630,https://images.financialmodelingprep.com/news/8-us-newspapers-sue-chatgptmaker-openai-and-microsoft-for-20240430.jpg
MSFT,2024-04-25,2024-04-11,2024-05-09,MSFT,,2024-04-30 16:38:18,2024-04-30T16:38:18-04:00,2024-04-30,Analysis: Microsoft's $1.7 Billion Bet on Indonesia's Digital Future Shows Global AI Investment Surge,"In a move that underscores the growing global interest in artificial intelligence (AI), Microsoft has announced an investment of $1.7 billion over the next four years in Indonesia.",pymnts.com,https://www.pymnts.com/artificial-intelligence-2/2024/analysis-microsofts-1-7-billion-bet-on-indonesias-digital-future-shows-global-ai-investment-surge/,https://images.financialmodelingprep.com/news/analysis-microsofts-17-billion-bet-on-indonesias-digital-future-20240430.jpg
MSFT,2024-04-25,2024-04-11,2024-05-09,MSFT,,2024-04-30 19:19:40,2024-04-30T19:19:40-04:00,2024-04-30,"Newspapers Sue Microsoft, OpenAI for Using Content to Train AI","Eight newspapers owned by Alden Global Capital's MediaNews Group are reportedly suing Microsoft and OpenAI, alleging that the tech companies used the newspapers' content to train artificial intelligence (AI) models.  The newspapers, which include the New York Daily News and Chicago Tribune, filed their suit in New York federal court on Tuesday (April 30), Reuters reported Tuesday.",pymnts.com,https://www.pymnts.com/legal/2024/newspapers-sue-microsoft-openai-for-using-content-to-train-ai/,https://images.financialmodelingprep.com/news/newspapers-sue-microsoft-openai-for-using-content-to-train-20240430.jpg
MSFT,2024-04-25,2024-04-11,2024-05-09,MSFT,,2024-04-30 23:09:00,2024-04-30T23:09:00-04:00,2024-04-30,Microsoft to invest $1.7 billion in AI and cloud infrastructure in Indonesia,"JAKARTA, Indonesia — Microsoft will invest $1.7 billion over the next four years in new cloud and artificial intelligence infrastructure in Indonesia — the single largest investment in Microsoft's 29-year history in the country — Microsoft CEO Satya Nadella said Tuesday.",marketwatch.com,https://www.marketwatch.com/story/microsoft-to-invest-1-7-billion-in-ai-and-cloud-infrastructure-in-indonesia-693b4ed9,https://images.financialmodelingprep.com/news/microsoft-to-invest-17-billion-in-ai-and-cloud-20240430.jpg
MSFT,2024-04-25,2024-04-11,2024-05-09,MSFT,,2024-05-01 00:16:54,2024-05-01T00:16:54-04:00,2024-05-01,Microsoft to open first regional data centre in Thailand,"Microsoft will open its first regional data centre in Thailand, the tech giant said on Wednesday, as it looks to widen availability of cloud services.",reuters.com,https://www.reuters.com/technology/microsoft-open-first-regional-data-centre-thailand-2024-05-01/,https://images.financialmodelingprep.com/news/microsoft-to-open-first-regional-data-centre-in-thailand-20240501.jpg
MSFT,2024-04-25,2024-04-11,2024-05-09,MSFT,,2024-05-01 00:50:48,2024-05-01T00:50:48-04:00,2024-05-01,"Microsoft to power data centers with Brookfield renewables deal, FT says","Canada's Brookfield Asset Management is set to develop new wind and solar farms with backing from tech giant Microsoft in an attempt to bring 10.5 gigawatts of generating capacity online, the Financial Times reported on Wednesday.",reuters.com,https://www.reuters.com/sustainability/climate-energy/microsoft-power-data-centers-with-brookfield-renewables-deal-ft-says-2024-05-01/,https://images.financialmodelingprep.com/news/microsoft-to-power-data-centers-with-brookfield-renewables-deal-20240501.jpg
MSFT,2024-04-25,2024-04-11,2024-05-09,MSFT,,2024-05-01 07:30:00,2024-05-01T07:30:00-04:00,2024-05-01,Microsoft's Earnings Results Show It's Delivering on Its Artificial Intelligence (AI) Promise. But Is the Stock a Buy After Recent Gains?,Its Azure segment continues to take share in the cloud-computing space. The tech giant is also seeing benefits from AI across its business lines.,fool.com,https://www.fool.com/investing/2024/05/01/microsofts-q1-results-showed-its-delivering-on-its/,https://images.financialmodelingprep.com/news/microsofts-earnings-results-show-its-delivering-on-its-artificial-20240501.jpg
MSFT,2024-04-25,2024-04-11,2024-05-09,MSFT,,2024-05-01 07:30:00,2024-05-01T07:30:00-04:00,2024-05-01,3 Spatial Computing Stocks That Will Dominate the Future of Work,"It's not all fun and games when it comes to the market's top spatial computing (or metaverse) stocks. Undoubtedly, we've seen some pretty capable mixed-reality headsets launching in recent years.",investorplace.com,https://investorplace.com/2024/05/3-spatial-computing-stocks-that-will-dominate-the-future-of-work/,https://images.financialmodelingprep.com/news/3-spatial-computing-stocks-that-will-dominate-the-future-20240501.jpg
MSFT,2024-04-25,2024-04-11,2024-05-09,MSFT,,2024-05-01 08:25:05,2024-05-01T08:25:05-04:00,2024-05-01,"Microsoft signs renewable energy deal with Brookfield, 10.5 gigawatts capacity to likely cost $10 B","On Wednesday, tech giant Microsoft and Brookfield Asset Management of Canada announced plans to develop new solar and wind farms to bring over 10.5 gigawatts of new renewable energy capacity. This deal signifies the importance of meeting clean energy commitments as well as the demands of cloud computing and AI.",invezz.com,https://invezz.com/news/2024/05/01/microsoft-signs-renewable-energy-deal-with-brookfield-10-5-gigawatts-capacity-to-likely-cost-10-b/,https://images.financialmodelingprep.com/news/microsoft-signs-renewable-energy-deal-with-brookfield-105-gigawatts-20240501.jpg
MSFT,2024-04-25,2024-04-11,2024-05-09,MSFT,,2024-05-01 08:51:43,2024-05-01T08:51:43-04:00,2024-05-01,Microsoft signs deal to invest more than $10 billion on renewable energy capacity to power data centers,"Microsoft and Brookfield Asset Management will develop 10.5 gigawatts of renewable energy, in a deal they describe as the largest of its kind.",cnbc.com,https://www.cnbc.com/2024/05/01/microsoft-brookfield-to-develop-more-than-10point5-gigawatts-of-renewable-energy.html,https://images.financialmodelingprep.com/news/microsoft-signs-deal-to-invest-more-than-10-billion-20240501.jpg
MSFT,2024-04-25,2024-04-11,2024-05-09,MSFT,,2024-05-01 08:55:00,2024-05-01T08:55:00-04:00,2024-05-01,"Cloud solutions provider Trofeo launches, focuses on Microsoft Azure","TAMPA, Fla.--(BUSINESS WIRE)--Trofeo, a new cloud solutions company, has launched to deliver client-focused, scalable cloud strategy and implementation services to companies nationally. As a Microsoft Cloud AI partner, Trofeo partners with companies to scale, adapt and thrive in a competitive market. Trofeo designs comprehensive cloud strategies, executes application migrations, implements and optimizes Microsoft Azure, and delivers ongoing security, support and management. With Trofeo, compani.",businesswire.com,https://www.businesswire.com/news/home/20240501519527/en/Cloud-solutions-provider-Trofeo-launches-focuses-on-Microsoft-Azure/,https://images.financialmodelingprep.com/news/cloud-solutions-provider-trofeo-launches-focuses-on-microsoft-azure-20240501.jpg
MSFT,2024-04-25,2024-04-11,2024-05-09,MSFT,,2024-05-01 10:00:00,2024-05-01T10:00:00-04:00,2024-05-01,Nearly 50% of Billionaire Stanley Druckenmiller's Portfolio Is Invested in These 4 Stocks,"Stanley Druckenmiller has one of the best investing records out there. He worked closely with George Soros, helping to ""break the Bank of England.",fool.com,https://www.fool.com/investing/2024/05/01/50-of-billionaire-stanley-druckenmillers-portfolio/,https://images.financialmodelingprep.com/news/nearly-50-of-billionaire-stanley-druckenmillers-portfolio-is-invested-20240501.jpg
MSFT,2024-04-25,2024-04-11,2024-05-09,MSFT,,2024-05-01 11:15:00,2024-05-01T11:15:00-04:00,2024-05-01,"Meet the Unstoppable Stock That Just Joined Nvidia, Microsoft, and Apple in the $2 Trillion Club","The $1 trillion club has just six members, but the $2 trillion club is even more exclusive. Alphabet became the newest member last week, joining Microsoft, Apple, and Nvidia.",fool.com,https://www.fool.com/investing/2024/05/01/meet-the-unstoppable-stock-that-just-joined-nvidia/,https://images.financialmodelingprep.com/news/meet-the-unstoppable-stock-that-just-joined-nvidia-microsoft-and-20240501.jpg
MSFT,2024-04-25,2024-04-11,2024-05-09,MSFT,,2024-05-01 11:59:04,2024-05-01T11:59:04-04:00,2024-05-01,3 Tech Stocks Hitting SPY Hard,"The SPDY S&P 500 ETF Trust (NYSE: SPY) provides investors and easy way to invest in the broad market and before expenses, performance corresponds to the price and yields of the S&P 500 Index.",247wallst.com,https://247wallst.com/investing/2024/05/01/3-tech-stocks-hitting-spy-hard/,https://images.financialmodelingprep.com/news/3-tech-stocks-hitting-spy-hard-20240501.jpg
MSFT,2024-04-25,2024-04-11,2024-05-09,MSFT,,2024-05-01 12:16:22,2024-05-01T12:16:22-04:00,2024-05-01,Microsoft and OpenAI face copyright lawsuit from eight US newspapers,"A group of eight US newspapers, including the Chicago Tribune and Denver Post, has lodged a lawsuit against ChatGPT developer OpenAI and financial backer Microsoft, accusing them of harvesting copyrighted content to train their AI-driven chatbots. Frank Pine, the executive editor for both MediaNews Group and Tribune Publishing, stated: ""We've spent billions of dollars gathering information and reporting news at our publications, and we can't allow OpenAI and Microsoft to expand the Big Tech playbook of stealing our work to build their own businesses at our expense.",proactiveinvestors.com,https://www.proactiveinvestors.com/companies/news/1046623,https://images.financialmodelingprep.com/news/microsoft-and-openai-face-copyright-lawsuit-from-eight-us-20240501.jpg
MSFT,2024-04-25,2024-04-11,2024-05-09,MSFT,,2024-05-01 13:00:00,2024-05-01T13:00:00-04:00,2024-05-01,Former Microsoft engineers raise $3M for cybersecurity startup StepSecurity,"StepSecurity, a Seattle-area startup aiming to help developers secure their projects, raised a $3 million seed round led by Runtime Ventures.",geekwire.com,https://www.geekwire.com/2024/former-microsoft-engineers-raise-3m-for-github-focused-cybersecurity-startup-stepsecurity/,https://images.financialmodelingprep.com/news/former-microsoft-engineers-raise-3m-for-cybersecurity-startup-stepsecurity-20240501.jpg
MSFT,2024-04-25,2024-04-11,2024-05-09,MSFT,,2024-05-01 15:24:23,2024-05-01T15:24:23-04:00,2024-05-01,Stock Market Crash Alert: 3 Must-Buy Dow Stocks When Prices Plunge,The Dow Jones Industrial Average has been around since 1885. The index contains 30 stocks and has regularly added and removed holdings from the list.,investorplace.com,https://investorplace.com/2024/05/stock-market-crash-alert-3-must-buy-dow-stocks-when-prices-plunge/,https://images.financialmodelingprep.com/news/stock-market-crash-alert-3-mustbuy-dow-stocks-when-20240501.png
MSFT,2024-04-25,2024-04-11,2024-05-09,MSFT,,2024-05-01 18:09:31,2024-05-01T18:09:31-04:00,2024-05-01,"Amazon, Microsoft, and Alphabet are doubling down on AI for the cloud — and it seems to be paying off","Amazon, Microsoft, and Alphabet's first quarter earnings surpassed Wall Street's estimates.  Execs credit some of the gains to their AI efforts, which they say help boost cloud revenue.",businessinsider.com,https://www.businessinsider.com/ai-is-paying-off-for-some-major-cloud-providers-2024-5,https://images.financialmodelingprep.com/news/amazon-microsoft-and-alphabet-are-doubling-down-on-ai-20240501.jpg
MSFT,2024-04-25,2024-04-11,2024-05-09,MSFT,,2024-05-01 23:49:02,2024-05-01T23:49:02-04:00,2024-05-01,Microsoft to invest $2.2 bln in cloud and AI services in Malaysia,"Microsoft will invest $2.2 billion over the next four years in Malaysia to support the country's digital transformation, the company said in a statement on Thursday.",reuters.com,https://www.reuters.com/technology/microsoft-invest-22-bln-malaysias-digital-transformation-2024-05-02/,https://images.financialmodelingprep.com/news/microsoft-to-invest-22-bln-in-cloud-and-ai-services-20240501.jpg
MSFT,2024-04-25,2024-04-11,2024-05-09,MSFT,,2024-05-01 23:56:27,2024-05-01T23:56:27-04:00,2024-05-01,Microsoft to open new data center in Thailand as it doubles down on AI and Southeast Asia,"The U.S. tech giant said it will also commit toward AI skills training for over 100,000 Thais and support local developers.",cnbc.com,https://www.cnbc.com/2024/05/02/microsoft-to-open-data-center-in-thailand-amid-southeast-asia-expansion.html,https://images.financialmodelingprep.com/news/microsoft-to-open-new-data-center-in-thailand-as-20240501.jpeg
MSFT,2024-04-25,2024-04-11,2024-05-09,MSFT,,2024-05-02 03:45:42,2024-05-02T03:45:42-04:00,2024-05-02,Microsoft will invest $2.2 billion in cloud and AI services in Malaysia,"Microsoft is investing $2.2 billion over the next four years in Malaysia's new cloud and artificial intelligence infrastructure as well as partnering with the government to establish a national AI center, its CEO Satya Nadella said Thursday.",techxplore.com,https://techxplore.com/news/2024-05-microsoft-invest-billion-cloud-ai.html,https://images.financialmodelingprep.com/news/microsoft-will-invest-22-billion-in-cloud-and-ai-20240502.jpg
MSFT,2024-04-25,2024-04-11,2024-05-09,MSFT,,2024-05-02 04:45:00,2024-05-02T04:45:00-04:00,2024-05-02,3 Artificial Intelligence (AI) Stocks to Buy in May,Investors should look again at the chip company leading the way in AI. This car company could take a critical AI application into overdrive.,fool.com,https://www.fool.com/investing/2024/05/02/3-artificial-intelligence-ai-stocks-to-buy-in-may/,https://images.financialmodelingprep.com/news/3-artificial-intelligence-ai-stocks-to-buy-in-may-20240502.jpg
MSFT,2024-04-25,2024-04-11,2024-05-09,MSFT,,2024-05-02 05:12:00,2024-05-02T05:12:00-04:00,2024-05-02,"Possible Stock Splits in 2024: 2 Growth Stocks Up 437% and 541% in 7 Years to Buy Now, According to Wall Street","Significant share-price appreciation usually precedes stock splits, but it can also help investors find companies with solid fundamentals and compelling growth prospects. Microsoft has a strong presence in enterprise software and cloud services, and Intuit is the market leader in U.S. tax preparation and accounting software.",fool.com,https://www.fool.com/investing/2024/05/02/stock-splits-2-growth-stocks-up-541-to-buy-wall-st/,https://images.financialmodelingprep.com/news/possible-stock-splits-in-2024-2-growth-stocks-up-20240502.jpg
MSFT,2024-04-25,2024-04-11,2024-05-09,MSFT,,2024-05-02 05:36:06,2024-05-02T05:36:06-04:00,2024-05-02,3 stocks poised for trillion-dollar valuations to consider today,"Identifying the next trillion-dollar market is a serious challenge. Reaching a trillion-dollar market cap symbolizes more than just financial success; it reflects a company's profound global impact, expansive customer base, and enduring brand influence.",finbold.com,https://finbold.com/3-stocks-poised-for-trillion-dollar-valuations-to-consider-today/,https://images.financialmodelingprep.com/news/3-stocks-poised-for-trilliondollar-valuations-to-consider-today-20240502.jpg
MSFT,2024-04-25,2024-04-11,2024-05-09,MSFT,,2024-05-02 06:40:00,2024-05-02T06:40:00-04:00,2024-05-02,2 No-Brainer Stocks to Buy Right Now for Less than $500,Alphabet's AI leadership is paying off with growing advertising and subscription revenue. Microsoft is experiencing strong adoption of AI services from Windows users and enterprise customers in Azure.,fool.com,https://www.fool.com/investing/2024/05/02/2-no-brainer-stocks-buy-right-now-500/,https://images.financialmodelingprep.com/news/2-nobrainer-stocks-to-buy-right-now-for-less-20240502.jpg
MSFT,2024-04-25,2024-04-11,2024-05-09,MSFT,,2024-05-02 06:44:00,2024-05-02T06:44:00-04:00,2024-05-02,Meme Stocks That Actually Make Sense? 3 Viral Names for Your Buy List,Meme stocks are simply those that have gained substantial popularity on social media leading many investors to buy them. That generally causes people to create pictures and gifs including humorous text known as memes of the stocks.,investorplace.com,https://investorplace.com/2024/05/meme-stocks-that-actually-make-sense-3-viral-names-for-your-buy-list/,https://images.financialmodelingprep.com/news/meme-stocks-that-actually-make-sense-3-viral-names-20240502.png
MSFT,2024-04-25,2024-04-11,2024-05-09,MSFT,,2024-05-02 06:48:00,2024-05-02T06:48:00-04:00,2024-05-02,Highly ranked manager who bet on Mag 7 giants looks to these second-order winners from AI,"Large-cap growth funds have been in the sweet spot for a few years now, thanks to megacap tech holdings.",marketwatch.com,https://www.marketwatch.com/story/highly-ranked-manager-who-bet-on-mag-7-giants-looks-to-these-second-order-winners-from-ai-affbc72d,https://images.financialmodelingprep.com/news/highly-ranked-manager-who-bet-on-mag-7-giants-20240502.jpg
MSFT,2024-04-25,2024-04-11,2024-05-09,MSFT,,2024-05-02 07:15:00,2024-05-02T07:15:00-04:00,2024-05-02,Intel and Microsoft are on different paths to profit from AI. One will be right.,Intel Corp. and Microsoft Corp. are painting two opposite pictures of the state of artificial intelligence right now.,marketwatch.com,https://www.marketwatch.com/story/intel-and-microsoft-are-on-different-paths-to-profit-from-ai-one-will-be-right-615a33e2,https://images.financialmodelingprep.com/news/intel-and-microsoft-are-on-different-paths-to-profit-20240502.jpg
MSFT,2024-04-25,2024-04-11,2024-05-09,MSFT,,2024-05-02 08:15:00,2024-05-02T08:15:00-04:00,2024-05-02,Microsoft Is Making a Massive $10 Billion Renewable Energy Bet (That Will Pay Big Dividends for This Top Energy Stock),Microsoft signed a global renewable energy framework with Brookfield. The deal will accelerate renewable energy development.,fool.com,https://www.fool.com/investing/2024/05/02/microsoft-is-making-a-massive-10-billion-renewable/,https://images.financialmodelingprep.com/news/microsoft-is-making-a-massive-10-billion-renewable-energy-20240502.jpg
MSFT,2024-04-25,2024-04-11,2024-05-09,MSFT,,2024-05-02 08:29:00,2024-05-02T08:29:00-04:00,2024-05-02,"Microsoft, AMD, SoFI, Amazon, and Other Tech Stocks in Focus Today",Tech stocks launched a comeback early Thursday as the sector was seemingly buoyed by Federal Reserve Chairman Jerome Powell's comments.,barrons.com,https://www.barrons.com/articles/microsoft-amd-sofi-amazon-tech-stocks-today-f44d8d6f,https://images.financialmodelingprep.com/news/microsoft-amd-sofi-amazon-and-other-tech-stocks-in-20240502.jpg
MSFT,2024-04-25,2024-04-11,2024-05-09,MSFT,,2024-05-02 10:13:00,2024-05-02T10:13:00-04:00,2024-05-02,Better AI Stock: Microsoft vs. AMD,"Microsoft's recent earnings release beat analysts' forecasts on multiple counts. Meanwhile, AMD is making headway with its new AI GPUs.",fool.com,https://www.fool.com/investing/2024/05/02/better-ai-stock-microsoft-vs-amd/,https://images.financialmodelingprep.com/news/better-ai-stock-microsoft-vs-amd-20240502.jpg
MSFT,2024-04-25,2024-04-11,2024-05-09,MSFT,,2024-05-02 11:37:00,2024-05-02T11:37:00-04:00,2024-05-02,SEC Ends Probe of Trades Before Activision-Microsoft Merger with No Action,Securities regulators have ended an investigation into large bets that Barry Diller and others made on Activision Blizzard days before the videogame company agreed to be acquired by Microsoft in 2022.,wsj.com,https://www.wsj.com/articles/sec-ends-probe-of-trades-before-activision-microsoft-merger-with-no-action-b13cce7c,https://images.financialmodelingprep.com/news/sec-ends-probe-of-trades-before-activisionmicrosoft-merger-with-20240502.jpg
MSFT,2024-04-25,2024-04-11,2024-05-09,MSFT,,2024-05-02 14:02:47,2024-05-02T14:02:47-04:00,2024-05-02,Analysis: Microsoft's $2.2 Billion AI Bet May Boost Malaysia's Tech Industry,"Microsoft will inject $2.2 billion into Malaysia's burgeoning cloud and artificial intelligence (AI) infrastructure over the next four years, CEO Satya Nadella announced on Thursday (May 2). The tech giant's move highlights a growing effort to expand AI capabilities beyond U.S. and European borders.",pymnts.com,https://www.pymnts.com/artificial-intelligence-2/2024/analysis-microsofts-2-2-billion-ai-bet-may-boost-malaysias-tech-industry/,https://images.financialmodelingprep.com/news/analysis-microsofts-22-billion-ai-bet-may-boost-malaysias-20240502.jpg
MSFT,2024-04-25,2024-04-11,2024-05-09,MSFT,,2024-05-02 14:44:36,2024-05-02T14:44:36-04:00,2024-05-02,Microsoft bans U.S. police departments from using enterprise AI tool,"Microsoft has changed its policy to ban U.S. police departments from using generative AI through the Azure OpenAI Service, the company's fully managed, enterprise-focused wrapper around OpenAI technologies.",techcrunch.com,https://techcrunch.com/2024/05/02/microsoft-bans-u-s-police-departments-from-using-enterprise-ai-tool/,https://images.financialmodelingprep.com/news/microsoft-bans-us-police-departments-from-using-enterprise-ai-20240502.jpg
MSFT,2024-04-25,2024-04-11,2024-05-09,MSFT,,2024-05-02 14:59:00,2024-05-02T14:59:00-04:00,2024-05-02,"Former Microsoft Sales Executive, Bob Culliton, Joins LawFi as SVP of Partnerships","JACKSONVILLE, Fla.--(BUSINESS WIRE)--LawFi, Inc., (“LawFi”) a pioneering Legal Fintech Lender and the Inventor of the “Legal Fee Loan” is pleased to announce the addition of Mr. Bob Culliton to our growing team. Mr. Culliton has signed on as an Advisor and SVP of Partnerships to guide our development and implementation of various integration and distribution partnership programs. Bob has extensive sales leadership and partner engagement experience, highlighted by 21 years at Microsoft where he.",businesswire.com,https://www.businesswire.com/news/home/20240502910172/en/Former-Microsoft-Sales-Executive-Bob-Culliton-Joins-LawFi-as-SVP-of-Partnerships/,https://images.financialmodelingprep.com/news/former-microsoft-sales-executive-bob-culliton-joins-lawfi-as-20240502.jpg
MSFT,2024-04-25,2024-04-11,2024-05-09,MSFT,,2024-05-02 16:57:36,2024-05-02T16:57:36-04:00,2024-05-02,Microsoft bans U.S. police departments from using enterprise AI tool for facial recognition,"Microsoft has changed its policy to ban U.S. police departments from using generative AI for facial recognition through the Azure OpenAI Service, the company's fully managed, enterprise-focused wrapper around OpenAI technologies.",techcrunch.com,https://techcrunch.com/2024/05/02/microsoft-bans-u-s-police-departments-azure-openai-facial-recognition/,https://images.financialmodelingprep.com/news/microsoft-bans-us-police-departments-from-using-enterprise-ai-tool-20240502.jpg
MSFT,2024-04-25,2024-04-11,2024-05-09,MSFT,,2024-05-02 17:15:00,2024-05-02T17:15:00-04:00,2024-05-02,RSA Partners with Microsoft to Secure Environments through New External Authentication Methods Capability,"BEDFORD, Mass.--(BUSINESS WIRE)--RSA continues partnership with Microsoft with new External Authentication Methods (EAM) Capability.",businesswire.com,https://www.businesswire.com/news/home/20240502861191/en/RSA-Partners-with-Microsoft-to-Secure-Environments-through-New-External-Authentication-Methods-Capability/,https://images.financialmodelingprep.com/news/rsa-partners-with-microsoft-to-secure-environments-through-new-20240502.jpg
