ticker,event_date,window_start,window_end,symbol,symbols,publishedDate,publishedDateET,date_et,title,text,site,url,image
MSFT,2024-04-25,2024-04-11,2024-05-09,MSFT,,2024-04-18 08:35:00,2024-04-18T08:35:00-04:00,2024-04-18,Microsoft's Earnings Are Next Week. It's All About Azure and AI.,"Software firm Microsoft is set to report earnings on April 25, and some analysts are upbeat, citing tailwinds from artificial intelligence.",barrons.com,https://www.barrons.com/articles/microsofts-earnings-wall-street-stock-29033356,https://images.financialmodelingprep.com/news/microsofts-earnings-are-next-week-its-all-about-azure-20240418.jpg
MSFT,2024-04-25,2024-04-11,2024-05-09,MSFT,,2024-04-18 09:16:00,2024-04-18T09:16:00-04:00,2024-04-18,IntelePeer Integrates with Microsoft Azure OpenAI Service to Deliver AI Automation Solutions to Significantly Improve Customer Service,"DANIA BEACH, Fla.--(BUSINESS WIRE)--IntelePeer, a leading AI-powered Communications Automation Platform provider, has integrated with Microsoft Azure OpenAI Service to embed OpenAI GPT into the company's Communications Automation Platform and Intelligent Virtual Assistant (IVA), SmartAgent™. With this integration, IntelePeer is delivering advanced solutions to fully automate customer interactions and improve operational efficiencies for businesses while creating a faster and easier customer exp.",businesswire.com,https://www.businesswire.com/news/home/20240418493509/en/IntelePeer-Integrates-with-Microsoft-Azure-OpenAI-Service-to-Deliver-AI-Automation-Solutions-to-Significantly-Improve-Customer-Service/,https://images.financialmodelingprep.com/news/intelepeer-integrates-with-microsoft-azure-openai-service-to-deliver-20240418.jpg
MSFT,2024-04-25,2024-04-11,2024-05-09,MSFT,,2024-04-18 11:07:05,2024-04-18T11:07:05-04:00,2024-04-18,Microsoft (MSFT) Reports Next Week: Wall Street Expects Earnings Growth,Microsoft (MSFT) doesn't possess the right combination of the two key ingredients for a likely earnings beat in its upcoming report. Get prepared with the key expectations.,zacks.com,https://www.zacks.com/stock/news/2257717/microsoft-msft-reports-next-week-wall-street-expects-earnings-growth?cid=CS-STOCKNEWSAPI-FT-tale_of_the_tape|yseop_template_9-2257717,https://images.financialmodelingprep.com/news/microsoft-msft-reports-next-week-wall-street-expects-earnings-20240418.jpg
MSFT,2024-04-25,2024-04-11,2024-05-09,MSFT,,2024-04-18 11:41:42,2024-04-18T11:41:42-04:00,2024-04-18,"Exclusive: Microsoft's OpenAI partnership could face EU antitrust probe, sources say","Microsoft's $13 billion investment in OpenAI could face an EU antitrust investigation as regulators are building the case for such a move, people familiar with the matter said on Thursday.",reuters.com,https://www.reuters.com/technology/microsofts-openai-partnership-could-face-eu-antitrust-probe-sources-say-2024-04-18/,https://images.financialmodelingprep.com/news/exclusive-microsofts-openai-partnership-could-face-eu-antitrust-probe-20240418.jpg
MSFT,2024-04-25,2024-04-11,2024-05-09,MSFT,,2024-04-18 11:53:57,2024-04-18T11:53:57-04:00,2024-04-18,"7 Must-Have AI Stocks, Fed Rate Cuts or No Fed Rate Cuts","Markets have remained strong in 2024 primarily because of two factors: the emergence of AI stocks and expectations of multiple Fed rate cuts this year. However, inflation remains high while other economic signals indicate a strong economy overall.",investorplace.com,https://investorplace.com/2024/04/7-must-have-ai-stocks-fed-rate-cuts-or-no-fed-rate-cuts/,https://images.financialmodelingprep.com/news/7-musthave-ai-stocks-fed-rate-cuts-or-no-20240418.png
MSFT,2024-04-25,2024-04-11,2024-05-09,MSFT,,2024-04-18 11:54:27,2024-04-18T11:54:27-04:00,2024-04-18,7 Stocks to Buy Now: Q2 Edition,"Buying and holding stocks for the long run is a time-tested strategy that can generate sizable long-term returns. Investors can simplify the experience by purchasing shares of top-tier ETFs with low expense ratios, but also by picking up stocks to buy now that can lead to market outperformance.",investorplace.com,https://investorplace.com/2024/04/7-stocks-to-buy-now-q2-edition/,https://images.financialmodelingprep.com/news/7-stocks-to-buy-now-q2-edition-20240418.png
MSFT,2024-04-25,2024-04-11,2024-05-09,MSFT,,2024-04-18 12:21:19,2024-04-18T12:21:19-04:00,2024-04-18,Underappreciated Industry Benefits from AI Buildout,"Picking winners in a hot industry like AI can be challenging as the competition is fierce. Nevertheless, the one constant is that the proliferation of AI will require a plethora of new energy production.",zacks.com,https://www.zacks.com/commentary/2257853/underappreciated-industry-benefits-from-ai-buildout?cid=CS-STOCKNEWSAPI-FT-investment_ideas-2257853,https://images.financialmodelingprep.com/news/underappreciated-industry-benefits-from-ai-buildout-20240418.jpg
MSFT,2024-04-25,2024-04-11,2024-05-09,MSFT,,2024-04-19 03:34:00,2024-04-19T03:34:00-04:00,2024-04-19,History Says the Nasdaq Will Continue to Soar in 2024: My Top 5 Artificial Intelligence (AI) Growth Stocks to Buy Before the Surge Continues,"The Nasdaq Composite has surged over the past year or so, but history suggests the rally is far from over. Generative AI has gone viral but is just getting started.",fool.com,https://www.fool.com/investing/2024/04/19/history-says-the-nasdaq-will-continue-to-soar-in-2/,https://images.financialmodelingprep.com/news/history-says-the-nasdaq-will-continue-to-soar-in-20240419.jpg
MSFT,2024-04-25,2024-04-11,2024-05-09,MSFT,,2024-04-19 04:20:00,2024-04-19T04:20:00-04:00,2024-04-19,Is Microsoft a Top Stock for Quantum Computing Right Now?,Microsoft and Quantinuum recently announced a breakthrough in quantum computing. Big tech companies like Microsoft use AI systems to help accelerate R&D on quantum computing technology.,fool.com,https://www.fool.com/investing/2024/04/19/microsoft-top-stock-quantum-computing-right-now/,https://images.financialmodelingprep.com/news/is-microsoft-a-top-stock-for-quantum-computing-right-20240419.jpg
MSFT,2024-04-25,2024-04-11,2024-05-09,MSFT,,2024-04-19 04:35:00,2024-04-19T04:35:00-04:00,2024-04-19,Forget Nvidia: These Are the 3 Tech Stocks Billionaires Can't Stop Buying,Researchers at The Motley Fool examined hedge funds run by billionaire investors to determine their most widely held tech stocks. It shouldn't come as a surprise that the results skewed heavily towards some of the top purveyors of artificial intelligence (AI) technology.,fool.com,https://www.fool.com/investing/2024/04/19/forget-nvidia-these-are-the-3-tech-stocks-billiona/,https://images.financialmodelingprep.com/news/forget-nvidia-these-are-the-3-tech-stocks-billionaires-20240419.jpg
MSFT,2024-04-25,2024-04-11,2024-05-09,MSFT,,2024-04-19 06:00:00,2024-04-19T06:00:00-04:00,2024-04-19,3 Magnificent 7 Stocks to Buy Now: Q2 Edition,"With the technology space encountering a sizable correction, it's time to consider Magnificent 7 stocks to buy now. Credited to Bank of America analyst Michael Hartnett for using the borrowed term from an old film, this list comprises the most popular and compelling businesses available.",investorplace.com,https://investorplace.com/2024/04/3-magnificent-7-stocks-to-buy-now-q2-edition/,https://images.financialmodelingprep.com/news/3-magnificent-7-stocks-to-buy-now-q2-edition-20240419.png
MSFT,2024-04-25,2024-04-11,2024-05-09,MSFT,,2024-04-19 06:28:00,2024-04-19T06:28:00-04:00,2024-04-19,The 3 Best Cybersecurity Stocks to Buy Now: Q2 Edition,Cybersecurity stocks have been going through a tough stretch. Many cybersecurity firms that have dominated the stock market since the pandemic (and even before that point) have been losing momentum.,investorplace.com,https://investorplace.com/2024/04/the-3-best-cybersecurity-stocks-to-buy-now-q2-edition/,https://images.financialmodelingprep.com/news/the-3-best-cybersecurity-stocks-to-buy-now-q2-20240419.jpg
MSFT,2024-04-25,2024-04-11,2024-05-09,MSFT,,2024-04-19 07:30:00,2024-04-19T07:30:00-04:00,2024-04-19,Strong Buy Alert: 7 No-Brainer Stocks to Scoop Up Now,"When Wall Street tags a stock as a strong buy, it is probably right. Generally speaking, such shares tend to be among the best positioned investments in the market.",investorplace.com,https://investorplace.com/2024/04/strong-buy-alert-7-no-brainer-stocks-to-scoop-up-now/,https://images.financialmodelingprep.com/news/strong-buy-alert-7-nobrainer-stocks-to-scoop-up-20240419.jpg
MSFT,2024-04-25,2024-04-11,2024-05-09,MSFT,,2024-04-19 08:45:00,2024-04-19T08:45:00-04:00,2024-04-19,Microsoft Invests $1.5 Billion in an AI Company: Here's What Investors Should Know,Microsoft is investing $1.5 billion in G42 in a strategic partnership. G42 is a tech holding company that is focusing its efforts on AI.,fool.com,https://www.fool.com/investing/2024/04/19/microsoft-invests-1-point-5-billion-in-ai-firm/,https://images.financialmodelingprep.com/news/microsoft-invests-15-billion-in-an-ai-company-heres-20240419.jpg
MSFT,2024-04-25,2024-04-11,2024-05-09,MSFT,,2024-04-19 09:00:00,2024-04-19T09:00:00-04:00,2024-04-19,Prediction: This Artificial Intelligence (AI) Stock Could Be Worth More Than Microsoft 5 Years From Now,"Amazon is expected to clock a healthy growth rate over the next five years, with AI set to be a key catalyst. The company is aggressively integrating AI into its platforms to capitalize on lucrative opportunities.",fool.com,https://www.fool.com/investing/2024/04/19/prediction-this-artificial-intelligence-ai-stock/,https://images.financialmodelingprep.com/news/prediction-this-artificial-intelligence-ai-stock-could-be-worth-20240419.jpg
MSFT,2024-04-25,2024-04-11,2024-05-09,MSFT,,2024-04-19 10:05:17,2024-04-19T10:05:17-04:00,2024-04-19,Is Trending Stock Microsoft Corporation (MSFT) a Buy Now?,"Recently, Zacks.com users have been paying close attention to Microsoft (MSFT). This makes it worthwhile to examine what the stock has in store.",zacks.com,https://www.zacks.com/stock/news/2258313/is-trending-stock-microsoft-corporation-msft-a-buy-now?cid=CS-STOCKNEWSAPI-FT-tale_of_the_tape|most_searched_stocks-2258313,https://images.financialmodelingprep.com/news/is-trending-stock-microsoft-corporation-msft-a-buy-now-20240419.jpg
MSFT,2024-04-25,2024-04-11,2024-05-09,MSFT,,2024-04-19 13:04:10,2024-04-19T13:04:10-04:00,2024-04-19,"Microsoft poised for growth in Q3, Bank of America analysts say",Microsoft Corp (NASDAQ:MSFT) is expected to showcase a strong performance in its upcoming fiscal third quarter earnings release. Bank of America analysts are projecting 1% upside to the Street's revenue estimate of $60.5 billion.,proactiveinvestors.com,https://www.proactiveinvestors.com/companies/news/1045729?SNAPI,https://images.financialmodelingprep.com/news/microsoft-poised-for-growth-in-q3-bank-of-america-20240419.jpg
MSFT,2024-04-25,2024-04-11,2024-05-09,MSFT,,2024-04-19 13:04:10,2024-04-19T13:04:10-04:00,2024-04-19,"Microsoft poised for growth in Q3, Bank of America analysts say",Microsoft Corp (NASDAQ:MSFT) is expected to showcase a strong performance in its upcoming fiscal third quarter earnings release. Bank of America analysts are projecting 1% upside to the Street's revenue estimate of $60.5 billion.,proactiveinvestors.com,https://www.proactiveinvestors.com/companies/news/1045729,https://images.financialmodelingprep.com/news/microsoft-poised-for-growth-in-q3-bank-of-america-analysts-20240419.jpg
MSFT,2024-04-25,2024-04-11,2024-05-09,MSFT,,2024-04-19 14:55:38,2024-04-19T14:55:38-04:00,2024-04-19,What You Need To Know Ahead of Microsoft's Earnings Report Thursday,"Microsoft (MSFT) is set to report earnings for the third quarter of the 2024 fiscal year Thursday after the bell, when investors will likely be watching for its cloud segment growth and any artificial intelligence (AI) updates from Microsoft's OpenAI partner.",investopedia.com,https://www.investopedia.com/microsoft-q3-fy-2024-earnings-preview-8633503,https://images.financialmodelingprep.com/news/what-you-need-to-know-ahead-of-microsofts-earnings-20240419.jpg
MSFT,2024-04-25,2024-04-11,2024-05-09,MSFT,,2024-04-19 16:32:41,2024-04-19T16:32:41-04:00,2024-04-19,"How To Generate $10,000 In Passive Income This Year","8.47% $1,694 Total:    $10,012   Take This Retirement Quiz To Get Matched With A Financial Advisor (Sponsored) Take the quiz below to get matched with a financial advisor today.",247wallst.com,https://247wallst.com/investing/2024/04/19/how-to-generate-10000-in-passive-income-this-year/,https://images.financialmodelingprep.com/news/how-to-generate-10000-in-passive-income-this-year-20240419.jpg
MSFT,2024-04-25,2024-04-11,2024-05-09,MSFT,,2024-04-19 16:32:41,2024-04-19T16:32:41-04:00,2024-04-19,"How To Generate $10,000 In Passive Income This Year","8.47% $1,694 Total:    $10,012   Take This Retirement Quiz To Get Matched With A Financial Advisor (Sponsored) Take the quiz below to get matched with a financial advisor today.",247wallst.com,https://247wallst.com/investing/2024/04/19/how-to-generate-10000-in-passive-income-this-year/?utm_source=snapi,https://images.financialmodelingprep.com/news/how-to-generate-10000-in-passive-income-this-year-20240419.jpg
MSFT,2024-04-25,2024-04-11,2024-05-09,MSFT,,2024-04-19 17:44:45,2024-04-19T17:44:45-04:00,2024-04-19,"Stock Market Action Plan: Tesla, Microsoft, Boeing, Google, Meta Headline A Big Earnings Week","The stock market wades into the thick of earnings season with Microsoft, Meta Platforms, Boeing and other leading names due to report.",investors.com,https://www.investors.com/research/investing-action-plan/stock-market-action-plan-tesla-microsoft-headline-earnings-week/,https://images.financialmodelingprep.com/news/stock-market-action-plan-tesla-microsoft-boeing-google-meta-20240419.jpg
MSFT,2024-04-25,2024-04-11,2024-05-09,MSFT,,2024-04-19 18:41:04,2024-04-19T18:41:04-04:00,2024-04-19,What Can Investors Expect From Big Tech Earnings?,Many in the market are looking to this week's quarterly results from the four members of ‘the Magnificent 7' to help reverse the stock market's ongoing weakness.,zacks.com,https://www.zacks.com/commentary/2258747/what-can-investors-expect-from-big-tech-earnings?cid=CS-STOCKNEWSAPI-FT-earnings_preview-2258747,https://images.financialmodelingprep.com/news/what-can-investors-expect-from-big-tech-earnings-20240419.jpg
MSFT,2024-04-25,2024-04-11,2024-05-09,MSFT,,2024-04-20 03:25:00,2024-04-20T03:25:00-04:00,2024-04-20,3 Millionaire-Maker Artificial Intelligence (AI) Stocks,"Most enterprises want to utilize artificial intelligence, they just don't know how. C3.ai helps get them started.",fool.com,https://www.fool.com/investing/2024/04/20/3-millionaire-maker-artificial-intelligence-ai-sto/,https://images.financialmodelingprep.com/news/3-millionairemaker-artificial-intelligence-ai-stocks-20240420.jpg
MSFT,2024-04-25,2024-04-11,2024-05-09,MSFT,,2024-04-20 09:00:00,2024-04-20T09:00:00-04:00,2024-04-20,Our Top 10 Dividend Growth Stocks - April 2024,"This article focuses on selecting high-growth dividend stocks that have rapidly grown their dividends in the recent past, rather than simply sport a high current yield. We use our proprietary models to rate quantitatively and qualitatively and select the top ten names from an initial list of nearly 400 dividend stocks. The article provides criteria for selecting high-growth dividend stocks. It offers a step-by-step guide on structuring a portfolio based on this strategy.",seekingalpha.com,https://seekingalpha.com/article/4684225-our-top-10-dividend-growth-stocks-april-2024,https://images.financialmodelingprep.com/news/our-top-10-dividend-growth-stocks-april-2024-20240420.jpg
MSFT,2024-04-25,2024-04-11,2024-05-09,MSFT,,2024-04-20 11:00:00,2024-04-20T11:00:00-04:00,2024-04-20,3 Clean Tech Stocks to Make Your Portfolio Shine on Earth Day,"The global economy is progressing towards a sustainable future, making it an excellent time to invest in clean tech stocks ahead of Earth Day. Sustainability has been a big talking points over the past several years, and it's a secular trend that will continue benefitting businesses looking to evolve.",investorplace.com,https://investorplace.com/2024/04/3-clean-tech-stocks-to-make-your-portfolio-shine-on-earth-day/,https://images.financialmodelingprep.com/news/3-clean-tech-stocks-to-make-your-portfolio-shine-20240420.jpg
MSFT,2024-04-25,2024-04-11,2024-05-09,MSFT,,2024-04-20 12:54:57,2024-04-20T12:54:57-04:00,2024-04-20,Magnificent Seven stocks ‘not so magnificent' on week's closure,"In a week marked by significant turbulence, ‘Magnificent Seven' stocks experienced a notable decline, diverging sharply from their typically robust performance.",finbold.com,https://finbold.com/magnificent-seven-stocks-not-so-magnificent-on-weeks-closure/,https://images.financialmodelingprep.com/news/magnificent-seven-stocks-not-so-magnificent-on-weeks-closure-20240420.jpg
MSFT,2024-04-25,2024-04-11,2024-05-09,MSFT,,2024-04-20 12:54:57,2024-04-20T12:54:57-04:00,2024-04-20,Magnificent Seven stocks ‘not so magnificent' on week's closure,"In a week marked by significant turbulence, ‘Magnificent Seven' stocks experienced a notable decline, diverging sharply from their typically robust performance.",finbold.com,https://finbold.com/magnificent-seven-stocks-not-so-magnificent-on-weeks-closure/?utm_source=snapi,https://images.financialmodelingprep.com/news/magnificent-seven-stocks-not-so-magnificent-on-weeks-closure-20240420.jpg
MSFT,2024-04-25,2024-04-11,2024-05-09,MSFT,,2024-04-21 03:00:00,2024-04-21T03:00:00-04:00,2024-04-21,"Big Fund Doubles Down on Palantir Stock, Sells Apple, Tesla, Microsoft","DNB Asset Management, the asset manager of Norway's largest bank, disclosed the moves in a filing with the SEC.",barrons.com,https://www.barrons.com/articles/palantir-stock-apple-tesla-microsoft-1ab0e0ba,https://images.financialmodelingprep.com/news/big-fund-doubles-down-on-palantir-stock-sells-apple-20240421.jpg
MSFT,2024-04-25,2024-04-11,2024-05-09,MSFT,,2024-04-21 07:24:41,2024-04-21T07:24:41-04:00,2024-04-21,What Will Make Super Micro Surge Higher?,The 23% collapse of Super Micro Computer (NASDAQ: SMCI) stock in one day was blamed on a flight from AI stocks.,247wallst.com,https://247wallst.com/apps-software/2024/04/21/what-will-make-super-micro-surge-higher/,https://images.financialmodelingprep.com/news/what-will-make-super-micro-surge-higher-20240421.jpg
MSFT,2024-04-25,2024-04-11,2024-05-09,MSFT,,2024-04-21 10:00:00,2024-04-21T10:00:00-04:00,2024-04-21,2 Top Dividend Stocks to Buy Right Now,Microsoft has ably positioned itself to cash in on the artificial intelligence boom. Exxon Mobil could insulate your portfolio from the threat of surging oil prices.,fool.com,https://www.fool.com/investing/2024/04/21/2-top-dividend-stocks-to-buy-right-now/,https://images.financialmodelingprep.com/news/2-top-dividend-stocks-to-buy-right-now-20240421.jpg
MSFT,2024-04-25,2024-04-11,2024-05-09,MSFT,,2024-04-21 10:00:00,2024-04-21T10:00:00-04:00,2024-04-21,3 Dividend Stocks to Buy Now: Q2 Edition,Buying dividend stocks can help you generate steady cash flow. You won't have to sell shares to cover your living expenses if you continue to make frequent contributions to your portfolio.,investorplace.com,https://investorplace.com/2024/04/3-dividend-stocks-to-buy-now-q2-edition/,https://images.financialmodelingprep.com/news/3-dividend-stocks-to-buy-now-q2-edition-20240421.jpg
MSFT,2024-04-25,2024-04-11,2024-05-09,MSFT,,2024-04-21 10:01:00,2024-04-21T10:01:00-04:00,2024-04-21,The Magnificent Seven have gotten less magnificent ahead of earnings. This one could have the most explaining to do.,"The so-called Magnificent Seven — Apple Inc., Nvidia Corp., Microsoft Corp., Tesla Inc. Google parent Alphabet Inc., Amazon.com, Meta Platforms Inc., the parent of Facebook and Instagram — have done the heavy lifting for the U.S. stock market since last year's massive artificial intelligence stock-buying bender.",marketwatch.com,https://www.marketwatch.com/story/the-magnificent-seven-have-gotten-less-magnificent-ahead-of-earnings-this-one-could-have-the-most-explaining-to-do-96f847be,https://images.financialmodelingprep.com/news/the-magnificent-seven-have-gotten-less-magnificent-ahead-of-20240421.jpg
MSFT,2024-04-25,2024-04-11,2024-05-09,MSFT,,2024-04-21 16:00:00,2024-04-21T16:00:00-04:00,2024-04-21,"Microsoft, Tesla, Boeing, and More Stocks to Watch","Earnings season ramps up with General Motors, Tesla, Visa, AT&T, Boeing, Chipotle, Meta Platforms, Alphabet, Comcast, Intel, Microsoft, and Exxon Mobil.",barrons.com,https://www.barrons.com/articles/stocks-watch-microsoft-att-tesla-boeing-visa-e45eb988,https://images.financialmodelingprep.com/news/microsoft-tesla-boeing-and-more-stocks-to-watch-20240421.jpg
MSFT,2024-04-25,2024-04-11,2024-05-09,MSFT,,2024-04-22 04:56:00,2024-04-22T04:56:00-04:00,2024-04-22,"Meta, Microsoft, Salesforce, Coinbase, Palantir, and Other Tech Stocks in Focus Today",The technology-heavy Nasdaq Composite rises following its worst week since November 2022.,barrons.com,https://www.barrons.com/articles/meta-microsoft-salesforce-palantir-tech-stocks-today-0240927d,https://images.financialmodelingprep.com/news/meta-microsoft-salesforce-coinbase-palantir-and-other-tech-stocks-20240422.jpg
MSFT,2024-04-25,2024-04-11,2024-05-09,MSFT,,2024-04-22 07:25:00,2024-04-22T07:25:00-04:00,2024-04-22,Should You Buy Microsoft Stock Before Thursday?,"Already priced a bit too richly, investors are starting to file out of Microsoft stock in anticipation of lackluster results and guidance. One quarter's results and the next quarter's guidance, however, aren't terribly important to true long-term investors.",fool.com,https://www.fool.com/investing/2024/04/22/should-you-buy-microsoft-stock-before-thursday/,https://images.financialmodelingprep.com/news/should-you-buy-microsoft-stock-before-thursday-20240422.jpg
MSFT,2024-04-25,2024-04-11,2024-05-09,MSFT,,2024-04-22 09:01:06,2024-04-22T09:01:06-04:00,2024-04-22,"ETF Winners Amid Last Week's Record Loss in ""Magnificent 7""","Last week witnessed the largest collective loss for the ""Magnificent Seven"" technology-related stocks due to higher rates and rich valuation of those stocks.",zacks.com,https://www.zacks.com/stock/news/2258961/etf-winners-amid-last-week-s-record-loss-in-magnificent-7?cid=CS-STOCKNEWSAPI-FT-etf_news_and_commentary-2258961,https://images.financialmodelingprep.com/news/etf-winners-amid-last-weeks-record-loss-in-magnificent-20240422.jpg
MSFT,2024-04-25,2024-04-11,2024-05-09,MSFT,,2024-04-22 09:09:59,2024-04-22T09:09:59-04:00,2024-04-22,Microsoft and Oracle top picks for TikTok takeover says analysts,"Microsoft Corp (NASDAQ:MSFT) and Oracle Corp (NYSE:ORCL, ETR:ORC) are the most likely buyers of TikTok should its owner be forced to sell it, analysts believe. It comes as the US government closes in on forcing owner ByteDance to divest the social media app or face a Stateside ban.",proactiveinvestors.com,https://www.proactiveinvestors.com/companies/news/1045815,https://images.financialmodelingprep.com/news/microsoft-and-oracle-top-picks-for-tiktok-takeover-says-analysts-20240422.jpg
MSFT,2024-04-25,2024-04-11,2024-05-09,MSFT,,2024-04-22 09:43:13,2024-04-22T09:43:13-04:00,2024-04-22,"Big Tech's Big Breakdown, The Technical Setup Ahead Of Earnings","Ahead of their Q1 2024 earnings, big tech stocks swung lower last week amid a broad market sell-off. In my view, soaring long-duration treasury yields and rightful concerns about liquidity drying up are driving this pullback. The technical setup for big tech stocks heading into Q1 looks bearish, and a failure to meet lofty investor expectations could lead to a deeper pullback in this frothy, overcrowded basket.",seekingalpha.com,https://seekingalpha.com/article/4685066-big-techs-big-breakdown-technical-setup-ahead-of-earnings,https://images.financialmodelingprep.com/news/big-techs-big-breakdown-the-technical-setup-ahead-of-20240422.jpg
MSFT,2024-04-25,2024-04-11,2024-05-09,MSFT,,2024-04-22 10:01:00,2024-04-22T10:01:00-04:00,2024-04-22,Trellix Enables Customers to Secure Microsoft Office 365,"SAN JOSE, Calif.--(BUSINESS WIRE)--Trellix, the cybersecurity company delivering the future of extended detection and response (XDR), today announced Trellix Email Security for Microsoft Office 365. Combining leading threat detection, threat intelligence, and security expertise, Trellix offers Microsoft Office 365 customers a superior, more cost-effective alternative to Microsoft Defender for Office. The evolving threat landscape and increased sophistication of threat actors demand alternative.",businesswire.com,https://www.businesswire.com/news/home/20240422464425/en/Trellix-Enables-Customers-to-Secure-Microsoft-Office-365/,https://images.financialmodelingprep.com/news/trellix-enables-customers-to-secure-microsoft-office-365-20240422.jpg
MSFT,2024-04-25,2024-04-11,2024-05-09,MSFT,,2024-04-22 10:21:21,2024-04-22T10:21:21-04:00,2024-04-22,Ahead of Microsoft (MSFT) Q3 Earnings: Get Ready With Wall Street Estimates for Key Metrics,"Evaluate the expected performance of Microsoft (MSFT) for the quarter ended March 2024, looking beyond the conventional Wall Street top-and-bottom-line estimates and examining some of its key metrics for better insight.",zacks.com,https://www.zacks.com/stock/news/2259068/ahead-of-microsoft-msft-q3-earnings-get-ready-with-wall-street-estimates-for-key-metrics?cid=CS-STOCKNEWSAPI-FT-fundamental_analysis|nfm_preview-2259068,https://images.financialmodelingprep.com/news/ahead-of-microsoft-msft-q3-earnings-get-ready-with-20240422.jpg
