ticker,event_date,window_start,window_end,symbol,symbols,publishedDate,publishedDateET,date_et,title,text,site,url,image
MSFT,2024-04-25,2024-04-11,2024-05-09,MSFT,,2024-04-24 11:30:01,2024-04-24T11:30:01-04:00,2024-04-24,"Microsoft claims that small, localized language models can be powerful as well","Microsoft has announced the development of a small, locally run family of AI language models called Phi-3 mini. In their Technical Report posted on the arXiv preprint server, the team behind the new SLM describes it as more capable than others of its size and more cost effective than larger models.",techxplore.com,https://techxplore.com/news/2024-04-microsoft-small-localized-language-powerful.html,https://images.financialmodelingprep.com/news/microsoft-claims-that-small-localized-language-models-can-be-20240424.jpg
MSFT,2024-04-25,2024-04-11,2024-05-09,MSFT,,2024-04-24 12:01:09,2024-04-24T12:01:09-04:00,2024-04-24,What's in Store for Microsoft ETFs This Earnings Season?,"Microsoft (MSFT) has been caught in a spree of heavy technology sector sell-off in recent weeks, erasing most of its gains made this year. There might be gains in store if MSFT comes up with an earnings beat as demand for generative AI will continue to fuel cloud business.",zacks.com,https://www.zacks.com/stock/news/2261397/what-s-in-store-for-microsoft-etfs-this-earnings-season?cid=CS-STOCKNEWSAPI-FT-etf_news_and_commentary-2261397,https://images.financialmodelingprep.com/news/whats-in-store-for-microsoft-etfs-this-earnings-season-20240424.jpg
MSFT,2024-04-25,2024-04-11,2024-05-09,MSFT,,2024-04-24 12:50:01,2024-04-24T12:50:01-04:00,2024-04-24,Microsoft and Amazon face scrutiny from UK competition watchdog over recent AI deals,British competition regulators said Wednesday they'll scrutinize recent artificial intelligence deals by Microsoft and Amazon over concerns that the moves could thwart competition in the AI industry.,techxplore.com,https://techxplore.com/news/2024-04-uk-big-tech-links-ai.html,https://images.financialmodelingprep.com/news/microsoft-and-amazon-face-scrutiny-from-uk-competition-watchdog-20240424.jpg
MSFT,2024-04-25,2024-04-11,2024-05-09,MSFT,,2024-04-24 13:26:03,2024-04-24T13:26:03-04:00,2024-04-24,What's in Store for These 5 Technology Stocks in Q1 Earnings?,Here we take a sneak peek at five stocks in the Zacks Computer and Technology sector due to report first-quarter 2024 earnings on Apr 25.,zacks.com,https://www.zacks.com/stock/news/2261536/what-s-in-store-for-these-5-technology-stocks-in-q1-earnings?cid=CS-STOCKNEWSAPI-FT-analyst_blog|earnings_preview_-_esp-2261536,https://images.financialmodelingprep.com/news/whats-in-store-for-these-5-technology-stocks-in-20240424.jpg
MSFT,2024-04-25,2024-04-11,2024-05-09,MSFT,,2024-04-24 13:38:00,2024-04-24T13:38:00-04:00,2024-04-24,ADDING MULTIMEDIA GlassHive Announces Collaboration with Microsoft to transform MSP Sales and Marketing to capture AI opportunity with customers,"ALLEN, Texas--(BUSINESS WIRE)--GlassHive and Microsoft collaborate to empower partners in marketing Microsoft Business Solutions, streamlining access, and generating leads.",businesswire.com,https://www.businesswire.com/news/home/20240408992139/en/ADDING-MULTIMEDIA-GlassHive-Announces-Collaboration-with-Microsoft-to-transform-MSP-Sales-and-Marketing-to-capture-AI-opportunity-with-customers/,https://images.financialmodelingprep.com/news/adding-multimedia-glasshive-announces-collaboration-with-microsoft-to-transform-20240424.jpg
MSFT,2024-04-25,2024-04-11,2024-05-09,MSFT,,2024-04-24 16:59:52,2024-04-24T16:59:52-04:00,2024-04-24,Should You Buy Microsoft Stock Before Earnings,Microsoft is benefiting from the rising effectiveness of artificial intelligence.,fool.com,https://www.fool.com/investing/2024/04/24/should-you-buy-microsoft-stock-before-earnings/,https://images.financialmodelingprep.com/news/should-you-buy-microsoft-stock-before-earnings-20240424.jpg
MSFT,2024-04-25,2024-04-11,2024-05-09,MSFT,,2024-04-24 17:49:12,2024-04-24T17:49:12-04:00,2024-04-24,"Microsoft-backed Rubrik prices IPO above range at $32 per share, source says","Rubrik , the cybersecurity software startup that counts Microsoft among its investors, priced its initial public offering at $32 per share on Wednesday above its indicated price range, according to a person familiar with the matter.",reuters.com,https://www.reuters.com/markets/deals/microsoft-backed-rubrik-prices-ipo-above-range-32-per-share-source-says-2024-04-24/,https://images.financialmodelingprep.com/news/microsoftbacked-rubrik-prices-ipo-above-range-at-32-per-20240424.jpg
MSFT,2024-04-25,2024-04-11,2024-05-09,MSFT,,2024-04-25 02:15:35,2024-04-25T02:15:35-04:00,2024-04-25,LSEG reports in-line first quarter as Microsoft partnership progresses,"London Stock Exchange Group said on Thursday its first quarter growth was in line with plans for the roll out of products from its partnership with Microsoft , although the bourse's shares briefly hit a five-month low.",reuters.com,https://www.reuters.com/business/finance/lseg-reports-first-quarter-growth-line-with-plans-2024-04-25/,https://images.financialmodelingprep.com/news/lseg-reports-inline-first-quarter-as-microsoft-partnership-progresses-20240425.jpg
MSFT,2024-04-25,2024-04-11,2024-05-09,MSFT,,2024-04-25 05:04:24,2024-04-25T05:04:24-04:00,2024-04-25,"AI spending worries cast gloom over Alphabet, Microsoft",Investors appear to be losing patience with Big Tech's prodigious artificial intelligence investments this week after Meta Platforms signaled deeper spending and a long road to profitability.,reuters.com,https://www.reuters.com/technology/ai-spending-worries-cast-gloom-over-alphabet-microsoft-2024-04-25/,https://images.financialmodelingprep.com/news/ai-spending-worries-cast-gloom-over-alphabet-microsoft-20240425.jpg
MSFT,2024-04-25,2024-04-11,2024-05-09,MSFT,,2024-04-25 06:00:00,2024-04-25T06:00:00-04:00,2024-04-25,7 Growth Stocks to Buy on the Dip: April 2024,Dips present long-term buying opportunities for investors who can wait for conditions to improve. Some corporations exhibit stock price declines due to temporary industry-specific headwinds or macroeconomic headlines.,investorplace.com,https://investorplace.com/2024/04/7-growth-stocks-to-buy-on-the-dip-april-2024/,https://images.financialmodelingprep.com/news/7-growth-stocks-to-buy-on-the-dip-april-20240425.png
MSFT,2024-04-25,2024-04-11,2024-05-09,MSFT,,2024-04-25 06:30:00,2024-04-25T06:30:00-04:00,2024-04-25,3 Stocks That Will Eclipse the Rest of the Market This Year,"Investors look for opportunities to outperform the stock market, usually defined as the S&P 500. Finding small-cap stocks can lead to market outperformance, but you don't always have to search for obscure stocks to generate outsized returns.",investorplace.com,https://investorplace.com/2024/04/3-stocks-that-will-eclipse-the-rest-of-the-market-this-year/,https://images.financialmodelingprep.com/news/3-stocks-that-will-eclipse-the-rest-of-the-20240425.jpg
MSFT,2024-04-25,2024-04-11,2024-05-09,MSFT,,2024-04-25 06:45:00,2024-04-25T06:45:00-04:00,2024-04-25,Maverick Tech Picks: 7 Stocks to Scoop Up While the Crowd Panics,Investors continue adjusting to the notion that interest rates may not come down as much as expected in 2024. That mindset shift is manifesting as something of a panic in the markets.,investorplace.com,https://investorplace.com/2024/04/maverick-tech-picks-7-stocks-to-scoop-up-while-the-crowd-panics/,https://images.financialmodelingprep.com/news/maverick-tech-picks-7-stocks-to-scoop-up-while-20240425.jpg
MSFT,2024-04-25,2024-04-11,2024-05-09,MSFT,,2024-04-25 07:15:00,2024-04-25T07:15:00-04:00,2024-04-25,Microsoft and Apple are safer bets than the U.S. government? Bond investors seem to think so.,"Unless, however, the company is Microsoft Corp. or Apple Inc., which have outstanding bonds that have been trading at negative spread levels to Treasurys, implying they're less risky than debt backed by the U.S. government.",marketwatch.com,https://www.marketwatch.com/story/microsoft-and-apple-are-safer-bets-than-the-u-s-government-bond-investors-seem-to-think-so-a2fc83f2,https://images.financialmodelingprep.com/news/microsoft-and-apple-are-safer-bets-than-the-us-20240425.jpg
MSFT,2024-04-25,2024-04-11,2024-05-09,MSFT,,2024-04-25 08:10:00,2024-04-25T08:10:00-04:00,2024-04-25,2 Roaring Growth Stocks to Hold for the Next 20 Years,"Microsoft is just getting started with its efforts to capitalize on the booming demand for artificial intelligence (AI) tech. Costco customers remain thrilled with what the warehouse retailer provides, and will soon be asked to pay a bit more for their memberships.",fool.com,https://www.fool.com/investing/2024/04/25/2-roaring-growth-stocks-to-hold-for-the-next-20-ye/,https://images.financialmodelingprep.com/news/2-roaring-growth-stocks-to-hold-for-the-next-20240425.jpg
MSFT,2024-04-25,2024-04-11,2024-05-09,MSFT,,2024-04-25 08:20:00,2024-04-25T08:20:00-04:00,2024-04-25,"Artificial Intelligence (AI) Robots Are a $38 Billion Market, According to Goldman Sachs. Here's How the ""Magnificent Seven"" Are Investing in the Technology.","Artificial intelligence (AI) robots have many applications in the labor market, as well as consumer and household environments. Some ""Magnificent Seven"" companies investing in robotics include Amazon, Nvidia, Tesla, and Microsoft.",fool.com,https://www.fool.com/investing/2024/04/25/artificial-intelligence-ai-robots-are-a-38-billion/,https://images.financialmodelingprep.com/news/artificial-intelligence-ai-robots-are-a-38-billion-market-20240425.jpg
MSFT,2024-04-25,2024-04-11,2024-05-09,MSFT,,2024-04-25 08:40:34,2024-04-25T08:40:34-04:00,2024-04-25,Build your millionaire portfolio: 3 must-buy stocks for serious growth,"Despite popular belief, most millionaires did not become so overnight. In fact, the most straightforward way to becoming a millionaire is through detailed research of the company valuation and stock market, patient and methodic investing approach, and close observation of the current economic trends.",finbold.com,https://finbold.com/build-your-millionaire-portfolio-3-must-buy-stocks-for-serious-growth/?utm_source=snapi,https://images.financialmodelingprep.com/news/build-your-millionaire-portfolio-3-mustbuy-stocks-for-serious-20240425.jpg
MSFT,2024-04-25,2024-04-11,2024-05-09,MSFT,,2024-04-25 08:40:34,2024-04-25T08:40:34-04:00,2024-04-25,Build your millionaire portfolio: 3 must-buy stocks for serious growth,"Despite popular belief, most millionaires did not become so overnight. In fact, the most straightforward way to becoming a millionaire is through detailed research of the company valuation and stock market, patient and methodic investing approach, and close observation of the current economic trends.",finbold.com,https://finbold.com/build-your-millionaire-portfolio-3-must-buy-stocks-for-serious-growth/,https://images.financialmodelingprep.com/news/build-your-millionaire-portfolio-3-mustbuy-stocks-for-serious-20240425.jpg
MSFT,2024-04-25,2024-04-11,2024-05-09,MSFT,,2024-04-25 09:09:00,2024-04-25T09:09:00-04:00,2024-04-25,Why Microsoft's earnings are all about ‘surviving and advancing',"Microsoft Corp. is certainly benefitting from artificial intelligence, but not to the degree of Nvidia Corp.",marketwatch.com,https://www.marketwatch.com/story/why-microsofts-earnings-are-all-about-surviving-and-advancing-950eddbe,https://images.financialmodelingprep.com/news/why-microsofts-earnings-are-all-about-surviving-and-advancing-20240425.jpg
MSFT,2024-04-25,2024-04-11,2024-05-09,MSFT,,2024-04-25 10:04:10,2024-04-25T10:04:10-04:00,2024-04-25,Earnings Preview: What To Expect From Microsoft,"Microsoft Microsoft Inc. scheduled to report earnings after Thursday's close. The stock hit a record high near $430.82/share in 2024 and, as of this writing, it is currently trading near $391.",forbes.com,https://www.forbes.com/sites/adamsarhan/2024/04/25/earnings-preview-what-to-expect-from-microsoft/,https://images.financialmodelingprep.com/news/earnings-preview-what-to-expect-from-microsoft-20240425.jpg
MSFT,2024-04-25,2024-04-11,2024-05-09,MSFT,,2024-04-25 11:07:07,2024-04-25T11:07:07-04:00,2024-04-25,Why Are Stocks Down Today?,Stocks are down today and investors wondering why have come to the right place as we have all the details behind the market slump on Thursday! The first bit of news that is pulling stocks down today comes from Meta Platforms (NASDAQ: META ).,investorplace.com,https://investorplace.com/2024/04/why-are-stocks-down-today-april-25th/,https://images.financialmodelingprep.com/news/why-are-stocks-down-today-20240425.jpg
MSFT,2024-04-25,2024-04-11,2024-05-09,MSFT,,2024-04-25 11:35:28,2024-04-25T11:35:28-04:00,2024-04-25,"Is ""Bad News"" Still ""Good News"" for the Market?","Thursday, April 25th, 2024 Pre-market futures are plummeting at this hour. We began the early trading session down anyway, based on earnings disappointments from Meta META and IBM IBM after yesterday's close.",zacks.com,https://www.zacks.com/stock/news/2262436/is-bad-news-still-good-news-for-the-market?cid=CS-STOCKNEWSAPI-FT-ahead_of_wall_street-2262436,https://images.financialmodelingprep.com/news/is-bad-news-still-good-news-for-the-market-20240425.jpg
MSFT,2024-04-25,2024-04-11,2024-05-09,MSFT,,2024-04-25 12:56:45,2024-04-25T12:56:45-04:00,2024-04-25,Microsoft-backed Rubrik's stock jumps nearly 21% in NYSE debut,"Rubrik's shares rose nearly 21% in their debut on the New York Stock Exchange on Thursday, giving the Microsoft-backed cybersecurity firm a valuation of $6.77 billion.",reuters.com,https://www.reuters.com/technology/cybersecurity/microsoft-backed-rubriks-stock-jumps-nearly-21-nyse-debut-2024-04-25/,https://images.financialmodelingprep.com/news/microsoftbacked-rubriks-stock-jumps-nearly-21-in-nyse-debut-20240425.jpg
MSFT,2024-04-25,2024-04-11,2024-05-09,MSFT,,2024-04-25 14:10:57,2024-04-25T14:10:57-04:00,2024-04-25,"Why Microsoft, Amazon, Alphabet, and Other ""Magnificent Seven"" Stocks Crashed on Thursday","Meta Platforms announced robust earnings, but its capital spending plans shook investors. The company plans to add billions of dollars to its infrastructure to support its artificial intelligence (AI) ambitions.",fool.com,https://www.fool.com/investing/2024/04/25/microsoft-alphabet-amazon-generative-ai/,https://images.financialmodelingprep.com/news/why-microsoft-amazon-alphabet-and-other-magnificent-seven-stocks-20240425.jpg
MSFT,2024-04-25,2024-04-11,2024-05-09,MSFT,,2024-04-25 16:05:24,2024-04-25T16:05:24-04:00,2024-04-25,Microsoft beats quarterly revenue estimates,"Microsoft beat Wall Street estimates for third-quarter revenue on Thursday, driven by gains from AI adoption across its cloud services and business software products.",reuters.com,https://www.reuters.com/technology/microsoft-beats-quarterly-revenue-estimates-2024-04-25/,https://images.financialmodelingprep.com/news/microsoft-beats-quarterly-revenue-estimates-20240425.jpg
MSFT,2024-04-25,2024-04-11,2024-05-09,MSFT,,2024-04-25 16:07:24,2024-04-25T16:07:24-04:00,2024-04-25,Microsoft reports another quarter of solid growth,Microsoft Corp (NASDAQ: MSFT) is trading up in extended hours on Thursday after reporting market-beating financial results for its third quarter. Microsoft stock up on strong cloud performance Investors are content particularly because Azure and other cloud services remained strong in Q3.,invezz.com,https://invezz.com/news/2024/04/25/microsoft-q3-earnings-report/,https://images.financialmodelingprep.com/news/microsoft-reports-another-quarter-of-solid-growth-20240425.jpg
MSFT,2024-04-25,2024-04-11,2024-05-09,MSFT,,2024-04-25 16:10:00,2024-04-25T16:10:00-04:00,2024-04-25,Microsoft earnings press release available on Investor Relations website,"REDMOND, Wash. , April 25, 2024 /PRNewswire/ -- Microsoft Corp. on Thursday announced that fiscal year 2024 third-quarter financial results are available on its Investor Relations website.",prnewswire.com,https://www.prnewswire.com/news-releases/microsoft-earnings-press-release-available-on-investor-relations-website-302128041.html,https://images.financialmodelingprep.com/news/microsoft-earnings-press-release-available-on-investor-relations-website-20240425.jpg
MSFT,2024-04-25,2024-04-11,2024-05-09,MSFT,,2024-04-25 16:12:01,2024-04-25T16:12:01-04:00,2024-04-25,Microsoft set to report earnings after the bell,"Microsoft added artificial intelligence talent through a deal with startup Inflection in the quarter, as it worked to sell a productivity chatbot to clients.",cnbc.com,https://www.cnbc.com/2024/04/25/microsoft-msft-q3-earnings-2024.html,https://images.financialmodelingprep.com/news/microsoft-set-to-report-earnings-after-the-bell-20240425.jpeg
MSFT,2024-04-25,2024-04-11,2024-05-09,MSFT,,2024-04-25 16:13:47,2024-04-25T16:13:47-04:00,2024-04-25,Microsoft Smashes Earnings Expectations—Stock Up 5%,"Microsoft easily topped analysts' forecasts in its first quarter of 2024, as the world's largest company continues to impress Wall Street.",forbes.com,https://www.forbes.com/sites/dereksaul/2024/04/25/microsoft-smashes-earnings-expectations-stock-up-5/,https://images.financialmodelingprep.com/news/microsoft-smashes-earnings-expectationsstock-up-5-20240425.jpg
MSFT,2024-04-25,2024-04-11,2024-05-09,MSFT,,2024-04-25 16:14:12,2024-04-25T16:14:12-04:00,2024-04-25,Microsoft results beat expectations as quarterly profits rise 20% to nearly $22B,"Microsoft posted a 17% increase in revenue, to $61.",geekwire.com,https://www.geekwire.com/2024/microsoft-results-beat-expectations-as-quarterly-profits-rise-20-to-nearly-22b/,https://images.financialmodelingprep.com/news/microsoft-results-beat-expectations-as-quarterly-profits-rise-20-20240425.jpeg
MSFT,2024-04-25,2024-04-11,2024-05-09,MSFT,,2024-04-25 16:19:39,2024-04-25T16:19:39-04:00,2024-04-25,Microsoft's heavy bet on AI pays off as it beats expectations in second quarter,World's largest public company reports $61.86bn revenue after investing billions into artificial intelligence,theguardian.com,https://www.theguardian.com/technology/2024/apr/25/microsoft-earnings,https://images.financialmodelingprep.com/news/microsofts-heavy-bet-on-ai-pays-off-as-it-20240425.jpg
MSFT,2024-04-25,2024-04-11,2024-05-09,MSFT,,2024-04-25 16:31:00,2024-04-25T16:31:00-04:00,2024-04-25,Microsoft Reports Rising Revenues as A.I. Investments Bear Fruit,"The tech giant's quarterly results included strong growth in cloud computing, fueled by its services in generative artificial intelligence.",nytimes.com,https://www.nytimes.com/2024/04/25/technology/microsoft-earnings.html,https://images.financialmodelingprep.com/news/microsoft-reports-rising-revenues-as-ai-investments-bear-fruit-20240425.jpg
MSFT,2024-04-25,2024-04-11,2024-05-09,MSFT,,2024-04-25 16:36:19,2024-04-25T16:36:19-04:00,2024-04-25,Microsoft quarterly profit rises 20% as tech giant pushes to get customers using AI products,Microsoft on Thursday said its profit rose 20% for the January-March quarter as it tries to position itself as a leader in applying artificial intelligence technology to make workplaces more productive.,techxplore.com,https://techxplore.com/news/2024-04-microsoft-quarterly-profit-tech-giant.html,https://images.financialmodelingprep.com/news/microsoft-quarterly-profit-rises-20-as-tech-giant-pushes-20240425.jpg
MSFT,2024-04-25,2024-04-11,2024-05-09,MSFT,,2024-04-25 16:37:02,2024-04-25T16:37:02-04:00,2024-04-25,"Microsoft beats on profit, revenue driven by AI and cloud services","Microsoft Corp (NASDAQ:MSFT) reported its earnings for the quarter, surpassing expectations on both earnings per share (EPS) and revenue fronts. The tech giant announced an EPS of $2.94, outpacing analysts' expectations of $2.84.",proactiveinvestors.com,https://www.proactiveinvestors.com/companies/news/1046172,https://images.financialmodelingprep.com/news/microsoft-beats-on-profit-revenue-driven-by-ai-and-20240425.jpg
MSFT,2024-04-25,2024-04-11,2024-05-09,MSFT,,2024-04-25 16:37:02,2024-04-25T16:37:02-04:00,2024-04-25,"Microsoft beats on profit, revenue driven by AI and cloud services","Microsoft Corp (NASDAQ:MSFT) reported its earnings for the quarter, surpassing expectations on both earnings per share (EPS) and revenue fronts. The tech giant announced an EPS of $2.94, outpacing analysts' expectations of $2.84.",proactiveinvestors.com,https://www.proactiveinvestors.com/companies/news/1046172?SNAPI,https://images.financialmodelingprep.com/news/microsoft-beats-on-profit-revenue-driven-by-ai-and-cloud-20240425.jpg
MSFT,2024-04-25,2024-04-11,2024-05-09,MSFT,,2024-04-25 16:43:17,2024-04-25T16:43:17-04:00,2024-04-25,"Microsoft revenue surges 17%, driven by AI gains, ChatGPT partnership",Microsoft stock has soared on Microsoft shipping genAI tools based on its strategic partnership with ChatGPT creator OpenAI.,nypost.com,https://nypost.com/2024/04/25/business/microsoft-revenue-surges-17-driven-by-ai-gains-chatgpt-partnership/,https://images.financialmodelingprep.com/news/microsoft-revenue-surges-17-driven-by-ai-gains-chatgpt-20240425.jpg
MSFT,2024-04-25,2024-04-11,2024-05-09,MSFT,,2024-04-25 17:20:43,2024-04-25T17:20:43-04:00,2024-04-25,Microsoft Stock Jumps On Earnings Beat Driven By Cloud Segment,Microsoft (MSFT) shares rose around 5% in after-hours trading Thursday after the company reported better-than-expected third-quarter earnings driven by its cloud business.,investopedia.com,https://www.investopedia.com/microsoft-q3-fy-2024-earnings-8639160,https://images.financialmodelingprep.com/news/microsoft-stock-jumps-on-earnings-beat-driven-by-cloud-20240425.jpg
MSFT,2024-04-25,2024-04-11,2024-05-09,MSFT,,2024-04-25 19:01:33,2024-04-25T19:01:33-04:00,2024-04-25,"Compared to Estimates, Microsoft (MSFT) Q3 Earnings: A Look at Key Metrics","Although the revenue and EPS for Microsoft (MSFT) give a sense of how its business performed in the quarter ended March 2024, it might be worth considering how some key metrics compare with Wall Street estimates and the year-ago numbers.",zacks.com,https://www.zacks.com/stock/news/2262805/compared-to-estimates-microsoft-msft-q3-earnings-a-look-at-key-metrics?cid=CS-STOCKNEWSAPI-FT-fundamental_analysis|nfm-2262805,https://images.financialmodelingprep.com/news/compared-to-estimates-microsoft-msft-q3-earnings-a-look-20240425.jpg
MSFT,2024-04-25,2024-04-11,2024-05-09,MSFT,,2024-04-25 19:16:12,2024-04-25T19:16:12-04:00,2024-04-25,"Markets Fight Back, Stay Red; MSFT, GOOGL, SNAP Beat on Late Earnings","Big gains in the after-market for Snap, Alphabet and Microsoft may keep the trading week in the green.",zacks.com,https://www.zacks.com/stock/news/2262834/markets-fight-back-stay-red-msft-googl-snap-beat-on-late-earnings?cid=CS-STOCKNEWSAPI-FT-ahead_of_wall_street-2262834,https://images.financialmodelingprep.com/news/markets-fight-back-stay-red-msft-googl-snap-beat-20240425.jpg
MSFT,2024-04-25,2024-04-11,2024-05-09,MSFT,,2024-04-25 19:47:28,2024-04-25T19:47:28-04:00,2024-04-25,Microsoft: Unlocking AI Benefits Will Require Cultural Changes for Enterprises,Digital transformation is the name of the game — and that's great news for Microsoft.,pymnts.com,https://www.pymnts.com/earnings/2024/microsoft-unlocking-ai-benefits-will-require-cultural-changes-for-enterprises/,https://images.financialmodelingprep.com/news/microsoft-unlocking-ai-benefits-will-require-cultural-changes-for-enterprises-20240425.jpg
MSFT,2024-04-25,2024-04-11,2024-05-09,MSFT,,2024-04-25 19:47:28,2024-04-25T19:47:28-04:00,2024-04-25,Microsoft: Unlocking AI Benefits Will Require Cultural Changes for Enterprises,Digital transformation is the name of the game — and that's great news for Microsoft.,pymnts.com,https://www.pymnts.com/earnings/2024/microsoft-unlocking-ai-benefits-will-require-cultural-changes-for-enterprises/?utm_source=snapi,https://images.financialmodelingprep.com/news/microsoft-unlocking-ai-benefits-will-require-cultural-changes-for-20240425.jpg
MSFT,2024-04-25,2024-04-11,2024-05-09,MSFT,,2024-04-25 20:18:06,2024-04-25T20:18:06-04:00,2024-04-25,Microsoft says cloud AI demand is exceeding supply even after 79% surge in capital spending,Microsoft has more demand than supply for running artificial intelligence models in the cloud.,cnbc.com,https://www.cnbc.com/2024/04/25/microsoft-says-cloud-ai-demand-exceeds-supply-despite-spending-surge.html,https://images.financialmodelingprep.com/news/microsoft-says-cloud-ai-demand-is-exceeding-supply-even-20240425.jpeg
MSFT,2024-04-25,2024-04-11,2024-05-09,MSFT,,2024-04-25 20:22:07,2024-04-25T20:22:07-04:00,2024-04-25,"Haunted by repeated breaches, Microsoft is ‘putting security above all else,' vows CEO Satya Nadella",Satya Nadella has made a habit on Microsoft's earnings calls of touting the revenue growth in the company's security technology business.,geekwire.com,https://www.geekwire.com/2024/haunted-by-repeated-breaches-microsoft-is-putting-security-above-all-else-vows-ceo-satya-nadella/,https://images.financialmodelingprep.com/news/haunted-by-repeated-breaches-microsoft-is-putting-security-above-20240425.jpg
