ticker,event_date,window_start,window_end,symbol,symbols,publishedDate,publishedDateET,date_et,title,text,site,url,image
AMZN,2021-10-28,2021-10-14,2021-11-11,AMZN,,2021-10-19 13:35:19,2021-10-19T13:35:19-04:00,2021-10-19,5 Consumer Discretionary ETFs Rising to New Highs,"With the economy regaining momentum after a pandemic slowdown buoyed by the biggest vaccination drive and reopenings, the consumer discretionary sector looks like an exciting bet at present.",zacks.com,https://www.zacks.com/stock/news/1812672/5-consumer-discretionary-etfs-rising-to-new-highs,https://images.financialmodelingprep.com/news/5-consumer-discretionary-etfs-rising-to-new-highs-20211019.jpg
AMZN,2021-10-28,2021-10-14,2021-11-11,AMZN,,2021-10-19 13:49:48,2021-10-19T13:49:48-04:00,2021-10-19,Amazon backs zero-carbon ocean shipping by 2040,"Amazon commits to zero-carbon marine shipping by 2040, but while new fuel sources like ammonia are promising, they are far from reality.",cnbc.com,https://www.cnbc.com/2021/10/19/amazon-backs-zero-carbon-ocean-shipping-by-2040-.html,https://images.financialmodelingprep.com/news/amazon-backs-zerocarbon-ocean-shipping-by-2040-20211019.jpeg
AMZN,2021-10-28,2021-10-14,2021-11-11,AMZN,,2021-10-19 15:42:21,2021-10-19T15:42:21-04:00,2021-10-19,Zuckerberg's Choice,"We have entered the phase when the body politic and public opinion are aware that Facebook ( FB , Financial) is disturbing our society. This is very important to us as investors, because the big tech companies make up a disproportionately large part of the S&P 500 Index.",gurufocus.com,https://www.gurufocus.com/news/1548558/zuckerbergs-choice,https://images.financialmodelingprep.com/news/zuckerbergs-choice-20211019.jpg
AMZN,2021-10-28,2021-10-14,2021-11-11,AMZN,,2021-10-19 16:13:56,2021-10-19T16:13:56-04:00,2021-10-19,Potential Starbucks partnership shows Amazon's ambitions for its cashierless retail technology,Could Starbucks give Amazon's retail technology a jolt?,geekwire.com,https://www.geekwire.com/2021/potential-starbucks-partnership-shows-amazons-ambitions-cashierless-retail-technology/,https://images.financialmodelingprep.com/news/potential-starbucks-partnership-shows-amazons-ambitions-for-its-cashierless-retail-20211019.jpg
AMZN,2021-10-28,2021-10-14,2021-11-11,AMZN,,2021-10-19 17:43:25,2021-10-19T17:43:25-04:00,2021-10-19,7 Top Stock Picks From Israel ‘Izzy' Englander for Your Portfolio,"In times of doubt, it's always better to refer to seasoned investment gurus. Here are some of the top stock picks from Israel “Izzy” Englander.",investorplace.com,https://investorplace.com/2021/10/7-top-stock-picks-from-israel-izzy-englander-amzn-aapl-baba-msft-tsla-fb-mu/,https://images.financialmodelingprep.com/news/7-top-stock-picks-from-israel-izzy-englander-for-20211019.jpg
AMZN,2021-10-28,2021-10-14,2021-11-11,AMZN,,2021-10-19 18:58:35,2021-10-19T18:58:35-04:00,2021-10-19,2 Blue-Chip Tech Stocks to Buy Before Earnings and Hold,The episode breaks down Apple and Microsoft ahead of their upcoming financial results to see if investors might want to buy these giant tech stocks right now.,zacks.com,https://www.zacks.com/stock/news/1812924/2-blue-chip-tech-stocks-to-buy-before-earnings-and-hold,https://images.financialmodelingprep.com/news/2-bluechip-tech-stocks-to-buy-before-earnings-and-20211019.jpg
AMZN,2021-10-28,2021-10-14,2021-11-11,AMZN,,2021-10-19 19:24:56,2021-10-19T19:24:56-04:00,2021-10-19,"I Don't Often Buy Disruptive Tech Stocks, But When I Do, I Buy These 3 'Emerging Amazons'","Cathie Wood and her ARKK ETF have burst onto the scene over the past year and a half thanks to an outstanding performance that crushed the rest of the market. Despite underperforming high yield YTD, ARKK's valuations remain largely stretched.",seekingalpha.com,https://seekingalpha.com/article/4460693-3-emerging-amazons-tech-stocks-i-buy,https://images.financialmodelingprep.com/news/i-dont-often-buy-disruptive-tech-stocks-but-when-20211019.jpg
AMZN,2021-10-28,2021-10-14,2021-11-11,AMZN,,2021-10-20 00:20:40,2021-10-20T00:20:40-04:00,2021-10-20,Amazon (AMZN) Builds Out Quick-Delivery Network,Amazon (AMZN) has received state and local incentives in its efforts to build a same-day delivery juggernaut.,investopedia.com,https://www.investopedia.com/amazon-amzn-builds-out-quick-delivery-network-5206452,https://images.financialmodelingprep.com/news/amazon-amzn-builds-out-quickdelivery-network-20211020.jpg
AMZN,2021-10-28,2021-10-14,2021-11-11,AMZN,,2021-10-20 00:53:47,2021-10-20T00:53:47-04:00,2021-10-20,"Alibaba expands cloud business abroad with new data centers in Asia, stepping up rivalry with Amazon","Alibaba's cloud computing expansion has focused on Asia, pitting it against U.S. rivals like Amazon and Microsoft.",cnbc.com,https://www.cnbc.com/2021/10/20/alibaba-expands-cloud-business-abroad-with-new-data-centers-in-asia.html,https://images.financialmodelingprep.com/news/alibaba-expands-cloud-business-abroad-with-new-data-centers-20211020.jpg
AMZN,2021-10-28,2021-10-14,2021-11-11,AMZN,,2021-10-20 01:47:35,2021-10-20T01:47:35-04:00,2021-10-20,"Amazon is offering $4,000 bonuses to lure UK workers as Britain faces labor crunch","The e-commerce giant is offering U.K. workers joining bonuses of up to £3,000 in the run up to the festive period.",cnbc.com,https://www.cnbc.com/2021/10/20/amazon-is-offering-4000-bonuses-to-lure-uk-workers.html,https://images.financialmodelingprep.com/news/amazon-is-offering-4000-bonuses-to-lure-uk-workers-as-20211020.jpeg
AMZN,2021-10-28,2021-10-14,2021-11-11,AMZN,,2021-10-20 03:02:49,2021-10-20T03:02:49-04:00,2021-10-20,"Deliveroo upgrades revenue guidance after tie-ups with Amazon Prime, Morrisons","Deliveroo plc has upgraded full-year revenue guidance after the strong trading in the first half continued in the third quarter, while it's reaping the benefits from its tie-ups with Amazon and Morrisons. The food delivery service expects full-year gross transaction value (GTV) to climb 60-70% instead of 50-60% as previously announced, while gross profit margin forecasts remain unchanged at 7.5-7.75%.",proactiveinvestors.co.uk,https://www.proactiveinvestors.co.uk//companies/news/963728/deliveroo-upgrades-revenue-guidance-after-tie-ups-with-amazon-prime-morrisons-963728.html?SNAPI,https://images.financialmodelingprep.com/news/deliveroo-upgrades-revenue-guidance-after-tieups-with-amazon-prime-20211020.jpg
AMZN,2021-10-28,2021-10-14,2021-11-11,AMZN,,2021-10-20 06:53:00,2021-10-20T06:53:00-04:00,2021-10-20,Why You Should Give BlackLine the Green Light,This unknown AI automation company could see incredible growth in the automation revolution.,fool.com,https://www.fool.com/investing/2021/10/20/why-you-should-give-blackline-the-green-light/,https://images.financialmodelingprep.com/news/why-you-should-give-blackline-the-green-light-20211020.jpg
AMZN,2021-10-28,2021-10-14,2021-11-11,AMZN,,2021-10-20 08:06:11,2021-10-20T08:06:11-04:00,2021-10-20,Amazon Faces New Challenges From Google,Amazon has a strong moat around its online retail business and is now taking away advertisement dollars from Google.A larger share of product searches starts on Amazon which has led to loss of valuable advertisement revenue for Google.,seekingalpha.com,https://seekingalpha.com/article/4460762-amazon-faces-new-challenges-from-google,https://images.financialmodelingprep.com/news/amazon-faces-new-challenges-from-google-20211020.jpg
AMZN,2021-10-28,2021-10-14,2021-11-11,AMZN,,2021-10-20 09:10:00,2021-10-20T09:10:00-04:00,2021-10-20,Should You Climb Aboard EV Maker Rivian's IPO?,The all-electric truck and SUV maker's offering comes with a few nagging risks.,fool.com,https://www.fool.com/investing/2021/10/20/should-you-climb-aboard-ev-maker-rivians-ipo/,https://images.financialmodelingprep.com/news/should-you-climb-aboard-ev-maker-rivians-ipo-20211020.jpg
AMZN,2021-10-28,2021-10-14,2021-11-11,AMZN,,2021-10-20 09:12:00,2021-10-20T09:12:00-04:00,2021-10-20,Singapore arbitration panel says India's Future Retail is party to dispute with Amazon-order,"A Singapore arbitration panel on Wednesday declined Future Retail's bid to exclude itself from an ongoing commercial dispute with Amazon.com Inc, according to an order seen by Reuters, the latest boost to the U.S. giant's bid to stall the Indian retailer's asset sale.",reuters.com,https://www.reuters.com/technology/singapore-arbitration-panel-says-indias-future-retail-is-party-dispute-with-2021-10-20/,https://images.financialmodelingprep.com/news/singapore-arbitration-panel-says-indias-future-retail-is-party-20211020.jpg
AMZN,2021-10-28,2021-10-14,2021-11-11,AMZN,,2021-10-20 12:00:00,2021-10-20T12:00:00-04:00,2021-10-20,"Today at Amazon Accelerate: Amazon Launches New Innovations for Brands as It Announces Over 100,000 Brands Have Joined Its U.S. Store in 2021","SEATTLE--(BUSINESS WIRE)--Today at the Accelerate 2021 conference, Amazon (NASDAQ: AMZN) announced that more than 100,000 brands have started selling in Amazon's U.S. store so far this year, with sales by brands up 60% year over year for the 12-month period ending June 30, 2021. Amazon connects brands with hundreds of millions of customers worldwide, offering brands a wide range of tools and services to help drive their success. At the event, the company announced a range of new tools, services",businesswire.com,https://www.businesswire.com/news/home/20211020005845/en/Today-at-Amazon-Accelerate-Amazon-Launches-New-Innovations-for-Brands-as-It-Announces-Over-100000-Brands-Have-Joined-Its-U.S.-Store-in-2021/,https://images.financialmodelingprep.com/news/today-at-amazon-accelerate-amazon-launches-new-innovations-for-20211020.jpg
AMZN,2021-10-28,2021-10-14,2021-11-11,AMZN,,2021-10-20 12:00:00,2021-10-20T12:00:00-04:00,2021-10-20,"Today at Amazon Accelerate: Amazon Launches New Innovations for Brands as It Announces Over 100,000 Brands Have Joined Its U.S. Store in 2021","SEATTLE--(BUSINESS WIRE)--Today at the Accelerate 2021 conference, Amazon (NASDAQ: AMZN) announced that more than 100,000 brands have started selling in Amazon’s U.S. store so far this year, with sales by brands up 60% year over year for the 12-month period ending June 30, 2021. Amazon connects brands with hundreds of millions of customers worldwide, offering brands a wide range of tools and services to help drive their success. At the event, the company announced a range of new tools, services, and benefits to help brands build and maintain customer relationships and increase their sales and profitability. “We want Amazon to be the best place for brands of all types and sizes to succeed, and we’re dedicated to helping them share their story and products to customers around the globe,” said Ian Simpson, Vice President of Selling Partner Tools and Services at Amazon. “We are constantly innovating for brands and excited to share some of our latest tools, services, and other benefits including the Amazon Brand Referral Bonus, Amazon Customer Engagement tool, A+ Story Cards, and Customer Review Resolution tool.” New tools, services, and benefits for brands selling on Amazon include: The Amazon Brand Referral Bonus, which helps brands make their marketing dollars go further. When brands direct non-Amazon marketing traffic from their own website or other websites to Amazon, they earn a bonus of, on average, 10% of the purchase price of the promoted product and any of the brand’s other products that the customer purchases over the following two weeks. Thousands of brands are already taking advantage of this benefit, with some earning thousands of dollars in bonuses in a single month. The Amazon Customer Engagement tool, which enables brands to easily launch email marketing campaigns to raise awareness of new products. Since launching the beta version of the tool in May, Amazon has already sent more than 6 million emails to customers on behalf of brands. A+ Story Cards on the product page enable brands to showcase their brand story through rich visual imagery and more seamlessly connect shoppers with their other products. In the last month, brands have enabled A+ Story Cards on more than 1 million products. The Customer Review Resolution tool, which enables brands to provide enhanced customer service when they identify a frustrated customer who leaves a negative product review. The tool enables brands to proactively offer additional support and a courtesy refund if a customer is unhappy with the product and leaves a negative review; this helps them build a stronger connection to their customers. Since the tool’s launch in June, brands have already offered enhanced support on more than 200,000 orders per month. “Amazon is a foundation for our business and is a great home for our brands, helping us continually find customers and build their affinity for our product lines,” said Steve Neufer, CEO of Juvo Plus, a seller with 15 brands and thousands of products on Amazon. “Features and tools like Amazon Stores, A+ Content, and Brand Analytics give our brands horsepower for growth across a range of product categories.” In addition to these new features, Amazon offers a range of free tools, services, and benefits for brands to help them launch their brand, build customer relationships, and grow and succeed, including: Amazon Stores empowers brands to create a customizable multipage storefront that tells their brand story and lets Amazon customers both learn about their company and discover their full range of products. Brands selling on Amazon.com have launched more than 140,000 stores. Brand Follow lets customers indicate their interest in a specific brand and receive updates about new products and promotions. Customers who “Follow” a brand in Amazon’s store on average spend more than double on products from the brand than other shoppers not following the brand. Manage Your Experiments lets brands run A/B tests on their product listings to help them better understand which product information appeals to Amazon customers—ultimately driving more sales. To date in 2021, brands have used Manage Your Experiments to create tens of thousands of experiments to improve the quality of their listings, which have increased their sales by up to 25%. Virtual Bundles gives brands the opportunity to offer two to five complementary products as a bundle without needing to pack the items together before sending them to Amazon’s fulfillment centers. By offering a virtual bundle, brands can increase their basket size, resulting in an over 15% sales lift for bundled products on average. Posts helps brands drive discovery on Amazon using images and lifestyle content that are displayed across Amazon and link to relevant Amazon product pages. Posts are free and available for brands selling in Amazon’s U.S. store. In the last year, Amazon delivered more than 11 billion viewable impressions through Posts. A+ Content helps brands better showcase their story and product features with immersive rich content such as videos, images, and dynamic text on their Amazon product detail pages. A+ Content helps increase conversion rates, and in 2021 alone, brands have added A+ Content to over 1 million product pages globally. These features are available to all brands enrolled in Brand Registry and selling in Amazon’s U.S. store, except for the Amazon Customer Engagement tool, which we will continue to test in a beta version throughout early 2022. Last year, Amazon invested more than $18 billion in logistics, tools, services, programs, and teams to help sellers get started, build their brands, and leverage Amazon’s scale to reach more customers. Amazon sellers have created an estimated 1.8 million U.S. jobs managing, operating, and supporting their Amazon-related businesses. Learn more about Accelerate at https://www.amazonaccelerate.com/.",businesswire.com,https://www.businesswire.com/news/home/20211020005845/en/Today-at-Amazon-Accelerate-Amazon-Launches-New-Innovations-for-Brands-as-It-Announces-Over-100000-Brands-Have-Joined-Its-U.S.-Store-in-2021,https://images.financialmodelingprep.com/news/today-at-amazon-accelerate-amazon-launches-new-innovations-for-20211020.png
AMZN,2021-10-28,2021-10-14,2021-11-11,AMZN,,2021-10-20 12:00:00,2021-10-20T12:00:00-04:00,2021-10-20,Today at Amazon Accelerate: Amazon Announces Product Opportunity Explorer to Help Third-Party Sellers Identify New Products to Sell in Amazon's Store,"SEATTLE--(BUSINESS WIRE)--Today at the Accelerate 2021 conference for third-party sellers, Amazon (NASDAQ: AMZN) announced Product Opportunity Explorer, a new tool that helps sellers identify opportunities to launch new, high-potential products to serve unmet customer demand. Identifying and launching new products is key to retail success, but it can be costly and time consuming. Amazon's new Product Opportunity Explorer tool helps take the guesswork out of identifying which products to launch",businesswire.com,https://www.businesswire.com/news/home/20211020005249/en/Today-at-Amazon-Accelerate-Amazon-Announces-Product-Opportunity-Explorer-to-Help-Third-Party-Sellers-Identify-New-Products-to-Sell-in-Amazon%E2%80%99s-Store/,https://images.financialmodelingprep.com/news/today-at-amazon-accelerate-amazon-announces-product-opportunity-explorer-20211020.jpg
AMZN,2021-10-28,2021-10-14,2021-11-11,AMZN,,2021-10-20 12:00:00,2021-10-20T12:00:00-04:00,2021-10-20,Today at Amazon Accelerate: Amazon Announces Product Opportunity Explorer to Help Third-Party Sellers Identify New Products to Sell in Amazon’s Store,"SEATTLE--(BUSINESS WIRE)--Today at the Accelerate 2021 conference for third-party sellers, Amazon (NASDAQ: AMZN) announced Product Opportunity Explorer, a new tool that helps sellers identify opportunities to launch new, high-potential products to serve unmet customer demand. Identifying and launching new products is key to retail success, but it can be costly and time consuming. Amazon’s new Product Opportunity Explorer tool helps take the guesswork out of identifying which products to launch by providing sellers with rich insights into what customers are searching for, clicking on, and buying, as well as not buying. The tool helps sellers identify niches of emerging product opportunities by providing detailed data on search volume and growth, sales history, and pricing trends, so they can identify and act on customer demand. “Amazon has a long track record of inventing for sellers, and our Product Opportunity Explorer tool is our latest innovation that provides them with insights to help them bring new products to market faster and more efficiently,” said Ben Hartman, Vice President of North America Selling Partner Services at Amazon. “This is another example of how we empower small businesses and entrepreneurs by providing them with powerful capabilities to reach more customers and grow.” Product Opportunity Explorer was developed with product research and development in mind, offering rich, accurate data to help sellers understand, gauge, and evaluate product opportunities on Amazon. Sellers can assess the likelihood of a new product gaining traction with customers and forecast sales potential. “We have built our business on Amazon, and our growth strategy is based on increasing the number of products we offer,” said John Broadbent of Silver Onyx, a seller with seven brands in Amazon’s store. “Product Opportunity Explorer will give us data and recommendations specifically relevant to our business, fueling our ability to develop and offer dozens of new products to our brand portfolio this year, such as successful new additions to our Nature’s Nutrition line.” Amazon offers a range of tools and services to help sellers launch new products. When sellers identify new products they want to launch on Amazon, they can use the FBA New Selection program that offers benefits on storage and advertising costs to help them accelerate their early sales. Sellers enrolled in Brand Registry can use Amazon Vine to help them build a foundation of insightful customer reviews on their new selection for as little as $200 per enrolled product. On average, brands have found Amazon Vine helped grow their initial product sales by more than 15%. Amazon is initially testing Product Opportunity Explorer in a beta program, with plans to make the tool available to all sellers in 2022. The tool is available at no charge in Seller Central, Amazon’s online business management resource for sellers. Last year, Amazon invested more than $18 billion in logistics, tools, services, programs, and teams to help sellers get started, build their brands, and leverage Amazon’s scale to reach more customers. Amazon sellers have created an estimated 1.8 million U.S. jobs managing, operating, and supporting their Amazon-related businesses. Learn more about Accelerate at https://www.amazonaccelerate.com/.",businesswire.com,https://www.businesswire.com/news/home/20211020005249/en/Today-at-Amazon-Accelerate-Amazon-Announces-Product-Opportunity-Explorer-to-Help-Third-Party-Sellers-Identify-New-Products-to-Sell-in-Amazon%E2%80%99s-Store,https://images.financialmodelingprep.com/news/today-at-amazon-accelerate-amazon-announces-product-opportunity-explorer-20211020.png
AMZN,2021-10-28,2021-10-14,2021-11-11,AMZN,,2021-10-20 12:00:00,2021-10-20T12:00:00-04:00,2021-10-20,Today at Amazon Accelerate: Amazon to Launch the Search Analytics Dashboard That Will Provide Third-Party Sellers with Insights on Search Performance of Their Products,"SEATTLE--(BUSINESS WIRE)--Today at the Accelerate 2021 conference for U.S. third-party sellers, Amazon (NASDAQ: AMZN) announced the Search Analytics Dashboard, a new tool that will help sellers registered in Brand Registry derive insights from the search performance of their products. “The Search Analytics Dashboard will provide sellers with a wealth of anonymized data to better understand customers' interests and shopping choices for their products. This information will help sellers optimize",businesswire.com,https://www.businesswire.com/news/home/20211020005248/en/Today-at-Amazon-Accelerate-Amazon-to-Launch-the-Search-Analytics-Dashboard-That-Will-Provide-Third-Party-Sellers-with-Insights-on-Search-Performance-of-Their-Products/,https://images.financialmodelingprep.com/news/today-at-amazon-accelerate-amazon-to-launch-the-search-analytics-20211020.jpg
