ticker,event_date,window_start,window_end,symbol,symbols,publishedDate,publishedDateET,date_et,title,text,site,url,image
AMZN,2021-10-28,2021-10-14,2021-11-11,AMZN,,2021-11-09 08:04:00,2021-11-09T08:04:00-05:00,2021-11-09,Amazon and Weber File Joint Lawsuit Against Counterfeiters,"SEATTLE--(BUSINESS WIRE)--Today, Amazon.com, Inc. (“Amazon”) (NASDAQ: AMZN), together with a subsidiary of Weber Inc. (NYSE:WEBR) (“Weber”), jointly filed a lawsuit against 12 defendants for selling products that illegally bear the WEBER® registered trademark in Amazon’s store. The defendants attempted to offer counterfeit versions of the global grill maker’s grill covers, violating Amazon’s policies, infringing on Weber’s registered trademarks, and breaking the law. The lawsuit was filed in the United States District Court for the Western District of Washington and alleges that the defendants conspired to deceive customers about the authenticity and origin of their products and create a false affiliation with Weber. Amazon closed the defendants’ selling accounts and proactively refunded the impacted customers. “If counterfeiters attempt to sell in our store, they don’t just break the law and violate the rights of companies like Weber, they mislead consumers,” said Kebharu Smith, Director of Amazon’s Counterfeit Crimes Unit. “In the rare instances when counterfeiters are able to bypass our enforcement tools and teams, we will find them and hold them fully accountable.” Amazon strictly prohibits infringing and counterfeit products in its store, and in 2020, Amazon invested more than $700 million and employed more than 10,000 people to proactively protect its store from fraud, counterfeit, and abuse. Amazon uses industry-leading tools to verify potential sellers’ identities and ensure product listings are authentic, and Amazon’s proprietary systems analyze hundreds of unique data points to verify information provided by potential sellers. In 2020, only 6% of attempted new seller account registrations passed Amazon’s robust verification processes and listed products for sale. In addition, fewer than 0.01% of all products sold on Amazon received a counterfeit complaint from customers. “Protecting consumers and our brand are top priorities for Weber,” said Phil Zadeik, General Counsel of Weber. “As the world’s leading company in outdoor cooking, we take tremendous pride in developing, manufacturing, and offering high-quality, durable, innovative products that meet or exceed our strict standards. And when that premise is jeopardized with counterfeit goods, we take action. We appreciate Amazon’s partnership and their commitment to only offering authentic Weber products to those that love to barbecue.” The court filings are available here: Case: 2:21-cv-01512, United States District Court for the Western District of Washington Amazon has an extensive history protecting brands and taking action to hold bad actors accountable: Amazon Counterfeit Crimes Unit Reaches Settlement with Influencers Who Ran Social Media Counterfeiting Scheme Amazon and Asmodee File Joint Lawsuit Against Counterfeiters Amazon and HanesBrands File Joint Lawsuits Against Infringers of Champion Trademarks Amazon Published Comprehensive Brand Protection Report Demonstrating Progress Toward Driving Counterfeits to Zero Amazon Establishes Counterfeit Crimes Unit to Bring Counterfeits to Justice Amazon Launches IP Accelerator in Europe to Help Small Businesses Protect Their Brands and Tackle Counterfeit IPR Center, Amazon Launch ‘Operation Fulfilled Action’ to Stop Counterfeiters Amazon and YETI File Joint Lawsuit against Counterfeiters Amazon and Salvatore Ferragamo File Two Joint Lawsuits Against Counterfeiters About Amazon Amazon is guided by four principles: customer obsession rather than competitor focus, passion for invention, commitment to operational excellence, and long-term thinking. Amazon strives to be Earth’s Most Customer‑Centric Company, Earth’s Best Employer, and Earth’s Safest Place to Work. Customer reviews, 1-Click shopping, personalized recommendations, Prime, Fulfillment by Amazon, AWS, Kindle Direct Publishing, Kindle, Career Choice, Fire tablets, Fire TV, Amazon Echo, Alexa, Just Walk Out technology, Amazon Studios, and The Climate Pledge are some of the things pioneered by Amazon. For more information, visit amazon.com/about and follow @AmazonNews. About Weber Inc. Weber Inc., headquartered in Palatine, IL, is the world’s leading barbecue brand. Weber’s founder George Stephen, Sr., established the outdoor cooking category when he invented the original charcoal grill nearly 70 years ago. Weber offers a comprehensive, innovative product portfolio, including charcoal, gas, pellet and electric grills, smokers, and accessories designed to help outdoor cooking enthusiasts discover what’s possible. Earlier this year, the company acquired June Life Inc., a smart appliance and technology company, to accelerate the development of its Weber Connect ® technology and digital products. Weber offers its barbecue grills and accessories, services, and experiences to a passionate community of millions across 78 countries. Weber® and Weber Connect ® are registered trademarks of Weber-Stephen Products LLC",businesswire.com,https://www.businesswire.com/news/home/20211109006012/en/Amazon-and-Weber-File-Joint-Lawsuit-Against-Counterfeiters,https://images.financialmodelingprep.com/news/amazon-and-weber-file-joint-lawsuit-against-counterfeiters-20211109.jpg
AMZN,2021-10-28,2021-10-14,2021-11-11,AMZN,,2021-11-09 08:04:00,2021-11-09T08:04:00-05:00,2021-11-09,Amazon and Weber File Joint Lawsuit Against Counterfeiters,"SEATTLE--(BUSINESS WIRE)--Today, Amazon.com, Inc. (“Amazon”) (NASDAQ: AMZN), together with a subsidiary of Weber Inc. (NYSE:WEBR) (“Weber”), jointly filed a lawsuit against 12 defendants for selling products that illegally bear the WEBER® registered trademark in Amazon's store. The defendants attempted to offer counterfeit versions of the global grill maker's grill covers, violating Amazon's policies, infringing on Weber's registered trademarks, and breaking the law. The lawsuit was filed in th",businesswire.com,https://www.businesswire.com/news/home/20211109006012/en/Amazon-and-Weber-File-Joint-Lawsuit-Against-Counterfeiters/,https://images.financialmodelingprep.com/news/amazon-and-weber-file-joint-lawsuit-against-counterfeiters-20211109.jpg
AMZN,2021-10-28,2021-10-14,2021-11-11,AMZN,,2021-11-09 12:35:54,2021-11-09T12:35:54-05:00,2021-11-09,Report: Amazon Hopes to Settle EU Antitrust Cases,"Amazon wants to settle a pair of antitrust probes in the EU in hopes of avoiding steep fines and directives to alter its business practices, Reuters reported on Tuesday (Nov. 9). Citing “people familiar with the matter,” the news agency said Amazon has begun discussions with the European Commission (EC) and has offered to make […]",pymnts.com,https://www.pymnts.com/antitrust/2021/report-amazon-hopes-to-settle-eu-antitrust-cases/,https://images.financialmodelingprep.com/news/report-amazon-hopes-to-settle-eu-antitrust-cases-20211109.jpg
AMZN,2021-10-28,2021-10-14,2021-11-11,AMZN,,2021-11-09 13:00:00,2021-11-09T13:00:00-05:00,2021-11-09,New Amazon Sortation Center in Maple Grove Now Up and Running,"MINNEAPOLIS--(BUSINESS WIRE)--Workers in Minnesota’s newest Amazon facility are now sorting and preparing packages for delivery, promising even faster service for thousands of customers in the Minneapolis/St. Paul area. The Sortation Center, located at 10440 89th Avenue in Maple Grove, received its first shipment on Wednesday, October 27th. “The City of Maple Grove is thankful for the continued investment in the community by Amazon. The new sortation center provides additional employment opportunities for residents as well as an increase to the tax base. The new facility will also provide residents and businesses with an increased ability to receive and send shipments on a timely basis. Amazon has been a great partner over the past few years, and the city looks forward to building upon the relationship into the future. The ongoing commitment from our businesses supports Maple Grove’s place as a premier destination to live and work,” Maple Grove Mayor Mark Steffenson said. Associates have spent the past couple of weeks ramping up operations while receiving, storing and sending out packages for delivery. “We are thrilled to open this facility in the North Metro, further increasing the speed of our delivery network. Our location was chosen based on data and customer needs and we’re proud to be a part of Maple Grove, as both a partner and employer. We bring Amazon’s state-of-the-art technology and commitment to worker safety to the region, and we look forward to growing alongside our community,” Site Leader Tommy Johns explained. While the facility increases its production, Human Resources leaders will also continue hiring hundreds of residents to help meet customer orders (www.amazon.com/apply). Full-time, part-time and “flex” employment shifts are available to meet the unique needs of every prospective employee. New hires are eligible for $3,000 signing bonuses and can earn more than $18/hour, and full-time employees are immediately provided with full benefits which include medical, dental, and a 50% match on 401k plans. Within 90 days of their start date, new hires also become eligible for Amazon’s Career Choice program, in which the company pays for full college tuition. For more information on the type of work performed at Sortation Centers: https://hiring.amazon.com/job-opportunities/sortation-center-jobs?cmpid=OAAAMK0378H3#/ Amazon leverages its scale for good and makes investments to support communities. Between 2010 and 2020, Amazon created more than 6,500 jobs in Minnesota and invested more than $3 billion across the state, including infrastructure and compensation to our employees. These investments have contributed an additional $3 billion in GDP to the Minnesota economy and have helped create over 9,000 indirect jobs on top of Amazon’s direct hires – from jobs in construction and logistics to professional services. In addition, more than 21,000 independent authors and small and medium businesses in the state are selling to customers in Amazon’s store, creating thousands of additional jobs across the state. About Amazon: Amazon is guided by four principles: customer obsession rather than competitor focus, passion for invention, commitment to operational excellence, and long-term thinking. Customer reviews, 1-Click shopping, personalized recommendations, Prime, Fulfillment by Amazon, AWS, Kindle Direct Publishing, Kindle, Fire tablets, Fire TV, Amazon Echo, and Alexa are some of the products and services pioneered by Amazon. For more information, visit https://www.aboutamazon.com/ and follow @AmazonNews.",businesswire.com,https://www.businesswire.com/news/home/20211109005388/en/New-Amazon-Sortation-Center-in-Maple-Grove-Now-Up-and-Running,https://images.financialmodelingprep.com/news/new-amazon-sortation-center-in-maple-grove-now-up-20211109.jpg
AMZN,2021-10-28,2021-10-14,2021-11-11,AMZN,,2021-11-09 13:00:00,2021-11-09T13:00:00-05:00,2021-11-09,New Amazon Sortation Center in Maple Grove Now Up and Running,MINNEAPOLIS--(BUSINESS WIRE)--Amazon's newest Minnesota facility is up and running in Maple Grove. Workers at the Sort Center are ramping up operations as leaders continue to hire.,businesswire.com,https://www.businesswire.com/news/home/20211109005388/en/New-Amazon-Sortation-Center-in-Maple-Grove-Now-Up-and-Running/,https://images.financialmodelingprep.com/news/new-amazon-sortation-center-in-maple-grove-now-up-and-20211109.jpg
AMZN,2021-10-28,2021-10-14,2021-11-11,AMZN,,2021-11-09 14:02:16,2021-11-09T14:02:16-05:00,2021-11-09,Amazon seeks to settle two EU antitrust probes: report,"Amazon.com Inc. AMZN, +2.71% is attempting to settle two antitrust investigations by the European Union to avoid heavy fines and orders to change its business practices, according to a Reuters report, citing people familiar with the matter. Last year, the European Commission charged Amazon with abusing its size, scope, and data to push its own products and gain an unfair advantage over rival merchants that sell on its online platform.",marketwatch.com,https://www.marketwatch.com/story/amazon-seeks-to-settle-two-eu-antitrust-probes-report-2021-11-09,https://images.financialmodelingprep.com/news/amazon-seeks-to-settle-two-eu-antitrust-probes-report-20211109.jpg
AMZN,2021-10-28,2021-10-14,2021-11-11,AMZN,,2021-11-09 15:00:00,2021-11-09T15:00:00-05:00,2021-11-09,Amazon Expands Investment with Four New Operations Sites in Alabama,"SEATTLE--(BUSINESS WIRE)--Amazon.com, Inc. (Nasdaq:AMZN) today announced plans for three new operations facilities in Alabama and celebrates the launch of a new fulfillment center that will support customers across the state. “We are proud to continue our investment in Alabama with thousands of good jobs and new, state-of-the-art operations facilities,” said Brian Huseman, vice president of public policy at Amazon. “Our success would not be possible without our great employees and we are grateful for the enthusiasm and strong state and local support we have received since first launching operations in 2020. We look forward to continued investment as we innovate and grow to better serve our customers across the state.” “Amazon’s decision to simultaneously launch and announce these projects in Alabama shows the high level of confidence the company has in the abilities of our hard-working citizens, who have shown time and time again that they can get the job done,” Governor Kay Ivey said. “Companies from around the world have discovered that Alabama offers them all the ingredients of success, and this is another prime example.” Amazon has created more than 9,000 direct jobs statewide and invested more than $1 billion in Alabama in infrastructure and compensation to employees. The company plans to add more than 500 full-time jobs to its operation by the end of 2021 and have created more than 1,800 seasonal positions across the state in preparation for the holiday season. The fulfillment and transportation jobs support communities of all sizes, pay a minimum starting wage of $15 per hour-which is more than double the federal and state minimum wage—and provide comprehensive health benefits on the first day of employment, paid time off, up to 20 weeks of fully paid parental leave, and more for employees and their families. New Amazon Sites Coming to Alabama Birmingham Delivery Station: In November, Amazon plans to expand the delivery services in greater Birmingham. This new station will employ approximately 150 people and create indirect job opportunities for hundreds of people through the empowerment of the Delivery Service Partner program. Huntsville XL Fulfillment Center: In 2022, Amazon will open its third fulfillment center. This “XL” Non-Sortable facility is designed to receive, store, and package heavy or bulky items like home appliances. The 1 million-square-foot facility in Limestone County will provide more than 250 full-time jobs and will utilize innovative technologies and energy-efficient, zero-emission power industrialized truck (PIT) equipment. Montgomery Receive Center: In 2022, Amazon will open an Inbound Cross Dock facility that will receive and consolidate items from vendors and facilitate shipment to fulfillment centers. This 650,000 square foot facility will provide more than 500 full-time jobs. Alabama Site Now Officially Launched: Huntsville Non-Sortable Fulfillment Center: Amazon’s new Huntsville Non-Sortable Fulfillment Center is now open for business. This is the first of two fulfillment centers in the area. This nearly 1 million square foot facility has created hundreds of full-time jobs and allows Amazon employees to pick, pack, and ship larger items to customers, such as bulk paper goods, outdoor equipment, or rugs. Additionally, this facility utilizes innovative technologies and energy-efficient, zero-emission power industrialized truck (PIT) equipment. Positions are available at all new operations facilities. Interested candidates can visit www.hiring.amazon.com, to learn more. For fulfillment center and delivery station images and b-roll, please visit https://press.aboutamazon.com/images-videos. Additional Quotes – Huntsville: Mayor Tommy Battle, Huntsville ""The growth of Huntsville and North Alabama is a natural fit for Amazon’s fulfillment centers as the company expands its physical distribution network. We welcome the new job opportunities and service options Amazon will bring to the region."" Chip Cherry, Chamber President & CEO: ""We are pleased to welcome Amazon to an area of the city that is really growing. This is one in a series of recent developments, bringing exciting new opportunities for people in our region for years to come."" Chairman Collin Daly, Limestone County Commission ""This is the second exciting announcement in Limestone County from Amazon. This investment in our county and the 250 jobs that will be created by this project, will greatly impact our future for many years. We would like to thank Amazon for believing in us, selecting our county for their second fulfilment center, and we look forward to being a part of their success in the future."" John Meredith, Huntsville City Council Representative, District 5 “The Amazon facility is proving to be a fantastic addition to the District 5 Huntsville/Limestone County family of businesses. This non-sort fulfillment center will bring over 500 much needed, well paying, full time jobs to area citizens,” said John Meredith. “Combined with a second fulfillment center responsible for large bulky items, Amazon expects to provide in excess of 750 new jobs operating out of a 2 million square feet of state-of-the-art warehouse space by this time next year.” Additional Quotes – Montgomery County Commission Chairman Elton Dean “We are proud to welcome Amazon to Montgomery County and into this growing community of diverse industries,” said County Commission Chairman Elton Dean. “This facility will provide excellent opportunities for our citizens and pave the way for even more growth and investment in our area.” Mayor Steven L. Reed “Amazon’s major investment shows that Montgomery is on the map and an essential part of logistics solutions for major brands and industries,” said Montgomery Mayor Steven L. Reed. “We’re eager to grow this partnership on behalf of the Montgomerians who will benefit from the careers that this new facility will bring.” Additional Quotes – Birmingham Chief Executive Officer, Birmingham Business Alliance, Ron Kitchens “We are incredibly proud and grateful for the continuing investment that Amazon had made in the Birmingham region, the 150 new jobs coming online will ensure families have well-paying jobs with access to educational benefits that are truly life changing.” About Amazon: Amazon is guided by four principles: customer obsession rather than competitor focus, passion for invention, commitment to operational excellence, and long-term thinking. Customer reviews, 1-Click shopping, personalized recommendations, Prime, Fulfillment by Amazon, AWS, Kindle Direct Publishing, Kindle, Fire tablets, Fire TV, Amazon Echo, and Alexa are some of the products and services pioneered by Amazon. For more information, visit https://www.aboutamazon.com/ and follow @AmazonNews.",businesswire.com,https://www.businesswire.com/news/home/20211109006349/en/Amazon-Expands-Investment-with-Four-New-Operations-Sites-in-Alabama,https://images.financialmodelingprep.com/news/amazon-expands-investment-with-four-new-operations-sites-in-20211109.png
AMZN,2021-10-28,2021-10-14,2021-11-11,AMZN,,2021-11-09 15:00:00,2021-11-09T15:00:00-05:00,2021-11-09,Amazon Expands Investment with Four New Operations Sites in Alabama,"SEATTLE--(BUSINESS WIRE)--Amazon.com, Inc. (Nasdaq:AMZN) today announced plans for three new operations facilities in Alabama and celebrates the launch of a new fulfillment center that will support customers across the state. “We are proud to continue our investment in Alabama with thousands of good jobs and new, state-of-the-art operations facilities,” said Brian Huseman, vice president of public policy at Amazon. “Our success would not be possible without our great employees and we are gratef",businesswire.com,https://www.businesswire.com/news/home/20211109006349/en/Amazon-Expands-Investment-with-Four-New-Operations-Sites-in-Alabama/,https://images.financialmodelingprep.com/news/amazon-expands-investment-with-four-new-operations-sites-in-alabama-20211109.jpg
AMZN,2021-10-28,2021-10-14,2021-11-11,AMZN,,2021-11-09 16:50:00,2021-11-09T16:50:00-05:00,2021-11-09,Some Big Tech Stocks Have Gone Bonkers. They're Not That Expensive.,The big share-price gains are coming from companies where earnings are also expected to soar.,barrons.com,https://www.barrons.com/articles/some-big-tech-stocks-have-gone-bonkers-theyre-not-that-expensive-51636494599,https://images.financialmodelingprep.com/news/some-big-tech-stocks-have-gone-bonkers-theyre-not-that-20211109.jpg
AMZN,2021-10-28,2021-10-14,2021-11-11,AMZN,,2021-11-09 17:22:22,2021-11-09T17:22:22-05:00,2021-11-09,"10 Stocks Post-Pandemic: What to Consider, Keep and Run From","More than a year and a half into the Covid-19 pandemic, the world is changing. More people are returning to the office after months of working at home and restaurants have reopened.",gurufocus.com,https://www.gurufocus.com/news/1567465/10-stocks-postpandemic-what-to-consider-keep-and-run-from,https://images.financialmodelingprep.com/news/10-stocks-postpandemic-what-to-consider-keep-and-run-20211109.jpg
AMZN,2021-10-28,2021-10-14,2021-11-11,AMZN,,2021-11-09 22:48:00,2021-11-09T22:48:00-05:00,2021-11-09,IPO Report: Rivian IPO: 5 things to know about the Amazon-backed electric-vehicle maker,"Electric-vehicle maker Rivian Automotive Inc. is set to become a public company, hoping to carve a niche for itself offering EVs for the great outdoors.",marketwatch.com,https://www.marketwatch.com/story/rivian-ipo-5-things-to-know-about-the-amazon-backed-electric-vehicle-maker-11633451932,https://images.financialmodelingprep.com/news/ipo-report-rivian-ipo-5-things-to-know-about-the-20211109.jpg
AMZN,2021-10-28,2021-10-14,2021-11-11,AMZN,,2021-11-10 01:09:00,2021-11-10T01:09:00-05:00,2021-11-10,U.S. airlines and Amazon join push to reduce aircraft emissions,Major U.S. airlines and Amazon.com's aviation unit are joining an effort to speed development and use of sustainable aviation fuels (SAF) to decrease emissions in air transport.,reuters.com,https://www.reuters.com/business/cop/us-airlines-amazon-join-push-reduce-aircraft-emissions-2021-11-10/,https://images.financialmodelingprep.com/news/us-airlines-and-amazon-join-push-to-reduce-aircraft-20211110.jpg
