ticker,event_date,window_start,window_end,symbol,symbols,publishedDate,publishedDateET,date_et,title,text,site,url,image
MA,2023-10-26,2023-10-19,2023-11-09,MA,,2023-11-06 10:37:48,2023-11-06T10:37:48-05:00,2023-11-06,4 Factor Dividend Growth Portfolio: Year One Is On The Books,"The 4-factor dividend growth portfolio is a strategy that leverages the stock selection process of Schwab U.S. Dividend Equity ETF, with a few minor twists. The portfolio fell by 3.07% in October, underperforming the S&P 500 by 0.97%. Year-to-date, the portfolio is up 3.61%.",seekingalpha.com,https://seekingalpha.com/article/4648006-4-factor-dividend-growth-portfolio-year-one-on-books,https://images.financialmodelingprep.com/news/4-factor-dividend-growth-portfolio-year-one-is-on-20231106.jpg
MA,2023-10-26,2023-10-19,2023-11-09,MA,,2023-11-07 05:59:00,2023-11-07T05:59:00-05:00,2023-11-07,Better Buy: Visa or Mastercard?,Visa has a lower price-to-earnings ratio than Mastercard. Visa has a higher annual dividend yield after a recent 16% raise.,fool.com,https://www.fool.com/investing/2023/11/07/better-buy-visa-or-mastercard/,https://images.financialmodelingprep.com/news/better-buy-visa-or-mastercard-20231107.jpg
MA,2023-10-26,2023-10-19,2023-11-09,MA,,2023-11-08 07:15:00,2023-11-08T07:15:00-05:00,2023-11-08,7 Dividend Aristocrats You Should Buy Before It's Too Late,"U.S. stocks had their best week in a year, with the S&P soaring almost 6% and tech stocks surging over 7%. It was a primarily speculation-driven rally with the lowest-quality stocks up 18%. But that doesn't mean high-quality dividend growth isn't available at a steep discount. Growth at a reasonable price, with a PEG ratio of close to 1, can help avoid paying dangerous valuations for quality companies.",seekingalpha.com,https://seekingalpha.com/article/4648144-7-dividend-aristocrats-you-should-buy-before-too-late,https://images.financialmodelingprep.com/news/7-dividend-aristocrats-you-should-buy-before-its-too-20231108.jpg
MA,2023-10-26,2023-10-19,2023-11-09,MA,,2023-11-08 09:30:00,2023-11-08T09:30:00-05:00,2023-11-08,3 Top Dividend Growers For 2024,"2024 is setting up to be a great year for us contrarian dividend investors—but to take full advantage, we need to buy now—while fear is still in the air.",forbes.com,https://www.forbes.com/sites/brettowens/2023/11/08/3-top-dividend-growers-for-2024/,https://images.financialmodelingprep.com/news/3-top-dividend-growers-for-2024-20231108.jpg
MA,2023-10-26,2023-10-19,2023-11-09,MA,,2023-11-09 18:01:41,2023-11-09T18:01:41-05:00,2023-11-09,How Trading Beats Buy-and-Hold,Is it really so bad to miss the best days of market performance?,investorplace.com,https://investorplace.com/2023/11/how-trading-beats-buy-and-hold/,https://images.financialmodelingprep.com/news/how-trading-beats-buyandhold-20231109.jpg
