ticker,event_date,window_start,window_end,symbol,symbols,publishedDate,publishedDateET,date_et,title,text,site,url,image
AMZN,2023-08-03,2023-07-20,2023-08-17,AMZN,,2023-08-11 06:15:00,2023-08-11T06:15:00-04:00,2023-08-11,"Amazon Is Soaring, and the Stock Is Probably Still a Great Buy","Amazon's business rebounded across the board in Q2 2023, but ads, third-party e-commerce services, and AWS performed especially well. Amazon appears to have undergone something of a transformation the last few years and is making most of its profit from supporting other businesses now.",fool.com,https://www.fool.com/investing/2023/08/11/amazon-is-soaring-and-the-stock-is-probably-still/,https://images.financialmodelingprep.com/news/amazon-is-soaring-and-the-stock-is-probably-still-20230811.jpg
AMZN,2023-08-03,2023-07-20,2023-08-17,AMZN,,2023-08-11 07:40:44,2023-08-11T07:40:44-04:00,2023-08-11,5 Things to Know Before Markets Open,"The latest Producer Price Index tracking wholesale inflation is expected to show prices ticked higher for July, and Google and GM get authority to operate self-driving taxis in San Francisco. Here's what investors need to know today.",investopedia.com,https://www.investopedia.com/5-things-to-know-before-markets-open-august-11-2023-7642340,https://images.financialmodelingprep.com/news/5-things-to-know-before-markets-open-20230811.jpg
AMZN,2023-08-03,2023-07-20,2023-08-17,AMZN,,2023-08-11 09:17:10,2023-08-11T09:17:10-04:00,2023-08-11,ETF Lessons to Learn from Berkshire Earnings,Veteran investor Warren Buffett's Berkshire Hathaway reported second-quarter earnings in late last week. These are lessons we have learnt from the release.,zacks.com,https://www.zacks.com/stock/news/2135522/etf-lessons-to-learn-from-berkshire-earnings,https://images.financialmodelingprep.com/news/etf-lessons-to-learn-from-berkshire-earnings-20230811.jpg
AMZN,2023-08-03,2023-07-20,2023-08-17,AMZN,,2023-08-11 10:43:38,2023-08-11T10:43:38-04:00,2023-08-11,Amazon warns employees who don't go to the office enough,"Amazon has warned some of its US-based office workers that it is keeping a close eye on their in-person attendance at work, sending emails to those it believes are not complying with its return-to-office policies.",cnn.com,https://www.cnn.com/2023/08/11/business/amazon-warns-employees-office/index.html,https://images.financialmodelingprep.com/news/amazon-warns-employees-who-dont-go-to-the-office-20230811.jpg
AMZN,2023-08-03,2023-07-20,2023-08-17,AMZN,,2023-08-11 10:59:00,2023-08-11T10:59:00-04:00,2023-08-11,"Amazon, Meta, and Alphabet Were the Standouts in Tech Earnings. Here's Why.",The overall Big Tech profit-reporting season was mixed as excitement over artificial intelligence was offset by fear of slower consumer spending.,barrons.com,https://www.barrons.com/articles/amazon-meta-alphabet-stocks-tech-winners-a31c1bef,https://images.financialmodelingprep.com/news/amazon-meta-and-alphabet-were-the-standouts-in-tech-20230811.jpg
AMZN,2023-08-03,2023-07-20,2023-08-17,AMZN,,2023-08-11 11:31:00,2023-08-11T11:31:00-04:00,2023-08-11,Direct Energy Expands Renewable Energy Plans and Includes Amazon Prime,"HOUSTON--(BUSINESS WIRE)--New Direct Energy customers now enjoy two years of Amazon Prime, which will be included with any Direct Energy “On Us” electricity plan, and are all 100 percent renewable. The “On Us” plans from Direct Energy include a fixed-rate electricity plan or a fixed-rate electricity plan with free nights or free weekends, any of which allow customers to save on their electricity bills. Direct Energy began collaborating with Amazon in 2018. Their latest joint undertaking, the “O.",businesswire.com,https://www.businesswire.com/news/home/20230811630753/en/Direct-Energy-Expands-Renewable-Energy-Plans-and-Includes-Amazon-Prime/,https://images.financialmodelingprep.com/news/direct-energy-expands-renewable-energy-plans-and-includes-amazon-20230811.jpg
AMZN,2023-08-03,2023-07-20,2023-08-17,AMZN,,2023-08-11 13:47:18,2023-08-11T13:47:18-04:00,2023-08-11,Momentum Alert: 3 Top Ranked Stocks Primed for a Breakout,"After rallying almost straight up for nearly four months the stock market has taken a much-needed breather over the last couple of weeks. Rather than a sharp downward correction, many stocks have corrected in time and built out some sideways action.",zacks.com,https://www.zacks.com/commentary/2135889/momentum-alert-3-top-ranked-stocks-primed-for-a-breakout,https://images.financialmodelingprep.com/news/momentum-alert-3-top-ranked-stocks-primed-for-a-20230811.jpg
AMZN,2023-08-03,2023-07-20,2023-08-17,AMZN,,2023-08-11 15:10:37,2023-08-11T15:10:37-04:00,2023-08-11,‘Big Five' Bring the Heat to Summer Earnings Season,"Subscribers to  Chart of the Week  received this commentary on Sunday, August 6.",schaeffersresearch.com,https://www.schaeffersresearch.com/content/bgs/2023/08/11/big-five-bring-the-heat-to-summer-earnings-season,https://images.financialmodelingprep.com/news/big-five-bring-the-heat-to-summer-earnings-season-20230811.jpg
AMZN,2023-08-03,2023-07-20,2023-08-17,AMZN,,2023-08-11 21:00:00,2023-08-11T21:00:00-04:00,2023-08-11,Amazon's Palm-Payment Effort Is a Sneak Attack on Apple and Google,"It's also a potentially massive play to make Amazon the central ID system for your whole life—from banking and loyalty programs to tickets, age verification and someday even health records and corporate ID cards.",wsj.com,https://www.wsj.com/articles/amazon-wants-you-to-pay-with-your-palm-its-a-sneak-attack-on-apple-and-google-e8e417a,https://images.financialmodelingprep.com/news/amazons-palmpayment-effort-is-a-sneak-attack-on-apple-20230811.jpg
AMZN,2023-08-03,2023-07-20,2023-08-17,AMZN,,2023-08-12 08:00:00,2023-08-12T08:00:00-04:00,2023-08-12,3 Warren Buffett Stocks to Buy Hand Over Fist in August,Improving profitability is sending Amazon's shares soaring. Kraft Heinz is an undervalued stock and offers a high dividend yield.,fool.com,https://www.fool.com/investing/2023/08/12/3-warren-buffett-stocks-buy-hand-over-fist/,https://images.financialmodelingprep.com/news/3-warren-buffett-stocks-to-buy-hand-over-fist-in-20230812.jpg
AMZN,2023-08-03,2023-07-20,2023-08-17,AMZN,,2023-08-12 08:00:00,2023-08-12T08:00:00-04:00,2023-08-12,Amazon: I'm Buying More Before The Northbound Train Leaves,"I added Amazon stock aggressively late last year and earlier this year, as I anticipated its bottom. Therefore, I'm not surprised AMZN has outperformed the S&P 500 significantly. I highlight why investors need to be forward-looking and not wait for the coast to be clear. Amazon's Q2 earnings release indicated an ongoing recovery, justifying my optimism. However, if you wait till its results offer more clarity, you have missed out on the most attractive risk/reward buying opportunities over the past year.",seekingalpha.com,https://seekingalpha.com/article/4627526-amazon-im-buying-more-before-the-northbound-train-leaves,https://images.financialmodelingprep.com/news/amazon-im-buying-more-before-the-northbound-train-leaves-20230812.jpg
AMZN,2023-08-03,2023-07-20,2023-08-17,AMZN,,2023-08-12 09:00:01,2023-08-12T09:00:01-04:00,2023-08-12,How Amazon is racing to catch Microsoft and Google in generative A.I. with custom AWS chips,"CNBC got an exclusive look inside Amazon's chip lab, where AWS designs custom silicon in a race to catch Microsoft and Google in the generative A.I. race",cnbc.com,https://www.cnbc.com/2023/08/12/amazon-is-racing-to-catch-up-in-generative-ai-with-custom-aws-chips.html,https://images.financialmodelingprep.com/news/how-amazon-is-racing-to-catch-microsoft-and-google-20230812.jpg
AMZN,2023-08-03,2023-07-20,2023-08-17,AMZN,,2023-08-12 10:15:00,2023-08-12T10:15:00-04:00,2023-08-12,Is Amazon a Buy After Its Blowout Quarter?,Efficiency improvements allowed Amazon's operating margin to expand significantly. AWS didn't perform well in the quarter.,fool.com,https://www.fool.com/investing/2023/08/12/is-amazon-a-buy-after-its-blowout-quarter/,https://images.financialmodelingprep.com/news/is-amazon-a-buy-after-its-blowout-quarter-20230812.jpeg
AMZN,2023-08-03,2023-07-20,2023-08-17,AMZN,,2023-08-13 05:52:00,2023-08-13T05:52:00-04:00,2023-08-13,Want to Get Richer? Buy and Hold These 5 Unstoppable Stocks,"Alphabet, Amazon, and MercadoLibre rank as leaders in growing markets. Brookfield Renewable is poised to profit from the shift to renewable energy.",fool.com,https://www.fool.com/investing/2023/08/13/get-richer-buy-and-hold-5-unstoppable-stocks/,https://images.financialmodelingprep.com/news/want-to-get-richer-buy-and-hold-these-5-20230813.jpg
AMZN,2023-08-03,2023-07-20,2023-08-17,AMZN,,2023-08-13 05:55:00,2023-08-13T05:55:00-04:00,2023-08-13,Here's the 1 Warren Buffett Stock That's Most Likely to Join Apple and Microsoft in the $2 Trillion Club,Berkshire Hathaway owns a position in only one of the three stocks closest to reaching a market cap of $2 trillion. This likely future member of the $2 trillion club should benefit from AI-related growth and increased profitability.,fool.com,https://www.fool.com/investing/2023/08/13/warren-buffett-stock-join-apple-microsoft/,https://images.financialmodelingprep.com/news/heres-the-1-warren-buffett-stock-thats-most-likely-20230813.jpg
AMZN,2023-08-03,2023-07-20,2023-08-17,AMZN,,2023-08-13 07:35:00,2023-08-13T07:35:00-04:00,2023-08-13,2 Discounted Growth Stocks to Buy for the Next Decade,Amazon and Advanced Micro Devices are turning the corner following a weak business climate. Amazon's revenue growth just accelerated back to the double-digit range in the second quarter.,fool.com,https://www.fool.com/investing/2023/08/13/2-discounted-growth-stocks-buy-next-decade/,https://images.financialmodelingprep.com/news/2-discounted-growth-stocks-to-buy-for-the-next-20230813.jpg
AMZN,2023-08-03,2023-07-20,2023-08-17,AMZN,,2023-08-13 09:15:37,2023-08-13T09:15:37-04:00,2023-08-13,"Amazon To Cut Back On Private Labels, While Walmart And Other Retailers Thrive",Customers opt for pricing over brand names but Amazon's scaling back its private label operations even as other retailers such as Walmart and Costco continue to derive value.,investopedia.com,https://www.investopedia.com/amazon-cuts-back-on-private-labels-7642551,https://images.financialmodelingprep.com/news/amazon-to-cut-back-on-private-labels-while-walmart-20230813.jpg
AMZN,2023-08-03,2023-07-20,2023-08-17,AMZN,,2023-08-13 14:20:19,2023-08-13T14:20:19-04:00,2023-08-13,The 3 Best Forever Stocks to Buy for August 2023,What are the best stocks to anchor a portfolio? Which securities should investors buy and hold forever?,investorplace.com,https://investorplace.com/2023/08/best-forever-stocks-to-buy/,https://images.financialmodelingprep.com/news/the-3-best-forever-stocks-to-buy-for-august-20230813.png
AMZN,2023-08-03,2023-07-20,2023-08-17,AMZN,,2023-08-13 17:00:00,2023-08-13T17:00:00-04:00,2023-08-13,"Amazon's Q2 Shows Why It's Still King, But Are Ratings Upgrades Too Late?","Many are rushing to upgrade Amazon stock after spectacular Q2 results. One critical cash flow metric turned positive, several segments improved, and a massive future opportunity is coming to AWS. But is the stock still a buy after 60% YTD gains?",seekingalpha.com,https://seekingalpha.com/article/4627616-amazon-q2-shows-why-its-still-king-but-are-ratings-upgrades-too-late,https://images.financialmodelingprep.com/news/amazons-q2-shows-why-its-still-king-but-are-ratings-20230813.jpg
AMZN,2023-08-03,2023-07-20,2023-08-17,AMZN,,2023-08-13 17:03:00,2023-08-13T17:03:00-04:00,2023-08-13,Elon Musk vs. Mark Zuckerberg: The stupidest story of the summer appears over,"Mark Zuckerberg, billionaire and chief executive of Meta Platforms Inc. META, -1.34%, on Sunday appeared to pull the grown-up card — or at least the less-immature card — to scuttle a cage fight with Elon Musk, the even richer billionaire, Tesla Inc. TSLA, -1.10% CEO and X owner.",marketwatch.com,https://www.marketwatch.com/story/elon-musk-vs-mark-zuckerberg-the-stupidest-story-of-the-summer-appears-over-44022704,https://images.financialmodelingprep.com/news/elon-musk-vs-mark-zuckerberg-the-stupidest-story-of-20230813.jpg
AMZN,2023-08-03,2023-07-20,2023-08-17,AMZN,,2023-08-14 06:35:00,2023-08-14T06:35:00-04:00,2023-08-14,Legendary investor Seth Klarman just got back into Amazon and bought three other stocks.,"Seth Klarman, the Baupost Group chief executive and value investing legend, just re-edited Benjamin Graham's and David Dodd's classic tome Security Analysis, originally published in 1934. In an interview with Institutional Investor, he talked of his biggest investing mistake.",marketwatch.com,https://www.marketwatch.com/story/legendary-investor-seth-klarman-just-got-back-into-amazon-and-bought-three-other-stocks-2ffbcd0f,https://images.financialmodelingprep.com/news/legendary-investor-seth-klarman-just-got-back-into-amazon-20230814.jpg
AMZN,2023-08-03,2023-07-20,2023-08-17,AMZN,,2023-08-14 06:45:00,2023-08-14T06:45:00-04:00,2023-08-14,Amazon Plans To Deliver Without A Box,There will be stickers on the box to ensure delivery to the right address.,forbes.com,https://www.forbes.com/sites/walterloeb/2023/08/14/amazon-plans-to-deliver-without-a-box/,https://images.financialmodelingprep.com/news/amazon-plans-to-deliver-without-a-box-20230814.jpg
AMZN,2023-08-03,2023-07-20,2023-08-17,AMZN,,2023-08-14 07:06:00,2023-08-14T07:06:00-04:00,2023-08-14,Is It Too Late to Buy Amazon Stock?,Amazon shares have soared over 60% since the start of the year. The company has rallied investors with a quickly developing AI business.,fool.com,https://www.fool.com/investing/2023/08/14/is-it-too-late-to-buy-amazon-stock/,https://images.financialmodelingprep.com/news/is-it-too-late-to-buy-amazon-stock-20230814.jpg
AMZN,2023-08-03,2023-07-20,2023-08-17,AMZN,,2023-08-14 08:00:00,2023-08-14T08:00:00-04:00,2023-08-14,"Doctor, Nurse Practitioner Pay Rising As Amazon, CVS And Walgreens Buy Providers","Nurse practitioners – not doctors – topped AMN Healthcare's list of “most requested search engagements for the third consecutive year.""",forbes.com,https://www.forbes.com/sites/brucejapsen/2023/08/14/doctor-nurse-practitioner-pay-rising-as-amazon-cvs-and-walgreens-buy-providers/,https://images.financialmodelingprep.com/news/doctor-nurse-practitioner-pay-rising-as-amazon-cvs-and-20230814.jpg
AMZN,2023-08-03,2023-07-20,2023-08-17,AMZN,,2023-08-14 09:18:57,2023-08-14T09:18:57-04:00,2023-08-14,"US firms including Netflix, Amazon offer AI jobs that pay up to $900K","Netflix is among the companies willing to pay the most for top talent in AI. One role will pay as much as $900,000 yearly, which caught the eyes of Hollywood workers on strike fighting for more protection against emerging tech.",nypost.com,https://nypost.com/2023/08/14/us-firms-like-netflix-amazon-offer-ai-jobs-that-pay-up-to-900k/,https://images.financialmodelingprep.com/news/us-firms-including-netflix-amazonoffer-ai-jobs-that-pay-20230814.jpg
AMZN,2023-08-03,2023-07-20,2023-08-17,AMZN,,2023-08-14 09:40:00,2023-08-14T09:40:00-04:00,2023-08-14,Stock screen spotlights 20 companies whose 2024 earnings estimates have risen most sharply,"With another earnings season almost complete, it might be useful for investors to look further ahead. Each earnings season, we can see 70% to 80% of the S&P 500 “beating” consensus quarterly profit estimates.",marketwatch.com,https://www.marketwatch.com/story/stock-screen-spotlights-20-companies-whose-2024-earnings-estimates-have-risen-most-sharply-2c1b75a4,https://images.financialmodelingprep.com/news/stock-screen-spotlights-20-companies-whose-2024-earnings-estimates-20230814.jpg
AMZN,2023-08-03,2023-07-20,2023-08-17,AMZN,,2023-08-14 09:47:44,2023-08-14T09:47:44-04:00,2023-08-14,Amazon is rolling out a generative AI feature that summarizes product reviews,Amazon is rolling out a new generative AI feature that summarizes product reviews for customers.,techxplore.com,https://techxplore.com/news/2023-08-amazon-generative-ai-feature-product.html,https://images.financialmodelingprep.com/news/amazon-is-rolling-out-a-generative-ai-feature-that-20230814.jpg
AMZN,2023-08-03,2023-07-20,2023-08-17,AMZN,,2023-08-14 10:30:42,2023-08-14T10:30:42-04:00,2023-08-14,Amazon taps generative AI to enhance product reviews,"Amazon announced this morning it will begin to leverage generative AI to help customers better understand what customers are saying about a product, without necessarily having to read through dozens of individual reviews.",techcrunch.com,https://techcrunch.com/2023/08/14/amazon-taps-generative-ai-to-enhance-product-reviews/,https://images.financialmodelingprep.com/news/amazon-taps-generative-ai-to-enhance-product-reviews-20230814.webp
AMZN,2023-08-03,2023-07-20,2023-08-17,AMZN,,2023-08-14 11:16:29,2023-08-14T11:16:29-04:00,2023-08-14,Amazon's On-Demand AI: Path To Adoption Through AI-As-A-Service,"AI-as-a-Service (AIaaS) and Machine Learning-as-a-Service (MLaaS) are growing trends in the AI industry, offering on-demand cloud-based AI capabilities. Amazon's AWS AI offerings, along with Microsoft's Azure AI, IBM's Watsonx, and Google's Vertex AI, are leading the competition in the AIaaS/MLaaS market. AWS AI has the potential to capture a larger market share due to its dominance in cloud services, extensive customer base and integration, developer-friendly ecosystem, and synergy with Amazon's retail and e-commerce presence.",seekingalpha.com,https://seekingalpha.com/article/4628157-amazons-on-demand-ai-path-to-adoption-through-ai-as-a-service,https://images.financialmodelingprep.com/news/amazons-ondemand-ai-path-to-adoption-through-aiasaservice-20230814.jpg
AMZN,2023-08-03,2023-07-20,2023-08-17,AMZN,,2023-08-14 11:53:27,2023-08-14T11:53:27-04:00,2023-08-14,The 7 Best Penny Stocks to Buy Now,"The performance of penny stocks continues to be mixed relative to more widely-followed stocks, but if you've looking for the best penny stocks to buy now, this works to your advantage. As has been the case in recent months, there are plenty of names in “penny stock territory” ($5 per share or less) trading at low valuations, with catalysts in play that over the long-term stand to help bridge the gap between trading price and underlying value.",investorplace.com,https://investorplace.com/best-penny-stocks/,https://images.financialmodelingprep.com/news/the-7-best-penny-stocks-to-buy-now-20230814.jpg
AMZN,2023-08-03,2023-07-20,2023-08-17,AMZN,,2023-08-14 12:00:00,2023-08-14T12:00:00-04:00,2023-08-14,Amazon: It's Time To Be Greedy,"Amazon reported great Q2 earnings results last week and improved its guidance for Q3. At this stage, the company has everything going for it to continue to grow at a decent rate even today, as long as the U.S. economy continues to improve. While there are questions about whether Amazon's current premium is justified, there are reasons to believe that the growth opportunities will outweigh the valuation concerns in the foreseeable future.",seekingalpha.com,https://seekingalpha.com/article/4628057-amazon-its-time-to-be-greedy,https://images.financialmodelingprep.com/news/amazon-its-time-to-be-greedy-20230814.jpg
AMZN,2023-08-03,2023-07-20,2023-08-17,AMZN,,2023-08-14 16:19:00,2023-08-14T16:19:00-04:00,2023-08-14,"Another Amazon exec, its devices chief, is leaving","Amazon.com Inc. AMZN, +1.56% is losing another executive. David Limp, senior vice president of devices & services, plans to retire this year — the latest departure of a longstanding Amazon executive since company Chief Executive Andy Jassy took over in 2021.",marketwatch.com,https://www.marketwatch.com/story/another-amazon-exec-its-devices-chief-is-leaving-106d7618,https://images.financialmodelingprep.com/news/another-amazon-exec-its-devices-chief-is-leaving-20230814.jpg
AMZN,2023-08-03,2023-07-20,2023-08-17,AMZN,,2023-08-14 16:30:31,2023-08-14T16:30:31-04:00,2023-08-14,Amazon hardware chief Dave Limp is stepping down this year,"Amazon's senior vice president of devices and services, David Limp, is planning to step down from his role after more than 13 years at the company.",cnbc.com,https://www.cnbc.com/2023/08/14/amazon-hardware-chief-dave-limp-is-stepping-down-this-year.html,https://images.financialmodelingprep.com/news/amazon-hardware-chief-dave-limp-is-stepping-down-this-year-20230814.jpeg
AMZN,2023-08-03,2023-07-20,2023-08-17,AMZN,,2023-08-14 16:39:32,2023-08-14T16:39:32-04:00,2023-08-14,Don't Jump the Gun! 3 Hyper-Growth Stocks to Grab AFTER a 10% Dip,"Certain stocks have surged this year, with hyper-growth tech companies seeing some of the biggest gains. The three companies listed below have highlighted what momentum can mean for sustained moves higher, even though these stocks are all down at least 10% from their all-time highs, at the time of writing.",investorplace.com,https://investorplace.com/2023/08/dont-jump-the-gun-3-hyper-growth-stocks-to-grab-after-a-10-dip/,https://images.financialmodelingprep.com/news/dont-jump-the-gun-3-hypergrowth-stocks-to-grab-20230814.jpg
AMZN,2023-08-03,2023-07-20,2023-08-17,AMZN,,2023-08-14 17:00:01,2023-08-14T17:00:01-04:00,2023-08-14,Amazon cracks down on employees who stay away from the office,"Amazon.com Inc. is cracking down on U.S. workers who have ignored its return-to-office guidelines, in the latest example of companies attempting to reduce the amount of time employees work remotely.",techxplore.com,https://techxplore.com/news/2023-08-amazon-employees-stay-office.html,https://images.financialmodelingprep.com/news/amazon-cracks-down-on-employees-who-stay-away-from-20230814.jpg
AMZN,2023-08-03,2023-07-20,2023-08-17,AMZN,,2023-08-14 17:31:00,2023-08-14T17:31:00-04:00,2023-08-14,"Dan Loeb's Third Point wagers on Nvidia, Amazon, Uber with new positions","Dan Loeb's Third Point LLC built new positions in Uber Technologies Inc., Amazon.com Inc. and Nvidia Corp. during the latest quarter.",marketwatch.com,https://www.marketwatch.com/story/dan-loebs-third-point-wagers-on-nvidia-amazon-uber-with-new-positions-3ca0a6a8,https://images.financialmodelingprep.com/news/dan-loebs-third-point-wagers-on-nvidia-amazon-uber-20230814.jpg
AMZN,2023-08-03,2023-07-20,2023-08-17,AMZN,,2023-08-14 17:32:42,2023-08-14T17:32:42-04:00,2023-08-14,Amazon's devices chief is stepping down this year,"David Limp is set to step down from his role as head of Amazon's consumer devices division later this year. Amazon has confirmed the news with TechCrunch, following a Wall Street Journal report.",techcrunch.com,https://techcrunch.com/2023/08/14/amazons-devices-chief-is-stepping-down-this-year/,https://images.financialmodelingprep.com/news/amazons-devices-chief-is-stepping-down-this-year-20230814.jpg
AMZN,2023-08-03,2023-07-20,2023-08-17,AMZN,,2023-08-15 07:00:00,2023-08-15T07:00:00-04:00,2023-08-15,Amazon Pharmacy Launches $35 Insulin Coupons As Transparency Takes Hold,"Amazon Pharmacy is rolling out coupons that ""automatically"" reduce customer costs for insulin to as low as $35 a month on more than a dozen diabetes care brands.",forbes.com,https://www.forbes.com/sites/brucejapsen/2023/08/15/amazon-pharmacy-launches-35-insulin-coupons-amid-transparency-debate/,https://images.financialmodelingprep.com/news/amazon-pharmacy-launches-35-insulin-coupons-as-transparency-takes-20230815.jpg
AMZN,2023-08-03,2023-07-20,2023-08-17,AMZN,,2023-08-15 07:05:29,2023-08-15T07:05:29-04:00,2023-08-15,Amazon Pharmacy automates discounts to help insulin patients get pledged prices,Amazon.com said on Tuesday its online pharmacy will automatically apply manufacturer-sponsored coupons to more than 15 insulin and diabetes medicines to help patients access discounts pledged by the drug industry.,reuters.com,https://www.reuters.com/business/retail-consumer/amazon-pharmacy-automates-discounts-help-insulin-patients-get-pledged-prices-2023-08-15/,https://images.financialmodelingprep.com/news/amazon-pharmacy-automates-discounts-to-help-insulin-patients-get-20230815.jpg
AMZN,2023-08-03,2023-07-20,2023-08-17,AMZN,,2023-08-15 07:08:24,2023-08-15T07:08:24-04:00,2023-08-15,"Amazon Pharmacy Announces Coupons For Insulin— Revolutionizing Medication Access, Yet Again","With a commitment to improving patient care and a tech-forward mindset, Amazon Pharmacy is powerful force of innovation.",forbes.com,https://www.forbes.com/sites/saibala/2023/08/15/amazon-pharmacy-announces-coupons-for-insulin--revolutionizing-medication-access-yet-again/,https://images.financialmodelingprep.com/news/amazon-pharmacy-announces-coupons-for-insulin-revolutionizing-medication-access-20230815.jpg
AMZN,2023-08-03,2023-07-20,2023-08-17,AMZN,,2023-08-15 07:15:00,2023-08-15T07:15:00-04:00,2023-08-15,Don't Call It a Comeback: Amazon Is Here to Stay,"Amazon Web Services and advertising revenue were the big winners in Q2. The company returned to positive free cash flow, despite operating in a high inflationary environment.",fool.com,https://www.fool.com/investing/2023/08/15/dont-call-it-a-comeback-amazon-is-here-to-stay/,https://images.financialmodelingprep.com/news/dont-call-it-a-comeback-amazon-is-here-to-20230815.jpg
AMZN,2023-08-03,2023-07-20,2023-08-17,AMZN,,2023-08-15 07:55:39,2023-08-15T07:55:39-04:00,2023-08-15,"Dan Loeb's Third Point Ramps Up AI Bets With Amazon, Nvidia and TSMC Stake","Hedge fund investor Dan Loeb's fund has pivoted further toward AI, slashing a big stake in defensive stocks such as Colgate to buy Amazon, Nvidia, and TSMC.",investopedia.com,https://www.investopedia.com/dan-loeb-s-third-point-ramps-up-ai-bets-with-amazon-nvidia-and-tsmc-stake-7643392,https://images.financialmodelingprep.com/news/dan-loebs-third-point-ramps-up-ai-bets-with-20230815.jpg
