ticker,event_date,window_start,window_end,symbol,symbols,publishedDate,publishedDateET,date_et,title,text,site,url,image
AMZN,2023-08-03,2023-07-20,2023-08-17,AMZN,,2023-08-04 05:32:00,2023-08-04T05:32:00-04:00,2023-08-04,"Amazon shares pop but Apple's dip, and other movers","Amazon.com Inc.‘s stock AMZN, +0.55% jumped more than 8% after the retail juggernaut blew past second-quarter expectations, with strong e-commerce and cloud sales.",marketwatch.com,https://www.marketwatch.com/story/amazon-shares-pop-but-apples-dip-and-other-movers-24b4c270,https://images.financialmodelingprep.com/news/amazon-shares-pop-but-apples-dip-and-other-movers-20230804.jpg
AMZN,2023-08-03,2023-07-20,2023-08-17,AMZN,,2023-08-04 05:36:00,2023-08-04T05:36:00-04:00,2023-08-04,Amazon Is Flying on the Cloud. AWS Jumps.,Stronger-than-expected growth from the company's cloud business offers hope that a recent slowdown is over. Shares of Amazon and other cloud players jumped on the news.,barrons.com,https://www.barrons.com/articles/amazon-earnings-stock-price-173a216d,https://images.financialmodelingprep.com/news/amazon-is-flying-on-the-cloud-aws-jumps-20230804.jpg
AMZN,2023-08-03,2023-07-20,2023-08-17,AMZN,,2023-08-04 06:05:48,2023-08-04T06:05:48-04:00,2023-08-04,"Amazon touts artificial intelligence products, services for businesses","Tech giant Amazon held its Q2 earnings call on Thursday as executives touted its AI initiatives, including the Bedrock platform businesses can use to make AI tools and models.",foxbusiness.com,https://www.foxbusiness.com/markets/amazon-touts-artificial-intelligence-products-services-businesses,https://images.financialmodelingprep.com/news/amazon-touts-artificial-intelligence-products-services-for-businesses-20230804.png
AMZN,2023-08-03,2023-07-20,2023-08-17,AMZN,,2023-08-04 06:45:00,2023-08-04T06:45:00-04:00,2023-08-04,Amazon Expands One-Day Delivery,"Same day delivery for some items is already in 90 metropolitan areas, according to the company.",forbes.com,https://www.forbes.com/sites/walterloeb/2023/08/04/amazon-expands-one-day-delivery/,https://images.financialmodelingprep.com/news/amazon-expands-oneday-delivery-20230804.jpg
AMZN,2023-08-03,2023-07-20,2023-08-17,AMZN,,2023-08-04 06:57:00,2023-08-04T06:57:00-04:00,2023-08-04,How Amazon's ‘game-changing' earnings could unlock a sustained stock surge,"Amazon.com Inc. showed positive momentum on the two most controversial elements of its story Thursday, and analysts were quick to shower the company with praise as a result.",marketwatch.com,https://www.marketwatch.com/story/how-amazons-game-changing-earnings-could-unlock-a-sustained-stock-surge-a2d09c08,https://images.financialmodelingprep.com/news/how-amazons-gamechanging-earnings-could-unlock-a-sustained-stock-20230804.jpg
AMZN,2023-08-03,2023-07-20,2023-08-17,AMZN,,2023-08-04 07:20:41,2023-08-04T07:20:41-04:00,2023-08-04,5 Things to Know Before Markets Open,Job growth is projected to slow and Amazon shares are soaring after the ecommerce giant blew by analyst revenue expectations. Here's what investors need to know today.,investopedia.com,https://www.investopedia.com/5-things-to-know-before-markets-open-august-4-2023-7569721,https://images.financialmodelingprep.com/news/5-things-to-know-before-markets-open-20230804.jpg
AMZN,2023-08-03,2023-07-20,2023-08-17,AMZN,,2023-08-04 07:30:58,2023-08-04T07:30:58-04:00,2023-08-04,"After Reporting A 2022 Loss, Amazon Looks To Rekindle Growth And Regain Its Mojo",E-commerce and cloud-computing leader Amazon.com has much to prove as it attempts to regain its mojo.,investors.com,https://www.investors.com/news/technology/amazon-stock-climbs-as-company-seeks-to-rekindle-growth-improve-profits/,https://images.financialmodelingprep.com/news/after-reporting-a-2022-loss-amazon-looks-to-rekindle-20230804.jpg
AMZN,2023-08-03,2023-07-20,2023-08-17,AMZN,,2023-08-04 07:37:00,2023-08-04T07:37:00-04:00,2023-08-04,Amazon Stood Out. Why Analysts Think It Will Keep Delivering.,"Analysts raised their target prices on Amazon after its earnings, seeing revenue momentum in cloud computing and improving e-commerce margins.",barrons.com,https://www.barrons.com/articles/amazon-stock-earnings-analysts-tech-ee00e47b,https://images.financialmodelingprep.com/news/amazon-stood-out-why-analysts-think-it-will-keep-20230804.jpg
AMZN,2023-08-03,2023-07-20,2023-08-17,AMZN,,2023-08-04 07:40:48,2023-08-04T07:40:48-04:00,2023-08-04,"Trading Game Plan: Jobs report, AAPL & AMZN earnings, day trades, swing trades and trading education - August 04, 2023","(Kitco News) - In today's action-packed session of the Game Plan LIVE on YouTube, Gareth Soloway will offer a full overview key charts and data sets across all markets. This includes a look at the Jobs Report, AAPL & AMZN Earnings, Day Trades, Swing Trades and Trading Education.",kitco.com,https://www.kitco.com/news/2023-08-04/Trading-Game-Plan-Jobs-report-AAPL-AMZN-earnings-day-trades-swing-trades-and-trading-education-August-04-2023.html,https://images.financialmodelingprep.com/news/trading-game-plan-jobs-report-aapl-amzn-earnings-day-20230804.jpg
AMZN,2023-08-03,2023-07-20,2023-08-17,AMZN,,2023-08-04 07:46:00,2023-08-04T07:46:00-04:00,2023-08-04,Amazon Is One Thing. But This Stock Market Bellwether Is Flashing Red for U.S. Tech.,Results from advertising behemoth WPP reveal a slowdown in spending from clients in the U.S. technology sector. It could be an early sign.,barrons.com,https://www.barrons.com/articles/amazon-is-one-thing-but-this-stock-market-bellwether-is-flashing-red-for-u-s-tech-6e128480,https://images.financialmodelingprep.com/news/amazon-is-one-thing-but-this-stock-market-bellwether-20230804.jpg
AMZN,2023-08-03,2023-07-20,2023-08-17,AMZN,,2023-08-04 07:50:33,2023-08-04T07:50:33-04:00,2023-08-04,"Amazon Stock Jumps After Earnings Beat, Ad Revenues Offset Slower Cloud Growth","Amazon shares jumped after the company reported stronger than expected earnings, with robust ad revenue helping to offset slower growth in cloud.",investopedia.com,https://www.investopedia.com/amazon-stock-jumps-after-earnings-beat-7569626,https://images.financialmodelingprep.com/news/amazon-stock-jumps-after-earnings-beat-ad-revenues-offset-20230804.jpg
AMZN,2023-08-03,2023-07-20,2023-08-17,AMZN,,2023-08-04 08:03:02,2023-08-04T08:03:02-04:00,2023-08-04,Nasdaq set to get Amazon boost but non-farm payrolls loom,"US markets are indicated to open modestly higher, with Amazon a likely big riser, although much will depend on non-farm payrolls data before Wall Street opens. Futures for the Dow Jones Industrial Average are one point higher, those for the S&P 500 are 7 points to the good while Nasdaq futures are up 31 points.",proactiveinvestors.com,https://www.proactiveinvestors.com/companies/news/1022660?SNAPI,https://images.financialmodelingprep.com/news/nasdaq-set-to-get-amazon-boost-but-nonfarm-payrolls-20230804.jpg
AMZN,2023-08-03,2023-07-20,2023-08-17,AMZN,,2023-08-04 08:59:11,2023-08-04T08:59:11-04:00,2023-08-04,DataDog: Stock Soars After Amazon's Strong AWS Results,"DataDog's stock surged in after hours trading on Thursday following Amazon's release of stronger than expected Q2 AWS results: $22.1 billion in revenue (+12% yoy). DDOG - a provider of cloud monitoring, security, and data analytics tools - also announced a bevy of new products at its annual DASH conference this week. AI is a strong positive catalyst for DDOG going forward as companies must migrate to the cloud in order to ring-out the most from AI algorithms.",seekingalpha.com,https://seekingalpha.com/article/4623866-datadog-stock-soars-after-amazons-strong-aws-results,https://images.financialmodelingprep.com/news/datadog-stock-soars-after-amazons-strong-aws-results-20230804.jpg
AMZN,2023-08-03,2023-07-20,2023-08-17,AMZN,,2023-08-04 09:03:54,2023-08-04T09:03:54-04:00,2023-08-04,Everyone's Watching These 2 Stocks Friday Morning,Markets inched higher in premarket trading. Amazon's stock got a big boost as both its e-commerce and cloud infrastructure businesses performed well.,fool.com,https://www.fool.com/investing/2023/08/04/everyones-watching-these-2-stocks-friday-morning/,https://images.financialmodelingprep.com/news/everyones-watching-these-2-stocks-friday-morning-20230804.jpg
AMZN,2023-08-03,2023-07-20,2023-08-17,AMZN,,2023-08-04 09:31:56,2023-08-04T09:31:56-04:00,2023-08-04,Amazon CEO To Wait And See If Store Remodels Produce Desired Results,"Time will tell, but Amazon's me-too approach to designing and running grocery stores suggests that any improvements coming will likely only delivery minor incremental",forbes.com,https://www.forbes.com/sites/georgeanderson/2023/08/04/amazon-ceo-to-wait-and-see-if-store-remodels-produce-desired-results/,https://images.financialmodelingprep.com/news/amazon-ceo-to-wait-and-see-if-store-remodels-20230804.jpg
AMZN,2023-08-03,2023-07-20,2023-08-17,AMZN,,2023-08-04 09:47:30,2023-08-04T09:47:30-04:00,2023-08-04,"""Big Tech"" Earnings Review: ETFs in Focus","Among the top five big tech stocks, Amazon, Facebook-parent Meta and Google-parent Alphabet delivered impressive results, garnering positive reactions from investors, while Apple and Microsoft disappointed investors.",zacks.com,https://www.zacks.com/stock/news/2132606/big-tech-earnings-review-etfs-in-focus,https://images.financialmodelingprep.com/news/big-tech-earnings-review-etfs-in-focus-20230804.jpg
AMZN,2023-08-03,2023-07-20,2023-08-17,AMZN,,2023-08-04 10:07:29,2023-08-04T10:07:29-04:00,2023-08-04,Amazon CEO Andy Jassy says 'every single one' of its teams is working on generative AI projects as the company rushes to keep pace with the AI boom,"Amazon CEO Andy Jassy says the company is working on multiple generative AI projects. The CEO called AI a ""significant investment and focus"" for the company.",businessinsider.com,https://www.businessinsider.com/amazons-teams-working-generative-ai-ceo-says-andy-jassy-2023-8,https://images.financialmodelingprep.com/news/amazon-ceo-andy-jassy-says-every-single-one-of-20230804.jpg
AMZN,2023-08-03,2023-07-20,2023-08-17,AMZN,,2023-08-04 10:25:54,2023-08-04T10:25:54-04:00,2023-08-04,Upbeat Earnings Boost Amazon.com Stock,"Amazon.com Inc's (NASDAQ:AMZN) highly anticipated second-quarter report bested analyst estimates, with profits of 65 cents per share on revenue of $134.38 billion.",schaeffersresearch.com,https://www.schaeffersresearch.com/content/news/2023/08/04/upbeat-earnings-boost-amazoncom-stock,https://images.financialmodelingprep.com/news/upbeat-earnings-boost-amazoncom-stock-20230804.jpg
AMZN,2023-08-03,2023-07-20,2023-08-17,AMZN,,2023-08-04 10:29:54,2023-08-04T10:29:54-04:00,2023-08-04,Amazon Revamps Grocery Business; Makes Biggest Changes Since Acquiring Whole Foods In 2017,"Six years ago, Amazon closed its $13.7 billion purchase of Whole Foods Market, by far the biggest acquisition ever for the e-commerce and cloud computing giant.",forbes.com,https://www.forbes.com/sites/sharonedelson/2023/08/04/amazon-revamps-grocery-business-makes-biggest-changes-since-acquiring-whole-foods-in-2017/,https://images.financialmodelingprep.com/news/amazon-revamps-grocery-business-makes-biggest-changes-since-acquiring-20230804.jpg
AMZN,2023-08-03,2023-07-20,2023-08-17,AMZN,,2023-08-04 10:39:35,2023-08-04T10:39:35-04:00,2023-08-04,Amazon Stock Hits 12-Month High On Impressive Sales Boost—Pushing Bezos' Net Worth Up $12 Billion,Amazon founder Jeff Bezos' net worth increased around $200 million per minute in the first hour of trading Friday.,forbes.com,https://www.forbes.com/sites/brianbushard/2023/08/04/amazon-stock-hits-12-month-high-on-impressive-sales-boost-pushing-bezos-net-worth-up-12-billion/,https://images.financialmodelingprep.com/news/amazon-stock-hits-12month-high-on-impressive-sales-boostpushing-20230804.jpg
AMZN,2023-08-03,2023-07-20,2023-08-17,AMZN,,2023-08-04 11:02:00,2023-08-04T11:02:00-04:00,2023-08-04,"Amazon's stock is now a better play than Apple's, according to this analyst","Amazon.com Inc. AMZN, +11.20% and Apple Inc. AAPL, -2.78% each reported earnings Thursday, and those results prompted Rosenblatt Securities analyst Barton Crockett to change his tune on both names. He upgraded Amazon's stock to buy from neutral after earnings, while making the reverse move on shares of Apple.",marketwatch.com,https://www.marketwatch.com/story/amazons-stock-is-now-a-better-play-than-apples-according-to-this-analyst-30572b58,https://images.financialmodelingprep.com/news/amazons-stock-is-now-a-better-play-than-apples-20230804.jpg
AMZN,2023-08-03,2023-07-20,2023-08-17,AMZN,,2023-08-04 11:17:06,2023-08-04T11:17:06-04:00,2023-08-04,5 ETFs to Profit from Amazon's Q2 Earnings Beat,"Amazon (AMZN) reported robust second-quarter results, wherein it beat both earnings and revenue estimates. The e-commerce giant provided an upbeat revenue outlook for the ongoing quarter.",zacks.com,https://www.zacks.com/stock/news/2132727/5-etfs-to-profit-from-amazon-s-q2-earnings-beat,https://images.financialmodelingprep.com/news/5-etfs-to-profit-from-amazons-q2-earnings-beat-20230804.jpg
AMZN,2023-08-03,2023-07-20,2023-08-17,AMZN,,2023-08-04 11:43:29,2023-08-04T11:43:29-04:00,2023-08-04,Why Amazon.com Stock Soared Today,"Amazon easily exceeded both its own guidance and Wall Street's expectations in Q2. Growth was broad-based across North America, International, and AWS.",fool.com,https://www.fool.com/investing/2023/08/04/why-amazoncom-stock-soared-today/,https://images.financialmodelingprep.com/news/why-amazoncom-stock-soared-today-20230804.jpg
AMZN,2023-08-03,2023-07-20,2023-08-17,AMZN,,2023-08-04 12:00:47,2023-08-04T12:00:47-04:00,2023-08-04,"Amazon stock rockets 11%, on pace for best day since November after blowout quarter","Analysts cheered stabilizing AWS growth, improving retail margins, and progress on cutting costs.",cnbc.com,https://www.cnbc.com/2023/08/04/amazon-stock-on-pace-for-best-day-since-november-after-blowout-quarter.html,https://images.financialmodelingprep.com/news/amazon-stock-rockets-11-on-pace-for-best-day-20230804.jpg
AMZN,2023-08-03,2023-07-20,2023-08-17,AMZN,,2023-08-04 12:02:21,2023-08-04T12:02:21-04:00,2023-08-04,"July Jobs Cool to 187K, Unemployment Drops to 3.5%","Year over year, hourly wages remain elevated at +4.4%, 20 basis points (bps) higher than analysts were looking for.",zacks.com,https://www.zacks.com/stock/news/2132744/july-jobs-cool-to-187k-unemployment-drops-to-3-5,https://images.financialmodelingprep.com/news/july-jobs-cool-to-187k-unemployment-drops-to-35-20230804.jpg
AMZN,2023-08-03,2023-07-20,2023-08-17,AMZN,,2023-08-04 12:50:34,2023-08-04T12:50:34-04:00,2023-08-04,"Markets Higher Midday After Upbeat Earnings, July Jobs Report","U.S. equities were higher at midday on Friday, Aug. 4, 2023 on the back of strong earnings reports, while a cooler-than-expected July jobs report raised optimism the Fed could ease back on its campaign of rate hikes to cool inflation.",investopedia.com,https://www.investopedia.com/markets-higher-midday-after-upbeat-earnings-7569874,https://images.financialmodelingprep.com/news/markets-higher-midday-after-upbeat-earnings-july-jobs-report-20230804.jpg
AMZN,2023-08-03,2023-07-20,2023-08-17,AMZN,,2023-08-04 13:04:00,2023-08-04T13:04:00-04:00,2023-08-04,Amazon's Big Quarter Drives Up Cloud Software Stocks,"The tech giant posted 12% growth for Amazon Web Services in the June quarter, surpassing Street expectations.",barrons.com,https://www.barrons.com/articles/amazon-aws-snowflake-cloud-software-stocks-bba6cb1d,https://images.financialmodelingprep.com/news/amazons-big-quarter-drives-up-cloud-software-stocks-20230804.jpg
AMZN,2023-08-03,2023-07-20,2023-08-17,AMZN,,2023-08-04 13:32:11,2023-08-04T13:32:11-04:00,2023-08-04,"Amazon's (AMZN) Q2 Earnings & Sales Beat Estimates, Up Y/Y","Amazon's (AMZN) second-quarter results reflect strength in AWS, Prime, third-party sellers and advertising businesses.",zacks.com,https://www.zacks.com/stock/news/2132862/amazon-s-amzn-q2-earnings-sales-beat-estimates-up-y-y,https://images.financialmodelingprep.com/news/amazons-amzn-q2-earnings-sales-beat-estimates-up-yy-20230804.jpg
AMZN,2023-08-03,2023-07-20,2023-08-17,AMZN,,2023-08-04 13:54:44,2023-08-04T13:54:44-04:00,2023-08-04,Amazon Music teams up with Bandsintown to let fans shop merch from popular artists,"Amazon Music announced a new merch integration with concert discovery platform Bandsintown to allow more than 590,000 artists to promote their merchandise on the Bandsintown website and app. Previously, artists could only link their Shopify store.",techcrunch.com,https://techcrunch.com/2023/08/04/amazon-music-bandsintown-concert-merch/,https://images.financialmodelingprep.com/news/amazon-music-teams-up-with-bandsintown-to-let-fans-20230804.jpeg
AMZN,2023-08-03,2023-07-20,2023-08-17,AMZN,,2023-08-04 14:24:56,2023-08-04T14:24:56-04:00,2023-08-04,"Amazon, Apple, Airbnb, Starbucks, Ferrari and other earnings that moved markets this week",,proactiveinvestors.com,https://www.proactiveinvestors.com/companies/news/1022704?SNAPI,https://images.financialmodelingprep.com/news/amazon-apple-airbnb-starbucks-ferrari-and-other-earnings-that-20230804.jpg
AMZN,2023-08-03,2023-07-20,2023-08-17,AMZN,,2023-08-04 14:56:52,2023-08-04T14:56:52-04:00,2023-08-04,Amazon.com analysts boost target price on 2Q beat and record gross margin,"Wedbush analysts believe Amazon.com, Inc took “its foot off the gas pedal” on some of the spending in order to deliver higher profitability during its second quarter of 2023, calling it a “prudent decision” and a “page out of the Bezos Playbook”.   In a note to clients, they raised their 12-month target price on the stock to $170 per share from $146, while maintaining an ‘Outperform' rating, following the eCommerce giant's better-than-expected 2Q revenue and earnings on record gross margin.",proactiveinvestors.com,https://www.proactiveinvestors.com/companies/news/1022707?SNAPI,https://images.financialmodelingprep.com/news/amazoncom-analysts-boost-target-price-on-2q-beat-and-20230804.jpg
AMZN,2023-08-03,2023-07-20,2023-08-17,AMZN,,2023-08-04 15:09:00,2023-08-04T15:09:00-04:00,2023-08-04,Amazon's stock chart's opening ‘gap' is the biggest in more than 9 months,"The big jump in ecommerce giant Amazon.com Inc.'s stock AMZN, +9.29% Friday in the wake of second-quarter results, suggests investors were the most surprised by Amazon news in more than nine months. The 9.4% upside gap in the stock chart, between Thursday's closing price of $128.91 and Friday's opening price of $141.06, was the biggest gap since the 11.8% downside gap between the Oct. 27, 2022 close ($110.96) and the Oct. 28 open ($97.91) after a disappointing holiday-season sales and profit outlook.",marketwatch.com,https://www.marketwatch.com/story/amazons-stock-charts-opening-gap-is-the-biggest-in-more-than-9-months-a4052b11,https://images.financialmodelingprep.com/news/amazons-stock-charts-opening-gap-is-the-biggest-in-20230804.jpg
AMZN,2023-08-03,2023-07-20,2023-08-17,AMZN,,2023-08-04 15:59:54,2023-08-04T15:59:54-04:00,2023-08-04,Amazon set to launch credit card in Brazil with Bradesco,"Amazon.com will launch a credit card offering in Brazil, in a partnership with Brazilian lender Banco Bradesco SA , the bank's chief executive said on Friday, as the ecommerce giant pushes to expand its fintech offering.",reuters.com,https://www.reuters.com/business/finance/amazon-set-launch-credit-card-brazil-with-bradesco-2023-08-04/,https://images.financialmodelingprep.com/news/amazon-set-to-launch-credit-card-in-brazil-with-20230804.jpg
AMZN,2023-08-03,2023-07-20,2023-08-17,AMZN,,2023-08-04 17:55:35,2023-08-04T17:55:35-04:00,2023-08-04,S&P 500 Gains and Losses Today: Stocks Lose Ground as Hiring Slows,"The S&P 500 fell 0.5% on Friday, Aug. 4, 2023, after the Labor Department's latest jobs report showed the pace of hiring slowed.",investopedia.com,https://www.investopedia.com/s-and-p-500-gains-and-losses-today-stocks-lose-ground-as-hiring-slows-7570040,https://images.financialmodelingprep.com/news/sp-500-gains-and-losses-today-stocks-lose-ground-20230804.png
AMZN,2023-08-03,2023-07-20,2023-08-17,AMZN,,2023-08-04 18:08:00,2023-08-04T18:08:00-04:00,2023-08-04,"The Score: Yellow, Advanced Micro Devices, Amazon and More Stocks That Defined the Week",Here are some of the major companies whose stocks moved on the week's news,wsj.com,https://www.wsj.com/articles/the-score-yellow-advanced-micro-devices-amazon-and-more-stocks-that-defined-the-week-ab3f2b1a,https://images.financialmodelingprep.com/news/the-score-yellow-advanced-micro-devices-amazon-and-more-20230804.jpg
AMZN,2023-08-03,2023-07-20,2023-08-17,AMZN,,2023-08-04 18:56:00,2023-08-04T18:56:00-04:00,2023-08-04,ARM & HAMMER™ Becomes the First Major Laundry Detergent Brand in the Sheets Detergent Category on Amazon in the U.S. and Partners with Victoria Justice on the Innovative Launch,"EWING, N.J.--(BUSINESS WIRE)--ARM & HAMMER™ Introduces Power Sheets Laundry Detergent, a Mess-Free Laundry Innovation with No More Plastic Bottles and Concentrated Cleaning Power.",businesswire.com,https://www.businesswire.com/news/home/20230804517667/en/ARM-HAMMER%E2%84%A2-Becomes-the-First-Major-Laundry-Detergent-Brand-in-the-Sheets-Detergent-Category-on-Amazon-in-the-U.S.-and-Partners-with-Victoria-Justice-on-the-Innovative-Launch/,https://images.financialmodelingprep.com/news/arm-hammer-becomes-the-first-major-laundry-detergent-brand-20230804.jpg
AMZN,2023-08-03,2023-07-20,2023-08-17,AMZN,,2023-08-04 20:05:00,2023-08-04T20:05:00-04:00,2023-08-04,"Thousands overwhelm New York's Union Square for streamer giveaway, tossing chairs and pounding cars","A crowd of thousands that packed Manhattan's Union Square for a popular livestreamer's hyped giveaway got out of hand Friday afternoon, with some clambering on vehicles, hurling chairs and throwing punches, leaving police struggling to rein in the chaos.",marketwatch.com,https://www.marketwatch.com/story/thousands-overwhelm-new-yorks-union-square-for-streamer-giveaway-tossing-chairs-and-pounding-cars-531e2497,https://images.financialmodelingprep.com/news/thousands-overwhelm-new-yorks-union-square-for-streamer-giveaway-20230804.jpg
AMZN,2023-08-03,2023-07-20,2023-08-17,AMZN,,2023-08-05 05:47:00,2023-08-05T05:47:00-04:00,2023-08-05,The Unfortunate Truth About Maxing Out Your 401(k),"The maximum 401(k) contribution allowed is $22,500 ($30,000 if you're 50 or older). IRAs offer more flexibility with investments and withdrawals.",fool.com,https://www.fool.com/retirement/2023/08/05/the-unfortunate-truth-about-maxing-out-your-401k/,https://images.financialmodelingprep.com/news/the-unfortunate-truth-about-maxing-out-your-401k-20230805.jpg
AMZN,2023-08-03,2023-07-20,2023-08-17,AMZN,,2023-08-05 08:00:20,2023-08-05T08:00:20-04:00,2023-08-05,"AI Play Oracle, Amazon Rival Lead 5 Stocks Near Buy Points","AI and cloud play Oracle leads five stocks to watch near buy points, along with Amazon rival MercadoLibre.",investors.com,https://www.investors.com/news/ai-play-oracle-amazon-rival-lead-5-stocks-near-buy-points/,https://images.financialmodelingprep.com/news/ai-play-oracle-amazon-rival-lead-5-stocks-near-20230805.jpg
AMZN,2023-08-03,2023-07-20,2023-08-17,AMZN,,2023-08-05 16:57:13,2023-08-05T16:57:13-04:00,2023-08-05,Environmentalists step up Amazon monitoring as fire season picks up,"Environmentalists warn that the Brazilian Amazon could be in for a bad burning season despite a drop in deforestation this year, as years of accumulated destruction and the arrival of El Nino could turn swathes of the jungle into a tinderbox.",reuters.com,https://www.reuters.com/world/americas/environmentalists-step-up-amazon-monitoring-fire-season-picks-up-2023-08-05/,https://images.financialmodelingprep.com/news/environmentalists-step-up-amazon-monitoring-as-fire-season-picks-20230805.jpg
AMZN,2023-08-03,2023-07-20,2023-08-17,AMZN,,2023-08-05 18:33:35,2023-08-05T18:33:35-04:00,2023-08-05,Is Amazon.com (AMZN) Significantly Undervalued? An In-depth Valuation Analysis,"On August 5, 2023, Amazon.com Inc ( AMZN , Financial) recorded a daily gain of 8.27%, with its Earnings Per Share (EPS) (EPS) standing at $1.27. This article aims to answer a vital question: Is Amazon.com (AMZN) significantly undervalued?",gurufocus.com,https://www.gurufocus.com/news/2058201/is-amazoncom-amzn-significantly-undervalued-an-indepth-valuation-analysis,https://images.financialmodelingprep.com/news/is-amazoncom-amzn-significantly-undervalued-an-indepth-valuation-analysis-20230805.jpg
AMZN,2023-08-03,2023-07-20,2023-08-17,AMZN,,2023-08-06 06:55:00,2023-08-06T06:55:00-04:00,2023-08-06,Is Amazon Stock a Buy Now?,"Amazon's profitability improved substantially. The company is poised to be a leader in AI, particularly in the cloud industry.",fool.com,https://www.fool.com/investing/2023/08/06/is-amazon-stock-a-buy-now/,https://images.financialmodelingprep.com/news/is-amazon-stock-a-buy-now-20230806.jpg
AMZN,2023-08-03,2023-07-20,2023-08-17,AMZN,,2023-08-06 07:40:00,2023-08-06T07:40:00-04:00,2023-08-06,"Up 54% This Year, Is Amazon Stock Still a Buy?","Amazon beat estimates in its second-quarter report, and guidance topped expectations. The macro headwinds that had been slowing its growth seem to be fading.",fool.com,https://www.fool.com/investing/2023/08/06/up-54-this-year-is-amazon-stock-a-buy/,https://images.financialmodelingprep.com/news/up-54-this-year-is-amazon-stock-still-a-20230806.jpg
