ticker,event_date,window_start,window_end,symbol,symbols,publishedDate,publishedDateET,date_et,title,text,site,url,image
AMZN,2023-08-03,2023-07-20,2023-08-17,AMZN,,2023-07-26 08:30:01,2023-07-26T08:30:01-04:00,2023-07-26,"Meta, Microsoft and Amazon team up on maps project to crack Apple-Google duopoly",Overture Maps Foundation is trying to collect enough data so that companies can build maps they own and operate rather than paying Google and Apple.,cnbc.com,https://www.cnbc.com/2023/07/26/meta-microsoft-amazon-join-overture-maps-to-vie-with-apple-google.html,https://images.financialmodelingprep.com/news/meta-microsoft-and-amazon-team-up-on-maps-project-20230726.jpeg
AMZN,2023-08-03,2023-07-20,2023-08-17,AMZN,,2023-07-26 08:43:00,2023-07-26T08:43:00-04:00,2023-07-26,DISH Stock Jumps as Boost Comes to Amazon,"In a press release Wednesday, the company said that Prime members would be able to sign up for its $25 plan ""seamlessly from the comfort of home.""",barrons.com,https://www.barrons.com/articles/dish-network-stock-price-amazon-boost-wirless-999adc0d,https://images.financialmodelingprep.com/news/dish-stock-jumps-as-boost-comes-to-amazon-20230726.jpg
AMZN,2023-08-03,2023-07-20,2023-08-17,AMZN,,2023-07-26 09:45:00,2023-07-26T09:45:00-04:00,2023-07-26,Better Artificial Intelligence Stock: Apple vs. Amazon,Apple and Amazon shares have soared over 45% since Jan. 1. Apple has received a boost after news it's developing a competitor to ChatGPT.,fool.com,https://www.fool.com/investing/2023/07/26/better-artificial-intelligence-stock-apple-vs-amaz/,https://images.financialmodelingprep.com/news/better-artificial-intelligence-stock-apple-vs-amazon-20230726.jpg
AMZN,2023-08-03,2023-07-20,2023-08-17,AMZN,,2023-07-26 09:56:30,2023-07-26T09:56:30-04:00,2023-07-26,Dish Network (DISH) Stock Dips Despite Amazon Partnership,"Dish Network (NASDAQ: DISH ) stock is a hot topic among traders on Wednesday after the company signed a partnership with Amazon (NASDAQ: AMZN ). With this partnership, Dish Network is offering its Boost Infinite service through the e-commerce platform.",investorplace.com,https://investorplace.com/2023/07/dish-network-dish-stock-dips-despite-amazon-partnership/,https://images.financialmodelingprep.com/news/dish-network-dish-stock-dips-despite-amazon-partnership-20230726.jpg
AMZN,2023-08-03,2023-07-20,2023-08-17,AMZN,,2023-07-26 10:19:14,2023-07-26T10:19:14-04:00,2023-07-26,Amazon offers concessions to UK antitrust watchdog as part of probe into its marketplace practices,Amazon on Wednesday offered commitments to the U.K. Competition and Markets Authority to address the British competition watchdog's concerns.,cnbc.com,https://www.cnbc.com/2023/07/26/amazon-offers-concessions-to-uk-cma-as-part-of-marketplace-probe-.html,https://images.financialmodelingprep.com/news/amazon-offers-concessions-to-uk-antitrust-watchdog-as-part-20230726.jpeg
AMZN,2023-08-03,2023-07-20,2023-08-17,AMZN,,2023-07-26 10:56:31,2023-07-26T10:56:31-04:00,2023-07-26,Dish Network's Boost Infinite Begins Selling Wireless Service on Amazon Prime,"Though it isn't clear which wireless network -- Dish's own, AT&T or T-Mobile -- the service will be running on.",cnet.com,https://www.cnet.com/tech/mobile/dish-networks-boost-infinite-begins-selling-wireless-service-on-amazon-prime/,https://images.financialmodelingprep.com/news/dish-networks-boost-infinite-begins-selling-wireless-service-on-20230726.jpg
AMZN,2023-08-03,2023-07-20,2023-08-17,AMZN,,2023-07-26 11:23:00,2023-07-26T11:23:00-04:00,2023-07-26,1 Green Flag and 1 Red Flag for E-Commerce Stocks,"The global supply chain is back in action, waving a green flag for e-commerce retailers. Reduced market demand is a major red flag, with consumers keeping tight control of their household budgets.",fool.com,https://www.fool.com/investing/2023/07/26/1-green-flag-and-1-red-flag-for-e-commerce-stocks/,https://images.financialmodelingprep.com/news/1-green-flag-and-1-red-flag-for-ecommerce-20230726.jpg
AMZN,2023-08-03,2023-07-20,2023-08-17,AMZN,,2023-07-26 11:30:00,2023-07-26T11:30:00-04:00,2023-07-26,Wall Street Lunch: Fed Still Has Lots To Do,Seeking Alpha analysts look down the road for the Fed and markets. The FTC could file a suit to break up Amazon as early as next week.,seekingalpha.com,https://seekingalpha.com/article/4619963-wall-street-lunch-fed-still-has-lots-to-do,https://images.financialmodelingprep.com/news/wall-street-lunch-fed-still-has-lots-to-do-20230726.jpg
AMZN,2023-08-03,2023-07-20,2023-08-17,AMZN,,2023-07-26 11:38:57,2023-07-26T11:38:57-04:00,2023-07-26,DISH Network confirms deal to sell Boost Infinite mobile service plan on Amazon,"Dish Network (NASDAQ:DISH)'s Boost Infinite wireless carrier said it will start selling its Infinite Unlimited wireless postpaid plan on Amazon, with an offer of unlimited mobile services to Prime customers for a fixed price of $25 a month. In a statement, Boost Infinite said it will sell its Infinite Unlimited SIM kit through Amazon's US store, and Prime members will get 20% off the list price of $25, as well as a $25 credit towards their first month of service.",proactiveinvestors.com,https://www.proactiveinvestors.com/companies/news/1021813?SNAPI,https://images.financialmodelingprep.com/news/dish-network-confirms-deal-to-sell-boost-infinite-mobile-20230726.jpg
AMZN,2023-08-03,2023-07-20,2023-08-17,AMZN,,2023-07-26 12:02:14,2023-07-26T12:02:14-04:00,2023-07-26,Amazon will pay 15% less for iRobot as the robot vacuum maker takes on new debt,Amazon will pay roughly 15% less to acquire iRobot after the robot vacuum maker incurred new debt.,techxplore.com,https://techxplore.com/news/2023-07-amazon-pay-irobot-robot-vacuum.html,https://images.financialmodelingprep.com/news/amazon-will-pay-15-less-for-irobot-as-the-20230726.jpg
AMZN,2023-08-03,2023-07-20,2023-08-17,AMZN,,2023-07-26 12:37:04,2023-07-26T12:37:04-04:00,2023-07-26,"It's Official: Amazon Web Services (AWS) Launches HealthScribe, A Generative AI Powered Clinical Documentation Tool",This bold venture marks AWS' investment and interest in transforming healthcare.,forbes.com,https://www.forbes.com/sites/saibala/2023/07/26/its-official-amazon-web-services-aws-launches-healthscribe-a-generative-ai-powered-clinical-documentation-tool/,https://images.financialmodelingprep.com/news/its-official-amazon-web-services-aws-launches-healthscribe-a-generative-20230726.jpg
AMZN,2023-08-03,2023-07-20,2023-08-17,AMZN,,2023-07-26 14:25:02,2023-07-26T14:25:02-04:00,2023-07-26,"AI At The Doctor? Amazon Launches New Service As Google, Microsoft Aim At Merging Healthcare With Artificial Intelligence","Amazon is continuing its expansion into the health space with the launch of a new generative AI tool called HealthScribe, meant to take over some time-consuming administrative tasks of doctor's offices and clinics, the company said.",forbes.com,https://www.forbes.com/sites/maryroeloffs/2023/07/26/ai-at-the-doctor-amazon-launches-new-service-as-google-microsoft-aim-at-merging-healthcare-with-artificial-intelligence/,https://images.financialmodelingprep.com/news/ai-at-the-doctor-amazon-launches-new-service-as-20230726.jpg
AMZN,2023-08-03,2023-07-20,2023-08-17,AMZN,,2023-07-26 15:47:00,2023-07-26T15:47:00-04:00,2023-07-26,Amazon Officially Launches New Robotics Fulfillment Center in Detroit,DETROIT--(BUSINESS WIRE)--Amazon Officially Launches New Robotics Fulfillment Center in Detroit.,businesswire.com,https://www.businesswire.com/news/home/20230726351524/en/Amazon-Officially-Launches-New-Robotics-Fulfillment-Center-in-Detroit/,https://images.financialmodelingprep.com/news/amazon-officially-launches-new-robotics-fulfillment-center-in-detroit-20230726.jpg
AMZN,2023-08-03,2023-07-20,2023-08-17,AMZN,,2023-07-26 16:55:05,2023-07-26T16:55:05-04:00,2023-07-26,"3 ""Hedge Fund Hotels"" Pulling into Support","Institutional quality stocks have several benefits including high-liquidity, low beta, and a long runway. Strategist Andrew Rocco breaks down what investors should look for and pitches 3 ideas.",zacks.com,https://www.zacks.com/commentary/2128189/3-hedge-fund-hotels-pulling-into-support,https://images.financialmodelingprep.com/news/3-hedge-fund-hotels-pulling-into-support-20230726.jpg
AMZN,2023-08-03,2023-07-20,2023-08-17,AMZN,,2023-07-26 19:08:33,2023-07-26T19:08:33-04:00,2023-07-26,Amazon cuts jobs at Fresh grocery stores,Amazon CEO Andy Jassy has pressed pause on some Fresh and Go store expansion as the company revamps its brick-and-mortar grocery strategy.,cnbc.com,https://www.cnbc.com/2023/07/26/amazon-cuts-jobs-at-fresh-grocery-stores.html,https://images.financialmodelingprep.com/news/amazon-cuts-jobs-at-fresh-grocery-stores-20230726.jpeg
AMZN,2023-08-03,2023-07-20,2023-08-17,AMZN,,2023-07-27 02:26:07,2023-07-27T02:26:07-04:00,2023-07-27,"Amazon: Up Substantially This Year, The Rally Isn't Over","Amazon: Up Substantially This Year, The Rally Isn't Over",seekingalpha.com,https://seekingalpha.com/article/4620328-amazon-up-substantially-this-year-the-rally-isnt-over,https://images.financialmodelingprep.com/news/amazon-up-substantially-this-year-the-rally-isnt-over-20230727.jpg
AMZN,2023-08-03,2023-07-20,2023-08-17,AMZN,,2023-07-27 07:40:00,2023-07-27T07:40:00-04:00,2023-07-27,3 Top E-Commerce Stocks to Buy Right Now,"Amazon is the undisputed leader of online shopping, and it should capture a lot of the sector's growth. Etsy runs a capital-light marketplace that allows it to generate a lot of free cash flow.",fool.com,https://www.fool.com/investing/2023/07/27/top-e-commerce-stocks-to-buy-right-now/,https://images.financialmodelingprep.com/news/3-top-ecommerce-stocks-to-buy-right-now-20230727.jpg
AMZN,2023-08-03,2023-07-20,2023-08-17,AMZN,,2023-07-27 08:08:02,2023-07-27T08:08:02-04:00,2023-07-27,Nextech3D.ai experiences surge in demand from Amazon,"Nextech3D.AI (CSE:NTAR, OTCQX:NEXCF) has announced a substantial increase in demand from its largest customer, Amazon, resulting in $2.2 million in additional revenue from new 3D model orders. The surge in demand is attributed to Nextech3D.ai's groundbreaking generative AI technology, which has driven significant productivity enhancements.",proactiveinvestors.com,https://www.proactiveinvestors.com/companies/news/1021879?SNAPI,https://images.financialmodelingprep.com/news/nextech3dai-experiences-surge-in-demand-from-amazon-20230727.jpg
AMZN,2023-08-03,2023-07-20,2023-08-17,AMZN,,2023-07-27 08:44:00,2023-07-27T08:44:00-04:00,2023-07-27,"Meta, Microsoft, and Amazon Team Up to Take Down Apple and Alphabet in a Key Segment. Here's What Investors Should Know.","An organization founded by Meta, Microsoft, and Amazon just released an open map dataset. Google Maps and Apple Maps currently dominate the mobile map market.",fool.com,https://www.fool.com/investing/2023/07/27/meta-microsoft-amazon-team-up-apple-alphabet/,https://images.financialmodelingprep.com/news/meta-microsoft-and-amazon-team-up-to-take-down-20230727.jpg
AMZN,2023-08-03,2023-07-20,2023-08-17,AMZN,,2023-07-27 09:20:00,2023-07-27T09:20:00-04:00,2023-07-27,Amazon Is Getting Into the Wireless Business. Are AT&T and Verizon Doomed?,Amazon is partnering with Dish to offer a $25/month unlimited wireless plan. The offer will be available to Amazon Prime members.,fool.com,https://www.fool.com/investing/2023/07/27/amazon-is-getting-into-the-wireless-business-are-a/,https://images.financialmodelingprep.com/news/amazon-is-getting-into-the-wireless-business-are-att-20230727.jpg
AMZN,2023-08-03,2023-07-20,2023-08-17,AMZN,,2023-07-27 10:00:00,2023-07-27T10:00:00-04:00,2023-07-27,Cell Tower REITs: Toxic Telecom?,"Cell Tower REITs have been the weakest-performing property sector since the start of 2022 - lagging even the battered office sector - amid a telecommunications industry-wide slump inflamed by tight monetary conditions. Cellular carriers have curbed their capital-intensive network expansion plans in recent quarters following a significant wave of investment and tower equipment upgrades from 2019-2022 to deploy nationwide 5G networks. The latest selloff was intensified by an expose alleging that century-old abandoned phone lines owned by AT&T and Verizon are leaching toxic lead into drinking water, potentially requiring costly remediation.",seekingalpha.com,https://seekingalpha.com/article/4620353-cell-tower-reits-toxic-telecom,https://images.financialmodelingprep.com/news/cell-tower-reits-toxic-telecom-20230727.jpg
AMZN,2023-08-03,2023-07-20,2023-08-17,AMZN,,2023-07-27 10:07:00,2023-07-27T10:07:00-04:00,2023-07-27,Better Buy: Amazon vs. Costco,Amazon has tons of opportunity ahead in its various new businesses. Costco's membership metrics tell you more about its business than sales growth.,fool.com,https://www.fool.com/investing/2023/07/27/better-buy-amazon-vs-costco/,https://images.financialmodelingprep.com/news/better-buy-amazon-vs-costco-20230727.jpg
AMZN,2023-08-03,2023-07-20,2023-08-17,AMZN,,2023-07-27 10:41:40,2023-07-27T10:41:40-04:00,2023-07-27,A Look at AI's Magnificent 7,"The introduction of ChatGPT by OpenAI on Nov. 30, 2022 has been compared to seminal events such as the detonation of the first atomic weapon, which ushered in the Atomic Age on July 16, 1945 in New Mexico. Whether artificial intelligence will take us to a Jetsonian utopia or the dystopian future of Mad Max is beyond the scope of this discussion.",gurufocus.com,https://www.gurufocus.com/news/2049793/a-look-at-ais-magnificent-7,https://images.financialmodelingprep.com/news/a-look-at-ais-magnificent-7-20230727.jpg
AMZN,2023-08-03,2023-07-20,2023-08-17,AMZN,,2023-07-27 13:28:45,2023-07-27T13:28:45-04:00,2023-07-27,Tipping Point: Is Amazon's Sizzling Stock Ready to Cool Down?,"Over the past few years, Amazon's (NASDAQ: AMZN ) performance has been a roller-coaster ride. AMZN stock plummeted by 50% from January to December 2022 as market concerns grew about the impact of inflation and potential interest rate hikes by the Federal Reserve.",investorplace.com,https://investorplace.com/2023/07/tipping-point-is-amazons-sizzling-stock-ready-to-cool-down/,https://images.financialmodelingprep.com/news/tipping-point-is-amazons-sizzling-stock-ready-to-cool-20230727.jpg
AMZN,2023-08-03,2023-07-20,2023-08-17,AMZN,,2023-07-27 13:49:45,2023-07-27T13:49:45-04:00,2023-07-27,Are Tech Stocks Getting A Little Too Bubbly Here?,"As we have pointed out several time, the Nasdaq and tech stocks (i.e. Semiconductors) are critically important leaders for the stock market.",seeitmarket.com,https://www.seeitmarket.com/are-tech-stocks-getting-a-little-too-bubbly-here/,https://images.financialmodelingprep.com/news/are-tech-stocks-getting-a-little-too-bubbly-here-20230727.jpg
AMZN,2023-08-03,2023-07-20,2023-08-17,AMZN,,2023-07-27 14:04:56,2023-07-27T14:04:56-04:00,2023-07-27,Here's How Amazon Could Be Broken Up After An FTC Lawsuit,"The FTC is preparing a behemoth lawsuit that seeks to break up the country's 16th largest company, according to multiple reports.",forbes.com,https://www.forbes.com/sites/willskipworth/2023/07/27/heres-how-amazon-could-be-broken-up-after-an-ftc-lawsuit/,https://images.financialmodelingprep.com/news/heres-how-amazon-could-be-broken-up-after-an-20230727.jpg
AMZN,2023-08-03,2023-07-20,2023-08-17,AMZN,,2023-07-27 14:36:15,2023-07-27T14:36:15-04:00,2023-07-27,AMZN Stock: How This Option Trade On Amazon Could Boost Your Wallet By $215,The cash-secured put option strategy has two ways to win. Bringing in income or getting stock at a discount.,investors.com,https://www.investors.com/research/options/amzn-stock-how-this-option-trade-on-amazon-could-boost-your-wallet-by-215-dollars/,https://images.financialmodelingprep.com/news/amzn-stock-how-this-option-trade-on-amazon-could-20230727.jpg
AMZN,2023-08-03,2023-07-20,2023-08-17,AMZN,,2023-07-27 15:28:04,2023-07-27T15:28:04-04:00,2023-07-27,Earnings Season: 3 Upcoming Reports Investors Can't Ignore,"Earnings season can sometimes feel hectic, with a surplus of companies unveiling quarterly results daily. Still, that's just the nature of the period, and seasoned investors have become well used to this chaotic nature.",zacks.com,https://www.zacks.com/commentary/2128985/earnings-season-3-upcoming-reports-investors-can-t-ignore,https://images.financialmodelingprep.com/news/earnings-season-3-upcoming-reports-investors-cant-ignore-20230727.jpg
AMZN,2023-08-03,2023-07-20,2023-08-17,AMZN,,2023-07-28 05:34:00,2023-07-28T05:34:00-04:00,2023-07-28,2 Breakout Growth Stocks You Can Buy and Hold for the Next Decade,Amazon still has a few tricks up its sleeve. Cybersecurity is an intensifying threat that AI-powered CrowdStrike combats daily.,fool.com,https://www.fool.com/investing/2023/07/28/2-breakout-growth-stocks-you-can-buy-and-hold-for/,https://images.financialmodelingprep.com/news/2-breakout-growth-stocks-you-can-buy-and-hold-20230728.jpg
AMZN,2023-08-03,2023-07-20,2023-08-17,AMZN,,2023-07-28 06:30:00,2023-07-28T06:30:00-04:00,2023-07-28,"Got $1,000? 2 Warren Buffett Stocks to Buy Hand Over Fist",Buffett's investment record is incomparable. Apple has the world's most valuable consumer brand and a new device that could be a blockbuster.,fool.com,https://www.fool.com/investing/2023/07/28/got-1000-x-warren-buffet-stocks-to-buy-hand-over-f/,https://images.financialmodelingprep.com/news/got-1000-2-warren-buffett-stocks-to-buy-hand-20230728.jpg
AMZN,2023-08-03,2023-07-20,2023-08-17,AMZN,,2023-07-28 06:30:41,2023-07-28T06:30:41-04:00,2023-07-28,Why Amazon Stock Is Still a Stellar Buy (Even as Prices Go Sky High),"It is too late to buy Amazon (NASDAQ: AMZN ) stock now? Or, should Amazon's current shareholders take profits and run?",investorplace.com,https://investorplace.com/2023/07/amzn-stock-still-a-buy-even-while-its-high/,https://images.financialmodelingprep.com/news/why-amazon-stock-is-still-a-stellar-buy-even-20230728.jpg
AMZN,2023-08-03,2023-07-20,2023-08-17,AMZN,,2023-07-28 06:40:00,2023-07-28T06:40:00-04:00,2023-07-28,Amazon's Boost Infinite Partnership Won't Change a Thing,"Amazon has teamed up with DISH Network subsidiary Boost Infinite to offer Prime members an inexpensive wireless plan. Boost Infinite doesn't use DISH's wireless network exclusively, and DISH's wireless subscriber count has been declining amid sky-high churn.",fool.com,https://www.fool.com/investing/2023/07/28/amazons-boost-infinite-partnership-wont-change-a-t/,https://images.financialmodelingprep.com/news/amazons-boost-infinite-partnership-wont-change-a-thing-20230728.jpeg
AMZN,2023-08-03,2023-07-20,2023-08-17,AMZN,,2023-07-28 07:00:00,2023-07-28T07:00:00-04:00,2023-07-28,2 Stocks That Are Up 53% and 45% This Year and Are Still Worth Buying,Amazon is looking to tap into lucrative long-term opportunities. Netflix is far from having accomplished its goal to replace linear television.,fool.com,https://www.fool.com/investing/2023/07/28/2-stocks-that-are-up-49-and-55-this-year-and-are-s/,https://images.financialmodelingprep.com/news/2-stocks-that-are-up-53-and-45-this-20230728.jpg
AMZN,2023-08-03,2023-07-20,2023-08-17,AMZN,,2023-07-28 07:20:00,2023-07-28T07:20:00-04:00,2023-07-28,"Walmart, Amazon and Apple are becoming a threat to bank-stock investors","If you follow financial services, you're likely aware of Walmart's longstanding ambition to become a bank. The retail giant applied for a license almost two decades ago — only to pull it after the banking industry objected loudly, saying Walmart would have an unfair advantage because of its massive customer base.",marketwatch.com,https://www.marketwatch.com/story/walmart-amazon-and-apple-are-becoming-a-threat-to-bank-stock-investors-506b4e3b,https://images.financialmodelingprep.com/news/walmart-amazon-and-apple-are-becoming-a-threat-to-20230728.jpg
AMZN,2023-08-03,2023-07-20,2023-08-17,AMZN,,2023-07-28 11:31:00,2023-07-28T11:31:00-04:00,2023-07-28,What Amazon's Reduced iRobot Acquisition Price Means for Investors,"Amazon will pay $51.75 per share to acquire iRobot, down from $61 per share at the time of the original merger announcement. The new price largely reflects a new financing facility to pay off debt and fund ongoing operations for iRobot, which has significantly lowered selling and marketing expenses as the deal awaits regulatory approval.",fool.com,https://www.fool.com/investing/2023/07/28/what-amazons-reduced-irobot-acquisition-price-mean/,https://images.financialmodelingprep.com/news/what-amazons-reduced-irobot-acquisition-price-means-for-investors-20230728.jpg
AMZN,2023-08-03,2023-07-20,2023-08-17,AMZN,,2023-07-28 11:47:44,2023-07-28T11:47:44-04:00,2023-07-28,"Shopify Stock Holds Near Highs Amid Expectations For Bullish Quarter; Apple, Amazon Set To Report","Shopify stock headlines a busy week of earnings for top-rated growth stocks, along with tech megacaps Apple and Amazon.com.",investors.com,https://www.investors.com/research/earnings-preview/shopify-stock-holds-near-highs-apple-aapl-amazon-amzn-set-to-report/,https://images.financialmodelingprep.com/news/shopify-stock-holds-near-highs-amid-expectations-for-bullish-20230728.jpg
AMZN,2023-08-03,2023-07-20,2023-08-17,AMZN,,2023-07-28 14:55:51,2023-07-28T14:55:51-04:00,2023-07-28,Why Twilio Stock Got a Boost From Amazon on Friday,Amazon took a notable stake in Twilio. This comes as the pair recently expanded an existing partnership.,fool.com,https://www.fool.com/investing/2023/07/28/why-twilio-stock-got-a-boost-from-amazon-on-friday/,https://images.financialmodelingprep.com/news/why-twilio-stock-got-a-boost-from-amazon-on-20230728.jpg
AMZN,2023-08-03,2023-07-20,2023-08-17,AMZN,,2023-07-28 15:43:51,2023-07-28T15:43:51-04:00,2023-07-28,Amazon Is Betting Big on Twilio (TWLO) Stock,"Twilio (NYSE: TWLO ) stock is on the rise today after Amazon (NASDAQ: AMZN ) disclosed a new stake in the communications and data collection company earlier this week. Indeed, TWLO is up more than 5% heading to market close on new signs of an artificial intelligence (AI) fueled strategic partnership between the two brands.",investorplace.com,https://investorplace.com/2023/07/amazon-is-betting-big-on-twilio-twlo-stock/,https://images.financialmodelingprep.com/news/amazon-is-betting-big-on-twilio-twlo-stock-20230728.jpg
AMZN,2023-08-03,2023-07-20,2023-08-17,AMZN,,2023-07-28 16:24:56,2023-07-28T16:24:56-04:00,2023-07-28,3 E-Commerce Stocks that could be the Next Amazon,"Over the past two decades, Amazon (NASDAQ: AMZN ) has revolutionized consumer shopping in the e-commerce space. Starting as a book retailer, it has morphed into an everything store.",investorplace.com,https://investorplace.com/2023/07/3-e-commerce-stocks-that-could-be-the-next-amazon/,https://images.financialmodelingprep.com/news/3-ecommerce-stocks-that-could-be-the-next-amazon-20230728.jpg
AMZN,2023-08-03,2023-07-20,2023-08-17,AMZN,,2023-07-28 18:25:02,2023-07-28T18:25:02-04:00,2023-07-28,"Stock Market Action Plan: Apple, Amazon And An Upturn In Optimism",The stock market heads into August riding an upturn in optimism. Apple and Amazon headline the coming week's earnings.,investors.com,https://www.investors.com/research/investing-action-plan/stock-market-action-plan-apple-amazon-and-an-upturn-in-optimism/,https://images.financialmodelingprep.com/news/stock-market-action-plan-apple-amazon-and-an-upturn-20230728.jpg
AMZN,2023-08-03,2023-07-20,2023-08-17,AMZN,,2023-07-28 18:30:05,2023-07-28T18:30:05-04:00,2023-07-28,Green Shoots Emerging From the Earnings Landscape,"With a little over half of June-quarter results already out, we can confidently call the overall earnings picture reassuringly stable and resilient.",zacks.com,https://www.zacks.com/commentary/2129678/green-shoots-emerging-from-the-earnings-landscape,https://images.financialmodelingprep.com/news/green-shoots-emerging-from-the-earnings-landscape-20230728.jpg
AMZN,2023-08-03,2023-07-20,2023-08-17,AMZN,,2023-07-29 11:30:00,2023-07-29T11:30:00-04:00,2023-07-29,Are Big Tech Stocks Too Expensive? 2 Of Them Are Still Cheap!,Here is a comparison of the trailing 12-month Price-to-Sales ratios of the S&P 7.,thedogofwallstreet.com,https://thedogofwallstreet.com/tsla/are-big-tech-stocks-too-expensive-2-of-them-are-still-cheap?utm_source=snapi,https://images.financialmodelingprep.com/news/are-big-tech-stocks-too-expensive-2-of-them-20230729.webp
AMZN,2023-08-03,2023-07-20,2023-08-17,AMZN,,2023-07-30 04:49:45,2023-07-30T04:49:45-04:00,2023-07-30,3 companies to watch next week as they report quarterly earnings,"The earnings season is going strong, and the week ahead is full of US corporations reporting their quarterly earnings. Because of their size and importance for the equity market, their earnings may cause major moves in the coming days.",invezz.com,https://invezz.com/news/2023/07/30/3-companies-to-watch-next-week-as-they-report-quarterly-earnings/?utm_source=snapi,https://images.financialmodelingprep.com/news/3-companies-to-watch-next-week-as-they-report-20230730.jpg
AMZN,2023-08-03,2023-07-20,2023-08-17,AMZN,,2023-07-30 05:30:00,2023-07-30T05:30:00-04:00,2023-07-30,2 Monster Stocks You Won't Want to Ignore,"Amazon stock has climbed this year, but it has plenty of room to run considering the company's strength in high-growth markets. Costco's business model makes it a top stock to own in both good and bad economic times.",fool.com,https://www.fool.com/investing/2023/07/30/2-monster-stocks-you-wont-want-to-ignore/,https://images.financialmodelingprep.com/news/2-monster-stocks-you-wont-want-to-ignore-20230730.jpg
