ticker,event_date,window_start,window_end,symbol,symbols,publishedDate,publishedDateET,date_et,title,text,site,url,image
AMZN,2023-08-03,2023-07-20,2023-08-17,AMZN,,2023-07-20 06:25:00,2023-07-20T06:25:00-04:00,2023-07-20,1 Bargain-Basement Warren Buffett Stock to Buy Before Wall Street Comes to Its Senses,"Even in the face of the worst downturn in over a decade, Amazon continued to rack up growth. The company dominates two important industries and is a top contender in several others.",fool.com,https://www.fool.com/investing/2023/07/20/1-bargain-basement-warren-buffett-stock-to-buy-bef/,https://images.financialmodelingprep.com/news/1-bargainbasement-warren-buffett-stock-to-buy-before-wall-20230720.jpg
AMZN,2023-08-03,2023-07-20,2023-08-17,AMZN,,2023-07-20 07:52:12,2023-07-20T07:52:12-04:00,2023-07-20,7 Tech Stocks That Could Form the Next ‘Magnificent Seven',"For those who are unaware, the “Magnificent Seven” stocks are Microsoft (NASDAQ: MSFT ), Apple (NASDAQ: AAPL ), Nvidia (NASDAQ: NVDA ), Tesla (NASDAQ: TSLA ), Alphabet (NASDAQ: GOOG , NASDAQ: GOOGL ), and Amazon (NASDAQ: AMZN ). With the exception of Nvidia, those top tech stocks are largely focused on the cloud (MSFT and AMZN), the internet (GOOG and AMZN), software (MSFT), or hardware (Apple).",investorplace.com,https://investorplace.com/2023/07/7-tech-stocks-that-could-form-the-next-magnificent-seven/,https://images.financialmodelingprep.com/news/7-tech-stocks-that-could-form-the-next-magnificent-20230720.png
AMZN,2023-08-03,2023-07-20,2023-08-17,AMZN,,2023-07-20 08:54:29,2023-07-20T08:54:29-04:00,2023-07-20,Amazon to launch pay-by-palm technology at all Whole Foods stores by year-end,Amazon One lets users enter and pay for items in stores by swiping their hand over a kiosk.,cnbc.com,https://www.cnbc.com/2023/07/20/amazon-to-add-pay-by-palm-tech-to-all-whole-foods-stores-by-year-end.html,https://images.financialmodelingprep.com/news/amazon-to-launch-paybypalm-technology-at-all-whole-foods-20230720.jpg
AMZN,2023-08-03,2023-07-20,2023-08-17,AMZN,,2023-07-20 09:00:00,2023-07-20T09:00:00-04:00,2023-07-20,Amazon Literary Partnership Announces 2023 Grant Recipients,"SEATTLE--(BUSINESS WIRE)--(NASDAQ: AMZN)—Today, Amazon Literary Partnership announced nearly $1 million in grant and sponsorship funding to 93 literary nonprofits across the United States. A longtime champion of the written word, Amazon Literary Partnership's funding includes support for groups that are working to empower diverse, marginalized, and underrepresented voices, helping writers to create, publish, learn, teach, experiment, and thrive in 2023 and beyond. Included in this year's cohort.",businesswire.com,https://www.businesswire.com/news/home/20230720777572/en/Amazon-Literary-Partnership-Announces-2023-Grant-Recipients/,https://images.financialmodelingprep.com/news/amazon-literary-partnership-announces-2023-grant-recipients-20230720.jpg
AMZN,2023-08-03,2023-07-20,2023-08-17,AMZN,,2023-07-20 09:45:00,2023-07-20T09:45:00-04:00,2023-07-20,Where Will Amazon Be in 5 Years?,"Amazon has a huge amount of market share in e-commerce, and its network is unbeatable. AWS also has the most market share in its industry, and it offers incredible AI technology.",fool.com,https://www.fool.com/investing/2023/07/20/where-will-amazon-be-in-5-years/,https://images.financialmodelingprep.com/news/where-will-amazon-be-in-5-years-20230720.jpg
AMZN,2023-08-03,2023-07-20,2023-08-17,AMZN,,2023-07-20 10:11:07,2023-07-20T10:11:07-04:00,2023-07-20,Amazon's palm-scanning payment technology is coming to all 500+ Whole Foods,Amazon's palm-scanning payment technology known as Amazon One is prepared to make a significant expansion across the U.S. The retailer announced this morning the payment tech will come to all 500+ Amazon-owned Whole Foods Market stores nationwide by year-end. The biometric payment system works by having the customer hover their palm above a reader device.,techcrunch.com,https://techcrunch.com/2023/07/20/amazons-palm-scanning-payment-technology-is-coming-to-all-500-whole-foods/,https://images.financialmodelingprep.com/news/amazons-palmscanning-payment-technology-is-coming-to-all-500-20230720.jpeg
AMZN,2023-08-03,2023-07-20,2023-08-17,AMZN,,2023-07-20 12:49:18,2023-07-20T12:49:18-04:00,2023-07-20,7 Fantastic Forever Stocks for Long-Term Lucrative Gains,"Investing is about building a stable long-term portfolio, not just seeking immediate gains. In a mixed economic climate with rising employment figures, savvy investors seek forever stocks.",investorplace.com,https://investorplace.com/2023/07/7-fantastic-forever-stocks-for-long-term-lucrative-gains/,https://images.financialmodelingprep.com/news/7-fantastic-forever-stocks-for-longterm-lucrative-gains-20230720.jpg
AMZN,2023-08-03,2023-07-20,2023-08-17,AMZN,,2023-07-20 13:18:28,2023-07-20T13:18:28-04:00,2023-07-20,Whole Foods Allows Customers To Pay With Palm Scanners—Here's How It Works,"The scanners will identify customers' Amazon memberships and allow them to pay without cash, a card, or a phone.",forbes.com,https://www.forbes.com/sites/brianbushard/2023/07/20/whole-foods-allows-customers-to-pay-with-palm-scanners-heres-how-it-works/,https://images.financialmodelingprep.com/news/whole-foods-allows-customers-to-pay-with-palm-scannersheres-20230720.jpg
AMZN,2023-08-03,2023-07-20,2023-08-17,AMZN,,2023-07-20 13:25:42,2023-07-20T13:25:42-04:00,2023-07-20,Amazon will let you pay with a wave of your hand at all Whole Foods stores,Amazon is bringing its Amazon One palm recognition system to all of its more than 500 Whole Foods stores by the end of the year.,cnn.com,https://www.cnn.com/2023/07/20/business/amazon-one-payment-whole-foods/index.html,https://images.financialmodelingprep.com/news/amazon-will-let-you-pay-with-a-wave-of-20230720.jpg
AMZN,2023-08-03,2023-07-20,2023-08-17,AMZN,,2023-07-20 15:13:00,2023-07-20T15:13:00-04:00,2023-07-20,Who could buy a piece of ESPN? Here are seven candidates,Disney chief executive officer Bob Iger shook up Wall Street Thursday when he told CNBC he's open to finding a strategic partner for ESPN.,marketwatch.com,https://www.marketwatch.com/story/who-could-buy-a-piece-of-espn-here-are-seven-candidates-6cd3e7f0,https://images.financialmodelingprep.com/news/who-could-buy-a-piece-of-espn-here-are-20230720.jpg
AMZN,2023-08-03,2023-07-20,2023-08-17,AMZN,,2023-07-20 15:16:00,2023-07-20T15:16:00-04:00,2023-07-20,Amazon expands pay-by-palm service in US grocery stores,"Customers shopping at Amazon's US-based Whole Foods grocery stores will be able to pay for items by hovering their palm over a scanner, much like shoppers already do with smartphones or credit cards.",techxplore.com,https://techxplore.com/news/2023-07-amazon-pay-by-palm-grocery.html,https://images.financialmodelingprep.com/news/amazon-expands-paybypalm-service-in-us-grocery-stores-20230720.jpg
AMZN,2023-08-03,2023-07-20,2023-08-17,AMZN,,2023-07-20 15:33:00,2023-07-20T15:33:00-04:00,2023-07-20,Amazon bringing pay-by-palm technology to all Whole Foods stores,Forget your credit card and phone? You'll soon still be able to pay at any Whole Foods Market store — as long as you have your palm.,marketwatch.com,https://www.marketwatch.com/story/amazon-bringing-pay-by-palm-technology-to-all-whole-foods-stores-f63a0ee1,https://images.financialmodelingprep.com/news/amazon-bringing-paybypalm-technology-to-all-whole-foods-stores-20230720.jpg
AMZN,2023-08-03,2023-07-20,2023-08-17,AMZN,,2023-07-20 16:01:00,2023-07-20T16:01:00-04:00,2023-07-20,Amazon.com to Webcast Second Quarter 2023 Financial Results Conference Call,"SEATTLE--(BUSINESS WIRE)--Amazon.com, Inc. (NASDAQ: AMZN) announced today that it will hold a conference call to discuss its second quarter 2023 financial results on Thursday, August 3, 2023, at 2:30 p.m. PT/5:30 p.m. ET. The event will be webcast live, and the audio and associated slides will be available for at least three months thereafter at www.amazon.com/ir.",businesswire.com,https://www.businesswire.com/news/home/20230720715329/en/Amazon.com-to-Webcast-Second-Quarter-2023-Financial-Results-Conference-Call/,https://images.financialmodelingprep.com/news/amazoncom-to-webcast-second-quarter-2023-financial-results-conference-20230720.jpg
AMZN,2023-08-03,2023-07-20,2023-08-17,AMZN,,2023-07-20 18:33:39,2023-07-20T18:33:39-04:00,2023-07-20,Amazon's Palm Payment Tech Is Coming to All US Whole Foods Stores,This payment option will be available at all stores by 2024.,cnet.com,https://www.cnet.com/tech/services-and-software/amazons-palm-payment-tech-is-coming-to-all-us-whole-foods/,https://images.financialmodelingprep.com/news/amazons-palm-payment-tech-is-coming-to-all-us-20230720.jpg
AMZN,2023-08-03,2023-07-20,2023-08-17,AMZN,,2023-07-21 06:36:00,2023-07-21T06:36:00-04:00,2023-07-21,"Microsoft, Google, Meta, and Amazon Make AI Safety Pledges to White House",The Biden administration strikes a deal with the biggest U.S. technology companies to manage the risks posed by artificial intelligence.,barrons.com,https://www.barrons.com/articles/microsoft-google-meta-amazon-ai-artificial-intelligence-42e223d0,https://images.financialmodelingprep.com/news/microsoft-google-meta-and-amazon-make-ai-safety-pledges-20230721.jpg
AMZN,2023-08-03,2023-07-20,2023-08-17,AMZN,,2023-07-21 06:50:00,2023-07-21T06:50:00-04:00,2023-07-21,The Smartest Stocks to Buy With $20 Right Now and Hold Forever,This actively managed ETF has an excellent pedigree and is managed by an industry giant. This fintech is up more than 100% this year and has a bright future.,fool.com,https://www.fool.com/investing/2023/07/21/the-smartest-stocks-to-buy-with-20-right-now-and-h/,https://images.financialmodelingprep.com/news/the-smartest-stocks-to-buy-with-20-right-now-20230721.jpg
AMZN,2023-08-03,2023-07-20,2023-08-17,AMZN,,2023-07-21 09:00:00,2023-07-21T09:00:00-04:00,2023-07-21,Better Buy: Costco vs. Amazon Stock,Amazon could see strong sales growth in its services segment. Costco stock will appeal more to investors seeking stable earnings.,fool.com,https://www.fool.com/investing/2023/07/21/better-buy-costco-vs-amazon-stock/,https://images.financialmodelingprep.com/news/better-buy-costco-vs-amazon-stock-20230721.jpg
AMZN,2023-08-03,2023-07-20,2023-08-17,AMZN,,2023-07-21 09:00:01,2023-07-21T09:00:01-04:00,2023-07-21,Amazon to build $120 million facility in Florida to prep Kuiper internet satellites for launch,"Amazon hopes to launch its first two Kuiper prototype satellites ""in the coming months,"" the company said. The new facility would be up and running early 2025.",cnbc.com,https://www.cnbc.com/2023/07/21/amazon-kuiper-to-build-satellite-prep-facility-in-florida.html,https://images.financialmodelingprep.com/news/amazon-to-build-120-million-facility-in-florida-to-20230721.jpg
AMZN,2023-08-03,2023-07-20,2023-08-17,AMZN,,2023-07-21 09:08:24,2023-07-21T09:08:24-04:00,2023-07-21,Amazon builds $120 million satellite processing hub in Florida,"Amazon is building a $120 million processing facility at NASA's Kennedy Space Center in Florida for its thousands of planned Kuiper internet satellites, the company and state officials said Friday.",reuters.com,https://www.reuters.com/science/amazon-builds-120-million-satellite-processing-hub-florida-2023-07-21/,https://images.financialmodelingprep.com/news/amazon-builds-120-million-satellite-processing-hub-in-florida-20230721.jpg
AMZN,2023-08-03,2023-07-20,2023-08-17,AMZN,,2023-07-21 09:52:15,2023-07-21T09:52:15-04:00,2023-07-21,Top tech firms commit to AI safeguards amid fears over pace of change,"Microsoft, Alphabet and OpenAI agree eight measures in effort to encourage responsible practices around fast-moving technology",theguardian.com,https://www.theguardian.com/technology/2023/jul/21/ai-ethics-guidelines-google-meta-amazon,https://images.financialmodelingprep.com/news/top-tech-firms-commit-to-ai-safeguards-amid-fears-20230721.jpg
AMZN,2023-08-03,2023-07-20,2023-08-17,AMZN,,2023-07-21 10:19:53,2023-07-21T10:19:53-04:00,2023-07-21,"ChatGPT owner OpenAI, Microsoft, Meta, Google commit to ensure AI products are safe","Seven leading AI companies – ChatGPT developer OpenAI, Amazon, Anthropic, Alphabet's Google, Inflection, Meta Platforms and Microsoft –have made commitments to the US government to ""manage the risks"" posed by the new technology.  The White House said the commitments will apply immediately and ""underscore three principles that must be fundamental to the future of AI – safety, security, and trust – and mark a critical step toward developing responsible AI"".",proactiveinvestors.co.uk,https://www.proactiveinvestors.co.uk/companies/news/1021377?SNAPI,https://images.financialmodelingprep.com/news/chatgpt-owner-openai-microsoft-meta-google-commit-to-ensure-ai-20230721.jpg
AMZN,2023-08-03,2023-07-20,2023-08-17,AMZN,,2023-07-21 11:49:34,2023-07-21T11:49:34-04:00,2023-07-21,"7 A.I. Companies Will Agree to Safeguards, Biden Administration Says","Amazon, Google and Meta are among the companies that will announce the new commitments on Friday as they race to outdo each other with versions of artificial intelligence.",nytimes.com,https://www.nytimes.com/2023/07/21/us/politics/ai-regulation-biden.html,https://images.financialmodelingprep.com/news/7-ai-companies-will-agree-to-safeguards-biden-administration-20230721.jpg
AMZN,2023-08-03,2023-07-20,2023-08-17,AMZN,,2023-07-21 12:24:58,2023-07-21T12:24:58-04:00,2023-07-21,Amazon is building a $120M facility in Florida for Project Kuiper satellite processing,"Amazon will spend $120 million on a new satellite processing facility at NASA's Kennedy Space Center (KSC), as the company gears up to launch the first batch of Project Kuiper prototype satellites in 2024. Construction is already underway on the new facility, the company said Friday.",techcrunch.com,https://techcrunch.com/2023/07/21/amazon-is-building-a-120m-facility-in-florida-for-project-kuiper-satellite-processing/,https://images.financialmodelingprep.com/news/amazon-is-building-a-120m-facility-in-florida-for-20230721.png
AMZN,2023-08-03,2023-07-20,2023-08-17,AMZN,,2023-07-21 12:56:58,2023-07-21T12:56:58-04:00,2023-07-21,Biden gets tech titans to pledge guardrails on AI risks,"President Joe Biden got US tech giants to pledge guardrails against risks from artificial intelligence, ranging from cyber-attacks to fraud, ahead of a White House summit Friday on how to manage the expanding sector.",techxplore.com,https://techxplore.com/news/2023-07-biden-tech-titans-pledge-guardrails.html,https://images.financialmodelingprep.com/news/biden-gets-tech-titans-to-pledge-guardrails-on-ai-20230721.jpg
AMZN,2023-08-03,2023-07-20,2023-08-17,AMZN,,2023-07-21 12:57:24,2023-07-21T12:57:24-04:00,2023-07-21,Amazon invests $120 million in internet satellite facility,"Amazon said Friday it will invest $120 million to build a satellite construction facility at NASA's Kennedy Space Center, as part of its plans to launch a space internet service to rival SpaceX's Starlink.",techxplore.com,https://techxplore.com/news/2023-07-amazon-invests-million-internet-satellite.html,https://images.financialmodelingprep.com/news/amazon-invests-120-million-in-internet-satellite-facility-20230721.jpg
AMZN,2023-08-03,2023-07-20,2023-08-17,AMZN,,2023-07-21 14:20:00,2023-07-21T14:20:00-04:00,2023-07-21,"AI will require ‘some new laws,' Biden says, even as tech giants agree to safeguards","Realizing the promise of artificial intelligence by managing its risks will require “some new laws, regulations and oversight,” President Joe Biden said Friday, even as several tech companies agreed to new AI safeguards.",marketwatch.com,https://www.marketwatch.com/story/ai-will-require-some-new-laws-biden-says-even-as-tech-giants-agree-to-safeguards-7587f34b,https://images.financialmodelingprep.com/news/ai-will-require-some-new-laws-biden-says-even-20230721.jpg
AMZN,2023-08-03,2023-07-20,2023-08-17,AMZN,,2023-07-21 14:25:49,2023-07-21T14:25:49-04:00,2023-07-21,Amazon to build $120M satellite facility at Florida's Kennedy Space Center,"Amazon's Project Kuiper is building a $120 million satellite processing facility at the Kennedy Space Center in Florida, creating 50 new jobs in the area.",foxbusiness.com,https://www.foxbusiness.com/markets/amazon-build-120-million-satellite-facility-floridas-kennedy-space-center,https://images.financialmodelingprep.com/news/amazon-to-build-120m-satellite-facility-at-floridas-kennedy-20230721.jpg
AMZN,2023-08-03,2023-07-20,2023-08-17,AMZN,,2023-07-21 14:51:00,2023-07-21T14:51:00-04:00,2023-07-21,Amazon Asking Employees to Return to 'Main Hub' Offices,Amazon.com has told staff across the company that they may have to move to locations in bigger cities.,wsj.com,https://www.wsj.com/articles/amazon-asking-employees-to-return-to-main-hubs-3e2dcb89,https://images.financialmodelingprep.com/news/amazon-asking-employees-to-return-to-main-hub-offices-20230721.jpg
AMZN,2023-08-03,2023-07-20,2023-08-17,AMZN,,2023-07-21 15:01:00,2023-07-21T15:01:00-04:00,2023-07-21,Amazon wants employees to return to ‘main hubs': WSJ,"Amazon.com Inc. AMZN has warned employees that they may have to move to the company's main offices in larger cities, The Wall Street Journal reported Friday, citing people familiar with the matter. Amazon managers reportedly are telling employees at smaller offices about the possibility of relocating to “main hubs,” such as the Seattle headquarters and the New York and San Francisco offices, the newspaper said.",marketwatch.com,https://www.marketwatch.com/story/amazon-wants-employees-to-return-to-main-hubs-wsj-ba9d4dac,https://images.financialmodelingprep.com/news/amazon-wants-employees-to-return-to-main-hubs-wsj-20230721.jpg
AMZN,2023-08-03,2023-07-20,2023-08-17,AMZN,,2023-07-21 20:14:34,2023-07-21T20:14:34-04:00,2023-07-21,"Google, Microsoft, Amazon, Meta Pledge to Make AI Safer and More Secure",The tech giants and ChatGPT creator OpenAI are among the companies that met with President Joe Biden and signed the voluntary agreement.,cnet.com,https://www.cnet.com/tech/google-microsoft-amazon-meta-pledge-to-make-ai-safer-and-more-secure/,https://images.financialmodelingprep.com/news/google-microsoft-amazon-meta-pledge-to-make-ai-safer-20230721.jpg
AMZN,2023-08-03,2023-07-20,2023-08-17,AMZN,,2023-07-22 06:15:07,2023-07-22T06:15:07-04:00,2023-07-22,Amazon is asking some corporate workers to relocate as part of its return-to-office policy,"Amazon is asking some corporate workers to relocate to other cities as part of its return-to-office policy, which mandates workers to be in the office three days a week.",techxplore.com,https://techxplore.com/news/2023-07-amazon-corporate-workers-relocate-return-to-office.html,https://images.financialmodelingprep.com/news/amazon-is-asking-some-corporate-workers-to-relocate-as-20230722.jpg
AMZN,2023-08-03,2023-07-20,2023-08-17,AMZN,,2023-07-22 07:30:00,2023-07-22T07:30:00-04:00,2023-07-22,An Amazon Prime Day Chat,Plus a look at how to find a retirement spending style.,fool.com,https://www.fool.com/investing/2023/07/22/an-amazon-prime-day-chat/,https://images.financialmodelingprep.com/news/an-amazon-prime-day-chat-20230722.jpg
AMZN,2023-08-03,2023-07-20,2023-08-17,AMZN,,2023-07-22 08:30:00,2023-07-22T08:30:00-04:00,2023-07-22,3 Low-Risk Ways to Profit From the AI Boom,"Artificial Intelligence has been making headlines lately, with the latest innovations capturing the public imagination. Investors too are captivated, but many are looking for a way to profit without all the risk.",fool.com,https://www.fool.com/investing/2023/07/22/3-low-risk-ways-to-profit-from-the-ai-boom/,https://images.financialmodelingprep.com/news/3-lowrisk-ways-to-profit-from-the-ai-boom-20230722.jpg
AMZN,2023-08-03,2023-07-20,2023-08-17,AMZN,,2023-07-22 08:41:00,2023-07-22T08:41:00-04:00,2023-07-22,"3 Reasons to Buy Amazon Stock, None of Which Are Related to AI",Amazon's retail operations should start getting much more profitable. The cloud computing market still has many years left of growth.,fool.com,https://www.fool.com/investing/2023/07/22/3-non-ai-reasons-to-buy-amazon-stock/,https://images.financialmodelingprep.com/news/3-reasons-to-buy-amazon-stock-none-of-which-20230722.jpg
AMZN,2023-08-03,2023-07-20,2023-08-17,AMZN,,2023-07-22 11:15:19,2023-07-22T11:15:19-04:00,2023-07-22,Amazon: Move or Get Out,Amazon has often been rumored to be tough on its employees. Public revelations of this have embarrassed the house Jeff Bezos built.,247wallst.com,https://247wallst.com/business/2023/07/22/amazon-move-or-get-out/,https://images.financialmodelingprep.com/news/amazon-move-or-get-out-20230722.jpg
AMZN,2023-08-03,2023-07-20,2023-08-17,AMZN,,2023-07-22 13:20:01,2023-07-22T13:20:01-04:00,2023-07-22,"'The only enemy is Amazon': Chris Smalls talks Bezos, unions during WA visit","When Chris Smalls, the president of the first union at an Amazon warehouse in the U.S., visits classrooms, he says the 10-year-old students know who Jeff Bezos is—and often criticize him.",techxplore.com,https://techxplore.com/news/2023-07-enemy-amazon-chris-smalls-bezos.html,https://images.financialmodelingprep.com/news/the-only-enemy-is-amazon-chris-smalls-talks-bezos-20230722.jpg
AMZN,2023-08-03,2023-07-20,2023-08-17,AMZN,,2023-07-23 07:20:00,2023-07-23T07:20:00-04:00,2023-07-23,Could Jumia Technologies Become the Next Amazon?,Jumia was once expected to become the “Amazon of Africa.” It's struggled with slowing growth and widening losses.,fool.com,https://www.fool.com/investing/2023/07/23/could-jumia-technologies-become-the-next-amazon/,https://images.financialmodelingprep.com/news/could-jumia-technologies-become-the-next-amazon-20230723.jpg
AMZN,2023-08-03,2023-07-20,2023-08-17,AMZN,,2023-07-23 08:30:00,2023-07-23T08:30:00-04:00,2023-07-23,3 Cheap Tech Stocks to Buy Right Now,"Amazon has improved its gross margins, but that hasn't affected the bottom line. Match Group has fallen victim to the cyclical advertising market.",fool.com,https://www.fool.com/investing/2023/07/23/3-cheap-tech-stocks-to-buy-right-now/,https://images.financialmodelingprep.com/news/3-cheap-tech-stocks-to-buy-right-now-20230723.jpg
AMZN,2023-08-03,2023-07-20,2023-08-17,AMZN,,2023-07-23 15:30:00,2023-07-23T15:30:00-04:00,2023-07-23,"Avoiding Recession, Cooling Inflation, AI Plays And Financial Earnings With Victor Dergunov","A 25 basis point increase from the Federal Reserve is expected and likely already priced into the market. Inflation has been decreasing, potentially opening the door for a more relaxed monetary stance from the Fed, possibly leading to lower interest rates in 2024.",seekingalpha.com,https://seekingalpha.com/article/4619063-avoiding-recession-cooling-inflation-ai-plays-and-financial-earnings-with-victor-dergunov,https://images.financialmodelingprep.com/news/avoiding-recession-cooling-inflation-ai-plays-and-financial-earnings-20230723.jpg
AMZN,2023-08-03,2023-07-20,2023-08-17,AMZN,,2023-07-24 05:56:29,2023-07-24T05:56:29-04:00,2023-07-24,"3 Value Stocks for Safe, Stable Portfolio Balance","In the dynamic investment landscape, the spotlight often falls on the hottest sectors, attracting a swarm of investors. Yet savvy traders understand the attractiveness of value stocks which offer tremendous upside potential.",investorplace.com,https://investorplace.com/2023/07/3-value-stocks-for-safe-stable-portfolio-balance/,https://images.financialmodelingprep.com/news/3-value-stocks-for-safe-stable-portfolio-balance-20230724.png
AMZN,2023-08-03,2023-07-20,2023-08-17,AMZN,,2023-07-24 06:30:00,2023-07-24T06:30:00-04:00,2023-07-24,"Financial markets are upside down, says Morgan Stanley, and investors can take advantage","The reweighting of the Nasdaq 100 and the expiration of some $2 trillion worth of options is out of the way. Now it's time for an onslaught of earnings, as well as rate decisions from the Fed, European Central Bank and Bank of Japan, before the summer really gets into sleepy territory.",marketwatch.com,https://www.marketwatch.com/story/financial-markets-are-upside-down-says-morgan-stanley-and-investors-can-take-advantage-aa8d6554,https://images.financialmodelingprep.com/news/financial-markets-are-upside-down-says-morgan-stanley-and-20230724.jpg
AMZN,2023-08-03,2023-07-20,2023-08-17,AMZN,,2023-07-24 07:50:26,2023-07-24T07:50:26-04:00,2023-07-24,7 Stocks to Double Your Money in Today's Markets,"The stock market continues to rip higher. And this year, the gains are primarily concentrated in technology stocks, specifically companies that are involved in artificial intelligence.",investorplace.com,https://investorplace.com/2023/07/stocks-to-double-your-money/,https://images.financialmodelingprep.com/news/7-stocks-to-double-your-money-in-todays-markets-20230724.jpg
AMZN,2023-08-03,2023-07-20,2023-08-17,AMZN,,2023-07-24 08:30:00,2023-07-24T08:30:00-04:00,2023-07-24,Amazon's Profligacy Is Destroying Shareholder Value,"In the past, I've focused heavily on Amazon's digital ad business, which now operates at about a $40B/year annualized run rate and just grew 20%+. And while I believe Amazon's ad business has a very long runway for growth still ahead, I've come to believe that AWS is a $1T+ business alone. Despite near term growth headwinds, AWS still has a very long runway for growth ahead, suggesting that it will very likely reaccelerate growth.",seekingalpha.com,https://seekingalpha.com/article/4617774-amazons-profligacy-is-destroying-shareholder-value,https://images.financialmodelingprep.com/news/amazons-profligacy-is-destroying-shareholder-value-20230724.jpg
