ticker,event_date,window_start,window_end,symbol,symbols,publishedDate,publishedDateET,date_et,title,text,site,url,image
JPM,2025-01-15,2025-01-08,2025-01-29,JPM,,2025-01-14 06:00:00,2025-01-14T06:00:00-05:00,2025-01-14,7 Blue Chip Dividend Stocks I Used To Build My First $100K Portfolio,"Building good financial habits and avoiding debt traps is the hardest part of accumulating your first $100K. Invest in companies with growing earnings, consistent dividends, low debt, and an established presence for long-term stability and market resilience. My 7-stock portfolio outperformed the S&P 500, tripling value and dividend income over 10 years with lower volatility.",seekingalpha.com,https://seekingalpha.com/article/4749172-7-blue-chip-dividend-stocks-i-used-to-build-my-first-100k-portfolio,https://images.financialmodelingprep.com/news/7-blue-chip-dividend-stocks-i-used-to-build-20250114.jpg
JPM,2025-01-15,2025-01-08,2025-01-29,JPM,,2025-01-15 20:32:10,2025-01-15T20:32:10-05:00,2025-01-15,Q4 Earnings Season Kicks Off Strong,"We are off to a solid start to the 2024 Q4 earnings season, with the big banks not only coming ahead of estimates but also providing reassuring guidance for the coming quarters.",zacks.com,https://www.zacks.com/commentary/2397842/q4-earnings-season-kicks-off-strong?cid=CS-STOCKNEWSAPI-FT-earnings_outlook-2397842,https://images.financialmodelingprep.com/news/q4-earnings-season-kicks-off-strong-20250115.jpg
JPM,2025-01-15,2025-01-08,2025-01-29,JPM,,2025-01-15 20:32:09,2025-01-15T20:32:09-05:00,2025-01-15,Q4 Earnings Season Kicks Off Strong,"We are off to a solid start to the 2024 Q4 earnings season, with the big banks not only coming ahead of estimates but also providing reassuring guidance for the coming quarters.",zacks.com,https://www.zacks.com/commentary/2397841/q4-earnings-season-kicks-off-strong?cid=CS-STOCKNEWSAPI-FT-earnings_trends-2397841,https://images.financialmodelingprep.com/news/q4-earnings-season-kicks-off-strong-20250115.jpg
JPM,2025-01-15,2025-01-08,2025-01-29,JPM,,2025-01-15 16:44:00,2025-01-15T16:44:00-05:00,2025-01-15,JPMorganChase Declares Preferred Stock Dividends,"NEW YORK--(BUSINESS WIRE)--JPMorgan Chase & Co. (NYSE: JPM) (“JPMorganChase” or the “Firm”) has declared dividends on the outstanding shares of the Firm's Series DD, EE, GG, JJ, KK, LL, MM and NN preferred stock. Information can be found on the Firm's Investor Relations website at https://www.jpmorganchase.com/ir/news. JPMorgan Chase & Co. (NYSE: JPM) is a leading financial services firm based in the United States of America (“U.S.”), with operations worldwide. JPMorganChase had $4.0 tr.",businesswire.com,https://www.businesswire.com/news/home/20250115339612/en/JPMorganChase-Declares-Preferred-Stock-Dividends/,https://images.financialmodelingprep.com/news/jpmorganchase-declares-preferred-stock-dividends-20250115.jpg
JPM,2025-01-15,2025-01-08,2025-01-29,JPM,,2025-01-15 16:42:44,2025-01-15T16:42:44-05:00,2025-01-15,Big US Banks See Profits Surge,"Big US banks had a great quarter. The four giant lenders that reported full-year results Wednesday notched their second-most profitable year ever in 2024, trailing only Joe Biden's first year as president.",youtube.com,https://www.youtube.com/watch?v=WqGlTbq3POs,https://images.financialmodelingprep.com/news/big-us-banks-see-profits-surge-20250115.jpg
JPM,2025-01-15,2025-01-08,2025-01-29,JPM,,2025-01-15 16:01:17,2025-01-15T16:01:17-05:00,2025-01-15,JPMorgan Chase is boosting buybacks even after CEO Jamie Dimon called the stock expensive,JPMorgan Chase executives said the bank would increase share buybacks so that a mounting pile of tens of billions of dollars in excess cash doesn't grow further. The biggest American bank by assets has stockpiled earnings in preparation for the Basel 3 regulatory rules that would've required more capital.,cnbc.com,https://www.cnbc.com/2025/01/15/jpmorgan-chase-boosting-stock-buybacks.html,https://images.financialmodelingprep.com/news/jpmorgan-chase-is-boosting-buybacks-even-after-ceo-jamie-20250115.jpg
JPM,2025-01-15,2025-01-08,2025-01-29,JPM,,2025-01-15 15:45:12,2025-01-15T15:45:12-05:00,2025-01-15,Options Bulls Blast 3 Bank Stocks After Earnings,Earnings season is off to a strong start.,schaeffersresearch.com,https://www.schaeffersresearch.com/content/news/2025/01/15/options-bulls-blast-3-bank-stocks-after-earnings,https://images.financialmodelingprep.com/news/options-bulls-blast-3-bank-stocks-after-earnings-20250115.jpg
JPM,2025-01-15,2025-01-08,2025-01-29,JPM,,2025-01-15 14:19:25,2025-01-15T14:19:25-05:00,2025-01-15,"Earnings show banks moving from 'challenged' to 'better,' says UBS' Erika Najarian","Erika Najarian, research analyst at UBS, joins CNBC's 'The Exchange' to discuss bank earnings, expectations for the industry in the coming months, and more.",youtube.com,https://www.youtube.com/watch?v=sJ7lCDJLmRM,https://images.financialmodelingprep.com/news/earnings-show-banks-moving-from-challenged-to-better-says-20250115.jpg
JPM,2025-01-15,2025-01-08,2025-01-29,JPM,,2025-01-15 12:07:59,2025-01-15T12:07:59-05:00,2025-01-15,JPMorgan Reports Bounce in Credit and Debit Sales on ‘Healthy' Consumer Spending,"J.P. Morgan Chase's fourth-quarter earnings results showed continued momentum in consumer spending, with increased credit and debit card use. Consumers also drew down their deposit account balances.",pymnts.com,https://www.pymnts.com/earnings/2025/jpmorgan-reports-bounce-credit-debit-sales-healthy-consumer-spending/,https://images.financialmodelingprep.com/news/jpmorgan-reports-bounce-in-credit-and-debit-sales-on-20250115.jpg
JPM,2025-01-15,2025-01-08,2025-01-29,JPM,,2025-01-15 12:01:29,2025-01-15T12:01:29-05:00,2025-01-15,CPI Comes in Slightly Warmer Than Expected,CPI Comes in Slightly Warmer Than Expected.,zacks.com,https://www.zacks.com/stock/news/2397586/cpi-comes-in-slightly-warmer-than-expected?cid=CS-STOCKNEWSAPI-FT-economic_highlights-2397586,https://images.financialmodelingprep.com/news/cpi-comes-in-slightly-warmer-than-expected-20250115.jpg
JPM,2025-01-15,2025-01-08,2025-01-29,JPM,,2025-01-15 11:54:26,2025-01-15T11:54:26-05:00,2025-01-15,JPMorgan Chase & Co. (JPM) Q4 2024 Earnings Call Transcript,"JPMorgan Chase & Co. (NYSE:JPM ) Q4 2024 Earnings Conference Call January 15, 2025 8:30 AM ET Company Participants Jeremy Barnum - CFO Jamie Dimon - Chairman and CEO Conference Call Participants John McDonald - Truist Securities Mike Mayo - Wells Fargo Securities Jim Mitchell - Seaport Global Securities Erika Najarian - UBS Matt O'Connor - Deutsche Bank Betsy Graseck - Morgan Stanley Ebrahim Poonawala - Bank of America Merrill Lynch Gerard Cassidy - RBC Capital Markets Operator Good morning, ladies and gentlemen. Welcome to JPMorgan Chase's Fourth Quarter 2024 Earnings Call.",seekingalpha.com,https://seekingalpha.com/article/4749688-jpmorgan-chase-and-co-jpm-q4-2024-earnings-call-transcript,https://images.financialmodelingprep.com/news/jpmorgan-chase-co-jpm-q4-2024-earnings-call-transcript-20250115.jpg
JPM,2025-01-15,2025-01-08,2025-01-29,JPM,,2025-01-15 11:35:55,2025-01-15T11:35:55-05:00,2025-01-15,"Banks are well setup for 2025, says RBC's Gerard Cassidy","Gerard Cassidy, RBC Capital Markets analyst, joins 'Squawk on the Street' to discuss the latest bank earnings results.",youtube.com,https://www.youtube.com/watch?v=3QfbTHLolMM,https://images.financialmodelingprep.com/news/banks-are-well-setup-for-2025-says-rbcs-gerard-20250115.jpg
JPM,2025-01-15,2025-01-08,2025-01-29,JPM,,2025-01-15 11:26:26,2025-01-15T11:26:26-05:00,2025-01-15,"Big banks shine in Q4, but risks loom ahead","Big banks like JP Morgan (JPM), Citigroup (C), Goldman Sachs (GS), and Wells Fargo (WFC) reported strong profits in quarter four, ignited by a rebound in dealmaking and investment banking. Chris Whalen, chairman of Whalen Global Advisors, joins Morning Brief hosts Seana Smith and Brad Smith to analyze these results, highlighting JP Morgan's stability and conservative loan growth.",youtube.com,https://www.youtube.com/watch?v=-CYs4n5jU8Y,https://images.financialmodelingprep.com/news/big-banks-shine-in-q4-but-risks-loom-ahead-20250115.jpg
JPM,2025-01-15,2025-01-08,2025-01-29,JPM,,2025-01-15 11:17:04,2025-01-15T11:17:04-05:00,2025-01-15,JPMorgan Chase & Co. Stock Can Hit $300 This Year,"JPMorgan Chase & Co's NYSE: JPM stock has been rapidly rising and is on track to continue the trend in 2025. The Q4 2024 results were not only strong, but the conditions driving bank results remain in place and are likely to remain so through year's end.",marketbeat.com,https://www.marketbeat.com/originals/jpmorgan-chase-and-co-stock-can-hit-300-this-year/,https://images.financialmodelingprep.com/news/jpmorgan-chase-co-stock-can-hit-300-this-year-20250115.jpg
JPM,2025-01-15,2025-01-08,2025-01-29,JPM,,2025-01-15 11:01:26,2025-01-15T11:01:26-05:00,2025-01-15,"JPM's Q4 Earnings Beat on Solid IB & Trading, NII Down on Lower Rates","A strong rebound in IB business, robust trading performance and a fall in provisions support JPMorgan's Q4 earnings. Relatively lower interest rates hurt NII.",zacks.com,https://www.zacks.com/stock/news/2397482/jpm-s-q4-earnings-beat-on-solid-ib-trading-nii-down-on-lower-rates?cid=CS-STOCKNEWSAPI-FT-analyst_blog|earnings_article-2397482,https://images.financialmodelingprep.com/news/jpms-q4-earnings-beat-on-solid-ib-trading-nii-20250115.jpg
JPM,2025-01-15,2025-01-08,2025-01-29,JPM,,2025-01-15 10:31:26,2025-01-15T10:31:26-05:00,2025-01-15,"Compared to Estimates, JPMorgan Chase & Co. (JPM) Q4 Earnings: A Look at Key Metrics","Although the revenue and EPS for JPMorgan Chase & Co. (JPM) give a sense of how its business performed in the quarter ended December 2024, it might be worth considering how some key metrics compare with Wall Street estimates and the year-ago numbers.",zacks.com,https://www.zacks.com/stock/news/2397397/compared-to-estimates-jpmorgan-chase-co-jpm-q4-earnings-a-look-at-key-metrics?cid=CS-STOCKNEWSAPI-FT-fundamental_analysis|nfm-2397397,https://images.financialmodelingprep.com/news/compared-to-estimates-jpmorgan-chase-co-jpm-q4-earnings-20250115.jpg
JPM,2025-01-15,2025-01-08,2025-01-29,JPM,,2025-01-15 10:15:43,2025-01-15T10:15:43-05:00,2025-01-15,"Big Bank Earnings Beats: JPM, GS, C, WFC, BLK",Earnings season had a strong starts thanks to big banks posting plenty of positive numbers. Alex Coffey turns to a macro perspective of big banks by analyzing the sector.,youtube.com,https://www.youtube.com/watch?v=Ou8FdF3Wp4A,https://images.financialmodelingprep.com/news/big-bank-earnings-beats-jpm-gs-c-wfc-blk-20250115.jpg
JPM,2025-01-15,2025-01-08,2025-01-29,JPM,,2025-01-15 09:38:23,2025-01-15T09:38:23-05:00,2025-01-15,JPMorgan Chase: Q4 EPS Tops Estimates,"Global financial giant JPMorgan Chase (JPM 1.33%) reported fourth quarter and full-year earnings on Wednesday, Jan. 15, that exceeded both top- and bottom-line estimates. Q4 earnings per share (EPS) of $4.81 came in well ahead of the analysts' consensus forecast of $4.09.",fool.com,https://www.fool.com/data-news/2025/01/15/jpmorgan-chase-q4-eps-tops-estimates/,https://images.financialmodelingprep.com/news/jpmorgan-chase-q4-eps-tops-estimates-20250115.jpg
JPM,2025-01-15,2025-01-08,2025-01-29,JPM,,2025-01-15 09:32:29,2025-01-15T09:32:29-05:00,2025-01-15,"Wall Street banks JP Morgan, Goldman Sachs post fat profits amid dealmaking surge, Trump ‘bump'","Interest rate cuts that made it cheaper to borrow money, prompting more mergers and acquisitions in 2024.",nypost.com,https://nypost.com/2025/01/15/business/wall-street-banks-jp-morgan-goldman-sachs-post-fat-profits-amid-dealmaking-surge-trump-bump/,https://images.financialmodelingprep.com/news/wall-street-banks-jp-morgan-goldman-sachs-post-fat-20250115.jpg
JPM,2025-01-15,2025-01-08,2025-01-29,JPM,,2025-01-15 09:08:41,2025-01-15T09:08:41-05:00,2025-01-15,JPMorgan Q4: A Blowout Quarter But Warning On Inflation And Geopolitics,"JPMorgan Chase & Co. delivered a blowout Q4 with a 21% ROTCE, driven by strong FICC trading and a steepening yield curve. The bank's 2025 NII guidance of $94 billion exceeded expectations, reflecting a resilient U.S. economy and loan volume growth. Each division performed exceptionally well, with CIB and AWM showing impressive ROE and net income growth, driven by market gains and fee income.",seekingalpha.com,https://seekingalpha.com/article/4749625-jpmorgan-q4-blowout-quarter-but-warning-on-inflation-and-geopolitics,https://images.financialmodelingprep.com/news/jpmorgan-q4-a-blowout-quarter-but-warning-on-inflation-20250115.jpg
JPM,2025-01-15,2025-01-08,2025-01-29,JPM,,2025-01-15 09:01:13,2025-01-15T09:01:13-05:00,2025-01-15,JPMorgan Chase & Co. (JPM) Tops Q4 Earnings and Revenue Estimates,"JPMorgan Chase & Co. (JPM) came out with quarterly earnings of $4.81 per share, beating the Zacks Consensus Estimate of $4.03 per share. This compares to earnings of $3.97 per share a year ago.",zacks.com,https://www.zacks.com/stock/news/2397077/jpmorgan-chase-co-jpm-tops-q4-earnings-and-revenue-estimates?cid=CS-STOCKNEWSAPI-FT-tale_of_the_tape|yseop_template_4-2397077,https://images.financialmodelingprep.com/news/jpmorgan-chase-co-jpm-tops-q4-earnings-and-revenue-20250115.jpg
JPM,2025-01-15,2025-01-08,2025-01-29,JPM,,2025-01-15 08:23:21,2025-01-15T08:23:21-05:00,2025-01-15,"Live Earnings Analysis: JPMorgan (JPM), Goldman Sachs (GS), Wells Fargo (WFC) and Other Banks Report Fargo","Banks are seeing strong price gains in premarket trading so far, but keep in mind that CPI numbers will release at 8:30 a.m.",247wallst.com,https://247wallst.com/investing/2025/01/15/live-earnings-analysis-jpmorgan-jpm-goldman-sachs-gs-wells-fargo-wfc-and-other-banks-report-fargo-wf/,https://images.financialmodelingprep.com/news/live-earnings-analysis-jpmorgan-jpm-goldman-sachs-gs-wells-20250115.jpg
JPM,2025-01-15,2025-01-08,2025-01-29,JPM,,2025-01-15 08:03:16,2025-01-15T08:03:16-05:00,2025-01-15,Biggar: JPMorgan is still the top of the heap among the big banks,Stephen Biggar of Argus Research discusses what will be the key drivers of Q4 results from the big banks.,youtube.com,https://www.youtube.com/watch?v=fO8fvDcjsRw,https://images.financialmodelingprep.com/news/biggar-jpmorgan-is-still-the-top-of-the-heap-20250115.jpg
JPM,2025-01-15,2025-01-08,2025-01-29,JPM,,2025-01-15 07:52:35,2025-01-15T07:52:35-05:00,2025-01-15,"Dow News: JPMorgan, Wells Fargo Results Boost Futures; CPI to Confirm or Cap Rally?","JPMorgan (JPM) and Wells Fargo (WFC) beat forecasts, boosting Dow futures 200 points. Will CPI data sustain the rally or reverse market gains?",fxempire.com,https://www.fxempire.com/forecasts/article/dow-news-jpmorgan-wells-fargo-results-boost-futures-cpi-to-confirm-or-cap-rally-1490329,https://images.financialmodelingprep.com/news/dow-news-jpmorgan-wells-fargo-results-boost-futures-cpi-20250115.jpg
JPM,2025-01-15,2025-01-08,2025-01-29,JPM,,2025-01-15 07:50:43,2025-01-15T07:50:43-05:00,2025-01-15,JPMorgan Chase's Q4 Results Top Estimates as Investment Banking Fees Surge,JPMorgan Chase (JPM) shares rose in premarket trading Wednesday after the banking giant reported fourth-quarter results that came in above analysts' expectations.,investopedia.com,https://www.investopedia.com/jpmorgan-chase-q4-fy2024-earnings-8773552,https://images.financialmodelingprep.com/news/jpmorgan-chases-q4-results-top-estimates-as-investment-banking-20250115.jpg
JPM,2025-01-15,2025-01-08,2025-01-29,JPM,,2025-01-15 07:34:04,2025-01-15T07:34:04-05:00,2025-01-15,"JPMorgan gets US bank earnings season off to strong start, Dimon calls for 'regulatory balance'","JPMorgan Chase & Co (NYSE:JPM, ETR:CMC) posted earnings that beat Wall Street expectations to kick off bank earnings season in strong style.  The largest US bank by assets reported progress for all its divisions, led by a 49% rise in investment banking fees and record revenues from asset management.",proactiveinvestors.com,https://www.proactiveinvestors.com/companies/news/1064360,https://images.financialmodelingprep.com/news/jpmorgan-gets-us-bank-earnings-season-off-to-strong-20250115.jpg
JPM,2025-01-15,2025-01-08,2025-01-29,JPM,,2025-01-15 07:21:45,2025-01-15T07:21:45-05:00,2025-01-15,JPMorgan Chase tops estimates on better-than-expected fixed income and investment banking results,CNBC's Joe Kernen reports on the company's quarterly earnings results.,youtube.com,https://www.youtube.com/watch?v=bZhSVP7gqic,https://images.financialmodelingprep.com/news/jpmorgan-chase-tops-estimates-on-betterthanexpected-fixed-income-and-20250115.jpg
JPM,2025-01-15,2025-01-08,2025-01-29,JPM,,2025-01-15 07:13:00,2025-01-15T07:13:00-05:00,2025-01-15,JPMorgan Chase's Profit Jumps 50%,Activity on Wall Street helped buoy the bank's fourth-quarter earnings,wsj.com,https://www.wsj.com/articles/jpmorgan-chase-earnings-report-4q-2024-jpm-835747eb,https://images.financialmodelingprep.com/news/jpmorgan-chases-profit-jumps-50-20250115.jpg
JPM,2025-01-15,2025-01-08,2025-01-29,JPM,,2025-01-15 06:53:28,2025-01-15T06:53:28-05:00,2025-01-15,"JPMorgan posts record annual profit as dealmakers, traders ride market rebound",JPMorgan Chase on Wednesday posted record annual profit as its dealmakers and traders reaped a windfall from rebounding markets in the fourth quarter.,reuters.com,https://www.reuters.com/business/finance/jpmorgan-profit-jumps-dealmakers-traders-ride-market-rebound-2025-01-15/,https://images.financialmodelingprep.com/news/jpmorgan-posts-record-annual-profit-as-dealmakers-traders-ride-20250115.jpg
JPM,2025-01-15,2025-01-08,2025-01-29,JPM,,2025-01-15 06:03:41,2025-01-15T06:03:41-05:00,2025-01-15,"US Stocks To Open Higher Ahead Of December Inflation Data: All Eyes On Banking Stocks As JPMorgan, Goldman, Citi, Wells Fargo Report Quarterly Earnings",U.S. stock futures advanced on Wednesday following Tuesday's mixed close. Futures of all four major indices rose in premarket trade.,benzinga.com,https://www.benzinga.com/25/01/42996752/us-stocks-to-open-higher-ahead-of-december-inflation-data-all-eyes-on-baking-earnings-by-jpm-goldman-citi-wells-f,https://images.financialmodelingprep.com/news/us-stocks-to-open-higher-ahead-of-december-inflation-20250115.jpg
JPM,2025-01-15,2025-01-08,2025-01-29,JPM,,2025-01-15 03:00:38,2025-01-15T03:00:38-05:00,2025-01-15,Bond vigilantes will force Trump administration to sit up and take notice: JP Morgan,"As bond investors turn price setters, JP Morgan's James Sullivan expects bond vigilantes to hold significant sway on the incoming US administration's fiscal policy.",youtube.com,https://www.youtube.com/watch?v=eBH2ioAY0wA,https://images.financialmodelingprep.com/news/bond-vigilantes-will-force-trump-administration-to-sit-up-20250115.jpg
JPM,2025-01-15,2025-01-08,2025-01-29,JPM,,2025-01-15 00:01:01,2025-01-15T00:01:01-05:00,2025-01-15,JPMorgan Chase is set to report fourth-quarter earnings – here's what the Street expects,JPMorgan Chase reports fourth-quarter earnings before the bell Wednesday. Analysts surveyed by LSEG expect earnings per share of $4.11 and and revenue of $41.7 billion.,cnbc.com,https://www.cnbc.com/2025/01/15/jpmorgan-chase-jpm-earnings-q4-2024.html,https://images.financialmodelingprep.com/news/jpmorgan-chase-is-set-to-report-fourthquarter-earnings-heres-20250115.jpg
JPM,2025-01-15,2025-01-08,2025-01-29,JPM,,2025-01-16 15:01:20,2025-01-16T15:01:20-05:00,2025-01-16,"Wall Street banks had a great quarter, and the boom times are just starting","American investment banks disclosed a record-smashing quarter, helped by surging trading activity around the U.S. election and a pickup in investment banking deal flow. JPMorgan Chase, Goldman Sachs and Morgan Stanley easily topped estimates for the fourth quarter.",cnbc.com,https://www.cnbc.com/2025/01/16/wall-street-banks-see-deal-activity-picking-up.html,https://images.financialmodelingprep.com/news/wall-street-banks-had-a-great-quarter-and-the-20250116.jpg
JPM,2025-01-15,2025-01-08,2025-01-29,JPM,,2025-01-16 13:23:16,2025-01-16T13:23:16-05:00,2025-01-16,JPMorgan Q4 Earnings: Time To Stop Worrying Over Mr. Dimon's Retirement,"JPMorgan Chase posted strong Q4 results, with EPS up 58% y/y and IB revenues up 46% y/y, beating analyst estimates. Investment Banking is expected to drive growth in 2025, supported by a favorable deal environment and increased market volatility under Trump 2.0. Concerns about Jamie Dimon's departure are premature; the focus should be on JPM's ambitious European expansion with Chase, which shows promising growth potential.",seekingalpha.com,https://seekingalpha.com/article/4749987-jpmorgan-q4-earnings-time-to-stop-worrying-over-mr-dimons-retirement,https://images.financialmodelingprep.com/news/jpmorgan-q4-earnings-time-to-stop-worrying-over-mr-20250116.jpg
JPM,2025-01-15,2025-01-08,2025-01-29,JPM,,2025-01-16 12:06:07,2025-01-16T12:06:07-05:00,2025-01-16,Initial Claims Come in Warmer Than Expected,Initial Claims Come in Warmer Than Expected.,zacks.com,https://www.zacks.com/stock/news/2398392/initial-claims-come-in-warmer-than-expected?cid=CS-STOCKNEWSAPI-FT-economic_highlights-2398392,https://images.financialmodelingprep.com/news/initial-claims-come-in-warmer-than-expected-20250116.jpg
JPM,2025-01-15,2025-01-08,2025-01-29,JPM,,2025-01-17 21:20:51,2025-01-17T21:20:51-05:00,2025-01-17,Bank profit growth is just beginning: CFRA analyst,"The financials sector is showcasing a strong earnings performance this season, as major banks Bank of America (BAC), Morgan Stanley (MS), Citigroup (C), JPMorgan Chase & Co. (JPM), Goldman Sachs (GS), and Wells Fargo (WFC) reported a combined 19% increase in net income for 2024. CFRA Research Director of Global Fundamental Research Ken Leon joins Market Domination to offer his analysis on the banking industry's outlook.",youtube.com,https://www.youtube.com/watch?v=yzQ70xxnjJQ,https://images.financialmodelingprep.com/news/bank-profit-growth-is-just-beginning-cfra-analyst-20250117.jpg
JPM,2025-01-15,2025-01-08,2025-01-29,JPM,,2025-01-17 18:19:31,2025-01-17T18:19:31-05:00,2025-01-17,"JPMorgan: Q4 Earnings, Consolidated Environment For Loan Growth","JPMorgan Chase exceeded Q4 expectations with $1.21 billion higher revenue and GAAP EPS of $4.81, showcasing robust economic performance. The steepening yield curve and higher loan volumes led JPMorgan to provide an optimistic NII guidance of $94 billion for FY 25. Despite a slight overvaluation, JPMorgan remains a ""buy"" due to strong return on tangible common equity and potential regulatory easing.",seekingalpha.com,https://seekingalpha.com/article/4750306-jpmorgan-q4-earnings-consolidated-environment-for-loan-growth,https://images.financialmodelingprep.com/news/jpmorgan-q4-earnings-consolidated-environment-for-loan-growth-20250117.jpg
JPM,2025-01-15,2025-01-08,2025-01-29,JPM,,2025-01-17 13:43:00,2025-01-17T13:43:00-05:00,2025-01-17,"Banks Are Booming, But Keep an Eye on the Consumer",JPMorgan Chase CEO Jamie Dimon warned investors to keep an eye on inflation and the job market. He said stagflation would be a worst-case scenario.,barrons.com,https://www.barrons.com/articles/bank-stocks-jpmorgan-goldman-sachs-b0c45af7,https://images.financialmodelingprep.com/news/banks-are-booming-but-keep-an-eye-on-the-20250117.jpg
JPM,2025-01-15,2025-01-08,2025-01-29,JPM,,2025-01-18 08:00:01,2025-01-18T08:00:01-05:00,2025-01-18,GLP-1s and Brian Thompson's killing loom large at top health-care conference,Thousands of health-care executives descended on JPMorgan's annual health-care conference in San Francisco this week. The conference took place a month after UnitedHealthcare CEO Brian Thompson was fatally shot in New York City.,cnbc.com,https://www.cnbc.com/2025/01/18/glp-1s-brian-thomson-killing-loom-large-at-jpm-health.html,https://images.financialmodelingprep.com/news/glp1s-and-brian-thompsons-killing-loom-large-at-top-20250118.jpg
JPM,2025-01-15,2025-01-08,2025-01-29,JPM,,2025-01-19 21:54:56,2025-01-19T21:54:56-05:00,2025-01-19,Dump The CDs For JPMorgan Chase's 5.7% Yielding Preferred Shares,"JPMorgan Chase's Series DD and GG preferred shares are recommended due to better yields and lower call risk compared to Series EE. The bank's Q4 earnings exceeded expectations, with a stable net interest yield and manageable loan to deposit ratio. Risks include credit card loan performance and call risk for preferred shares, but dividends remain secure.",seekingalpha.com,https://seekingalpha.com/article/4750519-dump-the-cds-for-jpmorgan-chases-5-7-percent-yielding-preferred-shares,https://images.financialmodelingprep.com/news/dump-the-cds-for-jpmorgan-chases-57-yielding-preferred-20250119.jpg
JPM,2025-01-15,2025-01-08,2025-01-29,JPM,,2025-01-19 04:33:00,2025-01-19T04:33:00-05:00,2025-01-19,Could Buying JPMorgan Chase Stock Today Set You Up for Life?,"Few investors would argue that JPMorgan Chase (JPM 1.92%) isn't a solid company. After all, there's a reason it's the U.S.'s biggest bank, boasting nearly $3.6 trillion worth of assets.",fool.com,https://www.fool.com/investing/2025/01/19/could-buying-jpmorgan-chase-stock-today-set-you-up/,https://images.financialmodelingprep.com/news/could-buying-jpmorgan-chase-stock-today-set-you-up-20250119.jpg
JPM,2025-01-15,2025-01-08,2025-01-29,JPM,,2025-01-20 17:15:41,2025-01-20T17:15:41-05:00,2025-01-20,What We Learned From Big Bank Earnings Last Week,The largest U.S. banks posted substantial fourth-quarter revenue and profit gains thanks to a resurgence in Wall Street dealmaking.,investopedia.com,https://www.investopedia.com/what-we-learned-from-big-bank-q4-2024-earnings-8775614,https://images.financialmodelingprep.com/news/what-we-learned-from-big-bank-earnings-last-week-20250120.jpg
