ticker,event_date,window_start,window_end,symbol,symbols,publishedDate,publishedDateET,date_et,title,text,site,url,image
JPM,2025-01-15,2025-01-08,2025-01-29,JPM,,2025-01-08 14:11:47,2025-01-08T14:11:47-05:00,2025-01-08,JPMorgan files two lawsuits against Greece's Viva Wallet as legal saga continues,"Wall Street bank JP Morgan has filed two lawsuits over its investment in fintech Viva Wallet, the latest twist in a legal dispute between the two sides over how to value the Greek business.",reuters.com,https://www.reuters.com/business/finance/jpmorgan-files-two-lawsuits-against-greeces-viva-wallet-legal-saga-continues-2025-01-08/,https://images.financialmodelingprep.com/news/jpmorgan-files-two-lawsuits-against-greeces-viva-wallet-as-20250108.jpg
JPM,2025-01-15,2025-01-08,2025-01-29,JPM,,2025-01-08 11:06:15,2025-01-08T11:06:15-05:00,2025-01-08,JPMorgan Chase & Co. (JPM) Earnings Expected to Grow: What to Know Ahead of Next Week's Release,JPMorgan Chase & Co. (JPM) possesses the right combination of the two key ingredients for a likely earnings beat in its upcoming report. Get prepared with the key expectations.,zacks.com,https://www.zacks.com/stock/news/2393769/jpmorgan-chase-co-jpm-earnings-expected-to-grow-what-to-know-ahead-of-next-week-s-release?cid=CS-STOCKNEWSAPI-FT-tale_of_the_tape|yseop_template_9-2393769,https://images.financialmodelingprep.com/news/jpmorgan-chase-co-jpm-earnings-expected-to-grow-what-20250108.jpg
JPM,2025-01-15,2025-01-08,2025-01-29,JPM,,2025-01-08 10:01:26,2025-01-08T10:01:26-05:00,2025-01-08,JPMorgan Chase & Co. (JPM) is Attracting Investor Attention: Here is What You Should Know,"Zacks.com users have recently been watching JPMorgan Chase & Co. (JPM) quite a bit. Thus, it is worth knowing the facts that could determine the stock's prospects.",zacks.com,https://www.zacks.com/stock/news/2393585/jpmorgan-chase-co-jpm-is-attracting-investor-attention-here-is-what-you-should-know?cid=CS-STOCKNEWSAPI-FT-tale_of_the_tape|most_searched_stocks-2393585,https://images.financialmodelingprep.com/news/jpmorgan-chase-co-jpm-is-attracting-investor-attention-here-20250108.jpg
JPM,2025-01-15,2025-01-08,2025-01-29,JPM,,2025-01-08 09:21:23,2025-01-08T09:21:23-05:00,2025-01-08,JPMorgan Q4 Earnings Preview: Buy Now or Wait for the Results?,"JPM will release Q4 earnings next week. Here, we explore the factors impacting its performance and consider whether the stock merits a place in your portfolio.",zacks.com,https://www.zacks.com/stock/news/2393504/jpmorgan-q4-earnings-preview-buy-now-or-wait-for-the-results?cid=CS-STOCKNEWSAPI-FT-analyst_blog|most_popular_stocks-2393504,https://images.financialmodelingprep.com/news/jpmorgan-q4-earnings-preview-buy-now-or-wait-for-20250108.jpg
JPM,2025-01-15,2025-01-08,2025-01-29,JPM,,2025-01-08 08:00:00,2025-01-08T08:00:00-05:00,2025-01-08,"Nominations Open for the 2025 50 Fastest Growing Women-Owned/Led Companies, presented by The Women Presidents Organization and JPMorgan Chase Commercial Banking","Applications will be accepted now through February 17, 2025 NEW YORK , Jan. 8, 2025 /PRNewswire/ -- The Women Presidents Organization (WPO) and JPMorgan Chase Commercial Banking are seeking nominees for the 50 Fastest Growing Women-Owned/Led Companies™ ranking. First launched in 2007, the annual 50 Fastest list celebrates the size and growth of women-owned or -led companies worldwide, recognizing their contributions to innovation, economic development and job creation across industries.",prnewswire.com,https://www.prnewswire.com/news-releases/nominations-open-for-the-2025-50-fastest-growing-women-ownedled-companies-presented-by-the-women-presidents-organization-and-jpmorgan-chase-commercial-banking-302345038.html,https://images.financialmodelingprep.com/news/nominations-open-for-the-2025-50-fastest-growing-womenownedled-20250108.jpg
JPM,2025-01-15,2025-01-08,2025-01-29,JPM,,2025-01-09 14:00:32,2025-01-09T14:00:32-05:00,2025-01-09,"Chart Master: JPM, C, TSM","Rick Ducat walks through the charts of JPMorgan Chase (JPM), Citigroup (C), and TSMC (TSM) ahead of earnings season next week. He uses technical analysis to look at current and past trends, and where price might move next.",youtube.com,https://www.youtube.com/watch?v=fIiO_6b4ZYI,https://images.financialmodelingprep.com/news/chart-master-jpm-c-tsm-20250109.jpg
JPM,2025-01-15,2025-01-08,2025-01-29,JPM,,2025-01-09 10:57:24,2025-01-09T10:57:24-05:00,2025-01-09,Wall Street banks turn back on net zero group before Trump's return,"Wall Street banks have quit the global industry's net zero target-setting group in droves ahead of president-elect Donald Trump's return to the White House. JPMorgan Chase & Co (NYSE:JPM, ETR:CMC) became the latest to exit the UN-sponsored net zero banking alliance (NZBA) earlier this week.",proactiveinvestors.com,https://www.proactiveinvestors.com/companies/news/1063990,https://images.financialmodelingprep.com/news/wall-street-banks-turn-back-on-net-zero-group-20250109.jpg
JPM,2025-01-15,2025-01-08,2025-01-29,JPM,,2025-01-09 09:00:00,2025-01-09T09:00:00-05:00,2025-01-09,JPMorgan: Good Chance Of Delivering Q4 Earnings Beat Next Week,"JPMorgan Chase is expected to report Q4 earnings with a revenue increase of 7-9% and EPS growth of 33%, despite Q4 being the least profitable quarter of 2024. Growth drivers include higher investment banking and asset management fees, net interest income, and potentially lower credit loss provisions due to a strong job market. The outlook for 2025 is positive, with potential benefits from less regulation under the new president and healthy economic growth in the US.",seekingalpha.com,https://seekingalpha.com/article/4748453-jpmorgan-good-chance-of-delivering-q4-earnings-beat-next-week,https://images.financialmodelingprep.com/news/jpmorgan-good-chance-of-delivering-q4-earnings-beat-next-20250109.jpg
JPM,2025-01-15,2025-01-08,2025-01-29,JPM,,2025-01-09 05:30:33,2025-01-09T05:30:33-05:00,2025-01-09,"JPMorgan Ending Remote Work For 300,000+ Employees: Report",It's JPMorgan's turn. AT&T did it.,forbes.com,https://www.forbes.com/sites/terinaallen/2025/01/09/jpmorgan-ending-remote-work-for-300000-employees-report/,https://images.financialmodelingprep.com/news/jpmorgan-ending-remote-work-for-300000-employees-report-20250109.jpg
JPM,2025-01-15,2025-01-08,2025-01-29,JPM,,2025-01-09 03:26:18,2025-01-09T03:26:18-05:00,2025-01-09,"The Zacks Analyst Blog JPMorgan, Citigroup and Bank of America","JPMorgan, Citigroup and Bank of America are included in this Analyst Blog.",zacks.com,https://www.zacks.com/stock/news/2394096/the-zacks-analyst-blog-jpmorgan-citigroup-and-bank-of-america?cid=CS-STOCKNEWSAPI-FT-press_releases-2394096,https://images.financialmodelingprep.com/news/the-zacks-analyst-blog-jpmorgan-citigroup-and-bank-of-20250109.jpg
JPM,2025-01-15,2025-01-08,2025-01-29,JPM,,2025-01-10 20:31:08,2025-01-10T20:31:08-05:00,2025-01-10,Can Bank Stocks Sustain Recent Momentum?,"JPMorgan JPM shares are down a little over -3% since their late-November highs, marginally better than the Zacks Finance sector but lagging the broader market that is essentially flat over the same period. Since the November elections, however, JPMorgan shares are up close to +2%, while the S&P 500 index is modestly in the negative.",zacks.com,https://www.zacks.com/commentary/2395390/can-bank-stocks-sustain-recent-momentum?cid=CS-STOCKNEWSAPI-FT-earnings_preview-2395390,https://images.financialmodelingprep.com/news/can-bank-stocks-sustain-recent-momentum-20250110.jpg
JPM,2025-01-15,2025-01-08,2025-01-29,JPM,,2025-01-10 16:00:02,2025-01-10T16:00:02-05:00,2025-01-10,The JPMorgan Memo Ends Remote Work And Tells Employees To Return To Office,"In a memo to employees, JPMorgan informs that the company is ending remote work. Reuters reports that it has seen and read the written internal communication and explains that the message in the memo is clear.",forbes.com,https://www.forbes.com/sites/terinaallen/2025/01/10/the-jpmorgan-memo-ends-remote-work-and-tells-employees-to-return-to-office/,https://images.financialmodelingprep.com/news/the-jpmorgan-memo-ends-remote-work-and-tells-employees-20250110.jpg
JPM,2025-01-15,2025-01-08,2025-01-29,JPM,,2025-01-10 13:49:23,2025-01-10T13:49:23-05:00,2025-01-10,JP Morgan Chase requires all workers to return to office five days a week,Executives acknowledge ‘not everyone will agree with this decision' as bank calls time on remote and hybrid working,theguardian.com,https://www.theguardian.com/business/2025/jan/10/jp-morgan-chase-return-to-office,https://images.financialmodelingprep.com/news/jp-morgan-chase-requires-all-workers-to-return-to-20250110.jpg
JPM,2025-01-15,2025-01-08,2025-01-29,JPM,,2025-01-10 11:58:44,2025-01-10T11:58:44-05:00,2025-01-10,JPMorgan orders staff to return to office 5 days a week: ‘Best way to run the company',"More than half of JPMorgan's employees already come into the office full time, according to a memo.",nypost.com,https://nypost.com/2025/01/10/business/jpmorgan-orders-staff-to-return-to-office-5-days-a-week-best-way-to-run-the-company/,https://images.financialmodelingprep.com/news/jpmorgan-orders-staff-to-return-to-office-5-days-20250110.jpg
JPM,2025-01-15,2025-01-08,2025-01-29,JPM,,2025-01-10 10:26:28,2025-01-10T10:26:28-05:00,2025-01-10,Countdown to JPMorgan Chase & Co. (JPM) Q4 Earnings: A Look at Estimates Beyond Revenue and EPS,"Evaluate the expected performance of JPMorgan Chase & Co. (JPM) for the quarter ended December 2024, looking beyond the conventional Wall Street top-and-bottom-line estimates and examining some of its key metrics for better insight.",zacks.com,https://www.zacks.com/stock/news/2395007/countdown-to-jpmorgan-chase-co-jpm-q4-earnings-a-look-at-estimates-beyond-revenue-and-eps?cid=CS-STOCKNEWSAPI-FT-fundamental_analysis|nfm_preview-2395007,https://images.financialmodelingprep.com/news/countdown-to-jpmorgan-chase-co-jpm-q4-earnings-a-20250110.jpg
JPM,2025-01-15,2025-01-08,2025-01-29,JPM,,2025-01-10 10:10:46,2025-01-10T10:10:46-05:00,2025-01-10,"JPMorgan asks staff to return to office five days a week in March, memo shows","Wall Street giant JPMorgan Chase asked its employees who are on hybrid work schedules to return to the office five days a week starting in March, according to an internal memo seen by Reuters on Friday.",reuters.com,https://www.reuters.com/business/finance/jpmorgan-asks-staff-return-office-five-days-week-march-memo-shows-2025-01-10/,https://images.financialmodelingprep.com/news/jpmorgan-asks-staff-to-return-to-office-five-days-20250110.jpg
JPM,2025-01-15,2025-01-08,2025-01-29,JPM,,2025-01-12 15:42:38,2025-01-12T15:42:38-05:00,2025-01-12,JPMorgan's Jamie Dimon ‘likely' to become chairman once he quits as CEO,"Speaking to CBS, Dimon he was “likely” to stay on as chairman even after he quits the top job he has held since 2006.",nypost.com,https://nypost.com/2025/01/12/business/jpmorgans-jamie-dimon-likely-to-become-chairman-once-he-quits-as-ceo/,https://images.financialmodelingprep.com/news/jpmorgans-jamie-dimon-likely-to-become-chairman-once-he-20250112.jpg
JPM,2025-01-15,2025-01-08,2025-01-29,JPM,,2025-01-12 06:01:15,2025-01-12T06:01:15-05:00,2025-01-12,What To Expect in the Markets This Week,"This week, investors can look forward to earnings from several big banks, with JPMorgan Chase (JPM), Goldman Sachs (GS), Bank of America (BAC), Wells Fargo (WFC), and more set to report. Results from large firms in the tech and health care sectors, including Taiwan Semiconductor Manufacturing Company (TSM) and UnitedHealth Group (UNH), could also attract investor attention.",investopedia.com,https://www.investopedia.com/what-to-expect-in-the-markets-this-week-8771925,https://images.financialmodelingprep.com/news/what-to-expect-in-the-markets-this-week-20250112.jpg
JPM,2025-01-15,2025-01-08,2025-01-29,JPM,,2025-01-13 23:00:00,2025-01-13T23:00:00-05:00,2025-01-13,Jamie Dimon Wants to Take JPMorgan Chase to Germany and Beyond,"America's biggest bank plans to launch a digital retail lender in Germany, Europe's biggest economy but one with a notoriously unprofitable banking sector.",wsj.com,https://www.wsj.com/articles/jpmorgan-chase-germany-consumer-banking-expansion-9a4c76aa,https://images.financialmodelingprep.com/news/jamie-dimon-wants-to-take-jpmorgan-chase-to-germany-20250113.jpg
JPM,2025-01-15,2025-01-08,2025-01-29,JPM,,2025-01-13 14:22:10,2025-01-13T14:22:10-05:00,2025-01-13,"BridgeBio, ARS Pharma, Harmony Bio Shine At JPM. But SpringWorks, Beam Take Their Lumps.","Biotech stocks put up a split showing at JPM, where names like BridgeBio, ARS and Harmony stood out with strong preliminary reports. The post BridgeBio, ARS Pharma, Harmony Bio Shine At JPM.",investors.com,https://www.investors.com/news/technology/biotech-stocks-jpmorgan-healthcare-conference/,https://images.financialmodelingprep.com/news/bridgebio-ars-pharma-harmony-bio-shine-at-jpm-but-20250113.jpg
JPM,2025-01-15,2025-01-08,2025-01-29,JPM,,2025-01-13 14:10:50,2025-01-13T14:10:50-05:00,2025-01-13,"JPMorgan Stock Today: Bull Put Spread Trade Could Deliver 14.9% Return, But Watch Earnings","A trader selling this spread would receive $65 in option premium and would have a maximum risk of $435. The post JPMorgan Stock Today: Bull Put Spread Trade Could Deliver 14.9% Return, But Watch Earnings appeared first on Investor's Business Daily.",investors.com,https://www.investors.com/research/options/jpmorgan-stock-today-bull-put-spread-trade-14-9-return-earnings/,https://images.financialmodelingprep.com/news/jpmorgan-stock-today-bull-put-spread-trade-could-deliver-20250113.jpg
JPM,2025-01-15,2025-01-08,2025-01-29,JPM,,2025-01-13 13:58:30,2025-01-13T13:58:30-05:00,2025-01-13,JPM to Offer Payment Terminals With Biometric Authentication,J.P. Morgan Payments has unveiled two new proprietary payment terminals that integrate in-store biometric authentication with payment capabilities. The terminals — a payment tablet called J.P.,pymnts.com,https://www.pymnts.com/news/biometrics/2025/jpm-to-offer-payment-terminals-with-biometric-authentication/,https://images.financialmodelingprep.com/news/jpm-to-offer-payment-terminals-with-biometric-authentication-20250113.jpg
JPM,2025-01-15,2025-01-08,2025-01-29,JPM,,2025-01-13 13:52:17,2025-01-13T13:52:17-05:00,2025-01-13,"Bank earnings coming up: Citi, JPMorgan, Goldman, BofA","Big Banks are ready to kick off earnings season. Citi (C), JPMorgan Chase (JPM), Goldman Sachs (GS), and Wells Fargo (WFC) report on Wednesday, while Bank of America (BAC) and Morgan Stanley (MS) release results on Thursday.",youtube.com,https://www.youtube.com/watch?v=EhUX6FyN4Ws,https://images.financialmodelingprep.com/news/bank-earnings-coming-up-citi-jpmorgan-goldman-bofa-20250113.jpg
JPM,2025-01-15,2025-01-08,2025-01-29,JPM,,2025-01-13 12:05:54,2025-01-13T12:05:54-05:00,2025-01-13,"KBW CEO: Banking industry is 'turning a corner' on a lot of fronts, here's why","Tom Michaud, KBW CEO, joins 'Squawk on the Street' to discuss what to expect from the spate of bank earnings coming up.",youtube.com,https://www.youtube.com/watch?v=i9W0KyZOn_k,https://images.financialmodelingprep.com/news/kbw-ceo-banking-industry-is-turning-a-corner-on-20250113.jpg
JPM,2025-01-15,2025-01-08,2025-01-29,JPM,,2025-01-13 12:01:24,2025-01-13T12:01:24-05:00,2025-01-13,What Analysts Think of JPMorgan Chase Stock Ahead of Earnings,"JPMorgan Chase (JPM) is scheduled to report earnings before the opening bell Wednesday, kicking off a stretch of earnings reports as America's largest financial institutions wrap up their 2024s.",investopedia.com,https://www.investopedia.com/what-analysts-think-of-jpmorgan-chase-stock-ahead-of-earnings-8771652,https://images.financialmodelingprep.com/news/what-analysts-think-of-jpmorgan-chase-stock-ahead-of-20250113.jpg
JPM,2025-01-15,2025-01-08,2025-01-29,JPM,,2025-01-13 11:33:51,2025-01-13T11:33:51-05:00,2025-01-13,JPMorgan providing forbearance to mortgage customers hit by Los Angeles wildfires,"JPMorgan Chase's home lending unit is providing disaster forbearance to mortgage customers affected by the Los Angeles wildfires, the bank said on Monday.",reuters.com,https://www.reuters.com/world/us/jpmorgan-providing-forbearance-mortgage-customers-hit-by-los-angeles-wildfires-2025-01-13/,https://images.financialmodelingprep.com/news/jpmorgan-providing-forbearance-to-mortgage-customers-hit-by-los-20250113.jpg
JPM,2025-01-15,2025-01-08,2025-01-29,JPM,,2025-01-13 10:40:20,2025-01-13T10:40:20-05:00,2025-01-13,Earnings Growth & Price Strength Make JPMorgan Chase & Co. (JPM) a Stock to Watch,"Wondering how to pick strong, market-beating stocks for your investment portfolio? Look no further than the Zacks Focus List.",zacks.com,https://www.zacks.com/stock/news/2395798/earnings-growth-price-strength-make-jpmorgan-chase-co-jpm-a-stock-to-watch?cid=CS-STOCKNEWSAPI-FT-tale_of_the_tape|zacks_education_focus_list-2395798,https://images.financialmodelingprep.com/news/earnings-growth-price-strength-make-jpmorgan-chase-co-jpm-20250113.jpg
JPM,2025-01-15,2025-01-08,2025-01-29,JPM,,2025-01-13 09:35:54,2025-01-13T09:35:54-05:00,2025-01-13,JPMorgan Chase disables internal comments after employees rip return-to-office policy,"JPMorgan Chase management disabled comments on an internal webpage where the policy was announced, according to the Wall Street Journal.",nypost.com,https://nypost.com/2025/01/13/business/jpmorgan-chase-disables-internal-comments-after-criticism-of-return-to-office/,https://images.financialmodelingprep.com/news/jpmorgan-chase-disables-internal-comments-after-employees-rip-returntooffice-20250113.jpg
JPM,2025-01-15,2025-01-08,2025-01-29,JPM,,2025-01-13 08:41:13,2025-01-13T08:41:13-05:00,2025-01-13,America's 6 Biggest Banks to Report $31 Billion in Profits,"America's biggest banks apparently have Donald Trump to thank for a successful quarter. Banking giants are set to report $31 billion in profits for the last three months of last year, fueled by a surge in trading and dealmaking following the U.S. presidential election, the Financial Times (FT) reported Monday (Jan. 13).",pymnts.com,https://www.pymnts.com/news/banking/2025/americas-6-biggest-banks-to-report-31-billion-in-profits/,https://images.financialmodelingprep.com/news/americas-6-biggest-banks-to-report-31-billion-in-20250113.jpg
JPM,2025-01-15,2025-01-08,2025-01-29,JPM,,2025-01-14 18:21:08,2025-01-14T18:21:08-05:00,2025-01-14,Investors Await Clouds Parting; CPI Ahead of Wednesday's Bell,Consumer Price data joins Big Banks reporting Q4 results ahead of Hump Day market activity.,zacks.com,https://www.zacks.com/stock/news/2396856/investors-await-clouds-parting-cpi-ahead-of-wednesday-s-bell?cid=CS-STOCKNEWSAPI-FT-ahead_of_wall_street-2396856,https://images.financialmodelingprep.com/news/investors-await-clouds-parting-cpi-ahead-of-wednesdays-bell-20250114.jpg
JPM,2025-01-15,2025-01-08,2025-01-29,JPM,,2025-01-14 17:35:21,2025-01-14T17:35:21-05:00,2025-01-14,Why JPMorgan CEO Jamie Dimon may not be going anywhere,"JPMorgan (JPM) has announced new leadership changes as president and chief operating officer (COO) Daniel Pinto plans to step down at the end of 2025. Co-CEO of the commercial and investment bank Jennifer Piepszak will assume the COO role effective immediately, while current co-head of global banking Doug Petno will succeed Piepszak.",youtube.com,https://www.youtube.com/watch?v=qsgD-iK8kEY,https://images.financialmodelingprep.com/news/why-jpmorgan-ceo-jamie-dimon-may-not-be-going-20250114.jpg
JPM,2025-01-15,2025-01-08,2025-01-29,JPM,,2025-01-14 17:20:52,2025-01-14T17:20:52-05:00,2025-01-14,JPMorgan Executive Changes Raise New Questions About Who Could Succeed Jamie Dimon,JPMorgan Chase (JPM) announced a flurry of executive role changes Tuesday that raised new questions about who could succeed CEO Jamie Dimon in the bank's top job.,investopedia.com,https://www.investopedia.com/jpmorgan-executive-changes-raise-new-questions-about-who-could-succeed-jamie-dimon-8774345,https://images.financialmodelingprep.com/news/jpmorgan-executive-changes-raise-new-questions-about-who-could-20250114.jpg
JPM,2025-01-15,2025-01-08,2025-01-29,JPM,,2025-01-14 15:03:04,2025-01-14T15:03:04-05:00,2025-01-14,JPMorgan Promotes Investment Banking Head Jennifer Piepszak to COO,"J.P. Morgan Chase President and Chief Operating Officer Daniel Pinto is retiring and will be replaced by Jennifer Piepszak, co-CEO of commercial and investment banking. Pinto, who has served the banking giant for 40 years, will relinquish his role June 30 and then retire next year, according to a Tuesday (Jan. 14) press release.",pymnts.com,https://www.pymnts.com/personnel/2025/jpmorgan-promotes-investment-banking-head-jennifer-piepszak-chief-operating-officer/,https://images.financialmodelingprep.com/news/jpmorgan-promotes-investment-banking-head-jennifer-piepszak-to-coo-20250114.jpg
JPM,2025-01-15,2025-01-08,2025-01-29,JPM,,2025-01-14 13:00:43,2025-01-14T13:00:43-05:00,2025-01-14,"Goldman Sachs, JPMorgan Lead Slew Of Bank Earnings. These Stocks Are Basing.","Big banks kick off Q4 results with Goldman Sachs, JPMorgan Chase, Wells Fargo, BlackRock reporting. Some names are basing.",investors.com,https://www.investors.com/news/goldman-sachs-jpmorgan-wells-fargo-blackrock-earnings-q4-2024-gs-jpm-wfc-blk-c-schw/,https://images.financialmodelingprep.com/news/goldman-sachs-jpmorgan-lead-slew-of-bank-earnings-these-20250114.jpg
JPM,2025-01-15,2025-01-08,2025-01-29,JPM,,2025-01-14 11:58:13,2025-01-14T11:58:13-05:00,2025-01-14,Jamie Dimon's top deputy to retire next year as race to lead biggest US bank heats up,"Succession planning is in focus across Wall Street, with JPMorgan at the center as Dimon approaches two decades in the top job.",nypost.com,https://nypost.com/2025/01/14/business/jamie-dimons-top-deputy-to-retire-next-year-while-potential-successor-exits-ceo-race/,https://images.financialmodelingprep.com/news/jamie-dimons-top-deputy-to-retire-next-year-as-20250114.jpg
JPM,2025-01-15,2025-01-08,2025-01-29,JPM,,2025-01-14 10:53:24,2025-01-14T10:53:24-05:00,2025-01-14,JPM COO Announces Retirement & Outlook for Earnings,"JPMorgan Chase (JPM) COO, Daniel Pinto, announced he will step down from his long-term position by the end of 2026. Jennifer Piepszak will take charge as COO once Pinto exits.",youtube.com,https://www.youtube.com/watch?v=mt-XPuwtJgs,https://images.financialmodelingprep.com/news/jpm-coo-announces-retirement-outlook-for-earnings-20250114.jpg
JPM,2025-01-15,2025-01-08,2025-01-29,JPM,,2025-01-14 10:30:43,2025-01-14T10:30:43-05:00,2025-01-14,Wall Street Bulls Look Optimistic About JPMorgan Chase & Co. (JPM): Should You Buy?,"The recommendations of Wall Street analysts are often relied on by investors when deciding whether to buy, sell, or hold a stock. Media reports about these brokerage-firm-employed (or sell-side) analysts changing their ratings often affect a stock's price.",zacks.com,https://www.zacks.com/stock/news/2396558/wall-street-bulls-look-optimistic-about-jpmorgan-chase-co-jpm-should-you-buy?cid=CS-STOCKNEWSAPI-FT-fundamental_analysis|average_broker_rating-2396558,https://images.financialmodelingprep.com/news/wall-street-bulls-look-optimistic-about-jpmorgan-chase-co-20250114.jpg
JPM,2025-01-15,2025-01-08,2025-01-29,JPM,,2025-01-14 10:22:06,2025-01-14T10:22:06-05:00,2025-01-14,"JPMorgan Names a New COO, and She Doesn't Want CEO Job","Some moves atop JPMorgan. Jenn Piepszak has been named the new chief operating officer, but she does not want to succeed Jamie Dimon as CEO.",youtube.com,https://www.youtube.com/watch?v=pK-ItgNi32E,https://images.financialmodelingprep.com/news/jpmorgan-names-a-new-coo-and-she-doesnt-want-20250114.jpg
JPM,2025-01-15,2025-01-08,2025-01-29,JPM,,2025-01-14 09:59:00,2025-01-14T09:59:00-05:00,2025-01-14,JPMorgan's Jennifer Piepszak moving up to COO role but doesn't want Jamie Dimon's job,"JPMorgan Chase & Co. on Tuesday named Jennifer Piepszak its new chief operating officer, but the company's four major department heads remain more likely successors to Chief Executive Jamie Dimon to head up the largest U.S. bank.",marketwatch.com,https://www.marketwatch.com/story/jpmorgans-jennifer-piepszak-moving-up-to-coo-role-but-doesnt-want-jamie-dimons-job-d35cfc31,https://images.financialmodelingprep.com/news/jpmorgans-jennifer-piepszak-moving-up-to-coo-role-but-20250114.jpg
JPM,2025-01-15,2025-01-08,2025-01-29,JPM,,2025-01-14 09:30:07,2025-01-14T09:30:07-05:00,2025-01-14,Big Bank earnings on deck: Here's what to expect,"Jason Goldberg, Barclays senior equity analyst, joins 'Squawk Box' to preview Q4 earnings seasons from big banks, state of the banking industry, and more.",youtube.com,https://www.youtube.com/watch?v=7iwqIbCKBPo,https://images.financialmodelingprep.com/news/big-bank-earnings-on-deck-heres-what-to-expect-20250114.jpg
JPM,2025-01-15,2025-01-08,2025-01-29,JPM,,2025-01-14 08:59:56,2025-01-14T08:59:56-05:00,2025-01-14,"JPMorgan Chase exec Daniel Pinto, longtime No. 2 to Jamie Dimon, will step down in June",Pinto has worked at JPMorgan and a predecessor firm for more than four decades.,cnbc.com,https://www.cnbc.com/2025/01/14/jpmorgan-chase-coo-daniel-pinto-stepping-down-in-june.html,https://images.financialmodelingprep.com/news/jpmorgan-chase-exec-daniel-pinto-longtime-no-2-to-20250114.jpg
JPM,2025-01-15,2025-01-08,2025-01-29,JPM,,2025-01-14 06:51:01,2025-01-14T06:51:01-05:00,2025-01-14,JPMorgan Eyes Commercial Banking Expansion in Germany,"America's largest bank reportedly wants to grow its presence in Europe's largest economy. J.P. Morgan Chase CEO Jamie Dimon is plotting a major expansion that involves developing a digitally-centered consumer bank outside the U.S., the Wall Street Journal (WSJ) reported Tuesday (Jan. 14).",pymnts.com,https://www.pymnts.com/news/banking/2025/jpmorgan-eyes-commercial-banking-expansion-in-germany/,https://images.financialmodelingprep.com/news/jpmorgan-eyes-commercial-banking-expansion-in-germany-20250114.jpg
