ticker,event_date,window_start,window_end,symbol,symbols,publishedDate,publishedDateET,date_et,title,text,site,url,image
JPM,2025-01-15,2025-01-08,2025-01-29,JPM,,2025-01-20 11:27:07,2025-01-20T11:27:07-05:00,2025-01-20,Play the “Trump Bump” With These 3 Stocks,"Inauguration Day is now upon us, and with a new administration taking hold, investors are placing their bets on where they see the overall market (and specific stocks and sectors) headed over the next four years.",247wallst.com,https://247wallst.com/investing/2025/01/20/play-the-trump-bump-with-these-3-stocks/,https://images.financialmodelingprep.com/news/play-the-trump-bump-with-these-3-stocks-20250120.jpg
JPM,2025-01-15,2025-01-08,2025-01-29,JPM,,2025-01-20 04:00:13,2025-01-20T04:00:13-05:00,2025-01-20,Bank Stocks Surge on Earnings and Lead CE 100 Up 2.9%,"Earnings season is officially here, led, as ever, by big banks – and this time around, a 9% surge in the “Bank” pillar pulled the CE 100 Index 2.9% higher in a strong weekly showing.",pymnts.com,https://www.pymnts.com/connectedeconomy/2025/bank-stocks-surge-on-earnings-and-lead-ce-100-up-2-9/,https://images.financialmodelingprep.com/news/bank-stocks-surge-on-earnings-and-lead-ce-100-20250120.jpg
JPM,2025-01-15,2025-01-08,2025-01-29,JPM,,2025-01-21 13:00:36,2025-01-21T13:00:36-05:00,2025-01-21,What Makes JPMorgan Chase & Co. (JPM) a Strong Momentum Stock: Buy Now?,Does JPMorgan Chase & Co. (JPM) have what it takes to be a top stock pick for momentum investors? Let's find out.,zacks.com,https://www.zacks.com/stock/news/2400710/what-makes-jpmorgan-chase-co-jpm-a-strong-momentum-stock-buy-now?cid=CS-STOCKNEWSAPI-FT-tale_of_the_tape|yseop_template_10-2400710,https://images.financialmodelingprep.com/news/what-makes-jpmorgan-chase-co-jpm-a-strong-momentum-20250121.jpg
JPM,2025-01-15,2025-01-08,2025-01-29,JPM,,2025-01-21 09:10:27,2025-01-21T09:10:27-05:00,2025-01-21,Is JPMorgan Stock a Buy Post Q4 Earnings & Under Trump 2.0 Policies?,Is JPM stock a smart buy after its Q4 earnings report and on potential Trump 2.0 policies? Let's find out.,zacks.com,https://www.zacks.com/stock/news/2400344/is-jpmorgan-stock-a-buy-post-q4-earnings-under-trump-2-0-policies?cid=CS-STOCKNEWSAPI-FT-analyst_blog|most_popular_stocks-2400344,https://images.financialmodelingprep.com/news/is-jpmorgan-stock-a-buy-post-q4-earnings-under-20250121.jpg
JPM,2025-01-15,2025-01-08,2025-01-29,JPM,,2025-01-21 08:50:43,2025-01-21T08:50:43-05:00,2025-01-21,JPMorgan Exec: Trump Puts Banks Into ‘Go Mode',"American banks are reportedly in “go mode” with Donald Trump's return to the White House. So says Mary Erdoes, head of asset and wealth management for J.P.",pymnts.com,https://www.pymnts.com/news/banking/2025/jpmorgan-exec-trump-puts-banks-into-go-mode/,https://images.financialmodelingprep.com/news/jpmorgan-exec-trump-puts-banks-into-go-mode-20250121.jpg
JPM,2025-01-15,2025-01-08,2025-01-29,JPM,,2025-01-21 07:00:00,2025-01-21T07:00:00-05:00,2025-01-21,"All It Takes Is $3,500 Invested in JPMorgan Chase and 3 Other Dividend Stocks to Help Generate Over $300 in Passive Income a Year","Banks are kicking off the fourth-quarter 2024 earnings season with a bang, with JPMorgan Chase (JPM 1.92%), Bank of America (BAC -0.24%), Wells Fargo (WFC 1.49%), and Citigroup (C 1.88%) all hovering near 52-week highs.",fool.com,https://www.fool.com/investing/2025/01/21/buy-jpmorgan-chase-bank-stocks-passive-income/,https://images.financialmodelingprep.com/news/all-it-takes-is-3500-invested-in-jpmorgan-chase-20250121.jpg
JPM,2025-01-15,2025-01-08,2025-01-29,JPM,,2025-01-22 14:39:03,2025-01-22T14:39:03-05:00,2025-01-22,5 Stocks to Buy for a Trump Presidency,The second Trump presidency has begun and these five stocks are set to benefit.,kiplinger.com,https://www.kiplinger.com/investing/stocks/stocks-to-buy-for-a-trump-presidency,https://images.financialmodelingprep.com/news/5-stocks-to-buy-for-a-trump-presidency-20250122.jpg
JPM,2025-01-15,2025-01-08,2025-01-29,JPM,,2025-01-22 13:20:17,2025-01-22T13:20:17-05:00,2025-01-22,Why JPMorgan Chase & Co. (JPM) Might be Well Poised for a Surge,"JPMorgan Chase & Co. (JPM) shares have started gaining and might continue moving higher in the near term, as indicated by solid earnings estimate revisions.",zacks.com,https://www.zacks.com/stock/news/2401571/why-jpmorgan-chase-co-jpm-might-be-well-poised-for-a-surge?cid=CS-STOCKNEWSAPI-FT-tale_of_the_tape|yseop_template_8-2401571,https://images.financialmodelingprep.com/news/why-jpmorgan-chase-co-jpm-might-be-well-poised-20250122.jpg
JPM,2025-01-15,2025-01-08,2025-01-29,JPM,,2025-01-22 12:20:47,2025-01-22T12:20:47-05:00,2025-01-22,JPMorgan Chase CEO Jamie Dimon says he ‘hugged it out' with Elon Musk after earlier clashes,"JPMorgan had sued Tesla in 2021, kicking off a drawn-out dispute that was at least in part tied to Musk's infamous 2018 tweet where he said he had ""funding secured"" to take the EV giant private.",nypost.com,https://nypost.com/2025/01/22/business/jamie-dimon-says-he-hugged-it-out-with-elon-musk-after-earlier-clashes/,https://images.financialmodelingprep.com/news/jpmorgan-chaseceo-jamie-dimon-says-he-hugged-it-out-20250122.jpg
JPM,2025-01-15,2025-01-08,2025-01-29,JPM,,2025-01-22 12:20:27,2025-01-22T12:20:27-05:00,2025-01-22,JPMorgan Chase CEO Jamie Dimon: The U.S. stock market is 'kind of inflated',"JPMorgan Chase CEO Jamie Dimon on Wednesday called the U.S. stock market inflated and said that he felt more cautious than others in the business world because of the risks from deficit spending, inflation and geopolitical upheaval. Dimon said that he was speaking specifically about the American stock market, which is in the midst of a multi-year bull run.",youtube.com,https://www.youtube.com/watch?v=6gaLNiQL1gc,https://images.financialmodelingprep.com/news/jpmorgan-chase-ceo-jamie-dimon-the-us-stock-market-20250122.jpg
JPM,2025-01-15,2025-01-08,2025-01-29,JPM,,2025-01-22 10:01:52,2025-01-22T10:01:52-05:00,2025-01-22,Here is What to Know Beyond Why JPMorgan Chase & Co. (JPM) is a Trending Stock,"Recently, Zacks.com users have been paying close attention to JPMorgan Chase & Co. (JPM). This makes it worthwhile to examine what the stock has in store.",zacks.com,https://www.zacks.com/stock/news/2401157/here-is-what-to-know-beyond-why-jpmorgan-chase-co-jpm-is-a-trending-stock?cid=CS-STOCKNEWSAPI-FT-tale_of_the_tape|most_searched_stocks-2401157,https://images.financialmodelingprep.com/news/here-is-what-to-know-beyond-why-jpmorgan-chase-20250122.jpg
JPM,2025-01-15,2025-01-08,2025-01-29,JPM,,2025-01-22 08:13:49,2025-01-22T08:13:49-05:00,2025-01-22,JPMorgan CEO Jamie Dimon on Elon Musk: The guy is our Einstein,"JPMorgan Chase chairman and CEO Jamie Dimon joins 'Squawk Box' to discuss the second Trump administration, why he's 'cautiously pessimistic' about the U.S. economy, impact of Trump's tariff proposals and EOs, state of the global markets, impact of the strong dollar, his relationship with Elon Musk, investing landscape, future of DEI in corporate America, his thoughts on the crypto industry, succession plans at JPMorgan, and more.",youtube.com,https://www.youtube.com/watch?v=ii08sxvgo-g,https://images.financialmodelingprep.com/news/jpmorgan-ceo-jamie-dimon-on-elon-musk-the-guy-20250122.jpg
JPM,2025-01-15,2025-01-08,2025-01-29,JPM,,2025-01-22 08:12:03,2025-01-22T08:12:03-05:00,2025-01-22,JPMorgan CEO Jamie Dimon: Growth is the only real solution to reducing deficits and debt,"JPMorgan Chase chairman and CEO Jamie Dimon joins 'Squawk Box' to discuss the second Trump administration, why he's 'cautiously pessimistic' about the U.S. economy, impact of Trump's tariff proposals and EOs, state of the global markets, impact of the strong dollar, his relationship with Elon Musk, investing landscape, future of DEI in corporate America, his thoughts on the crypto industry, succession plans at JPMorgan, and more.",youtube.com,https://www.youtube.com/watch?v=HEb9J4ERtK4,https://images.financialmodelingprep.com/news/jpmorgan-ceo-jamie-dimon-growth-is-the-only-real-20250122.jpg
JPM,2025-01-15,2025-01-08,2025-01-29,JPM,,2025-01-22 07:16:27,2025-01-22T07:16:27-05:00,2025-01-22,Best Income Stocks to Buy for January 22nd,"JPM, C and GS made it to the Zacks Rank #1 (Strong Buy) income stocks list on January 22, 2025.",zacks.com,https://www.zacks.com/commentary/2400939/best-income-stocks-to-buy-for-january-22nd?cid=CS-STOCKNEWSAPI-FT-zacks_1_rank_additions|income_additions-2400939,https://images.financialmodelingprep.com/news/best-income-stocks-to-buy-for-january-22nd-20250122.jpg
JPM,2025-01-15,2025-01-08,2025-01-29,JPM,,2025-01-22 07:11:13,2025-01-22T07:11:13-05:00,2025-01-22,New Strong Buy Stocks for January 22nd,"JPM, GS, C, HIPO and PBPB have been added to the Zacks Rank #1 (Strong Buy) List on January 22, 2025.",zacks.com,https://www.zacks.com/commentary/2400261/new-strong-buy-stocks-for-january-22nd?cid=CS-STOCKNEWSAPI-FT-zacks_1_rank_additions-2400261,https://images.financialmodelingprep.com/news/new-strong-buy-stocks-for-january-22nd-20250122.jpg
JPM,2025-01-15,2025-01-08,2025-01-29,JPM,,2025-01-22 01:15:00,2025-01-22T01:15:00-05:00,2025-01-22,Banks Kick Q4 Earnings Season Off With A Bang As CEO Sentiment Improves,"Banks such as JPMorgan, Citi, and Goldman Sachs started the earnings season off on a positive note when all beat expectations on the top and bottom lines. The pre-peak Late Earnings Report Index fell to its lowest level in a year, signaling corporations are feeling more certain about growth prospects as they start 2025. Q4 S&P 500 EPS growth is expected to come in at 12.5%, the highest growth rate in three years.",seekingalpha.com,https://seekingalpha.com/article/4751035-banks-kick-q4-earnings-season-ceo-sentiment-improves,https://images.financialmodelingprep.com/news/banks-kick-q4-earnings-season-off-with-a-bang-20250122.jpg
JPM,2025-01-15,2025-01-08,2025-01-29,JPM,,2025-01-23 20:00:46,2025-01-23T20:00:46-05:00,2025-01-23,Trump bashes CEOs of America's 2 biggest banks in front of Davos crowd,"Gov. Kelly Armstrong, R-N.D., reacts to President Trump demanding lower oil prices from Saudi Arabia on 'Making Money.",youtube.com,https://www.youtube.com/watch?v=tAI6n-KrAK4,https://images.financialmodelingprep.com/news/trump-bashes-ceos-of-americas-2-biggest-banks-in-20250123.jpg
JPM,2025-01-15,2025-01-08,2025-01-29,JPM,,2025-01-23 18:55:43,2025-01-23T18:55:43-05:00,2025-01-23,"Trump Says JPMorgan, Bank of America Won't Do Business With Conservatives","Big U.S. banks found themselves on the defensive Thursday, with Bank of America saying it doesn't have a “political litmus test” for clients after President Trump suggested that leading financial institutions weren't letting conservatives do business with them.",investopedia.com,https://www.investopedia.com/trump-says-jpmorgan-bank-of-america-won-t-do-business-with-conservatives-8779455,https://images.financialmodelingprep.com/news/trump-says-jpmorgan-bank-of-america-wont-do-business-20250123.jpg
JPM,2025-01-15,2025-01-08,2025-01-29,JPM,,2025-01-23 18:01:19,2025-01-23T18:01:19-05:00,2025-01-23,JPMorgan CEO Jamie Dimon was paid $39M in 2024 — a massive $3M raise,The pay package included a base salary of $1.5 million and $37.5 million in incentives.,nypost.com,https://nypost.com/2025/01/23/business/jpmorgan-ceo-jamie-dimon-was-paid-39m-in-2024-a-massive-3m-raise/,https://images.financialmodelingprep.com/news/jpmorgan-ceo-jamie-dimon-was-paid-39m-in-2024-20250123.jpg
JPM,2025-01-15,2025-01-08,2025-01-29,JPM,,2025-01-23 16:36:45,2025-01-23T16:36:45-05:00,2025-01-23,JPMorgan boosts CEO Jamie Dimon's pay to $39 million,"JPMorgan Chase on Thursday said it raised CEO Jamie Dimon's pay for 2024. Dimon earned $39 million following a year of record profitability, compared to $36 million in 2023.",businessinsider.com,https://www.businessinsider.com/jpmorgan-ceo-jamie-dimons-compensation-pay-39-million-2025-1,https://images.financialmodelingprep.com/news/jpmorgan-boosts-ceo-jamie-dimons-pay-to-39-million-20250123.jpg
JPM,2025-01-15,2025-01-08,2025-01-29,JPM,,2025-01-23 16:33:27,2025-01-23T16:33:27-05:00,2025-01-23,JPMorgan CEO Dimon's 2024 compensation rises about 8%,JPMorgan Chase said on Thursday CEO Jamie Dimon's 2024 compensation climbed about 8.3% to $39 million.,reuters.com,https://www.reuters.com/business/finance/jpmorgan-ceo-dimons-2024-compensation-rises-about-8-2025-01-23/,https://images.financialmodelingprep.com/news/jpmorgan-ceo-dimons-2024-compensation-rises-about-8-20250123.jpg
JPM,2025-01-15,2025-01-08,2025-01-29,JPM,,2025-01-23 14:11:12,2025-01-23T14:11:12-05:00,2025-01-23,Trump alleges Bank of America and JPMorgan are refusing to work with conservatives,"US President Donald Trump on Thursday accused the leaders of Bank of America and JPMorgan Chase of denying banking services to conservatives. Speaking via video link at the World Economic Forum in Davos, Switzerland, Trump addressed an audience of global corporate leaders and criticized the banks, suggesting they were sidelining conservative clients.",invezz.com,https://invezz.com/news/2025/01/23/trump-alleges-bank-of-america-and-jpmorgan-are-refusing-to-work-with-conservatives/,https://images.financialmodelingprep.com/news/trump-alleges-bank-of-america-and-jpmorgan-are-refusing-20250123.jpg
JPM,2025-01-15,2025-01-08,2025-01-29,JPM,,2025-01-23 05:15:51,2025-01-23T05:15:51-05:00,2025-01-23,Jamie Dimon is doubling down on JPMorgan's DEI work as a conservative group targets Wall Street: 'Bring them on',Jamie Dimon reaffirmed JPMorgan's DEI commitments after pressure from an activist shareholder. One group wants JPMorgan to revisit how compensation is tied to the company's racial equity goal.,businessinsider.com,https://www.businessinsider.com/jamie-dimon-doubles-down-jpmorgan-diversity-efforts-dei-shareholder-activists-2025-1,https://images.financialmodelingprep.com/news/jamie-dimon-is-doubling-down-on-jpmorgans-dei-work-20250123.jpg
JPM,2025-01-15,2025-01-08,2025-01-29,JPM,,2025-01-23 03:35:00,2025-01-23T03:35:00-05:00,2025-01-23,Is JPMorgan Chase Stock a Buy Now?,"Shares of JPMorgan Chase (JPM -0.07%) are up a fantastic 55% over the past year, strongly outperforming the S&P 500 index's 26% gain. The banking giant has successfully leveraged a resilient economic backdrop into a record year for profitability.",fool.com,https://www.fool.com/investing/2025/01/23/is-jpmorgan-chase-stock-a-buy-now/,https://images.financialmodelingprep.com/news/is-jpmorgan-chase-stock-a-buy-now-20250123.jpg
JPM,2025-01-15,2025-01-08,2025-01-29,JPM,,2025-01-24 13:57:24,2025-01-24T13:57:24-05:00,2025-01-24,Bank Stock Could Extend Record Highs,"Subscribers to Schaeffer's Weekend Trader options recommendation service received this JPM commentary on Sunday night, along with a detailed options trade recommendation -- including complete entry and exit parameters.",schaeffersresearch.com,https://www.schaeffersresearch.com/content/options/2025/01/24/bank-stock-could-extend-record-highs,https://images.financialmodelingprep.com/news/bank-stock-could-extend-record-highs-20250124.jpg
JPM,2025-01-15,2025-01-08,2025-01-29,JPM,,2025-01-24 04:09:09,2025-01-24T04:09:09-05:00,2025-01-24,JPMorgan Chase: Where Do You Go From The Top?,"JPMorgan Chase produced one of the best quarterly results of its peer growth relative to expectations. Underlying conditions are improving, and management meaningfully boosted net interest income guidance for 2025, but regulatory reform could be an even bigger boost to longer-term growth and profitability. JPMorgan has multiple drivers for long-term growth, including organic branch expansion, growth in capital markets, payments, and asset management, and tech-driven share takeaway.",seekingalpha.com,https://seekingalpha.com/article/4751692-jpmorgan-chase-stock-q4-where-do-you-go-from-the-top-reiterate-buy,https://images.financialmodelingprep.com/news/jpmorgan-chase-where-do-you-go-from-the-top-20250124.jpg
JPM,2025-01-15,2025-01-08,2025-01-29,JPM,,2025-01-25 02:37:09,2025-01-25T02:37:09-05:00,2025-01-25,Koninklijke Philips: Still Neutral After The JPM Healthcare Conference,"Not a constructive view on 2025. The CEO's negative tone and a challenging Chinese operating environment support this. Following the Q3 results, the company revised its Q4 sales estimates downward. A pricey valuation and a recovery in sales from H1 to H2 2025 confirmed a neutral view.",seekingalpha.com,https://seekingalpha.com/article/4751963-koninklijke-philips-still-neutral-after-the-jpm-healthcare-conference,https://images.financialmodelingprep.com/news/koninklijke-philips-still-neutral-after-the-jpm-healthcare-conference-20250125.jpg
JPM,2025-01-15,2025-01-08,2025-01-29,JPM,,2025-01-27 16:23:00,2025-01-27T16:23:00-05:00,2025-01-27,JPMorganChase to Present at the BofA Financial Services Conference,"NEW YORK--(BUSINESS WIRE)--Jennifer Piepszak, Chief Operating Officer of JPMorgan Chase & Co., will present at the BofA Financial Services Conference at the 1 Hotel in Miami Beach, Florida on Tuesday, February 11, 2025 at 1:00 p.m. (Eastern). A live webcast will be available on the day of the conference at www.jpmorganchase.com under Investor Relations, Events & Presentations. JPMorgan Chase & Co. (NYSE: JPM) is a leading financial services firm based in the United States of America.",businesswire.com,https://www.businesswire.com/news/home/20250127258038/en/JPMorganChase-to-Present-at-the-BofA-Financial-Services-Conference/,https://images.financialmodelingprep.com/news/jpmorganchase-to-present-at-the-bofa-financial-services-conference-20250127.jpg
JPM,2025-01-15,2025-01-08,2025-01-29,JPM,,2025-01-27 16:23:00,2025-01-27T16:23:00-05:00,2025-01-27,JPMorganChase to Present at the UBS Financial Services Forum,"NEW YORK--(BUSINESS WIRE)--Jeremy Barnum, Chief Financial Officer of JPMorgan Chase & Co., will present at the UBS Financial Services Forum at the Ritz Carlton Hotel in Key Biscayne, Florida on Tuesday, February 11, 2025 at 9:40 a.m. (Eastern). A live webcast will be available on the day of the conference at www.jpmorganchase.com under Investor Relations, Events & Presentations. JPMorgan Chase & Co. (NYSE: JPM) is a leading financial services firm based in the United States of Ameri.",businesswire.com,https://www.businesswire.com/news/home/20250127007425/en/JPMorganChase-to-Present-at-the-UBS-Financial-Services-Forum/,https://images.financialmodelingprep.com/news/jpmorganchase-to-present-at-the-ubs-financial-services-forum-20250127.jpg
JPM,2025-01-15,2025-01-08,2025-01-29,JPM,,2025-01-27 16:22:00,2025-01-27T16:22:00-05:00,2025-01-27,JPMorganChase Announcement Concerning Preferred Stock,"NEW YORK--(BUSINESS WIRE)--JPMorgan Chase & Co. (NYSE: JPM) (“JPMorganChase” or the “Firm”) has made an announcement concerning its preferred stock. Information can be found on the Firm's Investor Relations website at https://www.jpmorganchase.com/ir/news. JPMorgan Chase & Co. (NYSE: JPM) is a leading financial services firm based in the United States of America (“U.S.”), with operations worldwide. JPMorganChase had $4.0 trillion in assets and $345 billion in stockholders' equity as of.",businesswire.com,https://www.businesswire.com/news/home/20250127697513/en/JPMorganChase-Announcement-Concerning-Preferred-Stock/,https://images.financialmodelingprep.com/news/jpmorganchase-announcement-concerning-preferred-stock-20250127.jpg
JPM,2025-01-15,2025-01-08,2025-01-29,JPM,,2025-01-28 08:21:19,2025-01-28T08:21:19-05:00,2025-01-28,"JPMorgan eyes space at former Credit Suisse tower in Canary Wharf, source says","JPMorgan is in talks to take overflow office space in Credit Suisse's empty former offices in Canary Wharf, a source familiar with the matter told Reuters, having outgrown its own European headquarters nearby.",reuters.com,https://www.reuters.com/business/finance/jpmorgan-eyes-space-former-credit-suisse-tower-canary-wharf-source-says-2025-01-28/,https://images.financialmodelingprep.com/news/jpmorgan-eyes-space-at-former-credit-suisse-tower-in-20250128.jpg
