ticker,event_date,window_start,window_end,symbol,symbols,publishedDate,publishedDateET,date_et,title,text,site,url,image
AAPL,2021-01-27,2021-01-20,2021-02-10,AAPL,,2021-01-20 00:09:15,2021-01-20T00:09:15-05:00,2021-01-20,Apple Car Could Be Made By Kia In US: Report,"Apple Inc.'s (NASDAQ: AAPL) electric vehicles could be made by Kia Corp. at the latter's manufacturing facility in the United States, according to a report from the Korean outlet eDaily. What Happened: Local media reports earlier this month suggested Hyundai Motor Company (OTC: HYMTF) was in advanced discussions with Apple on partnering on the latter's self-driving electric vehicles.",benzinga.com,https://www.benzinga.com/news/21/01/19228805/apple-car-could-be-made-by-kia-in-us-report,https://images.financialmodelingprep.com/news/apple-car-could-be-made-by-kia-in-us-20210120.jpg
AAPL,2021-01-27,2021-01-20,2021-02-10,AAPL,,2021-01-20 05:52:00,2021-01-20T05:52:00-05:00,2021-01-20,3 Top Tech Stocks to Buy During a Recession,A recession can test the resolve of even the hardiest investor. But stocking your portfolio with long-term winners can help.,fool.com,https://www.fool.com/investing/2021/01/20/3-top-tech-stocks-to-buy-during-a-recession/,https://images.financialmodelingprep.com/news/3-top-tech-stocks-to-buy-during-a-recession-20210120.jpg
AAPL,2021-01-27,2021-01-20,2021-02-10,AAPL,,2021-01-20 07:23:03,2021-01-20T07:23:03-05:00,2021-01-20,Apple TV+ Faces Hurdle as Netflix Subscriber Count Tops 200 million,Netflix Inc. (NASDAQ: NFLX) posted extraordinary figures for its 2020 fourth quarter.,247wallst.com,https://247wallst.com/media/2021/01/20/apple-tv-faces-hurdle-as-netflix-subscriber-count-tops-200-million/,https://images.financialmodelingprep.com/news/apple-tv-faces-hurdle-as-netflix-subscriber-count-tops-20210120.jpg
AAPL,2021-01-27,2021-01-20,2021-02-10,AAPL,,2021-01-20 08:05:02,2021-01-20T08:05:02-05:00,2021-01-20,"What's Up With Apple: Who Wants to Make the Apple Car, Can Apple TV+ Compete, and More","While Apple Inc. (NASDAQ: AAPL) did not make major headlines on Tuesday, the world's most valuable company had a role in a number of stories.",247wallst.com,https://247wallst.com/technology-3/2021/01/20/whats-up-with-apple-who-wants-to-make-the-apple-car-can-apple-tv-compete-and-more/,https://images.financialmodelingprep.com/news/whats-up-with-apple-who-wants-to-make-the-20210120.jpg
AAPL,2021-01-27,2021-01-20,2021-02-10,AAPL,,2021-01-20 08:54:49,2021-01-20T08:54:49-05:00,2021-01-20,"Foxconn, Apple interest in EVs point to dramatically different future for automakers","Apple, Foxconn and other technology companies are going to work with automakers in ways which will transform the global auto industry.",cnbc.com,https://www.cnbc.com/2021/01/20/foxconn-apple-ev-interest-points-to-different-future-for-automakers.html,https://images.financialmodelingprep.com/news/foxconn-apple-interest-in-evs-point-to-dramatically-different-20210120.jpeg
AAPL,2021-01-27,2021-01-20,2021-02-10,AAPL,,2021-01-20 09:02:24,2021-01-20T09:02:24-05:00,2021-01-20,4 Stocks to Watch Amid Expected Growth in Consumer Electronics,"Consumer electronics market is poised to sustain its growth momentum on the back of rise in demand, making it wise to keep an eye on names like Apple (AAPL) and Flex (FLEX).",zacks.com,https://www.zacks.com/stock/news/1249004/4-stocks-to-watch-amid-expected-growth-in-consumer-electronics,https://images.financialmodelingprep.com/news/4-stocks-to-watch-amid-expected-growth-in-consumer-20210120.jpg
AAPL,2021-01-27,2021-01-20,2021-02-10,AAPL,,2021-01-20 13:58:54,2021-01-20T13:58:54-05:00,2021-01-20,"Nasdaq News: Why FB, AMZN, NFLX, AAPL and GOOGL Are on the Move Today","It looks like Big Tech stocks are big Inauguration Day winners. Despite widespread investor fears, leading tech names including Facebook (NASDAQ:FB), Amazon (NASDAQ:AMZN), Netflix (NASDAQ:NFLX), Apple (NASDAQ:AAPL) and Alphabet (NASDAQ:GOOG, NASDAQ:GOOGL) are on the move today.",investorplace.com,https://investorplace.com/2021/01/nasdaq-news-big-tech-stocks-faang-amzn-nflx-stock-climbing-today/,https://images.financialmodelingprep.com/news/nasdaq-news-why-fb-amzn-nflx-aapl-and-googl-20210120.jpg
AAPL,2021-01-27,2021-01-20,2021-02-10,AAPL,,2021-01-20 17:14:45,2021-01-20T17:14:45-05:00,2021-01-20,Market Outlook: History Repeats Itself (And You Can Cash In),"After extensive analysis, I isolated the eight key qualities that these super-performing stocks shared ... and I developed a system for finding them.",investorplace.com,https://investorplace.com/2021/01/navellier-template-4/,https://images.financialmodelingprep.com/news/market-outlook-history-repeats-itself-and-you-can-cash-20210120.jpg
AAPL,2021-01-27,2021-01-20,2021-02-10,AAPL,,2021-01-20 17:34:00,2021-01-20T17:34:00-05:00,2021-01-20,Why Alphabet and Other Big Tech Stocks Rallied,Tech titans' stocks rallied a investors appeared optimistic with their prospects under the new administration of President Joe Biden.,barrons.com,https://www.barrons.com/articles/alphabet-amazon-apple-microsoft-stock-tech-rally-51611181939,https://images.financialmodelingprep.com/news/why-alphabet-and-other-big-tech-stocks-rallied-20210120.jpg
AAPL,2021-01-27,2021-01-20,2021-02-10,AAPL,,2021-01-21 03:15:43,2021-01-21T03:15:43-05:00,2021-01-21,Apple Supplier Pegatron Prepares To Make iPhones In India With $150M Investment,"Apple Inc (NASDAQ: AAPL) supplier Pegatron has leased half a million square feet of space in an industrial park in Chennai to set up new manufacturing facilities, India's Financial Express newspaper reported Thursday (tocal time). What Happened: The move comes as part of the Taiwanese supplier's plan to invest $150 million to set up an iPhone production facility in India.",benzinga.com,https://www.benzinga.com/news/21/01/19248331/apple-supplier-pegatron-prepares-to-make-iphones-in-india-with-150m-investment,https://images.financialmodelingprep.com/news/apple-supplier-pegatron-prepares-to-make-iphones-in-india-20210121.jpg
AAPL,2021-01-27,2021-01-20,2021-02-10,AAPL,,2021-01-21 06:06:00,2021-01-21T06:06:00-05:00,2021-01-21,Here's How Much Dividend Income Warren Buffett Will Receive in 2021,Dividend stocks are the silent heroes that have propelled Buffett's wealth creation for decades.,fool.com,https://www.fool.com/investing/2021/01/21/how-much-dividend-income-warren-buffett-receive/,https://images.financialmodelingprep.com/news/heres-how-much-dividend-income-warren-buffett-will-receive-20210121.jpg
AAPL,2021-01-27,2021-01-20,2021-02-10,AAPL,,2021-01-21 07:15:09,2021-01-21T07:15:09-05:00,2021-01-21,Apple's Stock Price the Year You Were Born,Apple Inc. (NASDAQ: AAPL) has been a public company since 1981.,247wallst.com,https://247wallst.com/technology-3/2021/01/21/apples-stock-price-the-year-you-were-born/,https://images.financialmodelingprep.com/news/apples-stock-price-the-year-you-were-born-20210121.jpg
AAPL,2021-01-27,2021-01-20,2021-02-10,AAPL,,2021-01-21 07:39:00,2021-01-21T07:39:00-05:00,2021-01-21,Apple Is Overdue for a Haircut,The world's largest market cap is incredibly inflated.,fool.com,https://www.fool.com/investing/2021/01/21/apple-is-overdue-for-a-haircut/,https://images.financialmodelingprep.com/news/apple-is-overdue-for-a-haircut-20210121.jpg
AAPL,2021-01-27,2021-01-20,2021-02-10,AAPL,,2021-01-21 07:52:03,2021-01-21T07:52:03-05:00,2021-01-21,"What's Up With Apple: Podcasts Spotlight, Apple TV+ and More","Tech stocks had a solid Inauguration Day, adding just over 2% across the entire sector.",247wallst.com,https://247wallst.com/technology-3/2021/01/21/whats-up-with-apple-podcasts-spotlight-apple-tv-and-more/,https://images.financialmodelingprep.com/news/whats-up-with-apple-podcasts-spotlight-apple-tv-and-20210121.jpg
AAPL,2021-01-27,2021-01-20,2021-02-10,AAPL,,2021-01-21 08:17:34,2021-01-21T08:17:34-05:00,2021-01-21,4 Stocks to Watch as Streaming Services Continue to Explode,"From Netflix (NFLX) to Apple's (AAPL) Apple TV+ to Amazon.com (AMZN), all major streaming services have gained significant number of subscribers during the pandemic.",zacks.com,https://www.zacks.com/stock/news/1249620/4-stocks-to-watch-as-streaming-services-continue-to-explode,https://images.financialmodelingprep.com/news/4-stocks-to-watch-as-streaming-services-continue-to-20210121.jpg
AAPL,2021-01-27,2021-01-20,2021-02-10,AAPL,,2021-01-21 08:34:23,2021-01-21T08:34:23-05:00,2021-01-21,This S&P 500 ETF Stock Is Way Less Reliable Than You Know,"SPY stock tracks the S&P 500 well, but it's too heavily weighted towards momentum stocks and under-represents value plays. The post This S&P 500 ETF Stock Is Way Less Reliable Than You Know appeared first on InvestorPlace.",investorplace.com,https://investorplace.com/2021/01/s-p-500-less-reliable-than-you-know/,https://images.financialmodelingprep.com/news/this-sp-500-etf-stock-is-way-less-reliable-20210121.jpg
AAPL,2021-01-27,2021-01-20,2021-02-10,AAPL,,2021-01-21 09:24:37,2021-01-21T09:24:37-05:00,2021-01-21,Here's what analysts are expecting ahead of next week's Apple earnings,"Morgan Stanley Research analysts said the company ""is likely to report all-time record quarterly revenue and earnings.""",cnbc.com,https://www.cnbc.com/2021/01/21/apple-earnings-heres-what-analysts-are-expecting-next-week.html,https://images.financialmodelingprep.com/news/heres-what-analysts-are-expecting-ahead-of-next-weeks-20210121.jpeg
AAPL,2021-01-27,2021-01-20,2021-02-10,AAPL,,2021-01-21 10:25:00,2021-01-21T10:25:00-05:00,2021-01-21,"The Ratings Game: Apple's record quarter could be even bigger than expected, says Morgan Stanley","Investors aren't optimistic enough about Apple Inc.'s upcoming earnings report, according to a Morgan Stanley analyst.",marketwatch.com,https://www.marketwatch.com/story/apples-record-quarter-could-be-even-bigger-than-expected-says-morgan-stanley-11611242757,https://images.financialmodelingprep.com/news/the-ratings-game-apples-record-quarter-could-be-even-20210121.jpg
AAPL,2021-01-27,2021-01-20,2021-02-10,AAPL,,2021-01-21 10:42:02,2021-01-21T10:42:02-05:00,2021-01-21,"Apple developing 'pricey, niche' VR headset ahead of eventual augmented reality glasses: report","Apple Inc. is planning a headset that would be a ""pricey, niche precursor"" to an eventual pair of augmented-reality glasses, according to a Bloomberg News report. Apple has long been rumored to be planning a dedicated augmented-reality device, but its first foray into the headset space could be mainly focused on virtual reality, the report said, with a launch coming as early as 2022.",marketwatch.com,https://www.marketwatch.com/story/apple-developing-pricey-niche-vr-headset-ahead-of-eventual-augmented-reality-glasses-report-2021-01-21,https://images.financialmodelingprep.com/news/apple-developing-pricey-niche-vr-headset-ahead-of-eventual-20210121.jpg
AAPL,2021-01-27,2021-01-20,2021-02-10,AAPL,,2021-01-21 11:18:18,2021-01-21T11:18:18-05:00,2021-01-21,Apple (AAPL) TV+ Loses to Streaming Market Peers in Q4,"Apple's (AAPL) TV+ lags in capturing streaming market share in fourth-quarter 2020, per a research from JustWatch cited by 9TO5 Mac.",zacks.com,https://www.zacks.com/stock/news/1249846/apple-aapl-tv%2B-loses-to-streaming-market-peers-in-q4,https://images.financialmodelingprep.com/news/apple-aapl-tv-loses-to-streaming-market-peers-in-20210121.jpg
AAPL,2021-01-27,2021-01-20,2021-02-10,AAPL,,2021-01-21 11:40:34,2021-01-21T11:40:34-05:00,2021-01-21,Charts Suggest Mega-Cap Stocks Are Headed Higher,Charts of some of the world's largest corporations are showing signs of moving higher.,investopedia.com,https://www.investopedia.com/charts-suggest-mega-cap-stocks-are-headed-higher-5096161,https://images.financialmodelingprep.com/news/charts-suggest-megacap-stocks-are-headed-higher-20210121.jpg
AAPL,2021-01-27,2021-01-20,2021-02-10,AAPL,,2021-01-21 14:11:35,2021-01-21T14:11:35-05:00,2021-01-21,Don't Buy Overvalued and Speculative SPACs Like IPOD Stock,Don't buy overvalued SPACs like IPOD stock. IPOD stock trades for over 75% more than its IPO price even though there is no merger deal.,investorplace.com,https://investorplace.com/2021/01/ipod-stock-speculative-overvalued-spac/,https://images.financialmodelingprep.com/news/dont-buy-overvalued-and-speculative-spacs-like-ipod-stock-20210121.jpg
AAPL,2021-01-27,2021-01-20,2021-02-10,AAPL,,2021-01-21 14:24:04,2021-01-21T14:24:04-05:00,2021-01-21,3 Stocks to Hedge Your Portfolio Against Uncertainty,"When markets are at record highs as we face maximum risk, investors should consider ways to hedge your portfolio of stocks. The post 3 Stocks to Hedge Your Portfolio Against Uncertainty appeared first on InvestorPlace.",investorplace.com,https://investorplace.com/2021/01/3-stocks-to-hedge-your-portfolio-against-uncertainty/,https://images.financialmodelingprep.com/news/3-stocks-to-hedge-your-portfolio-against-uncertainty-20210121.jpg
AAPL,2021-01-27,2021-01-20,2021-02-10,AAPL,,2021-01-21 15:45:33,2021-01-21T15:45:33-05:00,2021-01-21,Apple (AAPL) Developing Podcast Service,"Apple (AAPL) is reportedly developing a paid subscription podcasting service, featuring exclusive content, to compete with Spotify (SPOT).",investopedia.com,https://www.investopedia.com/apple-aapl-developing-podcast-service-5096854,https://images.financialmodelingprep.com/news/apple-aapl-developing-podcast-service-20210121.jpg
AAPL,2021-01-27,2021-01-20,2021-02-10,AAPL,,2021-01-21 16:41:48,2021-01-21T16:41:48-05:00,2021-01-21,These 3 Giants Could Keep the Stock Market Rally Going in 2021,Big gains on Thursday could be just the beginning.,fool.com,https://www.fool.com/investing/2021/01/21/these-3-giants-could-keep-the-stock-market-rally-g/,https://images.financialmodelingprep.com/news/these-3-giants-could-keep-the-stock-market-rally-going-20210121.jpg
AAPL,2021-01-27,2021-01-20,2021-02-10,AAPL,,2021-01-21 16:57:00,2021-01-21T16:57:00-05:00,2021-01-21,The Dow Fell 12 Points Because Intel and Apple Stock Softened the Blow,"Concern from Republicans and moderate Democrats in Congress put a damper on the nascent market rally, as more stimulus looks less like a done deal. Big Tech stocks surged, backstopping the major stock indexes.",barrons.com,https://www.barrons.com/articles/dow-jones-industrial-average-intel-and-apple-stock-softened-blow-51611266023,https://images.financialmodelingprep.com/news/the-dow-fell-12-points-because-intel-and-apple-20210121.jpg
AAPL,2021-01-27,2021-01-20,2021-02-10,AAPL,,2021-01-21 17:32:49,2021-01-21T17:32:49-05:00,2021-01-21,First Eagle Global Value Team's 2020 Annual Letter,"Those who think it's possible to predict the future of economies and markets with any sort of accuracy would have a hard time explaining 2020—a year dominated by a black swan event that descended upon the world with little warning and even less indication of the breadth and depth of its impact. In December 2019, no serious economist or public health official was predicting the emergence of a novel coronavirus that would cause nearly two million deaths worldwide and provoke a deep and widespread recession.",gurufocus.com,https://www.gurufocus.com/news/1337820/first-eagle-global-value-teams-2020-annual-letter,https://images.financialmodelingprep.com/news/first-eagle-global-value-teams-2020-annual-letter-20210121.jpg
AAPL,2021-01-27,2021-01-20,2021-02-10,AAPL,,2021-01-21 17:45:06,2021-01-21T17:45:06-05:00,2021-01-21,Apple Working To Launch VR Headset As Precursor To Augmented Reality Tech,"The first headset to be rolled out by Apple is likely to be somewhat niche and expensive — and a precursor to eventual augmented reality (AR) glasses, which will take more time to develop, Bloomberg reported. The initial, mostly virtual reality (VR) headset has already encountered several issues, the report stated.",pymnts.com,https://www.pymnts.com/apple/2021/apple-working-launch-vr-headset-as-precursor-augmented-reality-tech/,https://images.financialmodelingprep.com/news/apple-working-to-launch-vr-headset-as-precursor-to-20210121.jpg
AAPL,2021-01-27,2021-01-20,2021-02-10,AAPL,,2021-01-22 01:48:54,2021-01-22T01:48:54-05:00,2021-01-22,Apple VR Headset To Arrive In 2022 And At A Steep Price: Report,"Apple Inc (NASDAQ: AAPL) is planning a virtual reality headset that may ultimately lead it to sell augmented reality glasses, Bloomberg reported Thursday. What Happened: The headset with the working name N301 is still in a prototype stage, while the glasses dubbed N421 are at a nascent stage known as “architecture.",benzinga.com,https://www.benzinga.com/news/21/01/19268998/apple-vr-headset-to-arrive-in-2022-and-at-a-steep-price-report,https://images.financialmodelingprep.com/news/apple-vr-headset-to-arrive-in-2022-and-at-20210122.jpg
AAPL,2021-01-27,2021-01-20,2021-02-10,AAPL,,2021-01-22 06:10:00,2021-01-22T06:10:00-05:00,2021-01-22,3 Warren Buffett Stocks That Should Be Surefire Winners in 2021,The billionaire investor seems likely to add to his already impressive net worth with these stocks.,fool.com,https://www.fool.com/investing/2021/01/22/3-warren-buffett-stocks-that-should-be-surefire-wi/,https://images.financialmodelingprep.com/news/3-warren-buffett-stocks-that-should-be-surefire-winners-20210122.jpg
AAPL,2021-01-27,2021-01-20,2021-02-10,AAPL,,2021-01-22 07:14:02,2021-01-22T07:14:02-05:00,2021-01-22,Apple's Market Value Reaches 20 Times IBM's,Another earnings disaster pushed International Business Machines Corp.'s (NYSE: IBM) market capitalization to $117 billion.,247wallst.com,https://247wallst.com/technology-3/2021/01/22/apples-market-value-reaches-20-times-ibms/,https://images.financialmodelingprep.com/news/apples-market-value-reaches-20-times-ibms-20210122.jpg
AAPL,2021-01-27,2021-01-20,2021-02-10,AAPL,,2021-01-22 08:40:39,2021-01-22T08:40:39-05:00,2021-01-22,Apple reportedly working on MacBooks with magnetic charging and new designs,Apple will use its own processors instead of Intel's in the new Macs.,cnbc.com,https://www.cnbc.com/2021/01/22/apple-reportedly-working-on-thinner-lighter-macbook-air-with-magsafe.html,https://images.financialmodelingprep.com/news/apple-reportedly-working-on-macbooks-with-magnetic-charging-and-20210122.jpg
AAPL,2021-01-27,2021-01-20,2021-02-10,AAPL,,2021-01-22 10:32:06,2021-01-22T10:32:06-05:00,2021-01-22,Apple (AAPL) to Report Q1 Earnings: What's in the Offing?,Apple's (AAPL) first-quarter fiscal 2021 earnings are expected to have benefited from strength in Services and strong sales of 5G-enabled iPhone 12.,zacks.com,https://www.zacks.com/stock/news/1250500/apple-aapl-to-report-q1-earnings-whats-in-the-offing,https://images.financialmodelingprep.com/news/apple-aapl-to-report-q1-earnings-whats-in-the-20210122.jpg
AAPL,2021-01-27,2021-01-20,2021-02-10,AAPL,,2021-01-22 10:44:18,2021-01-22T10:44:18-05:00,2021-01-22,7 Mega-Cap Stocks With Solid Foundations,"Mega-cap stocks have become staples in investors' portfolios. If you haven't hopped on this train yet, check out these long-term stocks.",investorplace.com,https://investorplace.com/2021/01/7-mega-cap-stocks-with-solid-foundations/,https://images.financialmodelingprep.com/news/7megacapstockswith-solid-foundations-20210122.jpg
AAPL,2021-01-27,2021-01-20,2021-02-10,AAPL,,2021-01-22 11:10:37,2021-01-22T11:10:37-05:00,2021-01-22,FUBO Stock Is a Great Bet on the Future Today,"FUBO stock is making all the right moves and executing strongly and with a correction under its belt, a longshot looks more like a sure thing The post FUBO Stock Is a Great Bet on the Future Today appeared first on InvestorPlace. More From InvestorPlace Why Everyone Is Investing in 5G All WRONG Top Stock Picker Reveals His Next 1,000% Winner It doesn't matter if you have $500 in savings or $5 million.",investorplace.com,https://investorplace.com/2021/01/fubo-stock-is-a-great-bet-on-the-future-today/,https://images.financialmodelingprep.com/news/fubo-stock-is-a-great-bet-on-the-future-today-20210122.jpg
AAPL,2021-01-27,2021-01-20,2021-02-10,AAPL,,2021-01-22 11:17:06,2021-01-22T11:17:06-05:00,2021-01-22,"Q4 Earnings Come to Regional Banks: ALLY, HBAN & More",Most of the Big Banks have already posted for Q4; this morning we see a large share of Regional Banks reporting quarterly earnings.,zacks.com,https://www.zacks.com/stock/news/1250524/q4-earnings-come-to-regional-banks-ally-hban-more,https://images.financialmodelingprep.com/news/q4-earnings-come-to-regional-banks-ally-hban-more-20210122.jpg
AAPL,2021-01-27,2021-01-20,2021-02-10,AAPL,,2021-01-22 11:47:00,2021-01-22T11:47:00-05:00,2021-01-22,"EU lawmakers want Amazon, Apple, Facebook, Google CEOs at Feb. 1 hearing","EU lawmakers have invited the chief executives of Amazon, Apple, Facebook and Alphabet to a Feb. 1 hearing in Brussels as they try to crack down on the powers of U.S. tech giants.",reuters.com,https://www.reuters.com/article/us-eu-tech-parliament/eu-lawmakers-want-amazon-apple-facebook-google-ceos-at-feb-1-hearing-idUSKBN29R24H,https://images.financialmodelingprep.com/news/eu-lawmakers-want-amazon-apple-facebook-google-ceos-at-20210122.jpg
AAPL,2021-01-27,2021-01-20,2021-02-10,AAPL,,2021-01-22 12:02:06,2021-01-22T12:02:06-05:00,2021-01-22,Regional Banks Post Mixed Earnings Results,Regional Banks Post Mixed Earnings Results.,zacks.com,https://www.zacks.com/stock/news/1250555/regional-banks-post-mixed-earnings-results,https://images.financialmodelingprep.com/news/regional-banks-post-mixed-earnings-results-20210122.jpg
AAPL,2021-01-27,2021-01-20,2021-02-10,AAPL,,2021-01-22 12:22:00,2021-01-22T12:22:00-05:00,2021-01-22,Dating App Bumble Warns in IPO Filing New Privacy Measures Could Hit Revenue,Apple has a new opt-in policy that could wipe out advertisers' ability to track you around the internet.,fool.com,https://www.fool.com/investing/2021/01/22/dating-app-bumble-warns-in-ipo-filing-new-privacy/,https://images.financialmodelingprep.com/news/dating-app-bumble-warns-in-ipo-filing-new-privacy-20210122.jpg
AAPL,2021-01-27,2021-01-20,2021-02-10,AAPL,,2021-01-22 12:25:47,2021-01-22T12:25:47-05:00,2021-01-22,"Apple, Amazon, Facebook, Nio and More Friday Afternoon Analyst Calls","With the trading day about half over, the broad markets were sliding into the weekend.",247wallst.com,https://247wallst.com/investing/2021/01/22/apple-amazon-facebook-nio-and-more-friday-afternoon-analyst-calls/,https://images.financialmodelingprep.com/news/apple-amazon-facebook-nio-and-more-friday-afternoon-analyst-20210122.jpg
AAPL,2021-01-27,2021-01-20,2021-02-10,AAPL,,2021-01-22 14:51:02,2021-01-22T14:51:02-05:00,2021-01-22,7 Undervalued Stocks That Could Perk Up Under Democratic Leadership,These undervalued stocks are well positioned for 2021 under the Biden administration and deserve a look from investors seeking sale prices. The post 7 Undervalued Stocks That Could Perk Up Under Democratic Leadership appeared first on InvestorPlace.,investorplace.com,https://investorplace.com/2021/01/7-undervalued-stocks-that-could-perk-up-under-democratic-leadership/,https://images.financialmodelingprep.com/news/7-undervalued-stocks-that-could-perk-up-under-democratic-20210122.jpg
AAPL,2021-01-27,2021-01-20,2021-02-10,AAPL,,2021-01-22 15:07:00,2021-01-22T15:07:00-05:00,2021-01-22,Apple Stock Nears Another Record. Analysts' iPhone Outlooks Keep Going Up.,Wall Street analysts continue to ratchet up expectations ahead of Apple's December quarter earnings report.,barrons.com,https://www.barrons.com/articles/apple-stock-near-record-earnings-iphone-outlook-51611345952,https://images.financialmodelingprep.com/news/apple-stock-nears-another-record-analysts-iphone-outlooks-keep-20210122.jpg
AAPL,2021-01-27,2021-01-20,2021-02-10,AAPL,,2021-01-22 15:29:00,2021-01-22T15:29:00-05:00,2021-01-22,Earnings Outlook: Get ready for Apple's first $100 billion quarter in history,Even a pandemic can't stop Apple Inc. from hitting new records. The smartphone giant is likely to post its first-ever quarter with revenue above $100 billion Wednesday.,marketwatch.com,https://www.marketwatch.com/story/get-ready-for-apples-first-100-billion-quarter-in-history-11611347355,https://images.financialmodelingprep.com/news/earnings-outlook-get-ready-for-apples-first-100-billion-20210122.jpg
AAPL,2021-01-27,2021-01-20,2021-02-10,AAPL,,2021-01-22 15:39:01,2021-01-22T15:39:01-05:00,2021-01-22,"Apple and Tesla earnings, along with the Fed and GDP will drive markets in the week ahead","Stimulus euphoria may be waning, but Investors have plenty to focus on in the week ahead, including a blast of earnings and a Fed meeting.",cnbc.com,https://www.cnbc.com/2021/01/22/apple-and-tesla-earnings-vaccine-news-and-the-fed-will-be-focus-of-markets-in-week-ahead.html,https://images.financialmodelingprep.com/news/apple-and-tesla-earnings-along-with-the-fed-and-20210122.jpg
AAPL,2021-01-27,2021-01-20,2021-02-10,AAPL,,2021-01-22 15:48:05,2021-01-22T15:48:05-05:00,2021-01-22,Q4 and 2021 Earnings Estimates Keep Going Up,Q4 and 2021 Earnings Estimates Keep Going Up,zacks.com,https://www.zacks.com/commentary/1250712/q4-and-2021-earnings-estimates-keep-going-up,https://images.financialmodelingprep.com/news/q4-and-2021-earnings-estimates-keep-going-up-20210122.jpg
AAPL,2021-01-27,2021-01-20,2021-02-10,AAPL,,2021-01-22 16:33:03,2021-01-22T16:33:03-05:00,2021-01-22,3 Surging Tech Stocks to Buy as the Nasdaq Hits Records in 2021,"Now might be a good time to consider buying some highly-ranked, high-flying stocks that fit within the broader technology basket.",zacks.com,https://www.zacks.com/stock/news/1250736/3-surging-tech-stocks-to-buy-as-the-nasdaq-hits-records-in-2021,https://images.financialmodelingprep.com/news/3-surging-tech-stocks-to-buy-as-the-nasdaq-20210122.jpg
