ticker,event_date,window_start,window_end,symbol,symbols,publishedDate,publishedDateET,date_et,title,text,site,url,image
AAPL,2021-01-27,2021-01-20,2021-02-10,AAPL,,2021-01-25 11:10:02,2021-01-25T11:10:02-05:00,2021-01-25,Bull Notes Push AAPL to Record Highs Ahead of Earnings,"The shares of Apple Inc (NASDAQ:AAPL) are trading at record levels this morning, up 3.9% at $144.49 at last check, after the tech giant earned a price-target hike from Wedbush to a Street-high $175 from $160.",schaeffersresearch.com,https://www.schaeffersresearch.com/content/news/2021/01/25/bull-notes-push-aapl-to-record-highs-ahead-of-earnings,https://images.financialmodelingprep.com/news/bull-notes-push-aapl-to-record-highs-ahead-of-20210125.jpg
AAPL,2021-01-27,2021-01-20,2021-02-10,AAPL,,2021-01-25 11:17:05,2021-01-25T11:17:05-05:00,2021-01-25,Quiet Before the Q4 Earnings Storm,"Big Tech reports earnings later this week, with Apple (AAPL) and Tesla (TSLA) among the companies putting out quarterly results. We see the Nasdaq +120 points an hour before the opening bell.",zacks.com,https://www.zacks.com/stock/news/1251359/quiet-before-the-q4-earnings-storm,https://images.financialmodelingprep.com/news/quiet-before-the-q4-earnings-storm-20210125.jpg
AAPL,2021-01-27,2021-01-20,2021-02-10,AAPL,,2021-01-25 11:55:21,2021-01-25T11:55:21-05:00,2021-01-25,"Alphabet, Apple, Roku, Tesla and More Monday Afternoon Analyst Calls","With the trading day about half over, the broad markets had pulled back on Monday.",247wallst.com,https://247wallst.com/investing/2021/01/25/alphabet-apple-roku-tesla-and-more-monday-afternoon-analyst-calls/,https://images.financialmodelingprep.com/news/alphabet-apple-roku-tesla-and-more-monday-afternoon-analyst-20210125.jpg
AAPL,2021-01-27,2021-01-20,2021-02-10,AAPL,,2021-01-25 12:02:15,2021-01-25T12:02:15-05:00,2021-01-25,Markets Await Economic and Earnings Data,Markets Await Economic and Earnings Data,zacks.com,https://www.zacks.com/stock/news/1251367/markets-await-economic-and-earnings-data,https://images.financialmodelingprep.com/news/markets-await-economic-and-earnings-data-20210125.jpg
AAPL,2021-01-27,2021-01-20,2021-02-10,AAPL,,2021-01-25 12:50:53,2021-01-25T12:50:53-05:00,2021-01-25,Apple's Stock May Soar In The Weeks Following Quarterly Results,Apple will report fiscal first quarter results on Jan. 27. The company expected to see strong iPhone revenue growth.,seekingalpha.com,https://seekingalpha.com/article/4400815-apples-stock-may-soar-in-weeks-following-quarterly-results,https://images.financialmodelingprep.com/news/apples-stock-may-soar-in-the-weeks-following-quarterly-20210125.jpg
AAPL,2021-01-27,2021-01-20,2021-02-10,AAPL,,2021-01-25 13:05:05,2021-01-25T13:05:05-05:00,2021-01-25,7 Retirement Stocks to Buy to Turbocharge Your Savings,Are you saving for your retirement years? Here are seven top retirement stocks to buy and hold to grow your nest egg and boost your savings.,investorplace.com,https://investorplace.com/2021/01/7-retirement-stocks-to-buy-to-turbocharge-your-savings/,https://images.financialmodelingprep.com/news/7-retirement-stocks-to-buy-to-turbocharge-your-savings-20210125.jpeg
AAPL,2021-01-27,2021-01-20,2021-02-10,AAPL,,2021-01-25 14:16:00,2021-01-25T14:16:00-05:00,2021-01-25,"Tesla, Apple, AT&T, Microsoft, and Other Stocks to Watch This Week","It's a busy week for earnings, with results from Apple, Tesla, Facebook, Microsoft, AT&T, GE, AMD, Visa, and many more. Plus, an FOMC meeting and fourth quarter GDP numbers.",barrons.com,https://www.barrons.com/articles/tesla-apple-at-t-microsoft-and-other-stocks-for-investors-to-watch-this-week-51611602159,https://images.financialmodelingprep.com/news/tesla-apple-att-microsoft-and-other-stocks-to-watch-20210125.jpg
AAPL,2021-01-27,2021-01-20,2021-02-10,AAPL,,2021-01-25 14:27:18,2021-01-25T14:27:18-05:00,2021-01-25,Earnings Preview: What To Expect From Apple On Wednesday,Apple is set to report earnings after Wednesday's close and here is what to expect.,forbes.com,https://www.forbes.com/sites/adamsarhan/2021/01/25/earnings-preview-what-to-expect-from-apple-on-wednesday/,https://images.financialmodelingprep.com/news/earnings-preview-what-to-expect-from-apple-on-wednesday-20210125.jpg
AAPL,2021-01-27,2021-01-20,2021-02-10,AAPL,,2021-01-25 14:52:00,2021-01-25T14:52:00-05:00,2021-01-25,"Facebook, Amazon, Apple, Alphabet CEOs asked to attend EU hearing, report says",The European Parliament is discussing more digital regulation.,cnet.com,https://www.cnet.com/news/facebook-amazon-apple-alphabet-ceos-asked-to-attend-eu-hearing-report-says/,https://images.financialmodelingprep.com/news/facebook-amazon-apple-alphabet-ceos-asked-to-attend-eu-20210125.jpg
AAPL,2021-01-27,2021-01-20,2021-02-10,AAPL,,2021-01-25 15:00:37,2021-01-25T15:00:37-05:00,2021-01-25,Apple Earnings: What to Look For,Apple reports Q1 FY 2021 earnings after market close on January 27. Can it boost services revenue and overall earnings amid the lengthening pandemic?,investopedia.com,https://www.investopedia.com/apple-q1-2021-earnings-5097192,https://images.financialmodelingprep.com/news/apple-earnings-what-to-look-for-20210125.jpg
AAPL,2021-01-27,2021-01-20,2021-02-10,AAPL,,2021-01-25 15:28:00,2021-01-25T15:28:00-05:00,2021-01-25,These 2 Nasdaq Giants Are at All-Time Record Highs -- and They're Not Slowing Down,"Once again, the Nasdaq outperformed the rest of the market.",fool.com,https://www.fool.com/investing/2021/01/25/these-2-nasdaq-giants-are-at-all-time-record-highs/,https://images.financialmodelingprep.com/news/these-2-nasdaq-giants-are-at-alltime-record-highs-20210125.jpg
AAPL,2021-01-27,2021-01-20,2021-02-10,AAPL,,2021-01-25 15:47:05,2021-01-25T15:47:05-05:00,2021-01-25,Buy Apple and Microsoft Stock Before Earnings?,Exploring Microsoft (MSFT) and Apple (AAPL) ahead of earnings to help decide if either tech giant's stock is worth buying right now.,zacks.com,https://www.zacks.com/stock/news/1251628/buy-apple-and-microsoft-stock-before-earnings,https://images.financialmodelingprep.com/news/buy-apple-and-microsoft-stock-before-earnings-20210125.jpg
AAPL,2021-01-27,2021-01-20,2021-02-10,AAPL,,2021-01-25 17:00:00,2021-01-25T17:00:00-05:00,2021-01-25,Dan Riccio Begins a New Chapter at Apple,"CUPERTINO, Calif.--(BUSINESS WIRE)--Apple® today announced Dan Riccio will transition to a new role focusing on a new project and reporting to CEO Tim Cook, building on more than two decades of innovation, service, and leadership at Apple. John Ternus will now lead Apple's Hardware Engineering organization as a member of the executive team. “Every innovation Dan has helped Apple bring to life has made us a better and more innovative company, and we're thrilled that he'll continue to be part of",businesswire.com,https://www.businesswire.com/news/home/20210125005875/en/Dan-Riccio-Begins-a-New-Chapter-at-Apple/,https://images.financialmodelingprep.com/news/dan-riccio-begins-a-new-chapter-at-apple-20210125.jpg
AAPL,2021-01-27,2021-01-20,2021-02-10,AAPL,,2021-01-25 17:00:00,2021-01-25T17:00:00-05:00,2021-01-25,Dan Riccio Begins a New Chapter at Apple,"CUPERTINO, Calif.--(BUSINESS WIRE)--Apple® today announced Dan Riccio will transition to a new role focusing on a new project and reporting to CEO Tim Cook, building on more than two decades of innovation, service, and leadership at Apple. John Ternus will now lead Apple’s Hardware Engineering organization as a member of the executive team. “Every innovation Dan has helped Apple bring to life has made us a better and more innovative company, and we’re thrilled that he’ll continue to be part of the team,” said Tim Cook, Apple’s CEO. “John’s deep expertise and wide breadth of experience make him a bold and visionary leader of our Hardware Engineering teams. I want to congratulate them both on these exciting new steps, and I’m looking forward to many more innovations they’ll help bring to the world.” Riccio has been a leader in designing, developing, and engineering almost all of Apple’s products. From the first generation iMac to the more recent 5G iPhone® lineup, M1-based Macs®, and AirPods Max™, Riccio built the Hardware Engineering teams and scaled Apple’s ability to innovate across multiple new product lines with the highest quality. After joining Apple in 1998 as a leader on the Product Design team, Riccio became vice president of iPad® Hardware Engineering in 2010, and in 2012 he joined the executive team as the leader of Hardware Engineering. Riccio will continue to play an instrumental role in shaping the future of Apple’s products in his new position as a vice president of engineering. “Working at Apple has been the opportunity of a lifetime, spent making the world’s best products with the most talented people you could imagine,” said Riccio. “After 23 years of leading our Product Design or Hardware Engineering teams — culminating with our biggest and most ambitious product year ever — it’s the right time for a change. Next up, I’m looking forward to doing what I love most — focusing all my time and energy at Apple on creating something new and wonderful that I couldn’t be more excited about.” Ternus takes on the role of senior vice president of Hardware Engineering. Ternus joined Apple’s Product Design team in 2001 and has been a vice president of Hardware Engineering since 2013. Throughout his nearly 20 years at Apple, Ternus has overseen hardware engineering work on a variety of groundbreaking products, including the first generation AirPods®, and every generation of iPad. Most recently, Ternus led the hardware team responsible for the incredible iPhone 12 and iPhone 12 Pro, and he has been a key leader in the ongoing transition of the Mac to Apple silicon. Ternus graduated with a Bachelor of Science in Mechanical Engineering from the University of Pennsylvania. Apple revolutionized personal technology with the introduction of the Macintosh in 1984. Today, Apple leads the world in innovation with iPhone, iPad, Mac, Apple Watch, and Apple TV. Apple’s five software platforms — iOS, iPadOS, macOS, watchOS, and tvOS — provide seamless experiences across all Apple devices and empower people with breakthrough services including the App Store, Apple Music, Apple Pay, and iCloud. Apple’s more than 100,000 employees are dedicated to making the best products on earth, and to leaving the world better than we found it. NOTE TO EDITORS: For additional information visit Apple Newsroom (www.apple.com/newsroom), or call Apple’s Media Helpline at (408) 974-2042. © 2021 Apple Inc. All rights reserved. Apple, the Apple logo, iPhone, Mac, AirPods Max, iPad, and AirPods are trademarks of Apple. Other company and product names may be trademarks of their respective owners.",businesswire.com,https://www.businesswire.com/news/home/20210125005875/en/Dan-Riccio-Begins-a-New-Chapter-at-Apple,https://images.financialmodelingprep.com/news/dan-riccio-begins-a-new-chapter-at-apple-20210125.png
AAPL,2021-01-27,2021-01-20,2021-02-10,AAPL,,2021-01-25 17:25:45,2021-01-25T17:25:45-05:00,2021-01-25,Apple taps hardware chief to lead new mystery project,Apple did not mention what project Riccio would work on in its announcement.,cnbc.com,https://www.cnbc.com/2021/01/25/apple-taps-hardware-chief-to-lead-new-mystery-project.html,https://images.financialmodelingprep.com/news/apple-taps-hardware-chief-to-lead-new-mystery-project-20210125.jpeg
AAPL,2021-01-27,2021-01-20,2021-02-10,AAPL,,2021-01-25 18:02:00,2021-01-25T18:02:00-05:00,2021-01-25,Apple Reports Earnings on Wednesday. Have Expectations Gone Too Far?,"Expectations on Wall Street have been steadily ratcheting higher, with particularly high hopes for iPhone sales.",barrons.com,https://www.barrons.com/articles/apple-reports-earnings-on-wednesday-heres-what-to-expect-51611615761,https://images.financialmodelingprep.com/news/apple-reports-earnings-on-wednesday-have-expectations-gone-too-20210125.jpg
AAPL,2021-01-27,2021-01-20,2021-02-10,AAPL,,2021-01-25 18:07:00,2021-01-25T18:07:00-05:00,2021-01-25,Apple's hardware engineering chief to step down to focus on new project,"Apple Inc's hardware engineering chief, Dan Riccio, will step down to oversee a new project, the iPhone maker said on Monday, providing few details on the longtime executive's latest role.",reuters.com,https://www.reuters.com/article/us-apple-riccio/apples-hardware-engineering-chief-to-step-down-to-focus-on-new-project-idUSKBN29U2LY,https://images.financialmodelingprep.com/news/apples-hardware-engineering-chief-to-step-down-to-focus-20210125.jpg
AAPL,2021-01-27,2021-01-20,2021-02-10,AAPL,,2021-01-25 18:48:44,2021-01-25T18:48:44-05:00,2021-01-25,Big Tech Looks Good Going Into Earnings,"This week should be a good one for big tech and therefore, also for the markets.",zacks.com,https://www.zacks.com/stock/news/1251655/big-tech-looks-good-going-into-earnings,https://images.financialmodelingprep.com/news/big-tech-looks-good-going-into-earnings-20210125.jpg
AAPL,2021-01-27,2021-01-20,2021-02-10,AAPL,,2021-01-25 18:48:45,2021-01-25T18:48:45-05:00,2021-01-25,Apple & Microsoft Will Set The Pace For Big Tech Earnings,Apple & Microsoft Will Set The Pace For Big Tech Earnings,zacks.com,https://www.zacks.com/commentary/1251638/apple-microsoft-will-set-the-pace-for-big-tech-earnings,https://images.financialmodelingprep.com/news/apple-microsoft-will-set-the-pace-for-big-tech-20210125.jpg
AAPL,2021-01-27,2021-01-20,2021-02-10,AAPL,,2021-01-25 22:33:03,2021-01-25T22:33:03-05:00,2021-01-25,Ride the Impressive Nasdaq Rally With These 5 ETFs,Major technology companies' resilience to the coronavirus crisis has supported the tech-heavy index in 2020 along with increased digital activities.,zacks.com,https://www.zacks.com/stock/news/1251715/ride-the-impressive-nasdaq-rally-with-these-5-etfs,https://images.financialmodelingprep.com/news/ride-the-impressive-nasdaq-rally-with-these-5-etfs-20210125.jpg
AAPL,2021-01-27,2021-01-20,2021-02-10,AAPL,,2021-01-25 23:24:51,2021-01-25T23:24:51-05:00,2021-01-25,Apple Car And Smart Glasses: Market Analysis And Valuation Show A Positive Outlook,Apple Car is expected to reach market in 2024-2027. Apple AR Smart Glasses can be released as early as next year.,seekingalpha.com,https://seekingalpha.com/article/4400911-apple-car-and-smart-glasses-market-analysis-and-valuation-show-positive-outlook,https://images.financialmodelingprep.com/news/apple-car-and-smart-glasses-market-analysis-and-valuation-20210125.jpg
AAPL,2021-01-27,2021-01-20,2021-02-10,AAPL,,2021-01-26 01:59:01,2021-01-26T01:59:01-05:00,2021-01-26,Apple Says Hardware Chief Will Work On 'New Project' Under Tim Cook — But Wouldn't Tell Us What It Is,"Apple Inc (NASDAQ: AAPL) said Monday that company veteran Dan Riccio would transition to a new role, working on an undisclosed project and report to CEO Tim Cook. What Happened: Riccio, a leader in design, development, and engineering has been involved with nearly all Apple products from the first-generation iMac to the 5G iPhone lineup, according to a statement released by the company.",benzinga.com,https://www.benzinga.com/news/21/01/19313922/apple-says-hardware-chief-will-work-on-new-project-under-tim-cook-but-wouldnt-tell-us-what-it-is,https://images.financialmodelingprep.com/news/apple-says-hardware-chief-will-work-on-new-project-20210126.jpg
AAPL,2021-01-27,2021-01-20,2021-02-10,AAPL,,2021-01-26 02:29:34,2021-01-26T02:29:34-05:00,2021-01-26,Apple now lets you take a 'walk' with Shawn Mendes and Dolly Parton,"It's 27 degrees where I live just north of New York City, but I'm taking a walk up a mountain with pop star Shawn Mendes in Griffith Park in Los Angeles. Unlike me, hands in pockets, mask giving me a little extra warmth, Mendes says hello to the people he walks by, in between reflections about his life in the spotlight.",cnn.com,https://www.cnn.com/2021/01/25/tech/apple-time-to-walk/index.html,https://images.financialmodelingprep.com/news/apple-now-lets-you-take-a-walk-with-shawn-20210126.jpg
AAPL,2021-01-27,2021-01-20,2021-02-10,AAPL,,2021-01-26 05:16:08,2021-01-26T05:16:08-05:00,2021-01-26,7 Robinhood Stocks To Move Into Now As Young Investors Look Long Term,Robinhood stocks sometimes get a bad reputation. The reality is that many operate solid businesses.,investorplace.com,https://investorplace.com/2021/01/7-robinhood-stocks-to-move-into-now-as-young-investors-look-long-term/,https://images.financialmodelingprep.com/news/7-robinhood-stocks-to-move-into-now-as-young-20210126.jpg
AAPL,2021-01-27,2021-01-20,2021-02-10,AAPL,,2021-01-26 05:46:00,2021-01-26T05:46:00-05:00,2021-01-26,Warren Buffett's 3 Biggest Stock Picks for 2021,Here's what the Oracle of Omaha is betting on for the coming year.,fool.com,https://www.fool.com/investing/2021/01/26/warren-buffetts-3-biggest-stock-picks-for-2021/,https://images.financialmodelingprep.com/news/warren-buffetts-3-biggest-stock-picks-for-2021-20210126.jpg
AAPL,2021-01-27,2021-01-20,2021-02-10,AAPL,,2021-01-26 06:46:05,2021-01-26T06:46:05-05:00,2021-01-26,Can Continued Services Momentum Aid Apple (AAPL) Q1 Earnings?,"Apple's (AAPL) first-quarter fiscal 2021 results are expected to reflect expanding Services business as well as solid iPad, Mac and Wearables sales.",zacks.com,https://www.zacks.com/stock/news/1251754/can-continued-services-momentum-aid-apple-aapl-q1-earnings,https://images.financialmodelingprep.com/news/can-continued-services-momentum-aid-apple-aapl-q1-earnings-20210126.jpg
AAPL,2021-01-27,2021-01-20,2021-02-10,AAPL,,2021-01-26 07:22:21,2021-01-26T07:22:21-05:00,2021-01-26,Apple Car Revenue May Drive Market Cap to $3 Trillion,Evercore analyst Amit Daryanani raised his forecast for the price of Apple Inc. (NASDAQ: AAPL) shares to $160.,247wallst.com,https://247wallst.com/technology-3/2021/01/26/apple-car-revenue-may-drive-market-cap-to-3-trillion/,https://images.financialmodelingprep.com/news/apple-car-revenue-may-drive-market-cap-to-3-20210126.jpg
AAPL,2021-01-27,2021-01-20,2021-02-10,AAPL,,2021-01-26 07:44:10,2021-01-26T07:44:10-05:00,2021-01-26,"What's Up With Apple: Upcoming Earnings, New Hardware Chief, Blood Sugar Monitor",Apple Inc. (NASDAQ: AAPL) closed out its first quarter for fiscal 2021 at the end of December.,247wallst.com,https://247wallst.com/technology-3/2021/01/26/whats-up-with-apple-upcoming-earnings-new-hardware-chief-blood-sugar-monitor/,https://images.financialmodelingprep.com/news/whats-up-with-apple-upcoming-earnings-new-hardware-chief-20210126.jpg
AAPL,2021-01-27,2021-01-20,2021-02-10,AAPL,,2021-01-26 08:05:38,2021-01-26T08:05:38-05:00,2021-01-26,Apple issues new warning: Keep your iPhone six inches away from your pacemaker,"An important heads-up for iPhone owners: Apple is warning customers that its smartphones could interfere with medical devices, including pacemakers.",cnn.com,https://www.cnn.com/2021/01/25/tech/iphone-12-medical-device-interference/index.html,https://images.financialmodelingprep.com/news/apple-issues-new-warning-keep-your-iphone-six-inches-20210126.jpg
AAPL,2021-01-27,2021-01-20,2021-02-10,AAPL,,2021-01-26 09:47:10,2021-01-26T09:47:10-05:00,2021-01-26,Will Technology Sector Become Market Winner Again in 2021?,"Major technology stocks that are going to perform well in near future are Apple Inc. (AAPL), Facebook Inc. (FB), Alphabet Inc. (GOOGL), Micron Technology Inc. (MU), Broadcom Inc. (AVGO), Qualcomm Inc. (QCOM), Intel Corp. (INTC) and Dell Technologies Inc. (DELL).",zacks.com,https://www.zacks.com/stock/news/1251830/will-technology-sector-become-market-winner-again-in-2021,https://images.financialmodelingprep.com/news/will-technology-sector-become-market-winner-again-in-2021-20210126.jpg
AAPL,2021-01-27,2021-01-20,2021-02-10,AAPL,,2021-01-26 10:08:16,2021-01-26T10:08:16-05:00,2021-01-26,Apple's Earnings Outlook,"Apple (NASDAQ:AAPL) will be releasing its next round of earnings this Wednesday, January 27. For all of the relevant information, here is your guide for Wednesday's Q1 earnings announcement.",benzinga.com,https://www.benzinga.com/news/earnings/21/01/19323271/apples-earnings-outlook,https://images.financialmodelingprep.com/news/apples-earnings-outlook-20210126.jpg
AAPL,2021-01-27,2021-01-20,2021-02-10,AAPL,,2021-01-26 10:28:01,2021-01-26T10:28:01-05:00,2021-01-26,Apple's iPhone Sales Could Blow Up in This Market in 2021,A huge jump in 5G smartphone sales in this market could be a boon for Apple.,fool.com,https://www.fool.com/investing/2021/01/26/apples-iphone-sales-could-blow-up-in-india-2021/,https://images.financialmodelingprep.com/news/apples-iphone-sales-could-blow-up-in-this-market-20210126.jpg
AAPL,2021-01-27,2021-01-20,2021-02-10,AAPL,,2021-01-26 11:17:20,2021-01-26T11:17:20-05:00,2021-01-26,The 5 Hottest Earnings Charts This Week,Big cap companies are in the spotlight this week. Will guidance for the new year boost the stocks to new highs?,zacks.com,https://www.zacks.com/stock/news/1251890/the-5-hottest-earnings-charts-this-week,https://images.financialmodelingprep.com/news/the-5-hottest-earnings-charts-this-week-20210126.jpg
AAPL,2021-01-27,2021-01-20,2021-02-10,AAPL,,2021-01-26 11:17:32,2021-01-26T11:17:32-05:00,2021-01-26,What Lies Ahead for FAANG ETFs in Q4 Earnings,The smooth trend is likely to continue with most of the companies likely to beat earnings estimates when they report this week and the next.,zacks.com,https://www.zacks.com/stock/news/1251877/what-lies-ahead-for-faang-etfs-in-q4-earnings,https://images.financialmodelingprep.com/news/what-lies-ahead-for-faang-etfs-in-q4-earnings-20210126.jpg
AAPL,2021-01-27,2021-01-20,2021-02-10,AAPL,,2021-01-26 12:50:28,2021-01-26T12:50:28-05:00,2021-01-26,"Earnings Previews: Altria, Apple, Facebook, McDonald's and Tesla","Through the end of this week, more than 200 U.S.-listed firms will report results for the quarter ended on December 31.",247wallst.com,https://247wallst.com/investing/2021/01/26/earnings-previews-altria-apple-facebook-mcdonalds-and-tesla/,https://images.financialmodelingprep.com/news/earnings-previews-altria-apple-facebook-mcdonalds-and-tesla-20210126.jpg
AAPL,2021-01-27,2021-01-20,2021-02-10,AAPL,,2021-01-26 14:07:55,2021-01-26T14:07:55-05:00,2021-01-26,It Is Safer to Trade QS Stock Than to Invest in It,"QuantumScape is likely to disappoint its fans in the long run. Meanwhile, QS stock is exciting to trade in the short term.",investorplace.com,https://investorplace.com/2021/01/it-is-safer-to-trade-qs-stock-than-to-invest-in-it/,https://images.financialmodelingprep.com/news/it-is-safer-to-trade-qs-stock-than-to-20210126.jpg
AAPL,2021-01-27,2021-01-20,2021-02-10,AAPL,,2021-01-26 16:46:55,2021-01-26T16:46:55-05:00,2021-01-26,How To Use Options Spreads To Trade Facebook And Apple Earnings On Wednesday,Prior Apple earnings weeks via Options AI Calendar,benzinga.com,https://www.benzinga.com/news/earnings/21/01/19333952/how-to-use-options-spreads-to-trade-facebook-and-apple-earnings-on-wednesday,https://images.financialmodelingprep.com/news/how-to-use-options-spreads-to-trade-facebook-and-20210126.jpg
AAPL,2021-01-27,2021-01-20,2021-02-10,AAPL,,2021-01-26 17:18:03,2021-01-26T17:18:03-05:00,2021-01-26,Strong Tech Dividend Stocks to Buy with Nasdaq at Records,"Strong, stable technology stocks that also pay a dividend should have a place in most diversified portfolios.",zacks.com,https://www.zacks.com/stock/news/1252045/strong-tech-dividend-stocks-to-buy-with-nasdaq-at-records,https://images.financialmodelingprep.com/news/strong-tech-dividend-stocks-to-buy-with-nasdaq-at-records-20210126.jpg
AAPL,2021-01-27,2021-01-20,2021-02-10,AAPL,,2021-01-26 17:30:50,2021-01-26T17:30:50-05:00,2021-01-26,Apple Earnings Preview: On Track To Top $100B Revenue Amid Strong Uptake Of iPhone 12,"Apple Inc (NASDAQ: AAPL) is on track to report a bumper quarter, going by the iPhone sales trend. The company is scheduled to release its fiscal-year 2021 first-quarter results Wednesday after the market close.",benzinga.com,https://www.benzinga.com/analyst-ratings/analyst-color/21/01/19324707/apple-earnings-preview-on-track-to-top-100b-revenue-amid-strong-uptake-of-iphone-12,https://images.financialmodelingprep.com/news/apple-earnings-preview-on-track-to-top-100b-revenue-20210126.jpg
AAPL,2021-01-27,2021-01-20,2021-02-10,AAPL,,2021-01-27 01:31:03,2021-01-27T01:31:03-05:00,2021-01-27,Find 'Strong Buy' Stocks Near New Highs with this Screener,Find 'Strong Buy' Stocks Near New Highs with this Screener,zacks.com,https://www.zacks.com/commentary/1252130/find-strong-buy-stocks-near-new-highs-with-this-screener,https://images.financialmodelingprep.com/news/find-strong-buy-stocks-near-new-highs-with-this-20210127.jpg
AAPL,2021-01-27,2021-01-20,2021-02-10,AAPL,,2021-01-27 06:04:00,2021-01-27T06:04:00-05:00,2021-01-27,3 Unstoppable Stocks at All-Time Highs That You Can Still Buy,Don't look for these stocks' sizzle to fizzle anytime soon.,fool.com,https://www.fool.com/investing/2021/01/27/3-unstoppable-stocks-at-all-time-highs-that-you-ca/,https://images.financialmodelingprep.com/news/3-unstoppable-stocks-at-alltime-highs-that-you-can-20210127.jpg
AAPL,2021-01-27,2021-01-20,2021-02-10,AAPL,,2021-01-27 07:05:00,2021-01-27T07:05:00-05:00,2021-01-27,"Wall Street expects near-record iPhone sales despite delay, shut Apple stores","During the last three months of 2020, Apple Inc delivered its flagship iPhone 12 model weeks later than normal iPhone debuts and shuttered some of its stores due to the pandemic.",reuters.com,https://www.reuters.com/article/us-apple-results-preview/wall-street-expects-near-record-iphone-sales-despite-delay-shut-apple-stores-idUSKBN29W1AG,https://images.financialmodelingprep.com/news/wall-street-expects-nearrecord-iphone-sales-despite-delay-shut-20210127.jpg
