ticker,event_date,window_start,window_end,symbol,symbols,publishedDate,publishedDateET,date_et,title,text,site,url,image
AAPL,2021-01-27,2021-01-20,2021-02-10,AAPL,,2021-02-03 06:10:00,2021-02-03T06:10:00-05:00,2021-02-03,Ignore GameStop: Here Are 3 Better Stocks,Don't get caught chasing the hype.,fool.com,https://www.fool.com/investing/2021/02/03/ignore-gamestop-here-are-3-better-stocks/,https://images.financialmodelingprep.com/news/ignore-gamestop-here-are-3-better-stocks-20210203.jpg
AAPL,2021-01-27,2021-01-20,2021-02-10,AAPL,,2021-02-03 06:15:58,2021-02-03T06:15:58-05:00,2021-02-03,7 Great Retirement Funds To Consider For Those 50+ and Planning for 2030,"If you're in your 50s, now can be a good time to review your investments to be sure you have the best retirement funds for your goals. The post 7 Great Retirement Funds To Consider For Those 50+ and Planning for 2030 appeared first on InvestorPlace.",investorplace.com,https://investorplace.com/2021/02/7-great-retirement-funds-if-you-are-50/,https://images.financialmodelingprep.com/news/7-great-retirement-funds-to-consider-for-those-50-20210203.jpg
AAPL,2021-01-27,2021-01-20,2021-02-10,AAPL,,2021-02-03 06:54:51,2021-02-03T06:54:51-05:00,2021-02-03,Three ways investors can play Big Tech on the back of earnings,"One Apple supplier could make for a good ""catch-up"" trade to the Big Tech bounce, says Mark Tepper, president and CEO of Strategic Wealth Partners.",cnbc.com,https://www.cnbc.com/2021/02/03/three-ways-investors-can-play-big-tech-on-the-back-of-earnings.html,https://images.financialmodelingprep.com/news/three-ways-investors-can-play-big-tech-on-the-20210203.jpg
AAPL,2021-01-27,2021-01-20,2021-02-10,AAPL,,2021-02-03 07:58:33,2021-02-03T07:58:33-05:00,2021-02-03,"Apple and Kia Plan 100,000 Cars",More reports are leaking out that Apple Inc. (NASDAQ: AAPL) is about to announce plans for an Apple Car.,247wallst.com,https://247wallst.com/autos/2021/02/03/apple-and-kia-plan-100000-cars/,https://images.financialmodelingprep.com/news/apple-and-kia-plan-100000-cars-20210203.jpg
AAPL,2021-01-27,2021-01-20,2021-02-10,AAPL,,2021-02-03 08:00:00,2021-02-03T08:00:00-05:00,2021-02-03,"Forget GameStop, This Reddit Stock Was a Bigger Winner Last Week","Shares of this little-known headphone-maker jumped nearly 2,000% last week.",fool.com,https://www.fool.com/investing/2021/02/03/forget-gamestop-this-reddit-stock-was-a-bigger-win/,https://images.financialmodelingprep.com/news/forget-gamestop-this-reddit-stock-was-a-bigger-winner-20210203.jpg
AAPL,2021-01-27,2021-01-20,2021-02-10,AAPL,,2021-02-03 08:21:19,2021-02-03T08:21:19-05:00,2021-02-03,US Economy to Return to Growth Trajectory in 2021: 5 Top Picks,"it will be prudent to invest in growth-oriented technology behemoths with a favorable Zacks Rank to maximize gains going forward. These are: MSFT, AAPL, QCOM, FB and TXN.",zacks.com,https://www.zacks.com/stock/news/1256490/us-economy-to-return-to-growth-trajectory-in-2021-5-top-picks,https://images.financialmodelingprep.com/news/us-economy-to-return-to-growth-trajectory-in-2021-20210203.jpg
AAPL,2021-01-27,2021-01-20,2021-02-10,AAPL,,2021-02-03 08:29:00,2021-02-03T08:29:00-05:00,2021-02-03,Apple Car Rumors Won't Stop. Kia Stock Is Rising.,Stock in the South Korean auto maker is up almost 10% after a report Apple will pick it as its partner for a coming iCar.,barrons.com,https://www.barrons.com/articles/apple-car-rumors-wont-stop-kia-stock-is-rising-51612358952,https://images.financialmodelingprep.com/news/apple-car-rumors-wont-stop-kia-stock-is-rising-20210203.jpg
AAPL,2021-01-27,2021-01-20,2021-02-10,AAPL,,2021-02-03 09:06:13,2021-02-03T09:06:13-05:00,2021-02-03,Pandemic Boosts Spending on Streaming Services: 4 Stocks to Watch,"From Netflix (NFLX) to Apple's (AAPL) Apple TV to Amazon's (AMZN) Amazon Prime, streaming services have seen a surge in subscribers during the pandemic, which is boosting their revenues.",zacks.com,https://www.zacks.com/stock/news/1256568/pandemic-boosts-spending-on-streaming-services-4-stocks-to-watch,https://images.financialmodelingprep.com/news/pandemic-boosts-spending-on-streaming-services-4-stocks-to-20210203.jpg
AAPL,2021-01-27,2021-01-20,2021-02-10,AAPL,,2021-02-03 09:20:35,2021-02-03T09:20:35-05:00,2021-02-03,Apple (AAPL) Sells $14B of Bonds,"Apple (AAPL) has sold $14 billion of bonds, with the funding of share repurchases and dividends being among the possible uses for the cash.",investopedia.com,https://www.investopedia.com/apple-aapl-sells-usd14b-of-bonds-5101660,https://images.financialmodelingprep.com/news/apple-aapl-sells-14b-of-bonds-20210203.jpg
AAPL,2021-01-27,2021-01-20,2021-02-10,AAPL,,2021-02-03 09:30:37,2021-02-03T09:30:37-05:00,2021-02-03,Taking a Bite of the Apple,"Apple (AAPL) appears to be rallying again, and we expect the stock to continue climbing higher. The post Taking a Bite of the Apple appeared first on InvestorPlace.",investorplace.com,https://investorplace.com/2021/02/taking-a-bite-of-the-apple/,https://images.financialmodelingprep.com/news/taking-a-bite-of-the-apple-20210203.jpg
AAPL,2021-01-27,2021-01-20,2021-02-10,AAPL,,2021-02-03 10:00:00,2021-02-03T10:00:00-05:00,2021-02-03,Apple Just Tapped the Debt Market to Raise $14 Billion,The Cupertino tech juggernaut conducts its first bond offering in six months.,fool.com,https://www.fool.com/investing/2021/02/03/apple-just-tapped-the-debt-market-to-raise-14-bill/,https://images.financialmodelingprep.com/news/apple-just-tapped-the-debt-market-to-raise-14-20210203.jpg
AAPL,2021-01-27,2021-01-20,2021-02-10,AAPL,,2021-02-03 10:35:05,2021-02-03T10:35:05-05:00,2021-02-03,Cage Match: Apple vs Facebook in a Battle Over Privacy,"Ever since Apple Inc. (NASDAQ: AAPL) announced last year that it planned to include a new privacy feature in the iPhone iOS 14 operating system, the line in the sand between Apple and Facebook Inc.",247wallst.com,https://247wallst.com/technology-3/2021/02/03/cage-match-apple-vs-facebook-in-a-battle-over-privacy/,https://images.financialmodelingprep.com/news/cage-match-apple-vs-facebook-in-a-battle-over-20210203.jpg
AAPL,2021-01-27,2021-01-20,2021-02-10,AAPL,,2021-02-03 10:51:15,2021-02-03T10:51:15-05:00,2021-02-03,Apple Car Manufacturing Partner Picked For 2024 Launch: Report,"The highly anticipated Apple car will be made with South Korea's Kia at a U.S. factory, according to reports. The post Apple Car Manufacturing Partner Picked For 2024 Launch: Report appeared first on Investor's Business Daily.",investors.com,https://www.investors.com/news/apple-car-built-with-korea-kia-by-2024-apple-stock/,https://images.financialmodelingprep.com/news/apple-car-manufacturing-partner-picked-for-2024-launch-report-20210203.jpg
AAPL,2021-01-27,2021-01-20,2021-02-10,AAPL,,2021-02-03 11:00:01,2021-02-03T11:00:01-05:00,2021-02-03,"Parler's survival is uncertain after it was dropped by Amazon, Apple and Google","During the 2020 election, many conservatives flocked to social media platform Parler decrying Big Tech's labeling of posts. Now the upstart site is struggling.",cnbc.com,https://www.cnbc.com/2021/02/03/parlers-survival-is-uncertain-after-it-was-dropped-by-big-tech.html,https://images.financialmodelingprep.com/news/parlers-survival-is-uncertain-after-it-was-dropped-by-20210203.jpeg
AAPL,2021-01-27,2021-01-20,2021-02-10,AAPL,,2021-02-03 11:22:19,2021-02-03T11:22:19-05:00,2021-02-03,3 Stocks to Buy in the Flourishing Computer Industry,3 Stocks to Buy in the Flourishing Computer Industry,zacks.com,https://www.zacks.com/commentary/1256574/3-stocks-to-buy-in-the-flourishing-computer-industry,https://images.financialmodelingprep.com/news/3-stocks-to-buy-in-the-flourishing-computer-industry-20210203.jpg
AAPL,2021-01-27,2021-01-20,2021-02-10,AAPL,,2021-02-03 12:38:53,2021-02-03T12:38:53-05:00,2021-02-03,Apple's growth in wearables is the most impressive feat from its holiday quarter,"When Apple announced its first-quarter earnings last week, it was easy to get distracted by all of the big numbers. The company had record top- and bottom-line numbers, reporting $111.4 billion in revenue and $28.76 billion in profit. It certainly appears it's managed to thrive during the pandemic. That's partially due to the surge in sales of the iPhone 12, which brought an updated design and added 5G wireless, something Apple had been later to adopt than most of its competitors. The Mac also did well alongside the overall resurgence of the laptop computer market, which this year saw its first increase in sales in a decade.",businessinsider.com,https://www.businessinsider.com/apple-holiday-quarter-growth-wearables-apple-watch-2021-2,https://images.financialmodelingprep.com/news/apples-growth-in-wearables-is-the-most-impressive-feat-20210203.jpg
AAPL,2021-01-27,2021-01-20,2021-02-10,AAPL,,2021-02-03 14:35:48,2021-02-03T14:35:48-05:00,2021-02-03,Apple Flexes Financial Muscle,Company borrows $14 billion at very low rates. Debt repayments/refinancings and buybacks likely uses of cash.,seekingalpha.com,https://seekingalpha.com/article/4403099-apple-flexes-financial-muscle,https://images.financialmodelingprep.com/news/apple-flexes-financial-muscle-20210203.jpeg
AAPL,2021-01-27,2021-01-20,2021-02-10,AAPL,,2021-02-03 16:45:14,2021-02-03T16:45:14-05:00,2021-02-03,Apple Puts $3.6 Billion Into Kia For Apple Car Project,"Apple plans to invest $3.6 billion in Kia for the manufacture of the partnership's new electric Apple cars, Fox Business reported Wednesday (Feb. 3). Apple will take an equity stake in Kia for the deal, and the company will build a manufacturing facility for the autonomous electric car in Georgia, the report says, citing South Korea's […]",pymnts.com,https://www.pymnts.com/apple/2021/apple-puts-3-6-billion-into-kia-for-apple-car-project/,https://images.financialmodelingprep.com/news/apple-puts-36-billion-into-kia-for-apple-car-20210203.jpg
AAPL,2021-01-27,2021-01-20,2021-02-10,AAPL,,2021-02-03 17:07:25,2021-02-03T17:07:25-05:00,2021-02-03,Apple: Off to the Races in Fiscal 2021,"Last week, Apple Inc. (NASDAQ:AAPL) reported results for the first quarter of fiscal 2021.",gurufocus.com,https://www.gurufocus.com/news/1348991/apple-off-to-the-races-in-fiscal-2021,https://images.financialmodelingprep.com/news/apple-off-to-the-races-in-fiscal-2021-20210203.jpeg
AAPL,2021-01-27,2021-01-20,2021-02-10,AAPL,,2021-02-03 18:01:59,2021-02-03T18:01:59-05:00,2021-02-03,Apple and Hyundai-Kia pushing towards deal on Apple Car,"Apple is close to finalizing a deal with Hyundai-Kia to manufacture an Apple branded autonomous electric vehicle at the Kia assembly plant in West Point, Georgia.",cnbc.com,https://www.cnbc.com/2021/02/03/apple-and-hyundai-kia-driving-towards-deal-on-apple-car.html,https://images.financialmodelingprep.com/news/apple-and-hyundaikia-pushing-towards-deal-on-apple-car-20210203.jpeg
AAPL,2021-01-27,2021-01-20,2021-02-10,AAPL,,2021-02-03 18:26:00,2021-02-03T18:26:00-05:00,2021-02-03,Apple may build a fully autonomous electric car with Hyundai-Kia: report,"Apple Inc. is close to a deal to make its autonomous electric-vehicle with Kia-Hyundai, CNBC reported late Wednesday.",marketwatch.com,https://www.marketwatch.com/story/apple-may-build-a-fully-autonomous-electric-car-with-hyundai-kia-report-11612394804,https://images.financialmodelingprep.com/news/apple-may-build-a-fully-autonomous-electric-car-with-20210203.jpg
AAPL,2021-01-27,2021-01-20,2021-02-10,AAPL,,2021-02-04 00:10:48,2021-02-04T00:10:48-05:00,2021-02-04,SPYG: Market-Mania Signals Potential Peak For Big Tech,SPYG: Market-Mania Signals Potential Peak For Big Tech,seekingalpha.com,https://seekingalpha.com/article/4403240-spyg-market-mania-signals-potential-peak-for-big-tech,https://images.financialmodelingprep.com/news/spyg-marketmania-signals-potential-peak-for-big-tech-20210204.jpg
AAPL,2021-01-27,2021-01-20,2021-02-10,AAPL,,2021-02-04 01:31:02,2021-02-04T01:31:02-05:00,2021-02-04,Tech Sector Shows Its Enormous Earnings Power,Tech Sector Shows Its Enormous Earnings Power,zacks.com,https://www.zacks.com/commentary/1257129/tech-sector-shows-its-enormous-earnings-power,https://images.financialmodelingprep.com/news/tech-sector-shows-its-enormous-earnings-power-20210204.jpg
AAPL,2021-01-27,2021-01-20,2021-02-10,AAPL,,2021-02-04 01:31:03,2021-02-04T01:31:03-05:00,2021-02-04,Tech Sector Shows Its Enormous Earnings Power,Tech Sector Shows Its Enormous Earnings Power,zacks.com,https://www.zacks.com/commentary/1257118/tech-sector-shows-its-enormous-earnings-power,https://images.financialmodelingprep.com/news/tech-sector-shows-its-enormous-earnings-power-20210204.jpg
AAPL,2021-01-27,2021-01-20,2021-02-10,AAPL,,2021-02-04 07:10:52,2021-02-04T07:10:52-05:00,2021-02-04,5 FAANG Stocks With Big Moves Ahead to Keep in Mind,"FAANG stocks represent about 15% of the S&P, making them the safest investments around. But even then, you have to time your entry and exit.",investorplace.com,https://investorplace.com/2021/02/5-faang-stocks-with-big-moves-ahead-to-keep-in-mind-fb-amzn-nflx-aapl-goog-googl/,https://images.financialmodelingprep.com/news/5-faang-stocks-with-big-moves-ahead-to-keep-in-20210204.jpg
AAPL,2021-01-27,2021-01-20,2021-02-10,AAPL,,2021-02-04 07:29:05,2021-02-04T07:29:05-05:00,2021-02-04,Apple's Biggest Opportunity? China's 1 Billion People Online,"By most accounts, about 290 million people are online in the United States, either via broadband to the home or wireless connections.",247wallst.com,https://247wallst.com/consumer-electronics/2021/02/04/apples-biggest-opportunity-is-chinas-1-billion-people-online-nasdaq-aapl/,https://images.financialmodelingprep.com/news/apples-biggest-opportunity-chinas-1-billion-people-online-20210204.jpg
AAPL,2021-01-27,2021-01-20,2021-02-10,AAPL,,2021-02-04 08:12:00,2021-02-04T08:12:00-05:00,2021-02-04,Sustainable Investing: What new Amazon CEO Andy Jassy needs to do to become a leader in sustainability like Apple,"Few ESG funds own Amazon stock because of its poor record on labor, workplace issues and corporate competition.",marketwatch.com,https://www.marketwatch.com/story/what-new-amazon-ceo-andy-jassy-needs-to-do-to-become-a-leader-in-sustainability-like-apple-11612444339,https://images.financialmodelingprep.com/news/sustainable-investing-what-new-amazon-ceo-andy-jassy-needs-to-20210204.jpg
AAPL,2021-01-27,2021-01-20,2021-02-10,AAPL,,2021-02-04 08:45:00,2021-02-04T08:45:00-05:00,2021-02-04,Where Will Apple Stock Be in 5 Years?,The tech giant could undergo a major transformation by 2025.,fool.com,https://www.fool.com/investing/2021/02/04/where-will-apple-stock-be-in-5-years/,https://images.financialmodelingprep.com/news/where-will-apple-stock-be-in-5-years-20210204.jpg
AAPL,2021-01-27,2021-01-20,2021-02-10,AAPL,,2021-02-04 09:04:35,2021-02-04T09:04:35-05:00,2021-02-04,Bull of the Day: Apple (AAPL),Bull of the Day: Apple (AAPL),zacks.com,https://www.zacks.com/commentary/1257160/bull-of-the-day-apple-aapl,https://images.financialmodelingprep.com/news/bull-of-the-day-apple-aapl-20210204.jpg
AAPL,2021-01-27,2021-01-20,2021-02-10,AAPL,,2021-02-04 09:51:56,2021-02-04T09:51:56-05:00,2021-02-04,Is an Apple Car Deal With Hyundia-Kia Getting Closer?,The chatter about a coming announcement from Apple Inc. (NASDAQ: AAPL) that it has struck a deal with automaker Hyundai keeps getting louder.,247wallst.com,https://247wallst.com/technology-3/2021/02/04/is-an-apple-car-deal-with-hyundia-kia-getting-closer/,https://images.financialmodelingprep.com/news/is-an-apple-car-deal-with-hyundiakia-getting-closer-20210204.jpg
AAPL,2021-01-27,2021-01-20,2021-02-10,AAPL,,2021-02-04 10:53:28,2021-02-04T10:53:28-05:00,2021-02-04,3 Tech Stocks To Trade As They Reestablish Dominance,"Tech titans are back on top, but not all opportunities in the space are created equal. Here's how to game the next leg higher in tech stocks.",investorplace.com,https://investorplace.com/2021/02/3-tech-stocks-to-trade-as-they-reestablish-dominance/,https://images.financialmodelingprep.com/news/3-tech-stocks-to-trade-as-they-reestablish-dominance-20210204.jpg
AAPL,2021-01-27,2021-01-20,2021-02-10,AAPL,,2021-02-04 11:35:21,2021-02-04T11:35:21-05:00,2021-02-04,7 ‘Love or Hate' Cult Stocks with Powerful Followings,"Sometimes, cult stocks drive investors crazy. Other times, they are right on the money.",investorplace.com,https://investorplace.com/2021/02/7-love-or-hate-cult-stocks-with-powerful-followings/,https://images.financialmodelingprep.com/news/7-love-or-hate-cult-stocks-with-powerful-followings-20210204.jpg
AAPL,2021-01-27,2021-01-20,2021-02-10,AAPL,,2021-02-04 11:55:32,2021-02-04T11:55:32-05:00,2021-02-04,Is Facebook Lying About the Impact of Apple's Privacy Initiative?,Our look Wednesday at the dispute between Apple Inc. (NASDAQ: AAPL) and Facebook Inc.,247wallst.com,https://247wallst.com/technology-3/2021/02/04/is-facebook-mistaken-about-the-impact-of-apples-privacy-initiative/,https://images.financialmodelingprep.com/news/is-facebook-lying-about-the-impact-of-apples-privacy-20210204.jpg
AAPL,2021-01-27,2021-01-20,2021-02-10,AAPL,,2021-02-04 12:07:10,2021-02-04T12:07:10-05:00,2021-02-04,"The Best Stocks to Buy in the Market Today, According to Jeff Bezos","The world's biggest companies -- and the market's best stocks to buy -- all have one thing in common: They're relentlessly innovative.  The post The Best Stocks to Buy in the Market Today, According to Jeff Bezos appeared first on InvestorPlace.",investorplace.com,https://investorplace.com/hypergrowthinvesting/2021/02/the-best-stocks-to-buy-in-the-market-today-according-to-jeff-bezos/,https://images.financialmodelingprep.com/news/the-best-stocks-to-buy-in-the-market-today-20210204.jpg
AAPL,2021-01-27,2021-01-20,2021-02-10,AAPL,,2021-02-04 12:54:46,2021-02-04T12:54:46-05:00,2021-02-04,Q1 Results Show Increasing Asia Focus For Apple,China iPhone sales were the headline number in the Q1 results. Signs of progress finally being made in India are a bullish sign.,seekingalpha.com,https://seekingalpha.com/article/4403371-q1-results-show-increasing-asia-focus-for-apple,https://images.financialmodelingprep.com/news/q1-results-show-increasing-asia-focus-for-apple-20210204.jpg
AAPL,2021-01-27,2021-01-20,2021-02-10,AAPL,,2021-02-04 13:00:59,2021-02-04T13:00:59-05:00,2021-02-04,"Odds Are This Fund Topped Yours — Without FAANG Stocks like Amazon, Apple and Netflix","Odds are, Virtus KAR Mid-Cap Growth Fund's 65% gain topped your mutual funds. It owned no giant tech stocks like Amazon, Apple and Netflix.",investors.com,https://www.investors.com/etfs-and-funds/mutual-funds/best-mutual-funds-fund-soared-2020-without-amazon-apple-netflix/,https://images.financialmodelingprep.com/news/odds-are-this-fund-topped-yours-without-faang-stocks-like-20210204.jpg
AAPL,2021-01-27,2021-01-20,2021-02-10,AAPL,,2021-02-04 13:36:03,2021-02-04T13:36:03-05:00,2021-02-04,Expect a Rally in EV ETFs on a Likely Apple-Hyundai Deal,"A boom in the electric vehicle segments is in the cards. While Tesla has dominated the space so far, Apple is all set to hit the market with its likely deal with Hyundai.",zacks.com,https://www.zacks.com/stock/news/1257771/expect-a-rally-in-ev-etfs-on-a-likely-apple-hyundai-deal,https://images.financialmodelingprep.com/news/expect-a-rally-in-ev-etfs-on-a-likely-20210204.jpg
AAPL,2021-01-27,2021-01-20,2021-02-10,AAPL,,2021-02-04 15:07:04,2021-02-04T15:07:04-05:00,2021-02-04,Is It Time For The Markets To Sober Up?,"Market fundamentals and valuations have seemingly been thrown out the window, but I don???t think this market euphoria can last much longer",zacks.com,https://www.zacks.com/stock/news/1257785/is-it-time-for-the-markets-to-sober-up,https://images.financialmodelingprep.com/news/is-it-time-for-the-markets-to-sober-up-20210204.jpg
AAPL,2021-01-27,2021-01-20,2021-02-10,AAPL,,2021-02-04 15:24:12,2021-02-04T15:24:12-05:00,2021-02-04,Apple shares jump amid reports that electric car deal is near,Apple's stock price got some extra juice Thursday following reports that it's close to inking a deal to produce an autonomous electric car. The iPhone maker's shares climbed as much as 1.9 percent to $136.48 after South Korean and American news outlets reported details of Apple's potential partnership with Kia.,nypost.com,https://nypost.com/2021/02/04/apple-shares-jump-amid-reports-that-electric-car-deal-is-near/,https://images.financialmodelingprep.com/news/apple-shares-jump-amid-reports-that-electric-car-deal-20210204.jpg
AAPL,2021-01-27,2021-01-20,2021-02-10,AAPL,,2021-02-04 15:52:07,2021-02-04T15:52:07-05:00,2021-02-04,Is It Time For The Equity Market To Sober Up?,"The democratization of the financial markets, ultra-low interest rate, and high future growth environment have created a new market that freshman and senior traders are both learning.",zacks.com,https://www.zacks.com/stock/news/1257790/is-it-time-for-the-equity-market-to-sober-up,https://images.financialmodelingprep.com/news/is-it-time-for-the-equity-market-to-sober-20210204.jpg
AAPL,2021-01-27,2021-01-20,2021-02-10,AAPL,,2021-02-04 17:16:36,2021-02-04T17:16:36-05:00,2021-02-04,Facebook's not the only one worried about Apple's privacy change — Snap and Unity both just warned investors about it,"Snap and Unity Software, which reported fourth quarter earnings Thursday, both warned of the upcoming impact from Apple's privacy changes set for this spring.",cnbc.com,https://www.cnbc.com/2021/02/04/snap-unity-warn-of-impact-from-apple-ios-14-idfa-privacy-changes.html,https://images.financialmodelingprep.com/news/facebooks-not-the-only-one-worried-about-apples-privacy-20210204.jpg
AAPL,2021-01-27,2021-01-20,2021-02-10,AAPL,,2021-02-04 18:30:34,2021-02-04T18:30:34-05:00,2021-02-04,Big Tech's road to underperformance and why its dominance is waning,"Big Tech stocks such as Apple and Microsoft rallied on Thursday, but Bryn Mawr Trust's Jeff Mills has a warning.",cnbc.com,https://www.cnbc.com/2021/02/04/big-tech-stocks-whats-next-for-apple-microsoft-alphabet-shares.html,https://images.financialmodelingprep.com/news/big-techs-road-to-underperformance-and-why-its-dominance-20210204.jpeg
AAPL,2021-01-27,2021-01-20,2021-02-10,AAPL,,2021-02-04 18:55:08,2021-02-04T18:55:08-05:00,2021-02-04,"From Apple to Honeywell, Jim Cramer's 13 dream team Super Bowl-ready stocks","""The name of the game is finding all-star companies that can handle all kinds of setbacks and still get you to the championship,"" the ""Mad Money"" host said.",cnbc.com,https://www.cnbc.com/2021/02/04/from-apple-to-honeywell-jim-cramers-13-dream-team-super-bowl-ready-stocks.html,https://images.financialmodelingprep.com/news/from-apple-to-honeywell-jim-cramers-13-dream-team-20210204.jpeg
AAPL,2021-01-27,2021-01-20,2021-02-10,AAPL,,2021-02-04 22:42:00,2021-02-04T22:42:00-05:00,2021-02-04,MarketWatch First Take: Apple's privacy changes are affecting more than just Facebook,"On Thursday, Snap, Pinterest and Unity Software each said they anticipate some issues or headwinds resulting from Apple's upcoming changes to its privacy settings, seemingly supporting Facebook's argument that the changes will hurt app makers.",marketwatch.com,https://www.marketwatch.com/story/apples-privacy-changes-are-affecting-more-than-just-facebook-11612496532,https://images.financialmodelingprep.com/news/marketwatch-first-take-apples-privacy-changes-are-affecting-more-than-20210204.jpg
AAPL,2021-01-27,2021-01-20,2021-02-10,AAPL,,2021-02-05 04:16:06,2021-02-05T04:16:06-05:00,2021-02-05,"Apple's VR Device To Cost $3,000 And Feature Changeable Headbands: Report","Apple Inc's (NASDAQ: AAPL) virtual reality headset could cost nearly $3,000, Business Insider reported Thursday. What Happened: The VR device could also be equipped with interchangeable headbands and have more than a dozen cameras onboard to track hand movements, according to the Information, reported Insider.",benzinga.com,https://www.benzinga.com/news/21/02/19505402/apples-vr-device-to-cost-3-000-and-feature-changeable-headbands-report,https://images.financialmodelingprep.com/news/apples-vr-device-to-cost-3000-and-feature-changeable-headbands-20210205.jpg
AAPL,2021-01-27,2021-01-20,2021-02-10,AAPL,,2021-02-05 07:00:00,2021-02-05T07:00:00-05:00,2021-02-05,Apple Is Still Mostly an iPhone Company. That's Becoming a Problem.,The world's biggest company is still the world's most profitable company. But past performance is no guarantee of future results.,fool.com,https://www.fool.com/investing/2021/02/05/apple-still-iphone-company-thats-a-problem/,https://images.financialmodelingprep.com/news/apple-is-still-mostly-an-iphone-company-thats-becoming-20210205.jpg
AAPL,2021-01-27,2021-01-20,2021-02-10,AAPL,,2021-02-05 09:05:11,2021-02-05T09:05:11-05:00,2021-02-05,5 Top-Ranked Growth Stocks to Tap Market Rally in February,"At this stage, it will be prudent to invest in growth stocks with a favorable Zacks Rank. These are: AAPl, F, FDX, HOLX, WY.",zacks.com,https://www.zacks.com/stock/news/1258106/5-top-ranked-growth-stocks-to-tap-market-rally-in-february,https://images.financialmodelingprep.com/news/5-topranked-growth-stocks-to-tap-market-rally-in-20210205.jpg
AAPL,2021-01-27,2021-01-20,2021-02-10,AAPL,,2021-02-05 09:50:27,2021-02-05T09:50:27-05:00,2021-02-05,How Apple (AAPL) Stock Stands Out in a Strong Industry,"Apple (AAPL) has seen solid earnings estimate revision activity over the past month, and belongs to a strong industry as well.",zacks.com,https://www.zacks.com/stock/news/1258184/how-apple-aapl-stock-stands-out-in-a-strong-industry,https://images.financialmodelingprep.com/news/how-apple-aapl-stock-stands-out-in-a-strong-20210205.jpg
